
순환경제사회로 가기 위한 국내외 빈용기보증금제도 비교 연구,"오늘날 북서태평양 동쪽에는 거대 쓰레기 지대가 형성되어 있다. 쓰레기의 90% 가량이 비닐과 플라스틱류로 이루어져 있으며, 이는 한반도의 약 7배, 대한민국의 약 16배 정도의 면적이다. 우리나라의 경우 최근 COVID-19 시대의 사회적 거리두기로 인한 배달음식의 호황은 포장재 쓰레기를 폭발적으로 증가시키고 있으며, 이로 인한 사회적 문제가 대두되고 있다. 플라스틱 용기로 인한 환경오염문제를 감소시키고 친환경 순환경제사회로 전환하기 위한 노력의 일환으로 글로벌 음료 제조기업인 코카콜라, 에비앙, 네슬레 등은 DRS(보증금환불제도)를 이용하여 폐플라스틱 용기의 회수와 재활용에 힘쓰고 있다. 우리나라 역시 빈용기보증금제도를 시행하고 있지만 전세계적으로 문제가 되고 있는 플라스틱 용기는 그 대상에 포함되어 있지 않다. 이에 본 연구에서는 해외에서 빈용기보증금제도가 무단투기 및 쓰레기 혼입감소, 그리고 고품질 폐플라스틱 회수율 증대에 어떻게 작용하는 지를 살펴보고 우리나라의 빈용기보증금제도와는 어떤 차이점이 있는 지를 비교 고찰하여, 플라스틱 부문의 대량생산과 대량소비, 폐기에 이르는 선형구조에서 폐플라스틱 발생 최소화를 통한 원자재 사용감소로 이어지는 순환경제사회로 나아갈 수 있는 함의점을 도출하고자 하였다. 이와 함께 우리나라와는 달리 양질의 폐플라스틱 빈용기를 회수하는 해외 선진국의 수거방식에 대해서도 살펴보았다. 해외 선진국의 경우 빈용기보증금제도에 플라스틱 용기를 포함시켜 금전적인 유인책으로 소비자의 적극적인 참여를 이끌어내고 있었으며, 국내의 단순 분리배출, 수거와는 달리 무인 빈용기회수기계인 RVM(Reverse Vending Machind)을 이용하여 소비자들의 접근성을 높였다. 폐플라스틱 빈용기에 대한 해외 보증금제도와 수거방식을 우리나라에 도입하여 소비자의 적극적인 분리배출을 이끌어낼 수 있다면 RVM을 통한 양질의 빈플라스틱 용기가 회수율이 높아져 폐플라스틱 매립 감소, 무단투기 감소, 재활용재료 재사용에 따른 환경적·경제적 편익의 증대를 기대해 볼 수 있겠다. 향후 해당 빈용기 보증금제도가 정착되고 활성화된다면 에너지 사용감소와 온실가스 배출 감소를 통한 탄소발자국 감소, 회수된 포장용기 판매를 통한 수익 증대와 무단투기로 인한 쓰레기 수거 및 처리 비용 절감, 새로운 일자리 창출 등 다양한 긍정적인 효과에 대한 추가적인 연구가 가능할 것이다.",김남석 ( Nam Seok Kim ),2021,https://www.riss.kr/link?id=A107746892
리튬이차전지 제조 공정 폐액으로부터 알루미늄계 화합물 및 황산화 반응을 적용한 리튬화합물 제조 방법,"최근 전기차, 고용량 에너지 저장장치 관련 산업분야의 고도발전에 따라 핵심원료인 리튬자원에 대한 수요가 급증하고 있으며, 리튬자원은 제조되는 배터리의 조성에 따라 탄산리튬 및 수산화리튬 등의 화합물의 형태로 사용되고 있다. 특히 이차전지 양극재 제조공정에서 발생되는 세척 폐수양이 증가함에 따라 세척 폐수에 함유된 리튬을 재자원화하는 연구에 관심이 집중되고 있다. 1,000mg/L~2,000mg/L 정도로 낮은 함량으로 리튬을 함유한 세척 폐수를 재활용하는 연구는 감압농축법, 흡착법, 용매추출법, 침전법 등 다양한 기술이 제시되고 있으나 높은 공정운영비와 2차오염물질의 발생 등의 문제가 있어, 본 연구에서는 리튬이온 농축 방법을 통하여 공정운영비를 절감하고, 발생 폐기물을 최소화하는 습식 재활용 연구를 수행하였다.
본 연구는 알루미늄계 화합물을 이용한 침전법을 이용하여 리튬-알루미늄 화합물을 제조하고, 황산 용액을 이용하여 황산리튬으로 전환하여 반복 침출함으로써 용액 내 리튬 이온을 농축하였다. 알루미늄계 화합물은 Al powder, Al(OH)<sub>2</sub>, NaAlO<sub>2</sub>를 이용하였으며, NaAlO<sub>2</sub>을 사용하였을 때 Li과 Al의 몰비 기준 1 : 1.8에서 가장 우수한 99.9% 이상의 회수율을 나타내었다. 제조된 리튬-알루미늄 화합물을 황산용액을 이용한 반복침출방법과 황산배소법을 통해 각각 리튬 농축액의 리튬이온 농도를 확인한 결과 3M 황산 반복침출의 경우 최대 5,000mg/L, 황산배소의 경우 약 30,000mg/L의 리튬 농축액을 제조하였다. 또한, 제조된 황산리튬 농축액은 Na<sub>2</sub>CO<sub>3</sub>를 이용하여 최종 제품인 탄산리튬을 제조할 수 있었다.
본 연구를 통해 고효율로 제조되는 리튬화합물을 양극재 원료용 소재로 활용하는 추가적인 사용 타당성 평가를 수행할 예정으로 향후 리튬소재의 국내 자원 선순환 사업모델을 제시할 수 있을것으로 기대하며, 이를 바탕으로 국내 제조-재활용 산업의 상생에 따른 산업구조의 발전에 이바지할 것으로 기대된다.",박지윤 ( Ji-yoon Park ),2021,https://www.riss.kr/link?id=A107746895
정수기 폐필터를 이용한 자원순환형 침투형 집수정 개발,"도시화와 산업화로 인한 지표면의 불투수 면적율 증가는 자연적 물순환을 저해시켜 도시 홍수, 지하수위 저감 등의 문제를 지속적으로 야기하고 있다. 이러한 문제를 직·간접적으로 해소하기 위해 표면 유출수를 제어 배수하는 우수배제 시스템이 활용되고 있으나, 기존의 시스템은 급격하게 발생하는 유출수를 적절히 배수하지 못하여 도시 홍수 효율적으로 제어하기에는 한계가 있다. 이러한 문제점을 해결하기 위해 표면유출수의 침투를 이용한 우수배제 시스템이 활발히 연구 개발되고 있다. 침투형 우수배재 시스템은 기층, 보조기층, 필터층, 포장 층으로 구성되며 포장의 경우 아스팔트 콘크리트에 비해 투수성이 큰 투수블럭, 투수 콘크리트 등을 사용한다. 침투를 이용한 우수배제 방식은 포장과 필터층의 공극을 이용한 수질개선 효과가 있음이 입증된 바 있다.
국내 가정용 정수기 보급의 확대에 따라 연간 40,000 톤 이상의 필터 폐기물이 발생하고 있으며 향후 그 폐기량이 지속적으로 증가할 것으로 예상되며, 정수기 필터는 사용기간에 따라 수집되며 전량 소각 또는 매립 등의 고비용 후처리를 통해 폐기되는 실정이다. 이를 저비용으로 재활용하여 효율적으로 자원재순환을 적용시키기 위한 다양한 연구가 필요한 상황이며, 정수기 폐필터의 카본블록을 활용하여 빗물 집배수 장치를 단일 여과 저리 시설로 전환하여 빗물 재이용수를 확보하는 설계, 특허 및 선행연구는 전무한 실정이다. 정수기 폐필터를 이용한 집수 시스템의 경우 정수기 필터에서 가장 많이 폐기되는 카본 블록필터를 목적에 맞게 변형하여 유기화학물, 냄새, 잔류 염소 등을 흡착 제거하여 중수 이상의 수질 확보가 가능하다.
위와 같이 정수기 폐필터를 침투형 우수배제 시스템에 적용할 경우 빗물을 중수이상의 수질로 정화하고 이를 조경수, 화장실 용수 등으로 빗물 자원의 재사용이 가능한 기술이며, 정수기 폐필터 카본 블록을 활용하여 폐자원의 순환이 가능한 기술이다.",김정건 ( Junggun-kim ),2021,https://www.riss.kr/link?id=A107746855
미세플라스틱 검출법과 국내 배출량 추정,"전 세계적으로 플라스틱의 사용량은 꾸준히 증가하고 있는 추세이다. 그 결과, 해양쓰레기 중 플라스틱의 비중은 60~80%로써 높은 비중을 차지하고 있다. 플라스틱 중에서도 미세플라스틱은 5mm 미만의 플라스틱 조각으로서 인위적으로 제조된 1차 미세플라스틱과 물리·화학적으로 인한 파쇄나 분해에 의한 2차 미세플라스틱으로 나눌 수 있다. 이러한 미세플라스틱은 생물증폭(Biomagnification)과 생물농축(Bioaccumulation)이 우려되고 있다.
최근 미세플라스틱의 관심이 대두되면서 미세플라스틱의 정량·정성분석에 대한 문헌이 증가하는 추세이지만, 정량에 사용하는 단위는 연구자마다 상이하여 상호 비교가 어려운 현실이다. 또한 시료의 상태에 따라 유기물분해, 밀도차선별을 선별적으로 적용해야 한다. 특정 환경매체에서 정량·정성분석의 결과는 배출원별 배출량과 함께 고려해야 한다. 국외의 경우 미세플라스틱의 배출원별 배출량에 관한 연구가 이미 진행되었으나, 우리나라의 경우 관련된 연구는 찾아볼 수 없다. 이에 본 연구에서는 국외 선행연구에서 사용한 기법을 적용하여 우리나라에서 배출되는 미세플라스틱의 양을 추정하였다. 그 결과, 1차 미세플라스틱 배출량이 2차 미세플라스틱 배출량보다 약 10배 많은 것으로 나타났다.",이혜성 ( Hye-sung Lee ),2017,https://www.riss.kr/link?id=A106295334
의료 및 소형 폐기물 소각로에서 배출되는 오염 물질의 특성,"급격한 산업화와 인구 증가 등은 국내 폐기물 발생량이 해마다 증가하는 요인으로 작용하고 있으며 이에 따른 다양한 폐기물 처리방법이 수행되고 있다. 대표적인 폐기물 처리 방법 중 하나는 소각에 의한 폐기물 처리이며 다량의 폐기물 처리가 가능하고 특히 폐기물의 부피와 무게를 10~20% 정도로 감량할 수 있으며 소각열에너지를 회수하여 폐기물의 자원순환에 일조하고 있다. 이러한 장점으로 인해 국내 폐기물의 소각처리 비율은 꾸준히 증가하고 있는 추세이다.
그럼에도 불구하고 폐기물 소각처리 중 발생하여 배출되는 다양한 오염물질은 환경에 큰 단점으로 작용할 수 있다. 따라서 소각시설에서 배출되는 오염물질의 모니터링은 환경보전 문제에 있어 매우 중요한 과제이다. 본 연구에서는 소각로에서 배출되는 오염물질의 특성을 파악하기 위해 의료 폐기물 소각로 44개소와 소형 폐기물 소각로 28개소, 총 72개의 가스 샘플을 채취하고 분석하여 주 대기오염 물질인 이산화탄소, 질소산화물, 황산화물, 다이옥신을 측정하였고 배출허용기준과 비교하였다. 또한 주성분분석을 통해 오염물질 배출을 6개 그룹과 6개 샘플로 나누어 각각의 배출특성을 분석하였다. 분석 결과, 다이옥신의 경우 배출허용기준을 초과한 시설은 의료 폐기물 소각로 7개소, 소형 폐기물 소각로 9개소로 나타난 반면, 이산화탄소, 질소산화물, 황산화물의 경우 소형 폐기물 소각로 10개소에서만 배출허용기준을 초과한 것으로 나타났다. 이 결과를 통해 의료 폐기물 소각시설보다 소형 폐기물 소각시설의 오염물질 배출이 심각한 것으로 확인되었으며 방지시설과 운전 조건의 개선이 필요할 것으로 판단된다.",윤영욱 ( Young Wook Yoon ),2017,https://www.riss.kr/link?id=A106295328
COVID-19 팬데믹에 따른 이산화탄소 배출 및 블루카본 흡수량 영향,"블루카본 생태계(Blue carbon ecosystems, BCEs)는 탄소 중립을 달성하기 위한 맹그로브 숲, 잘피 숲, 염습지를 포함하고 최근 지구온난화로 인한 기후변화에 큰 영향을 주는 높은 이산화탄소(CO2)를 흡수하는 탄소흡수원의 역할로 부각되고 있다. 기존 연구들은 CO2 흡수원의 역할에 대해 많은 연구가 진행되었으나, 현재 COVID-19 팬데믹으로 인한 해양환경변화에 대한 연구는 미비한 실정이다. 본 연구에서는 COVID-19 팬데믹 전후로 “블루카본”과 관련된 연구 키워드를 비교하여 블루카본 연구 동향을 확인하였으며 전세계 발전소 및 산업활동을 통한 CO2 배출량을 비교하였다. COVID-19 팬데믹 이후 러시아(18%)에서 CO2 배출량이 증가한 반면 영국(17%)에서는 CO2 배출량이 감소했다. 전세계적으로는 화석 CO2 배출량(EFOS)과 대기 중 CO2 농도(GATM)는 팬데믹 이후 감소하였으며, 해양생태계 CO2 흡수량과 화석 CO2 배출량(p < 0.001) 그리고 대기 중 CO2　농도(p < 0.001)와 유의한 양의 상관관계를 보였다. 또한 블루카본 생태계의 탄소 잠재량 분석 결과, 블루카본 생태계 중 맹그로브 숲의 맹그로브 나무(20.8 Gt CO2)와 퇴적물(0.03 Gt CO2)이 가장 높은 탄소 흡수원으로 나타났다. 해저지형 중에서는 해연/해저분지(6.76 Gt CO2)에서 가장 높은 탄소 잠재량을 확인하였다. 전세계적으로 COVID-19 팬데믹에 따른 국경봉쇄, 이동제한 그리고 산업활동의 감소는 대기중 CO2 배출량(5%)을 감소시켰으며, 해양으로 흡수량(1%)은 증가한 것으로 보인다. COVID-19 팬데믹 이후 전세계 총 탄소 수치(5.5%)는 감소하였다. 본 연구 결과는 COVID-19 팬데믹으로 생긴 사회적 제약에 따른 CO2 배출과 블루카본에 대한 데이터를 확립해야 할 필요성을 다루며, 전세계적으로 블루카본 생태의 중요성을 강조한다.",권인하,2023,https://www.riss.kr/link?id=A108490606
인공지능 모델을 활용한 실시간 수질평가지수 예측,"현재 해양수산부에서 연안 오염우심해역의 해양환경을 상시 측정하기 위해 해양수질자동측정망 자료를 제공하고 있다. 아울러 우리나라는 해양환경을 직관적으로 평가하기 위하여 수질평가지수(water quality index, WQI)를 사용하고 있다. 하지만, 해양환경측정망 자료는 WQI를 제공하고 있으나 해양수질자동측정망 자료는 WQI를 계산하기 위한 수질 자료가 충분하지 않다. 이 연구는 실시간으로 수질 변화를 평가하기 위해서 해양환경측정망 자료를 학습한 인공지능(artificial intelligence, AI) 모델(model)을 이용하여 보정(calibration)된 수질자동측정망 자료의 WQI를 예측하고자 한다. 특별관리해역의 수질자동측정망 자료 중 결측치(missing value)가 비교적 적은 부산수영, 광양적량, 마산삼귀, 인천송도, 시화조력, 시화반월 측정소 자료를 활용하였다. 보정을 위해 수질자동측정소와 가장 인접한 해역별 정점의 해양환경즉정망 자료를 활용하였다. Cook의 거리(Cook’s distance) 비교로 이상치를 제거하고 선형회귀(linear regression)를 통해 해양환경측정망과 동일한 조사 시간의 수질자동측정망 자료 중 결정계수(coefficient of determination)값이 큰 변수의 자료만을 보정하였다. 해양환경측정망 자료를 훈련자료(training datasets)로 사용하고 보정된 수질자동측정망 자료를 검증자료(test datasets)를 사용하여 다양한 알고리즘(algorithm)(MLR, SVR, XGBR, ETR, ANN, ELM, NFN, ANFIS, GANN)으로 학습한 모델의 예측 성능을 평균제곱근오차(root mean square error, RMSE), 평균절대오차(mean absolute error, MAE)로 평가하였다. 평가 결과 각 해역별로 최적 알고리즘과 예측성능은 상이하였고 수질이 나쁜 경우(WQI가 클수록) 예측성능이 나쁘고 일관성이 부족하였다. 자료와 보정의 품질을 향상시킨다면 실시간으로 수질자동측정망 자료의 WQI를 정확히 예측하여 수질오염 경보와 지속가능한 해양환경관리가 가능할 것이다.",김수빈,2023,https://www.riss.kr/link?id=A108490614
COVID-19 팬데믹에 따른 연안환경의 변화와 해양생태계 영향 고찰,"COVID-19 사태가 전세계적으로 장기화됨에 따라 사회적 봉쇄 조치 및 방역용품 사용 의무화 등으로 사람들의 생활 방식이 바뀌었다. 본 연구는 문헌 리뷰를 통해 COVID-19가 변화시킨 사람들의 생활 방식이 연안 생태계에 미친 영향을 고찰하였다. 리뷰는 COVID-19가 확산되기 시작한 2020년 이후에 출판된 논문을 대상으로 진행하였다. 연구 결과, COVID-19 팬데믹으로 인한 연안 환경 및 연안 서식 생물 영향은 지역별, 생물 분류군별로 상이하게 나타났다. COVID-19 확산 이후 많은 지역에서는 연안 쓰레기가 줄고, 연안 서식 생물 개체수가 증가하는 긍정적인 영향이 나타났다. 이는 환경을 교란시키고 생물에 스트레스를 주었던 관광 및 산업 활동이 사회적 봉쇄 조치로 인해 감소되었기 때문인 것으로 나타났다. 반면, 연안 환경이 악화되고 연안 서식 생물에 부정적인 영향이 나타난 경우는 코로나바이러스 전파를 막기 위한 방역 활동의 영향이 컸다. 버려진 마스크나 일회용 장갑 등이 연안에서 발견되는 빈도가 증가했고, 마스크나 소독제 등의 잔여물은 생물의 기능을 저하시키거나 종 풍부도를 감소시키기도 하였다. 리뷰를 통해 팬데믹은 인간의 생활뿐만 아니라 질병과 관계없는 생물 및 환경까지 연쇄적으로 영향을 미칠 수 있음을 확인할 수 있었다. 또한, 짧은 기간일지라도 인간 활동의 제한은 생태계를 일부 회복시킬 수 있다는 점이 드러났다. 본 연구는 인간 활동과 생태계와의 긴밀한 연결성을 보여주며, 연안 생태계 관리를 위한 기초 연구로써 활용될 수 있을 것으로 사료된다.",김호상,2023,https://www.riss.kr/link?id=A108490609
리튬이차전지의 차세대 음극 실리콘의 바인더 설계,"리튬 이온 배터리의 높은 에너지 밀도 요구를 충족시키기 위해 차세대 소재로 더 높은 이론 용량을 가진 여러 후보들이 있다. 그 중 대표적인 차세대 음극물질이 실리콘이다. 실리콘은 높은 이론용량(4200 mAh/g for Li4.4Si)을 보이며 이는 현재 널리 사용되고 있는 흑연(graphite)의 이론 용량(372 mAh/g for LiC6)의 10배 이상의 높은 수치이다. 하지만 실리콘 음극의 경우 충전과 방전이 반복될 때 낮은 안정성과 초기효율이 문제가 되고 있다. 이는 실리콘으로 리튬이 들어오는(lithiation) 과정에서 300%의 부피팽창이 발생하고, 리튬이 나가는 과정에서 부피의 수축이 일어나는 반응이 반복되기 때문이다. 그래서 실리콘의 부피팽창을 막고 배터리의 안정성을 높이는 연구가 주로 진행 중이다. 특히 실리콘 음극 연구의 큰 틀로 음극제조에 사용되는 고분자 바인더를 개발하는 연구가 진행되고 있다. 실리콘 전극에서 바인더의 역할은 단순히 도전재와 활물질을 물리적으로 묶어주는 역할만이 아닌 물질에 따라서 실질적으로 성능에 큰 영향을 주는 요소로 작용한다. 예를 들어 음극 활물질인 실리콘입자에서 형성되는 SEI(solid electrolyte interface) layer의 형성과 안정화에 기여하며 그리고 실리콘입자의 자가 회복(self-healing) 기능을 부여할 수 있다. 또한 전도성 고분자로 전자전도에 관여하는 등의 전기화학적 성능향상에 큰 도움을 준다. 이 리뷰 논문을 통해 기존 통용되어 온 기본적인 고분자 바인더와 그동안의 연구들을 통해 제시된 다양한 바인더를 소개하고 그들의 특성들을 분석하려 한다. 아울러 실리콘 음극에서의 부피변화 문제를 해결하기 위해 합리적인 바인더 설계와 개발방향을 제시하고자 한다.",박보근(Bo Keun Park),2022,https://www.riss.kr/link?id=A108213004
주요 산림 바이오매스 자원의 열분해특성 및 연료성능에 관한 고찰,"본 연구에서는 산림 바이오매스인 목본류와 초본류의 세 가지 수종에 대하여 열화학적 분석을 기반으로 연료로서의 성능평가를 실시하였다. 공시수종은 소나무, 졸참나무와 솜대를 선정하여 이용하였으며, 성능평가에 대한 측정은 공업분석과 원소분석 및 발열량, 그리고 열중량분석(TGA)을 수행되었다. 각 항목에 대하여 각각의 수종간 비교분석을 실시한 결과, 초본류의 솜대가 발열량, 휘발분 및 고정탄소 함량 등의 항목에서 가장 높은 것으로 나타났고, ANOVA 분석에서 일부 수종간의 99% 유의차가 인정되는 것으로 확인되었다. 또한 열중량분석을 통해 초본류의 솜대는 세포벽 주요성분인 셀룰로오스, 헤미셀룰로오스, 리그닌 등의 열분해 온도가 목본류인 소나무 및 졸참나무 보다 비교적 낮은 것으로 나타났으며, 최종 잔여물(%) 또한 가장 높은 것으로 확인되었다. 그러나 세 가지 수종에 대하여 SRF(Solid Refuse Fuel)로서의 활용에 대한 관점에서 평가해볼 때, 모두 신재생 에너지로서 유용한 에너지원으로 주목받을 필요가 있다.",이창구(Chang-Goo Lee),2020,https://www.riss.kr/link?id=A107209363
전국폐기물통계조사 생활폐기물 조사체계 개선방안 마련 연구,"‘전국폐기물통계조사’는 1996년 제1차 조사를 시작으로 5년 주기로 시행되어 2021년 제6차 조사를 앞두고 있다. ‘전국폐기물통계조사’는 폐기물 정책수립에 필요한 기초자료를 확보하기 위해 폐기물의 발생 및 처리현황과 도시규모 및 발생원별 폐기물의 분포 및 변화 추이, 폐기물의 종류별 발생량, 물리적 조성, 화학적 성상분석 등의 조사ㆍ분석을 수행한다.
이 중 생활폐기물의 경우 가정 및 비가정(소규모 사업체)에서 발생하는 종량제봉투 대상 폐기물, 음식물류폐기물, 재활용가능자원에 대한 발생량 조사, 물리적 조성 조사, 성상분석(삼성분, 원소분석 등)을 수행한다. 제5차 조사까지의 ‘전국폐기물통계조사’ 생활폐기물 조사범위는 생활폐기물 중 가정, 비가정(소규모사업체)만을 대상으로 조사를 시행함에 따라 처리시설 반입량 기준으로 매년 집계되는 ‘전국 폐기물 발생 및 처리현황’의 데이터와는 종량제봉투 폐기물 발생량에서 발생원의 범위가 다름에 따른 차이가 존재한다.
‘전국 폐기물 처리현황’의 생활폐기물은 생활계폐기물의 하위 항목으로 포함되어 있으며, 생활계폐기물은 사업장생활계폐기물과 생활폐기물로 구분된다. 생활폐기물 발생량 데이터는 각 지자체 소각시설, 매립시설, 생활 자원회수센터 등의 폐기물처리시설의 반입량 데이터를 집계하여 산출된다. 이에 따라 ‘전국폐기물통계조사’에서는 조사되지 않는 가정 및 비가정 외의 지자체 처리책임 폐기물(공사장 폐기물, 가로청소 폐기물 등) 및 ‘전국폐기물통계조사’에서 기타폐기물 항목으로 분류되는 재해폐기물, 대형폐기물 등이 포함되어 있다. 실제 5차 통계 및 2016년 연보의 종량제봉투 폐기물 발생 원단위 비교 결과 5차 통계기준 13,889톤/일, 연보 기준 32,166톤/일로 차이가 매우 크게 나타났다. 발생량 이외에도 ‘전국폐기물통계조사’와 연보의 조성이 서로 상이하여 직접적인 비교ㆍ분석이 불가능함에 따라 조성구분 항목 조정을 통하여 두 통계성의 연계성을 높일 필요성이 있는 것으로 나타났다.
본 연구에서는 ‘전국폐기물통계조사’와 ‘전국 폐기물 발생 및 처리현황’의 생활폐기물 발생량 집계를 위한 발생원의 범위를 분석하고, ‘전국폐기물통계조사’와 연보의 데이터 연계성 확보를 통한 비교ㆍ분석을 가능하도록 하기 위해 ‘제6차 전국폐기물통계조사’의 생활폐기물 조사범위 및 데이터 집계 방안을 제시하였다.",이종수 ( Jong-soo Lee ),2020,https://www.riss.kr/link?id=A107196317
