
음악신호와 뇌파 특징의 회귀 모델 기반 감정 인식을 통한 음악 분류 시스템,"본 논문에서는 음악 청취 시에 나타나는 뇌파 특징을 이용하여 사용자 감정에 따른 음악 분류 시스템을 제안한다. 제안된 시스템에서는 뇌파 신호로부터 추출한 감정별 뇌파 특징과 음악신호에서 추출한 청각적 특징 간의 관계를 회귀 심층신경망을 통해 학습한다. 실제 적용 시에는 이러한 회귀모델을 기반으로 제안된 시스템은 입력되는 음악의 청각 특성에 매핑된 뇌파 신호 특징을 자동으로 생성하고, 이 특징을 주의집중 기반의 심층신경망에 적용함으로써 음악을 자동으로 분류한다. 실험결과는 제안된 자동 음악분류 프레임 워크의 음악 분류 정확도를 제시한다.",이주환,2022,https://www.riss.kr/link?id=A108098619
Impendance Tube를 이용한 흡음재의 흡음율 측정,"흡음 계수는 흡음재의 흡음 특성을 제시해 주는 기본적 물리량이다. 본 연구에서는 일반적으로 흡음재로 사용되는 흡음재의 흡음 특성을 알기 위해 두께 18mm, 직경 105mm인 10종의 흡음재를 택하 여 흡음재의 흡음 계수를 구하였다. 이를 위해 impedance tube를 제작하여 관내에 흡음재를 넣은 후 관 내에 만들어진 정상파의 최대 음압과 최소음압의 비, 정상파비를 이용하여 흡음 계수를 구했다. 그 결과 흡음재의 흡음 특성은 진동수, 흡음재으 lwowlf, 두께 및 다공성에 크게 의존해 스폰지, 유리 섬유 등의 흡음 효과가 좋게 나타났으며 특히 같은 두께의 동일 흡음재일지라도 흡음재 뒷면의 공기층을 적절리 조절함으로써 특정 진동수 근처에서의 흡음 효과를 증대시킬 수 있었다.",김명수,1986,https://www.riss.kr/link?id=A101070254
3상 농형 유도전동기의 자기소음 해석에 관한 연구,"3상농형유도전동기에서 발생되는 소음중 자기소음을 해석하였다. JEM-1313 규격과 반확산 음장법을 이용하여 전체의 소음을 측정하였으며, fk={K+$\frac{Z_s}{P}$(1-S)}f[Hz]의 실험식을 도출하였다. 고정자 권선의 자기소음만을 도출하기 위해서 회전자를 제거하고 고정자권선에 정격전압, 정격주파수를 가한 상태에서 자기소음을 측정하여 비교, 검토하는 소음해석방법을 제시하였다. 이론치와 실험치는 1440[Hz], 1560[Hz]에서 근사하였고 가장 큰 자기고조파는 1560[Hz]에서 발생되는 것을 알 수 있다.",신대철,1991,https://www.riss.kr/link?id=A101070326
고체내부의 결함형태에 따른 초음파 신호의 특징추출,"본 논문에서는 금속내부에 존재하는 결함의 다양한 형태로부터 반사된 초음파 신호를 디지탈 신호처리에 의하여 특징추출하는 방법을 연구분석하였다. 다양한 형태의 결함으로부터 반사된 초음파 신호는 잡음 등의 영향으로 그 특징의 구별이 애매하므로 자기 회기법(auto-regressive)을 이용한 위너 필터링(Wiener filtering)과 최소 절대치 노름(least-absolute-values norm) 기법을 사용하여 신호의 특징을 추출하고 상호 비교분석하였다. 실험에서는 알루미늄 시편에 평면결함, 사각결함, 원형결함의 세가지 결함형태를 제작하였으며, 초음파를 입사하고 펄스-에코 방법에 의하여 반사신호를 측정하였다. 반사신호의 디지탈 신호처리 결과, 이러한 특징추출방법은 다양한 형태의 결함으로부터 반사된 신호를 효율적으로 분류 할 수 있었다.",신진섭,1995,https://www.riss.kr/link?id=A101070465
산조 가야금의 물리적 모델링,"본 논문에서는 개선된 디지털 도파관 이론을 이용하여 산조 가야금을 물리적으로 모델링하였다. 산조 가야금의 몸통 특성은 역 필터링 방법과몸통의 임펄스응답 이용하여 구현하였다 또한 안족의 위치에 따른 기본주파수의 변화를 조사, 선분 적합성을 이용한 근사화 과정을 거쳐 단위음을 합성하는 모의 실험을 하였다. 실제 가야금을 조율하듯 안족에 의한 조율로 실제 음과 유사한 단위음 합성을 할 수 있었다.",정의필,2004,https://www.riss.kr/link?id=A101071351
음향조정실에서 적절한 초기지연시간을 갖는 무반사지역의 설계연구,"엔지니어의 모니터링 위치가 한 지점에만 한정되어 있는 음향조정실의 기존개념을 여러 사람이 동시에 작업할 수 있는 지역적인 방식으로 개선하였다. 이를 위하여, Davis의 $LEDE^{TM}$ 방식을 도입하였고, 내부의 구조 및 흡음재료의 특성, 확산기 및 저역흡음기의 설치와 음상법 등을 활용하여 초기시간지연을 제어하였다. 따라서 여러 엔지니어들이 서로 유사한 음향특성 하에서 동시에 소리를 모니터링 할 수 있는 무반사지역을 형성시켰다. 뿐만 아니라, 음향조정실 (특히 무반사지역) 안에서 정재파, 음향초점, 컬러링, 하스효과 그리고 플러터 에코 등의 발생을 억제하거나 크게 감소시킬 수 있었다.",이에스더,2007,https://www.riss.kr/link?id=A101069554
배경음악 분리를 위한 확장된 합성곱을 이용한 멀티 밴드 멀티 스케일 DenseNet,"방송 콘텐츠의 혼합 신호에서 배경음악 신호를 분리하는 확장된 합성곱을 이용한 멀티 밴드 멀티 스케일 DenseNet을 제안한다. 확장된 합성곱은 스펙트로그램의 다양한 스케일 문맥 정보를 학습하기 용이하도록 한다. 컴퓨터 모의실험 결과, 제안한 구조는 신호대잡음비(Signal to Noise Ratio, SNR) 0 dB, -10 dB의 환경에서 각각 0.15 dB, 0.27 dB의 신호대왜곡비(Signal to Distortion Ratio, SDR)를 개선하였다.",허운행,2019,https://www.riss.kr/link?id=A106474839
연안 환경에서 클러터에 강인한 능동소나 탐지 알고리듬,"연안 환경에서 소형 표적의 탐지에는 고주파 능동소나가 적합하다. 연안 환경에서 고주파 능동소나를 사용할 경우 해양 생물 소음, 선박 소음, 항적 등에 의한 클러터로 인하여 오경보율이 매우 높다. 본 논문에서는 연안 환경에서 능동 소나에서 클러터에 강인한 탐지 알고리듬을 제안한다. 제안된 알고리듬은 측정치 추출 시 신호의 통계적인 특징을 이용하는 Constant False Alarm Rate(CFAR)와 클러스터링 알고리듬을 이용하여 클러터 제거율을 높인다. 제안 된 탐지 알고리듬은 해상 시험을 통하여 검증하였으며, 약 96 % 이상의 클러터를 제거하였다.",장은정,2019,https://www.riss.kr/link?id=A106474843
심해에서의 빔 다이버시티를 이용한 수중음향통신 성능 분석,"수중에서는 다중 경로로 인한 인접 심볼 간 간섭의 영향으로 통신 성능이 저하되며, 수동형 시역전 처리는 다중 경로를 완화하기 위한 가장 효율적인 기법이다. 수동형 시역전 처리의 성능을 향상시키기 위해 다이버시티 결합기법이 이용되고 있으며, 본 논문에서는 여러 각도로의 빔 조향을 통해 획득한 신호들을 결합하는 빔 다이버시티 결합기법을 이용하여 통신 성능을 분석하였다. 수직 선 배열 센서에 수신된 탐침 신호로부터 추정한 빔-시간 그래프를 통해 음파의 전달 각도들을 추정하였으며, 추정된 각도 중 결합 개수 및 방식에 따른 통신 성능을 분석하였다. 분석을 위해 2018년 10월 포항 동방 해역에서 수행된 Biomimetic Long range Acoustic Communications 2018(BLAC18) 실험 데이터를 활용하였으며, 통신 성능 지표로써 출력 신호 대 잡음비를 이용하였다.",김동현,2019,https://www.riss.kr/link?id=A106474842
Design of launch pad for mitigating acoustic loads on launch vehicle at liftoff,"우주발사체는 발사 시 추진장치에서 발생하는 고강도 소음에 의한 음향하중의 영향을 받는다. 로켓소음은 발사체와 페이로드 내 전자 및 기계 부품의 손상 및 오작동을 유발할 수 있기 때문에 음향하중의 예측 및 저감은 설계에 있어 중요한 고려사항이다. 본 논문에서는 로켓 소음의 생성 및 발사대의 음향설계 기법에 대한 최신 연구동향을 논하였다. 특히, 새로운 발사대 설계 방법론의 예로서 일본 Epsilon 로켓 발사대의 개발과정을 기술하였다. 전산유체역학 모사 및 1/42 축소모형 실험을 통하여 설계된 발사대의 음향하중 저감 효과를 Epsilon 로켓의 실제 비행 데이터 분석을 통하여 검증하였다.","Tsutsumi, Seiji",2020,https://www.riss.kr/link?id=A106985686
능동흡음재를 이용한 음파반사 제어기법 연구,"이 논문은 능동흡음재를 이용한 수중음향반사파 상쇄에 관한 연구이다. 능동흡음재는 평판형 구동센서와 수신센서로 몰딩되고 외부 제어기와 연결된 구조로 되어있다. 이 두 층의 센서와 피드백제어기는 하나의 피드백 루프를 이루며, 이 루프의 특징은 외부로부터 인가되는 입사파에 대해 음향 임피던스가 자동적으로 정합되어, 자동적으로 반사파를 상쇄하는 특성을 가진다. 능동흡음재의 전기 구조 음향의 다중물리특성은 1차원 전달함수로 모델링 되고, 운용주파수 대역에서 입사파에 대한 반사파가 최소화 되도록 제어기의 전달함수가 설정된다. 능동형 흡음재는 수동형 흡음재의 두께에 비하여 현저히 얇은 두께를 가지며, 간단한 아날로그 회로 제어기만으로도 넓은 주파수 대역에서 우수한 흡음특성을 보인다.",장우석,2009,https://www.riss.kr/link?id=A101069609
잡음 환경에서의 음성 명료도 향상 기술,"주변 잡음이 심한 환경의 음성 통신에서 음성 명료도는 주변 잡음의 마스킹 효과로 인하여 크게 저하된다. 본 논문에서는 잡음 환경에서 음성 명료도를 향상시켜 통화 품질을 높이는 새로운 방법을 제안한다. 청각 이론에 의하면 음성의 시간축포락선은 명료도 결정에 중요한 역할을 한다. 이에 따라 본 논문에서는 대역별 시간축 포락선의 변화를 강화하여 명료도를 향상시키는 방법을 사용하며, 음질을 추가로 향상시키기 위한 피치 강화동작을 포함한다. 또한, 실제 통화상황에서의 정확한 주관적 성능 평가를 위하여 양 귀를 이용하는 새로운 주관적 성능 평가 방법을 제안한다. 제안하는 평가 방식을 통하여 제안하는 명료도 향상 기술의 성능을 평가하였으며, 명료도와 음질이 모두 향상되는 것을 확인하였고, 동작 파라미터 조정을 통하여 명료도와 음질 사이의 상호 관계가 조정되는 것을 확인하였다.",윤제열,2009,https://www.riss.kr/link?id=A101069593
1:50 다목적홀의 음향평가를 위한 축소모형재료의 선정,"다목적홀의 음향을 1:50 축소모형으로 예측 및 평가하기 위해 필요한 모형재료의 구성과 흡음특성에 대해 연구하였다. 실제 홀에서의 반사면 및 가변음항요소, 객석의 설계요소별 흡음특성 (125Hz-lkHz 평균)을 기준으로 축소모형의 형상과 재질을 선정하였으며, 흡음율은 상사의 법칙과 ISO 354를 준용하여 측정하였다. 그 결과, 주벽체의 평균흡음율은 0.08로 래커 코팅된 MDF나 아크릴이 적합하며, 객석 의자, 관객 및 연주자 평균흡음율은 각각 0.64, 0.74와 0.45를 목표로 할때 목재, 흡음천과 폼보드를 조합하여 흡음률을 재현하였다. 흡음커튼과 배너는 적용부위 및 단면설계에 따라 흡음재의 마운팅 방법을 선택하였으며, 배면공기층이 없는 상태 (A형 마운팅)에서의 평균흡음율이 0.42, 0.9 m 배면공기층 조건에서 시료 양단이 고정된 상태 (E형 마운팅)에서는 0.47, 천장에 매단 상태 (G형 마운팅)에서는 0.45로 나타났다. 특히, 배면공기층의 증가에 의해 저주파 대역 흡음력이 증가하였다. 스테이지 하우스 내부는 평균흡음율 0.68의 Fiber glass board 시공을 예상하여 흡음재와 스피커망 원단을 조합하여 재현하였다. 본 연구에서 도출된 모형 재료의 형상과 흡음특성은 향후 1:50 축소모형으로 다목적홀의 형상에 의한 중주파 대역 이하의 음향예측에 유용하게 활용될 것으로 사료된다.",전진용,2009,https://www.riss.kr/link?id=A101069606
