
비등방성 매질에서의 2차원적 회절현상의 수학적 모델링,본 논문에서는 비등방성 매질에서의 2차원적 회절현상을 수학적으로 모델링하였다. 비등방성 매질의 2차 포물선 근사법과 프레즈넬 근사법을 적용하기 위하여 전파방향에 따른 표면파 속도의 역수를 포물선으로 가정하였다. 128${\circ}$ Rotated $LiNbO_{3}$ 기판을 사용한 SAW IF Bandpass Filter에서의 회절현상을 모의 설계하여 그 결과를 회절현상이 없는 이상적인 경우와 비교하였다. 또한 전산화 모의 설계 결과와 실제로 제작된 SAW Filter 특성결과를 비교하여 $LiNbO_{3}$ 기판을 사용한 SAW Filter에서도 프레즈넬 근사법이 대체적으로 일치하는 것을 알 수 있었다.,정영지,1988,https://www.riss.kr/link?id=A101070236
감정 인식을 통한 음악 검색 성능 분석,"본 논문은 자동으로 분류된 음악 신호의 감정을 기반으로 하는 음악 검색 의 성능을 분석하였다. 음성, 영상 등의 다른 미디어 신호와 마찬가지로 음악은 인간에게 특정한 감정을 불러일으킬 수 있다. 이러한 감정은 사람들이 음악을 검색할 때 중요한 고려요소가 될 수 있다. 그렇지만 아직까지 음악의 감정을 직접 인식하여 음악 검색을 수행하고 성능을 검증한 경우는 거의 없었다. 본 논문에서는 음악 감정을 표현하는 주요한 세 축인 유발성, 활성, 긴장 과 기본 5대 감정인 행복, 슬픔, 위안, 분노, 불안의 정도를 구하고, 그 값들의 유사도를 기반으로 음악 검색을 수행하였다. 장르와 가수 데이터셋에서 실험을 수행하였다. 제안된 감정 기반 음악 검색 성능은 기존의 특징 기반 방법의 성능에 대비해서 최대 75 % 수준의 검색 정확도를 보였다. 또한 특징 기반 방법을 제안된 감정 기반 방법과 병합할 경우 최대 14 % 검색 성능 향상을 이룰 수 있었다.",서진수,2015,https://www.riss.kr/link?id=A101070086
1/10 축소모형을 이용한 소공연장의 흡음재와 확산체의 적용위치에 따른 음향성능 비교,"본 연구는 흡음재와 확산체의 적용위치가 소공연장의 음향성능에 미치는 영향에 대하여 알아보았다. 서울의 대학로의 2000년 이후 개관한 36곳의 공연장의 평균크기로 소공연장의 표준모델을 설정하여 연구를 진행하였다. 본 연구에서는 마감재 적용유효면적이 가장 작은 뒷벽을 기준으로 마감재의 적용면적을 산출하고, 마감재의 적용위치별 음향성능 변화를 분석하기 위하여 천장, 측벽의 적용위치를 전반부, 중반부, 후반부로 구분하여 총 8가지의 경우를 만들어, 1/10 축소모형실험을 진행하였다. 사용된 음향지표는 잔향시간(Reverberation Time, RT), 초기감쇠시간(Early Decay Time, EDT), 음악명료도(Clarity, C80), 음성명료도(Definition, D50), 음성전달지수(Speech Transmission Index, STI)를 이용하였다. 실험결과 마감재의 적용위치 변화는 소리의 울림에 양과 관련된 음향인자인 잔향시간, 초기감쇠시간 은 최소 변화 감지폭에 의한 (Just Noticeable Difference, JND) 평가시 변화가 뚜렷하게 나타났고, 소리의 명료도와 관련된 인자인 음악명료도, 음성명료도, 음성전달지수는 변화가 거의 없는 것으로 나타났다. 짧은 잔향시간을 얻고자 하는 경우 흡음재와 확산체 적용시 모두 측벽부분을 통한 잔향시간 조절이 가장 효과적이며, 측벽 전반부가 가장 짧은 잔향시간을 얻을 수 있는 위치인 것으로 나타났다.",김태희,2015,https://www.riss.kr/link?id=A101070073
지하철 실내 소음 하에서 음향기기 사용에 따른 음향반사역치와 소음 속 어음인지 변화,"환경 소음의 무절제한 노출이 청력 손실로 이어질 수 있다는 보고는 익히 알려져 있지만, 지하철 실내 소음과 휴대용 음향기기 음량에 따른 이중 소음 노출에 대한 탑승객들의 청력 손실 여부는 많은 연구들에서 여전히 진행 중이다. 본 연구는 지하철 실내 소음 하에서 탑승객들이 이어폰을 이용하여 개인음향기기 사용 시 음향 반사 역치와 소음속 어음인지도가 어떻게 변화하는 지 확인하고자 하였다. 20대의 젊은 건청 성인 40명을 대상으로 실험 그룹과 대조그룹으로 각각 20명씩 구분하였다. 실험 전 모든 대상자에게 5개의 주파수에서 음향반사역치검사와 0, -5 dB SNR에서 문장검사를 실시하였다. 실험 그룹은 60분간 73.45 dBA의 실제 서울도심지하철의 평균 실내 소음 강도를 들으며 개인별 선호 음량으로 이어폰을 통해 좋아하는 음악을 들었고, 대조그룹은 동일강도의 지하철 소음에만 노출된 채 신문 혹은 잡지를 읽었다. 60분간의 지하철 소음 노출 후 음향반사역치검사와 소음 속 문장검사를 재실시하여 기준선과 비교하였다. 소음 노출 전 후 비교 시, 두 그룹 간 음향반사역치는 유의미한 차이가 없었다. 그러나 소음 속 문장 검사결과에서는 실험 그룹의 어음인지도가 소음 노출 후 유의하게 하락하였다. 본 결과를 근거로 지하철 탑승객이 일정기간 동안 지하철 실내 소음에 노출된 채 반복적으로 음악을 듣는 습관이 지속될 시 일시적인 어음인지력 저하의 위험이 예상 될 것이라고 생각한다.",한우재,2015,https://www.riss.kr/link?id=A101070072
심리음향 분석을 이용한 MP3 저작권 보안을 위한 적응적 워터마킹,"본 논문에서는 오디오 컨텐츠 저작권 보안을 위하여 MP3 공격에 강인한 워터마킹 방법을 제안한다. 일반적인 주파수 도메인에서의 워터마킹 방법인 Cox의 스프레드 스펙트럼 방법에서는 DCT후 값이 큰 저주파수의 계수에 순차적으로 워터마크를 삽입하였다. 임의의 주파수 계수에 삽입하는 방법은 효과적이지 못하므로, 본 논문에서는 심리음향 모델을 분석하여 MP3 공격시 손실이 적은 주파수 계수에 적응적인 함수를 적용하여 가중치를 부여한 후 계수에 워터마크를 삽입하는 방법을 제안한다. 다양한 음원에 대하여 실험한 결과, 제안한 방법은 기존의 방법들에 비해 워터마크의 보존하고 원본 음원의 왜곡을 줄이는 두 가지 측면 모두 좋은 결과를 나타내었다.",이경환,2013,https://www.riss.kr/link?id=A101070017
방송용 다목적 홀에서 배너 가변에 따른 음향 환경 변화,"스피치, 국악, 뮤지컬, 대중음악과 콘서트까지 다양한 장르의 공연이 이루어지는 방송용 다목적 홀의 경우 공연에 필요한 전기, 건축 음향적 요구 조건이 다양하다. 하지만 실제 음향 환경 가변을 위한 효율적인 운용 방법은 많지 않다. 본 연구는 무대 반사판의 설치 유 무와 전기 음향 사용 조건하에서 배너의 가변에 따른 홀의 음향 환경 변화를 살펴보았다. 그 결과 벽체 면적의 15 %에 해당하는 배너를 설치한 실제 측정에서 잔향 시간(Reverberation Time, $T_{30}$)은 최대 0.12 s, 초기감쇠시간(Early Decay Time, EDT)은 0.15 s, 음악 명료도(Clarity, $C_{80}$)는 0.76 dB, 음성 명료도(Definition, $D_{50}$)는 6.43 % 변하였다. 배너의 면적을 확장시킨 컴퓨터 시뮬레이션을 통해 전체 벽체 면적의 40 %에 해당하는 배너를 설치할 경우 잔향 시간은 0.11 s에서 최대 0.55 s까지 가변되는 것을 확인했다.",박호철,2019,https://www.riss.kr/link?id=A106398076
음성과 영상정보를 결합한 멀티모달 제어기의 구현,"본 논문에서는 음성과 영상정보를 결합한 멀티모달시스템을 구현하고 그 성능을 평가하였다. 음성정보를 이용해서 음성인식기를, 영상정보를 이용해서 입술인식기를 설계하였으며, 두 인식기는 HMM (Hidden Markov Model) 기반의 인식엔진을 사용하였다. 음성과 영상인식의 결과는 각각 8:2의 가중치를 부여하여 통합하였다. 한편, 구축된 멀티모달 인식시스템은 DARC (data radio channel)시스템과 통합되어 응용프로그램인 Comdio(computer radio)를 제어하도록 구현하였다. 멀티모달과 DARC시스템, 멀티모달시스템 내에서 두 인식기간의 정보교환은TCP/IP소켓 방식을 사용하였다. 통합시스템의 Comdio 제어실험의 결과는 입술인식이 음성인식기의 보조수단으로 사용될 수 있음을 보였으며, 향후교통정보 및 자동차항법장치에 적용되어짐으로써 그 적용분야를 넓힐 수 있을 것으로 기대된다.",김철,2001,https://www.riss.kr/link?id=A101071198
선형 판별분석과 공통벡터 추출방법을 이용한 음성인식,"본 논문에서는 선형 판별분석 (LDA: Linear Discriminant Analysis)과 공통벡터 추출방법을 이용한 음성인식방법을 제안하였다. 음성신호는 화자의 성별, 나이, 출생지, 주위 잡음, 정신적 상태, 발성기관의 구조 등과 같은 다양한 정보를 포함하고 있다. 이로 인해 같은 음성신호라 할지라도 서로 다른 화자가 발성하게 되면 서로 다른 특성을 보이게 된다. 음성신호의 이러한 성질은 같은 음성군 (class)에 포함된 공통된 특성벡터를 추출하는 일을 상당히 어렵게 한다. 음성신호에서 공통된 특징 벡터를 추출하는 방법은 KLT (Karhunen-Loeve Transformation)와 같이 선형 대수적인 접근방법이 많이 사용되어지고 있으나, 본 논문에서는 M. Bilginer et al.이 제안한 공통벡터 추출 방법을 사용하였다. M. Bilginer et al.이 제안한 방법은 주어진 훈련 음성신호들에 대하여 최적의 공통 벡터를 추출하여 주면서 공통벡터 추출에 사용된 훈련 데이터에 대해서는 100%의 인식결과를 보여준다. 그러나 공통벡터 추출을 위한 훈련 음성신호의 수를 무한히 늘릴 수 없다는 점과 공통벡터들간의 구별정보 (discriminant information)가 정의되지 않았다는 단점이 있다. 본 논문에서는 단어그룹간 (class) 구별정보를 추출된 공통벡터와 결합해 단어간의 오인식률 (error rate)을 감소시킬 수 있는 방법과 공통벡터 추출방법에 적합한 파라미터 가공 방법을 제안하였다. 공통벡터 추출방법은 음성신호의 시간 축 정규화 방법과 벡터의 차원 크기에 따라 인식시간과 인식률에 영향을 받는다. 따라서 부적절한 시간 축 정렬과 너무 큰 벡터의 차원 수는 인식률 저하 등과 같이 알고리즘의 효율성을 떨어뜨린다. 본 논문에서 제안한 방법을 사용하여 실험한 결과 알고리즘의 효율성이 증가되었으며, 기존방법보다 약 2％정도의 향상된 인식률을 얻을 수 있었다.낮추는 효과를 나타내었다.다. 이상의 결과를 통하여 추출 온도와 용매 농도에 따른 수율의 차이가 있었으며 free radical 소거 활성에서는 종자 에탄을 추출물이 과피 에탄올 추출물 보다 145배 이상의 현저히 높은 활성을 나타내었다.을 나타내었다.'Lian(연)' : repeatability, continuance, plenty and intercommunicate, 2. 'Lian(연)'-'Lian(염)': integrity, 3. 'He (하)'-'He(화)' : peace, harmony and combination, 4. 'He(하)'-'He(하)' : clear river, 5.'He(하)'-'He(하)' ; all work goes well. When the Chinese use lotus patterns in lucky omen patterns, same pronunciation and pitch of Chinese language more prominent than natural properties or the image of Buddhism. I guess that it cause praying individual's peace and happiness more serious than philosophical meaning or symbol that base in Buddhism for ordinary people.ML., -9.00~12.49 and -19.81~19.81%, respectively). Therefore, it is concluded that the two formulations are bioequivalent for both the extent and the rate of absorption after single dose administration.ation.ion.ion.ation.ion.n. fibrosis, collagen bundle) was",남명우,2001,https://www.riss.kr/link?id=A101071202
해저면 경사가 일정한 천해에서의 광대역 간섭 유형,"수심이 변하는 천해 환경에서 이동하는 선박방사소음의 광대역 간섭 유형을 고찰하였다. 수심 변화율이 일정한 음도파관에 대해 단열 모드 이론에 근거하여 거리-주파수 영역에서의 보강 (또는 상쇄) 간섭 발생 유형을 나타내는 음도파관 불변인자 (waveguide invariant index, β)를 유도하였다. 이를 이용하여 수심 변화에 의한 광대역 간섭 형태 변형을 해석하였다. 해석적 방법으로 고찰한 간섭 유형은 해상 실험과 수치 모델을 이용한 모의실험에서도 나타남을 확인하였다.",오철민,2002,https://www.riss.kr/link?id=A101071256
사물놀이 악기음의 소리분석에 관한 연구,"본 논문에서는 사물놀이 소리를 과학적인 분석을 통하여 그 특성을 규명하고자 한다. 사물놀이의 4가지 악기는 서로 다른 소리의 높낮이 특성에 의해 음양 (陰陽)의 조화를 이루고 있을 뿐만 아니라, 우리가 귀로 느낄 수 있는 소리의 범위를 완전히 커버하고 있다. 그리고, 징과 장구 소리를 들었을 때 다시 한번 더 듣고 싶은 친근감을 느끼게 피는데, 그 원인으로는 징소리와 장구의 기본 진동수가 사람의 남녀 목소리의 기본진동수와 자자 근접하기 때문이다. 즉, 징소리와 장구소리를 들으면 사람의 목소리로 응답하는 듯한 친근함과 정다움을 느끼게 된다. 또한 인간은 소리를 귀로만 느끼지 않고 피부를 통해 진동으로도 느끼게 되는데, 사물놀이에서 북, 징, 장구는 그러한 특성이 두드러지게 나타난다.",나덕수,2000,https://www.riss.kr/link?id=A101071087
음성엔코더 시뮬레이션에 사용되는 난수발생기 설계,"본 논문에서는 음성엔코더 (speech-waveform coder) 시뮬레이션에 사용할 수 있는 난수발생기를 설계하였다. 설계된 난수발생기는 규정된 확률밀도함수와 규정된 스펙트럼을 동시에 만족해야 하는 환경에서 필요로 하는 것이다. 선형필터와 메모리가 없는 비선형 회로로 구성되는 Sondhi 알고리즘 [1]을 기반으로 하여 난수발생기를 구현하였고, 균일 분포, 이진 분포, 감마 분포와 같은 연속적인 확률분포함수들을 얻기 위해 필요한 선형필터와 비선형 회로를 구현하는 방법을 연구하였다. 또한 분석적인 방법을 통하여 구현해야 하는 비선형 회로가 비대칭 형태로 표현되지 않는 경우 (카이-제곱 분포, lognormal 분포)와 수학식으로 표현할 수 없는 경우 (Student-t 분포, F 분포)에는 Sondhi 알고리즘이 동작하지 않음을 보였다.",박중후,2001,https://www.riss.kr/link?id=A101071013
스피커의 주관적 청음 평가치와 라우드니스 측정치 간의 상관 관계,"스피커의 음질에 대한 재생 성능을 판단하기 위하여 개발 및 최종 평가 단계에서 수행되는 청음실험은 시간과 경제적 문제뿐만 아니라, 평가자의 평가 능력에 따른 재현성 및 신뢰성에 많은 문제를 나타낸다. 이와 같은 이유로 스피커의 성능은 주관적 평가치 뿐만 아니라 객관적인 지표로서도 나타내는 시도가 함께 이루어져야 한다. 이를 위한 시도의 하나로서, 본 연구에서는 청음실험 및 통계 처리를 실행하여 얻은 주관적 평가 결과와 스피커 재생음에 대한 음질인자 해석을 통하여 얻은 객관적 측정 사이의 관계를 밝히고자 한다. 청음실험 결과는 분산분석법 및 Tukey의 방법을 이용한 네 단계의 통계 처리를 통하여 주관적 평가 결과를 얻고, 객관적 평가를 위해서는 라우드니스 측정을 기본으로 한 충실도 평가치 (Fidelity Rating)와 부드러움 평가치 (Softness Rating)를 제안한 후, 두 평가 결과의 상관도를 계산함으로써 타당성을 검증하였다. 본 연구에서의 방법론을 이용하면, 개발품 및 완성품의 스피커 음질 평가에 있어서, 시간이 많이 들고 비싼 주관 평가 작업이 없이도 통계적으로 안정되게 예측 평가할 수 있다고 본다.",신성환,2000,https://www.riss.kr/link?id=A101071082
발화속도와 한국어 분절음의 음향학적 특성,"본 연구에서는 산출실험을 통해 발화속도와 한국어의 분절음의 지속시간 및 포만트 특성과의 관계와 모음의 지속시간과 포만트 간의 상관관계를 살펴보았다. 빠른 발화일수록 음절 및 자음과 모음의 지속시간은 짧게 나타났으며 대부분의 화자에서 폐쇄음의 폐쇄구간 대 기식구간의 비율이나 한 음절 내의 모음 대 자음 지속시간의 비율은 발화속도의 영향을 받지 않는 반면 일부 화자들은 발화속도의 영향을 받는 것으로 나타났다. 발화속도의 영향을 받는 화자들에서 폐쇄음의 경우 폐쇄구간이 기식구간보다 영향을 더 받으며 음절의 경우 모음이 자음보다 더 영향을 받는 것으로 나타났다. 발화속도와 모음의 포만트값과의 관계 분석 결과 발화속도가 모음약화에 영향을 미치는 정도가 화자간에 차이를 보였으며 이는 화자마다 모음의 포만트값 구현에 관하여 다른 발화기재를 이용하고 있다는 것을 간접적으로 시사해주는 것이라고 할 수 있다. 즉, 발화속도의 증가에 따라 조음기관의 움직임의 속도를 증가시키는 화자가 있는 반면 발화속도의 변화에 관계없이 일정한 속도를 유지하는 화자가 있다는 것을 의미한다.",이숙향,2004,https://www.riss.kr/link?id=A101071399
능동 소나 위치 추정 성능 비교 및 최적 수신망 배치,"본 논문에서는 능동 소나의 구성 방법 및 관측 오차에 따른 위치 추정 성능에 대해서 다룬다. 능동 소나는 구성 방법에 따라서 크게 단상태 (Monostatic) 소나, 양상태 (Bistatic) 소나, 다중상태 (Multistatic) 소나로 분류될 수 있으며, 각각의 오차에 대한 특성이 서로 다르다 각 수신기가 거리 정보와 방위 정보를 얻을 수 있다는 가정하에 단상태, 양상태 소나와 다중상태 소나의 위치 추정 성능에 대해 비교해 보고 기존의 정보 융합 방법인 최소 자승법 (LS: Least square)에 가중치를 주는 가중치 최소 지승법 (WLS: Weighted least square)을 제안하였다. 또한, 제안된 방법을 이용하여 수신기의 수, 송수신기간 거리와 위치 추정 성능과의 연관성에 대하여 알아보고 효과적인 다중상태 소나 배치에 대한 연구를 수행하였다. 모의 실험결과 다중상태 소나의 위치 추정 제곱근 오차평균이 단상태 소나에 비해 약 35.98%, 양상태 소나에 비해 약 37.45% 우수한 것을 볼 수 있었으며 WLS가 LS에 비해 평균 7.4% 우수한 성능을 나타내었고 각 센서에 입력되는 정보의 분산 차가 클수록 성능 향상율이 증가하는 경향을 보였다.",박치현,2003,https://www.riss.kr/link?id=A101071340
청감실험에 의한 공동주택 바닥충격음의 평가등급 설정,"본 논문에서는 바닥충격음의 감성적 상하한치를 기준으로 바닥충격음의 감성적 평가등급을 설정하기 위하여 바닥충격음 레벨에 따른 피험자의 주관적 반응을 현장 청감실험을 통하여 조사하였다. 표준 바닥충격원인 중량, 경량 충격음과 현재 일본에서 신 중량충격원으로 제안되고 있는 고무공충격음, 그리고 실제 충격음 (Jumping)을 대상으로 청감실험을 실시하였으며 청감실험에 사용된 주관적 반응의 평가척도로는 일본 건축학회에서 활용되고 있는 3개의 평가척도와 소음평가어휘를 활용한 평가척도를 사용하였다. 청감실험 결과, 바닥충격음 레벨에 따른 주관적 반응의 관계는 1차 회귀식으로 나타났으며, 감성적 하한치가 중량충격음의 경우 역A특성 가중 바닥충격음 레벨 (L/sub i, Fmax, AW/)이 46㏈, 경량충격음의 경우 역A특성 가중 규준화 바닥충격음 레벨 (L'/sub n, AW/)이 56㏈로 나타났다. 최종적으로 청감실험 결과에서 도출된 감성적 하한치의 기준으로 총 3등급의 평가등급이 설정되었다.",전진용,2003,https://www.riss.kr/link?id=A101071322
골전도 피드백 보상에 의한 휴대전화 음질 향상,"현대사회를 살아가는 사람들은 버스나 지하철과 같은 대중교통에서나 백화점이나 할인점 같은 다수의 사람이 모이는 환경에서 순전히 타의에 의해 온갖 소음에 노출된다. 이런 환경에서 휴대전화나 PMP 등 개인 휴대용 단말기 사용이 늘어나면서 공공장소에서 소음 문제는 점점 심각해지고 있다. 사람들은 소음환경 속에서 휴대기기를 이용해 원활한 정보교환을 위해 일반적으로 소음보다 15 dB이상 큰 음압으로 휴대기기를 구동하고 있다. 이러한 휴대기기의 음압을 측정해보면 110 dB까지 발생하고 있으며, 이렇게 발생한 음압은 사용자에게 소음성 난청을 유발시키고, 주변사람에게 또 다른 소음문제를 발생시킨다. 이러한 문제를 해결하기 위해 골전도 시스템을 이용한 방법을 제안한다. 본 논문에서는 휴대전화에 일반스피커와 함께 골전도 스피커와 골전도 마이크를 사용해 피드백을 통한 보상을 하였고, 이 방법에 의해 주변 소음의 영향을 줄이고 휴대전화 음질 향상하는 방법을 제안한다. 제안한 방법으로 휴대전화 사용자 주변의 소음에 대한 영향을 줄이고 통화 음질을 향상해 약 17 dB의 성능 향상효과를 확인하였다.",박형우,2012,https://www.riss.kr/link?id=A101070004
국내 학교 교실의 실내음향성능 실태조사,"학교 공간의 핵심인 교실의 음환경은 학생의 학습효과와 학업 성취에 매우 중요한 요소이다. 따라서 교실에서의 높은 음향성능 제고를 위한 다양한 노력들이 국내외적으로 끊임없이 이어져오고 있다. 그 결과로써 미국 및 영국의 경우 학교 교실의 잔향시간 및 배경소음을 바탕으로 한 교실의 용도 및 크기 별로 음환경 기준이 성립되어 있다. 그러나 우리나라의 경우 교실에 대한 대부분의 연구가 건축계획상의 특정한 사용 목적을 위해 이루어지고 있으며 이에 기초가 되는 학교 교실의 실내음향성능에 대한 실태 조사가 부족한 실정이다. 본 연구에서는 학교 교실의 음환경 실태를 조사하기 위하여 국내 초등학교 및 중학교, 고등학교의 총 15개 교실을 선정하여 실내음향성능을 측정하였다. 각 학교 교실의 음환경 분석에 사용한 음향지표는 배경소음, 신호대잡음비, 잔향시간, 음명료도, 음성전달지수 등이 있다. 연구결과 배경소음의 경우 도로변에 위치한 학교에서 미국 및 영국의 기준인 35 dB(A)를 초과하는 것으로 나타났다. 특히 창문을 개방했을 때 신호대잡음비는 거의 모든 학교에서 기준을 초과하는 것으로 나타나 외부 소음에 의해 학생이 음성전달에 방해를 받을 수 있음을 알 수 있었다. 잔향시간의 경우 일부 초등학교와 중학교에서 미국의 기준인 0.6 s를 초과하는 것으로 나타났으며 명료도는 모든 학교에서 높게 나타났다.",박찬재,2014,https://www.riss.kr/link?id=A101069945
입체음향효과 향상을 위한 스테레오-10.2채널 블라인드 업믹스 기법,"본 논문에서는 입체음향효과의 향상을 위한 스테레오-10.2채널의 블라인드 업믹스 알고리즘을 제안하였다. 최근에, 소비자들은 더 나은 입체음향효과나 3D 사운드를 즐기길 원하고 다양한 멀티채널 포맷의 등장으로 업믹스 알고리즘들이 연구 되어 왔다. 그러나 기존의 업믹스 알고리즘들은 공간정보를 왜곡하는 문제점을 가지고 있었다. 이러한 문제점을 해결하기위해 전 후방 채널에 대한 이득 조절 및 10.2 채널의 각 채널별 믹싱 알고리즘을 제안한다. 기존의 상용화된 멀티채널 업믹스 알고리즘들과의 주관적 평가 실험결과 제안한 알고리즘은 입력신호의 공간정보를 유지하면서 입체음향효과를 향상시킨 것으로 확인되었다.",최선웅,2012,https://www.riss.kr/link?id=A101070002
