
도심 교통음과 자연의 소리에 대한 음향심리 분석,"현대 사회에서는 세계 인구의 대부분이 도시에 몰려 있기 때문에, 도심의 소리는 중요한 의미를 가진다. 그 중 교통음은 가장 대표적인 도심소리 중에 하나이다. 일반적으로 도심 교통음은 환경소음으로, 대표적인 자연의 소리인 숲, 폭포소리등은 사람에게 긍정적인 효과를 주는 소리로 분류한다. 본 연구에서는 자연의 소리가 포함하는 백색잡음에 다양한 형태의 FFT보정 필터를 적용시켜, 사람이 가장 선호하는 형태의 백색잡음 주파수 특성을 발견하고 자연 소리와의 상관관계를 확인하였다. 그리고 여러 형태의 도심 교통음과 숲소리의 파형, 스펙트럼 비교를 통한 분석을 진행하였다. 분석 결과 도심 교통음이 숲소리에 비해 특정 주파수대역과 시점에 집중된 소리 에너지 특징이 있음을 발견하였으며, 이러한 특징이 사람에게 미칠 수 있는 부정적인 요소들을 확인하였다. 마지막으로 전극법 뇌파 실험을 통하여, 도심 교통음과 자연의 숲, 폭포소리를 직접 피실험자들에게 들려주어, 알파파와 베타파의 에너지 분포를 측정하였다. 측정결과 도심 교통음은 자연의 소리보다 현저하게 많은 양의 베타파를 발생 시켰으며, 반대로 자연의 소리는 많은 양의 알파파를 발생 시켰다. 이러한 결과를 통해 도심 교통음이 사람에게 미치는 부정적인 영향과 자연 소리의 긍정적인 영향을 직접적으로 확인하였다.",견두헌,2009,https://www.riss.kr/link?id=A101069710
여성 뉴스 앵커의 발성 특성 분석,"본 논문은 각 방송사의 메인 뉴스인 평일 저녁뉴스의 여성 앵커 음성 분석을 통하여 공통적인 음성 요소와 각 방송국별 상대적인 음성 및 음향에는 어떠한 차이가 있는지 연구하였다. 전반적인 음성 특성을 알아보기 위해 6가지 요소를 분석한 결과, 각 방송국별 아나운서는 발화속도를 제외하면 모든 영역에서 뚜렷한 음성 및 발성 특징을 가지고 있었으며 음향시스템적인 차이도 발견 되었다. 주요 분석 요소는 기본 피치 외에 제1포만트와 피치비율에 따른 음색과 피치대역폭을 통한 정감도 요소, 피치대역폭내의 평균피치위치를 통한 문장 끝맺음 양상, 평균 발화속도, 주파수 대역별 에너지 분포를 통한 음향적인 음색 분석이다. 분석된 수치 및 결과는 국내 여성 앵커의 발성 특징의 기준으로 참고 및 활용될 수 있다.",견두헌,2011,https://www.riss.kr/link?id=A101069768
라이스의 전화기 발명과 통화 음질의 문제,리어스는 그레이나 벨 등보다 훨씬 앞서서 도선을 통해 목소리를 전달하는 데 성공했기 때문에 전화기의 발명자라고 불리는 것이 마땅하지만 살아 있는 동안 그의 위대한 발명품으로 영예를 누리지 못했다. 그는 과학자 집단에 속해 있었으므로 그의 연구를 특허를 낼 수 있는 발명품이 아니라 과학적 발견으로 제시하였다. 또한 그는 유럽 음향학의 실험 전통에 따라 단속적 전기를 사용하였기에 그의 전화기는 통화음질에 치명적 결점을 갖게 되었다. 반면에 전기와 음향학에 초보자였던 벨은 소리 신호를 전송하기 위해 가변 전류를 사용하였고 그것은 라이스의 전화기보다 더 나은 통화 음질을 보장하였다.,구자현,2010,https://www.riss.kr/link?id=A101069762
공감 (Empathy)이 자기존중감과 주관적 안녕감에 미치는 영향,"그동안 공감이 대인관계에서 하는 역할은 꾸준히 밝혀져 왔다. 하지만 공감이 주관적 안녕감에 어떤 영향을 미치는지 밝히는 연구는 거의 없었다. 이에 따라 본 연구에서는 공감이 자기존중감을 매개로 주관적 안녕감에 영향을 미친다는 모형을 가정하고 검정하고자 하였다. 또한 허재홍, 이찬종 (2010)은 공감지수 (Empathy Quotient: EQ) 척도의 심리측정 속성은 밝혔으나 확인요인분석은 하지 않아 본 연구에서 확인요인분석을 하였다. 대학생 421명 (남학생 192명, 여학생 225명)을 대상으로 설문을 실시하였고, 구조방정식 모형과 경로분석을 하였다. 연구결과 EQ는 기존 연구와 마찬가지로 세 요인 (인지공감, 정서공감, 사회기술공감)으로 보는 것이 타당하였다. 또한 공감은 자기존중감을 매개로 주관적 안녕감에 영향을 미치고 있었다. 이 연구 결과에서 공감이 우리나라 문화에서 개인이 문화의 가치를 충족시킴으로써 자기존중감을 높이고 이는 다시 주관적 안녕감을 향상시킨다는 것을 알 수 있었다. 이와 함께 본 연구에서는 공감에 우리나라 문화 특성도 반영해야 한다는 사실도 시사되었다.",허재홍,2010,https://www.riss.kr/link?id=A101069801
소음지도 시뮬레이션을 이용한 도로교통소음 개선방안 연구,"급속한 도시화와 인구밀도의 증가로 도시의 주거지역은 점점 고층화, 고밀화 되어가는 추세이다. 그로 인하여 인구의 공간적 집중으로 발생하는 교통수요를 감당하기 위하여 도시내부 도로는 점차 증가하였으며, 주거지역은 도로에 바로 인접하여 개발되고 있다. 이에 따라 도로에 연접한 주거지역의 도로교통소음 문제를 해결하기 위하여 방음벽에 의존하는 실정이었으나, 경관저해, 소음차단성능저해 등 다양한 역기능이 발생하고 있다. 본 연구에서는 방음벽의 역기능을 해소하고 바람직한 개선방안을 제시하기 위하여 도로변에 위치한 주거지역의 현장측정을 통하여 시뮬레이션의 정확도를 검증한 후 방음시설별 성능평가 및 전체 지역을 분석하였다. 그리고 개선방안으로 건축물의 배치형태 변화와 도로단으로부터의 이격거리를 20m 증가시켰다. 분석 결과 도로변과 평행한 공동주택의 피해가 가장 심각하였고, 시설별 분석에서는 방음벽의 성능이 우수하였으며, 건물 배치형태는 $30^{\circ}$ 배치가 우수하며, 이격거리가 증가함에 따라 교통소음이 감소하는 것으로 나타났다.",김형철,2007,https://www.riss.kr/link?id=A101069517
화음 이름과 음계 분석을 이용한 호모포니 4부 합창 악보의 자동 조성 검출 알고리듬,"MusicXML 파일로 표현되는 수직적으로 화음을 결정할 수 있는 충분한 정보가 있는 호모포니(homophony) 4부 합창 형식의 음악에서 화음 이름을 자동으로 판단하고 사용된 음계와 검출된 화음 이름을 이용하여 조성을 자동으로 검출하는 알고리듬을 기술한다. 화음 이름은 사용된 조에 관계없이 분석이 가능한 구성 화음의 절대적인 이름이나 환경에 따라 두 개 이상의 화음 이름으로 결정될 수 있는 여러 상황이 존재하게 되는데, 몇 가지 파라미터를 이용하여 상황에 가장 적절한 화음을 선택하는 알고리듬을 기술한다. 또한 사용된 음들을 이용하여 음계를 추정하고, 구해진 화음 이름과 추정된 음계를 이용하여 음악의 조성을 파악하는 알고리듬을 기술한다. 조성이 결정되었으면 다시 조성과 파악된 조성을 기반으로 화음을 표기하고 MusicXML 파일로 출력한다.",이강성,2007,https://www.riss.kr/link?id=A101069515
초저주파 대역 수중 자체소음 저감에 관한 실험 연구,"수중에서 음향신호를 측정할 때에 청음기 주위에서의 유동에 의해 발생하는 초저주파 대역 자체소음을 저감시키기 위해 청음기 주위에 다공성 발포재를 씌우는 기법의 효과를 해상 실험을 통해 고찰하였다. 두께가 다른 10 ppi 폴리우레탄 발포재를 이용하여 실험한 결과, 2-10 Hz 대역에서 발포재의 두께가 1 cm일 때에는 최대 20 dB 그리고 발포재의 두께가 3 cm인 경우에는 최대 28 dB의 자체소음 저감 효과가 있음을 확인하였다.",이성욱,2011,https://www.riss.kr/link?id=A101069788
3D 모델의 구체성이 건축음향 시뮬레이션 및 가청화시재에 미치는 영향,"본 논문은 건축음향 설계에 있어서 가장 많이 활용되고 있는 컴퓨터 시뮬레이션의 정밀도 향상을 위한 3차원 모델의 구체성에 대하여 연구하였다. 본 연구에서는 건축음향 시뮬레이션 프로그램인 odeon 6.5에서 제시하고 있는 transition order의 단계를 기준으로 3D 모델의 구체성을 총 4단계로 구분하였다. 각 실내마감재의 흡음률은 도면에 표기된 재료를 odeon의 material library 및 시험성적서를 참고해 입력하였으며 확산률은 odeon의 마감의 표면형태에 따른 권장치를 입력하였다. 또한 room setup 설정시 사용음선수를 동일하게 입력하였으며, trasition order는 각 모델의 유효표면수에 맞게 입력하였다. 실제 공연장에서 측정한 현장음향실험 결과를 기준으로 시뮬레이션 결과와 비교하여 물리적 음향인자 (음압레벨, 잔향시간, 명료도 등)의 오차를 분석하였다. 또한 가청화시재를 제작하여 현장에서 녹음한 음원과 청감실험을 통해 비교하여 주관적 음향인자 (잔향감, 명료함 등)별 유사 정도를 평가하였다. 물리적 음향인자 분석결과, 가장 구체적인 3D모델의 잔향시간 오차가 가장 작게 나타났으며 명료도의 경우 단순한 모델의 오차가 가장 작았다. 그러나 단순한 모델은 저주파수 대역의 오차가 상대적으로 매우 크게 나타남에 따라 3D 모델을 구체적으로 작성할수록 보다 정밀한 음향예측이 가능할 것으로 판단된다. 또한 주관적 청감실험 결과, 물리적 오차가 작을수록 가청화시재가 원음과 가장 유사하게 들린다고 응답함으로써 3D 모델의 구체성이 가청화시제 제작에 영향을 미치고 있음을 알 수 있었다.",박찬재,2011,https://www.riss.kr/link?id=A101069789
스펙트럼 대비 MFCC 특징의 음악 장르 분류 성능 분석,"본 논문에서는 새로운 형태의 스펙트럼 특징인 스펙트럼 대비 MFCC (SCMFCC)를 제안하고 음악 장르 분류 성능을 분석하였다. 음악 장르 분류를 위해서는 장르 간의 차이를 두드러지게 할 수 있는 특징을 사용해야 하므로, 음악의 화음 구조 및 강약을 잘 표현하는 스펙트럼 대비 특징들이 관심을 받아왔다. 본 논문에서 제안된 SCMFCC는 멜 켑스트럼 상에서 스펙트럼의 대비를 이용하여 기존의 MFCC를 음악 분류에 적합하도록 변형했다. 널리 사용되고 있는 음악 장르 데이터베이스에서 실험을 수행하여, 제안된 SCMFCC 특징의 음악 장르 분류 성능을 기존의 다른 특징들과 비교하였다.",서진수,2010,https://www.riss.kr/link?id=A101069810
잡음환경에서 휴대전화 사용에 따른 소음성 난청예방 기술에 관한 연구,"사람의 청력은 노화로 인해 자연스럽게 저하된다. 하지만 최근 들어 젊은 나이에 난청이 발생하는 경우가 크게 늘고 있다. 이처럼 난청인구가 증가하는 가장 큰 이유는 각종 휴대용 멀티미디어 기기의 대중화에 기인한다. 현재 이어폰/헤드폰으로 유발되는 소음성 난청 연구는 많이 이루어지고 있으나, 직접적인 휴대전화 통화에 따른 소음성 난청유발에 대한 연구는 거의 없다. 본 연구에서는 선행 조사를 토대로, 골전도 스피커에 Active Noise Reduction기술을 접목하여 소음성 난청을 예방하는 기술을 제안한다. 이 기술은 주변소음을 골전도 스피커를 통해서 능동적으로 역위상 진동을 부과하여 노이즈를 줄이는 방법이다. 제안한 시스템을 적용할 경우 실제 청각에 유입되는 소음레벨이 12 dB 이상 감소되며, 이러한 음량 감소폭은 휴대폰 통화에 따른 소음성난청 요인을 근본적으로 예방하는 것이다. 감성실험 결과 통화음량이 감소된 상황에서도 원활한 통화가 가능하였다.",박형우,2011,https://www.riss.kr/link?id=A101069916
공간의 청각적 규모감과 음향적 선호도간의 관계,"인간은 일반적으로 공간의 크기에 대한 정보를 시각에 의존한다. 그러나 청각적 경험이 중시되는 공연공간이나 다수의 음원을 활용하는 멀티미디어 환경 및 자동차의 캐빈 등에서는 시각적으로 큰 차이가 없는 상황에서도 제공되는 청취환경에 의해서 공간의 크기를 다르게 지각하게 된다. 본 연구는, 단일공연장내 상이한 위치에서 청각적으로 지각되는 공간의 규모를 청취실험을 통하여 측정 분석하였으며, 동일위치에서 측정된 건축음향파라메타와의 상관관계분석을 통하여 영향요인들을 살펴보았다. 실험결과, 공연장의 크기에 대한 청각적 인상은 음악적 명료도(clarity)에 의해 크게 좌우되며, 음원과의 거리, SPL등에 의해 영향을 받는 것으로 나타났다. 또한 각기 다른 4종류의 연주악기를 이용한 음향 선호도 평가결과, 성악을 제외한 오케스트라, 첼로, 플룻의 경우 공간적 규모감이 작은 것을 선호하였다. 반면, 성악의 경우 공간적 규모감과의 유의적인 상관관계가 나타나지 않았다.",정대업,2006,https://www.riss.kr/link?id=A101069577
청각 환경이 교사의 음성 파라미터에 미치는 영향,"본 연구는 교사와 일반인을 대상으로 그들의 음성과 청각 조건 ( 소음, 음악 )에서의 음성 파라미터들을 비교 분석하여 다음과 같은 결과를 얻을 수 있었다. 교사는 일반인의 음성 보다 높은 주파수 변동률(%)과 진폭 변동률(%)을 보여 정상 음성에 비해 높이와 강도에 변화가 큰 것을 알 수 있었다. 청각 조건에 따른 결과를 살펴보면, 교사의 음성 파라미터는 청각 조건이 주어지지 않은 일반 음성에 비해 소음 환경에서 높은 기본 주파수 (Hz)를 나타내었고 소음과 음악 환경간에는 그 차이를 발견할 수 없었다. 일반인의 음성 파라미터 청각 조건이 주어지지 않은 일반 음성에 비해 소음 환경에서 높은 기본 주파수를 나타내었으며 음악과 소음 환경간에도 기본 주파수의 차이를 나타내었다.",이주영,2006,https://www.riss.kr/link?id=A101069579
성덕대왕신종의 명동과 간극의 공명조건,"한국종은 지면으로부터 일정한 간극을 두고 매달리며, 종 아래에 명동이라고 불리는 독특한 음향학적 요소를 갖고 있다. 간극과 명동의 적절한 설계는 공명효과에 의하여 종소리를 극적으로 증폭시킨다. 종체의 내부공동과 간극, 그리고 명동으로 구성된 음향공동계는 공명주파수와 모드를 갖는데, 공명주파수가 종체의 고유진동수에 일치하게 되면, 그 주파수성분이 크게 증폭된다. 이 연구는 성덕대왕신종을 대상으로 간극효과를 고려한 명동의 공명조건을 처음으로 제시한다. 공명조건을 구하기 위하여 신종의 실제 치수를 사용하여 SYSNOISE를 이용한 경계요소해석을 수행하였다. 또한, 계절에 따른 기온의 차이가 공명조건에 어떠한 영향을 미치는가를 규명하고, 가변형 명동의 개념을 제시함으로써, 현장에서 온도차를 보정하여 정확한 공명조건을 구현시킬 수 있는 방안을 제공한다.",김석현,2011,https://www.riss.kr/link?id=A101069918
자음지각검사 (KCPT)의 개발,"본 연구의 목적은 말지각평가의 기초 자료가 되고 청각장애 자음지각능력의 정량적 정성적 평가가 가능한 음소단위의 한국어자음지각검사 (Korean Consonant Perception Test, 이하 KCPT)도구를 개발하는 것이다. KCPT는 조합 가능한 모든 한국어 단음절어 중 유의미 단음절어만 분류하여, 7종성발음규칙을 적용하고 목표단어의 친숙도를 조절한 사지선다형 초 종성검사문항 시안을 작성한 후, 각 단어들의 조음 특성, 난이도, 음소 출현빈도수를 고려하여 완성되었다. 이를 정상인 20명을 대상으로 평가하여 난이도가 높은 문항을 제거하고 화자 간 변수가 없는 것을 통계적으로 확인한 후 회화체 빈도수에 맞도록 최종문항을 작성하였다. 세부적 수정을 거쳐 초 종성검사문항 각 200개와 100개로 구성된 총 300개 문항을 개발하였다. 30명의 청각장애인을 대상으로 검증하여 A와 B로 구분한 절반목록간 차이도 없음을 확인하고 초성검사문항은 초성자음지각평가에 종성 검사문항은 종성자음 지각평가에 적절한 도구임을 검증하였다.",김진숙,2011,https://www.riss.kr/link?id=A101069926
음원과 마이크로폰 사이의 거리변화에 의한 음향 특성 보정에 관한 연구,"본 연구에서는 마이크로폰에 입사되는 음성 신호를 거리의 변동에 의해 크기와 주파수 응답특성 변화를 최소화시키는 방법에 대한 연구를 하였다. 우선 마이크로폰과 음성음원 사이의 거리를 변화시키며 거리변화에 따른 응답특성을 측정하였다. 본 연구에 사용된 마이크로폰은 일반적으로 사용되는 마이크로폰 중에 무지향성 마이크로폰과 초단일지향성 마이크로폰, 단일지향성 마이크로폰 등, 3가지 종류의 마이크로폰을 선정하였다. 측정한 이들 마이크의 주파수 응답특성 변화 결과를 기준치와 비교하여 보정치를 구하고 이를 주파수 대역별로 변화된 음성신호를 원음과 근사하게 보상하도록 하였다. 저주파대역은 근접효과에 의한 증폭현상, 그리고 거리에 의한 감쇠효과를 보정하도록 하였다. 중음대역에서는 저음대역보다 거리의 변화에 의한 주파수특성 편차가 비교적 적었지만 음성정보신호에 중요한 영향을 주는 부분이기 때문에 기준신호와 비교하여 복원하도록 하였다. 고주파대역의 음성정보의 변화는 극히 미소하여 고주파대역 조정은 큰 문제가 없이 원음에 가깝게 복원되었다.",정병철,2012,https://www.riss.kr/link?id=A101069840
"한국표준 학령전기용 단음절어표 (Korean Standard Monosyllabic Word Lists for Preschoolers, KS-MWL-P)의 심리음향기능곡선 연구","아동을 위한 단어인지도 검사 (word recognition test, WRT)는 아동의 의사소통장애정도를 진단하고, 보청기 사용을 위한 처방을 하고, 청각재활과 언어치료의 계획을 수립하고, 병변부위를 판단하는데 유용하게 사용될 수 있다. 한국표준 학령전기용 단음절어표 (Korean standard monosyllabic word lists for preschoolers, KS-MWL-P)는 문헌에서 주어진 기준을 고려하여 개발되었다. 그러나 KS-MWL-P의 저자들은 어표의 개발과정 중 단지 8명만 참여하여 분석된 심리음향 기능곡선을 검증하기 위하여 더 많은 대상을 포함한 연구를 제안하였다. 그러므로 본 연구의 목적은 KS-MWL-P 어표의 제한성을 보완하기 위하여 심리음향기능분석으로 어표의 동질성을 연구하고자 한다. 정상청력을 가진 23명의 학령전기아동을 대상으로 100개의 KS-MWL-P단어가 그림과 함께 제시되었다. -10에서 40 dB dBIH.까지 여러 강도에서 각 단어의 인지도 검사를 계산하여 20%와 80% 정답률 기준의 선형기울기로 심리음향기능곡선을 수집하고 분석하였다. 연구결과 강도에 따라 정답률이 증가하는 S자형 심리음향기능곡선이 나타났고 각 단어와 표간 통계적 유의성은 나타나지 않았다. 표간 유사한 그래프 형태를 통해 우수한 동질성을 보여주었고 표 1,2,3,4의 평균기울기는 4.48, 3.86, 4.65, 4.50 이었으며 일원 분산분석으로 분석할 때 표간 유의성이 없는 것 (p>0.05)으로 나타나서 표간 난이도의 동질성에 문제가 없는 것으로 확인되었다. 그리고 항목 번호의 순서에 따른 기울기의 P값도 표 1, 2, 3, 4에서 0.93, 0.59, 0.91, 0.70으로 모두 유의하지 않아 모든 표에서 $1{\sim}10$, $1{\sim}20$, $1{\sim}25$의 항목간 차이는 없는 것으로 나타났다. 그러나 KS-MWL-P는 낮은 번호의 항목은 더 어린 연령을 위하여 쉬운 단어로 배치하고자 하였으나 본 연구결과는 그렇지 못한 것으로 나타났다. 이러한 점을 고려할 때 어린 연령대를 위한 쉬운 단어가 낮은 항목에 배치되도록 항목의 배치를 재조정하여야 할 것으로 사료된다. 이러한 점을 제외하면 결론적으로 KS-MWL-P는 학령전기를 위한 임상과 재활의 평가 및 훈련도구로 유용한 것으로 입증되었다.",신현욱,2009,https://www.riss.kr/link?id=A101069701
음성 분리를 위한 스펙트로그램의 마루와 골을 이용한 시간-주파수 공간에서 소리 분할 기법,"본 논문에서는 스펙트로그램에서 마루와 골을 이용한 주파수 채널 분할 알고리즘을 제안한다. 주파수 채널 분할 문제는 동일한 음원으로부터 발생한 음성이 포함된 주파수 채널들을 하나의 그룹으로 묶는 것을 의미한다. 제안된 알고리즘은 입력 신호의 평탄화된 스펙트럼에 기반한 알고리즘이다. 평탄화된 스펙트럼에서 마루와 골은 각각 세그먼트의 중심과 경계를 판단하기 위해 사용된다. 각 세그먼트를 하나의 소리로 묶는 그룹핑 단계 이전에 제안된 알고리즘에 의한 세그멘테이션 결과가 유용함을 평가하기 위하여 이상적인 마스크에 의한 세그멘테이션 결과와 제안된 방법을 비교한다. 제안된 방법을 협대역 잡음, 광대역 잡음, 다른 음성신호와 혼합된 음성신호에 대하여 실험하였다.",임성길,2008,https://www.riss.kr/link?id=A101069642
설문지를 통한 소음성난청에 대한 인식 조사 및 분석,"소음성난청은 고려 시 되어야 하는 공중보건 문제로 알려져 있지만, 큰 소음의 노출로 인해 난청이 발생됨을 많은 사람들은 잘 인식하지 못하고 있다. 본 연구의 목적은 일반인들이 얼마나 중요하고 심각하게 소음성난청에 대하여 인식하고 있는지 22개의 설문 문항을 바탕으로 조사하고 그 결과를 분석하였다. 20대부터 60대의 성인 남녀 150명을 대상으로 청력손실과 이명을 포함하여 일반적인 건강 문제들에 대한 사회 및 개인적 중요도, 소음노출과 청력손실에 대한 인지 정도, 청력 보존 방법에 대한 인식을 문답하였다. 연구 결과, 다른 건강 문제들과 비교하여 응답자 중 약 17.33 %만이 청력손실을 '매우 큰 문제'로 인식하였다. 놀랍게도 다수의 응답자인 82 %는 청력손실에 관한 정보를 듣거나 보지 못하였다고 답변하였다. 전체 응답자 중 약 85 %의 응답자들은 큰 소음이 있는 환경에서 청력 문제 및 이명을 경험한 적이 있다고 답하였지만, 그 중 11.33 %만이 이어플러그를 착용해 본적이 있다고 응답하였다. 그러나 많은 응답자들은 추후 의료진이 권장하거나(80 %), 소음으로 인한 영구적 청력손실이 발생할 수 있다는 정보를 접한다면(78.67 %) 청력보호를 위해 소음 노출 시 이어플러그를 착용하겠다고 응답하였다. 소음으로 인한 영구적 청력 손실의 잠재성과 효율적인 청력 보호 방법에 대한 체계적인 교육으로 일반인들의 소음성난청을 예방하여야 하겠다.",이동욱,2015,https://www.riss.kr/link?id=A101070089
신경망을 이용한 우리말 음성의 인식에 관한 연구 - 복합 신경망을 이용한 초성자음 인식에 관한 연구,"본 논문은 신경망을 이용한 자음인히기에 관한 연구이다. 우선 자음과 모음이 포함된 음성에서 자음부분을 분리하였다. 각각의 자음을 몇개의 집단으로 나누어서 자음구간대 영교차율을 조사하였다. 마지막으로 자음을 인식하기 위해 제어망과 몇개의 소규모 망으로 구성한 혼합 신경망을 제안한다. 제어망은 입력된 자음이 어느 집단에 속하는가를 결정하고, 소규모망에서는 각 집단에 속하는 자음을 인식한다.",김석동,1992,https://www.riss.kr/link?id=A101070295
