
한국 현대동화의 삽화 연구,"최근 동화 삽화는 단순히 글을 보조하는 역할을 넘어 이야기를 깊이 이해할 수 있도록 돕고 때에 따라서는 인물의 보이지 않는 정서까지 담아낸다.
과거를 배경으로 삼은 역사동화의 경우 김동성은 『책과 노니는 집』에서 절제된 삽화로 정보를 전달하면서 그림만의 예술성으로 삽화의 성취도를 높였다. 윤정주는 『목기린 씨, 타세요!』에서 글에 서술된 묘사 부분을 삽화 한 장면으로 보여주거나 반대로 함축적 문장을 말풍선으로 풀어내는 방식을 사용하였다. 또 윤정주의 다른 작품 『헌터걸』에서는 고학년용 장편 동화의 글을 표로 요약하는 방식을 활용했다. 이는 ‘헌터걸’의 규칙을 강조하는 기능으로 작용하여 ‘헌터걸’의 매력을 높이는 효과를 낳는다. 이러한 방식은 동화 속 글을 삽화를 통해 편집하고 연출하여 재현하는 방식이라 할 것이다.
한편 고정순과 소윤경은 동화 삽화임에도 작가의 개성과 스타일을 좀 더 반영하고 있으며 그것은 주로 인물의 내면을 해석하는 방식으로 나타난다. 고정순은 『망나니 공주처럼』에서 세 명의 주요 인물의 성격과 상황을 잘 해석하여 삽화에 그들의 내면이 드러나도록 배치하였다. 소윤경은 SF동화이자 일인칭 주인공시점인 동화 『우주로 가는 계단』의 삽화에서 일인칭 주인공 시점으로 평행우주와 미래를 보는 상상력을 가시화 하였다.
이처럼 동화 삽화가 글을 어떻게 재현하고 해석하느냐에 따라 동화의 전달력과 상상력이 확장됨을 확인할 수 있었다. 또한 최근 활발하게 출간되는 그림책의 완결성이 동화 삽화의 성취에 영향을 미치고 있음도 확인할 수 있었다.",오세란 ( Oh Seran ),2021,https://www.riss.kr/link?id=A108732059
한강 『채식주의자』에 나타난 여성 몸의 의미와 저항 읽기,"한강의 『채식주의자』에서 육체적 욕구를 내포한 육식 문화는 남성 중심의 지배질서를 의미하며, 여성에 대한 소유와 통제를 강제하는 도구로 작용한다.
영혜의 몸에 가해진 최초의 폭력은 권위적이고 가부장적 가치관에 사로잡힌 아버지에 의한 것이었으며, 이후로도 영혜는 강간, 육식 강요, 자해, 정신병원 수용과 단식 등 다양한 폭력에 노출된다. 이러한 폭력을 자신의 주체성을 위협하는 요소로 인식하고 극단적인 저항을 감행한 영혜에게 나타난 변이는 자신과 세상을 연결하면서도 주체적으로 분리되는 남성 권위로부터의 해방을 의미한다.
영혜가 실천한 육체의 인식 변화는 여성보다 한 인간으로서 가져야 할 주체성 회복을 강조한다. 이 행위는 인혜에게 객체화된 자아 극복과 남성 중심의 지배질서가 각인된 몸을 스스로 파괴할 수 있도록 유도한다. 남성과 여성의 성 역할을 중심으로 여성의 몸 인식과 저항의식을 탐색한다면 고정된 젠더의식을 비판적 관점으로 검열할 수 있는 능력을 얻을 수 있다.",마혜경 ( Ma Hye Kyung ),2022,https://www.riss.kr/link?id=A108761961
한국 웹툰 번역 업계 문제점 분석 및 개선방안 제언 - 관계자 심층 인터뷰 조사를 중심으로,,"강경이(Kang, Kyoungyi)",2021,https://www.riss.kr/link?id=A108761954
앤서니 브라운의 『겁쟁이 빌리』(Silly Billy) -걱정인형을 통해본 아동의 분리불안과 수면불안의 해소-,『겁쟁이 빌리』는 분리불안을 겪고 있는 아동의 심리를 다루고 있다. 분리불안은 아동의 성장과 발달과정에서 일어나는 필연적적인 현상이다. 그러나 빌리가 분리불안을 겪는 이유는 비합리적으로 예상하고 비이성적인 상황을 다루는 소심한 성격을 가졌기 때문이다. 이 그림책은 색과 그림을 통하여 등장인물들의 내면적 심리를 섬세하게 잘 표현해준다. 아동들은 화려한 색깔의 그림과 걱정인형들을 통하여 빌리가 겪는 불안에 대해 감정이입을 하게 되고 공감하게 된다. 빌리의 부모는 아들의 분리불안에 대하여 적절하게 대응하지 못하나 할머니는 빌리의 불안에 보다 적극적으로 대처하고 해소시킬 방법을 찾아낸다. 빌리는 걱정인형을 이용하여 불안을 극복해나가는 과정을 통해 사회성을 발달시키게 된다. 부모는 인지교정방식과 행동교정방식을 통하여 불안과 공포를 일으키게 하는 생각과 행동들을 바꾸게 함으로써 아동들의 분리불안에 관련된 문제들을 해소할 수 있다.,이영준 ( Young Zun Lee ),2015,https://www.riss.kr/link?id=A108732056
중한 번역에서 문화소의 부등성에 따른 번역 전략,,강수정(Kang SuJung),2010,https://www.riss.kr/link?id=A108220919
동화치료의 연구동향 분석: 2008∼2017년 학술논문을 중심으로,"본 연구에서는 2008년부터 2017년까지 10년간 수행된 동화치료의 연구 동향을 분석하였으며 그 내용은 다음과 같다.
첫째 동화치료는 2008년부터 2017년까지 총 96건의 연구가 수행되었다. 연도 별로 규칙적인 증감패턴을 나타내고 있지 않았지만 2013년~2016년까지 매년 10건 이상의 연구가 수행되어오고 있었다. 둘째, 동화치료는 초등학생(56.3%)을 대상으로 가장 많은 연구가 수행되었으며 유아(16.7), 청소년(7.3%), 성인(7.3%)의 순으로 연구가 수행되었다. 셋째, 동화치료는 교육학 분야(29.2%)에서 가장 많은 연구가 수행되었으며, 심리학(26.0%), 특수교육학(9.4%), 문헌정보학(9.4%), 문학(8.3%), 재활학(6.3%) 등의 순으로 연구되었다. 넷째, 동화치료의 연구유형별 현황은 자기효능감, 자아존중감, 사회적응 등과 관련된 정서적 연구(59.0%)가 가장 많이 이루어졌으며, 이론적 연구(16.7%), 사례적 연구(9.4%), 임상적 연구(6.3%), 학습적 연구(6.3%) 순으로 수행되었다.
연구에서는 분석결과를 토대로 동화치료만의 정체성을 확립을 위한 문학치료, 시(時)치료 등과의 비교연구를 제안하였고, 성인대상의 연구를 보다 더 수행해서 동화치료의 저변을 확대할 것을 제안하였다. 또한 스마트폰이나 태블릿PC를 활용한 동화치료의 효과성 검증과 기존 연구들에 대한 체계적 문헌 고찰을 통해 동화치료의 우수한 효과를 재입증할 것을 제안하였다.",남재우 ( Nam Jaewoo ),2019,https://www.riss.kr/link?id=A107984262
"황순원 소설에서의 모성성과 훼손된 아동이미지 연구 -「별」, 「왕모래」, 「안개구름끼다」를 중심으로-","황순원은 한국 문단에서 중간파적인 입장을 고수하는 이력과 문학세계를 갖고 있는 작가이다. 그러나 황순원은 현실과 유리된 예술지상주의자는 아니다. 황순원의 주요 작품 연보를 그 제작 시기와 연관시켜 볼 때 그가 항상 당대의 역사와 사회적 상황에 민감하게 반응하고 있음을 알 수 있다. 그리고 이러한 사실들이 아동을 대상으로 하고 있는 소설에도 드러나고 있다. 황순원이 작가로서 현실에 대한 적극적 저항을 할 수 없었던 당대의 내외적 조건이 그로 하여금 부정적인 현실을 파국적으로 드러낼 수 있는 방법으로써 가장 순수한 ‘아동’을 훼손된 이미지로 전환시켰던 것으로 보인다. 별 , 왕모래 , 안개구름끼다 를 기반으로 훼손된 아동이미지를 통해 전달 하려고 한 작가의식을 연구하려고 한다. 아동은 한국만의 역사적 상황에 따라 점점 더 동심이 철저하게 파괴되는 것으로 드러나고 있다. 이 세 소설의 아동은 모두 9살부터 모성성을 찾는다. 황순원 소설에서 모성성은 다층적으로 해석될 여지를 갖고 있다. 황순원 소설에서의 모성성을 찾는 아동들은 고아의식을 드러냄과 동시에 정주하기 위해 절대적인 모성성을 찾아 헤맨다. 그러나 아동들은 기다려온 모성성을 만나지 못했을 때 절대적인 믿음과는 반대로 비틀어지고 위태롭고 위악적인 죽음의 양상을 보여준다. 이는 모성성으로 감싸 안을 수 없는 인간 세계가 얼마나 황폐할 수 있는지를 단적으로 보여주는 것이라고 할 수 있다.",방금단 ( Geum Dan Bang ),2015,https://www.riss.kr/link?id=A108105619
동화치료의 사례와 유형 분석: 2010-2014,"본 연구는 다양한 학문분야에서 수행된 동화를 이용한 독서치료의 연구결과를 조사하여 동화치료 영역으로의 도입과 활용의 가능성을 살펴보는 것이다. 첫째, 2010년부터 2014년까지 발간된 총 222편의 자료를 대상으로 독서치료의 현황을 조사하였다. 둘째, 52편의 자료를 대상으로 동화치료에서 가장 중요하고 핵심적인 요소인 자료의 선정 과정과 방법을 도식화하고 활용빈도별 동화목록을 제시하였다. 셋째, 동화치료 프로그램의 연구 유형은 다양한 참여자의 문제를 해결하기 위하여 다양한 학문영역에서 발달·예방적 독서치료(집단적 형태)와 임상·치료적 독서치료(일대일 혹은 소수) 형태로 이루어지고 있는 것으로 나타났다. 넷째, 독서치료 프로그램의 여러 과정을 살펴보면 여러 이론에 따라서 질문의 유형이나 활동 등은 차이점이 분명하게 보이기보다는 상호 유사한 형태를 보이고 있는 것으로 나타났다. 제언으로 동화치료의 활성화를 위하여 동화치료를 위한 지식정보시스템 구축과 연계를 제시하였다. 지식정보시스템의 주요 구성요소는 동화를 위한 데이터베이스(상황별 목록, 사례 지식베이스, 인터넷 서점, 도서관목록 등), 디지털 콘텐츠(전자책, 애니메이션, 동영상, 음악 등), 운영 및 관리(사용자의 참여), 네트워크(이용자의 특성에 맞는 연계 및 상호작용 기능 제공)이다.",최원태 ( Won Tae Choi ),2015,https://www.riss.kr/link?id=A107864841
중한 법령 기계번역 포스트에디팅 교육을 위한 예비 연구,,"김혜림(Kim, Hae Rhim)",2021,https://www.riss.kr/link?id=A108220921
영화 <피터 래빗>에 나타난 외디푸스 콤플렉스 연구,"어린 시절 부모의 관심과 애정은 아이의 성장에 꼭 필요하다. 하지만 성장하면서 아이는 부모에 대한 애착에서 벗어나야만 한다. 알을 깨고 나오는 것이 고통스럽고 힘들지만, 반드시 두꺼운 벽을 깨고 나와야만 자신만의 새로운 세상을 만날 수 있다. 그래야만 그는 영웅으로 탄생할 수 있는 것이다.
아직 외디푸스 콤플렉스에 고착되어 내적으로 성장하지 못한 피터는 모든 것을 파국으로 이끌게 된다. 모든 것이 파국으로 치닫는 지경에 이르게 되자, 그때서야 피터는 자신의 집착이 잘못되었음을 깨닫게 된다. 엄마의 사랑을 독점하겠다는 마음에서 벗어나 아버지를 받아들이게 된다. 사랑은 나눔으로써 더 풍요로워질 수 있음을 알게 된 것이다.
성장과정에 있어 아이의 성숙과 독립은 반드시 필요하며, 이는 엄마, 아빠 모두로부터 정신적 육체적으로 독립, 성숙하는 것을 의미한다. 부모에게서 독립해야 그는 한 인간으로서 홀로 설 수 있으며, 새로운 영웅으로 탄생할 수 있다. 이제 외디푸스 콤플렉스에서 벗어난 피터는 성숙한 영웅으로 재탄생한 것이다.",이수경 ( Lee Sookyung ),2018,https://www.riss.kr/link?id=A100680950
ALTA(미국문학번역협회) 소개,"미국에서는 문학번역에 대한 이해가 일천하며, 심지어 문학번역에 대한 올바른 평가는 더더욱 열악하다. 본 논문에서는 ALTA(미국문학번역협회)를 소개하고, 일련의 서비스 및 활동을 통해 문학번역의 위상을 제고하고자 하는 ALTA 의 임무를 설명하겠다.
1979 년에 제 1 회 전미 총회가 이루어진 이래로 ALTA 는 전세계 문학번역가들을 위해 독특한 임무를 수행해 왔다. 20 년이라는 기간 동안 ALTA 는 문학번역가들을 위한 서비스 제공, 문학번역의 이론과 실제에 관한 포럼 주최, 전세계 문학번역가들과의 협력, 문학번역가들의 권익대변 등의 활동을 통해 문학번역의 위상제고를 꾀하는 광범위한 기반을 갖춘 조직으로 성장했다.ALTA는 미국 유일의 문학번역 전문조직이다.
ALTA 회원들에게는 ""Translation Review"" 라는 잡지를 발송한다. 여기에는 번역가와의 인터뷰, 번역의 이론과 실제, 대학에서의 번역 수업, 문학작품의 해석을 위한 번역 방법론 적용에 관한 기사, 출판사 소개, 문학번역 출판의 동향, 번역 프로세스와 번역물의 평가에 중점을 두는 리뷰 등이 실린다. ALTA가 발행하는 ""Annotated Books Received"" 는 최신 번역물 목록으로서, 각 번역물에 대한 주석이 함께 제공된다. ""Newsletter"" 라는 소식지는 회원현황, 지원금, 회의일정, 수상소식 등 문학번역계의 관심사를 전한다. ""ALTA Guides to Literary Translation"" 은 초보에서 베테랑에 이르는 모든 번역가들을 위한 실용적인 조언을 제공한다. ALTA의 웹사이트는 계속 확장 중이며, 여기서는 번역활동, 회원현황, 연례총회 소식, ""Annotated Book"" 발췌, ""Translation Review"" 최 신호 등을 볼 수 있다.
ALTA의 연례총회는 현재 문학번역계에서 일어나는 일에 대해 토론하는 장으로서 한 해 행사의 하이라이트이다. ALTA 의 연례총회는 문학번역가들이 자신의 최신 번역물을 선보이고, 서로의 경험과 지식을 공유하며, 공통의 문제에 대해 토론할 수 있는 기회를 제공한다. 여기에는 출판사와 작가들도 참석한다. ALTA 에서는 번역입문자들이 ALTA 연례총회에 와서 참석할 수 있도록 특별경비를 지원하기도 한다.
ALTA 는 문학번역의 뛰어난 업적을 기리기 위해 전미번역상을 수여하고 있다. 이상은 출판계의 후보지명으로부터 시작하여 번역물에 대해 문학적 중요성, 충실성, 예술성의 관점에서 3차에 걸친 철저한 심사에 이르는 1 년 여의 긴 과정의 결정체이다.
지난 27 년간 ALTA 는 문학번역의 위상을 제고하기 위해 많은 일을 해왔다. 물론 아직도 할 일이 많이 남아 있으며, ALTA의 회원들은 한결 같은 헌신과 열의를 통해 이를 이루어 갈 것이다.",존 발콤,2005,https://www.riss.kr/link?id=A82576000
라이선스 뮤지컬 문화소 번역 사례 연구: 〈렌트〉를 중심으로,,"강인혜(Kang, Inhae)",2021,https://www.riss.kr/link?id=A106303117
역번역을 통한 기계번역의 한계와 발전 가능성 제고: 『채식주의자』를 중심으로,"이 연구는 기계번역이 한국어와 영어 문장에 대해 인지하는 수준을 파악하고, 원작이 전달하고자 하는 의미를 어느 정도 효과적으로 반영할 수 있는지를 알아보고자 하였다. 이를 위해 작가 한강의 소설 『채식주의자』를 구글 번역을 통해 번역하고 그 결과물을 다시 기계번역으로 역번역하여 원전과 얼마나 의미 차이가 발생하며, 기계번역이 의미 도출에 있어 원전에 대한 충실성이 어느 정도까지 결여되어 있는지를 살펴봄으로써 기계번역의 현주소를 확인하고자 하였다. 특히 작품에서 주인공 영혜를 묘사하거나 영혜가 채식주의자가 되어가는 과정 및 사건에 관해 그려지는 작품 내 대화 등을 살펴봄으로써 역번역 시 어떠한 결과물이 도출되는가에 무게를 두었다.
기계번역 시 드러나는 문제점 중 단어 수준의 등가성 확보는 여전히 문맥의 의미를 제대로 파악하지 못해 발생하는 동음이의어의 채택 등의 문제를 야기했다. 더불어 문장의 구조가 정확하지 못한 경우, 가령 주어가 생략된 문장의 역번역은 구조뿐 아니라 의미상으로도 정확하지 못한 문장을 생성해냄을 알 수 있었다. 이로써 기계번역이 여전히 코퍼스의 활용이 더욱 왕성하게 이루어져야 번역상의 오류가 감소할 수 있음을 가늠하게 한다.
역번역을 수행함에 있어 기계번역을 활용한 것은 오역의 발생지점을 파악하는 데 도움이 되었고, 이로써 기계번역의 코퍼스 활용의 문제와 한계에 대해 알 수 있었다.",김혜경 ( Kim Hyekyung ),2019,https://www.riss.kr/link?id=A108761962
중한 기사제목에서의 은유 번역 연구,,"류스원(Liu, Si-Yuan)",2021,https://www.riss.kr/link?id=A105677069
이연주 시에 나타난 질병 모티프의 이중성,"본고는 이연주 시에 나타난 질병 모티프를 중심으로 질병 모티프의 상징과시의 화자의 이중성에 대해 구체적으로 고찰하였다. 이연주 시에서 질병 모티프는 다양한 시편에서 발견된다. 현대 문학에 있어서 질병은 중요한 상징이나 비유의 대상으로 주제학의 영역에서 상징적 주제의 의미를 포착하는 데 있어서 유의미하게 작동한다. 질병은 문학적으로 중요한 징표이자 시대사적 징후의 표상이기 때문이다. 질병 모티프는 사회 질서를 둘러싼 관심을 표명하는 데에 사용되며 질병에 대한 은유들은 개인과 사회 간의 격심한 불안정을 드러낸다.
이러한 맥락에서 이연주 시의 질병 모티프는 크게 두 가지 범주로 나누어 살필 수 있다. 첫째 시의 화자가 맺고 있는 타자와의 관계 양상을 상징하기 위해 사용된 모티프이다. 위험한 시절의 진료소 연작시를 통해 살펴본 시의 화자와 타자의 관계는 질병 모티프를 통해 구체화 된다. 관계로부터 기인한 서정을 이중적으로 표현함에 있어 질병 모티프를 사용하고 있어 시사적이다. 둘째, 시의 화자와 세계의 관계를 상징하는 데 질병 모티프가 사용되고 있다. 화자는 세계에 대한 영향으로 인해 질병 상황에 놓이게 됐다. 그럼에도 세계에 대한 관심을 그칠 수 없다는 이중성을 드러내는데 질병 모티프를 동원하고 있다.
이렇듯 이연주 시의 질병에 대한 모티프들은 대상에 대한 이중성을 드러내며 화자가 선택하지 못하는 모습과 그로 인해 모두 실패하는 모습을 전시해 시의 비극성을 높이고 있다. 또한 구체적인 질병의 명칭을 시어로 사용함으로써 질병 자체가 갖는 고통의 환기를 통해 시인의 부정적인 세계관이 돋보이기도 했다. 이연주 시인은 질병 모티프를 통해 화자의 이중성을 드러내며 시에 대한 다양한 해석의 가능성을 제시한다는 점에 있어 질병 모티프의 유의미함을 확인할 수 있다.",김지은 ( Kim Ji Eun ),2021,https://www.riss.kr/link?id=A100680961
<벼랑위의 포뇨>에 나타난 미야자키 하야오의 작가의식 연구: 원천 서사 분석을 중심으로,"<벼랑위의 포뇨>는 2008년 개봉한 미야자키 하야오 감독의 장편 애니메이션 영화로 우라시마 타로 에서 멜뤼진 , 운디네 , 인어공주 까지 풍부한 원천 서사를 그 배경에 두고 있다. 포뇨의 원천 서사들은 당대의 이상화된 여성상을 비추는 동시에 자연을 인식하는 당시 사람들의 방식을 드러내고 있다. 뛰어난 이야기는 시대의 현실에 대한 고민과 고민에 대한 탐색을 함께 담고 있으며, <벼랑위의포뇨> 또한 옛이야기의 틀을 깨고 새로운 의미들을 만들어냄으로써 시대의 부름에 응하고 있다. 이렇게 만들어진 새로운 의미는 시대를 읽는 미야자키 하야오의 예민한 작가의식으로 인한 것으로, 작품 안에서 성장과 변화의 주체로서 새로운 유형의 주인공인 포뇨, 포뇨와 소스케의 대등한 관계를 그려낸 인간과 자연이 조화를 이루는 대통합의 세계, 대통합의 동력이 되는 강하고 역동적인 인어 포뇨와 바다 어머니그란만마레 등 능동적이고 강인한 여성상으로 드러나고 있다. 이는 원천 서사 속에 나타나는 타인에 의해서만 성장변화할수 있는 주인공, 한쪽이 다른 한쪽에 일방적으로 의존하는 남녀 관계, 결합에만 적극적일 뿐 수동적인 모습을 보이는 여성상과는 확연히 구별된다. <벼랑위의 포뇨>는 이렇게 원천 서사를 뛰어넘어 시대의 부름에 호응하는 의미를 만들어냄으로써 ‘새로 쓴 이야기’로서의 가치를 스스로 증명하고 있다.",최미경 ( Mi Kioung Choi ),2014,https://www.riss.kr/link?id=A100680956
『배고픈 애벌레』와 『깊은 밤 부엌에서』에 나타난 전능적 판타지 읽기,"영아는 엄마의 젖가슴에 안겨 우유를 먹으면서 마법적인 전능감과 쥬이쌍스를 만끽한다. 그러나 이유기를 거치는 동안 이런 원초적인 기쁨과 즐거움이 상실된다. 그 결과 전이대상과의 놀이를 통해 이전의 느꼈던 전능적 쾌락을 되찾고자 하는 무의식적인 욕망이 환상들로 표출하게 되는데 이를 전능한 판타지라 한다.
『배고픈 애벌레』는 작은 애벌레가 자라서 나비가 되는 이야기로 이를 피아제의 발달이론에 적용하면 감각운동기에 속한 어린 영아가 성장하면서 겪어 가는 인지적 발달과정을 보여준다. 영아는 모유를 먹으면서 원초적인 전능감과 쥬이쌍스를 경험한다. 이 이야기에서 유아에게 원초적인 어머니는 대상 아(objet a)로 기능하게 되고 이러한 환상적 과정을 통하여 전능적 판타지가 만들어 진다.
『깊은 밤 부엌에서』는 전조작기에 속한 2-3살의 어린 유아인 미키가 한밤중에 꾸는 꿈을 보여준다. 미키의 꿈은 전능적인 환상의 형태로 나타나며 여기에는 그의 무의식적인 욕망을 표상되어 있는데, 이는 잃어버린 전능감과 쥬아쌍스를 회복하려는 심리적인 노력의 일환이다. 내면의 결핍을 느끼는 미키는자신의 꿈을 통해 억압된 소망과 욕구를 전능적 판타지를 통하여 투사시킨다.",이영준 ( Lee Youngzun ),2019,https://www.riss.kr/link?id=A108732057
『오만과 편견』의 언어적 아이러니 번역 고찰,"제인 오스틴은 『오만과 편견』을 한편의 희극처럼 구성하여 당시 영국인들에게 만연한 물질주의와 그로 인해 생기는 사람에 대한 편견, 사랑보다 재물을 중요시하는 결혼관 등을 언어적 아이러니를 통하여 비판하고 있다. 번역은 원문의 내용을 살리면서 작가의 창작의도를 충실히 살려야 한다. 이 작품의 경우 아이러니 수법을 충실히 살려야 작가의 창작의도를 잘 번역했다고 할 수 있다.
이 작품은 최근에도 매년 두 세 종의 번역본이 새로 출간될 만큼 수많은 번역본이 출간되었고, 많은 연구가 이루어진 상태이다. 원전에 대한 연구는 사회적 연구 및 시대상황에 대한 연구가 주를 이룬다. 번역본에 대한 연구는 대부분 오역의 문제를 다루고 있으며 아이러니의 번역에 대한 연구는 거의 없다.
본 연구는 최근 번역본 3종을 선택하여 오스틴의 언어적 아이러니를 어떻게 번역하였는가를 살펴보았다. 그 결과 지나친 오역이나 변조 등은 거의 보이지 않아 내용의 충실성은 어느 정도 담보된 것으로 밝혀졌다. 다만 언어적 아이러니를 잘 살리지 못하였다. 이는 『오만과 편견』이 대중성이 높은 소설이기 때문에 다양한 독자층을 만족시키기 위해 가독성 높은 번역 전략을 택하면서 언어적 아이러니의 번역에 특별한 전략을 수립하지 않았기 때문으로 생각된다.",김태훈 ( Kim Taehoon ),2018,https://www.riss.kr/link?id=A77273925
