
한국과 일본의 영어 교육 비교 연구,"ABTRACTThe present study surveys the historical background of English teaching in japan, which Korea inherited and has made its own tradition.The Japanese history of English teaching has had two periods during which English was popularly learned with the kind of enthusiasm that has not been seen in other times. One was the Meiji period When all subjects on the curriculum of the middle school and upwards were taught in English by Western teachers with books written in English, and the other the period of American occupation beginning with the end of the war, when the ability of spoken English was almost an essential condition for advancing one's career.In other times, the status of English was recognized only as one of the most important subjects of the examination for entrance into the university. This was a situation for which the grammar-translation method of teaching was the most effective, making it difficult for any communication-oriented method to be adopted in schools of formal educationThe national controversies, characteristic if English teaching in Japan, over whether English should be included in the curriculum of the middle school are traced partly to public dissatisfaction with the low level of English proficiency of high school and university graduates vis-a-vis the time spent on learning the foreign language,partly to nationalism of the Japanese people, and partly on the ideology of English education.English was introduced to Korea along routes different from the way it came to Japan. and had been taught to a small number of people by a communication-centered method until 1919, when Japan replaced with its own the traditional Korean educational system including English teaching. It can be said that English teaching in Korea actually started with the imposition of the Japanese educational system in Korea, and has thus inherited the Japanese tradition of English teaching. It is this historical background that makes the history and tradition of English teaching of Japan meaningful to us.It is revealed by this survey that progress in the teaching of foreign",조용남,1991,https://www.riss.kr/link?id=A2112155
비교문화적 화용론에 기초한 한국어의 화용 교육,"People who grew up in a completely different cultural environment will have difficulty in deciding what kind of verbal reaction they are expected to show; this is due to the cultural differences they have in their life style, attitude and way of thinking.",이해영 ( Lee Hae Yeong ),2002,https://www.riss.kr/link?id=A75594957
언어이론과 영어교육,"The outcome of this study suggests that some of the linguistic, especially semantic, theories be applied to actual English teaching. As for the applicability of the theories, the Standard theory with its feature analysis helps the ESL students to understand English ambiguity and synonyms better; Thematic roles as part of semantic theories have made it easier for them to have a thorough grasp of the underlying logical meaning of the surface forms; Performative theory shed light on the illocutionary force of linguistic meaning; and Discourse analysis, for its part, puts much emphasis on the appropriateness of language use, differentiating between written and conversational English according to its formality / informality.
In view of such pedagogical of the above and other contributory factors- psychomotor, cognitive- in the Facilitation of teaching and learning English as a foreign language for Korean ESL students, the present writer as a teacher of English takes the that appliction of semantic theories can be effectively pursue(B as pedagogical entities.",이웅호,1998,https://www.riss.kr/link?id=A2105290
AI 챗봇 활용 국내 영어학습의 효과 메타분석,"This study aims to investigate the effects of using AI chatbots in Korean English education from a macro perspective. For this purpose, 19 experimental studies are selected to conduct a meta-analysis, synthesizing the results of 51 individual study cases. The results of this study are as follows: First, it is found that the overall effect size of using chatbots is more than medium size meaning that a chatbot is an effective tool to learn English. Second, in the aspects of linguistic competence and affective categories, each shows over medium sizes like the overall effect size. In details of the dependent variables, vocabulary and speaking in linguistic competence and motivation in affective categories, large effect sizes are shown. Third, the effect sizes are getting larger, as the younger the students are, the longer the experiment period lasts, and the more purpose-built the chatbot is. But the differences in the effect sizes in terms of these moderators (e.g., school level, experiment period, and chatbot type) are not significant. Lastly, it is suggested that follow-up studies are needed to collect a sufficient number of experimental study cases and subdivide the variables for performing a more detailed meta-anlysis.",서소담,2023,https://www.riss.kr/link?id=A108754503
"""세종학당용 초급 한국어 표준교재""개발을 위한 교수요목 설계 방안 연구","This study aims to develop a syllabus of ``Korean Language Textbook for Sejong Hakdang; Beginner level``. which will be distributed and used as a main teaching material in Sejong Hakdangs in overseas. Sejong Hakdang is a brand of Korean educational facility and program for Korean learners found by the National Institute of the Korean Language. Educators and Students at Sejong Hakdangs has demanded textbooks customized according to their curriculum and educational environment, ``Korean Language Textbook for Sejong Hakdang; Beginner level`` is being developed to this needs. This study will demonstrate the principles and process of designing the syllabus that is the framework of ``Korean Language Textbook for Sejong Hakdang; Beginner level``. And the study will also examine and analyse the current state of overseas Sejong Hakdangs focusing on their curriculum and teaching hours so as to apply the their needs to the syllabus design. The syllabus that will be presented in this study consist of 26 units excluding 3 preliminary units. The 26 units are divided into 2 modules, one with 12 units, the other with 14 units. This ``2 modules 26 units`` system is designed to maximize the instructional efficiency considering current curricula of overseas Sejong Hakdangs in the perspective that overseas Sejong Hakdangs has a need of the textbook with smaller teaching units for their limited teaching hour. This study will discuss more characteristics of the syllabus related to the other constructs of the syllabus.",김정숙 ( Chung Sook Kim ),2011,https://www.riss.kr/link?id=A75591019
구글 번역기와 네이버 파파고 번역기의 스페인어-한국어 기사 번역 오류 유형 분석,.,양성혜,2022,https://www.riss.kr/link?id=A82638259
정보화 시대의 이중언어교육,"This paper aims to emphasize the need of bilingual education not only the minority students, but also for every students in the world. Since this century is called knowledge-Informationization era, knowing more than two languages is almost necessary. This",박영순 ( Park Yeong Sun ),2002,https://www.riss.kr/link?id=A102450668
"한국어 학습자의 인지적,정의적 개인차 요인과 제2언어 성취 간의 관계","This paper investigates the relationships of cognitive and affective individual difference variables (i.e., second language [L2] aptitude and L2 learning motivation, respectively) to proficiency and achievement in Korean as a second language (KSL) for Chinese learners of Korean enrolled in a university-affiliated Korean language institute. The data were analyzed by a variety of statistical methods involving correlation multiple regression. The subtest scores of the aptitude test battery showed strong correlation with overall L2 proficiency and achievement in speaking, listening, reading, and vocabulary and grammar, while measures of the attitude/motivation test battery also corre1ated with L2 success in reading and speaking to a certain extent. The present study contributed to an in-depth understanding of factors that influence success in KSL and highlighted utility of the aptitude and attitude/motivation test batteries used in this study for predicting L2 success of learners of Korean. Implications for further research and limitations of the present study were also discussed.",이은하 ( Eun Ha Lee ),2011,https://www.riss.kr/link?id=A87003113
중국인 한국어 학습자의 발음 오류와 지도방법,"The aim of this paper is to survey the reasons behind the Chinese native speakers`` errors when they pronounce Korean and to present the appropriate teaching methods of pronunciation. The main reasons of their errors in pronunciation are induced from retroflexes and tone. Retroflexes cause the point of articulation to move more backwards that the point where real Korean sound is made. And tone influences the way a sound is articulated. Because of the influence of tone, Chinese learners tend to neglect the correct way of articulation in the mouth, even though it is an important factor in distinguishing Korean sounds. So for the teaching pronunciation, teachers should make the learners`` tongue to be flat to pronounce non-retroflexes. When teachers present the sounds and the way of articulation, by her or himself, it is more efficient than presenting it through other methods to change their habit to pronounce.",백소영 ( So Young Paik ),2008,https://www.riss.kr/link?id=A87014716
외국어로서의 한국어 문법 교육 - 한국어 교육 문법의 제시 원리와 체계를 중심으로 -,"This paper defines Korean grammar for foreign learners as what helps them communicate effectively in Korean through providing them with substantial, not abstract, grammatical knowledge about the specific meanings and functions of grammatical forms. With t",김재욱 ( Kim Jae Ug ),2003,https://www.riss.kr/link?id=A108086764
한국어 학습자의 외국어 불안과 모험시도가 학업성취도에 미치는 영향,"Bilingual Research 45, 27-49. The purpose of this study is to investigate foreign language anxiety and risk-taking of Korean language learners and the correlation between them and achievement. The study employs two questionnaires for foreign language anxiety and risk-taking, and one evaluation test for achievement. in this study, There are 179 participants who study Korean with academic purpose. The results of this study showed that them are specific aspects of foreign language anxiety and risk-taking on the learners` variables and a negative correlation was found between foreign language anxiety and achievement, especially, between foreign language anxiety and productive skills such as speaking and writing. On the other hand, it was only found a positive relationship between risk-taking and achievement on the advanced-level. And there isn`t any correlation between foreign language anxiety and risk-taking. (Kyung Mae University)",권유진 ( You Jin Kwon ),2011,https://www.riss.kr/link?id=A82367706
담화 분석을 통한 한국어 간접 인용 표현 교육 방안 연구,"With the increasing importance of speaking-centric communication skills in Korean education, more and more interest bas been invested in functional grammar in recent years. Grammar appears when language is actually used during a conversation from the perspective of functional grammar, being formed by various discourse factors outside the language structure. When taking that perspective to look at grammar, it is required to offer speech acts in which indirect quotation expressions are implemented and promote their natural uses instead of restricting them to sentence grammar. One of the important goals of grammar education is to help the students increase the ability to express a sentence of their intent by making proper use of a grammar item after studying it. If the students in the intermediate or advanced level fail to make proper use of indirect quotation expressions even after studying them, the teacher should check if there is any deficiency with educational content and method. In that sense, this study set out to examine what functions indirect quotation expressions would implement in spoken language with drama scripts and discuss what should be supplemented in the method by which to teach indirect quotation expressions in the current teaching materials for Korean education.",김지혜 ( Ji Hye Kim ),2011,https://www.riss.kr/link?id=A82420251
원인'과 '결과' 구문의 통사론 및 의미론적 고찰,"Causative construction has been worked upon from the syntactic point of view in many languages. In English, verbs such as 'make', 'let', and 'have' are considered syntactic causative verbs. The equivalent of 'do' and 'make' in other languages have often been used as the syntactic causative verbs.
Semantically, however, there is no reason why verbs such as 'order', 'request' cannot be causative verbs. Semantically causation includes a 'cause', and 'effect'. The causing event, 'cause' is frequently contained in the main clause and the desired event, 'effect ' in the embedded clause. When the main verb is, for instance, 'make' in an English causative sentence, it is not clear what the causing event may be although there must be a certain event which occurred to make the desired event happen. When the verb is 'order', it is a little clearer to understand what the causing event may be. The causer gives an order, verbally or in writing, which is intended to make the desired event happen.
In this paper, we argue that in case of Korean, there is a match between syntax and semantics in the causative construction as the same complementizer 'key' or' tolok' is used. This is very different from the case of English because in English three different syntactic structures are used - bare infinitive, to-infinitive, and 'in order that' clause. Japanese uses two different syntactic structures, one of them including a morphological process using a causative morpheme 'sase', and the other using a complementizer 'yooni'. Thai behaves rather Elte Korean in the sense that one element 'hay (give)' can be used to cover the entirety of the semantic causative phenomenon. One difference between Thai and Korean is, though, that in Thai there can be two other ways besides using 'hay' to express the syntactic causative construction, which are to use the verb 'tham (do)' or 'tham hay' together.
Based on what we have seen so far, we can have the following continuum of match-mismatch relation between syntax and semantics for the causative phenomenon.",김경안,1997,https://www.riss.kr/link?id=A82367708
브라질 오순절 운동의 토착화,"This article is to look into transformation of the Brazilian pentecostalism in the process of development. To do this project, I prefer to use the categories of inculturation of Christianity.
For better understanding of pentecostalism of Brazil, I analyze a brief historical background of Brazilian Protestantism. Although the methodology of phenomenology of religion I use is largely ahistorical, its application does not deny or reject relevant historical facts for interpretation. And I intend to develop a preliminary understanding of two contextual aspects of pentecostalism in Brazil : the cultural aspect and the religious aspect. The cultural aspect influenced brazilian to accept new movement of Christianity, and the religious aspect led brazilian to make their own indigenous or syncretistic folk Christianity.
Among these different types of Brazilian Christianity, I find the indigenous religious patterns by using the categories of contextualization of religion: (1) syncretization of pentecostalism (2) weakness of speaking in tongues (3) emphasizing worship service of women (4) belief in empowerment of pastors as God's sacred people. These indigenous patterns of Brazilian Pentecostalism must be a major cultrual reason for the church growth of Brazil.",김영철,2004,https://www.riss.kr/link?id=A87014746
한국어와 영어의 양태 표현에 대한 대조적 고찰: 부정과 관련한 문법 현상을 중심으로,"In this study, I examine the modal expressions of Korean and English, and contrast the grammatical properties of them found in negation. In Korean, the formal categories which express modal meanings are some endings and periphrastic constructions, whereas",박재연 ( Bak Jae Yeon ),2003,https://www.riss.kr/link?id=A87014759
청각장애부모 가정 건청아동(CODA)의 언어발달 관련 연구 문헌분석,"The purpose of current study was to analyze the trends of research regarding CODA(children of deaf adults) by analyzing the articles from 1976 to March 2011 in international foreign journal. Seventeen studies met strict criteria for this review. The research was conducted by analyzing their participants, research methods, independent, dependent variable, and results. The results explained that hearing children born to deaf parents are often called CODAs or codas. Many of these hearing children grow up in a deaf-culture environment that ASL (American sign language) is a legitimate language for family interaction. So they are considered bimodal (two different modalities of sign and speech) bilingual and bicultural in that they potentially share the language and culture of their Deaf parents. Some studies related CODA have been expressed serious concern about the potential for spoken language delay base upon the presumption that the child lacks adequate speech input in the home environment. and other studies have been concluded that CODA do develop speech and language normally. We discussed the implication regarding research trends of the language environment and development of CODA. If the research of this parts continue, it can be able to develop useful bilingual research of bimodal environment that have clinical application and more meaningful work.",이은주 ( Eun Ju Lee ),2011,https://www.riss.kr/link?id=A87014725
세기 전환기의 스페인 문학 - 모데르니스모 미학과 98 세대의 정신사적 배경 -,"Este trabajo trata de investigar 1os fundamentos del cambio histo′rico del pensamiento y la literatura espan～oles en la e′poca que va de finales del siglo pasado al nuestro. En Europa esta e′poca finisecular y novosecular ha sido marcada por el predominio del arte modernista. Parece un camino necesario y efectivo, a nuestro propo′sito de clarificar las bases del arte y la culture finisecular de Espan～a, identificar ante todo lo que diferencia el Modernismo hispa′nico del Modernism europeo ; el uno se refiere a un movimiento que se inicia con el contacto con el simbolismo france′s y se propaga en toda la Hispanoame′rica y Espan～a durante la primers mitad del siglo XX, y el otro, te′rmino general referente a la nueva era de las industri′as, las ideas y las artes que veni′a forma′ndose desde la e′poca ilustrada intensificadas aun ma′s en los u′ltimos dos siglos. Es claro que el modernismo espan～ol forma parte del Modernism europeo visto tanto dentro del contexto histo′rico como en los aspectos arti′stico-culturales. Sin embargo, a pesar de la contempora′neidad y su contextualidad el modernismo espan～ol se nos muestra como una variante del modernism con marcadas diferencias en los fundamentos culturales : 1a claridad mediterra′nea, el catolicismo y el resto del espi′ritu feudalista. De suerte que el Modernismo espan～ol time que ser anti-Modernista. tanto como modernista. Esta peculiaridad histo′rica, social, a idiosincra′tica viene atravesando toda la historia del Modernismo espan～ol desde la Generacio′n del 98 y el novecentismo haste la Generacio′n del 27. El ma′s obvio ejemplo to vemos en el ambiguo mundo noveli′stico de Miguel de Unamuno, modernists en su estilo y te′cnica, y antimodernista en su pensamiento y psicologi′a al resistirse a to moderno y positivista. Esta observacio′n de las caracteri′sticas de la cultura finisecular de Espan～a, que transmite su legado a to largo y ancho del siglo venidero, nos hace preguntar : ¿podri′amos averiguar con aquella observacibn el futuro del arte espn～ol finisecular del siglo XX? Si′, todavi′a hoy en di′a prevalece las idosincraci′as nacionales a identidades culturales, pero el mundo ya postmodernista ha cambiado demasiado pare hablar de una equivalenaa entre los dos tiempos finiseculares.",김춘진,1998,https://www.riss.kr/link?id=A82420250
『백년의 고독』,"Hoy en dia, los criticos coreanos tienen mucho interes en 『Cien anos de soledad』 de Gabriel Garcia Marquez. En los anos noventa la mayoria de los escritores coreanos tratan de escribir obras fantasticas para huir de la realidad. Pero Hwang Suk-Young ha buscado una posibilidad nueva de la literatura fantastica en su obra 『El visitante』. En esta obra el escritor intenta curar el trauma de la guerra civil coreana, haciendo vivir los muertos con los vivos. Los criticos coreanos han aplaudido a esta obra porque ha buscado una nueva posibilidad en las obras realistas. Sin embargo, la convivencia de seres reales con seres irreales, es una de las caracteristicas tipicas de 『Cien anos de soledad』.
『Cien anos de soledad』de Gabriel Garcia Marquez, es la historia de la victoria y caida de la familia Buendia durante cien anos, y esta construida en tres grandes partes: la epoca de las mitologias, de las historias y de la literatura. En <la epoca de las mitologias>, que es una prehistoria de Macondo, el autor nos muestra tres codigos importantes para entender toda la historia de la obra. Primero, el nos narra el nacimiento y el miedo de la caida de la familia Buendia y de Macondo por el incesto; el segundo, su encuentro con la cultura extranjera que causara la caida de Macondo; y el ultimo, la historia oral de Francisco. <La epoca de las historias> trata dos conflictos que occurieron realmente en la historia colombiana, en dos heroes. La historia del coronel Aureliano Buendia es la historia de la guerra de mil dias y la de Jose Arcadio Segundo, de la huelga de los bananeros en Cienaga. En Colombia, hay dos movimientos revolucionarios en cien anos.
Los revolucionarios colombianos intentan construir la Utopia Liberal en la segunda parte del siglo ⅩⅠⅩ y la Utopia socialista en los comienzos del siglo ⅩⅩ. Garcia Marquez nos narra el proceso y la caida de los dos movimientos reales en la obra. <La epoca de la literatura> tiene relacion con la autobiografia de Garcia Marquez. En esta epoca el autor nos narra dos trabajos principales, uno es el trabajo de Aureliano Babilonia y el segundo, el amor autentico de los amantes. Aureliano Babilonia se metio en una habitacion cerrada para resolver los manuscritos de Melquiades. Este acto nos muestra que Aureliano tiene caracter de los intelectos que tratan buscar las causas y respuestas de la realidad colombiana.
El mito del incesto es el codigo principal de 『Cien anos de soledad』. Toda la historia de Macondo tiene relacion con este mito. Todos los hombres tienen deseo del incesto; las mujeres, miedo de la caida por el incesto. Pero, hay que romper este miedo para construir la nueva sociedad. El mito del incesto se perpecto cuando regreso el nuevo representante Amaranta Ursula despues de la muerte de Ursula. Aureliano y Amaranta Ursula son los seres mas felices del mundo por el amor autentico, y su cosecha, el ultimo Aureliano que tiene cola ed cerdo, no significa la caida fatal de Macondo sino el comienzo del nuevo mito y de la sociedad nueva.",김용호,2002,https://www.riss.kr/link?id=A97762920
스페인어 초급수준 학습자를 대상으로 한 PBL 활용 스페인어 청취 수업,"Unlike the PBL-based listening lessons conducted twice, this study is the operation and results of the classes for beginner level Spanish learners. They were beginner level learners prior to their Spanish acquisition experience in Mexico, so we prepared a lecture class to help them perform PBL tasks. Rather than preparing something new, we reviewed and used some of the very basic things we had learned in the past, and made sure that the topics in Module 1 and 2 were linked. For the PBL effect research method, we choose a hybrid research method that integrates quantitative and qualitative methods, which is a method to enhance the validity of the research and is based on a practical statement about self-directed learning ability, which is the purpose of using PBL. As a result of pre-post survey analysis, the overall post-scores of both problem solving ability and cooperative efficacy were significantly higher than pre-scores. In all five sub-domains of problem solving ability, post-score scores were higher than in pre-scores, and the four sub-fields of cooperative efficacy increased. In terms of class satisfaction, ‘enough time and effort devotion’ and ‘helping to deepen their major knowledge’ were the highest. Through the analysis of the reflection journals in Modules 1 and 2, it was found that the students' listening experience in Spanish, which is the biggest learning goal of the subject, was achieved through direct contact with native speakers and subtitle processing of interview videos during the PBL assignment, and that they were able to develop self-directed learning methods by considering the existing learning methods by themselves while recognizing the difficulty of listening or communicating during the assignment. It was also a positive factor that the burden of dialogue with foreigners was reduced through the experience of contact with native speakers during the assignment, and that they could understand the culture of Latin American countries.",심영식,2020,https://www.riss.kr/link?id=A82367714
