
"대학에서 글쓰기 교육을 한다는 것, 그 돌아보기와 내다보기","대학 글쓰기 교육을 담당하는 한 축으로 교수자의 역할과 교육현장에서의 소회를 돌아보는 것은 대학 글쓰기 교육의 정체성을 찾기 위해 유의미한 작업이 될 수 있다. 이러한 과정에서 제기되는 제언들이 대학 글쓰기 교육의 방향성을 찾는 현실적인 지표가 되기를 소망한다.
논의 결과를 요약하면 다음과 같다. 2장에서는 글쓰기 교육을 전담하는 교수자의 입장에서 고민되는 두 가지 지점을 짚어보았다. 글쓰기 교육에는 여느 교양교육에서와는 다른 각도에서의 교육적 배려와 책임감이 요구되기 때문이다. 첫째, 글쓰기 이론이 여과 없이 글쓰기 교육에 적용될 수 없다는 점에서 ‘글쓰기’를 위한 이론과 별개로 ‘글쓰기 교육’을 위한 이론의 가능성을 타진해보는 것이 필요하다. 둘째, 글쓰기 행위에 대한 고민과 성찰을 전제로 교육현장에 대한 정확한 파악과 그에 맞춤한 교수법의 고안이 보다 치밀하게 이루어질 필요가 있다. 대학에서의 글쓰기 교육이 이론적 토대를 갖추게 된다면, 글쓰기 교수자들의 문제의식과 이를 토대로 한 현장보고가 유용하고 유의미하며 유효한 필터링의 역할을 해주게 될 것이며, 또 그런 역할을 해주어야 할 것이다.
3장에서는 대학에서 글쓰기 교육을 한다는 것의 지향점을 두 가지로 나누어 살펴보았다. 그 하나는 대학시절의 글쓰기 경험치에 대한 주목으로, 대학생을 대상으로 한 글쓰기 교육의 현실적 필요성에 대해 고민하고 제대로 방향잡기를 하고 있는가 하는 문제에 관심을 갖는 것이 중요하다는 점이다. 이에 학술적 글쓰기에 대한 비중 강화와, 자기성찰의 글쓰기에 대한 효율적인 연습을 제안하였다. 다른 하나는, 교과과정에 대한 이해를 보다 확대할 필요가 있다는 점이다. 효율적인 교과과정을 구성하는 것은 다양한 교수자들의 개성적인 교수법이 허용되는 기본토대로 작용할 수 있을 것이며, 대학생을 위한 글쓰기 교육의 구심점으로 제 역할을 해낼 수 있을 것이다.",최규수,2015,https://www.riss.kr/link?id=A100005622
대학 글쓰기 교육의 목표 설정과 지식 정보화 시대의 대응,"이 논문에서는 우선 대학 글쓰기 교육의 목표가 무엇인가를 탐색하고 있다. 대학 글쓰기 교육의 목표는 일차적으로 신입생 글쓰기 교육을 통해 전공 글쓰기에 도움이 되고자 하는 것이다. 미국과 한국의 여러 대학들도 학생들이 대학의 학술 텍스트를 잘 쓰기 위해 대학. 글쓰기 교육을 도입하였다. 이런 측면에서 보면 대학 글쓰기 교육의 주된 목표는 학술적 글쓰기 교육이라고 말할 수 있을 것이다. 반면에 이와 다른 관점에서 대학 글쓰기 교육을 바라보는 관점도 있다. 그것은 표현주의 입장으로, 글쓰기를 통해 개인의 자기 탐색, 자기 성찰을 중요하게 생각하는 관점이다. 한국에서 표현주의의 입장은 학술적 글쓰기와의 결합을 통해 개인적 관점과 사회적 관점의 조합을 추구하고 있다. 세 번째로 대학 글쓰기 교육을 인문학적 사고의 학습으로 보는 관점이 있다. 외국어 교육과 다르게 자국어 대학 글쓰기 교육은 다양한 고전의 학습과 함께 인문학적 사고와 성철을 수반하기 때문에 인문학적 교육으로 보아야 한다는 것이다.
대학 글쓰기 교육에서 이렇게 다른 세 가지 관점은 서로 상이한 철학을 지니지만 서로 혼용되어 사용될 수도 있다. 국내 대학들은 대체로 이 세 가지 관점을 섞어서 많이 사용하고 있으며, 학생들의 학술적 쓰기 능력과 자기 성찰, 사회적 비판의식 모두들 소중하게 생각한다. 이보다 대학 글쓰기 교육에서 더 중요하게 바라보아야 할 관점은 지식 정보화 시대에 디지털 글쓰기의 도전과 대응이다. 디지털 시대의 글쓰기는 쓰기 주체의 문제, 소통의 문제, 쓰기 교육의 문제를 다시 돌아보게 한다. 디지털 시대 대학 글쓰기는 매체나 도구의 다양성에도 불구하고 여전히 학생들의 쓰기 능력을 향상시키는 데 중점을 두어야 한다. 아울러 학생들이 자신의 관점을 되돌아보고, 인문학적 자기 성찰을 할 수 있도록 도와주는 것도 중요하다.",정희모,2015,https://www.riss.kr/link?id=A100140452
영화 <말아톤>에 재현된 자폐성 장애인 연구,"<말아톤>은 자폐성 장애인에 대한 사회적 관심과 인식 개선을 이끌어 낸 최초의 한국 영화로 중요한 가치가 있다. 이에 여러 분야의 연구를 통 해 이 영화의 다층적 의미가 규명되었지만 영화 속 자폐성 장애인 재현에 대한 예각화된 분석과 총체적 평가는 미비했다. 본고는 문화 연구와 장애 학을 기반으로 한 융복합 연구를 통해, <말아톤>의 주요 언어와 영상 표 현, 서사의 의미를 심층적으로 분석하고 <말아톤>에 재현된 자폐성 장애 인의 의미를 비판적으로 고찰하여 영화와 현실에서 자폐성 장애인이 배 제되지 않는 사회를 만들기 위해 개선해야 할 과제를 밝히는 것을 그 목 표로 한다. 연구결과 영화 <말아톤>은 자폐성 장애에 대한 이항대립적 오해를 바로잡고 장애인 인식 개선의 긍정적인 역할을 하고 있으며, 장애 인과 비장애인의 동반 성장 서사를 통해 장애인의 자기결정권과 사회구 성원으로서의 소통을 의미 있게 재현해 내고 있다. 그럼에도 불구하고, 여 전히 영화와 현실에서 발견되는 한계와 과제들이 있다. 자폐성 장애인을 지나치게 순수하거나 탁월한 존재로 묘사하거나 통합교육, 직업재활을 통한 자립에 대한 이해가 부족하다는 한계를 드러내고 있다. 또한 개인적 사회화를 넘어선 사회통합도 과제로 남는다.",김세령,2020,https://www.riss.kr/link?id=A105996640
‘하얀 손’에 대한 원한과 박정희 체제의 젠더 정치 - 1970년대 황석영 소설의 남성성과 민중의 젠더화 -,"본고는 박정희 체제의 초남성적 통치성과 그에 대한 대항담론이 모두 헤게모니적 남성성을 중심으로 구성되었으며, 그 약한 토대를 가리기 위해 민중을 젠더화하는 여성혐오를 사용했다는 것을 분석하고자 한다. 남성 노 동자 대 젊고 부유한 여성, 혹은 남성 노동자 대 가난으로 타락한 여성이라 는 리얼리즘 문학의 전형성은 리얼리즘 문학이 ‘민중’을 표상하는 지점을 보여준다. 박정희 체제에 저항하는 리얼리즘 문학은 남성 노동자를 초점화 자로 삼고 서사를 전개시킨다. 이 정전화 과정에서 문학사적 시민권을 획 득한 것은 남성 하위주체다. 반면 여성은 고향을 떠나 타락한 여성과 부르 주아 여성으로 양분된다. 이들의 ‘하얀 손’은 박정희 체제가 남성 주체에게 가하는 억압적 상황을 비추는 거울의 역할을 한다. 이는 백화나 미리와 같 은 여성들은 소설의 행위자가 될 수 없는 구조적 한계에서 기인한다. 한국사회의 폭력적 남성성에 대응하는 문학의 응전방식 역시 남성성을 바탕에 두고 있으며, 남성성의 재건을 통한 문학사의 창조에 초점을 맞춰왔던 것 이다. 그 결과 공백으로 남은 것은 여성 노동자의 자리다.",허윤,2020,https://www.riss.kr/link?id=A108732100
‘말 끼어들기에 대한 반응’을 둘러싼 성별 특징,"본고는 현행 연구에서 말 끼어들기 행위만을 놓고 우호, 비우호성을 판 단하는 것은 절반의 성공일 뿐이라는 판단 하에, 말 끼어들기에 대한 반 응을 유형화하여 제시하려고 한다. 끼어드는 당사자의 우호성에도 불구하 고 현행화자의 말차례가 중단된다면 말차례를 잡고 있던 현행화자로서는 자신의 말차례에 방해를 받은 것과 다름없기 때문이다. 따라서 말 끼어들 기에 대한 반응을 유형화하고, 이를 오락프로그램에 적용, 그 분포현황을 성별로 나누어 조사, 분석하였다. 그 결과, 우호적 말 끼어들기는 현행화 자의 말차례 유지가 높았고, 비우호적 말 끼어들기는 후행화자로의 말차 례 넘기기가 높았다. 그러나 말차례 넘기기는 현행화자의 말이 중단된 경 우만이 아니라 마무리된 경우를 포함하고 있어, 본고는 이를 기준으로 다시 나눠보았다. 그 결과, 남성과 달리, 여성 사회자 집단은 우호와 비우호 적 말 끼어들기 모두 현행화자의 발화가 마무리된 경우가 많았다. 이는 현행화자의 배려, 친교적 행위를 나타내는 결과이며, 따라서 여성은 기분 좋은 청자일 뿐 아니라 상대방과의 마찰을 피하면서 효과적으로 자신의 메시지를 전달할 수 있는 전략적인 화자라는 평가를 내릴 수 있었다.",강소영,2020,https://www.riss.kr/link?id=A107936273
통신 언어 사용자들의 언어 태도 고찰: 10-30대의 설문 조사를 중심으로,"본고는 통신 언어 사용자들의 언어 태도를 확인하는 것을 목적으로 한다. 초기 통신 언어는 특정 집단을 중심으로 생성, 향유되었기에 이에 관한 연구는 통신 언어를 사회 방언으로 다루는 연구가 주가 되었다. 그와 함께 또 다른 연구 방향은 기존 언어 규칙을 위반하며 일상어에 부정적인 영향을 미치는 통신언어에 대해 초점이 맞춰졌다. 그렇기에 통신 언어에 대한 교정과 언어 교육 주제를 연구자 중심에서 다룬 연구들이 많았다.
본고에서는 통신 언어에 대한 기존의 관점에서 벗어나 실제로 통신 언어를 사용하는 10대에서 30대의 인식을 설문 조사를 통해 살피며, 언어 사용자 중심에서의 통신 언어를 고찰하였다. 조사 결과를 통해 언어 사용자들이 일상어와 통신 언어에 대한 각기 다른 존재 의의와 가치를 인식하고 있다는 것을 확인할 수 있었다. 이러한 성과는 통신 언어의 사용 양상 분석만으로는 살필 수 없었던 통신 언어 사용 맥락을 확인하는 연구에 새로운 근거를 제시할 수 있으리라 생각한다.","백준영(Paik, Junyoung)",2021,https://www.riss.kr/link?id=A107840328
"알베르 카뮈의 『페스트』: 나, 우리, 반항","20세기 프랑스를 대표하는 작가 중 한 명인 카뮈에게서 ‘반항’ 개념이 갖는 의미는 아무리 강조해도 지나치지 않다. ‘부조리’와 더불어 ‘반항’은 카뮈의 작품과 사상을 관통하는 핵심 개념이기 때문이다. 이 ‘반항’ 개념과 관련하여 카뮈가 ‘집단적 반항’ 개념에도 큰 관심을 표명했다는 사실은 흥미롭다. 일반적으로 카뮈의‘코기토’로 여겨지는 “나는 반항한다, 그러므로 우리는 존재한다”라는 명제로 요약되는 이 ‘집단적 반항’이 문학적으로 가장 잘 형상화된 작품이 1947년에 출간된 『페스트』가 아닌가 한다. 이 같은 사실을 염두에 두면서 이 글에서 우리는 특히 『페스트』에서 페스트를 물리치기 위한 투쟁 중에 형성된 ‘자원보건대’의 구성원들, 그 중에서도 리외, 타루, 그랑, 랑베르의 활동에 주목해보았다. 실제로 이들 네 명은 페스트라고 하는 공동의 적과 맞서면서 ‘집단적 반항’의 결정체라고 할 수 있는 ‘우리’를 형성한다. 그런데 이 ‘우리’는 정확히 카뮈의 ‘형제-적’이라고 할 수 있는 사르트르가 ??변증법적 이성비판??에서 제시한 ‘융화집단’으로서의‘우리’의 특징을 그대로 간직하고 있는 것으로 보인다. 보다 구체적으로 『페스트』에서 자원보건대의 일원으로 활동하는 이들 네 명은 모두 ‘너’, ‘나’의 구별이 없는 ‘동지들’이고, 이들 사이의 관계는 ‘완벽한 상호성’에 의해 규정되고, 그들의 관계는 ‘편재성’에 의해 특징지어지며, 이들에 의해 형성되는 ‘우리’는 ‘페스트’라고 하는 공동의 적과의 투쟁, 곧 ‘실천’이 이루어지는 동안에만 그 존재이유를 가질 뿐이다. 아울러 우리는 이런 사실들을 바탕으로 이들 네 명이 각자 부분적으로이기는 하지만 ‘카뮈’의 모습을 구현하고 있다는 사실을 지적했다. 하지만 『페스트』에서 볼 수 있는 자원보건대로 대표되는 ‘집단적 반항’, 그리고 이 반항을 통한 ‘우리’의 형성은 지나치게 낙관적임과 동시에 구체적인 사회적, 역사적 맥락을 결여하고 있다는 비판에서 완전히 자유로울 수는 없다는 점 또한 지적했다.","변광배(Byun, Kwangbai)",2014,https://www.riss.kr/link?id=A60258269
칸트의 숭고미에 대해,"본고에서는 칸트의 숭고미(崇高美)에 묘사된 예술의 정치성에 대해 논한다. 숭고미를 쾌(快)의 감정과 연계해 논의한 다음, 낭만주의 시대 ‘천재 예술론’을 예술의 정치화 과정으로 이해해본다. 또한 사진 전시회, 추상회화 등 현대 예술에 나타나는 비구상과 병렬성의 기원을 칸트의 숭고미 및 횔덜린의 시 예술작품론에서 찾아본다. 미지의 세계에 대한 거의 확신에 가까운 기대감으로 현실의 모순과 한계를 기꺼이 극복할 수 있다는, 낭만적 사유와 행동을 보여 준, 낭만주의자들은 예술론의 근원을 미와 추(醜)가 종합적으로 체험되고 사유된 숭고미에서 가져온다. 과도한 열정과 상상력으로 무장한 그들에게 낭만적 시도란 다름 아닌 사회적 시스템의 불안정과 분열된 자아를 넘어서, 빌둥 Bildung을 통한 자아 탐색, 공동체 의식 등을 찾아 나서면서 낭만적 아이러니를 경험하는 것이었다.<br/>
숭고미 이론을 통해 예술의 경향은 구상에서 비구상으로 전환된다. 열림과 탐색, 혼돈, 비정형화, 반추 과정을 통한 새로운 생명력의 발견 등 낭만적 사고방식을 적절히 묘사하는 예술 방법론으로 비구상이 선택되고, 예술은 낭만화의 단계를 거쳐 현대의 사진 전시에 나타난 미디어의 퍼포먼스 기능으로 역할이 확대된다. 본고에서 숭고미를 쾌의 범주에 두고, 병렬성, 비구상적 예술 및 사진 전시간의 상관성을 밝혀 낭만성의 현대적 해석 가능성을 모색해본다.<br/>
숭고미의 정치성을 횔덜린의 시에 나타난 병렬성과 연계해 논의하면서, 횔덜린의 병렬적 사유 방식이 지향하는 정치성을 다름 아닌 현상에 대한 안티노미적 예술 판단을 극복해 보려는 시도로 이해할 수 있을 것이다. 시어의 병렬적 구성이 숭고미 예술의 비구상적 요소와 함께 어떻게 낭만적 사유와 행위로 구체화되어 나타나는지 살펴 볼 것이다.","김종대(Kim,Jongdae)",2014,https://www.riss.kr/link?id=A108153002
『파이돈』에서의 철학자와 즐거움,"『파이돈』에서의 육체적 즐거움에 관한 플라톤의 입장은 흔히 금욕주의적인 것으로 규정된다. 하지만 최근 몇몇 학자들은 금욕주의적인 해석에 반대하면서 새로운 해석의 방향을 제시하고 있다. 통상 ‘평가적 해석’으로 불리는 이 해석의 핵심적 주장은 『파이돈』에서 소크라테스는 육체적 즐거움을 피하거나 억누를 것을 권유하고 있는 것이 아니라 단지 그것에 대해서 올바른 태도를 취해야 한다고 말하고 있다는 것이다. 이 글의 목표는 이 두 해석의 대립을 염두에 두면서 『파이돈』에서의 즐거움에 대한 플라톤의 입장을 어떻게 이해해야 하는가를 고찰해 보는 것이다. 이 글은 육체적 즐거움에 대한 비판이 가장 두드러지는 부분들에 대해서 평가적 해석을 옹호하는 학자들이 어떤 식으로 해석하는가를 살펴본 다음, 그 해석의 타당성을 검토해 보는 방식으로 진행된다. 결론적으로 이 글에서는 평가적 해석이 즐거움에 대한 올바른 태도의 중요성을 적절히 부각시키고 있다는 장점을 가짐에도 불구하고, 여전히 한계를 가진다고 주장한다. 즉 그 해석은 육체적 즐거움이 그 태도 자체를 왜곡시킬 수 있는 힘을 가지기 때문에 그것에 대한 적극적 회피가 요구된다는 점을 간과하고 있다. 마지막 단락에서는 『파이돈』에서의 플라톤의 입장을 쾌락주의적으로 이해할 수 있다고 보는 입장의 타당성을 검토하고 왜 그 입장이 『파이돈』의 기본적 메시지와 충돌하는지를 보인다.","전헌상(Chun, Hunsang)",2018,https://www.riss.kr/link?id=A76513085
정호승 시에 나타난 연민의 작동 방식과 의미 구조,"정호승 시에서 연민은 그의 시세계를 추동하는 핵심 감정으로 작용한다. 기존 연구가 정호승 시에 나타나는 외로움, 슬픔, 사랑 등에 주목하여 그의 시세계를 보편적 정서의 전형으로 규정하는 데 치우쳤다면, 본 연구는 연민에 초점을 맞춰 마사 누스바움의 연민론을 토대로 그 작동 방식과 의미 구조를 구체적으로 분석하였다. 정호승의 시에서 연민의 작동방식과 그 의미는 ‘관찰자적 시선과 결핍된 존재의 환기 → 고통의 극대화와 시적 정의(正義)의 구현 → 존재 복원의 메타포와 연민윤리의 시적 실현’으로 확장 구조를 구축한다. 이는 정호승 연민의식의 지향점이자 정호승 시 세계의 특수성이라 할 수 있다. 이처럼 정호승이 전유하는 ‘연민의 시학’은 그의 시에 대한 그동안의 평가, 즉 서정시의 전형이라는 견고한 프레임을 넘어서는 근거이다.",이지원,2022,https://www.riss.kr/link?id=A100140470
유사 비대면 인터뷰 특징에 관한 연구 - 배구 경기 후 수훈선수 인터뷰를 중심으로 -,"본고는 코로나19로 인해 변화한 배구선수 인터뷰의 유형을 유사 비대면 인터뷰로 분류하고 기존 인터뷰와의 비교를 통해 유사 비대면 인터뷰의 특징을 분석하였다. 인터뷰의 유형 분류에 따르면 코로나19 이전의 배구선수 인터뷰는 보도용 인터뷰, 대면 인터뷰, 1:1 인터뷰에, 코로나19 이후 배구선수 인터뷰는 보도용 인터뷰, 유사 비대면 인터뷰, 2:1 인터뷰에 해당한다. ‘유사 비대면 인터뷰’란 서로의 얼굴을 볼 수 있다는 점에서 비대면 인터뷰와 차이를 보이지만 의사소통 방식이 비대면 인터뷰와 유사한 새로운 유형의 인터뷰를 말한다. 인터뷰 구조에서의 유사 비대면 인터뷰의 특징은 첫째, 시작 단계에서 인사하기 언어 행위가 생략되지 않는다. 둘째, 대면 인터뷰의 전개 단계에서는 나타나지 않았던 새로운 유형의 질문이 나타난다. 셋째, 대면 인터뷰의 종결 단계에서는 나타나지 않았던 인터뷰어의 감사하기 언어 행위가 나타난다. 인터뷰 참여자들의 발화 행위에서의 유사 비대면 인터뷰의 특징으로는 담화표지의 빈번한 사용, 빈번한 말 겹침, 빈번한 질문의 재요청과 재질문하기, 답변에 대한 후속 질문하기가 나타난다.",장지영,2022,https://www.riss.kr/link?id=A101745871
소포클레스의 오이디푸스와 프로이트의 오이디푸스,"이 글은 프로이트의 오이디푸스 콤플렉스 이론은 근본적으로 재검토되어야 한다는 생각에서 출발한다. 프로이트는 오이디푸스 콤플렉스가 모든 인간의 보편 현상이라고 단언하였고, 소포클레스의 『오이디푸스 왕』에서 이 콤플렉스가 명백히 표출되고 있음을 확인한다. 그러나 오이디푸스 콤플렉스는 참이냐 아니냐의 판단의 대상이기에 앞서 왜 프로이트는 사태를 그와 같은 방식으로 보고자 했던가에 대한 우리의 해석을 기다리고 있는 문제라고 생각된다. 프로이트는 오이디푸스 신화와 소포클레스의 비극작품을 전혀 구별하지 않고 동등하게 취급하는데, 이 또한 많은 문제점들을 안고 있다. 소포클레스의 비극작품이 오이디푸스 이야기의 가장 정교한 형태인 것은 사실이나 어디까지나 그것은 여러 버전 중의 하나일 뿐이기 때문이다. 우리는 오이디푸스 신화와 그 신화를 각색하여 아테네의 시민들에게 특정한 메시지를 전달하고자 했던 소포클레스의 비극작품을 구별해야 한다. 이를 위해서는 오이디푸스 이야기의 여러 형태들에 대한 고려와 함께 오이디푸스 신화 자체에 대한 해석이 요구된다. 이 글은 오이디푸스 이야기의 여러 층위에 대한 음미를 통해 프로이트의 오이디푸스 콤플렉스 이론이 얼마나 타당한가를 검토하고자 한다.","이성원(Lee, Sung-Won)",2016,https://www.riss.kr/link?id=A107493912
코로나 시대의 베트남 외식산업 현황 및 전망,"베트남 외식산업은 지난 2013년 이후부터 비약적인 성장을 해 왔다. 물론 베트남의 전체적인 경제 성장이 매우 가파르게 오르던 터라 외식시장도 동반 성장의 모습을 보였다.
베트남은 covid-19 발생 이후 4차에 걸친 도시 및 거주지 전면 통제적 봉쇄 조치로 경제 전체가 침체되는 시기를 보냈다. 특히 외식시장은 5개월간의 영업 제한으로 커다란 타격을 받았다. 임차료 지급을 하지 못하고 직원 월급을 못 주는 등으로 인해 소송과 어려움에 직면하게 됐다. 그러나 covid-19가 일상으로 자리 잡으면서 외식시장의 소비 패턴이 변하고 수요자들의 요구 상황에 맞는 상품을 제공하기 시작하면서 다시 반등의 기미가 보이며 점차 회복세를 찾아가고 있다. 더구나 베트남의 높은 인구 성장과 인구황금구조의 형태는 경제 성장의 강력한 견인차 역할을 하고 있다.
covid-19가 안겨준 새로운 것은 일상을 비대면으로 거래하게 했고, 이는 곧 전자상거래의 증가와 더불어 현금 사용 비중을 줄이면서 신뢰 할 수 있는 거래가 가능하게 여러 전자상거래 플랫폼이 생겨나게 했다. 외식산업도 이에 발맞춰 소비자의 요구에 맞는 외식 전자상거래 시장이 성장하고 있으며 관련된 외식 어플리케이션, 음식 배달서비스업 그리고 즉석식품·밀키트와 같은 가정 간편식의 성장을 가져오고 있다. 또한 비싼 임대료 문제로 공유주방의 등장이 베트남 외식시장의 새로운 뉴노멀이 될 것으로 기대된다.",채규진,2022,https://www.riss.kr/link?id=A108136029
