
' 동사 + 명사 ' 합성어의 형태론적 분석,"Se denomina la formacio′n de palabras al conjunto de procesos morfosinta′cticos que permiten la creacio′n de nuevas unidades a partir de morfemas le′xicos. Para former las palabras, se utilizan los afijos de derivacio′n o los diversos procedimientos de composicio′n. Es decir, se crean nuevas palabras sobre la base de las existentes por los procedimientos ma′s fa′ciles, que son la derivacio′n y la composicio′n. La composicio′n es up procedimiento de crear nuevas palabras que se presta a muchas discusiones porque no todas las lenguas lo manejan con la misma libertad. La descripcio′n y clasificacio′n de las formas que la estructura de una lengua nos lleva a describir como palabras compuestas, dependera′ de los rasgos caracteri′sticos de esta lengua. Por lo tanto, los rasgos gramaticales que nos llevan a reconocer las palabras compuestas difieren en las distintas lenguas, y algunas lenguas carecen de este tipo de formas. En espan～ol, las palabras compuestas suelen dividirse en diferentes grupos, segu′n la naturaleza de sus elementos romponentes. Entre ellos, los compuestos ma′s abundantes son los de `verbo ma′s nombre`: abrecartas, cortaviento, lavacoches, matafuego, rompecabezas, saltamontes, etc. El tipo de composicio′n consiste en que dos palabras, tales como `romper`(verbo) y `cabezas`(nombre), que significan cosas distintas, se unen para formar una tercera: rompecabezas. El tipo, que no es heredado del lati′n, es caracteri′stico de las lenguas roma′nicas y esta′ ampliamente representado en todas panes dentro de la Romania: Estos compuestos, cuya categori′a gramatical es nombre, constituyen un puente entre la morfologi′a y la sintaxis, puesto que se trata de elementos que, en su origen, eran palabras distintas y, despue′s, partes de una misma unidad le′xica. Estos compuestos tienen dos formas libres o separables entre sus constituyentes inmediatos, y las construcciones de estos compuestos son las ma′s semejantes a la construccibn sinta′ctica. El primer componente de estos compuestos se parece a una forma verbal conjugada: la historia pretende hacernos ver imperativo, pero la idea del imperative se ha olvidado y nadie ve ni imperativo ni otro tiempo alguno. En conclusion, este tipo de composicio′n procedio′ de las frases imperativas, pero hoy no tiene la idea del imperativo: solamente por causa de la energi′a latente del modelo romance se han formado los compuestos. En estos compuestos, el nombre es normalmente plural, pero puede ser singular, especialmente si es el nombre masivo o incontable. Y el plural de los dos tipos tiene la misma secuencia [verbo+nombre+morfema de plural], pero sus estructuras se diferencian, y podemos entender una interaccio′n entre composicio′n y flexio′n nume′rica. Si intentamos representar esquema′ticamente el modelo ma′s socorrido y general de formar estos compuestos, obtenemos el siguiente esquema: [elemento verbal+nombre+-(e)s]. Este modelo esta′ contribuyendo a formar una infinidad de palabras. Como procedimiento de formacio′n de palabras, el tipo de composicio′n de `verbo y nombre` es caracteri′stico de las lenguas roma′nicas, y los compuestos son numerosos como formaciones populates y ocasionales. La frecuencia en el lenguaje coloquial de los compuestos de `verbo y nombre` indica que se trata de un procedimiento de creatividad le′xica cuya vitalidad excede las restricciones del lexico′n establecido. En el sistema lingu¨i′stico virtual, este tipo de composicio′n es esencialmente ide′ntico en las lenguas roma′nicas y es comu′n a toda la Romania. En espan～ol, el modelo es productivo diacro′nieamente, comp lo testimonian distintas documentaciones recogidas a lo largo de la historia de la literatura espan～ola y, en te′rminos generales, resulta un procedimiento de formacio′n de palabras muy popular.",유연창 ( Yeon Chang You ),1996,https://www.riss.kr/link?id=A87014762
오르떼가의 환경론,"Este trabajo se plantea en el punto tangencial de diversas aproximaciones cienti′ficas en la nocio′n de Circunstancia de Ortega. Esta nocio′n que se desarrollo′ muy tempranamente proporciono′ a Ortega, con su estado sobre los animales y sus ambientes, un especial esti′mulo que llevo′ al filo′sofo a formular su idea principal $quot;Raciovitalismo$quot; y le habi′a de resultar sumamente fecunda a lo largo de la vida del filo′sofo espan～ol. Bajo la creciente importancia de la influencia del pensamiento cienti′fico sobre el pensamiento filoso′fico que veni′a ejercie′ndose continuamente a lo largo del siglo XIX, aparecio′ la famosa definicio′n orteguiana que completo′ en las $quot;Meditaciones del Quijote$quot;: $quot;Yo soy yo y mi circunstancia. Si no la salvo yo, yo no me salvo a mi′.$quot; Esta idea le sirvio′, entre varios aspectos, para adentrarse por la fenomenologi′a del arte, como puede verse en su ensayo sobre $quot;Los cuadros y sus marcos$quot;. Creo posible tambie′n extrapolar su idea acerca de la circunstancia para verla en la base de la sociologi′a poli′tica orteguiana en la $quot;La rebelio′n de las masas$quot; y en $quot;El hombre y la gente$quot;. Otro importante aspecto de la obra de Ortega es su antropologi′a, su definicio′n de lo que es humano, en contraposicio′n de lo que no lo es, principalmente en sus ensayos sobre $quot;Ensimismamiento y la alteracio′n$quot;. Finalmente, esta idea de que no es posible separarnos de las circunstancias que nos rodean, y que en realidad forman parte de nuestro ser se puede aplicar a la teori′a de la Ecologi′a personalista. En conclusio′n, la obra total de Ortega, tan rica en ideas que rezuma intuiciones y teori′as en cada pa′gina resulta muy dificil de reducir a una, dos, o tree ideas centrales. Pero, sin embargo, si una idea ba′sica pareoe permear muchos de sue ma′s importantes textos, la encontramos en la concepcio′n bipolar del yo y sus circunstancias.",안영옥,1998,https://www.riss.kr/link?id=A82638268
스페인어 청취 교육에서의 섀도잉 활용에 관한 연구,"This study analyzes the difficulties experienced by undergraduate learners majoring in Spanish in advanced listening and their needs in listening classes, and proposes a teaching method that incorporates shadowing practice for improving listening skills. Shadowing began to be known as a basic practice for simultaneous interpretation, and has been widely introduced as a teaching method for improving listening skills and speaking fluency in foreign language education. Domestic research on shadowing has mostly focused on its use as a teaching method for improving listening skills of learners in EFL (English as a Foreign Language) or KFL (Korean as a Foreign Language) courses, excluding professional interpretation education. This study, however, examines whether the assumption that shadowing practice helps learners improve their ability for bottom-up information processing by developing repeated phonemic awareness of auditory input is also valid for advanced listening practice for undergraduate Spanish learners. For the purpose of the study, shadowing was incorporated in listening classes for Spanish majors who have completed Spanish language courses of intermediate or higher levels, and the learners were surveyed about difficulties experienced in listening and benefits of shadowing in learning achievement. Survey results demonstrated the necessity and validity of shadowing in Spanish learning for improving the ability for bottom-up information processing in areas that learners often find challenging, such as pronunciation, speed and intonation.",김희진,2022,https://www.riss.kr/link?id=A107964966
국어의 로마자 표기법 문제 종합 검토,"A non-technical system of Romanizing Korean. that is not a system for linguists, should facilitate for foreigners (mainly the English speakers) to learn how to pronounce words and sentences written in this system so that a Korean will recognize them when he hears them.
Although each system has its good and bad points, I think that the most suitable system for a Korean case should accept the principle of the phonetic representation that underlies the McCune-Reischauer system of Korean Romanization.
The Romanization of the Ministry of Education is still aesthetically ugly in spite of the recent changes regarding the writing of lthe vowels (from eo and eu to o and u)and th e judicious use of spellings closer to the phonetic shapes of words.
Thus, it is proposed to minimize the use of the hyphen, apostrophe, and diacritic marks and to choose the letter symbols without the possibility of unpleasant looks and misleading pronunciations as follows.",李相億,1981,https://www.riss.kr/link?id=A87003112
漢文 품사분류론 재론,"Abstract
The succession to traditional culture could be roughly divided two ways: one is through
literature, another through folk ways. To uphold the traditional culture through literature,
Koreans have to learn the Old Chinese because most transmitted Korean literature is
recorded in Chinese.

Chinese is a foreign language which is different from Korean especially in grammar. So,
to learn the language, we have to master its grammar. At this point, the establishment
of prescriptive grammar (school grammar) of Chinese comes into question, which has
never been discussed to my knowledge since I issued an article on this problem.

I intend to set a Korean prescriptive grammar of Chinese by reviewing and refining the
parts of speech developed in 『漢文新講』written by 李家源, the great scholar of Chinese
literature in Korea and『文言文法』by 楊伯峻, the great grammarian in China which are
considered to be representative books on Chinese grammar.",박유리,1999,https://www.riss.kr/link?id=A75592158
"스페인어 능력평가 시험의 구성과 특징 분석: DELE, CELA, SIELE","The purpose of this study is to provide a detailed explanation about the elaborate composition and characteristics of major overseas tests: DELE, CELA, and SIELE. The three tests have a common goal of evaluating Spanish proficiency for non-native spanish speakers, but certain differences exist in the constitution and evaluation methods among each exam. In this study, detailed composition of each test will be explained and evaluation criteria will be examined. The DELE test can be regarded as the test that requires the most preparation for the examinee in all aspects. However, the DELE exam does not require a perfect score to be passed, but rather a certificate is given if one exceeds the specified minimum score. Therefore, in such perspective, one can say that participants have a bit of an advantage in gaining a certificate. Since CELA is provided in Mexico, the nature of the exam requires more understanding of the Mexican culture than the other exams. Due to such locational characteristic, the number of people undertaking CELA is expected to increase in the future considering not only the current and future trade volume between Korea and Mexico but also Mexico’s position as the bridgehead for entry into Latin America. The SIELE test is a single-form assessment, and the difficulty of the questions can be considered lower than that of other tests. SIELE majorly examines Pan-hispanic expressions. Given the advantages of expedited test results and the possibility of partial testing, we expect that more candidates will choose this test in the future.",김선웅,2021,https://www.riss.kr/link?id=A97762765
학문 목적 한국어 학습자를 위한 윤리적 글쓰기 교육의 방향,"Bilingual Research 45, 167-188. This article has been written from the recognition of the necessity of writing ethics, which was not dealt with extensively in KAP writing education. Foreign students sometimes, for various reasons, violate writing ethics. The reason why this is a serious issue is because an individual may become accustomed to undesirable and unethical writing habits without being aware of the immorality behind one`s own actions. However, solutions should not be found from simply accusing the learner of one`s dishonest attitude or consciousness, hut solutions should be found from understanding the reality of current Ethical writing` education and from searching for ``the direction that the education of writing ethics`` should take in KAP writing education. In this writing, studies on current writing ethics education has been done through writing materials for KAP learners, and reviewing the writing syllabuses for KAP learners. Moreover, several proposals concerning the direction of ``writing ethics education`` for both foreign and international students are made. Now, the placement of emphasis on the importance of an ``honest and sincere`` writing above the importance of teaching about the writing ``method`` and the required ``content`` is imperative. Therefore, henceforth, the issue of ``ethics`` should be dealt with in greater part in Korean writing and it is essential that a detailed education plan with its accommodation be developed.(Yonsei University)",이윤진 ( Yun Jin Lee ),2011,https://www.riss.kr/link?id=A108113917
한국어 교사의 교사 효능감 연구,"Bilingual Research 45, 109-132. This paper examines what makes a Korean language teacher efficient in the classroom in terms of teachers sense of efficacy. To investigate Korean language teachers` sense of efficacy, OSTES(Ohio State Univ. Teacher efficacy scale) is translated and revised to be applied to KM. field. And to decide relevant factors of the Korean language teacher, preliminary survey was made by 20 Korean teachers. There are 164 in-service Korean language teachers included in the formal survey. The average score of Korean language teachers sense of effleacy is 6.44 out of 9 and efficacy in instructional strategy ia higher than efficacy in classroom management or efficacy in student engagement. Research has been conducted on the statistical relationship between factors of Korean teachers and teachers` sense of efficacy, As a result, mare experienced teachers generally show higher efficacy and the number of students teachers teach at the same time meaningfully affects teachers` sense of efficacy. Furthermore, the average salary of the teachers correlates with teachers` sense of efficacy. Reeducation experiences, teacher positions and certificates for a Korean teacher and motivating factor to be a Korean teacher don`t show statistical meaningfulness in connection with teachers` sense of efficacy.(Hankuk University of Foreign Studes)",안정민 ( Jeong Min Ahn ),2011,https://www.riss.kr/link?id=A82532527
한국어 자음 체계의 유형적 보편성 연구,"Bilingual Research 45. 331-351. This paper discusses Korean consonant system in terms of typological universals of natural languages with the data in UCLA Phonological Segment Inventory Database (19X4) and The World Atlas of Language Structures (2005). Korean manifests the following common facts that are found in natural languages; (i) the size of phonological inventory and consonant inventory of Korean, (ii) the ratio of obstruents-sonorants, (iii) the number of nasals and glides, and (iv) the frequency of stops(including affricates) based on the place of articulation. On the other hand, Korean has a very unique structure of stops. affricates and fricatives in terms of the manner of articulation. In particular, the aspirated and tense segments make the Korean consonant system different from the general aspects that are found in other human languages,(Hankuk University of foreign studies)",허용 ( Yong Heo ),2011,https://www.riss.kr/link?id=A82638260
19세기 콜롬비아 사회와 호르헤 이삭스의 『마리아』,"La novela Maria(1867), unica novela de Jorge Isaacs, se considera como la representante de la novela romantica en America Latina. El fondo y la historia estan basados en las reminiscencias literarias europeas y la propia biografia del autor. En la movela destaca la naturaleza armoniosa en convivencia con un orden social jerarquizado y pacifico. Se considera con frecuencia que el paisaje en Maria tiene por objeto representar el estado de animo del protagonista Efrain, como en la tradicion del Romanticismo. Segun muchos criticos, la novela romantica se caracteriza como el producto del siglo ⅩⅠⅩ, cuando Ametica Latina se desliza politicamente hacia la anarquia despues de la independencia.
En Colombia, el periodo de 1862 comprende los anos de formacion de la nueva Republica y se caracterizo por el conflicto y la crisis. Colombia proclama su independencia en 1810 y la consolida en 1819 con la batalla de Bayaca. Despues entra en una serie de guerras civiles entre los liberalistas y los consevadores. Este conflicto entre dos partidos es el germen del problema politico en la Colombia actual, llamado ""Violencia"".
Maria se puede considerar como una novela que trata del tema del amor entre dos joenes en el paraiso perdido y como un prototipo de la novela del Romanticismo sentimental: la historia del amor y la muerte, Sin embargo, Williams agrega que esta novela se publico para sustentar el proyecto idealogico conservador y crear, particularmente, los balores esteticos comparables a los europeas y c los que las classes media y baja del pais se habian acostumbrado, y que al fin habia logrado describir a Colombia como una verdadera Arcadia Heleno-Catolica. El autor trata del problema social como ideologia, etnia, raza y religion que caracteriza a las culturas latinoameticanas, especialmente, colombiana. En America Latina hay una relacion estrecha y directa entre la historia, politica y ficcion, y el amor sentimental de la novela sirve como paradigma para su construccion.",배지완,2002,https://www.riss.kr/link?id=A2096324
한국어 말하기 과제의 상호작용적 실제성 연구,"This study aims to examine interactive authenticity of speaking tasks presented in intermediate Korean textbooks, and to suggest ways to enhance the interactive authenticity. As the core principles of the Korean education, communicative language teaching, task-based language teaching, and learner-centered language teaching are emphasized, and it results that material developers have made great effort to include the authentic materials which reflect the real-world situations. However in order to increase the ability of task performance, the experience of classroom task performance should transfer to a real-world situation, thus more attention should be paid to the authentic process of task performance as well as authentic task itself. Therefore, in this study it is termed ``interactive authenticity`` to refer this authentic process of task performance, and it is specified as follow: i) topic development, ii) turn-taking, iii) response utterance, iv) attitude and gesture. Among these, interactive authenticity of intermediate Korean materials is analyzed based on the framework of topic introduction, topic transition, and topic deepening. As a result, all materials analyzed in this study have devices to teach topic development. Especially expressions and devices to present the way to deepen given topic abound, but topic introduction, which helps to start discourse, and topic transfer, which extend discourse moving to other topic within given theme, are shown relatively small percentage. This study also gives actual example of topic development presented in analyzed intermediate Korean materials. Based on this, more effective ways to lead students to develop a seamless interaction. This study highlights on the need of paying more attention to the interactive authenticity when developing speaking tasks and teaching speaking tasks.(Korea University)",김지영 ( Ji Young Kim ),2013,https://www.riss.kr/link?id=A87014731
계승어 사용자로서의 재미동포 미취학 아동을 위한 한글학교 유아반 교실 운영 방안,"This article is dealing with the characteristics of Korean-American preschoolers who are aged four and five and quarter of the Korean language school population, and the roles of Korean language school. In order to understand them, we have interviewed the teachers and parents of the 4 year-old class of the school. Their abilities of using Korean are definitely related to their parents` abilities and their desire to educate Korean to them. Moreover, even though the students are only four year-olds, they are superior to use English to Korean. There are some roles of Korean language school. It should be a field to build their identities, to learn and practice Korean, and to experience Korean culture as a mother country. Lastly, it is important for the students and their parents to establish networks of Korean immigrant community in advance before the public education. Unfortunately, there has not been any Korean language education program for Korean-American children. Therefore, there should be efforts to establish appropriate education systems for the children and teachers alike. Especially, the curriculum of the programs for teachers should be focused on making children understand not only general ideas, but also the essence and quality of Korean language. And also, it should be able to show the prototype of Korean language education system for the children.(Kyung Hee University)",이정희 ( Jung Hee Lee ),2013,https://www.riss.kr/link?id=A82420247
구어 담화에서의 한국어 학습자 요청 화행 실현 양상 연구 -전화 메시지 남기기 과제를 중심으로,"There are relatively many researches on request speech acts of the various fields of Korean education, but many of them employed a questionnaire-type discourse completion test for data collection and thus provided no information on how Korean learners actually made request speech acts in a spoken language environment. Although a discourse completion test is useful for examining the patterns and strategies of using polite expressions by many learners according to their social relationships, it is difficult to get an overall picture of how the primary and auxiliary speech acts are performed in request speech acts with such a test. It is also difficult to discuss whether request expressions learned by many learners can be put to immediate use in a spoken language situation with a discourse completion test since it is a writing task in many cases. This study thus set out to examine how request expressions and strategies learned in the classroom were utilized and whether there would be differences in expressions and strategies according to the content of request by analyzing the materials of learners who performed a task of leaving a message by phone in order to supplement the lacking aspects of a discourse completion test suggested in previous discussions.(Dong-A University)",김지혜 ( Ji Hye Kim ),2013,https://www.riss.kr/link?id=A82420255
외국인 유학생의 논증 텍스트에 나타난 응집성 실현 양상 연구 -응집성 실현의 언어 사용을 중심으로-,"The purpose of this study is to analysis aspects of coherence in the argumentative text of foreign students in Korea with a macroscopic point of view. Coherence is semantic network which is the most important and basic factor of the text. In this study, some phenomena of language from foreign students in Korea were investigated such as expressions of coherence in basis-conclusion and basis-inference-conclusion structure in their academic reports. It is found that most of foreign students are lack of variety of expressions and cannot use conjunctions appropriately. Also, it is very difficult to find drawing the valid inference in their writing. The results of this study illustrate needs for education of the structure and expressions in argumentative texts.(Ewha Womans University)",이정란 ( Jung Ran Lee ),2013,https://www.riss.kr/link?id=A45002503
한국어 형용사 전자사전을 위한 형태 · 통사 · 의미 분류,"This paper aims to classify morphological, syntactic and semantic properties of Korean adjectives to assign required linguistic information to electronic lexicon entries. Morphological information including inflectional classes is the first demanded in the automatic language processing system. We present 24 inflectional classes for about 6,000 adjectives defined by a formal criterion. We here introduce 15 syntactic classes and 12 semantic classes of adjectives, which can be used to extract syntactico-semantic information from online documents.",남지순(Jee-Sun Nam),2010,https://www.riss.kr/link?id=A75594966
