
포스트 코로나와 디지털시대의 아날로그 융합스토리텔링 양상과 방안 연구,"선사시대부터 인류는 도구의 개발을 통해 문명을 형성하고 보다 나은 삶을 위해 노력해 왔다. 인간에게 있어서 일은, 생존을 위한 생산 활동을 넘어서는 중요한 행위다. 인류는 일을 통해 사회문화를 형성하고 삶의 목적을 찾게 된다. 인공지능으로 대변되는 4차 산업 혁명은 노동시장에 약 500만 개의 일자리를 사라지게 할 것으로 예상하고 있다. 미래의 노동은 더 이상 생계유지 수단으로서 ‘일자리’로 존립하기가 힘들어졌다. 그 결과 노동의 대가로 생계를 유지하는 시대는 곧 사라지게 될 것이다. 디지털이나 AI는 인간을 위해 만든 도구들이지만 인간은 이제 자신들이 만든 기계와 경쟁해야 한다. 한 번 없어진 일자리는 다시 회복되기 쉽지 않고, 한 번 경험한 디지털의 속도도 돌이키기 힘든 상황이 되었다. 하지만 디지털 기술 또한 전염병에 대한 빠른 대응을 가능하게 했고, 비대면이 중요시되고 있는 현 시점에 가상환경을 제공함으로써 업무의 효율성과 다양한 경험적 기회를 제공하였다. 반면 이러한 환경이 ‘접속 가능한 자’와 ‘접속 불가능한 자’로 분리되면서 또 다른 불평등을 초래할 가능성을 안겨주고 있는 것도 사실이다.
주목할 것은 이러한 상황들 속에서 느리고 불편한 것을 찾는 레트로 문화가 브랜드화 되고 있다는 것이다. LP판, 종이, 인쇄물, 키덜트, 여행, 축제, 슬로우 푸드 등에서 목격되는 레트로 문화는, 대량생산과 대중문화 등으로 획일화되고 있는 세상에서 자신의 정체성을 표현하는 일련의 움직임들로, 안정을 추구하고 균형을 유지하려는 몸부림과도 같다. 게다가 가상현실까지 가세하는 과학기술 앞에서 경험적 산물인 레트로와 아날로그 문화현상은 초지능을 가진 도구의 탄생에도 새로운 논지를 던져준다.
가상환경이 학습과 업무, 사회적 관계 형성에까지 이른 상황에서 이런 양가적 측면을 염두해 둘 때 보다 효과적인 디지털과 아날로그의 융합은 당연한 것이 된다. 이것에 우선되어야 할 것이 공감 스토리텔링이다. 공감은 사회질서와 기업의 이익에도 중요한 부분이다. 또한 위급상황에서 사람들을 하나로 모으는 공동체 의식의 함양은 공감과 균형의 논리에서도 중요한 요소로 작용한다. 지역사회를 기반으로 세대 간의 격차를 줄이는 온, 오프라인 체험과 활동영역 확보, 기업의 지속가능한 사회적 책임과 연대는 공감브랜드 마케팅으로 이어지는 대안이 된다. 이는 일자리의 ‘소멸’이 아니라 ‘변화’로 이어질 수 방안이 될 것이다. 균형과 공감에 대한 고민과 논의는 인류가 수없이 많은 위기를 맞으며 화합과 공존의 의미로 회자 되어 왔지만 팬데믹과 4차 산업혁명을 눈앞에 두고 있는 상황 앞에서 보다 새로운 높이에 도달 할 수 있을 것이다.",박소연 ( Park So-yeon ),2021,https://www.riss.kr/link?id=A108399983
일본 근대 번역한자어의 성립과 한국 수용,,최경옥(Choi Kyung-ok),2007,https://www.riss.kr/link?id=A102392886
해석학적 번역이론과 텍스트 기능,,김효중(Kim Hyo Joong),2004,https://www.riss.kr/link?id=A107864843
번역품질평가의 현황과 과제,,이향(Lee Hyang),2010,https://www.riss.kr/link?id=A108761953
영화 <굿 윌 헌팅>의 이미지 경로 - 시공간의 모빌리티를 중심으로,"이 논문은 <굿 윌 헌팅>에서 주인공 윌이 그의 재능과 성장 가능성을 알아본 인물의 도움에 힘입어 스스로 자신의 장벽을 깨뜨리고 세상 밖으로 나오는 서사를 경로의 관점으로 분석하였다. 텍스트에서 모빌리티는 서사와 인물의 관계적 이동성을 나타낸다. 본고는 모빌리티의 측면에서 인물 관계와 서사의 경로 이미지를 미장센과 공간 배치로 고찰하는 데 목적이 있다.
외연적 서사에 나타나는 공간의 의미와 인물의 심리 변화를 탐색하기 위해 윌의 천재성을 중심으로 두 가지로 나누어 고찰하였다. 천재성이 없어도 소통이 가능한 시기에 윌은 내면적 성찰과 세계관 확장에 참여하는 기여자의 도움으로 성장을 이루어냈다. 이 글은 예술과 학문 융합의 관점에서 사건을 도식화하여 모빌리티의 경로로 탐색하는 방법론을 보이고, 인물의 심리를 공간의 미장센으로 분석하는 두 가지 의의를 지닌다.",김영선 ( Kim Youngseon ),2023,https://www.riss.kr/link?id=A106021032
문학적 장애재현과 담론의 한계와 가능성-장애학적 관점에서 고정욱의 장편 동화 다시-읽기,"본 연구는 문학 속 장애재현과 담론을 비평적으로 탐색한다. 이를 위해 장애학적 관점을 빌려, 장애 작가 고정욱의 장편 동화를 심층 분석한다. 분석 결과, 장애는 각 동화에서 장애인 당사자와 주변 인물들에게 인간 공통의 취약성과 의존성을 긍정적으로 상기시킴으로써, 이러한 ‘유약함’과 ‘불완전함’에 대한 노력과 강구책을 촉발시키며 궁극적으로 개인적, 공동체적 성장과 혁신을 가능하게 만드는 원천으로 재현된다. 『휠체어를 타고 날다』(2006)에서는 장애를 가진 미스핏(misfit)인 주인공 이준석은 의료적, 과학적 담론과 몸과 외부환경과의 상호 불일치로 사회적으로 소외되고 배제당하지만, 인간 본연의 취약성에 기반한 미스핏의 긍정성과 역동성은 오히려 주인공을 둘러싼 현실을 변화시킬 뿐만 아니라 지역 공동체와 구성원들 간의 공감과 연대의식도 불러일으킨다. 『책 읽어 주는 아이』(2016)가 담아내는 ‘책’을 매개로 한 비장애 아동 김진식과 장애 작가 고청강 간의 대화와 소통은 개인적 성장과 성찰을 뛰어넘어 공동체 조성에 중요한 기틀을 마련한다. 결론에서 동화 분석 연구결과의 시사와 함의점이 논의된다.",우충완 ( Woo Chungwan ),2019,https://www.riss.kr/link?id=A82508786
설화를 활용한 대학생 대상 인간관계 향상 문학치료 프로그램 개발 - 친구관계를 다룬 설화 분석을 중심으로,"이 연구는 대학생의 친구관계 향상을 위해 설화를 활용한 문학치료 프로그램 개발의 토대 마련을 목적으로 하였다.
성인 초기 대학생들의 발달과업인 친밀감에 주목하였고, 프로그램의 실효성을 높이기 위해 예비 참여자인 대학생들을 대상으로 요구조사를 실시하여 프로그램 구성에 필요한 요소들을 살펴보았다. 그리고 문학치료 프로그램의 구성 원리에 따라 참여자에 대한 이해를 바탕으로 설화를 선정하고, 이야기를 만들고, 만든 이야기를 탐색하고, 참여자의 실제 삶과 관련짓고, 해결방법과 변화를 모색하여 다시 이야기를 재창작하는 순환구조를 설명하였다.
다음으로 친구관계에서 경험할 수 있는 어려움을 다룬 설화 <장사 형제 이긴 힘센 의형제>를 분석하고 문학치료프로그램을 진행할 때에 활용할 수 있는 활동방법을 제안하였다.
후속 연구에서는 이번 연구를 통해 제안한 프로그램 활동을 중심으로, 대학생 대상 친구관계 향상을 위한 문학치료 프로그램을 실행하고 효과성을 검증하고자 한다.",조영주 ( Cho Youngju ),2021,https://www.riss.kr/link?id=A99912062
기계번역 결과물의 오류유형 고찰,,"서보현(Seo, Bo-Hyun)",2018,https://www.riss.kr/link?id=A108099884
소설 텍스트의 중한 번역방법 연구,,"이현주(Lee, Hyun-Joo)",2018,https://www.riss.kr/link?id=A108099888
기계번역 담론에 대한 비판적 고찰,,"송연석(Song, Yonsuk)",2018,https://www.riss.kr/link?id=A75064917
소설 『작은 아씨들』과 영화 <작은 아씨들> 스토리텔링 전환 양상과 의미,"이 글은 루이자 메이 올콧의 소설 『작은 아씨들』과 원작소설을 비교적 충실하게 반영하면서 각 시대적 가치관을 반영한 세 편의 영화(1949, 1994, 2919)의 각색 전략을 살펴보았다. 이를 토대로 몇 가지 중요한 사실을 확인할 수 있었다.
첫째, 원작 소설 『작은 아씨들』은 다층적인 목소리를 통해 전복의 상상력을 내장하고 있다는 점이다. 이 작품이 오늘날 여러 버전으로 각색되는 것은 19세기 소녀소설로 당대적 도덕관과 가치관을 담아내고 있으나, 소설의 곳곳에서 당대적 가치관에 대해 순응과 불온의 상상력을 동시에 담아내고 있다는 점에서 다층적인 해석의 가능성이 있다.
둘째, 원작 소설을 비교적 충실하게 각색한 영화들이 각 시대의 소통욕망을 반영하여 새로운 시각에서 이야기를 확장하고 강화하는 방향으로 변모되었다는 점에서 스토리텔링의 가능성을 모색할 수 있었다. 1949년 영화의 경우 원작 소설에서 낭만적 연애와 결혼에 초점을 맞추고 남성 중심 사회를 존속, 유지하는데 기여하는 스토리텔링을 보여준다는 특징이 있다. 1994년 영화에서는 여성주의 시각이 강화되면서 스토리텔링도 변화된다. 1994년 영화는 조와 마치부인, 그리고 에이미의 성격을 강화하고 여성주의 시각에서 남성중심 사회의 문제점을 조망해서 보여주고자 한다. 2019년 영화에서는 현대인들의 꿈에 대한 도전과 성취라는 문제에 초점을 맞춰 조를 화자로 내세워 과거와 현재를 교차편집하는 전략을 취하고 있다. 누구나 소녀시절에는 자신의 꿈이 있고 낭만적인 미래를 꿈꿀 수 있다는 점에서 이 영화는 네 자매의 삶을 통해 현대인의 가치관의 변화와 소통에 대한 욕망을 반영해서 각색되었다는 데 의미가 있다.",장수경 ( Jang¸ Sukyung ),2020,https://www.riss.kr/link?id=A100298293
『동화와번역』 : 포스트모던 그림책으로서의 『지각대장 존』 읽기,"본 연구는 그림책의 역동성을 출발점으로 삼아, 포스트모더니즘의 관점에서 『지각대장 존』을 분석해보았다. 『지각대장 존』의 뼈대에 해당되는 4개의 에피소드 와 열린 결말이라는 명시적 구조아래 감추어진 다양한 가능성을 탐색하여, 텍스트 를 지배하고 있는 이질적인 목소리와 그 의미를 밝혀보고자 하였다. 따라서 본 연 구는 비선형성과 불확정성, 모호함이라는 포스트모던 그림책의 특성에서 알 수 있 듯, 하나의 통합된 형태로 이야기를 정리하는 대신 파편의 형태로 산재해 있는 이 질적인 이야기에 주목하여, 좁게는 『지각대장 존』에 대한 다양한 해석의 가능성을 탐색하고, 넓게는 이를 통해 그림책이 가진 역동성을 확인하고자 하였다. 분석결과, 『지각대장 존』의 뼈대를 구성하는 4개의 에피소드와 열린 결말의 순환구조는 존과 교사, 자연과 문명의 대립관계를 명시적으로 보여주는 데 그치지 않고, 배움의 길과 그 길이 갖는 의미를 간접적으로 시사하고 있음을 알 수 있었 다. 존 버닝햄은 또 명확한 시간의 지표를 제시하지 않고, 환상과 현실의 경계 또 한 모호하게 처리하여 매우 분명한 것으로 여겨졌던 존과 교사의 대립관계 또한 실재하는 현실이라기보다 존의 상상에 지나지 않을 가능성이 있음을 시사한다. 뿐 만 아니라, 4개의 에피소드를 통해 존과 교사의 대립관계 너머로, 자연과 어린이가 맺는 특별한 관계의 가능성 또한 시사한다. 이 점에서 보면, 『지각대장 존』은 성 인과 어린이의 대립관계 이상으로, 또 다른 ‘이야기가 서로를 반박하며 경쟁하는’ 포스트모던 그림책으로서의 면모를 보여준다고 할 수 있다.",나선희 ( Sun Hee Ra ),2014,https://www.riss.kr/link?id=A107894675
Self-Efficacy and Interpretation Quality,"자기 효능감은 알버트 반두라(Albert Bandura)의 사회인지학습 이론의 핵심 개념이다. 이는 “특정 과업이나 목적을 달성할 능력에 대한 기대”로 정의된다(Bandura, 1997: 3). 일반적으로 자기 효능감은 성공적으로 행동하는데 필요한 자신감으로 여겨진다. 한 방대한 연구 논문 (Walsh, 2008; Pajares, 1996; Lawrence, 2006)은 자기 효능감이 다양한 과업과 상황에 대한 인간의 성과를 예측할 수 있는 중요한 전조 기제임을 보여주고 있다. 학교라는 맥락에서는 자기 효능감을 근거로 학업 성취도를 예측할 수 있다 (Pajares, 1996: 543). 자기 효능감이 높은 학생들이 더 많이 성취하는 경향이 있다. 본 연구는 통역 품질과 자기 효능감간 의미있는 관계를 도출해 내고자 한다. 따라서 자기 효능감 평가 질문서를 개발하여 통역사 훈련 프로그램에 등록하고 3개 이상의 통역 과목을 수강한 32명의 고학년 학생들을 대상으로 설문조사를 실시하였다. 그 결과 자기 효능감과 통역 품질 간에는 직접적인 관계가 있음을 알 수 있었다. 자기 효능감 점수가 높은 학생들이 통역 또한 우수하였다. 이는 자기 효능감을 통역사 훈련 프로그램의 설계, 통역사의 능력평가, 통역이란 행위에 가장 적합한 지원자의 선별에 있어 효과적인 요소로 고려할 수 있음을 보여준다.",Miad Zareai,2010,https://www.riss.kr/link?id=A106303116
