
병원급 의료기관에서의 투약오류 관련 요인,"Objectives This study aimed to identify factors related to medication errors in hospitals, provide basic data for medication safety, and to provide evidence to develop an intervention program to prevent medication errors.
Methods This cross-sectional descriptive study was using the 2021 patient safety report data released by Korea Institute for Healthcare Accreditation. Of the total of 13,146 patient safety incidents, 4,198 medication errors were used, excluding psychiatric hospitals, oriental medicine hospital, and missing data were excluded. Descriptive statistics, Chi-square test, and multinominal logistic analysis were performed using SPSS 26.0 program.
Results Factors affecting adverse events of medication errors were age, the place of occurrence and bed size.
In addition, the factors influencing the sentinel event of medication error were the evening shift, the place of occurrence. Among the medication errors 70.4% (1,201) were near misses, 26.1%(445) were adverse events, and 3.5% (59) were sentinel events.
Conclusions In order to prevent medication errors in medical institutions, factors that can affect medication errors by work department should be identified in various aspects, such as organizational, management, system, and human factors, and sufficient medical personnel, positive working environment, and medication safety system should be improved.",윤숙희,2022,https://www.riss.kr/link?id=A108264590
ChatGPT의 교육적 활용 관련 연구동향 및 주제 분석,"The aim of this study was to identify research trends and topics related to the educational use of ChatGPT, a generative artificial intelligence, and to draw implications. The study analyzed 72 related literatures (domestic: 14, foreign: 58) published from December 2022 to May 2023, and topics were analyzed through the systematic literature review and text mining techniques. Regarding the result of the systematic literature review, the number of related literatures increased rapidly in March, and conceptual studies and empirical studies appeared in a similar proportion. Regarding the LDA-based topic modeling analysis, the topics of research trends are (1) impact and preparation of ChatGPT in medical and nursing education, (2) exploration of the impact of ChatGPT in practices and proposing frameworks, (3) future consideration about the use of ChatGPT in practices and research, (4) evaluating ChatGPT performance, (5) exploring ways to use ChatGPT in subject-specific learning activities and tasks, (6) considerations for using ChatGPT in higher education, (7) implications drawn from the experience of using ChatGPT by experts, teachers, and students, and (8) possibilities and challenges of using ChatGPT in education. Based on the results, we present ways to use ChatGPT for education and implications for future related studies",장혜지,2023,https://www.riss.kr/link?id=A108737601
학교폭력 예방 프로그램의 적용효과 분석,"The purpose of this study was to investigate the effect of the KEDI School Violence Prevention Program (2007), which was created as an educational material for school violence prevention.
The subjects of this study were third and fifth grade elementary school students (n=982), placed in two groups: an experimental group (n=497) that watched the program and a control group (n=485) that did not watch the program. A difference, analyzed via mixed ANOVA, was found in the pre-test and post-test scores between the two groups. The result shows that, after the students watched the program, the level of comprehension of school violence (tolerance level for school violence) and the level of the attitude and behavior toward school violence significantly decreased in the experimental group compared to the control group, while the ability to deal with school violence significantly increased among the experimental group students. The KEDI School Violence Prevention Program appears to have a positive effect on preventing students' violent behaviors.",박효정,2010,https://www.riss.kr/link?id=A101742021
빅데이터를 활용한 MBTI에 대한 한국 사회의 인식,"Objectives This study was conducted to find out the main issues and meanings of Korean people's MBTI because two years after the first MBTI test became an issue using big data, and it shows more than just a psychological test.
Methods Using the web crawler function, “MBTI” was collected from February to March 2022, and “Personality Type Test” was collected around ‘Naver news’ articles collected from November 2021 to March 2022, and language network analysis was conducted using a total of 3,910 keywords excluding disused words.
Results First, the terminal frequency analysis showed that the top key keywords associated with MBTI were certification, education, symptoms, Yu Jae-seok, results, disorders, overcoming, study, counseling, depression, disposition, Korea, lecture, implementation, and operation. Second, as a result of analyzing the topic modeling based on the Latent Dirichlet Allocation(LDA), the four major topics were ‘related counseling programs’, which showed the types of counseling programs operated in relation to the actual MBTI. ‘Actual treatment and utilization plan as a professional’ appeared to be used in the actual treatment process as an expert as the youth appeared in high frequency. The MBTI Expert Course was not a formal psychological test in the broadcast, so it was interested in the official license MBTI inspection of the Korea MBTI Institute. ‘Celebrity and Issue’ appeared as an issue related to entertainers as MBTI received people's attention.
Conclusions This study examined the overall perception of Korean people's MBTI and discussed the implications and significance of the study using it.",이영주,2022,https://www.riss.kr/link?id=A108264588
초·중·고 학생의 미디어 이용 양상 및 미디어 리터러시 교육에 관한 인식 분석,"The purpose of this study is to investigate and analyze the media culture that students experience outside of school and the media literacy that they experience in school to reveal the realization of school media literacy education and to derive certain implications for future education directions.
This Studies have shown that students tend to rely on digital media in their daily lives, using a lot of digital-based New Media such as online video platform and social media. There was a low perception of experiencing media literacy education through school education, and it was found that media literacy education was experienced mainly in information and Korean language curriculum.Ethical use education of media was the most active, and the education on the reliability of media information and data production using media were the least sufficient, but the educational demand for the reliability of media information was the strongest.
Results Showed that the systematization of school media literacy education requires education reflecting students' media culture, hierarchy by school level, accurate diagnosis and verification of media literacy capabilities, and integrated media literacy education.",변숙자,2021,https://www.riss.kr/link?id=A107775594
통합교육의 발전 방안에 관한 소고,"Inclusive education in Korea has expanded rapidly in quantity over the past decade.
However, its quality is still in need of improvement, as many educators agree. Based on previous research, this paper discusses strategies for the improvement of inclusive education in Korea. The development and the current status of inclusive education in Germany, which is considered to be of high quality, are included in this discussion.
Lastly, this paper presents the following suggestions:
1) The number of qualified special educators in inclusive schools should be increased.
2) The role of special educators in inclusive education should be redefined.
3) vocational education for students with disabilities should be implemented beyond the strict dichotomy between inclusion and separation.
4) Inclusive education Should be discussed in the context of general education reform.",이주화,2011,https://www.riss.kr/link?id=A82692386
문화예술교육을 통한 일상의 변화와 교육적 의미 탐구,"The purpose of this study is to explore changes in a daily life through Art & Cultural Education and their educational implications. The individual learners in Art & Cultural Education program experienced emotional abundance and inner. They recalled their past selves and reflected on their present selves, which allowed them to expand their thinking by facing various perspectives and experiences in a community. Flexible thinking and open mindedness based on art & cultural education enlarged the understanding of others, restored the sensitiveness of daily life, and realized art of daily life with an attitude of wide-awakeness. Moreover, the practices of community as ‘an experience' allowed the learners interest to be extended not only to oneself but also to their surroundings, communities, and society, thereby leading to social accountability and the relevant practices. Also, realizing art of daily life is intertwined with the attitudes and quality of life of the learners, and further extends its influences to communities and society as a whole. The suggestions for art & cultural education’s orientations are as follows. First, various programs should be carried out both inside and outside school to foster the aesthetic sense of teachers. Second, practical art & cultural education at a community level should be encouraged so it can be learned as an experience rather than function and knowledge.",권희원,2018,https://www.riss.kr/link?id=A105457441
국내 창의성 교육 연구동향 분석,"The purpose of the study was to analyze the researches related to creativity education to find out how those researches have approached focusing on the types of creativity education. To achieve the purpose 399 articles related to creativity education published from 2002 to 2011 in Korea were reviewed and ananized by three dimensions such as ‘integrated with subject’, ‘separated from subject’, and ‘indirect support’ toward creativity education. The results showed that the most frequently found researches were those ‘integrated with subjects’. It was a desirable finding that the studies tried to approach creativity education toward integrated with a subject(s). However, those researches mostly focused on the effects of certain programs rather than showing what and how the contents of the curriculum were integrated with the elements of creativity. The researches related to ‘separated from subject’ were the next frequently found and those were focused only techniques of teaching thinking of creativity rather than relating specific subjects of curriculum. Discussions are followed about the results of the researches from the perspective whether the research could help either to develop theories or practices of creativity education in the classroom teaching and learning.",정지은,2012,https://www.riss.kr/link?id=A60308741
"상담 이론에 기반한 상담사례의 사례개념화 -대상관계이론, 인지치료이론, 실존역동적 접근 방식의 사례개념화","Case conceptualization is setting goals and establishing intervention strategies through organizing and explaining various information about the client. Case formulation is an important element in counselling, as the problem that must be addressed by counselling can be explained in various ways, depending on the theoretical counselling or psychotherapy approach taken, and the goals of the case and intervention strategies are based on the case formulation. Enhancement of case formulation capabilities is a particularly important element in counselor supervision, as a multifaceted approach to case formulation is an important factor in effective counselling. In this study, three different counselling and psychotherapeutic approaches were employed to formulate a single case: object relation theory, cognitive theory, and existential dynamic approach. By using a single case approach method, this study shows how multiple different theoretical approaches can be used to explain a single case and aid the client, and discusses the possibility of a multifaceted approach to case formulation.",최윤미,2019,https://www.riss.kr/link?id=A106527707
대학생의 글쓰기 윤리와 표절 문제,"Nowadays the ethics of studying become an important issuein university. The ethics of studying is very essential toprofessors and students. But the misconducts of studying arehappened much in university and one of these is theplagiarism.
The plagiarism is happened in the writing of student. Theplagiarism in the writing is appeared in the structure,contents, sentences and words. It is regarded that theplagiarism of student is happened by three factors. Namelythese are the psychological factor, environmental factor andthe cultural factor.
But the plagiarism is one of professional misconducts andmust be exterminated. For this, it is very important that theethical education is done in the education of writing. I thinkthat the ethical education of writing is absolutely necessaryfor honest studying of student. The writing is done in allstudying of student and is one of creative works.",황성근,2008,https://www.riss.kr/link?id=A104029737
우리나라 중·고등학생의 디지털 미디어 리터러시 인식 연구,"The Korea 2022 National Curriculum emphasize language literacy and digital literacy in preparation for the digital transition and increased social uncertainty.
The purpose of the new curriculum is in line with the international community’s emphasis on digital media literacy. In the future when technology such as ChatGPT has become widespread, literacy based on digital technology will become increasingly important. Therefore, this study empirically explores the current middle and high school students’ perceptions of the components of digital media literacy. In the “Korean Language”, “Common Korean Language 1, 2,” and “Media Communication” segments of the 2022 revised Korean Language Curriculum. In addition, it is intended to provide basic information for digital media literacy classes considering the level and characteristics of learners.
A test tool with 16 cognitive components and 10 affective components of digital media literacy was created, and students’ responses were collected. The overall average value was 3.5 points or higher, indicating a positive perception of digital media literacy.
This analysis established the following. First, classes and evaluations involving digital familiarity are needed. Second, digital media challenges with clear goals and objectives should be presented. Third, classes and evaluations of the critical judgement of information are needed. Fourth, sufficient time should be provided for information sharing and communication through digital media.",최진영,2023,https://www.riss.kr/link?id=A108573500
기업교육장면에서 MBTI 검사의 신뢰도에 관한 연구,"The purpose of this study was to compare the results of pre-test(result from test) and post-tests(best fit from workshop) to investigate MBTI’s reliability in corporate education settings. For this study, self-reports data from 144 employees were collected in two companies, who participated for MBTI in-house training during seven hours. Compared between the pre-test and the post-test results, 92 participants (63.9%) showed same MBTI type while 52 participants (36.1%) showed a different type as it had been. In conclusion, the MBTI test results indicated low reliability in the corporate educational settings. Thus, it is necessary to provide education activities including workshop in the training. Based on the results, finding and implications were discussed.",박제일,2012,https://www.riss.kr/link?id=A104228581
유아교사의 디지털 놀이에 대한 인식 탐색,"The purpose of this study was to examine the perception of digital play that early childhood teachers have through metaphor analysis, and to seek directions and plans for digital play support based on this. To this end, from March 13 to April 14, 2023, a metaphor survey was conducted targeting 123 kindergarten and daycare teachers in G-metropolitan and J-province, and digital play of early childhood teachers was conducted through metaphor identification, metaphor categorization, category development, category classification, validity and reliability review, and quantitative statistical analysis. The concept of is categorized. As a result, the metaphor for digital play was categorized into five aspects: the concept of digital play, the value of digital play, the anti-value of digital play, the role and plan to support digital play, and the difficulties and demands of digital play support. Early childhood teachers' understanding of the concept of digital play was diverse, and teachers mentioned the value aspect of digital play the most, exploring the role of teachers to support digital play and worrying and demanding more educational support. expressed.
Based on these results, a direction for future digital play operation and support was suggested.",윤민아,2023,https://www.riss.kr/link?id=A108633849
부모배경에 따른 교육불평등은 심화되었는가?: OECD 5개 국가의 교육불평등 비교 분석,"There is a deep concern that the socio-economic inequality of parents will be inherited to their children through education. So, the assertions are being empowered that the difference of academic achievement of their children have been enlarged, and that the social mobility have been weakened. Therefore, it becomes an important issue in every countries whether the effects of the parents’ socio-economic background on academic achievement of their children is increasing, that is, whether the educational inequality is widening.
In this paper, the necessary and sufficient condition is derived to prove statistically whether the educational inequality is increasing. By analyzing the PISA raw data which have measured students’ achievements six times every 3 years between 2000 and 2015, it is shown that parents’ background impacts on their children’s achievement differently according to their nation, and that the educational inequality is not widening world-widely.
Also, it is statistically proved that, in case of Korea, parents’ impacts on their children’s achievement have not been deepened. It is contrary to the previous assertions that the impacts have been deepened.",김준형,2018,https://www.riss.kr/link?id=A105240092
챗GPT에(게) 묻다,"This review examines the meaning of ChatGPT, a state-of-the-art natural language processing (NLP) model developed by OpenAI, and Professor Kim Dae-sik, a brain scientist, exchanged questions and answers on topics such as human relations, love, and happiness, risks facing mankind, God's existence and death. First, we asked ChatGPT, Google Bard, and Microsoft's search engine “Newbing” to write a book review on “The Future of Mankind Ask ChatGPT,” and then analyzed the contents and composition of each answer. The book review written by ChatGPT was presented in the form of “Overall Introduction-Book Composition Method and Theme-Limitations and Significance of ChatGPT-General Review,” and the flow of the article was generally smooth, but it was difficult to find the writer’s fresh perspective. Google’s Bard article confirmed that the text generation method of artificial intelligence chatbots focuses on universal summaries and simple and clear explanations rather than individuality and originality. Microsoft’s search engine “Newbing,” based on the GPT-4 model, specifically cited the contents of the book to increase reliability and reveal the source in consideration of the issue of intellectual property infringement.
Looking at the conversation scenes between humans and machines, I thought about the significance of the conversation. In order for “ask-answer” to be a process of generating meaning, curiosity, and curiosity about not only oneself but also others and the world must be placed behind it. In addition, to continue the conversation, a literacy ability to discover meaning is required, and literacy presupposes the ability to read between the lines and grasp contextual knowledge. This eventually requires the imagination to fill the gap and the overall perspective to grasp the relationship between the part and the whole, the part and the part. The process of finding meaning is the ability to think about surplus and outside and grasp the context, and if you say one thing, it is no different from the sense of recognizing heat. The sensibility that knows how to capture nuances belongs to the realm of humanism, which is essential for humans to sense and judge an object or phenomenon.
Therefore, Professor Kim Dae-sik’s conclusion in “Epilogue II” of “The Future of Humanity Ask ChatGPT” has great implications. The eye to distinguish the voices of individuals, which contain nuances subtly different from those that “probabilistic parrots” imitate plausibly, is based on humanities knowledge that cannot be easily filled with the names of efficiency, probability, and practicality. To exist as thinking human beings, we realize again that we must ask ‘why’ rather than ‘what’ and rely on the logic of coincidence and the specific context of life, not on the axis of stochastic thinking. And at the core of it, there is humanity that repeatedly asks and answers with a long-term perspective.",김화선(Hwa-seon Kim),2023,https://www.riss.kr/link?id=A108673665
교권침해 실태에 대한 중학교 교사의 인식 조사,"This paper is to examine the violation of teachers’ rights in the classroom. For the study it surveyed 466 teachers in 14 middle schools of Yang-San, Kyung-Nam province. The major findings are the follows.
First, teachers have recognized the serious violation of teachers’ rights. Teachers have experienced violent behavior and verbal abuse from students in the classroom one to three times, on average with female teachers have experienced. Most of these incidents occur when students do not follow the teachers’ instruction. They mostly happen at the beginning of the first semester, during the class and in the classroom.
Second, the improper behavior of students is the most common type of violation. In private school and the smaller area, improper behavior of the parents is more common. Female teachers and teachers in public school have experienced assault and verbal violence. Students tend not to conform to the direction of head teachers or teachers with more than 20 years experience.",최경실,2015,https://www.riss.kr/link?id=A103687293
다문화교육에 대한 교사의 인식,"This study assessed the direction of multicultural education through awareness, attitudes and educational guidance towards multicultural education in multicultural core-schools in Jeju-city. The results are as follows. First, most teachers think multicultural education is needed, but lack knowledge, understanding and multicultural teaching materials. To solve this problem, improvements to training courses for teachers is needed. Second, the experience of attending lectures about multicultural education, and the experience of educational opportunities concerning multiculturalism play an key role in awareness and attitudes towards multicultural education. Third, student learning and daily-life guides should not only be level appropriate but also goal-oriented to increase the effectiveness of multicultural education. Fourth, teachers working at multicultural education-centered schools have limited experience with multiculturalism. Fifth, instructors of the multicultural education training course for teachers have less experience with multicultural education than the teachers who work in multicultural education-centered schools. Based on the results of this study, urgent changes are need to develop more systematic education training courses to improve multicultural education.",현길자 염미경,2014,https://www.riss.kr/link?id=A100057302
경계선지능의 개념 정의의 재구조화 및 교육지원 체계 연구,"The purpose of this study is to explore the educational support direction of borderline intelligence students by exploring the learning characteristics and factors of underachievement of borderline intelligence learners. To this end, based on previous studies on learners with borderline intelligence, the content of underachievement of learners with borderline intelligence and their resources and characteristics were analyzed. A student with borderline intelligence has an IQ 70∼85 category and does not have an intellectual disability, but complains of academic difficulties. In the general education system, they are unable to adapt to academic performance and school life due to their low cognitive abilities and lack of social skills. In the case of borderline intelligence, there are areas that can be developed through acquired environment and continuous education. The function of language understanding can be improved through direct or indirect experiences and stimuli. The functional level of the working memory area can also be raised through repetitive training. As a result of the study, the direction of educational orientation of learners with borderline intelligence, the requirements to be considered in their educational support, and the learning system were presented, and the study was concluded with suggestions.",김용훈,2023,https://www.riss.kr/link?id=A108530931
