
생애주기별 성인 학습시간의 변화가 주는 시사 : ‘생활시간조사(1999-2019)’ 자료를 중심으로,"시간 사용을 보면 사는 방법과 삶의 질을 알 수 있다. 본 연구는 1999년부터 2019년까지 5회에 걸쳐 시행된 통계청의 ‘생활시간조사’를 바탕으로 20년간 우리나라 20세 이상 성인들의 생활시간이 생애주기별로 어떻게 달라지며, 성인들의 학습활동은 생애주기별로 어떻게 변화하는지를 실증적으로 규명하고자 하였다. 분석 결과 첫째, 성인들은 20년에 걸쳐 개인 유지 시간은 늘었고, 일과 가사노동 시간은 감소했다. 일은 중년기, 학습은 청년기, 개인 유지와 여가는 노년기에 가장 많았다. 둘째, 학습 시간은 모든 조사에서 청년기에 가장 많았으며, 생애주기가 바뀔 때마다 절반 이하로 줄었다. 변화 추이를 살펴보면 청년기와 중년기의 학습 시간과 학습 참여율이 늘었으며, 모든 생애주기에서 학교 활동 외 학습이 가장 많은 시간을 보내는 학습유형으로 나타났다. 셋째, 학습참여자의 경우, 청년기와 중년기의 학습 시간이 증가했다. 청년기 학습참여자는 20년 동안 22분 증가했으며, 중년기 학습참여자도 25분 증가했다. 학습유형별로는 학교 활동은 줄었고, 학교활동 외 학습 시간이 늘었다. 이러한 결과는 중년기와 장년기를 위한 맞춤형 직업교육, 장년기와 노년기 대상으로 삶의 의미를 찾을 수 있는 프로그램과 학습장벽을 낮추기 위한 디지털 리터러시 교육을 평생교육의 정책적 시사점으로 제시한다.","손선연(Son, Sun Yeon)",2021,https://www.riss.kr/link?id=A107964404
초등 메이커 교육에서 팅커링(tinkering)의 의미와 유형 탐색,"이 연구는 초등 메이커 교육의 맥락에서 팅커링의 의미를 탐색하고, 초등 메이커 교육에 적용 가능한 팅커링 유형을 확인하기 위해 수행되었다. 연구의 목적을 달성하기 위해서 팅커링 관련 문헌 고찰을 통해 팅커링의 의미를 탐색하고 팅커링의 유형을 분류하여 도출하였다. 또한, 초등 메이커 교육에 적용 가능한 팅커링 유형에 대한 타당도를 검증하였다. 이 연구의 주요 결과는 다음과 같다.
첫째, 초등 메이커 교육에서 팅커링의 의미를 1) 브리콜뢰르로서의 팅커링, 2) 메이커 활동의 한 분야로서 팅커링, 3) 문제 해결과 놀이로서의 팅커링, 4) 학습 과정으로서의 팅커링 등과 같은 네 가지 관점에서 탐색하였다.
둘째, 초등 메이커 교육에 적용할 수 있는 팅커링 유형을 1) 문제 해결하기, 2) 조작·표현하기, 3) 관찰·탐색하기, 4) 분해·조립하기 등의 네 가지 유형으로 구분하여 제시하였다. 또한, 각 유형의 팅커링에는 1) 손으로(with hands), 2) 놀이하듯(like playing), 3) 스스로 결정하며 (self-determined), 4) 계속 시도하는(try over and over), 5) 학습 과정 (learning process) 등과 같은 공통 요소가 전제 조건으로서 반영되어야 할 것을 제안하였다.",문대영(Daeyoung Moon),2023,https://www.riss.kr/link?id=A108531090
럭셔리 브랜드 콜라보레이션 제품 특성이 소비자 구매의도 향상 요소,"본 연구에서는 최근 유행 중인 럭셔리 브랜드 콜라보레이션 제품 특성이 브랜드 태도를 통해 소비자의 구매의도에 미치는 영향에 대해 알아보고자 하였으며, 이러한 럭셔리 브랜드 콜라보레이션 제품에 있어 가장 주요한 소비자층인 MZ 세대를 연구 대상자로 선정하여 MZ 세대의 소비가치의 조절 효과에 대해 탐색해 보았다. 연구결과, 럭셔리 브랜드 제품 특성은 브랜드 태도 및 구매의도에 유의미한 긍정적인 영향을 미치는 것으로 나타났다. 또한, 럭셔리 브랜드 제품특성이 구매의도에 미치는 영향에서 브랜드 태도는 매개효과를 일으킨다. 이는 럭셔리 브랜드 제품 특성인 심미성, 희소성이 높을수록 더 높은 수준의 구매의도를 일으키는 것으로 이해할 수 있으며, 이러한 상관관계에서 브랜드에 대한 소비자의 태도는 더욱 강화하는 작용을 한다는 것으로 미루어 짐작해볼 수 있다. 마지막으로 최근 럭셔리 브랜드 콜라보레이션 제품의 가장 주요한 소비층인 MZ 세대의 소비가치의 조절 효과를 알아본 결과, 브랜드 태도와 구매의도의 관계에서 유의미한 조절효과를 일으키는 것으로 나타나 MZ 소비가치를 통해 소비자의 구매의도를 더욱 강하게 촉진할 수 있다는 것을 알 수 있었다. 따라서 럭셔리 브랜드 기업은 타 브랜드과의 콜라보레이션을 적극적으로 활용하여 높은 예술적 디자인이나 시대가 추구하는 상징적인 문구 혹은 메시지를 제공한다면 MZ 소비자 지각하는 해당 브랜드에 대한 태도 및 구매의도에 최종적으로 긍정적인 영향을 미칠 수 있다고 판단된다.",렴정(Lian Ting ),2023,https://www.riss.kr/link?id=A108640702
품앗이 학습에 관한 연구,"본 연구는 성인학습자를 위한 품앗이 학습의 헤게모니 공유형태를 밝히고 헤게모니 공유방법을 제시하는데 있다. 품앗이 학습은 가르치는 이와 배우는 이를 이분하는 사고틀을 벗어나, 서로 배우고 서로 가르치는 협업학습활동인데, 본 연구는 품앗이 학습의 모습을 영화 속에 드러난 가르치는 이와 배우는 이의 대화방식, 문제해결방법, 관계형성방식을 분석했다. 품앗이 학습의 핵심은 ""가르치는 이""와 ""배우는 이""의 교수학습 헤게모니의 공유를 극대화시키는데 있다. 본 연구에서 분석된 영화 속에서는 품앗이 학습의 진면목을 볼 수 있었다. 그것은 가르치는 이는 배우는 이와 헤게모니를 공유하기 위해 배우는 이와의 대화, 문제해결, 상호작용을 진정 마음으로부터 실천하는 사람들로 나타났다. 품앗이 학습의 가르치는 이의 문제해결이나 상호작용은 배우는 이에 대한 사랑이 그 기저에 깔려있었다.",기영화,2001,https://www.riss.kr/link?id=A19653056
무형식학습 영향 요인에 관한 통합적 문헌 고찰,"본 연구의 목적은 평생교육의 관점에서 일터 근로자들의 학습 양상으로 중요하게 다루어지고 있는 무형식학습에 영향을 미치는 개인차원 요인 및 조직차원 요인을 이론적으로 고찰하여 무형식학습 영향 요인에 대한 통합적 개념 모형(Conceptual integrative model)을 구명하는데 있었다. 연구의 목적을 달성하기 위하여 1) 분석대상 선정 준거 설정, 2) 자료 수집 및 분석 대상 선정, 3) 연구의 개념적 모형(Conceptual model) 설계, 4) 선정된 자료 분석, 5) 무형식학습 영향 요인에 관한 개념적 통합 모형을 설계의 연구절차를 수행하였다.
연구결과 일터에서 무형식학습에 영향을 미치는 개인차원 요인 중 학습자특성 요인으로는 역량수준, 경쟁심, 자기효능감, 직무만족, 자기주도성, 개인적 경험, 개인의 목표, 학습전략, 학습동기가 제시되었고, 대인관계 요인으로는 사회적 네트워크와 피드백으로 제시되었다. 한편, 일터에서 무형식학습에 영향을 미치는 조직차원 요인 중 조직풍토 요인은 관리자 및 리더의 학습지원, 권한위임, 학습지향문화, 기업문화의 변화, 조직 구조가 제시되었고, 직무상황 요인으로는 학습시간 부족, 학습으로부터 학습부재, 업무도구 및 자원, 보상이 제시되었다.",박혜선(Haesun Park),2012,https://www.riss.kr/link?id=A60243451
"중년기 여성의 학습자 특성, 참여동기, 학습만족도 및 평생교육 참여성과 간의 구조적 관계","본 연구는 다양한 학습상황을 갖고 평생교육에 참여하는 중년기 여성학습자의 평생교육 참여성과에 미치는 영향을 분석하고 이들 변수들이 참여성과와 어떻게 구조적인 관계를 형성하는지 고찰하는 데 그 목적이 있다. 본 연구의 목적을 달성하기 위해 서울 및 경기도에 소재하는 평생교육기관에서 평생교육프로그램을 수강중인 여성학습자를 연구대상으로 선정하고 조사에 응답한 846명의 설문지를 분석하였다. 설정된 연구모형을 검증하기 위해 SPSS(18)와 Amos(18) 프로그램을 사용하여 분석하였고 분석방법으로는 구조방정식을 활용하였다. 연구결과는 첫째, 중년기 여성학습자의 학습자특성은 매개변인인 학습만족도에 미치는 영향은 통계적으로 유의하지 않지만, 평생교육 참여성과에 직접적인 영향을 미치는 것으로 나타났다. 둘째, 외생변인으로 설정한 참여동기는 평생학습에 참여하는 중년기 여성학습자의 평생교육 참여성과에 직접적으로 영향을 미치는 변인이면서, 학습만족도의 매개변인을 통해서 참여성과에 연결되어 간접 효과까지 미치고 있다. 셋째, 매개변인인 학습만족도는 평생교육 참여성과에 정적인 영향을 주는 요인 중 가장 큰 효과를 가지고 있는 변인인 것으로 나타났다. 학습만족도는 평생교육기관 차원의 준거들로서 중년기 여성학습자들의 참여성과에 영향을 미치는 학습과정상의 중요한 변인이라 할 수 있다.",이상희(Lee Sang Hee),2016,https://www.riss.kr/link?id=A102117118
대학평생교육 연구동향 분석,"본 연구는 고등교육의 전통적 패러다임에 대한 변화 요구가 확산되고 있는 시점에서 대학평생교육의 발전과 활성화를 위해 이제까지 국내에 발표된 대학평생교육 연구물의 동향을 분석하여 시사점을 얻고자 하는 목적으로 수행되었다. 이 연구의 주요 내용은 첫째, 대학평생교육의 개념과 한국 대학평생교육의 발전과정 및 선행연구를 고찰하였고, 둘째, 연구동향 파악을 위해 대학평생교육을 다룬 국내 학위논문 및 학술논문을 시기와 주제 중심으로 분석하였으며, 셋째, 이를 바탕으로 한국 대학평생교육 연구의 특징과 문제점을 도출하고 발전 과제를 제시하는 것이다. 연구동향 분석을 위해 문헌조사와 연구물 분석방법을 사용하였으며, 1982년부터 2012년까지 국내에서 발표된 학위논문과 학술논문 총 250편을 대상으로 하였다. 연구주제를 총 7개 영역으로 유형화하여 분석한 결과, 대학평생교육 '프로그램 관련' 연구가 가장 많았으며 '제도 및 정책', '성인학습자', '직무담당자'를 다룬 연구는 취약한 것으로 나타났다. 본 연구를 통해 특정 프로그램을 분석하는 미시적 접근과 함께 거시적 안목으로 대학평생교육 연구권역 전반을 분석하는 도전적 연구의 필요성, 대학평생교육의 개념적 합의 및 역할과 발전과제에 대한 학계의 심도 있는 논의에 대한 요구, 대학평생교육의 주체인 '성인학습자'에 대한 연구의 확충을 과제로 제시하였다.",곽삼근,2014,https://www.riss.kr/link?id=A100055570
평생교육방법으로서의 토론기법의 이론적 구성에 대한 연구,"본 연구는 성인학습자들의 성찰성과 경험을 바탕으로 한 토론기법에 대한 이론 탐구와 현자에서의 실용가능성에 대한 탐색을 하였다. 토론기법은 성인학습자들이 스스로 사고하고, 결정하는 자율성의 원칙과 학습자의 경험과 내적인 판단원칙을 기초로 하는 자기 주도적 학습원칙과 연결되어 있다. 왜냐하면 토론은 성인학습자들의 일상생활과 생애사에서 드러나는 관심과 문제를 교육내용으로 연결시킬 수 있으며 대화진행을 통해 일상생활에 대한 성찰과 문제해결과정을 포함할 수 있기 때문이다. 토론기법은 기업교육, 노인교육과 민주시민교육 등의 영역에서 일상생활의 문제들을 해결할 수 있도록 유도하는 유용한 교육방법으로 제시될 수 있다.","박응희(Park, Eung Hee)",2008,https://www.riss.kr/link?id=A76450440
종교생활의 맥락에서 살펴본 성인의 영성학습 과정 : 가톨릭 신자들의 경험을 중심으로,"본 연구는 가톨릭 신자들의 신앙생활 경험을 중심으로 종교생활의 맥락에서 영성의 발달을 이끄는 성인들의 영성학습 과정을 살펴보는 것을 목적으로 한다. 이를 위해서 비교적 오랜 기간 성실하게 신앙생활을 해왔으며, 가톨릭에서 신앙적 모범으로 인정받은 신자 7명, 사제 1명, 수녀 1명의 경험을 심층적으로 청취하여 신앙에 영향을 미친 사건과 변화의 모습 및 특징을 살펴보았다.
연구를 통해서 드러난 영성학습의 과정을 요약하면 연구 참여자들은 초월적 존재인 하느님과 관계 맺고 일치하기를 바라는 마음을 가지고 신앙 활동에 몰입하였으며, 그 가운데 하느님의 현존을 인식함으로써 자기정화를 경험한다. 이러한 경험을 통하여 참여자들은 기존의 관점이 초월적 존재와의 관계 속에서 자기 자신, 타인, 세계를 이해하는 관점으로 변화하였을 뿐만 아니라, 변화된 자세로 삶을 살아가는 실천 양상을 보이게 된다.
본 연구를 통해서 영성학습의 과정이란 초월적 존재인 하느님과의 관계를 토대로 자신과 세계를 이해하는 새로운 인식을 얻는 동시에, 변화된 삶의 자세를 보이는 과정임을 확인할 수 있었다. 특히 영성학습과 영성 발달을 추동하는 영적 경험이 친숙한 일상에서 생소하고 낯선 것을 인식하는 경험이란 점에서 본 연구결과는 영성학습이 성인학습의 주요 주제인 비판적 사고와 밀접한 관련성을 가질 수 있음을 시사한다.",김한별(Kim Han byul),2015,https://www.riss.kr/link?id=A101879092
평생학습사회의 교육현실변화와 교육철학 연구의 과제,"21세기의 거시적 사회 환경의 변화 속에서 평생학습사회로의 이행이라는 변화는 교육적으로 중요한 의미를 지니는 변화라고 할 수 있다. 평생학습사회는 전통적 교수중심의 교육패러다임으로부터 학습자 중심의 교육패러다임의 변화 및 그에 따른 교육현실의 변화를 요구하고 있기 때문이다. 이러한 교육패러다임과 교육현실의 변화 속에서 제기되는 교육학 연구의 과제는 다각적으로 검토되어야 할 것이다. 본 논문은 규범적/개념적 접근을 특징으로 하는 교육철학적 연구에서 제기되는 몇 가지 기본적인 연구과제로서 1) 새로운 교육패러다임의 개념적 혼란 및 규범적 논의 부재 극복의 과제, 2) 삶의 각 발달단계가 지니는 고유 가치 인식의 과제, 3) 새로운 교육목적 및 교육적 인간상 정립의 과제, 4) 정의로운 교육기회 배분을 위한 평생 학습권 및 인권 개념 정립의 과제, 그리고 5) 교육학 연구의 방향제시 및 각 영역간의 대화 노력 선도 과제 등의 5가지의 과제에 대해 논의하고 있다",유현옥(Yoo Hyeon-Ok),2005,https://www.riss.kr/link?id=A76482246
3D 푸드 프린터의 실과교육 활용 방안 탐색,"이 연구는 3D 푸드 프린터의 실과교육 활용방안을 탐색하기 위하여 실시하였다. 이를 위해 자료 조사를 통해 3D 프린팅의 원리 및 활용 사례, 3D 푸드 프린팅의 원리, 활용 사례, 재료, 관련 연구에 대하여 문헌 고찰과 인터넷을 활용하여 조사하였다. 3D 푸드 프린터가 교육 현장에서 접근하기 어려우므로 3D 푸드 프린터 활용 수업의 기초 단계에서 활용 가능하도록 일회용 주사기를 활용한 3D 푸드 프린팅 원리 학습 방안, 분자요리를 활용한 3D 푸드 프린팅 재료 학습 방안을 탐구하였다. 그 결과는 다음과 같다. 실과 식생활영역에서 3D 푸드 프린터 활용 수업의 기초 단계에서 적용할 수 있는 방법은 3D 푸드 프린터로 식품 디자인하기, 3D 푸드 프린터의 프린팅 원리 탐구하기, 3D 푸드 프린터의 재료 탐구하기, 토론하기 등이 가능하다. 3D 푸드 프린터가 교육 현장에서 접근하기 어려우므로 3D 푸드 프린터의 원리를 이해하기 위하여 일회용 주사기를 이용하였다. 일회용 주사기에 밀가루를 반죽하여 넣어 압출함으로써 3D 푸드 프린터의 적층원리를 이해하도록 하였다. 3D 과일 프린터는 분자요리 기법을 활용하는데, 과일을 진짜 과일과 유사한 맛과 향을 나타낼 수 있도록 망고 주스를 구체화시켜 망고 맛 스파게티와 카나페를 만드는 과정을 통해 3D 푸드 프린터의 재료에 대한 이해가 가능하도록 하였다. 이 연구에서는 3D 푸드 프린터의 활용은 교육적 가치를 가지고 있는 반면 교육 현장에서 접근하기 어렵기 때문에 3D 푸드 프린터 활용 수업의 기초 단계에서 적용가능 하도록 일회용 주사기를 활용하여 3D 푸드 프린터의 원리를 이해하고, 분자요리를 이용하여 3D 푸드 프린터의 재료에 대한 이해를 도움으로써 활용 방안을 탐색하였다. 추후 여러 가지 재료로 푸드 잉크로서 기능을 할 수 있는 안정적인 레시피 개발과 온도 유지와 출력량 조절 등 기술적인 접근을 통해 쉽게 사용할 수 있는 3D 푸드 펜이 개발되었으면 한다.","이성숙(Lee, Sung Sug)",2020,https://www.riss.kr/link?id=A107214669
Making 경험에서 나타나는 의미에 대한 들뢰즈의 ‘배움’ 철학 기반 탐색,"이 연구의 목적은 Making 경험에서 나타나는 의미를 들뢰즈의 ‘배움’ 철학에 기반하여 탐색하는데 있다. 이 연구의 내용은 Making의 경험에 대한 의미 탐색은 질적 연구를 수행하고 그 결과를 들뢰즈의 ‘배움’ 철학에 기초하여 해석하는 것이다. 연구의 방법은 크게 문헌연구와 질적연구로 이루어졌다. 문헌연구를 통해 들뢰즈의 ‘배움’ 철학을 탐구하였고, 질적 연구를 통해 Making 경험에서 나타나는 의미를 탐색하였다. 연구참여자는 G교육대학교 1학년과 2학년 학생이었다. Making 과제는 종이탑 쌓기, 영상 제작하기, 쓸모있는 생활용품 만들기, 온라인 메이킹 독서프로그램 개발, 골판지를 이용한 독서대 만들기이다. 연구 결과는 다음과 같다. 이 연구의 결과는 크게 시작 단계, 전개 단계, 마무리 단계로 구분하여 정리되었다. 시작 단계에서 나타나는 Making 경험의 의미는 막막함, 두려움, 생경함, 압박, 고민, 유목적적 시작이었다. 전개 단계에서 나타나는 Making 경험의 의미는 시행착오의 과정, 우연한 마주침의 연속과 해 찾기, 지속적으로 강요되는 사유의 과정이었다. 마지막 단계에서 나타나는 Making 경험의 의미는 창조, 개선, 확장, 연속, 적용이었다. 들뢰즈의 ‘배움’ 철학에 의하면 학생들이 Making에서 경험하는 것은 제시된 길을 따라 동일성을 찾아가는 앎의 과정과 다르다. 마주친 질문에 대한 답을 스스로, 그리고 다르게 찾아가는 과정이고 그것의 답은 다양하다. 이것이 메이커 활동의 의미라고 볼 수 있다.","송현순(Song, Hyunsoon)",2021,https://www.riss.kr/link?id=A107334354
마을-학교 연계사업 참여 교사들의 인식변화과정 연구,"평생교육의 이념을 기반으로 한 평생학습사회에서는 학교가 가정, 미디어, 지역사회와 같은 다른 교육 시스템들과 적극적으로 연계해야 함을 강조하고 있다. 이러한 맥락에서 본 연구는 서울지역 마을-학교 연계사업에 참여하고 있는 공교육 교사들이 어떤 인식 변화과정을 보이는지 전환학습 관점에서 살펴보고자 사례연구를 실시하였다. 연구 결과 참여자들은 낯선 마을과의 만남에서 발생한 ‘왜 마을인가’의 딜레마에서 시작하여 기존의 교육 준거틀에 대한 비판적 검토, 새로운 시도와 교사의 확신을 거쳐 새로운 관점에 근거한 삶의 재통합이라는 인식변화 과정을 보이는 것으로 나타났다. 또한 인식변화와 관련된 특성으로는 가시적인 학생들의 변화 목격, 배움과 삶의 일치를 지향하는 교육과정 재구성 경험, 구체적 삶의 터전으로서의 마을 공간이 탐색 되었다. 이러한 주요 특성들은 교사들에게 마을사업에 대한 교육적 확신을 갖도록 하였으며, 이 교육적 확신은 교사들로 하여금 마을사업의 어려움 속에서도 다시 사업에 참여하도록 하는 원동력으로 작용하고 있었다. 마지막으로 이 논문은 평생교육이 향후 공간 담론과 지역의 공간구축에 더욱 관심을 가질 필요가 있으며 학생과 교사, 그리고 학부모를 포함한 지역주민들이 마을교육공동체의 주체로서 성장할 수 있도록 역량 강화에 기여해야 함을 주장하였다.","최은미(Choi, Eun Mi)",2020,https://www.riss.kr/link?id=A107088225
중증장애인의 고용확대를 위한 생산품우선구매제도 지정기준 개선방안 연구,"이 연구는 중증장애인생산품우선구매제도가 중증장애인의 고용성과나 직무유지 등의 고용의 질을 향상시키는 성과가 있는 지를 알아보고자 한 연구로 이를 위한 연구방법은 사회감사법의 모니터링이며, 연구에서 나타난 결과는 첫째, 중증장애인생산품우선구매제도는 장애인과 중증장애인의 고용기회 확대라는 측면에서 성과가 있는 것으로 나타났으나 성과의 내용적인 측면에서는 매출액이나 우선구매 금액이 증가하는 수준에서 고용성과나 직무유지 등의 고용의 질적인 측면의 성과에는 문제가 있는 것으로 분석되었으며, 둘째, 우선구매 총액과 매출액이 상위의 지정시설이 오히려 하위인 시설보다 장애인과 중증장애인 근로자, 직무유지 율이 낮은 것으로 나타나 재지정 기준에 문제가 있는 것으로 나타났으며, 셋째, 지정시설의 다른 유형인 장애인복지단체와 장애인직업재활시설의 경우 장애인과 증증장애인 근로자 수와 지정시설 수는 장애인직업재활시설이 많은데 매출액과 우선구매 비율은 오히려 장애인복지단체가 많았으며, 장애인과 중증장애인 근로자 고용성과나 직무유지율도 장애인직업재활시설의 성과가 장애인복지단체 보다 큰 것으로 나타나 장애인복지단체의 지정기준에 문제가 있는 것으로 나타났으며, 넷째, 이 같은 결과가 나타난 것은 중증장애인생산품 시설 지정을 위한 적격성 기준이 장애인과 중증장애인 고용기회 확대라는 기준을 우선적으로 적용하기 보다는 생산설비나 관련 생산인력 배치 등의 직접생산 기준이 적용되고 적접 심사하는 과정에서 장애인과 중증장애인의 일자리에 대한 충분한 확인에 제한점이 있었기 때문인 것으로 분석되었다.","나운환(Na, Woon Hwan)",2021,https://www.riss.kr/link?id=A107840527
