
심인성반응으로 신체증상을 호소하는 초등학생에 대한 로저스상담의 효과 분석,"본 연구는 심인성(心因性)반응으로 신체증상을 표현하는 초등학생에게 증상해결을 위하여 로저스상담과 플라시보(placebo)처치를 적용해보고, 그 효과를 규명하고자 하는데 목적을 두었다.
연구자가 근무하는 충남 A시 초등학교 보건실 방문학생 중 심인성반응에 의해 신체증상을 표현하는 학생을 대상으로 학교보건실 방문 순서에 따라 2012년 9월 1일부터 10월 15일까지 15명에게 로저스상담을 실시하였으며, 2012년 10월 16일부터 11월 30일까지 15명에게 플라시보(placebo)처치를 적용하였다. 학교현장에서 초등학생을 대상으로 상담자가 진정성을 가지고 공감하고 수용하면 긍정적인 인간관계가 이루어짐을 경험하였다.
또한, 정신건강수준의 측정을 위해 가장 일반적으로 쓰이는 방법인 한국판 일반정신건강척도 'The Korean General Health Questionnaire(KGHQ-20문항)'을 사용하여 사전-사후검사를 실시하였다. 연구결과, 각각의 처치에서 긍정적인 변화가 있었으며, 로저스상담이 더 유효한 것으로 나타났다.","이영욱(Lee, Young-Wook)",2013,https://www.riss.kr/link?id=A100122547
중학생의 자아탄력성과 가족건강성이 진로성숙도에 미치는 영향,"본 연구의 목적은 중학생의 자아탄력성과 가족건강성이 진로성숙도에 얼마나 영향을 미치는지 확인하는 데 있다
이에 따라 '중학생의 자아탄력성과 함께 가족건강성이 진로성숙도에 얼마나 영향을 미치는가?', '중학생의 자아탄력성, 가족건강성은 진로성숙도에 얼마나 영향을 미치는가?'를 연구 문제로 설정하였다. 연구를 위하여 충청남도 Y군의 중학교에 다니는 남ㆍ여 학생 415명을 임의 표집하여 가족건강성, 자아탄력성, 진로성숙도 척도로 구성된 설문지로 실시하였다. 그 중 회수되지 않거나, 무성의하게 응답한 설문지를 제외하고, 성별과 학년간의 비율을 일정하게 하기 위하여 총 115부를 제외한 나머지 300부를 가지고 중다선형회귀분석을 실시하였다.
이에 대한 연구 결과, 자아탄력성과 가족건강성은 진로성숙도와 정적 상관관계가 있으며, 특히 자아탄력성이 가족건강성보다 진로성숙도에 크게 영향을 미치는 것으로 나타났다. 가족건강성은 자아탄력성에 비해 진로성숙도에 크게 영향을 덜 미치나 진로성숙도에 유의미하게 영향을 미친다고 할 수 있다.
이러한 결과로 미루어 다음과 같은 교육적 함의를 지닌다. 교육 기관과 사회복지 기관에서는 다양한 학부모 교육을 통하여 가족건강성에 대한 인식을 널리 알리고, 지역 사회 기관들은 서로의 긴밀한 연계를 통하여 가족의 건강성을 높일 수 있는 프로그램을 제공하여 가정들의 결속력을 높일 수 있도록 지원해야 할 것이다. 또한 학교 현장과 교사들은 학생들의 자아탄력성과 진로의식성숙도를 향상시키기 위하여 효과적인 진로 교육ㆍ상담 프로그램을 개발하고 운영하는 노력을 해야 할 것이다.",이경선(Kyung-Sun Lee),2011,https://www.riss.kr/link?id=A100122535
이마고 부부관계치료를 통한 어린 시절 상처 인식의 변화와 배우자 이미지 변화 경험에 대한 현상학적 연구,"본 연구에서는 이마고 부부관계치료를 경험한 참여자들이 과거 자신의 어린 시절의 상처에 대하여 어떤 인식의 변화를 경험했으며, 자신들의 배우자에 대한 이미지에 있어 어떤 변화를 경험하는지를 탐구하고자 하였다. 따라서, 어린 시절의 상처 인식의 변화 경험과 배우자 이미지 변화 경험이 참여자들의 삶에 어떠한 의미로 인식되고 있는지를 알아보기 위해 6명의 참여자들을 통해서 연구 자료를 제공받았으며 반구조화 면담을 통해 자료를 수집하였다. 면담자료는 van Manen의 해석학적 분석방법을 주요 분석의 틀로 사용했으며, 연구 과정에서의 권력적 해석의 오류를 최소화하기 위해 교수급 질적 연구 전문가의 검증과정을 거쳤다. 분석과정에서 개방코딩을 통해 486개의 의미 단위를 추출하였고, 축코딩을 통해 118개의 하위 주제를 묶고, 범주화를 통해 16개의 하위 범주로 분류 통합하였으며, 최종적으로 5개의 상위 범주를 도출하여 본질적 주제로 분류하였다. 논의 부분에서는 연구 참여자의 어린 시절 상처 인식의 변화와 배우자 이미지 변화 경험의 의미를 밝히고자 하였다.",변복수 ( Bok Soo Byun ),2010,https://www.riss.kr/link?id=A87025101
이성관계를 통한 가족 및 자기이해에 관한 사례연구,"본 연구에 소개된 사례는 이성관계에서 어려움을 느낀 내담자가 그 동안 눌러왔던 감정을 해소하고 남자친구와의 관계를 더 잘 해보기 위해 시작된 상담사례이다. 처음에 내담자는 자신이 어리고 남자친구를 잘 이해해주지 못하기 때문에 상대가 자기에 대한 부족감을 느낀다고 자책하는 경향이 강했고, 그로 인해 자신이 여자친구로서 존중받지 못하고 있다는 감정조차 자각하지 못하고 있었다. 또한 이성관계에서 중요한 상호 의사소통이 원활하지 않아 남자친구의 비일관적이고 무시하는 태도에 대해서 표현하지 못하고 일방적으로 참고 맞춰주는 방식으로 관계를 유지하고 있었다. 상담이 진행되면서 이러한 내담자의 모습이 어머니의 모습과 닮아 있으며, 내담자는 이를 긍정적으로 내재화하고 있음을 발견하게 되었고 이에 보다 객관적으로 상대를 바라보고 자신의 욕구나 감정을 표현하고 충족시키는 것이 중요함을 인식하게 되었다. 아직 훈습되어야할 부분들이 남아 있지만 내담자의 졸업과 구직활동으로 상담을 종결하고 추수상담을 진행 중이다.",장수정,2006,https://www.riss.kr/link?id=A76521457
문화예술교육 전문인력양성 연수 프로그램의 만족도 분석,"한국문화예술교육진흥원이 매년 주관하는 문화예술교육 아카데미 CETA(Creativity Education Through Arts) 연수 프로그램은 우리나라 문화예술교육의 확대를 위한 중요한 연수프로그램이라 할 수 있다. 본 연구에서는 교육 만족도를 전반적인 교육연수의 만족도와 개인적인 성과 만족도로 구분하여 연수 만족도를 회귀분석 하였다. 분석결과를 보면, 첫째, 연수 프로그램 참여자가 연수에 참여한 목적을 달성하였는지에 대해서는 절대 다수가 기대한 수준의 성과를 달성하였거나 그 이상의 성과를 달성하였던 것으로 나타났다. 둘째, 연수 참여 목적의 달성 정도와 연수 프로그램의 만족도 사이에는 높은 상관성을 가지고 있었다. 셋째, 연령대와 참여 회수에 따라 만족도가 상이하게 나타났는데 이는 연수 프로그램을 모듈화 하는 단계적 연수 과정을 통해 참여자의 교육성과를 높여야 한다는 의미로 이해할 수 있겠다. 장기적으로 문화예술교육 아카데미 CETA의 운영은 문화예술교육과 관련된 전문인력 개발 및 연구와 교육의 제공은 물론 수요 지향적 고급 인력의 부족 해소와 지속적인 능력 개발 지원 체제 등의 부재를 해결한다는 의미에서 국가적으로 중요한 의미를 지닌다. 따라서 본 연수프로그램은 문화예술교육 인재양성을 위한 교육과정과 교육콘텐츠를 지속적으로 개발하고 종합적인 창의성 교육체계를 구축할 수 있는 프로그램으로 발전시켜야 할 것이다.",이해춘,2014,https://www.riss.kr/link?id=A100122542
상담 석사 과정에 대한 석사생들의 교육 경험 및 만족도 분석,"본 연구는 국내 상담 석사 교육과정에서 제공되는 교육활동의 실태와 내용을 상담 석사생들의 관점에서 확인하고, 그들의 교육 경험과 만족도를 탐색하기 위하여 수행되었다. 이를 위해 상담관련 전공이 개설되어 있는 일반 및 특수대학원, 전문대학원 석사과정에 재학 중이거나 졸업한지 3년 이내인 상담 전공생 139명을 대상으로 설문조사를 실시하였다. 상담 석사과정에서 제공되는 교육활동을 크게 수업, 실습, 연구, 진로지도의 측면에서 살펴본 결과, 우리나라 상담석사과정 교육은 수업을 중심으로 이루어지고 있으며 상대적으로 실습 훈련이나 연구 활동, 진로지도가 충분히 이루어지고 있지 않았다. 이에 따라 상담 석사생들은 개인적으로 실습훈련 할 곳을 찾아야 하는 어려움을 겪고 있으며, 지도감독이나 관리가 이루어지는 체계적인 실습 훈련을 받고 있지는 못하는 것으로 확인되었다. 상담 교육과 상담 현장을 효과적으로 연계할 수 있는 제도 마련을 위해 미국의 대학원 교과과정에서 제공되고 있는 상담 실습 훈련 및 상담 현장과 대학원 간의 실습 연계제도에 대하여 살펴보고 우리나라 상담관련 전공 대학원 석사과정에서 보완되어야 할 실습훈련, 연구 활동 및 진로 지도의 측면에 대하여 제언하였다.",조윤진 ( Yoon Jin Cho ),2010,https://www.riss.kr/link?id=A87025111
장 의존성과 내외 통제성의 일치여부와 자아개념,"선행 연구들은 장 의존적 지각 양식보다는 장 독립적 지각 양식을， 그리고 외적 통제의 신념보다는 내적 통제의 신념을 긍정적인 자아 개념과 관계하는 것으로 밝혀 왔다. 이와 같이 장 독립성 혹은 내적 통제성이란 한 측면의 우세성을 입증한 연구와는 달리 본 연구에서는 장 의존성과 내외 통제성 차원올 동시에 고려하여 나타나는 상호작용 효과가 자아 개념의 예측에 있어서 중요한 요인임을 밝히고자 하였다.
본 연구의 목적을 위해서 3가지 가설을 검증하였다.
첫째 장 의존성과 자아 개념의 관계를 살펴본 결과 가설 1에서 예견한 대로 장 독립적인 개인이 장 의존적 개인보다 더욱 긍정적인 자아 개념을 갖는 것이 확인되었다. 추가적으로 남녀를 분리하여 장 독립적 집단과 장 의존적 집단간의 차이를 분석하였다. 그 결과 남녀 모두에게서 장 독립적인 집단이 장 의존적 집단보다 더 긍정적인 자아 개념을 갖는 것으로 나타났는데， 이러한 경향성은 남아에게서만 장 의존성과 자아개념이 정적인 관계를 지닌다고 밝힌 Pawelkiewicz & Mcintire(975) 과 Hoffman(1978) 등의 연구 결과와는 일치하지 않았다. 이들의 연구에서는 국민학생을 피험자로 사용한 것에 비하여 본 연구에서는 연구 대상이 대학생이였다. 이와 갈이 연령층이 달랐다는 점에서 동일한 결과를 산출하지 못했을 수 있다. 그러나 장 독립적/ 장 의존적 집단간의 차이의 유의수준이 여자 집단의 경우 p<.005, 남자 집단의 경우 p<.001로써 남자 집단에게서 장 의존성과 자아 개념의 관계가 더욱 뚜렷하게 나타났다. 이러한 사실을 여자들보다 남자들이 장 독립적일수록 높은 자아 개념올 갖는 경향성이 있음을 말해 주며 이는 위에서 언급된 연구 결과와 일관된 방향에 있다.
둘째 선행 연구와 일관되게 본 연구에서도 내적 통제 집단은 외적 통제 집단이 더욱 긍정적인 자아 개념을 갖는 것으로 밝혀졌다.
셋째 가설 3에서 예측한 바와 같이 두 변인의 일치를 보이는 개인이 불일치 되는 개인보다 더욱 긍정적인 자아 개념을 갖는 것으로 나타났다. 특히 일치 집단은 총자아긍정 점수의 하위척도인 자아 정체성， 자아 수용성， 자아 행동성점수들간의 변산점수가 19점이었으며 불일치 집단은 30점이었다. 변산 점수는 각 유목간의 점수차이를 양적으로 측정한 것으로 이 점수가 낮은 사람은 자아 개념의 항상성과 안정성을 지니고 있다고 여겨지며 높은 점수는 자아 개념의 항상성이 유통되는 것을 의미한다고 한다(정원식， 1965). 이러한 점에서 일치 집단은 불일치 집단보다 자아 개념의 안정성을 예측할 수 있다. 그러므로 장 의존성과 내외 통제성의 상호작용이 3개 자아 점수들에 대해 통일한 의의 수준인 p<.001 수준에서 유의미하게 나타난 사실은 자아 점수들 간의 변산 정도가 작았다는데서 비롯되는 것 같다.
이상의 3개 가설들에 대한 논의들을 종합하여 보건대， 장 의존성 차원의 장 독립성과 내외 통제성 차원의 내적 통제성이 자아 개념과 관계하는 요인들로 밝혀졌다할지라도 두 변인을 함게 고려하여 나타난 상호작용 효과는 장 독립적 지각 양식과 내적 통제의 신념이 앞서 기술된 바 있는 몇몇 심리적 측면에서 우세하다는 결과들을 제한하여 설명하게 한다. 즉 장 독립적 양식을 취하는 개인은 통제 소재의 방향이 내적으로 향할 때 자아 개념을 긍정적으로 지니게 되고 또한 열세하게 간주되었던 장 의존적 양식을 취하는 개인이라 해도 외적 통제의 신념을 가질 때 높은 자아개념을 기대할 수 있는 것이다. 따라서 자아 개념의 예측에 있어서 어느 한 측면의 우세성보다 여러 측면의 상호작용을 고려하는 것이 중요함을 시사해준다.
한편으로 Lefcourt와 Teledgi (1971)가 장 의존성 구조와 내외 통제성 구조를 보다 상위 차원인 지각적 측면과 기대 측면으로 규정한 것처럼 장 의존성은 지각적 체계의 하나로， 내외 통제성은 인지적 체계의 하나로 간주할 수 있을 것이다. 이 두 체계의 일관성이 어떤 연유로 보다 긍정적인 자아 개념과 관계하는가에 대한 가능한 추론으로써 Seeman의 주장을 들 수 있다. 앞서 언급된 바와 같이 Seeman은 성격의 통합적 현상으로서 유기체 하위 체계간의 일치 경향성을 주장하고 이러한 일치 경향성은 보다 효율적인 기능을 이끈다고 하였다. 그러므로 장 의존성과 내외 통제성의 일치는 지각적 체계와 인지적 체계간의 상호작용의 한 결과임을 추측할 수 있으며 이것이 보다 긍정적인 자아 개념을 이끌었을 수 있다.
이러한 맥락에서 앞으로의 연구는 자아 개념 혹은 심리적 건강을 예측할 때 지각적 체계와 인지적 체계로 간주할 수 있는 또 다른 구조들을 사용하여 동일한 양상의 결과를 산출할 것인지 살펴보아야 할 것이다. 아울러 지각적， 인지적 체계가 아닌 다른 체계들간의 일관성도 심리적 건강과 관계하는지 밝혀보는 것은 인간의 심리적 건강을 이해하는데 도움이 될 것이다.
본 연구는 장 의존성과 내외 통제성의 일치와 자아 개념의 인과적 관계를 입증한 것이 아니므로 한 측면의 우세성보다 여러 측면의 적절한 상호작용(흑은 통합적 과정)이 보다 심리적 건강을 이끈다는 인과적 설명을 위해서는 실험적 연구와 종단적 연구가 앞으로의 연구과제로 남아 있다.",권희경,1991,https://www.riss.kr/link?id=A82690198
산 자와 죽은 자의 선물 교환과 믿음체계:인도네시아 남 술라웨시 (South Sulawesi) 섬의 따나 또라자 (Tana Toraja) 장례식의 사례,"이 글은 인도네시아 남 술라웨시(South Sulawesi)의 따나 또라자(Tana Toraja) 지역의 장례식을 대상으로 산자와 죽은 자의 선물 교환과 믿음체계 사이의 상호 관계에 대한 기술과 분석을 통해 산자와 죽은 자 사이의 거래의 경제적, 문화적 특징과 그 의미를 고찰하기 위한 것이다. 또라자의 장례식은 죽은 자를 위해 산 자들이 정성과 제물을 들이는 증여와 거래의 현장이다. 그리고 그러한 증여와 거래가 발생하는 이유는 공동체 내 자신의 사회적 지위와 결부되기 때문이다. 장례식에서 산 자들은 죽은 자를 애도하기 위해서만 물소나 돼지와 같은 제물을 선물하는 것이 아니다. 그것은 장래를 위한 투자이기도 하다. 장례식은 산 자와 죽은 자와의 증여와 거래를 매개로 하여, 죽은 자와 산 자, 그리고 산 자들 사이의 유대를 더욱 강화하고 돈독하게 하는, 소위 친목과 유대의 장인 것이다. 장례식에서 선물을 가져 온 사람들의 이름이 호명된다는 점에서, 이는 조문객들 로서는 생전에 죽은 자에게 입었던 은혜를 갚는 것이고, 훗날에 죽은 자의 후손 들에게 그에 대한 보답이나 답례를 기대할 수 있다는 점에서, 장례식은 산 자와 죽은 자, 산 자들 사이의 증여와 거래가 이루어지는 문화 현장인 것이다.",홍석준,2015,https://www.riss.kr/link?id=A100549764
"성인애착, 공감능력 및 결혼만족도 간의 관계","본 연구의 목적은 성인애착, 공감능력 및 결혼만족도 간의 관계를 알아봄으로써 부부들의 결혼만족도에 영향을 미치는 요인을 살펴보는 것이다. 이를 위해 서울, 인천, 경기 지역의 기혼자를 대상으로 성인애착, 공감능력, 결혼만족도 수준을 검사하였다. 연구결과 남성이 여성에 비해 높은 결혼만족도를 보였고, 여성이 남성보다 높은 정서공감능력을 보였다. 성인애착유형별로 살펴볼 때, 안정형이 가장 높은 결혼만족도를 나타내었고 몰두형이 가장 높은 공감능력을 보였다. 성인애착과 공감능력, 결혼만족도의 관계를 살펴본 결과, 성인애착과 결혼만족도 간에는 부적상관, 공감능력과 결혼만족도 간에는 정적상관이 나타났다. 성인애착과 공감능력이 결혼만족도에 미치는 영향을 위계적으로 살펴본 결과, 회피애착이 결혼만족도에 가장 크게 부적으로 영향을 미치는 것으로 나타났다. 본 연구결과들을 종합해 볼 때, 성인애착과 공감능력이 결혼만족도에 영향을 미치는 중요한 요인들임을 알 수 있었다. 특히 유아시절 형성된 애착패턴은 성인기로 이어져 결혼 후 부부생활에까지 영향을 미치고 공감능력 또한 결혼만족도에 정적인 영향을 미친다는 결과는, 어린 시절 양육환경의 중요성에 대한 확인과 공감적태도를 촉진시키는 프로그램이나 교육이 부부관계를 향상시키는 하나의 방안이 될 수 있음을 확인해주었다.",정경아 ( Kyung A Jung ),2010,https://www.riss.kr/link?id=A87025103
프랑스 교육복지안전망 연구 -2015년 우선교육정책재설립 시행을 중심으로-,"본 연구에서는 프랑스 교육복지정책의 기본노선인 우선교육정책과 그 연계운영방식인 프랑스 교육복지안전망의 우선교육네트워크를 분석하였다. 프랑스 교육안전망의 개념은 2원적인 의미를 갖고 있다. 1차적인 연계망은 학교간 교육연계망으로 이루어진 우선교육네트워크의 기능이고, 2차적인 연계망은 우선교육네트워크-시ㆍ구청-교육지원청-지자체 민ㆍ관 교육협력기관으로 이루어진 다자적인 교육연계망의 기능이다. 즉 우선교육정책 안의 교육연계망은 교육거점 중학교를 중심으로 유치원-초등학교-중학교를 총체적으로 아우르는 학교단위 교육협력을 도모하게 할 뿐 아니라 시ㆍ구청 및 지역사회 민ㆍ관 교육연계기관과 다자적인 교육협력 운영체제를 이루게 한다. 학교는 모두를 위한 열린 장소로서 교육네트워킹을 작동시키는 구심점의 역할을 하고, 이는 현장중심의 자율적 시스템으로 이어져 지역교육자원의 체계화와 통합에 일조하고 있다. 우선교육정책을 중심으로 작동되는 프랑스 교육안전망의 의의는 첫째, 본 정책을 계기로 아동ㆍ청소년의 총합적 생활세계를 위한 통합교육네트워킹 시스템 구축이 시작되었다는 점, 둘째, 학교내-학교간-학교밖의 교육협력이 활성화된 점, 셋째, 본 정책과 도시개발정책의 공동참여로 지역교육공동체에 대한 인식을 강화시킨 점, 마지막으로 기타 아동ㆍ청소년정책과 연계를 통한 부처 간 사업에 시너지 역할을 할 수 있다는 점이다. 교육지원체제로서 교육네트워크가 교육복지안전망의 핵심적 작동방식이라는 점은 이제 막 교육복지우선지원사업과 함께 교육안전망 구축을 정착하기 시작한 한국에 주는 시사점은 다의적일 것이다.",이영란 ( Young Ran Lee ),2016,https://www.riss.kr/link?id=A101832537
성교육 담당교사의 성역할고정관념적 태도에 관한 연구,"성교육 담당교사들의 성역할 고정관념적인 태도는 평균의 차이검중(특히 일원변량분석과 3-way 변량분석 )을 통하여 분석하였다. 그 결과 및 시사점을 요약하면 다음과 같다.
첫째， 대부분의 교사들은 전통적인 성역할 고정관념적인 태도를 가지고 있는 것으로 나타났다. 이러한 남자교사들이 여자교사들보다 더 보수적이며， 고연령 교사일수록， 그리고 기흔교사일수록 전통적인 성역할 고정관념이 강하게 나타난다. 이와같은 사회-인구학적인 변인에 따른 태도의 변화는 성역할 고정관념의 세영역별로도 동일하게 나타나 성， 연령， 혼인상태는 성역할 태도에 중요변수로 작용하고 있음을 알 수 있다.
둘째， 성역할 고정관념의 세가지 영역간의 상관관계가 매우 높게 나타났으며， 전체 성역할 고정관념에 대한 각 영역의 상관관계 또한 높게 나타났다. 특히 성별분업에 대한 고정관념적 측면의 전체에 대한 상관계수가 가장 높게 나타난 것은 성역할 태도 형성에 결정적인 영향력을 미칠 것으로 해석할 수 있다.
셋째， 세가지 영역을 평점평균으로 분석해 볼 때， ‘생’에 대한 고정관념적 측면이 가장 높고 (평점평균 2.95) , 성별분업에 대한 고정관념 (2.86) , 심리적 성차에 대한 고정관념 (2.77) 의 순으로 나타났으며， 대체로 순결이데올로기와 노동의 공사 구분의식이 높은 것으로 밝혀졌다. 이러한 결과는 성교육이 가부장제의 여성 성통제와 노동통제의 수단으로 이용될 높은 가능성을 나타내 주는 것으로 해석된다. 그러나 교육의 미래지향적이고 발전적인 특성을 살려 성교육의 쇄신작업이 가능하다고 판단되며 이를 위해서는 교사 재교육과 성교육의 체계적인 운영과 지속적인 연구가 요청된다.
본 연구의 결과는 성교육이 성역할 고정관념의 사회화에 중요한 기제로 기능하고 있음을 밝히고， 미약하나마 성역할 고정관념을 세가지 측면으로 나누어 분석하므로써 성교육이 가부장제의 여성에 대한 성과 노동의 통제수단으로써 이용될 가능성이 크다는 것을 발견하였다. 그러나 본 연구의 주된 관심은 성교육 담당교사들이 성역할 고정관념을 어느 정도 인식하고 있는가를 파악하여 학생들에게 미칠 영향에 있었기 때문에 여성의 성과 노동통제의 수단으로써의 성교육의 기능분석에는 한계를 가지며， 이를 위해서는 구체적인 성교육 현장에 대한 관찰과 성(sexuality)에 대한 심충분석이 이루어져야 할 것이다.
결국 성교육 담당교사들은 고정관념적인 성역할 태도를 갖고 있으므로 의식적이건 무의식적이건 학생들과의 상호작용 속에서 표출되어 학생들에게 영향을 미칠 것이 확실하다. 인간으로서 가지고 있는 모든 잠재력을 십분 발휘하여 완전한 인격체를 키워 나간다는 견지에서 교사들의 남녀평v에 대한 재인식이 절실히 요청된다. 교사들의 의식화를 위해서는 남녀평등적인 교사재교육 프로그램이 실시되어야 하며， 기존의 성교육지침서에 대한 내용분석을 통해 고정관념적인 성격을 탈피하여야 하며， 끊임없는 연구를 하여 남성중심적인 과학의 신비를 벗기는데 주력해야 함을 재차 강조한다.",황은자,1988,https://www.riss.kr/link?id=A82690189
