
"내외통제성, 인지정서조절 전략과 주관적 안녕감에 관한 연구","본 연구에서는 내외통제성, 인지정서조절 전략과 주관적 안녕감의 관계에 대해서 알아보았다. 연구대상은 경기, 서울, 기타 지역에 소재하고 있는 공립유치원 교사 256명이며 설문조사를 실시하였다. 결과는 다음과 같다. 첫째, 내적통제가 높은 사람은 낮은 사람보다 주관적 안녕감이 높은 것으로 나타났다. 그러나 주관적 안녕감 하위 요인별로 살펴보았을 때는 정적 정서에서만 유의미한 차이를 보였다. 둘째, 적응적 전략을 많이 사용할수록, 부적응적 전략을 덜 사용할수록 주관적 안녕감이 높은 것으로 나타났다. 그러나 주관적 안녕감의 하위 요인별로 살펴보았을 때, 적응적 전략을 많이 사용할 경우에는 삶의 만족도, 정적 정서, 부적 정서 모두에서 차이를 보였으나 부적응 전략을 덜 사용할 경우에는 삶의 만족도와 부적 정서에서만 차이를 보였다. 셋째, 내적통제가 높은 사람은 낮은 사람보다 적응적 전략을 더 많이 사용하는 것으로 나타났다. 넷째, 내외통제성과 인지정서조절 전략이 주관적 안녕감에 미치는 영향을 살펴본 결과 인지정서조절 전략이 내적통제성보다 주관적 안녕감을 더 잘 예측하는 변인이었다.",정상원,2008,https://www.riss.kr/link?id=A76521448
대학에서의 진로지도 ; 현실과 이상의 괴리,"위에서 제시한 것과 같은 형태의 체계적 진로지도는 아직 우리나라 어느 대학에서도 이루어지지 않고 있다. 현실적으로 학생, 진로지도기관, 학교제도 및 교수활동 등의 제요소가 진로선택 및 진로지도와 관련되어서 조화를 이루어 오지 못한 것도 사실이다. 흔히 학생들은 학교의 교육내용이 자신들의 진로문제와 직접적으로 연계되지 않는다고 불평을 하는가 하면 학교의 교육내용은 교양 및 학문적 탐구만을 강조하며 취업문제는 제2차적 관심으로 돌려오는 경향도 없지 않았다. 그러나 대학이 학생들과 사회의 요구에 부응하는 교육적 기능과 요소를 보강하기 위해서는 학생들의 진로문제와 연관시켜 학교의 교육기능을 재검토하고 진로지도를 위한 체계적이고 조직적인 접근이 요구된다고 볼 수 있다. 현재 취업을 원하는 여대졸업생이 계속 증가하며 여성인력에 대한 사회적 욕구가 높아져 가고 있다는 점, 취업 및 진학의 문제가 특히 여자대학에서 더욱 큰 문제로 부상하고 있는 점 등은 남자대학보다 여자대학에서 진로지도 및 진로교육이 보다 시급함을 시사하는 것으로 해석해 볼 수 있다.
현재와 같이 학생처나 상담실의 제한된 노력만으로는 여대 졸업생의 진로장애 요소를 극복하는데 미흡한 점이 많다고 볼 수 있다. 이제 이와같은 학생들의 진로문제를 학생만의 문제로 내버려두는 소극적 자세는 탈피되어져야 할 것이며 진로문제가 중요하다는 인식만으로는 문제해결에 큰 도움이 될 수 없다. 진로문제와 관련하여 대학은 지금까지의 교육 및 학생지도 문제를 거시적이며 제도적 차원에서 재 검토하고 현실의 진로문제에 정면으로 도전하는 제도적 구조적 변화를 시도하여야 할 것이다.",서경숙,1985,https://www.riss.kr/link?id=A82690182
반성적 사고와 전문가 교육,"현대 사회는 전문성을 점점 크게 요구하고 있다. 전문성을 발달시키기 위한 다양한 접근들 중 특히 경험을 통해 획득되는 실천적 지식에 대한 관심이 높아졌다. 실천적 지식은 경험 자체의 의해 얻어지는 것이 아니라 경험에 대한 반성적 사고를 통해 얻어지게 된다. 따라서 실천적 지식을 획득할 수 있는 중요한 방법들 중의 하나인 반성적 사고에 대한 앞으로의 연구 방향 및 활용 방안을 제시하기 위해, 반성적 사고의 개념에 대해 살펴보았고, 이러한 반성적 사고가 연구에 대한 검토 결과, 교사 교육에서는 반성적 사고와 교수 능력과의 관계, 그리고 반성적 사고를 통한 예비 교사 교육에 대한 연구들이 있었으며, 상담자 교육에서는 반성적 사고를 통한 훈련모델에 대한 연구와 반성적 사고 내용에 대한 연구가 있었으나 비교적 사고를 활용한 연구가 많지 않았다. 이러한 결과들을 통해 결국, 보다 폭 넓게 다양한 방면에서 반성적 사고에 대한 적응과 연구가 필요함을 알 수 있었고, 반성적 개념에 대한 보다 정확한 이해를 통해 효율적인 반성적 사고의 훈련이 이루어져야 함을 알 수 있었다.",손은정,2003,https://www.riss.kr/link?id=A30020831
신경증 경향을 가진 여대생과 정상 여대생의 가족 결속력 비교연구,"본 연구는 신경증경향군과 정상군의 가족결속력을 비교함으로써 신경증경향을 가진 여대생의 건강의 증진과 회복을 위해 효율적인 가족중심의 간호중재를 할 수 있는 기초자료를 제공하고자 시도하였다.
본 연구를 통하여 얻은 결과는 다음과 같다.
1. 정상군의 가족결속력은 평균점수가 3.676이고 신경증경향군의 가족결속력의 평균점수는 3.045이었다.
2. “신경증경향군의 가족결속력은 정상군의 가족결속력보다 낮을 것이다”라는 가설은 지지되었다(t=1.13， P=0.000).
3. 신경증경향군의 신경증경향정도와 가족결속력정도간의 상관관계
신경증경향군의 신경증경향정도와 가족결속력 정도간에는 유의한 역상관관계가 있었다(r=-0.1397, P≤0.01).
4. 신경증경향군의 일반적 특성과 신경증경향정도와의 관계
신경증경향군의 신경증경향과 유의한 관계가 있는 일반적 특성은 없었다.
5. 신경중경향군의 일반적 특성과 가족결속력정도와의 관계
신경증경향군의 가족결속력과 유의한 관계가 있는 일반적 특성은 어머니 학력(F=3.129， P≤0.035)이었다. 즉 어머니의 학력이 높은 집단에서 가족결속력정도가 높게 나타났다.
이상의 결과에서와 같이 신경증경향을 가진 여대생의 가족결속력이 저하되어 있다는 사실을 통해서 볼 때 신경증경향을 가진 여대생의 정신건강을 증진시키기 위해서 학교간호사는 가족결속력을 활성화 시킬 수 있는 방향으로 가족중심간호를 해야하며 이를 위해 기초자료로 가족결속력을 사정해야 되리라 믿는다. 더 나아가 여대생의 신경증 발현을 예방하기 위해서 학교간호사는 가족결속력을 강화시켜 주는 방향으로 가족접근적 간호를 계획해야 되리라 생각된다.",성명숙,1990,https://www.riss.kr/link?id=A82690195
한국형 단어연상검사 사례연구,"본 연구는 융의 단어연상검사에 토대를 둔 한국형 단어연상검사의 임상적 유용성을 알아보기 위한 탐색적인 시도이다. 피검자는 융 학파의 연상검사 방식에 따라 한국형 단어연상검사를 수행하였고 임상 면접을 하였다. 자료를 분석한 결과 한국형 단어연상검사는 피검자가 현재 당면하고 있는 문제들을 가려내고, 이러한 문제들과 기저의 콤플렉스간의 연결을 설명해주는 유용한 검사라는 결과를 보여주었다. 이 결과는 한국형 단어연상 검사가 상담 장면에서 내담자의 당면한 문제영역을 찾아내고, 이와 관련된 기저의 콤플렉스에 대한 자각을 촉진시킬 수 있는 유용성을 지니고 있음을 시사한다. 끝으로 한국형 단어연상검사의 제한점에 대한 논의와 제언을 하였다.",박현순,2005,https://www.riss.kr/link?id=A346361
자기표출훈련이 자기표출과 자아개념에 미치는 효과에 관한 일 연구,"자기표출이란 ""한 개인이 자신의 감정이나 생각등 자신에 관한 정보를 다른 사람에게 언어로써 의사소통하는 것""이다. 이러한 자기표출은 인간관계에서 중요한 측면을 이루고 있는 한 현상이라고 할 수 있다. 우리들은 일상생활에서 흔히 마음에 있는 말을 그대로 드러내기를 무척 두려워하고, 조심스러워하며 하고 싶은 말을 억지로 참고 지내는 경우가 많으며 심지어는 마음에도 없는 말을 할 때가 자주 있다.
자기자신이 경험한 사건이나 지금 당장 겪고 있는 문제와 관련된 자기자신의 느낌이나 감정을 솔직하게 그리고 정확하게 표현할 수 있다고 자신하는 사람은 그리 많지 않을 것이다. 특히 우리나라 사회에서는 감정표출을 억제하는 것이 말썽없이 세상을 편안하게 살아가는 것이라고 하여 감정표출을 억제하는 것을 미덕으로 삼아왔다. 그런데 현대 사회와 같이 복잡다사한 시기에 자신의 감정을 억제하려고만 하여 자신의 감정을 표출하지 않는 사람은 정서적으로 불안정하여 정신건강상 좋지 않을 것이다. 또한 이러한 사람은 자기의 감정을 이해하는데 둔감하기 때문에 다른 사람의 감정을 이해하기가 어려워 대인관계에서도 여러가지 문제를 일으킬 것이다. 따라서 자기표출을 적절히 하는 것은 정신건강을 증진시키고 의사소통과 인간관계를 증진시키며 친밀한 인간관계를 맺는데 도움이 된다.
Auerwald(1974) Hackney & Nye (1973)등은 대인관계가 원만하고 정서적으로 건강하며 성격이 원만한 사람들도 자기표출은 적극적이며 생산적이며 능률적인 생활을 가능하게 함으로써 개인의 자기실현(自己實現) 또는 자기성장(自己成長)에 결정적인 작용을 한다고 주장하고 있다. 따라서 본 연구에서는 자기표출이 다른 종류의 성격특성과 달라서 학습이나 훈련을 통해 의도적으로 비교적 쉽게 변화될 수 있다고 하는 이론적 주장(Himelstein & Kimbrough(1963), Cozby(1973), Stokes, Fuehrer & Child (1980))을 바탕으로 자기표출훈련을 집단상담의 한 형태로 여자대학생집단에게 실시하여 그 효과를 알아보고자 한다.",이승신,1987,https://www.riss.kr/link?id=A82690186
香 문화로 본 <滿殿春 別詞> 연구,"이 논문은 <만전춘 별사> 노랫말에 등장하는 '사향 각시'를 주목하여, 사향을 포함한 고려 시대의 香 문화와 관련하여 이 노래를 해석하였다.
특히, 이 노래는 내용적 일관성을 지닌 1인의 화자에 의한 것과 복수화자가 등장하고 시점이 이동하는 경우 등으로 나뉘는 이유가 4연의 '비오리', '연못', '여울'이 남성과 여성을 상징하고 있다고 보는 데서 비롯한다. 이와 같은 화자의 문제는 5연의 사향 각시와 관련하여 그 논란이 증폭되고 있다. 따라서 이 문제를 해결하기 위해서는 화자는 어떤 부류의 사람이고, 어떤 상황에 처해있는가를 찾아보는 것이 필요하다. 1연에서 죽음을 불사하겠다는 극단적인 언사에서 화자의 예사롭지 않은 처지를 알 수 있었다. 3연에서 죽어서도 함께 가자고 다짐했던 주체가 화자 자신이었다. 이를 통해 화자가 처하고 있는 심적 상태를 모색해볼 수 있었다. 이런 마음을 가진 화자 앞에 여울을 두고 연못으로 오는 비오리의 모습에서 화자는 여울과 같은 자신의 존재를 발견하게 된다. 이때 화자가 취할 방법이 상상 속의 환경에서 임을 기다리며 향 주머니를 안는 것이다. 최음제인 사향을 자신의 가슴으로 품었다는 것은 임을 유인하고자 하는 화자의 욕망을 반영한다. 임과 떨어져 지내며 받았던 상처를 치료하는 방법은 임이 자신에게 돌아오는 것이다. 약든 가슴이란 자신을 치유할 수 있는 임의 가슴을 지칭하며, 그런 임과 영원히 함께하고자 소망한다는 것이 화자의 바람이다.
이처럼 <만전춘 별사>는 현재 상황은 이별해 있지만 임에 대한 화자의 태도만큼은 이별이 아니라 화합을 위한 기다림의 정서 속에 있음을 보여 준다. 이런 정서 때문에 이 노래는 '임'과 '나'가 '임금'과 '신하'의 관계로 치환되어 영원히 함께하기를 소망하는 노래로 인식하여 전승되었다고 판단된다.","이정선(Lee, Jeong-seun)",2013,https://www.riss.kr/link?id=A100122551
이현화 연극에 나타난 폭력의 양상,"본고는 이현화의 연극에 나타난 폭력의 양상을 검토한다. 본고는 이현화의 희곡<산씻김>과 <카덴자>의 공간, 인물, 작중 인물들의 대사, '고문'의 방식과 이들 극에서의 관객의 역할을 분석함으로써 결과적으로 그의 극이 그려내고자 하는 폭력의 의미를 밝히고자 한다. 이현화의 희곡에 나타난 폭력의 의미를 명확하게 규명하기 위해서는 그의 연극의 형식과 기법, 소재에 대한 세밀한 분석이 선행되어야 한다. 본고는 이현화의 연극에서 발화 행위를 중심으로 그 발화 행위가 상징하는 폭력의 의미를 살펴본다. 이현화의 연극에서 폭력을 행하는 인물들의 언어는 의사소통의 역할을 상실하며 강박적 약호로 기능한다. 또한 본고는 이현화의 연극에서 나타나는 통과의례적 폭력성에 대해서도 살펴본다.
통과의례는 분리―과도-통합의 과정으로 이루어지는데, 이현화의 두 희곡은 이와 같은 통과의례의 과정을 충실히 따르고 있는 것으로 보인다. '분리'의 단계에서 인물은 기존의 세계와의 완전한 단절을 경험한다. 두 작품에서 인물들은 우연한 기회로 기존의 세계와 단절되게 되는데, 그들이 맞는 새로운 세계는 기존의 상식이나 법이 작동하지 않는 곳이다. 그들은 자신들이 기존의 세계로 쉽게 돌아갈 수 없다는 것을 수긍하고 자신들에게 가해지는 일들을 순순히 수용하게 된다. 본고는 또한 아르토의 잔혹연극론과 이현화의 연극을 비교분석한다. 아르토의 잔혹연극론이 일상에 억눌려있던 관객들의 본능을 밖으로 표출하도록 하는 데 초점을 맞췄다면, 이현화의 연극은 이런 역할을 일부 실현하면서도 반복되는 상징을 통해 감각과 이성적 통찰을 함께 끌어낸다.
이현화의 <카덴자>와 <산씻김>에서 공통적으로 추출할 수 있는 폭력의 양상은 다음과 같다. 이 두 작품에서의 폭력은 악한 의도 없이, 일정한 제의적 과정에 의해서 체계적으로 행해진다. 두 작품에서 제시되는 폭력에는 인과성이 없으며, 가해자와 피해자 모두 익명의 인물들이다. 만일 이 극이 어떤 구체적인 상황에서, 분명한 맥락 속에서 벌어지는 폭력을 보여줬다면, 이 극이 수용할 수 있는 폭력의 상징은 축소될 수밖에 없었을 것이다. 인물들의 이름이나, 직업, 사회적인 기호들이 생략된 상태에서 벌어지는 폭력은 현대 사회를 살아가는 모든 개인의 이름을 호명한다. <카덴자>에서 여성 인물에게 신체적인 가학 행위를 하는 장면을 적나라하게 보여줬다면, <산씻김>으로 오면서 이런 가학행위는 줄어들고, 보다 모호하고 상징적인 행위들의 빈도가 높아진다. 상징이 강화되면서 이현화의 연극이 그려내는 폭력은 보다 보편적이고 객관적인 성격을 띠게 되었다고 판단된다.",최은영(Eun-Young Choi),2011,https://www.riss.kr/link?id=A100122528
"부모-자녀간 의사소통, 사회적 지지 및 정서표현갈등간의 관계","본 연구는 고등학생과 대학생의 정서표현갈등, 부모-자녀간 의사소통 그리고 사회적 지지와의 관계를 알아보고자 하였다. 이를 위해 서울 및 경기 지역의 고등학생 303명과 대학생 304명을 대상으로 부모-자녀간 의사소통 척도, 사회적 지지 척도, 정서표현갈등 질문지를 실시하여 자료를 수집하고 상관분석, 일원변량분석, 이원변량분석을 이용하여 분석하였다. 연구 결과는 다음과 같다. 첫째, 부모-자녀간 의사소통 고·저 집단에 따라 정서표현갈등에는 유의미한 차이가 있어 부모-자녀간 의사소통이 역기능적일수록 정서표현갈등은 높았다. 둘째, 대학생 집단에서 사회적 지지 고·저 집단에 따라 정서표현갈등에는 유의미한 차이가 있어 사회적 지지의 지각이 높을수록 정서표현갈등은 낮았다. 셋째, 대학 3, 4학년에서 정서표현갈등에 대한 부모-자녀간 의사소통과 친구 지지 간에 상호작용 효과가 있어 부모-자녀간 의사소통이 역기능적이더라도 사회적 지지의 지각이 높으면 정서표현갈등을 덜 일으켰다. 이상의 연구 결과는 고등학생과 대학생을 대상으로 정서표현갈등을 이해하는 데 있어 개인의 발달 심리적 관점에서 부모-자녀간 의사소통과 사회적 지지의 관련성을 이해하는 데 도움이 될 것이라 기대된다.",조수경,2009,https://www.riss.kr/link?id=A76521452
남성과 여성의 언어 사용 성향에 대한 연구,"본고는 어느 사회에서나 존재하는 성별에 따른 언어 차이를 몇몇 어휘를 대상으로 남성과 여성이 각기 어떻게 사용하는가를 계량적으로 보여주려는 것이 목적이다. 본고에서는 남이 불렀을 때 대답하는 어휘인 ‘어’와 ‘응’, 종결어미 ‘-어’와 ‘-니’, ‘-냐’, 양성 모음과 음성 모음의 성별 사용에 국한하여 직접 조사를 하였다.
의문형 종결어미에서 10대 남자는 ‘-냐’를, 여자는 ‘-어’를 많이 사용하였으나 20대와 30대는 남녀 모두 ‘-어’를 많이 사용한다. 10대는 강압적인 느낌을 주는 어미를 사용하고 20대와 30대는 남녀 모두 부드러운 어감이 있는 ‘-어’를 많이 사용하였다.
여성은 양성 모음을 많이 사용하였는데, 양성 모음의 어감이 밝고 가벼운 느낌이고 상태나 모양이 작은 것을 표현하기 적절하기 때문이다. 반면에 남성은 어둡고 무거운 느낌인 음성 모음을 많이 사용하였다.
대답하는 표현에서는 남성이 ‘어’를 많이 쓰고 여성은 ‘응’을 더 많이 쓰고 있다. 이러한 차이가 나는 이유는 ‘어’는 거친 표현이고 ‘응’은 부드러운 표현이기 때문이다. 음성학적인 측면에서 보면 ‘응’의 자음 ‘ㅇ’이 연구개음으로 비음을 동반한다. 비음이 들어가는 소리는 부드러운 어감을 갖고 있기 때문이다.",유형선,2004,https://www.riss.kr/link?id=A341794
대학생의 취업 스트레스와 우울 간의 관계: 적응적인 인지적 정서조절 전략의 매개효과 검증,"본 연구는 대학생의 취업 스트레스, 우울 및 적응적인 인지적 정서조절 전략의 관련성을 살펴보고, 취업 스트레스와 우울 간의 관계에서 적응적인 인지적 정서조절 전략이 매개역할을 하는지 알아보고자 하였다. 이를 위해 4년제 대학교에 재학 중인 대학생 380명으로부터 자료를 수집하였다. 본 연구의 주요 결과는 다음과 같다. 상관 분석 결과, 취업 스트레스와 우울은 유의미한 정적 상관을 보였다. 취업 스트레스는 적응적인 인지적 정서조절 전략의``계획 다시생각하기``와 ``긍정적 재평가`` 요인과 유의미한 부적 상관을 보이는 것으로 나타났다. 우울은 ``수용`` 요인을 제외한 적응적인 인지적 정서조절 전략의 하위 요인 모두와 유의미한 부적 상관을 보였다. 다음으로 구조방정식 모형 분석 결과, 측정모형과 구조모형이 자료에 적합한 것으로 나타났다. 구체적인 경로를 살펴보면, 인지적 정서조절 전략의 하위 요인 중 ``계획 다시생각하기`` 가 취업 스트레스와 우울 간 관계를 부분 매개하는 것으로 나타났다. 연구결과를 바탕으로 상담실제에 대한 시사점과 후속 연구에 대한 제언을 논하였다.",심지은 ( Ji Eun Shim ),2011,https://www.riss.kr/link?id=A87025055
분단 독일을 그린 펭크와 임멘도르프의 미술,"펭크와 임멘도르프는 독일분단 시기에 동독과 서독에서 냉전체제와 분단의 문제에 대해 집중적으로 작업한 미술가들이다. 동독의 펭크는 사회주의 리얼리즘에 비판적인 추상화를 그렸고, 서독의 임멘도르프는 서유럽의 모던한 추상화와는 반대되는 사실주의를 시도했다. 그럼으로써 둘은 각자의 테두리에서 탈피함과 동시에 서로에게로 접근했다. 펭크의 그림은 단순 명료한 기호적 성격을 통해 논리적이고 객관적으로 세계와 체제를 묘사하며 국가권력을 비판한다. 임멘도르프는 예술가로서의 소명의식에 찬 열정으로 사회를 변화시키고 분단을 극복하기 위해 카페 도이칠란트 연작을 그린다. 펭크와 임멘도르프의 미술은 그들이 처한 체제에서 드물고 특별했다. 그들의 미술은 주류를 따르는 것이 아니라 각자 냉철한 머리와 뜨거운 가슴으로 자신의 신념을 표현한 미술이었다. 그들은 서로 만나 분단의 고착을 막기 위한 예술적 교류와 협력을 갖는다. 이러한 시도는 분단과 냉전체제의 긴장과 위협을 완화하고 80년대 말에 화해 국면으로 나아가는데 일조했다. 동서독의 문화협정이 체결되고 동독의 예술무대에 자유의 바람이 불며 베를린 장벽은 붕괴된다. 독일통일로 치닫는 과정은 장벽의 한계를 뛰어넘어 이질감과 반목을 극복하려는 펭크와 임멘도르프 같은 예술가들의 혁신적 노력이 없었더라면 불가능했을 것이다.","김숙영(Kim, Sook Young)",2013,https://www.riss.kr/link?id=A100122549
"학업 우수 청소년의 부모애착, 학업적 자기효능감 및 진로포부 관계모형의 남녀 비교","본 연구는 학업 우수 청소년을 대상으로 부모애착, 학업적 자기효능감 및 진로포부간의 구조 관계를 알아보고 남녀 집단 간 구조 모형에 유의미한 차이가 존재하는지 살펴본 연구이다. 기존 연구를 바탕으로 부모애착은 학업적 자기효능감에 영향을 미치고, 학업적 자기효능감이 다시 진로포부에 영향을 미칠 것이라는 구조적 관계를 연구 모형으로 설정하였고, 부모애착이 진로포부에 직접적인 영향력을 미친다는 선행 연구를 토대로 경쟁모형을 설정하였다. 연구 결과에 따르면, 학업 우수 남학생과 여학생 모두 부모애착이 학업적 자기 효능감에 영향을 미친 것으로 나타났고, 학업적 자기 효능감은 진로포부에 유의미한 영향을 미치고 있었다. 또한 경쟁모형에서 가정한 부모애착이 진로포부에 미치는 직접적인 영향력은 유의미하지 않은 것으로 나타났다. 마지막으로 이러한 모형에 있어서 남녀 학업 우수 청소년 간에 차이는 존재하지 않는 것으로 나타났다. 연구 결과를 토대로 학업 우수 청소년들의 차별화된 진로 상담 개입을 위한 시사점을 제시하고, 후속연구를 위한 제언을 하였다.",이은영,2009,https://www.riss.kr/link?id=A76521451
