
유아교육의 철학적 기초: 고대 그리스와 로마의 유아교육,"교육의 출발점이 되는 고대 그리스의 철학과 사상을 탐색하기 위해, 헬레니즘 문명의 기초가 되는 가장 강력한 폴리스, 스파르타와 아테네의 정치체제와 문화, 교육의 제도를 중심으로, 특히 유아교육과 여성교육에 주목하면서 오늘날 우리나라의 유아교육을 조명한다. 나아가 그리스의 것을 모방한 것으로 알려진 로마의 철학과 사상을 살피면서 그 들의 유아교육은 그리스의 것과 또 우리의 유아교육과 어떻게 다른지 비교하면서 우리에게 주는 시사점을 찾고자 한다.",계영희,2011,https://www.riss.kr/link?id=A99931872
서양의 역사적인 지도제작법의 발달 과정과 수학적 지식의 상호 영향 관계를 통해 본 직교좌표계,"역사적인 지도제작법에 나타난 좌표계와 수학적 직교좌표계의 발전 과정을 비교하면서 위치를 표시하는 직교좌표계는 수학의 해석기하학과는 상관없이 인간 본연에 내재되어 있었던 공간지각능력의 일환으로 발전되어 왔음을 주장한다. 지도제작법의 발전이 해석기하학의 발명 전후 삼각함수, 로그, 기하학, 미적분학, 통계학 등 수학의 여러 분야와 상호 영향을 미치지만 원점의 표시나 음수 좌표의 사용과 같은 수학적 직교좌표계 자체에 대한 발전은 데카르트의 논문 발표 후 100여년 이상 지난 후에 이루어지는 점, 해석기하학을 발명하는데 공헌한 대부분의 수학자들이 당대의 문제 해결에 집중하면서 직교좌표계에 대한 수학적 설명없이 자연스럽게 사용하였던 점을 바탕으로 이런 결론을 얻는다.",이동원,2012,https://www.riss.kr/link?id=A101558568
최석정의 직교라틴방진,2006년 이전까지도 유럽의 오일러가 직교라틴방진의 첫 연구자로서 인정을 받아왔다. 그러나 오일러 이전에 조선의 최석정이 오일러 이전에 이미 9차의 직교라틴 방진을 만들었다는 사실이 2006년 출판된 '조합론 디자인 편람' 에 소개됨으로써 우리만 알고 있던 사실이 세계적으로 공인되었다. 본 논문에서는 최석정과 양휘산법의 마방진을 비교하고 세계최초로 만들어진 최석정의 직교라틴방진과 오일러 가설의 역사를 설명한다.,김성숙,2010,https://www.riss.kr/link?id=A101558579
라플라스 모세관이론과 수학물리학의 태동,"뉴턴의 중력이론의 성공은 수학물리학을 태동시키는 바, 최초로 19세기 초의 분자력의 모델성립에 중요한 요소로 등장하였다. 라플라스는 여기서 회전타원체의 작용이라는 모델을 이용하였고 회전타원체의 작용은 이계편미분방정식으로 표현이 되었다. 이것을 풀어서 유체를 담은 용기의 기하학적 모습과 와 유체와 고체의 접촉각에 대응시켰다. 알 수 없는 분자간거리는 추상적이고 미지의 힘 함수 $\varphi(f)$를 써서 표현하여, 분자 작용반경이라는 개념을 도입하여 이론적인 포텐셜 함수의 이론적인 토대를 구축하였다. 뉴턴의 중력이론은 라플라스이론에서 완성을 이루었고, 이후 분자력의 모델로서 작용을 하였다. 라플라스-영의 모세관이론은 수학적으로는 극소 곡면론에서 물리학적으로는 표면장력현상으로 설명이 된다.",이호중,2008,https://www.riss.kr/link?id=A101558751
GSP를 활용한 한국 전통문양의 테셀레이션 작도,"본 논문은 기하 프로그램 GSP(Geometer's SkechPad)를 응용하여, 수학이 흥미롭고 재미있는 교과목이며, 또 다양한 영역 속에서 아름답게 활용될 수 있는 것을 보이고자, 테셀레이션의 도형을 평면기하에서 평행이동, 미끄럼반사 등으로 우리 고유의 독특한 태극무늬와 단청문양, 흉배에 사용하였던 구름무늬 등을 현대적인 감각으로 디자인 한 것을 GSP(Geometr's SkechPad) 4.0 으로 작도하였다.",계영희,2008,https://www.riss.kr/link?id=A101558710
19세기 초 영국의 해석적 방식의 도입과 이후 영국 수학의 발전 : 19세기 초 케임브리지 대학의 '해석학회'의 의의와 그 한계,"이 논문에서는 19세기 초에 영국 케임브리지 대학에서 나타났던 '해석학회'를 중심으로 18세기 후반에서 19세기 전반까지의 영국 수학계의 상황을 살펴볼 것이다. 이를 통해 흔히 매우 새롭고 혁신적인 사건으로 언급되는 해석학회의 등장이 19세기 이전 영국 수학계의 꾸준한 개혁 노력들이 축적된 결과 나타날 수 있었음을 보일 것이다. 그 결과 해석학회의 역할과 의의에 대해 새롭게 이해할 수 있게 될 것이다. 또한 이후 영국에서 해석적 방식이 받아들여졌던 과정과 그 경로를 통해 새로운 해석적 방식이 당시 영국의 독특한 지적, 사회적 상황 속에서 대륙과는 다른 방식으로 발전했던 과정을 이해할 수 있을 것이다.",조수남,2007,https://www.riss.kr/link?id=A101558678
초등기하에서 도형의 대칭에 관한 연구,"대칭은 수학뿐만 아니라 생활에서 널리 이용되는 개념으로 5-나 단계에서 도형의 대칭을 다루고 있다. 본 연구는 도형의 대칭 지도를 위해 대칭과 대칭지도에 관한 역사적 배경, 수학적 배경, 교육과정에서의 위계를 살펴보고, 아동에게 대칭에서 발생하는 주요 오류와 그 원인을 규명하여 이를 극복하기 위한 아이디어를 얻고자 한다.",한길준,2007,https://www.riss.kr/link?id=A101558873
일반화된 피보나치수열과 루카스 수열에 관계하는 산술삼각형 연구,"본 논문에서는 피보나치수열의 여러 변형들로서, 루카스 수열을 포함하여 트리보나치 수열, 쿼드로나치수열 등을 살펴보고 그 상관관계를 연구하고자 한다. 피보나치수열과 파스칼의 삼각형의 관계처럼, 변형된 피보나치수열을 시각적으로 표현할 수 있는 산술삼각형을 연구하고자 한다. 이를 바탕으로 학교 수학교육 현장에서 산술삼각형들을 활용하여 학생들의 수학적 사고력을 높일 수 있는 교수-학습 자료를 제시하고자한다.",최은미,2013,https://www.riss.kr/link?id=A101558627
사사교육을 통한 해석기하학적 관점에서 사이클로이드곡선의 연구,가. 연구의 제목 사사교육을 통한 해석기하학적 관점에서 사이클로이드곡선 나. 연구기간 2013. 3. ～ 2013. 8 다. 연구에 사용한 프로그램 GSP 5.0 라. 연구 모형 1) 연구목표의 설정 GSP를 이용하여 사사교육을 통해 탐구주제를 설정하였다. 학교에서 배우는 원의 성질을 기반으로 사이클로이드의 종류들에게 연구하게 되었다.,이영배,2013,https://www.riss.kr/link?id=A101558621
통계 처리 오류의 유형별 분석,"자료를 수집하고 분석하는 통계적 행위를 통하여 얻어진 정보는 매우 유용한 것임에도 불구하고 전문적 지식의 부족이나, 모형 및 분석법의 잘못된 선택, 표본 설계 및 표본 조사에 있어서의 연구자 및 조사원의 미숙, 얻어진 정보의 과장된 표현 등으로 유용한 정보의 손실은 물론 사회 구성원 및 연구자들에게 정보가 잘못 전달되는 사례가 적지 않은 실정이다. 본 연구에서는 통계적 행위를 통하여 정보를 얻는 데 있어서 자주 발생하는 오류들을 실제 사례를 중심으로 하여 유형별로 분석함으로써, 통계의 효율적 이용을 모색하고자 한다.",오희정,1997,https://www.riss.kr/link?id=A106511839
한중 대학생의 거절화행 사용전략 고찰,"외국어를 학습할 때 학습자에게 있어서 모국어 화자와 유사한 언어 능력의 발달이 가장 중요한 목표인데, 이러한 목표를 달성하기 위해서는 문법적인 능력 이외에도 사회 문화적인 능력과화용적인 능력을 키워야한다. 특히 거절의 경우 대화 상대방의 체면 손상을 유발하는 화행이기 때문에 거절을 수행하는 화자는 상대의 체면을 손상하지 않기 위해 많은 노력을 할 뿐만 아니라 그 사용 전략도 다양하게 나타난다. 따라서 본고에서는 한국어 모국어 대학생 화자와 중국어 모국어 대학생 화자의 거절화행 분석을 통하여 한중 대학생들의 거절사용 전략을 살펴보고 그 특징을 알아냄으로써 한국어교육에 적용하는데 목적이 있다.",최죽산,2010,https://www.riss.kr/link?id=A101558673
소설 텍스트 중심으로 본 문학능력과 한국어교육,"이 글은 소설 텍스트를 중심으로 문학능력의 속성을 규명하고, 그것이 한국어교육 혹은 한국문학교육에 어떤 효용을 드러낼 수 있는가 하는 점을 검토하는 것이 목적이다. 그러기 위해서는 텍스트 자체를 분석하기보다는 텍스트를 수용하고 창조하는 인간적 여건에 대한 검토가 우선해야 한다. 이 글에서는 먼저 중국의 경극 <대당귀비>를 하나의 텍스트라고 상정하고, 이 작품을 접하고, 감상하고, 이해하는 방법에 대한 논의를 바탕으로 소설 텍스트를 읽는 방법을 다시 생각해 보았으며, 그 내용은 다음과 같다. 첫째, 텍스트의 이해는 사전 지식(preunderstanding)을 가지고 출발한다. 둘째, 전개되는 이야기에 몰두한다. 셋째, 디테일이 아니라 전체의 얼개를 먼저 본다. 넷째, 이야기, 인물의 관계, 무대 연출 등을 재구성하면서 본다. 다섯째, 문화적으로 본다.
언어와 문학은 불가분의 관계이나 분과화된 학문이 이에 대한 인식을 갈라놓았다. 언어능력과 문학능력, 자국어능력과 외국어능력 등에 대해 몇 가지 사항을 정리하면 다음과 같다. 첫째, 자국어능력과 외국어능력은 상호연관성이 매우 짙다. 둘째, 언어능력은 문법능력과 문화능력이 통합되어 실현된다. 셋째, 문학능력은 형상적인 언어능력 혹은 상상적인 언어능력이다. 넷째, 의사소통능력은 종합적 소통능력이다.
한국어교육에서도 소설을 교육할 때에는, 소설은 소설답게 다루어져야 한다. 따라서 일상에서 소설을 읽을 때, 어떠한 과정을 거치는가 살펴야 하며, 그 내용은 다음과 같다. 첫째, 독서 목적이 독서 방법을 결정한다. 둘째, 전체를 파악한 다음 부분을 고려한다. 셋째, 인물은 유형이 아니라 관계존재로 살아있다. 넷째, 구성의유형은 서사의 원형을 제공한다. 다섯째, 소설의 언어는 담론의 구체성을 실현한다.
외국어교육으로서 한국어교육에서 문학작품 강독을 소설로 한정하고, 강독의 방법을 학습자 스스로 작품을 읽고 교사가 그 과정과 결과를 확인 및 조정하는 역할을 히는 것이라고 할 때, 교육과정과 교재의 구성에는 다음과 같은 조처가 필요하다. 첫째, 강독의 중점을 설정하고 읽도록 하라. 둘째, 제재의 내용을 계열화하여 제공하라. 셋째, 교재를 구성하는 데에는 학습자의 자국어 문학능력, 문화체험과 연관된 작품 및 현대어로 서술된 작품, 학습자의 언어능력 수준을 향상할 수있는 작품, 비평적 글쓰기에 활용할 수 있는 작품을 고려하라.
마지막으로 교육과정의 내실화를 위한 평가와 되먹이기(feedback)에 대해 논의할 때에 고려할 수 있는 평가 목표로는 다음과 같은 것을 이야기할 수 있다. 작품의 분위기와 이야기의 개요, 인불과 인물의 관계를 파악했는지, 구성의 논리성과 서사적 원형을 이해했는지, 담론으로서 언어가 가지는 특성을 이해했는지, 비평으로서 글쓰기를 할 수 있는지, 이러한 평가목표에는 서술식 평가 방법을 활용하는 것이 적절하며, 강독과 평가의 선후와 방법은 필요에 따라 융통성 있게 조절할 수 있다.",우한용,2010,https://www.riss.kr/link?id=A101558713
