
"복소수의 기하적 해석의 발달 : Descarte, Wallis, Wessel를 중심으로","복소수 발견초기 수학자들은 복소수에 대한 거부감이 상당했으나 복소수의 대수적 연산에는 큰 어려움이 없었다. 복소수가 수학적 대상으로 인정받기까지 많은 시간이 필요했던 이유는 복소수의 기하적 해석에 많은 시행착오와 시간이 필요했기 때문이다. 본 논문은 복소수의 기하적 해석의 싹을 Euclid 원론에서 찾고, Descarte, Wallis, Wessel를 거치면서 그 싹이 틔어가는 과정을 밝히고 있다. 복소수의 기하적 해석에 대한 세 명의 수학자들의 생각은 서로 다르지만 밀접한 관계가 있다. 이들은 선분과 복소수의 관계에 주목하고, 곱셈 연산을 일반화하면서 복소수의 기하적 해석을 시도하였다.",이동환,2007,https://www.riss.kr/link?id=A101558700
귀납법과 수학적 귀납법,"21세기 세상은 제4차 산업혁명의 영향으로 인하여 새로운 산업사회로 변모하고 있으며 과학적 방법론을 전제하는 데이터과학과 함께 인공지능 시대로의 전환이 진행되고 있다. 이에 데이터를 다루고 지식과 통찰력을 도출하기 위한 논리에 대한 탐구가 요구된다. 논리는 크게 연역법과 귀납법으로 나뉜다. 수학이나 인공지능에 사용하는 알고리즘은 연역적 논리를 기반으로 하는 한편 과학은 귀납적 논리를 사용한다. 특히 확률론의 발전에 관한 고찰은 인공지능의 딥러닝 기술에 의미를 더해줄 수 있다. 더불어 알고리즘에 이용되는 재귀 또는 점화식에 적용되는 논리인 수학적 귀납법에 대한 고찰도 필요하다. 본 연구는 데이터과학과 인공지능의 발전을 위하여 논리,특히 귀납논리와 수학적 귀납법, 과학적 방법론의 기원과 의미를 살펴본다.",고영미,2022,https://www.riss.kr/link?id=A101558500
다양한 사이클로이드 곡선의 구성에 관한 연구,"본 논문에서는 벡터의 분해와 합의 개념을 이용하여, 사이클로이드, 에피사이클로이드, 하이포사이클로이드 곡선을 ‘수학-과학 소프트웨어’인 지오지브라에서 구현하며, 에피사이클로이드 곡선과 하이포사이클로이드 곡선의 연관성을 밝힌다.",곽도영,2013,https://www.riss.kr/link?id=A101558915
피보나치 수열의 일반화에 관한 고찰,"본 연구에서는 유명한 피보나치 수열을 일반화하는 g-피보나치 수열 $\{g_n\}$={a, b, a+b, a+2b, 2a+3b, 3a+5b,...}의 여러 가지 성질과 특성을 조사한다. 특히, g-피보나치 수열의 합에 관한 항등식과 제 n항 $g_n$(비네의 공식의 일반화)을 구체적으로 구한다. 또한 피보나치 수열에 관한 카타란의 항등식의 일반화된 항등식과 A. Tagiuri의 항등식을 구하고 $g_n$과 파스칼 삼각형과의 관계식과 g-피보나치 수 $g_n$이 얼마나 빨리 커지는가를 조사한다. 아울러 g-피보나치 수열의 초항과 둘째 항이 서로 소일 때 연속하는 두 항은 서로 소이며, 연속하는 두 항의 비율 $\{\frac{g_{n+1}}{g_n}\}$은 황금비 $\frac{1+\sqrt5}2$ 수렴함을 밝히고자한다.",양영오,2008,https://www.riss.kr/link?id=A108128327
뫼비우스 띠에 대하여,"뫼비우스의 띠(Mobius strip, 좁고 긴 직사각형 종이를 한 번(180°) 또는 그 이상 꼬아서 끝을 붙인 면과 동일한 위상기하학적 성질을 가지는 곡면)는 물리학, 화학, 약학, 신소재공학 등 다양한 분야에 걸쳐 폭 넓게 이용되어 높은 탐구 가치를 인정받고 있다. 최근 영국 런던대 연구진이 뫼비우스 띠의 새로운 해석 방법을 제시하는 등 그 연구 또한 활발히 이루어지고 있다. 본 연구에서는 뫼비우스의 띠를 매듭론의 관점에서 해석하였다. 뫼비우스 띠의 기본적인 성질과 변수(꼬인수, 등분 수)에 따른 변화 등을 탐구·관찰하고, 실제 뫼비우스의 띠를 제작하여 실험값을 얻었다. 그 결과를 도표화하고 매듭론을 통해 분석하면서 규칙을 찾고, 이를 공식으로 수식화하였다. 이러한 탐구 내용을 바탕으로 뫼비우스의 띠를 매듭으로 표현하는 데 성공하였고 매듭론의 기본적인 식 ‘알렉산더-콘웨이 다항식 (Alexander-Conway polynomial)’을 통해 걸림수(Linking number)의 규칙성을 찾아냈다.",박지현,2013,https://www.riss.kr/link?id=A101558893
굴절의 법칙의 수학적 증명과 그 교수학적 의의,"물리학에서 Snell의 법칙으로 불리는 굴절의 법칙은 수학사적으로 매우 중요한 의미를 가진다. Snell이 많은 관찰 자료를 바탕으로 굴절의 법칙 $\frac{v_1}{sin{\theta}_1}=\frac{v_2}{sin{\theta}_2$를 발견한 이후 많은 수학자들은 '최소 시간의 원리'를 사용하여 이 식을 수학적으로 증명하려 시도하였으며 이러한 노력은 미분의 발명을 촉진한 주요한 동력 중의 하나였다. format는 자신만의 방법을 개발하여 이 문제를 최초로 해결하였으며, 이때 Format가 사용한 극대$cdot$극소 방법은 현대의 미분을 통한 방법과 유사한 것으로 이후 Leibniz의 무한소 방법의 기원이 되었다. 역사적으로 수학과 물리학은 밀접하게 상호작용하면서 과학의 발전을 이끌었다. 굴절의 법칙은 이러한 수학과 물리학의 관계를 잘 보여준다. 물리학은 수학에 질문을 제기하고 수학은 보편적인 원리로 그것을 해결함으로써 처음의 현상보다 더 넓은 현상까지 포괄적으로 설명한다. 수학교육의 목적은 완성된 수학을 배우는 것뿐만 아니라 수학을 응용할 줄 아는 능력이라는 Freudenthal의 말을 생각할 때, 굴절의 법칙은 고등학교의 우수한 학생이나 대학의 수학 교육과정에 적합한 소재이다. 대학의 수학이나 물리학 전공과정에서는, 미분을 통한 현대적인 방법뿐만 아니라 format의 방법(미분을 명시적으로 사용하지는 않았지만 원시적인 미분의 방법을 쓰고 있는)을 동시에 다루면서 양자를 비교하는 기회를 가지는 것은 교육적으로 가치 있는 일이라 생각된다.",강흥규,2006,https://www.riss.kr/link?id=A106182673
택시기하에서의 이차곡선에 관한 연구,"비 유클리드 기하 중 하나인 택시기하에서 거리의 정의는 유클리드 기하와 다르기 때문에, 만들어지는 도형의 모양 또한 다르다. 이 연구에서는 방정식의 최고차항이 이차인 도형들, 그 중에서도 특별히 두 초점에서의 거리의 합, 차, 곱, 비가 일정한 점의 자취에 대해 연구하였다. 이들 중 두 초점에서의 거리의 합이나 차가 일정한 점의 자취에 대한 선행연구를 바탕으로 거리의 곱이나 비가 일정한 점의 자취에 대한 연구를 진행하였다. 두 초점으로부터의 거리의 곱이 일정한 렘니스케이트, 거리의 비가 일정한 아폴로니우스 원의 경우 유클리드 기하에서는 초점의 위치에 관계없이 일정한 모양이 나오지만 택시기하에서는 초점의 위치에 따라 그 모양이 다르게 나타난다. 이런 관점에서 본 연구에서는 택시기하에서의 렘니스케이트와 아폴로니우스의 원이 초점의 위치에 따라 어떻게 나타나는지에 대하여 분류하여 제시하였다. 이 연구는 택시기하에서의 다른 여러 가지 도형, 또는 알파기하에서의 이차곡선 등 다양한 방향으로의 연구의 기초가 될 것이다.",양희석,2013,https://www.riss.kr/link?id=A99931822
택시 기하에서의 삼각형의 외심에 관한 연구,"택시 기하는 현대 도시의 거리 개념에 보다 현실적으로 실용적이란 면에서 많이 연구가 되고 있다. 본 연구에서는 아직 충분한 연구결과가 발표되지 않고 있는 택시 기하에서의 삼각형의 외심의 존재성과 유일성에 대한 몇 가지 정리를 증명하였다. 예각삼각형에서는 항상 택시 외심이 존재하고 유일하다는 것을 증명하였고, 둔각삼각형에서는 택시 외심이 존재하면 유일하다는 것을 증명하였다. 또한 삼각형을 택시 기하에서 다루기 유용하게 경우를 나눔으로서 여러 가지 의미 있는 정리를 증명하였다. 본 연구의 방법과 결과는 여러 기하학에서 삼각형의 중심의 존재와 유일성 및 기하학적으로 의미 있는 양에 대한 연구에 도움이 될 것이다.",이승우,2013,https://www.riss.kr/link?id=A101558666
카발리에리 원리의 생성과정의 특성에 대한 고찰,"이 연구에서는 카발리에리가 제시한 두 가지 불가분량법 사이의 전환에 대해 고찰한다. 불가분량법 사용에 대한 반대에 대응하기 위해, 카발리에리는 그가 처음 제시했던 불가분량법을 수정하였다. 이 과정에 대한 분석을 통해, 이 연구에서는 카발리에리가 불가분량과 관련된 패러독스를 피하기 위해 도형의 밀도를 반영하는 방향으로 불가분량법을 바꾸었다는 면과 함께, 라카토스의 이론에 근거해, 이러한 전환이 불완전한 보조정리 합체법으로서의 특정을 지니고 있음을 밝힌다.",박선용,2011,https://www.riss.kr/link?id=A99931829
고대 그리스 수학과 동양 수학,"본 논문에서는 동양수학과 고대 그리스 수학을 비교한 결과, 동양수학은 엄밀한 논리적 체계를 갖추지는 못했지만 양적이고 계산적이며 어떤 원리를 가지고 문제를 해결한 반면, 고대 그리스에서는 완전한 학문으로써의 공리적이고 연역적인 전개로 이루어진 수학의 특성을 가지고 있음을 고찰하였다. 이는 동양과 고대 그리스의 수학적 특성과 장점들을 결합하여 연구하면 미래의 수학교육과 수학발전에 원동력이 될 것으로 기대된다.",김종명,2007,https://www.riss.kr/link?id=A101558712
아리스토텔레스의 무한론에 대한 제논의 역할,"본 논문에서는 아리스토텔레스의 무한론과 제논의 논증들과 역설에 대한 그의 논의를 기반으로 아리스토텔레스의 잠재적인 무한론 형성에 제논의 영향을 추론하였다. 고대 그리스수학의 기초로서 아리스토텔레스의 잠재적인 무한을 고찰해 보면 미적분학에 꼭 필요한 실무한에 대한 개념을 허락하지 않았다. 아리스토텔레스의 ""자연학""에서 실무한의 존재를 부정하고 잠재적인 무한만을 주장하게 된 것은 제논의 논증에 나타난 불합리를 피하기 위한 희망이 내재해 있는 것으로 판단할 수 있다. 따라서 고대 그리스인들이 왜 실제적으로 극한 개념을 수반한 적분을 개발하지 못하고 번거롭고 불완전한 십진법을 사용하면서 멀리까지 왔는지에 대한 이유 중 하나를 제공할 수 있을 것이다.",강대원,2009,https://www.riss.kr/link?id=A101558644
다변수 미분에 관하여,대학교육에서 다변수함수의 미분은 수리적 분석을 요하는 학문의 발전과 더불어 점차 그 중요성이 강조되고 있다. 그러나 현재 대학교양교육에서 학생들에게 도입되고 있는 다변수함수의 미분 정의는 처음 접하는 학생들에게 쉽지 않게 느껴지는 면이 있다. 이에 본 저자가 최근 몇 년간 교양수학을 가르치면서 학생들의 이해를 돕기 위해 고안한 방법이 있어 이를 소개하고자 한다. 본 저자의 경험을 토대로 한 이 방법은 다변수함수의 미분 정의에 대한 직관적이면서 기하학적인 설명법으로서 엄밀한 증명에 의한 접근 방법은 아니지만 다변수 미분의 의미를 빠르게 전달할 수 있다는 장점이 있다.,박희철,2008,https://www.riss.kr/link?id=A101558493
선형대수학의 두 가지 기원적 개념,"오늘날 선형대수학은 이론의 기초적 성격과 응용의 풍부성으로 인해 대학수학에 있어서 필수적인 분야로서 자리하고 있다. 하지만 선형대수학의 기계적인 계산위주나 딱딱한 형식적 개념위주의 학습으로 인해 학생들은 종종 큰 벽에 부딪치게 되고 심한 경우에는 수학자체에 흥미를 잃기도 한다. 따라서 선형대수학을 성공적으로 가르치는 것은 매우 중요한 문제이다. 이 문제를 해결하기 위한 방안으로 본 논문에서는 학생의 입장에서 선형대수학에 기원적 개념의 도입을 제안한다 기원적 개념이란 역사적 순서나 이론적 체계에 있어서 실제 출발점이 되면서 선형대수학의 중요한 개념들을 이끌어낼 수 있는 씨앗역할을 하는 개념을 의미한다. 여기서는 선형대수학의 두 가지 기원적 개념을 제시한다. 하나는 평면과 공간의 기하학이며, 다른 하나는 1차(선형대수)방정식이다. 전자가 기원적 개념이 되는 것은 [2]에 의거하며 여기서는 1차 방정식이 또 다른 기원적 개념임을 보인다.",박홍경,2008,https://www.riss.kr/link?id=A99931882
남아선호사상에 기반한 출생 성비에 관한 확률론적 고찰,"우리나라의 출생 성비는 자연 상태에서의 출생 성비(natural sex ratio at birth)로 추정되는 105를 초과하고 있는데, 그 원인 중 하나로 남아선호사상으로 인한 인위적인 출산이 있다(e.g. 임신중절 등). 본 연구에서는 임신 중절 없이 남아를 낳을 때까지만 출산을 하려는 가정(family)들의 존재가 출생 성비를 높이는 데에 기여하는지를 알아보기 위하여, 이러한 가정들과 출생 성비(sex ratio at birth)의 관계를 분석하였다. 그 결과, 남아 한 명을 낳을 때까지만 출산을 하려는 가정의 수가 무한으로 발산할수록 출생 성비는 자연 상태에서의 출생 성비에 확률적으로 수렴하는 것을 알 수 있었다. 즉, 남아를 낳을 때까지만 출산을 하려는 가정들의 존재는 출생 성비에 영향을 미치지 않음을 확인하였다.",김윤수,2008,https://www.riss.kr/link?id=A99931883
상호작용하는 두 생물 종의 개체 수 변화에 대한 수학적 모델,"최근 그 중요성이 인식되면서 수학에서 뿐만 아니라, 생물학, 의학, 면역학 등의 여러 분야에서 세계적으로 광범위하게 연구되어지고 있는 수리 생물학(Mathematical biology) 분야의 학문적 시초이며 그 기초를 제공하는 개체 수 생태학 (population ecology) 은 생물 종 (種) 의 개체 수가 서식지 안의 특정 위치에서 시간에 따라 어떻게 변하는 지를 연구하는 분야이다. 이 논문에서는 두 종류의 생물 종이 한 서식지 안에서 상호작용하는 형태로서 포식자-먹이 관계, 경쟁관계, 협력관계를 나타내는 모델들을 살펴본다.",심성아,2012,https://www.riss.kr/link?id=A101558758
함수공간에서의 일반화된 푸리에-파인만 변환에 관한 고찰,"본 논문은 일반화된 브라운 확률과정으로 유도된 함수공간에서 정의되는 일반화된 파인만 적분과 일반화된 푸리에-파인만 변환을 소개하고, 이들의 존재정리 및 여러 가지 성질을 설명한다. 그리고 푸리에 변환과 일반화된 해석적 푸리에-파인만 변환의 유사성을 조사한다.",장승준,2007,https://www.riss.kr/link?id=A101558691
Ausubel의 유의미 수용학습 이론에 근거한 수업 모델 개발 및 적용,"본 논문의 목적은 Ausubel의 유의미 수용학습 이론에 근거한 수업 모델을 개발하고 이의 적용가능성을 확인하는 것이다. 이를 위해 Ausubel의 유의미 수용학습 이론에 근거한 수업 요소 14개를 선별하여 이를 반영한 수업모델을 개발하였으며 H여자고등학교 2학년 3차시의 수업을 분석하였다. 개발한 수업 모델로 수업을 받은 학생들은 ‘이 수업 모델로 수업을 하는 것이 쉽다’, ‘이 수업 모델로 수업 한 후 수학이 더욱 좋아졌다’, ‘선생님이 설명으로 새로운 지식을 지도하는 것이 좋다’, ‘자신의 수준에 맞는 수학을 배운다’ 그리고 ‘이 수업 모델로 수업한 지식은 기억이 오래 간다’는 변화를 보였다. 그리고 교사는 ‘학생의 수준에 맞추어 다양한 교수법을 선택하기’, ‘선행조직자를 학생이 가능하면 쉽게 이해할 수 있도록 준비하기’, ‘학생들에게 학습 과제를 위계적으로 제시하기’, 수업 정리 단계에서 ‘통합적 조정의 원리 이용하기’와 ‘비판적 접근 유도하기’ 등에 긍정적인 반응을 보였다. 이와 같은 연구 결과를 통해 본 논문은 Ausubel의 유의미 수용학습 이론에 근거한 수업 모델이 교사가 중심이 되어 수업을 진행하는 교수법에 대한 경험적 근거를 제공한다.",박경은,2012,https://www.riss.kr/link?id=A3010218
수학과 건축의 패러다임과 범 패러다임,"토마스 쿤의 패러다임 이론은 수학의 혁명적 과정을 설명하는 데는 충분치 않으며, 학제간 연구에는 더욱 그러하다. 본 논문에서는 현대건축에 나타난 위상기하적인 요소를 고찰하고, 우리나라 전통건축과 서양의 현대건축과의 강한 유사성을 비교할 때 시대정신으로는 설명이 불충분하여 범 패러다임이란 개념으로 설명한다.",계영희,2013,https://www.riss.kr/link?id=A101558575
수학과 교수-학습에서 수학사 활용에 교육적 함의: 수월성 교육을 중심으로 한 미적분 지도의 예,"본 논문에서는 먼저 수학사를 수업에 활용하고자 하는 이론적 근거를 여러 가지 교육적 측면에서 고찰한다. 아울러 수학적 인식에 관한 개인적인 발달과 역사적 발달 사이의 관계를 토대로 수학사 활용의 교육적 유용성을 가장 강력하게 이론적으로 뒷받침하는 역사 발생 원리의 생성, 전개 과정 및 그 의의와 한계 등을 논한다. 또한 여러 가지 측면에서 이론적 근거가 마련되고 있는 수학사 활용에 대한 긍정적인 입장에서 구체적인 방안을 기준과 함께 제시하였다. 다음으로 지금까지 논의된 수학 영재 프로그램 개발의 방향과 실제를 개관하고 수학사를 접목하는 것에 대한 근거를 밝혔다. 마지막으로 수학사 활용의 예를 미분개념의 이해를 중심으로 제시하였다.",한경혜,2006,https://www.riss.kr/link?id=A101558812
유클리드의 원론에 나타난 대수적 개념에 대하여,"본 고에서는 유클리드의 원론에 나타난 대수적 개념들을 개괄하고, 현대적인 기호로 그 의미를 분석하였다. 유클리드의 원론에는 이차방정식, 곱셈공식, 비례식, 정수론, 무리수 등의 대수적 개념이 포함되어 있으나, 그 표현과 추론은 완전히 기하학적인 형태로 이루어져 있다 이러한 내용을 분석하는 것은 대수학의 발생적 본질을 찾아 최초에 수학이 만들어지는 상황을 학생들에게 경험하게 함으로써 수학화를 구현하려는 교육적인 문제의식에도 일종의 시사를 제공하게 될 것이다.",홍진곤,2004,https://www.riss.kr/link?id=A101558807
수학적 의사소통에 대한 고찰과 '고등학교 수학' 의 의사소통 코너 분석,"수학적 의사소통은 수학 교수 학습 과정에서 학습에 참여하는 사람들 간에 수학적 아이디어를 교환하는데 필수적인 활동이다. 2007년 개정 수학과 교육과정에서는 수학적 의사소통 능력의 신장을 여러 영역에서 명시하고 있다. 이에 따라 편찬된 '고등학교 수학' 18종 교과서에는 의사소통 문제를 다루는 코너가 마련되어 있고, 실제 학교 현장의 교사들은 수학 수업 시간에 어떤 과제를 어떤 방식으로 의사소통을 해야 할지에 대해 알고 싶어 한다. 이렇게 수학적 의사소통이 수학 교육에서 해결해야 할 중요한 문제로 부각되는 시점에서 본 논문은 수학적 의사소통에 대하여 고찰해 보고, 이를 토대로 '고등학교 수학' 교과서에 수록된 의사소통 관련 코너의 내용을 분석하여 유형화하고 나아가 각 유형에 적절한 의사소통 활동을 제시함으로써 차후에 개정될 교과서의 실질적인 의사소통 코너 마련을 위한 정보 및 교사들에게 수학적 의사소통이 활발한 수학 수업을 안내할 수 있는 틀을 제공하는 것을 목적으로 한다.",김향숙,2010,https://www.riss.kr/link?id=A101558656
주먹 돌도끼에 나타난 황금비,"본고에서는 $\ulcorner$자연$\cdot$인간, 그리고 황금분할 I$\lrcorner$([1])의 후속연구로 인간의 미의식과 정신적 모형과 약 1백만 년 전 석기시대의 주먹 돌도끼에 나타나는 황금비와, 오늘날도 다방면에서 선호하여 사용되어지고 있는 황금비에 관하여 연구한다. 연구결과 특히 1백만 년 전의 주먹 돌도끼는 인류가 당시에 후일의 예술과 수학의 전제조건이 되는 중요한 능력을 가지고 있었다는 것을 보여주는 것이었으며, 펜, 종이, 자 등의 도움 없이도 정신적인 모형이 존재하여 기본적인 수학적 변환을 가능하게 하였음을 보여준다. 다양한 크기의 주먹도끼를 동일한 황금비를 유지하면서 제작하였다는 것은 수십만 년 후에 나타난 유클리드의 $\ulcorner$기하학 원론$\lrcorner$에서 다루어진 원리를 최초로 보여준 예라고 생각된다.",한정순,2006,https://www.riss.kr/link?id=A3040440
통합개념으로서 함수 개념에 대한 역사적 고찰,"함수 개념은 그 자체만으로 이루어진 단일한 개념이 아니라 산술, 기하와 같은 수학의 여러 주제가 통합된 개념이다. 따라서 함수는 수학의 밑바탕에 폭넓게 스며 있는 기본적인 개념일 뿐 아니라 변화하는 현실 세계를 이해하기 위한 개념적인 수단으로서 다양한 변화 현상을 '보기' 위해서 생각하지 않을 수 없다. 이에 따라 본 논문에서는 역사적인 고찰을 통해 통합개념으로서 함수 개념에 대해 고찰하였다. 특히 함수 개념과 관련된 표현이 보다 명백히 드러난 중세에서부터 19세기까지 함수 개념의 변화를 통해 통합개념으로서 함수의 모습을 살펴보았다.",강현영,2007,https://www.riss.kr/link?id=A101558665
원뿔곡선의 수학사와 수학교육,"고등학교 교육과정에서 학생들은 원뿔곡선 조작 환경을 제공 받지 못하고 초점과 준선을 이용하여 대수적 정의를 받아들이며, 원뿔곡선을 동적인 의미 없이 정적인 대수적 문제로 국한해서 생각하는 경향이 있다. 대수적인 표현뿐만 아니라 동적인 기하학적 표현을 보완하기 위해 원뿔곡선을 원뿔 절단으로 정의한 역사적 근거를 해시계에서 찾고 원뿔 절단으로는 설명할 수 없는 초점과 준선 개념의 역사도 살펴본다. 그리고 원뿔곡선을 연속적으로 그리기 위해 사용된 도구들에 대해서 알아보고, 학생들의 활동을 위한 공학적 도구로 컴퓨터 환경을 살펴본다.",진만영,2012,https://www.riss.kr/link?id=A101558880
수학사적 관점에서 오일러 및 베르누이 수와 리만 제타함수에 관한 탐구,"베르누이가 처음으로 자연수 k에 대하여 합 $S_n(k)=\sum_{{\iota}=1}^n\;{\iota}^k$에 관한 공식들을 유도하는 방법을 발견하였다([4]). 그 이후, 리만 제타함수와 관련된 베르누이 수와 오일러 수에 관한 성질들이 연구되어왔다. 최근에 김태균은 $\mathbb{Z}_p$상에서 p-진 q-적분과 관련된 확장된 q-베르누이 수와 q-오일러 수, 연속된 q-정수의 멱수의 합에 관한 성질들을 밝혔다. 본 논문에서는 연속된 q-정수의 멱수의 합에 관한 역사적 배경과 발달과정을 고찰하고, 오일러 및 베르누이 수와 관련된 리만 제타함수가 해석적 함수로써 값을 가지는 문제를 q-확장된 부분의 이론으로 연구되어온 q-오일러 제타함수에 대해 체계적으로 논의한다.",김태균,2007,https://www.riss.kr/link?id=A101558701
정오각형 작도에 의한 특수각의 삼각비 유도,본 논문은 중$\cdot$고등학교에서 특수각의 삼각비를 삼각비의 원래 기원인 기하학적 의미가 아닌 지나친 대수적 접근방법으로 지도하고 있다는 문제점으로부터 출발하여 특수각의 삼각비를 유클리드 <원론>에 기초한 정오각형과 정십각형의 작도법으로부터 유도하고자 한다. 이를 위하여 정오각형과 정십각형의 작도법을 고찰하고 이로부터 다양한 특수각을 기하적으로 유도하고 있다. 이런 기하학적 방법을 통하여 특수각의 삼각비의 기하학적 의미를 재조명하고 수학사를 활용한 삼각비의 교수방법을 제시하고자 한다.,조정수,2006,https://www.riss.kr/link?id=A99932147
