
코로나19 발생에 따른 청년 1인가구의 주생활행위 변화,"With the aim of identifying changes in the housing behavior of young single-person households before and after the outbreak of COVID-19, this study analyzed 133 Internet articles published from January to December before the COVID-19 crisis for a comparison with preceding studies on the housing behavior of young single-person households after the pandemic began. In addition, in order to closely examine the actual behavior changes in young households in connection with the results of the article analysis, interviews were conducted with 10 young single-person households on the changes in their housing behavior before and after the outbreak of COVID-19. The article analysis led to the observation that more articles about hobby and home decoration were published after the crisis. The interview results show, consistent with the article analysis results, an increasing trend of hobby activities, along with a marked increase in activities related to telecommuting, online classes and eating (specifically in relation to delivery meals). The results of this study provide a glimpse of the changes in the housing behavior of young single-person households before and after the pandemic, and are expected to be used as basic data for planning youth housing suitable for the post-corona era.","김태완(Kim, Tae-Wan)",2021,https://www.riss.kr/link?id=A107953213
동시출현단어 분석을 이용한 노인주거디자인 국내외 연구동향 비교 - Web of Science Core Collection과 KCI-Korean 저널 데이터베이스를 중심으로 -,"In aging society, providing comfortable and optimized residential environment for the elderly is essential task for policy makers, designers, and researchers. The purpose of this research was to identify research trends in housing design for the elderly, both domestically in South Korea and in international, in order to propose a future research and a strategy for the research community. For this goal, we analyzed research documents published in domestic and international journal articles retrieved from Web of Science databases, using VOSviewer software for keyword co-occurrence analysis. The results show that international studies categorized as follows: (a) systems, services, and technologies, (b) care and health, (c) illness and life of the elderly (dementia, depression, etc.), and (d) macroperspective (population, project, government, and public-private partnership); domestic studies were categorized as (a) characteristics of residential environment, (b) studies on elderly care facilities, (c) architecture and interior design for the elderly, and (d) user needs and design elements. Compared to international research trends, those of domestic research tended to lack convergence of diverse areas and interest; thus, expansion of research interest towards more diverse disciplines including technology, health, medicine, nursing, and policy is necessary. The results provide insights for the direction of future research on the aging society of South Korea.","왕택우(Wang, Ze-Yu)",2021,https://www.riss.kr/link?id=A107953210
정비지원계획구역 지정이 부동산 가격에 미치는 영향에 관한 연구-서울시 용산구 청파동1가를 중심으로-,"This study investigated the impact of the maintenance support plan system introduced in September 2021 on real estate prices for rapid housing supply in Seoul. In particular, while designating the maintenance support plan area, the land transaction permit system and the base date for calculating rights were designated for the purpose of preventing the rise in real estate prices, and the impact of these policies on real estate prices was analyzed. Based on the actual transaction price, this study confirmed whether real estate prices were stabilized using a double-difference method that measures policy effects before and after the public offering by dividing into groups that applied real estate regulations and groups that did not. As a result of the analysis, it was found that there was no effect of suppressing the rise in real estate prices due to the application of the land transaction permit system to stabilize housing prices and the base date for calculating rights. Therefore, based on the results of this study, it is necessary to prepare additional measures to block speculative demand when designating a future maintenance support plan.",김숙현,2023,https://www.riss.kr/link?id=A108766881
외부환경과의 교류와 소통을 위한 매개공간 특성 - 주거유닛의 발코니 공간을 중심으로 -,"Due to Covid-19 pandemic and lockdown, people have experienced imbalance between the inside and outside and become aware of personal and social relationship based on places. Place as a meaningful location should provide a connection between the inside and the outside and provide a smooth transition between inside and outside. Balcony areas became used as living areas for replacement of its transitional functions as intended. More diverse shape and layout, size can provide higher possibility of connection and communication toward outside of individual unit in multi-complex housing in urban settings. For this study, we collected some of foreign and domestic balcony cases and analyzed layout arrangement, size, shape, and degree of openness. Foreign social housing appeared to have more diverse shapes and size variations and provided more open spaces with higher possibility of connection and communication with outside. In many domestic cases, balconies are more disconnected, enclosed and secured increased privacy.","이소영(Lee, So-Young)",2021,https://www.riss.kr/link?id=A107952642
"공유주거, 청년 1인가구의 주거 대안이 될 수 있는가?: 주거 유형별 사회적자본 및 주거만족도 비교·분석 연구","As urbanization and household differentiation progressed, Co-housing begans to emerge as an alternative to modern housing that pursues economic and socio-cultural benefits through the community. Co-housing is recognized as a desirable housing alternative for community revitalization at a time when exchanges between people are decreasing and community attachment, including social capital, is decreasing. Co-housing is advantageous in that it can secure high-quality residential spaces by operating various shared spaces compared to limited housing costs, and can independently form and exchange communities focusing on studies, work, and interests. This study started with the question of the utility and sustainability of Co-housing as an alternative housing type for single-person youth households. It is intended to verify the utility of Co-housing and to derive detailed housing factors that can improve the housing satisfaction of single-person households by analyzing whether they can lead a qualitative residential environment rather than living in detached house.","서은지(Seo, Eun-ji)",2022,https://www.riss.kr/link?id=A108112400
노인 스마트홈 관련 국제연구동향: 계량서지학적 분석을 중심으로,"With the background of aging society and the era of big data, this study investigated the research trends in smart homes for the elderly using bibliometric analysis. We analyzed research documents published in international journals retrieved from the Web of Science’s Core Collection by searching smart home and the elderly related terms. We analyzed the frequency of publications by year, by country, and by research field. In addition, using VOSviewer software, keyword co-occurrence analysis was conducted. The co-occurrence analysis results show following four main themes in the research of smart homes for the elderly: (a) benefits and concerns of smart home for elderly; (b) technology for daily activity detection, (c) elements of smart home technology, and (d) elderly health status and daily life. The results provide insights for the direction of future research on smart home for the elderly.","홍이경(Hong, Yi-Kyung)",2022,https://www.riss.kr/link?id=A108112405
입원 신생아에 있어 환경 온·습도에 따른 체온변이,"A cross sectional explorative study was conducted to invest the relationship between the temperature and humidity of the environment that newborns were l℃ated at and the central and peripheral body temperatures of newborns in hospitalized newborns using a primary dataset on 199 high-risk infants. Data was collected on the temperature (℃) and humidity (%) of the environments (incubator, radiant warmer and room), the temperatures (℃) from the central part (right upper quadrant of abdominal surface) and the peripheral part (dorsal surface of hand) of newborns. As well the weight and length was deducted from main dataset with general characteristics of newborns. The result showed that all of newborn revealed the peripheral hypothermia regardless of 88% of them in normothermia, 9% in hypothermia and 3% in hyperthermia. The low humidity of the environment, rather than the low environmental temperature of either incubator or radiant warmer, was mainly responsible for the massive peripheral hypothermia. Proper environmental humidity should be provided to maintain the normothermia of entire body system in high-risk newborns at NICU.",이상미(Sang-Mi Lee),2012,https://www.riss.kr/link?id=A99590470
요양병원에 입원한 노인환자의 건강상태가 욕창단계에 미치는 요인,"The purpose of this study was to explore the predictors of pressure ulcer stage among elderly in long-term care facilities(LTCFs). This study was a retrospective data analysis of 95 patients who had stayed over 3 months in LTCFs. Data were collected from monthly LTCFs patients’"" assessment report data during 3 months. The patients consisted of 65.3% females, with a mean age of 77.57 ± 9.97 years. The mean score of ADL 3.03 ± 1.06 in 5. The state of pressure ulcer after 3 months was 11.6%, stage 2 and 4 of pressure ulcer was 3.2% and stage 3 of pressure ulcer was 4.3%. The predictor factors of pressure ulcer stage was bowel elimination management, urinary elimination management and Parkinson""s disease. These variables accounted 37% of the variance in ulcer stage. These results suggest it is important to manage high risk group and systemic approach for prevention of pressure ulcer. Also it is necessary to develop the pressure ulcer prevention and management program for healthcare professionals, patients and caregivers.",채경숙(Kyung-Suk Chae),2012,https://www.riss.kr/link?id=A99590465
