
청년 1인가구의 주거환경만족도와 주거이동의향 실증분석 : 도시와 농촌 차이,"This study divides the residential areas of young one-person households living in Chuncheongnam-do into urban and rural areas, and analyzes the degree to which they are satisfied with their residential environment and they intend to migrate. The key findings are as follow: First, there is no difference in residential environment satisfaction among living areas (cities and rural areas). Although urban residents’ satisfaction (5.56 out of 10) is higher than that of rural residents (5.47), it is not statistically significant. Second, according to the results of the analysis by residential environment factors, urban residents are more satisfied with the access to living facilities, while rural residents are more satisfied with the air, noise, and green areas. Third, depending on the living area of young one-person households, urban residents’ intention of the residential movement is higher than that of rural residents. Fourth, the analysis on the factor that affects the satisfaction of the residential environment shows that all four types of housing factors have a statistically significant positive effect. In particular, convenience facility factors have a greater impact than other factors, which are common in urban and rural areas. Fifth, as the result of analyzing the determinants of the intention to move around, urban residents are not greatly affected by certain factors, and rural residents are greatly influenced by cultural tourism and sports factors. Young one-person households are very important for maintaining urban vitality and strengthening residential stability. In particular, considering the high cost of housing for young people, various housing policies in the supply-side for young people and the maintenance of the residential environment that can attract young people are required.","임준홍(Im, Jun-hong)",2021,https://www.riss.kr/link?id=A107355549
저출산 대응을 위한 해외 양육친화 주택의 육아지원 방안 분석 - 싱가포르와 일본을 중심으로 -,"The purpose of this study is to identify the most suitable direction for parenting-friendly residential policy to address low birth rates. To achieve this, we analyze the experiences of Singapore and Japan, countries that have successfully implemented policies to increase fertility rates. These countries were selected due to their close relationship with Korea. Singapore’s Kampung Admiralty is a prominent example of a multi-generational residential complex that fosters intergenerational living among parents and children, facilitating elderly care and childcare. On the other hand, Japan has developed a certification system for childcare support housing, which includes a variety of housing models for families with low birth rates, with unique regional features. Furthermore, Japan has initiated projects to expand local childcare support bases. This study provides valuable data for the formulation of future parenting-friendly residential policies, and the creation of residential services that cater to the needs of parents and children.","박지선(Park, Ji-Seon)",2023,https://www.riss.kr/link?id=A108605742
실내건축공간 디자인 스타일 기반 이미지 생성 인공지능 활용도 조사,"With the recent emergence of ChatGPT, Image Generation AI based on large language models has become an important issue of growing interest. Recent Image Generation AI based on giant language models, such as GPT, has demonstrated a remarkable improvement compared to existing technologies. This study investigates and analyzes the practicality of Image Generation AI by generating over 3,000 diverse Interior Architectural Space Images in 25 different styles using Image Generation AI and exploring their potential applications in related fields.","정현(Jeong, Hyun)",2023,https://www.riss.kr/link?id=A108605720
여대생의 환경호르몬 노출위험행위와 월경곤란증의 관계,"This descriptive study was designed to examine the relationship between risk-behavior to exposure toward endocrine disrupting chemicals(EDCs) and dysmenorrhea in young women. Data were collected from 236 university female students using self-reported questionnaire about risk-behavior to exposure toward EDCs and dysmenorrhea. Data analysis method were correlation analysis, factor analysis and ANOVA. As results, mean for risk-behavior to exposure toward EDCs was 2.70±0.41 and mean of dysmenorrhea was 2.80±1.07. The relationship between risk-behavior to exposure toward EDCs and dysmenorrhea showed significant correlation(r=.16, ρ=.012). 18 risk-behavior items to exposure toward EDCs were sorted into four factors by factor analysis: plastic container usage, exposure to pollutants, fast food and canned drink intake, chemical detergent usage. In two of four factor, dysmenorrhea showed significant differences among three level of risk-behavior to increase exposure toward EDCs. These results suggest that riskbehavior to increase exposure toward EDCs is related with dysmenorrhea.",천숙희,2020,https://www.riss.kr/link?id=A106865836
싱가포르 노인주거복지서비스의 현황,"Singapore has created a systematic housing welfare policy centered on public housing. The majority of Singaporeans live in public housing provided by the Housing and Development Board(HDB). HDB provides not only housing but also various housing welfare services. The purpose of this research is to examine the various elderly housing welfare services in Singapore and draw conclusion by comparing them to Korea. The elderly housing welfare services in Singapore were analyzed in the aspects of financial, physical, and life/welfare services, which are key aspects of housing welfare services, and those services were analyzed by comparing to Korean services. The research was conducted through a literature review, with supplementary consultation of local experts. As a result, it was found that Singapore is focusing on financial services for the elderly to live independently without financial difficulties. In addition, some benefits were provided for the people to live with or near their parents. These can help reduce the national and social burden of supporting the elderly, as well as the elderly can age in place where they have lived. It is expected that the results will contribute to preparing alternatives for the successful development and settlement of elderly housing welfare services, which are innovatively promoted in Korea.",김채린,2022,https://www.riss.kr/link?id=A108043492
지역사회 지속 거주를 위한 노인가구의 주택개조 실태와 개선 요구 - 2020년 주거실태조사를 중심으로 -,"This study aims to provide implications as basic data for seeking spatial alternatives for sustainable home-based elderly housing in the community and establishing policies by identifying the reality of housing modification and improvement needs of older adults households. The analysis data used the micro-data of Korea housing survey 2020, and the older adults household owners aged 65 or older who responded that they had experience in housing modification were targeted. As a result, older adults households of 'female and 'over 85 years of age' were found to be the most in need of support as both the awareness and use rate of home modification installation and housing support programs were lower than others. As the age increases, the proportion of home modification experience grows. Depending on whether or not there was a disability, older adults households with disabilities had a higher rate of home modification experience, but among them, 'non-registered disabled' households. Most of the home modification items were repaired in the kitchen and toilet- related facilities, 'lever-type faucet (faucet)', and 'a kitchen workbench of appropriate height' was the highest in order. On the other hand, 'emergency bells in the house' and 'auxiliary chair on the porch' showed the lowest rate. The necessary home modification was 'safe flooring for anti- slip', 'a toilet or bathroom support handles', 'emergency bells in the house', and 'removal of steps such as thresholds and stairs in the house' were higher than others. 'Male' older adults households were more aware of the housing support program than 'female' older adults. Even though home modification was the preferred program, it showed a low utilization rate.",황지혜,2023,https://www.riss.kr/link?id=A108565466
공공임대주택 커뮤니티 시설의 운영 · 관리방안에 관한 연구,"For efficient management and operation in Public Rental Housing, it is necessary to choose an operating method that requires account the needs of the users and subsidiaries of the various communities. The purpose of this study is to provide the basic data on the efficient management of community facilities in apartments and operation methods that can enhance residents satisfaction. The following four conclusions are extracted; First, the satisfaction with community operation management is highly correlated with overall satisfaction with community facilities. That is, it can be inferred that the satisfaction level of community facilities not only works in the physical environment but also in software such as operational management. Second, when choosing the operational management method for each facility, the first consideration should be focused on qualitative aspects such as the continuity and level of management of the operation rather than the operational cost. Third, the preference for pure autonomy and consignment methods is very high in the preference survey for residents operational management methods. However, it is assumed that there is a lack of information and understanding on professional and external consignment management methods such as consignment operation and rental operation. Fourth, most rental apartments have the right to decide on many operations and management, including the community, by the Korea Land and Housing Corporation. As a result, it is difficult to reflect the opinions of residents of rental apartments, which are operated independently by the consignment management team.","김민규(Kim, Min-Gyu)",2021,https://www.riss.kr/link?id=A107769720
프랙탈 기하학 차원에서 본 자하 하디드 건축작품의 공간형태특성에 관한 연구 - 2000년대 이후 건축작품 중심으로 -,"This study utilizes fractal geometry, which is evaluated as a new alternative in the field of science, to interpret and apply complex and diverse architectural phenomena in the field of architectural design to create multi-dimensional space forms and respond to users' unpredictable and flexible demands. We want to explore the possibilities of whether it can be used with various algorithms that can be used.
In this process, we tried to understand the concept, characteristics, and compositional principles of fractal geometry, and to interpret the creation process of spatial forms in Zaha Hadid's architectural works erected after the 2000s from the perspective of fractal geometry. In addition, we tried to explore the possibility of application to contemporary architecture by proposing the aspects of the architect's fractal characteristics through diagrams and analyzing the proportion of utilization of various algorithms to propose them as a mechanism for creating spatial forms.",김주향,2023,https://www.riss.kr/link?id=A108532453
노인주거복지정책의 현황과 정책제언,"The purpose of this paper is to review and critique on the current policies on housing welfare for the elderly and analyze the problems to make suggestions for the future policy-making of the field. Korea has experienced unprecedentedly rapid growth of aging population due to the extended life expectancy. Now the number of the elderly living alone reached 1 million, and one-generation households which consist of elderly people only comprise 35% of the whole households. The percentage of the elderly who live in their own housing marks 73.8%, however, they live in old housing and have low income. The elderly who live in rental housing also live in poor conditions of housing, income, and asset. Despite Korean government's efforts to develop policies and establish systems to provide the housing welfare for the elderly, the results have not been very successful. In order to improve housing welfare for the elderly, the following suggestions were made. First, more collaborative partnerships need to be established between government and nongovernment organizations. Second, provision of affordable residential facilities for the elderly should be expanded in the public sector. Third, establishment of an effective management system for the elderly welfare housing is needed. And finally, introduction of housing benefit system to assist the elderly to be better able to pay housing rents and to supplement their living costs.",신용주,2012,https://www.riss.kr/link?id=A99549532
국내 그린캠퍼스 추진현황 연구－ 관련제도 고찰과 전국 대학교의 추진실태 조사 －,"In order to propose the materials and offer the diffusion methods to implement the green campus domestically, this study aims to comprehend the current status of the green campus promotion in Korea through a review of the systematical assistance and a survey about the implementation of universities. For the systematical assistance, we reviewed the related current regulations, organizations, and green campus supporting projects. After developing the survey instrument, a survey was proceeded through the electronic official letter and online questionnaire. The implementation elements were 72 and the respondents were 92 universities. As results, the portion of implementing respondents was 2.2~72.8(average 22.3)% each element, and the number of implemented elements was 0~53(average 16.1) each university. These show that the level of university’s implementation was low. The background factors of it include the systematical obligation, selection of the green campus supporting project, and the will of university’s executives and etc. Therefore, the system amendment and establishment, the perception diffusion, the active use of supporting systems, and etc. are necessary.",최윤정,2018,https://www.riss.kr/link?id=A105429887
노인주택개조서비스 사례 연구 -행정안전부 노인돌봄 전달체계 개편 시범사업을 중심으로-,"The purpose of this study is to analyze the process of providing customized housing remodeling services considering the needs, physical condition, and lifestyle of the clients in Hwa-seong & Chun-cheon. The case used in this study is data on housing remodeling service users among the 「Reorganization pilot project of the Elderly Care Delivery System」 promoted by the Ministry of the Interior and Safety. The subjects of this study were 22 subjects who had been provided with Housing Remodeling service for about 4 months. A summary of the research results is as follows. First, when the client's lifestyle and physical function are comprehensively considered, the risk of falls is high. Second, the safety of each housing space is low. Third, the location and service items were included in the establishment of the service provision plan. Fourth, the service was provided according to the service plan. Fifth, service inspection and additional needs were identified through follow-up management and monitoring. In conclusion, the characteristics of the elderly and their health status should be considered when providing home remodeling services. And after providing the service, training on how to use is necessary.",이영광,2022,https://www.riss.kr/link?id=A108043491
"결혼이주여성의 지각된 건강상태와 자기효능감, 사회적지지, 건강문해력, 문화적응 스트레스와 여성건강지식이 건강관련 삶의 질에 미치는 영향","The purpose of this study is to investigate perceived health status, self efficacy and social support mainly for migrant women living in G district in Seoul city, and to investigate the relationship between them understanding perceived health, self efficacy and social support on quality of life, and to support the formation of ongoing management and self-help meetings for married migrant women. This is descriptive survey study using a questionnaire which with demographic and sociological variables, health care needs, perceived health status, self efficacy, social support, and quality of life items by 98 married migrant women who visit a multicultural family council. The perceived health status of the participants was generally well recognized(3.06±.82). Health-related quality of life was associated with perceived health status(r=.33, p=.001), self efficacy(r=.38, p<.001), social support(r=.33, p=.001) and it was a static correlation. Factors influencing quality of life were self efficacy, social support, and perceived health status and these factors accounted for 30.1% of health related quality of life. In order to maintain and promote the health related quality of life of married immigrant women, it is necessary to promote self efficacy, and to participate in the health promotion activities that take into account the sustained interest and support and health condition.",전미영,2019,https://www.riss.kr/link?id=A106186602
고령 남녀의 겨울철 품목별 착의실태와 한 벌 의복의 보온력,"This study was conducted to investigate the elderly’s actual wearing condition by clothing item and clothing thermal insulation in winter. Elderly males (N=111) and females (N=138) participated in this study. Based on actual wearing condition by clothing item, the representative winter ensembles of males and females outside and at home, respectively, were derived and then thermal insulation of those ensembles were measured by using a thermal manikin.
Among the upper items outside, the wearing rates of the padded coats were the highest in both males and females.
The wearing rates of singlet were higher in males compared to females both outside and at home, respectively (P<0.01).
The wearing rates of long-sleeved T-shirts and a vest were higher in females than those in males (P<0.01). The 82.6% and 57.2% of females wore brassieres outside and at home, respectively. As for the lower items, males and females wore boxer shorts and panties, respectively. More than 65% and 46% of males and females wore long-length underpants outside and at home, respectively, and there were no significant differences between gender. The wearing rate of hat was higher in males than that in females, while the wearing rate of muffler and gloves were higher in females (all, P<0.01). Thermal insulation of clothing ensembles in winter were 1.84 clo for male and 1.50 clo for female outside and 0.56 clo and 0.59 clo at home, respectively. These results showed that elderly males and females have different wearing behavior in winter.",박준희,2020,https://www.riss.kr/link?id=A106865835
스마트팜을 적용한 청년 공유주거의 발전방향,"Interest in shared housing that can form a community by sharing space and activities and live at low costs is increasing. As popularity is increasing, especially among young people who actively want to accept a new lifestyle, various programs that share the interests and hobbies of young people are emerging. Although it has not been established as a major housing type in Korea, it is predicted that the proportion of shared housing will increase and become one housing type based on the declining birthrate and aging society and the increase in single-person households. Therefore, this study aims to propose a youth-type shared housing that introduces an eco-friendly smart farm program that responds to climate change beyond simply sharing space, leisure, and hobby activities. In the study, the direction of development was presented in terms of space, activity, and function of youth-type shared housing applied with smart farms. Smart farms, which can be grown indoors and outdoors, can be linked to spaces where various activities take place in the youth’s lifestyle. Temporary single activities that have been carried out so far can develop into sustainable activities. The application of smart farms in shared housing can save energy in shared housing through the functional advantages of smart farms. Through the application of smart farms in shared housing for young people, we would like to contribute to the direction of sustainable future shared housing development. Future research needs to present more specific spatial composition beyond the proposal to apply smart farm programs to shared housing for young people.","손동화(Shon, Donghwa)",2023,https://www.riss.kr/link?id=A108605722
2010년 이후 노인주거 연구동향 고찰 - 체계적 문헌고찰과 직접 내용분석법을 활용하여 -,"This paper analyses research trends on older adults’ housing and reviews the results of previous studies. The baby boomer generation, born in 1955-1963 right after Korean War in Korea, has come to older adults. Researcher and designer should consider their high demands since they are no longer standardized as a group but are segmented by diverse characteristics of individuals (Kim et al., 2020). Factors by reviewing the previous studies before 2010 reestablished the research framework for this study, and the framework derived results using the systematic review methodology and manual content analysis. The results presented current issues on older adults’ housing in Korea as follows: there is a large amount of research on using consciousness(satisfaction, preference, demand). Since 2010, researchers have been interested in housing and related factors that older adults want to live with as they age.","주한나(Ju, Hannah)",2023,https://www.riss.kr/link?id=A108605732
부동산 개발금융 리스크 관리방안에 관한 연구 : PFV를 중심으로,"This study was to offer a combined risk management method between a real estate development and its financing risk as these days a real estate development and its financing are integrated each other. Also this study was meaningful to get various opinions of feedback about the PFV(Project Financing Vehicle) system from the experts engaged in the real estate market at a time when the PFV system is about to sunset by December 31, 2022. Among the 3 risks, the real estate development risk, the financing risk and the PFV system risk, the operational risk of PFV system was the most important, and the financing risk followed. Comparatively the real estate development risk was low. The return allocation was most important among the PFV operational risks. This was because the PFV system was to save corporates’ income tax and a stable return allocation to all participants was important. The expert group research showed the PFV system was inevitable. Also it showed that the legislation for the system and its administration were required for stable operations.","안용운(Ahn, Yong Un)",2021,https://www.riss.kr/link?id=A107867703
"공공임대주택의 공급이 미혼 청년 가구의 주거 만족도와 삶의 만족도, 결혼 의지에 미치는 영향","While the supply of public rental housing for young adults is expanding, studies that empirically verify effects of the policy have been conducted at an insignificant level. In this regard, this study aimed to verify causal effects of the Happy Houses, a representative public rental housing for young households in terms of changes in housing satisfaction, life satisfaction, and marriage willingness of unmarried young residents after moving into houses. To this end, an online survey was conducted targeting unmarried young households residing in the Happy Houses. As a result, it was found that the 'housing satisfaction', 'life satisfaction', and 'marriage willingness' of unmarried young households all increased due to moving into public rental housing. In addition, the change of housing satisfaction did not have a direct effect on the change of marriage willingness, but it affected the change of life satisfaction, and the change of the life satisfaction again influenced changes in marriage willingness, showing a complete mediating effect. The results of this study are meaningful in that they showed the effects of supplying public rental housing from various angles and prove that there is a positive effect, thereby providing a basis for this policy to gain social consensus and continue to be implemented.",김태완,2023,https://www.riss.kr/link?id=A108565465
