
한국 청소년의 가당음료 섭취실태 및 영향요인,"본 연구는 2017년도 제 13차 청소년건강행태온라인조사자료를 활용하여 우리나라 청소년의 가당음료 섭취실태를 파악하고 가당음료 섭취와 인구사회학적 특성, 건강관련 행위, 심리적 특성 및 식습관과의 관련요인을 확인하기 위해 수행되었다. 가당음료 섭취빈도는 탄산음료, 고카페인 또는 에너지음료, 단맛이 나는 음료수에 대한 섭취빈도를 합산하여 산출하였으며, 주요 분석결과는 다음과 같다.
1. 인구사회학적 특성별 가당음료 섭취비율을 살펴보면 남학생과 여학생의 가당음료 섭취 비율의 차이를 나타냈으며, 중학생군과 고등학생군의 가당음료 섭취비율에서도 유의미한 차이가 있었다. 아버지의 학력에서도, 주관적인 학업성적에서도 군간에 가당음료섭취비율의 유의미한 차이를 보였다.
2. 건강행위별 가당음료를 섭취하는 비율은 흡연군과 비흡연군간에 차이를 나타냈으며, 음주군과 비음주군에서도 섭취 비율의 차이를 보였다. 또한 중강도 · 고강도운동 등의 신체활동군에서 비신체활동군과의 가당음료 섭취 비율의 유의미한 차이를 보였다.
3. 심리적 특성으로서 스트레스가 높거나 자살 생각 또는 슬픔이나 절망감을 경험한 군에서도 비경험군과 가당음료 섭취 비율이 다르게 나타났다.
4. 식습관 요인을 살펴보면 아침을 주 5일 이상 결식한 군과 비결식군간에, 패스트푸드, 라면, 과자를 일주일에 3회 이상 섭취 또는 편의점 · 슈퍼마켓 · 학교매점을 이용하여 식사를 한 경험이 일주일에 3회 이상 있는 군과 3회 미만인 군간에 가당음료 섭취비율의 차이를 확인할 수 있었다. 채소 반찬의 경우 매일 3회 이상 섭취한 군과 3회 미만으로 섭취한 군간에 가당음료 섭취비율도 유의미한 차이를 보였다.
5. 가당음료 섭취에 영향을 주는 요인을 알아보고자 로지스틱 회귀분석을 실시한 결과 여학생보다 남학생이, 중학생보다 고등학생이, 아버지의 학력이 낮을수록, 주관적인 학업성적이 낮을수록, 흡연이나 음주를 하는 학생이 가당음료를 섭취할 가능성이 높았다. 또한 스트레스가 심하거나, 자살 생각 또는 슬픔이나 절망감을 경험한 학생들의 가당음료를 섭취할 가능성이 높게 분석되었다. 또한 아침을 자주 결식하거나, 패스트푸드, 라면, 과자 등 건강하지 못한 식품을 섭취하거나, 편의점, 슈퍼마켓, 학교매점에서 저녁을 간단히 먹는 학생들에게서도 가당음료 섭취 가능성이 높은 것으로 나타났다.
이상의 결과를 종합해보면 우리나라 청소년들의 가당음료 섭취와 인구사회학적 요인, 건강관련행위, 심리적 특성 및 식습관 등 여러 요인들과 연관성이 있음이 관찰되었다. 이러한 가당음료 섭취는 영양적으로 가치가 낮은 반면 칼로리는 높아 비만을 유도하고 각종 질환의 원인이 될 수 있다. 현재 정부에서 청소년들의 당류섭취량을 줄이기 위해 학교 내 또는 학교주변 어린이식품안전보호구역에서 탄산음료 또는 고카페인 함유 음료 판매를 금지하고 있으나, 학생들의 자의적 선택에 의해서 가당음료를 마시지 않도록 하기 위해서는 학교 영양교사나 급식영양사에 의하여 당류 섭취 감소를 위한 주기적인 영양교육이 이루어져야 할 것으로 본다.","김아영(Kim, Ayoung)",2018,https://www.riss.kr/link?id=A105672558
우리나라 성인 여성의 항산화비타민 섭취량과 비만의 연관성,"본 연구에서는 2007 ~ 2016년 국민건강영양조사의 검진조사와 식품섭취조사를 완료한 만 19세 이상의 성인 여성 30,425명을 대상으로 항산화비타민 섭취량과 비만 및 복부비만의 연관성을 분석하였다. 체질량지수가 25 ㎏/㎡ 이상이거나 허리둘레가 85 ㎝ 이상인 대상자를 각각 비만과 복부비만으로 판정하였고, 개인별 일일 항산화비타민 섭취량은 24시간 회상법을 이용한 식사자료와 한국인 상용식품의 항산화비타민 함량 데이터베이스를 연계하여 추정하였다. 항산화비타민에는 카로티노이드 6종, 레티놀, 비타민 A (레티놀 활성 당량), 비타민 C, 토코페롤 4종, 비타민 E (α-토코페롤 당량)이 포함되었다. 정상군과 비만군의 열량 1,000 ㎉당 일일 항산화비타민 섭취량의 평균을 비교한 결과, 비만군은 α-카로틴, 레티놀, 비타민 E, α-토코페롤, γ-토코페롤을 정상군보다 적게 섭취한 것으로 나타났다. 항산화비타민 섭취수준에 따라 대상자를 삼분위로 구분했을 때, 라이코펜을 가장 많이 섭취하는 군은 가장 적게 섭취하는 군에 비해 비만 (OR = 0.89, 95% CI: 0.83-0.96)과 복부비만 (OR = 0.88, 95% CI: 0.81-0.95) 유병률이 유의하게 낮았다. 총 카로티노이드, α-카로틴, 비타민 A, γ-토코페롤 섭취량 또한 복부비만의 오즈비와 음의 연관성을 나타냈다. 식품군별 항산화비타민 섭취량을 비교했을 때, 비만군은 정상군에 비해 난류, 우유류, 조미료류, 곡류를 통한 항산화비타민 섭취량이 적었다. 추후 전향적 설계를 이용한 후속연구를 수행하여 항산화비타민 섭취량과 비만 간의 인과성을 확인할 필요가 있을 것으로 사료된다.","함동우(Ham, Dongwoo)",2018,https://www.riss.kr/link?id=A105672563
가구소득수준에 따른 남녀 노인의 건강 및 영양섭취 실태 비교: 2018년 국민건강영양조사 자료를 이용하여,"본 연구에서는 제7기 (2018년) 국민건강영양조사 자료를 이용하여 65세 이상 노인의 가구소득수준에 따른 식생활, 건강생활특성 및 영양섭취실태를 비교 분석하였다. 본 연구의 주요결과를 요약하면 다음과 같다. 연구 대상자 수는 전체 1,355명이었으며, 남자 노인 41.5% (558명), 여자 노인 58.5% (797명)로 소득수준별로 저소득군 48.3%, 중소득군 40.9%, 고소득군이 10.5%로 나타났다. 연령, 거주지역, 교육수준, 가구 유형에서 남녀 노인 모두 소득수준별로 유의적인 차이가 있는 것으로 나타났으며 경제활동여부는 남자 노인에서만 소득수준의 차이가 있었다. 식생활 실태에서는 남녀 노인 모두 소득수준이 높을수록 외식 횟수가 많았으며 점심, 저녁 식사의 동반자가 있는 비율이 높게 나타났다. 소득수준과 주관적 건강상태를 살펴보면 남자 노인의 경우 소득이 높을수록 건강이 좋다고 느끼는 비율이 유의하게 높았으며, 저작 불편 여부에서도 소득이 낮을수록 불편을 느끼는 노인의 비율이 높았다. 비만, 당뇨병, 고콜레스테롤혈증 및 고중성지방혈증 유병률은 노인의 가구소득수준별로 차이가 없었으며 여자 노인의 경우 고소득군보다 저소득군에서 고혈압 유병률이 높게 나타났다. 영양소 섭취량은 남녀 모두 소득이 높아질수록 에너지섭취량이 증가하였으며 탄수화물의 섭취량은 남녀 모두 소득수준별로 차이가 없었다. 그러나, 단백질과 지질의 섭취량은 소득수준별 차이가 유의하게 나타나 남녀 노인 모두 소득수준이 높을수록 단백질, 지질 섭취량이 증가하였다. 남자 노인의 경우 인, 칼륨, 리보플라빈, 니아신, 비타민 C의 섭취량이 유의하게 차이를 보여 소득수준이 높을수록 섭취량이 많은 것으로 나타났다. 여자 노인은 칼슘, 인, 철, 비타민 A, 리보플라빈, 니아신의 섭취량에서 소득수준별 유의한 차이가 나타났으며 리보플라빈의 경우 남녀 노인 모두에서 소득수준별로 매우 유의한 차이를 보였다. 남녀 노인의 총 식품섭취량은 소득이 높아질수록 비례해서 섭취량도 많아지는 것으로 나타났다. 남자 노인의 경우 과일류 (p < 0.001), 해조류 (p < 0.05), 계란류 (p < 0.05)에서 유의적인 차이를 보이며 소득이 높아질수록 많이 섭취하고 있는 것으로 나타났다. 여자 노인의 경우에는 당류 (p < 0.001), 계란류 (p < 0.001), 음료류 (p < 0.001)에서 유의적인 차이가 나타났으며 소득이 높아질수록 섭취량이 증가하는 것으로 파악되었다. 전체적으로 우리나라 남녀 노인의 소득수준에 따른 영양 및 식품섭취량에 차이가 있으며 소득수준이 높을수록 에너지섭취량, 특히 단백질과 지질 섭취량이 많았고 미량영양소에서도 남자와 여자노인에 따라 섭취량에 차이가 있었다. 따라서, 남녀 노인의 소득수준에 따른 사회경제적 요인과 가구 유형, 사회환경 등이 식생활 및 영양섭취에 영향을 미치는 것을 알 수 있었다. 향후 노인 대상 영양지원 또는 교육 프로그램설계 시 노인의 성별, 소득수준별로 세분화된 내용구성이 필요하며, 건강한 식생활과 생활습관으로 변화시킬 수 있는 다양하고 체계적인 영양교육 및 영양지원 프로그램이 설계되어 제공되어야 하겠다.",길진모(Jin Mo Khil),2021,https://www.riss.kr/link?id=A107304077
대전지역 대학생들의 식생활 실태 및 생활습관이 식품섭취에 미치는 영향,"대전지역 대학생들의 식생활 실태 및 생활습관이 식품섭취에 미치는 영향을 조사하기 위해 대전지역의 대학생들을 대상으로 식품섭취, 식습관, 생활습관실태를 설문지를 이용하여 조사한 결과는 다음과 같다. 조사대상자들의 일반사항은 남학생 104명(26.75%), 여학생 282명(73.75%)으로 전체 386명이었다. 거주형태는 58.70%로 가장 많았고, 다음이 자취 28.05%, 하숙 5.97%, 친척집 3.9% 순이었다. 한달 용돈은 전체적으로 20∼30만원 미만이 가장 높게 나타났으며, 성별로는 유의적인 차이을 보였다(p＜0.01). 한달 외식비용은 전체적으로 5∼10만원 미만이 가장 많은 것으로 나타났으며, 성별간에는 유의적인 차이를 보였다(p<0.001).
조사대상자의 식사 이용형태에 대해서 아침식사에 주로이용하는 것은 전체적으로 밥류76.05%이었으며, 성별간에는 유의적인 차이가 없었다. 점심식사에 주로 이용하는 것은
전체적으로 밥류 73.77%로 가장 많았고, 다음으로 라면, 국수류 순이었으며. 성별간에는 유의적인 차이를 나타내었다.
식습관의 실태에 대해서는 아침식사에 대해 '규칙적으로 한다' 41.95%이었고, 점심식사는 '규칙적으로 한다' 가 54.55% 이었으며 성별간에는 유의적인 차이가 없었다. 저녁식사는 '불규칙적으로 한다' 가 49.22% 이었고, 성별간에는 유의적인 차이를 보였다. 식사를 거르는 때를 보면 전체적으로 아침을 먹지 않는 비율이 24.35%로 가장 높았고, 저녁 4.40%, 점심 2.08% 순이었다. 성별로는 유의적인 차이를 보였다. 식사를 거르는 이유에 대해서는 아침식사, 점심식사 모두 '시간이 없어서' 가 가장 높게 나타났으며, 저녁식사를 거르는 이유에 대해서는 '체중을 줄이려고' 에서 가장 높았고, 성별간에는 모두 유의적인 차이를 나타내었다.
생활습관의 실태조사에서 흡연은 '안한다' 80.0%로 나타났고, 음주는 '가끔 마신다' 가 67.19%로 가장 높았으며, 성별로는 각각 유의적인 차이를 보였다.
음주 및 흡연이 식품섭취에 미치는 영향에 대해서는 음주시에 식품섭취에서 '식사후 음주한다' 가 55.98%로 가장 높았고, 성별간에는 유의적인 차이가 없었다. 흡연시에 식품섭취에 미치는 영향에 대해서는 '영향을 주지 않는다' 에서 47.66%로 높았지만 '약간 영향을 준다' 32.03%, '많이 영향을 준다' 20.31%로 흡연이 영향을 주는 비율이 많든 적든 52.34% 로 흡연과 식품섭취에는 관련이 있는 것으로 나타났다. 성별로는 유의적인 차이를 보였다. 흡연 후 밥맛에 영향을 주는가에 대해서는 '잘 모르겠다' 가 높게 나타나 흡연이 밥맛에 큰 영향을 미치지 않음을 알 수 있었으며. 성별로는 유의적인 차이를 나타내었다.
심리적인 변화에 따른 식품섭취와의 관계를 조사한 결과 시험기간중의 식품섭취는 '평상시와 같다' 는 응답이 43.23%로 높게 나타났으나 '감소한다' 38.80%, '증가한다' 17.97%의 비율의 합계가 56.67%로 스트레스를 받으면 심리적으로 식품섭취에 영향을 주는 것으로 나타났다. 기분이 우울할 때 식품섭취의 변화는 '감소한다' 가 46.61%로 가장 높게 나타났으며, 피곤할 때는 식품섭취의 변화는 '감소한다', 78.24%로 가
장 높았고, 즐거울 때 식품섭취의 변화는 '증가한다' 에서 50.26%로 가장 높게 나타났다. 식품섭취증가 후에 나타나는 심리적인 변화는 '체중의 우려가 생긴다' 에서 57.70%로 가장 높게 나타났고, 식품섭취감소 후에 나타나는 심리적인 변화는 '느낌없다' 가 42.86%로 가장 높았다. 이러한 각각의 심리적인 변화에 따른 식품섭취의 관계에 대해서는 성별간에 모두 유의적인 차이를 나타내었다.
본 연구를 통하여 식생활 습관의 여러 가지 양상을 비교함으로써 현재의 식생활 실태를 파악하였으며 또한 생활습관이 식품섭취에 영향을 미치는 것으로 조사되었다. 따라서 식습관은 건강의 유지에 중요한 영향을 미치므로 잘못된 습관을 고쳐 나갈 수 있도록 학교나 가정에서 매스컴 등으로 바람직한 식생활교육을 지도하여야 할 것이다.",박상욱,2004,https://www.riss.kr/link?id=A45018299
한국 성인의 체질량 지수에 따른 비만도와 주관적 체형인식 간의 차이가 영양소 섭취와 체중조절 및 정신건강에 미치는 영향,"본 연구는 제5기 국민건강영양조사를 이용하여 만 19~64세 성인 10,608명을 대상으로 BMI를 기준으로 분류한 체형과 주관적 체형인식의 차이를 기준으로 실제 체형보다 마르게 인식하는 RL군, 실제 체형을 올바르게 인식하는 RA군과 실제체형보다 비만하다고 인식하는 RH군으로 분류하여 각 그룹의 영양소 섭취, 체중조절 여부, 정신건강상태를 비교하였다.
1) RH군의 비율은 19~29세, 30~49세, 50~64세에서 남자는 12.1%, 9.5%, 10.0%였고, 여자는 31.2%, 29.0%, 20.3%로 여자에서 RH군의 더 비율이 높았고, RL군의 비율은 남자 19~29세, 30~49세, 50~64세에서 26.0%, 24.2%, 28.8%였고, 여자는 3.9%, 5.7%, 14.6%로 남자에서 RL군의 비율이 더 높았다.
2) 남녀 연령대별 BMI에서 남자 19~29세, 30~49세의 평균 BMI는 RA군이 가장 높고 RH군, RL군 순위였으며 50~64세에선 RL군이 가장 낮았다. 여자 19~29세에서는 RL군이 가장 낮았으며, 30~49세, 50~64세에선 RA군이 가장 높고 RH군, RL군 순이었다.
3) 남자의 경우 19~29세에서 탄수화물 섭취량은 RH군이 가장 낮게 섭취하였다. 여자는 30~49세에서 총에너지 섭취량은 실제체형보다 비만하게 인식하는 RH군이 에너지 섭취가 가장 낮았으며 RL군이 가장 많이 섭취했다. 여자 30~49세와 50~64세에서 탄수화물 섭취량이 RH군에서 가장 낮았고 총에너지 섭취량에 따른 탄수화물 섭취비율 또한 30~49세에서 실제체형보다 비만하게 인식하는 RH군에서 가장 낮아 실제체형보다 비만하게 인식하였을 때 탄수화물 섭취량이 적었으며 이로 인해 에너지 섭취량이 적었다.
4) 남자 50~64세를 제외한 남녀 모든 연령대에서 실제체형보다 비만하게 인식하는 RH군이 체중 감량 시도를 가장 많이 한 것을 알 수 있고, 남자 19~29세, 30~49세, 전 연령대의 여자에서 실제체형보다 비만하게 인식하는 RH군에서 체중이 증가한 경우가 가장 적었지만, 주별 중등도 운동일수에는 차이가 없어서 체형인식과 운동량은 관련이 없었다.
5) 남자 19~29세에서 실제체형보다 비만하게 인식하는 RH군이 우울감을 느낀 비율이 높았지만, 남자 50~64세에서는 실제체형보다 마르게 인식하는 RL군이 우울감 경험비율과 스트레스가 높아 체형인식에 따른 우울감은 남성에서 연령별로 차이를 보였다.
결론적으로 본 연구를 통해 성별과 연령에 따라 다소 차이가 있지만 실제체형보다 자신을 비만하다고 인식할 때 탄수화물의 섭취를 줄이고, 체중조절을 더 시도하며, 젊은 남성들에서 우울감 경험률이 높음을 알 수 있었다. 이에 따라 올바른 신체상을 확립하기 위해선 마른 몸매 선호에 대한 왜곡된 사회문화적 분위기를 개선하고 자신의 체형에 대한 올바른 인식이 필요함을 확인하였다.","서지현(Seo, Jihyun)",2016,https://www.riss.kr/link?id=A103006580
"타가토스, 알룰로스, 과당으로 설탕을 대체하여 제조한 파운드 케이크의 이화학적 특성 연구",,황자영(Ja Young Hwang),2019,https://www.riss.kr/link?id=A106271684
당 섭취와 인지능력,"감미료는 감각을 만족시키는 기능을 가지며, 에너지를 공급하는 영양적 감미료와 에너지를 공급하지 않는 비 영양적 감미료로 분류 될 수 있다. 영양적 감미료들은 (설탕, 과당 등) 미국 식약청에서는 일반적으로 안전하다고 인식 (generally recognized as safe, GRAS) 되고 있다. 그러나 감미료 섭취는 적절한 영양섭취와 건강과 관련하여 아직 많은 우려를 가지고 있다. 첨가당으로부터의 에너지 섭취가 총 에너지 섭취의 25% 이상이면 식사의 질 (quality)이 낮아진다. 지난 수 십 년 간, 당 섭취가 행동적인 면에 부정적으로 작용한다는 많은 이론들이 대두되었다. 그러나 포도당은 뇌의 주요 에너지원이다. 포도당의 기억력 향상기능은 모든 연령에서 보고되었으며, 특히 젊은 층보다는 노인에서 더 효과적이었다. 특히 적당량으로 섭취하였을 때 포도당의 섭취는 단어기억, 이야기 기억, 24시간 전에 학습한 정보에 대한 기억, 경계 (vigilance)의 향상, 반응시간의 단축, 정신적 계산 능력의 향상, 시뮬레이터 조절에서의 실수감소, 스투르프효과 (Stroop effect)의 감소, 지능검사의 향상, 실제사건에 대한 기억력 검사와 웩슬러 척도 (Wechsler Scale)에서의 향상과 같은 여러 인지능력 검사에서 좋은 영향을 미친다고 한다. 포도당 용액과 간삭의 섭취는 기억력을 개선한다. 아침식사를 거르는 것은 아동들에서 낮은 학습능력을 보인다. 인지능력 변화와 관련 있는 식이는 뇌에 포도당을 공급하는 것과 관련 있다. 과당도 동물 실험에서 기억력을 향상시키는 기능이 있다는 것을 보여주고 있다. 본 논문은 당 섭취가 인지능력에 미치는 영향에 대한 과학적인 연구들을 종합하여 정리한 것이다. (Korean J Nutr 2007; 40 (Suppl) : 50 ~ 65)",김우경(Kim WooKyoung),2007,https://www.riss.kr/link?id=A82576632
임신성 당뇨병 환자의 식습관 및 식이섭취에 관한 환자-대조군 연구,"임신성 당뇨병의 발병에 영향을 미치는 식이 인자를 알아보고자 컴퓨터용 식품섭취빈도조사지와 설문지 등을 이용하여 임신성 당뇨병의 환자군-대조군 연구를 시행한 결과는 다음과 같다.
임신성 당뇨병군이 대조군보다 연령과 BMI가 높았고, 당뇨병의 가족력이 많았다. 임신전의 식습관은 임신성 당뇨병군이 대조군보다 1일 식사횟수가 적었고, 식사 시간이 불규칙하고 식사속도가 빨랐으며 채식을 적게 하고 기름진 음식을 싫어하는 경향이었으며, 식습관점수가 낮았다.
식품섭취빈도법으로 조사한 영양소 섭취량에서는 임신성 당뇨병군이 대조군보다 탄수화물의 섭취량이 유의적으로 많았고 단백질의 에너지 섭취비율이 유의적으로 낮았다. 지방의 섭취량에는 두 군 간에 차이가 없었으며 임신성 당뇨병군이 대조군보다 단백질과 칼슘, 인, 비타민 B₁의 영양밀도가 유의적으로 낮았다.
두 그룹 간에 섭취량에 유의적 차이를 보이는 식품 중 쌀, 중국국수, 돼지고기 등은 임신성 당뇨병군에서 대조군보다 많이 섭취하였고, 옥수수, 오정어채, 큰멸치, 수박, 포도, 복숭아, 밤, 땅콩, 호상 요구르트, 치즈, 검정콩, 당근 등은 대조군에서 섭취량이나 섭취빈도가 많았다. 두 군 사이에 섭취량에 유의적 차이를 보이는 음식 중 온면, 시루떡, 햄버거, 돼지고기편육, 삶은 계란 등은 임신성 당뇨병군에서 섭취량이 많았고, 전병, 두부조림, 오징어채무침, 깍두기, 야채샐러드, 김치국, 과일샐러드, 콩밥, 콩조림, 토마토쥬스 등은 대조군에서 섭취량이나 섭취빈도가 많았다. 특히 쌀의 경우에는 임신성 당뇨병군이 대조군보다 섭취량은 많았으나 섭취빈도는 적어 임신성 당뇨병군에서 1회의 섭취분량이 많았던 것으로 생각할 수 있다.
영양소 중에서는 탄수화물이나 에너지의 섭취량이 많을 때 임신성 당뇨병의 odds ratio가 증가하였고, 식품이나 음식은 쌀, 국수, 돼지고기, 온면, 시루떡, 햄버거, 삶은 계란, 돼지고기편육 등의 섭취량이 많을 때 임신성 당뇨병의 odds ratio가 증가하였다.
상관관계의 분석결과 에너지 섭취량, 탄수화물 섭취량 등이 혈액의 포도당농도와 상관관계가 있는 것으로 나타났다.
이상으로 본 연구 결과를 종합해 볼 때 임신성 당뇨병에 영향을 미치는 식이 인자는 지방보다는 탄수화물의 섭취량으로 생각되어지며 단백질을 포함한 식사의 질과 바람직하지 않은 식습관이 영향을 미칠 수 있음을 생각해 볼 수 있다.",지선경(Ji Sun-Kyung),2008,https://www.riss.kr/link?id=A82576634
한국인의 당류 공급 및 섭취실태,"최근 식생활의 서구화로 인해 기호식품의 사용량이 증가하고 설탕섭취량은 계속적인 증가를 보이고 있다. 특히, 아동들이 우리의 전통식생활에서 멀어지고 단 맛 위주의 스낵류나 과자 케？ 등과 같은 기호식품의 사용으로 인한 설탕섭취량이 증가하고 있다. “식품수급표”상에 나타난 설탕 공급량을 위주로 우리 국민의 설탕소비패턴과 국제간 비교를 통해 한국인들의 설탕섭취수준이 어느 정도인지를 파악하고 단맛에 대한 한국인의 기호도의 변화과정을 살펴보았다. “2001 국민건강영양조사”에서는 한국 성인 1일 1인당 약 60 g 정도의 설탕 섭취량을 보였다. 농림부의 “식품수급표”를 중심으로 살펴보면 2002년에 1인 1일당 설탕 공급량이 57g으로 나타나 미국인의 1일 설탕섭취량인 130g 정도인 것에 비하면 아직도 적다고 볼 수 있다. 그러나 1962년에 4.8g이었던 것을 생각하면 상당히 증가하였다. 식품수급표상에 나타난 국제 통계 비교치에서는 한국인의 1일 설탕공급량을 99g으로 잡고 있어 실제로는 한국인들의 설탕섭취량이 상당한 수준으로 올라왔음을 짐작케 한다. ISO의 국제 비교에서는 1년 1인 소비량이 22.7㎏으로 전 세계 국가 평균 소비량을 상회하고 있다. 아동의 가공식품 소비로 인한 설탕섭취량은 급속히 증가하였고, 현재 급속히 증가하고 있는 아동비만 현상과도 관련이 있다. 1995년에 행해진 초동학생들의 설탕섭취실태자료를 통해 볼 때 이미 10년 전에도 도시지역이 아닌 농촌 지역 아동의 설탕섭취량이 이미 60g 이상을 넘어서고 있었고 급원식품에서 성인들이 주로 과일류 의존이 높았던 반면 아동들은 간식류에서의 설탕섭취가 매우 높았다. 따라서 연령별로 매우 자세한 간식 목록에 의거한 설탕섭취량 조사가 무엇보다도 필요하다. 현재 한국의 식품성분표에는 다양한 한국음식에 대한 설탕함량 Database가 없으므로 미국의 USDA Database를 기초로 한국 식품의 설당 함량을 추론해야 하는 어려움이 있다. 따라서 다양한 한국음식의 설탕함유량에 대한 Database구축이 무엇보다도 필요하다고 보인다. (Korean J Nutr 2007; 40 (Suppl): 22 ~ 28)",김선희(Kim Sun-Hee),2007,https://www.riss.kr/link?id=A82576630
