
도시 청소년의 성의식 및 성문제와 성교육에 관한 조사 연구,"The purpose of this study was to investigate the sex consciousness, sex problems and sex education of adolescence emphasizing the validity and necessity for the systematic enforcement of sex education.
For this purpose, a questionnaire representing six categories, the relationship, with the opposite sex, sexual knowledge, sex consciousness, sex morality, sex problems, and sex education, was developed by the researchers.
The subjects of this study was 224 middle school students and 267high school students in Seoul.
Sex ration of these subjects was about the same;
For the satistical analysis of the collected data, frequency, Chi-square, and severed one way ANOVA's and two way ANOVA's were performed .05 was used as a significance level in this study.
The most important findings in the study showed that that most of the students wanted the systematic sex education in school, especially by the professionals in the sex education field.",이문희,1994,https://www.riss.kr/link?id=A2086327
비타민E 보충이 성인의 Immune activity에 미치는 영향,"This trial attempted to assess the effect of vitamin E supplementation on immune response for Korean adults. 10 volunteers aged between 20-60 received daily 10mg vitamin E for 6 months. The effect of the supplementation on the expression of cell surface markers(CD4, CD8) defining specific lymphocyte and NK cell activity(Lu 30), T cell(PHA) and B cell(SAC) proliferative response, were examined using flow cytometric analyses. The mean expression of CD4, CDS, CD56 tend to increase immediately after the supplementation. However, there were the tendency to show that the level come back to the level of the initial period. The results may suggest that immune response stabilized once the blood level saturated at the certain level of nutrient intake.",김영옥,2001,https://www.riss.kr/link?id=A327070
연령대별 1인 가구의 우울감에 미치는 영향요인: 다인 가구와의 비교를 중심으로,"The study aims to examine the association between patterns of depressive symptoms and which factors influence depressive symptoms of the between single-person and multi-person households according to the age groups by using data from the 16th year(2021) Korea Welfare Panel Study(KoWePS). A total of 2,172 single-person households and 9,355 multi-person households were divided into the following groups: young(19∼39), middle(40∼59), younger-old(60∼79), and older-old(80+). There were differences in the characteristics, levels of depressive symptoms, and factors affecting depressive symptoms for each age group between single-person and multi-person households. Unlike the young and middle-aged groups, the social relation characteristics of the older adults group were significantly associated with depressive symptoms regardless of household composition. The results of this study show that age should be considered in the research and intervention related to depressive symptoms in single-person households. These findings suggest practical and policy interventions for single-person households.",윤태실,2023,https://www.riss.kr/link?id=A108533011
성별에 따른 결혼 인식의 세대 차이,"The purpose of study is to examine marriage perceptions according to gender and generation, and whether they are influenced by socio-demographic information and family values. Online surveys were conducted to investigate family related values, and 1,319 adults participated in this study. Using STATA 17.0, descriptive analyses, correlational analyses, group comparison analyses, and hierarchical logistic regression analyses were conducted. The results are as follows. First, younger generations perceived family diversity more positively for both men and women. For women, younger generations showed higher levels of non-traditional gender role attitudes and positive family perceptions. Second, younger generations demonstrated lower levels of positive marriage perceptions, and the gender difference in perceiving marriage positively existed in generation M and Z. Third, for men and women, the babyboomer (BB) generation perceived marriage the most positively in model 1, but the generational differences disappeared after socio-demographic information and family value related variables were put in model 2 and 3. For men, higher levels of non-traditional gender role attitudes and positive family perceptions and lower levels of family diversity influenced their positive marriage perception. For women, lower levels of family diversity and higher levels of positive family perceptions influenced their positive marriage perception. Also, married individuals perceived marriage more positively regardless of gender or generations. This study will provide valuable information in making family policies regarding marriage and low birthrate.",진미정,2023,https://www.riss.kr/link?id=A108533013
유아의 미디어 이용시간 실태와 자기조절력 및 문제행동과의 관계,"The purpose of this study was to examine the media use time of young children and to investigate the relationship between young children’s media use time, self-regulation, and problem behavior. The subjects of this study were 82 mothers of 82 children age 5-6 and eight teachers of the children who are attending six preschool facilities in the Seoul area. To measure the media use time of young children, we developed our questionnaire for this study with reference to Current Status and Protective Measures of Young Children’s Exposure to Media Devices (Jeongrim Lee, Namhee Do, Yu Jeong Oh, 2013). This study modified and revised the Self-Control Rating Scale (Kendall and Wilcox, 1979) and Children's Behavior Rating Scale (C-TRF) (Oh Kyung-Ja & Kim Young-A, 2010). The Pearson product moment correlation coefficient and the one-way ANOVA were used to analyze the data. The results were as follow: first, the average media use time of young children was three hours and 54 minutes. Additionally, young children spent more media exposure time with parents and siblings, than the time they spent alone on media. Two, the aggressiveness of the children was higher with longer use time of smart devices, and boys had higher scores on emotional reactivity in internalizing problem behavior, as well as aggressiveness, and problem behavior in externalizing problem behavior. Additionally, when young children were alone while using smart devices, their attentiveness and aggressiveness were higher in externalizing problem behavior.",김보라,2019,https://www.riss.kr/link?id=A106492969
구조적 가족치료와 전략적 가족치료의 통합적 접근,"The key concept of structural family therapy model is family structure, which is made of repeated interaction among family members. Related concepts of family structure are family subsystem, boundary, enmeshed and disengaged family. The purpose of structural family therapy is removal of symptoms(short-term) and restructuring the family and maintaining the changed family structure(ultimate purpose).
Strategic family therapy model emphasizes change itself rather than understanding the problem. It focuses on sequence of behaviors, communication types, and here and now approach. The symptom is often the power struggle among family members. Coalition across generation lines destroys the hierarchical structure, which generates dysfunctional triangles and perpetuates the symptoms Structural family therapy focused on techniques and developed innovational ways to change families.
There are many commonality between structural family therapy and strategic family therapy. First of all, couple subsystem is viewed as the most important and relatively stable system. Strengthening couple subsystem is often pursued in both models. Both models also are relatively short-term, focuses on directly dealing with problems rather than gaining insights about problems. Therapists, in both models, are more actively involved with family members, initiating many tactics of change. Skills are also similar. Joining with family, enactment, reframing and relabeling are common in both models. Of course, paradoxical intervention is more the characteristics of strategical family therapy model.
The concepts of family structure, use of specific and behavioral strategies fit Korean family. It may be particularly useful to solve fixated pattern of communication among family members and rigid hierarchical family.",신혜섭,2003,https://www.riss.kr/link?id=A327127
이별을 경험한 대학생의 고통감과 이별 후 성장의 관계: 의도적 반추와 대처유연성의 조절된 매개효과,"This study aimed to identify whether coping flexibility can moderate the mediating effect of deliberate rumination in the relationship between distress and post-traumatic growth of university students Who experienced breakups. Online data approximately 330 University students were analyzed, The moderated mediation effect of deliberate rumination in the relationship between distress and post-traumatic growth was examined. Data were analyzed using SPSS 23.0 program and PROCESS Macro(v.3.1). The results are as follows. First, deliberate rumination has a mediating effect on the relationship between distress after breakups and post-traumatic growth. Second, coping flexibility has a moderating effect on the relationship between deliberate rumination and post-traumatic growth. Third, coping flexibility has a moderated mediating effect through deliberate rumination on the relationship between distress after breakups and post-traumatic growth. Hense, when distress after breakups leads to post-traumatic growth through deliberate rumination, high levels of coping flexibility promotes the effect of deliberate rumination. The results of this study suggest that therapeutic interventions help to increase the level of coping flexibility required after experiencing a breakups.",서은비,2022,https://www.riss.kr/link?id=A108324568
"대상관계이론의 관점에서 본 자녀양육과 자아발달: 클라인, 비온 그리고 위니컷을 중심으로","The modern psychoanalytic approach of object relations theory, in particular, has emphasized that human beings grow up and exist in interactional relationships. Furthermore, these theories purport that self-development occurs through internalizing those relationships. This study explores the relationship between parenting and self-development from the perspectives of Klein, Bion, and Winnicott’s object relations theories. These three theorists have highlighted primary caregivers’ critical role in a child’s self-development. This study focuses on the main concepts of these theorists, including “projective identification,” “containment,” and “holding.” The study examines the implications of each concept to better understand the role of parenting in a child’s self-development. The results of this study outline Klein’s “projective identification” as a defense mechanism. It serves as a child’s way of protecting themselves from anxieties due to death drive, while relating them to external objects. Bion’s containment theory provides perspective on the intersubjective relationship between a mother and child. This is critical in the context of the child’s self-development. Lastly, Winnicott emphasized the role of the mother as a holding environment for a child.",김은정,2022,https://www.riss.kr/link?id=A108324564
한국과 영국의 학교 성교육 비교 연구,"Sex education in the U.K. follows an ideal model, co-operation where ever possible between homes, schools, and communities, whereas in Korea schools are mostly responsible for sex education. Moreover, Central Government and LEAs are deeply involved in school sex education in the U.K., in contrasts the concrete help at Government level is very limited in Korea though the necessity of sex education is acknowledged. These differences be accounted for by the different social and cultural backgrounds of the two countries, especially given the different thoughts of the people-oriental and occidental- . In the U.K., sex education has been a compulsory subject in secondary schools since 1994 (by the Education Act 1993), and it is well managed with the support at Government level as compared with that of Korea. Sex education in the U.K. may give some lessons for practising and developing sex education in Korea because the people in both countries have similarly conservative thinking about school sex education and it is implemented very carefully in the U.K.. In this article, a general comparison of background, policy, aims, content, management, teacher training, and materials of sex education between the two countries is made.",김정옥,1996,https://www.riss.kr/link?id=A2086377
코로나19 팬데믹 시대의 가족스트레스가 가족기능에 미치는 영향: 인지적 대처와 우울의 매개효과,"Objective: The purpose of this study was to investigate effects of Family Stress on Cognitive Coping, Depression, and Family Functioning during the COVID-19 pandemic. Methods: Subjects of this study were 679 married people with children under the age of 19, with a psychological crisis level of 6 or higher out of 10 after the onset of COVID-19. Data were analyzed using SPSS 25.0 program. The path model was tested using the AMOS 23.0 program. Results: First, there were differences in family stress, cognitive coping, depression, and family function according to demographic variables. Second, Family stress during the COVID-19 pandemic affected depression through cognitive coping. Third, cognitive coping during the COVID-19 pandemic affected family function through depression. Fourth, family stress during the COVID-19 pandemic had an indirect effect on family functioning through cognitive coping and depression. Cognitive coping had a mediating effect on the relationship between family stress and depression. It also had a mediating effect on the relationship between family stress and family functioning. Conclusion: Results of the current study highlight the significance of intervention in cognitive coping to improve family functioning. That is, counseling and education programs need to focus on cognitive coping to effectively intervene in family stress and depression during the COVID-19 pandemic.",박이슬,2022,https://www.riss.kr/link?id=A108117548
한국판 아동 청소년 행동평가척도 6-18을 기반으로 한 조증 척도 (CBCL-MS)의 요인구조 : 아동을 대상으로,"In this study, we examined the factor structure of the Child Behavior Checklist-Mania Scale (CBCL-MS) for children. Confirmatory factor analysis was performed on two previous model studies to determine which factor structure was most appropriate for the CBCL-MS. This study analyzed the data from the 10th year of the Korean Children Panel Study, which included 1,420 children. The K-CBCL 6-18 was employed as the research instrument.The new scale, the CBCL-MS, is derived from the CBCL and comprises of 19 CBCL questions that correlate directly with criteria for mania and bipolar disorder. CBCL-MS consists of four factors. The results of this study provided further support the CBCL-MS for children and confirmed the CBCL-MS’s most appropriate factor structure in a sample of Korean children’s population.","박미숙(Park, Mi-sook)",2021,https://www.riss.kr/link?id=A107973986
3D 가상의류 제작을 위한 가상원단과 실제원단의 드레이프 비교에 대한 연구,"Three-dimensional (3D) virtual garments imitate the silhouette and details of clothing in a virtual space on a computer without producing actual clothing and have been used in a variety of fields. As non-face-to-face services have become more popular in the fashion field, they are now being used for virtual models or digital fashion shows. As a result, the virtual garment must be similar to the real one. Drape is one of the factors that determines the silhouette of the garment. Thus, in this study, we compared the difference between real and virtual fabrics by using drape to confirm the similarity between the real and virtual fabrics. Fabrics were divided based on the fabric type and drape difference between the real and virtual fabrics. The experiment was carried out with the help of 287 woven and 318 knit fabrics. The drape ratio was used to test the drape quality of materials. By employing drape ratio, woven and knit fabrics were divided into seven grades, with eight fabrics selected for each grade. The drape ratio of the virtual and real fabrics was evaluated after creating virtual fabrics of selected fabrics using the CLO 3D application. Correlation analysis revealed that there is a correlation between the drape ratio of the real and virtual fabric for both woven and knit fabrics. However, t-test results demonstrate that there is a difference between the drape ratio of the real and virtual fabric, with the virtual fabric drape tending to be larger than the drape ratio of the real fabric. When fabrics were divided by type, the outer fabrics had the largest difference in drape between real and virtual. As drape property is affected by fabric functional processing, additional research is needed to determine what kind of functional processing affects the difference between real and virtual fabrics. In this study, physical and data were extracted from, and it is expected that this research can help contribute to the reproducibility of 3D modeling in the fashion field.",윤혜준(YOON HYE JUN),2021,https://www.riss.kr/link?id=A107973086
부모의 공감적 태도와 청소년의 자아존중감 간의 관계에서 청소년의 인지적 정서조절전략의매개효과,"The purpose of this study was to investigate the parallel multi-mediating effects of cognitive emotion regulation strategies (adaptive/maladaptive) as noted between parental empathy (cognitive/ emotional) and self-esteem of early adolescents. In this study, we collected data from 568 middle school students in S, D and J cities, and analyzed them using the SPSS 20.0 and the SPSS PROCESS macro statistics program. From the data analysis, it was noted that the adaptive cognitive emotion regulation strategies had a mediating effect on the impact of cognitive and emotional empathy of parents on self-esteem. However, the maladaptive cognitive emotion regulation strategies had only a mediating effect on the impact of emotional empathy of parents on self-esteem. As a result of the difference verification, parental empathy mainly affected self-esteem through the adaptive cognitive emotion regulation strategies. Therefore, raising parental empathy (cognitive/emotional) and adolescent's adaptive cognitive emotion regulation strategies were essential factors for promoting self-esteem. We also need to enhance the emotional empathy of parents to promote self-esteem by reducing the effect of the adolescent's maladaptive cognitive emotion regulation strategies.",이진경,2020,https://www.riss.kr/link?id=A107017508
유아와 부모의 어린이도서관 참여 경험에 대한 탐색 연구,"Children's library is a complex cultural space. It can be said to be the center of education, culture, and information for children and their families. However, as existing research studies on children's libraries are mainly conducted in the field of literature and information, children and their parents tend to be overlooked. This study attempted to qualitatively explore the meaning of participating experiences in children's library by recruiting children, parents, and librarians into focus groups. Research questions are: 1) what is the experience of parents with early childhood children using children's library? 2) what is the experience of infants participating in children's library? and 3) what is children's library librarian's experience of interacting with infants and parents? Participating institutions were three children's libraries in Seoul. Participants were 45 young children, 24 parents, and 6 librarians. Focus group interviews were conducted. Focus group interview is a data collection method that induces communication between participants to stimulate cognitive activation and to reveal attitudes, motivations, and emotions while freely exchanging opinions. Common or conflicting opinions of parents and librarians on their participation experiences were captured and the meaning was derived. The essential meaning of children's participation experience was studied by conducting theme analysis on pictures they draw on children's library. Results could contribute to enhancing the role of children's libraries as a complex cultural space in the community and suggesting practices to support positive development of children.",임재윤,2022,https://www.riss.kr/link?id=A108117545
기업의 과도한 마케팅이 소비자스트레스 및 권리침해인식과 구매의도에 미치는 영향,"This study seeks to shed light on consumers’ general perceptions of marketing and how these perceptions vary by the type of excessive marketing media. Also, it examines how excessive marketing affects consumers’ stress levels, rights infringement awareness, and purchase intentions. The results are as follows. First, consumers showed a more positive attitude toward traditional media compared to new marketing media. Second, they preferred marketing media that did not infringe on their personal lives (e.g., time or privacy). Third, regarding the attitude manifested by excessive marketing media, consumers held the most negative attitudes toward human media, mobile media, and broadcasting media, in that order. Fourth, regarding their degree of discomfort with excessive marketing media, they felt the most uncomfortable with excessive marketing by mobile media. In response to the question of how they felt about excessive marketing, “Reject” was the most common answer. Fifth, the stress levels caused by excessive marketing media were reported as highly stressful for human media, mobile media, and broadcasting media. Sixth, concerning the effect of the excessive marketing experience on consumers’ purchase intentions, human media had the most negative impact. Finally, the analysis of consumers’ attitude-behavioral models showed that the consumers’ stress and rights infringement awareness caused by all three types of media(human, mobile, and broadcasting) had a negative impact on purchase intentions.","박지윤(Park, Jiyun)",2019,https://www.riss.kr/link?id=A106357899
대학생의 불확실성에 대한 인내력 부족과 학업소진의 관계 : 자아탄력성에 의해 조절된 사회비교경향성의 매개효과,"The aim of this study is to examine the mediating effect of social comparison orientation moderated by ego-resiliency in the relationship between intolerance of uncertainty and academic burnout. The participants were 650 (287 men and 363 women) undergraduate students. The data were analyzed using descriptive statistics, factor analysis, and Process Macro v. 3.5 model 14. The results of this study were as follows: First, ego-resiliency moderated the mediating effect of ability comparison orientation on academic burnout. Second, ego-resiliency did not moderate the mediating effect of opinion comparison orientation on academic burnout. In conclusion, the results suggest the effect of ability in comparison prominent in the academic burnout process and that ego-resiliency strengthens the effect of ability comparison orientation on academic burnout.",송진아,2022,https://www.riss.kr/link?id=A108327013
노인의 자아통합감과 삶의 만족도 간의 관계: 초월과 죽음 불안의 조절된 매개효과,"The current study aimed to show the moderating and mediating effects of transcendence and death anxiety in the relationship between ego-integrity and life satisfaction to improve life satisfaction in the elderly experiencing physical, psychological, and socioeconomic changes due to various losses. The participants in this study included 144 elderly aged 60 years and over. The Results can be summarized as follows: A significant mediating effect of transcendence was found in the relationship between self-integrity and life satisfaction. A significant moderating effect of death anxiety was found in the relationship between the self-integrity and transcendence. The tendency that ego-integrity indirectly increased life satisfaction with mediated by transcendence was promoted in less death anxiety. Consequently, in order to increase the life satisfaction of the elderly, it is necessary to re-examine the meaning of life and to accept of the past life for promoting ego-integrity and transcendence. Efforts are needed to lower the level of death anxiety, and for this, programs to understand death in old age and resolve death anxiety are needed.",진지혜,2022,https://www.riss.kr/link?id=A108324567
리포좀의 특성 및 안정성에 관한 연구,"Liposomes are self-assembling colloidal vesicles composed of phospholipid bilayers in which drugs or bioactive materials are encapsulated. Liposomes have been widely employed as an effective delivery system for drugs and cosmetics, but there are still some problems about the low stability of liposomes. In this study, various relavant informations on the charaterisics of liposome were presented. Also, factors influencing the stability of liposomes were analyzed and a general overview of the stability problems of liposomes was given.",진병석,2001,https://www.riss.kr/link?id=A327078
