
"OECD 국가의 양육지원 정책과 출산율 분석: 현금지원 정책, 보육시설서비스 정책, 조세혜택 정책을 중심으로","본 연구에서는 양육지원 정책과 출산율과의 관계를 분석하기 위해 OECD 33개국의 출산율을 종속변수로 현금지원 정책, 보육시설서비스 정책, 조세혜택 정책을 독립변수로 구조방정식을 실시하였다. 연구결과 출산율에 가장 큰 영향을 미치는 정책은 보육시설서비스 정책으로 나타났다. 정책비용에 따른 효과를 다시 한 번 비교해 보았을 때 현금지원 정책은 지원비용에 따라 효과의 증감이 일관되게 나타났으나 보육시설서비스 정책은 지원비용에 따라일관된 증감이 나타나지 않았다. 이러한 연구 결과는 현금지원 정책의 효과성을 높이기 위해서는 부모의 양육부담 완화를 위한 적정 비용의 산정과 재정의 재분배 그리고 지원방법과시기에 대한 지속적인 논의가 이루어져야하고, 보육시설서비스 정책의 효과성을 높이기 위해서는 일과 가정의 양립을 가능하게 하는 다양하고 포괄적인 질적 보육시설서비스 정책이지속적으로 시행되어져야 한다는 것을 시사한다.",강경희,2013,https://www.riss.kr/link?id=A104443169
양육효능감의 매개 역할,"1 ""어머니의 양육효능감에 관한 연구"" 43 (43): 111-123, 2005",최형성(Hyung Sung Choe),2005,https://www.riss.kr/link?id=A102953769
"영아를 둔 아버지들의 부모 효능감, 놀이 신념, 그리고 영아의 놀이성 간의 관계 연구","영아를 둔 아버지의 부모 효능감, 놀이 신념, 그리고 영아의 놀이성 간의 관계를 살펴보기 위해 본 연구를 실시하였다. 본 연구의 참여자는 인천 및 경기도에 위치한 보육시설에 다니고 있는 만 2세의 영아를 둔 아버지 152명과 영아를 담당한 교사들 15명이었다. 만 2세의 영아를 둔 아버지의 부모 효능감과 놀이 신념을 측정하기 위해 부모 효능감 척도(Parent Sense of Competence: PSCO)와 부모 놀이 신념 척도 (The Parent Play Beliefs Scale: PPBS)를 사용하였고, 영아를 담당한 교사들이 영아의 놀이성을 측정하기 위해 영아의 놀이성 척도 CPS(Children``s Playfulness Scale)를 사용하였다. 수집된 자료는 연구문제에 따라 독립표본t-test, 일원변량분석(one-way ANOVA), Pearson의 상관관계 분석을 실시하였다. 본 연구의 결과는 다음과 같다. 먼저, 아버지의 효능감은 아버지 연령, 학력, 소득의 종류에 따라 차이가 없었다. 아버지의 놀이 신념은 연령에 따라 차이가 없었지만, 학력에 따라 놀이지지 놀이신념은 차이가 있었고, 소득에 따라 학습 중심의 놀이 신념은 차이가 있었다. 영아의 놀이성은 아버지의 연령에 따라 차이가 없었지만, 아버지의 학력, 소득에 따라 차이가 있었다. 둘째, 아버지의 부모효능감과 놀이지지 놀이신념은 긍정적인 관계가 있었고, 아버지의 부모효능감은 영아 놀이성의 하위 영역인 사회적 자발성에서 긍정적인 관계가 있었다. 그러나 아버지의 놀이 신념과 영아 놀이성은 통계적으로 유의한 상관관계가 존재하지 않았다. 본 연구의 결과는 영아의 놀이성에 영향을 미치는 아버지의 부모효능감과 놀이신념에 대한 올바른 이해와 더 나아가 영아를 둔 아버지의 자녀양육을 어떻게 도움을 줄 수 있는지 살펴보는데 그 의의가 있다.",권인옥 ( In Ok Kwon ),2015,https://www.riss.kr/link?id=A101741701
중국 출신 다문화가정 어머니의 자녀 이중언어를 위한 부모교육 참여 경험,"본 연구의 목적은 중국 출신 다문화가정 어머니를 대상으로 자녀 이중언어교육을 위한 부모교육 참여 경험에 대해 살펴보고자 하는 것이다. 이를 위해 유아기 자녀를 둔 중국 출신 다문화가정 어머니 8명을 연구 참여자로 선정하여 심층면담을 실시하였다. 수집된 자료는 Creswell이 제시한 질적 연구의 분석을 토대로 하였고, 분석 결과 참여자들의 참여 경험은 5개의 상위범주와 10개의 하위범주로 분류되었다. 연구 결과, 중국 출신 다문화가정 어머니들의 부모교육 참여 경험은 첫째, ‘중국엄마인 자신에 대해 재발견함’, 둘째, ‘달라진 자녀 모습에 고양됨’, 셋째, ‘교육을 통해 자녀 이중언어에 대한 인식이 변화됨’, 넷째, ‘다양한 이중언어교육방법을 알고 실천하게 됨’, 다섯째, ‘자녀 이중언어교육에 대한 요구가 생김’으로 범주화되었다. 본 연구의 결과를 통해 다문화가정 자녀의 이중언어교육을 위한 기초자료를 제공하고, 향후 다문화가정 부모를 대상으로 한 자녀 이중언어를 위한 부모교육의 바람직한 방향성을 제공할 수 있을 것이다.",이상미,2023,https://www.riss.kr/link?id=A108531337
"학부모는 무엇을 할 수 있고, 또 해야 하는가? : 현행 법령에 나타난 학부모의 권리와 의무 분석","이 연구는 학부모의 권리와 의무가 현행 법령에 구체적으로 어떻게 규정되어 있는지를 확인하기 위한 것이다. 분석 결과 76개 법령의 198개 조문에 관련 사항이 명시되어 있었다. 권리 166건에 의무와 책임이 각각 24건과 8건이었다. 법률이 114건으로 압도적으로 많았으며(57.6%), 대통령령 69건과 부령은 15건으로 나타났다. 권리의 유형별로는 참여권이 47건(28.7%)으로 가장 많고, 요구권(39건)과 알 권리(35건) 및 의견제시권(24건)도 비교적 많은 편이었다. 동의권(9건)과 의견진술권(7건) 및 프라이버시권(5건)은 미미했다. 다양한 법령과 조문에 권리와 의무가 규정되고 학교를 비롯하여 광범위한 참여를 요청받는 것은, 학부모의 위상과 역할의 중요함을 잘 나타내는 실증적 지표라 하겠다. 영역별로 다른 특성도 확인되었다. 참여권과 의견제시권은 공적 영역의 권리인데 비해 나머지는 학부모 개인의 사적 영역의 권리라 할 수 있다. 동의권은 가장 엄격한 법적 구속력을 가지는 권리다. 의무에는 권장사항 정도의 일반적인 의무, 반드시 이행을 요하는 의무, 채무관계의 부담을 지는 의무로 구분되었다. 학부모의 권리 보장과 책무성 향상을 위해서는 법령의 한계와 문제점 보완이 필요하다. 학부모 교육권의 체계와 내용 정립, 입법 미비점의 조속한 치유, 현실성 있고 유용한 제도적 장치를 갖출 것을 제언하였다.","김장중(Kim, Jang-Joong)",2022,https://www.riss.kr/link?id=A108016655
임산부-태아 간 상호작용과 애착발달,[초록없음],강차연;윤지영,2004,https://www.riss.kr/link?id=A60239856
베스트셀러 그림책에 나타난 다문화교육내용 분석,"본 연구의 목적은 2008~2014년 사이 국내 베스트셀러 그림책 98권의 다문화교육내용을 분석하는 것이다. 문화, 다양성, 정체성, 평등, 반편견, 공동체적 협력 등 6가지 범주로 분석한 결과는 다음과 같다. 첫째, 그림책에 나타난 다문화교육내용은 협력, 정체성, 문화 및 다양성의 순이었으며 반편견과 평등 등은 비교적 적게 나타났다. 둘째, 국내작가 그림책보다 국외작가 그림책에서 다양성 내용이 많이 다루어졌다. 문화 관련 내용 중 유사점과 차이점 알기는 국외작가의 그림책에서 문화에 대한 존중심 갖기는 국내작가의 그림책에서 더 많이 발견되었다. 셋째, 환상동화와 생활동화가 6가지 범주의 다문화교육내용을 고르게 다루고 있는 것으로 나타났다. 본 연구는 그림책들이 편중된 다문화교육내용을 다루고, 비판적이며 현실적인 주제를 다루지 못하고, 주류의 관점을 반영하며, 모호한 메시지를 전달하고 환상적 요소를 통한 은유적인 다문화개념을 내포한다고 논의했다. 또한 본 연구는 베스트셀러 그림책을 교육적으로 활용할 수 있는 성인역할의 중요성을 시사한다.",김미애,2015,https://www.riss.kr/link?id=A104438679
예비부모교육 프로그램의 효과에 관한 메타분석,"본 연구는 메타분석을 통해 예비부모교육 프로그램의 효과에 관한 연구들을 종합하여 체계적인 결과를 도출하는데 목적이 있다. 이를 위해 PICOS 기준에 따라 1996년부터 2021년 6월까지 연구된 국내 석·박사학위 논문 및 학술지 23편을 연구대상으로 선정하였다. 연구의 결과는 다음과 같다. 첫째, 예비부모교육 프로그램의 전체 평균 효과 크기는 0.68로 중간 효과 크기를 나타냈다. 둘째, 운영특성에 따른 평균효과 크기를 살펴보면, 참여대상은 중·고등학생(0.87)이 가장 크고, 다음으로 대학생(0.68), 군인(0.28) 순으로 나타났다. 또한, 프로그램의 총 회기가 12회기 이상이며, 전체 기간이 13주 이상일 경우 평균효과 크기가 가장 컸다. 셋째, 예비부모교육 프로그램의 종속변인을 정보제공, 신념변화(자기 관련, 양육 관련), 기술습득으로 분류하여 분석한 결과, 정보제공(1.00)이 큰 효과 크기로 나타났으며, 기술습득(0.74), 양육(0.63) 및 자기와 관련된 신념변화(0.62)가 중간 효과 크기로 나타났으나, 각 종속변인별 평균효과 크기 차이가 유의미하지 않았다. 이러한 결과를 토대로 향후 연구 및 정책에 대한 제언을 논의하였다.",문소희 ( Moon¸ Sohee ),2021,https://www.riss.kr/link?id=A107873587
고등학생의 학업스트레스와 주관적 행복감의 관계에서 부모-자녀 의사소통과 정서지능의 매개효과,"본 연구는 고등학생이 지각한 학업스트레스와 주관적 행복감의 관계에서 부모-자녀 의사소통과 정서지능의 매개역할을 검증하였다. 이를 위해 고등학생 624명을 대상으로 자기보고식 설문조사를 실시하였다. 수집된 자료는 SPSS 25.0 프로그램과 SPSS Process Macro 프로그램을 사용하여 분석하였고, 부트스트래핑을 실시하여 매개효과의 유의성을 확인하였다. 연구의 결과를 요약하면 다음과 같다. 첫째, 연구 변인 간의 상관관계를 살펴본 결과, 학업스트레스는 주관적행복감, 부모-자녀 의사소통, 정서지능과 부적 상관이 나타났고, 주관적행복감, 부모-자녀 의사소통, 정서지능 간에는 정적 상관이 나타났다. 둘째, 고등학생의 학업스트레스와 주관적 행복감과의 관계에서 부모-자녀 의사소통과 정서지능의 매개효과가 확인되었다. 셋째, 학업스트레스와 주관적 행복감의 관계에서 부모-자녀 의사소통과 정서지능의 순차적으로 매개효과가 확인되었다. 이와 같은 결과는 고등학생들의 주관적 행복감 증진을 위해 학업스트레스 관리에 대한 실질적 지원의 필요성과 부모-자녀 의사소통과 정서지능의 수준을 향상시킬 수 있는 프로그램의 개발과 시행의 필요성을 시사한다.",김영화,2022,https://www.riss.kr/link?id=A108402040
장애아동 부모 대상 프로그램 메타분석 : 2000년 이후 연구를 대상으로,"이 연구의 목적은 메타분석 기법을 활용하여 국내 장애아동 부모대상 프로그램의 효과를 체계적이고 종합적으로 살펴보고자 함에 있다. 실험-통제집단 설계 연구 29편을 분석대상 논문으로 선정하였고 총 95개의 효과크기를 산출, CMA 3.0을 활용하여 메타분석을 실시하였다. 연구 결과, 전체 효과크기는 .831(p＜.05)로 나타났다. 독립변인별 분석 결과, 부모자녀병합지원(1.148)과 양육정보지원(.953)이 높은 효과크기를 가진 것으로 나타났고, 종속변인에서는 가족기능(1.650), 심리적 자원(.779) 변인에서 높은 수준의 효과크기를 보였다. 기타변인으로 자녀의 장애유형에서는 발달장애가 중간 이상의 효과크기, 자녀의 학교급에서는 유치원과 기타(학교급 무관)에서 높은 효과크기를 보였으며, 부모유형은 어머니가 다수를 차지하며 높은 수준의 효과크기를 보였다. 본 연구는 메타분석을 통해 장애아동의 부모 대상 프로그램의 효과에 영향을 미치는 여러 변인을 바탕으로 결과를 제시하였으므로 추후 장애아동 부모대상 프로그램에 필요한 기초자료를 제공할 수 있을 것이다.",이미지 ( Lee Miji ),2020,https://www.riss.kr/link?id=A107072334
우리나라 임신·출산 지원 제도 고찰,"임신과 출산을 지원하는 제도는 대체로 「모자보건법」을 법적 근거로 추진되는 한편 인구문제에 대응하는 인구정책의 맥락에서 「저출산·고령사회 기본법」을 근거로 범국가적 중장기 계획인 저출산·고령사회 기본계획의 세부 추진 과제로서 적극적으로 추진되고 있다. 본고에서는 제4차 저출산·고령사회 기본계획(2021~2025)의 세부 과제로 추진 중인 건강한 임신 지원 사업, 고위험 임산부 의료비 지원 사업, 생애 초기 건강관리 사업, 산모·신생아 건강관리 지원 사업, 여성 장애인 지원 사업, 청소년 산모 임신·출산 의료비 지원 사업, 난임 지원 사업, 분만취약지 지원 사업 등을 중심으로 임신·출산 지원 제도의 추진 배경과 세부 제도의 주요 내용을 살펴보고자 한다.",이소영,2023,https://www.riss.kr/link?id=A108599247
