
유아보육·교육기관의 교사 전문성 지원 환경이 유아교사의 인공지능 기술수용의도에 미치는 영향: 스마트·디지털 기기 활용 경험에 의해 조절된 과학교수태도의 매개효과를 중심으로,"Objective: This study aims to investigate whether science teaching attitude of early childhood teachers mediates the relationship between the professional learning environment of institutions and their intention to accept artificial intelligence (AI)
technology, and whether the experience of using smart and digital devices moderates the effect of science teaching attitude.
Methods: An online survey was conducted targeting 118 teachers with more than 1 year of experience in kindergarten and day care center settings. Descriptive statistical analysis, correlation analysis, and The Process macro model 4, 14 were performed
using SPSS 27.0 and The Process macro 3.5.
Results: First, the science teaching attitude of early childhood teachers served as a mediator between the professional learning environment of institutions and teachers' intention to accept AI technology. Second, the experience of using smart and digital devices was found to moderate the effect of teachers' science teaching attitude on their intention to accept AI technology.
Conclusion/Implications: This results showed that an institutional environment that supports teachers' professionalism development and provides rich experience is crucial for promoting teachers’ active acceptance of AI technology. The findings highlight the importance of creating a supportive institutional envionment for teacher’s professional growth, enhancing science teaching attitudes, and facilitating the use of various devices.",안혜령(Hye-Ryung An),2023,https://www.riss.kr/link?id=A108560285
양육행동 및 형제관계와 아동의 자존감과의 관계 연구,"The purpose of this study was to investigate how parental childrearing behavior and children`s sibling relationships are related to children`s self-esteem. 440 middle class families consisting of two children and their parents were the subjects of this study. The research instruments included a childrearing behavior questionnaire, the Sibling Relationships Questionnaire (Furman & Buhrmester, 1985), and the Self-Perception Profile for Children (Harter, 1985). Analyses of the data included correlation analysis, canonical correlation, regression, stepwise multiple regression, and MANOVA with stepwise discriminant analysis as the follow-up test. The most powerful predictors of children`s self-esteem were the Warmth-Acceptance of childrearing behavior and the Warmth-Closeness of sibling relationships. The self-esteem dimension was best predicted by parental childrearing behavior and by children`s sibling relationships was Global Self-Worth. Behavioral Conduct was best predicted by the Rejection-Restriction factor of childrearing, and by Conflict (for boys) and Rivalry (for girls) factors of sibling relationships. Children`s self-esteem was related more strongly to the Warmth-Acceptance and the Rejection-Restriction of opposite-sex parents. The effects of PermissivenessNonintervention were stronger in same-sex parent-child dyads. Parental childrearing behaviors accounted for boy`s self-esteem better than girl`s with the exception of Behavioral Conduct. Sibling relationships accounted for girl`s self-esteem better than boy`s. The 2×2 MANOVA revealed interaction effects of parental childrearing behaviors and sibling relationships on children`s self-esteem. Two factors of Rivalry and Conflict in sibling relationships and all three factors of childrearing behaviors showed significant interaction effects, The childrearing factor of Permissiveness-Nonintervention and the sibling factor of Rivalry, which were relatively weak predictors of self-esteem when acting alone, gained power in explaining children`s self-esteem within the interactional context.",박영애(Young Yae Park),1996,https://www.riss.kr/link?id=A102953558
교사에 대한 학부모 기대와 인식에 대한 고찰: 선행연구를 중심으로,"This study noted that the conflict between parents and teachers is caused by distrust of each other, which it may arise from due to differences between expectations and perceptions of each other. This study analyzed what parents' expectations and perceptions of school teachers were, focusing on previous studies. The results of the study were as follows. First, teachers expected by parents include ‘teachers who understand the characteristics of students well and satisfy individual needs’, ‘teachers with professional knowledge and skills’, and ‘teachers who communicate with parents in equal and partnership’. Second, teachers perceived by parents include ‘teachers who do not know students well’, ‘teachers who do not help students’, and ‘teachers who want parents' help but dislike to interfere.’ The results indicated that there is a significant gap between parents' expectations and perceptions of teachers. Based on the results, discussion for parent-teacher cooperation and suggestions for future research were presented.",황성희,2022,https://www.riss.kr/link?id=A108208000
유아교육 및 보육 정책 환경과 효과 분석,"The purpose of this study is to examine the policy environments of early childhood education and child care in Finland, the United Kingdom and Japan and to compare and analyze policy effects using the policy web. For this purpose, policy input and output factors were selected and analyzed. The results are summarized as follows: First, in Finland and the UK, the investment ratio of public funds in the infant and childhood period exceeded the OECD average compared with GDP. Second, policies related to companies such as parenting leave system are active in each country. Especially the UK, which has a relatively high expenditure on family welfare, has a higher fertility rate and mother employment rate than the OECD average. Third among the three countries, Finland especially strengthened the family support system which in result affected on the women’s employment and fertility rate exceeding the OECD average. Finally, the UK and Japan have relatively high qualifications standards for teachers compared to other OECD countries and attributed to the higher rate of enrollment of 3 to 5 year old children in kindergarten. Based on these findings, policy implications such as the establishment of stable financial resources to support the Nuri curriculum, arrangement of an effective policy related to companies to promote housework and work compatibility for married couples and its confirmation plan have been suggested for early childhood education and child care in Korea.",장민영,2017,https://www.riss.kr/link?id=A104383725
부부갈등과 아동의 행동문제,"This study examined the salutary effects of marital conflict resolution on children`s behavior problems. The subjects were 487 4th and 6th grade students and their parents. Data were analyzed by multiple regression analyses of the SAS program. Children`s problem behaviors were positively correlated with their perception of marital conflict. After intervention, children`s perception of the resolution of marital conflict moderated their aggressive or immature behavior. Sex and age differences showed salutary effects of marital conflict resolution on boys` but not girls` behavior problems and on 6th grade students but not 4th grade students.",권영옥(Young Ock Kwon),1999,https://www.riss.kr/link?id=A102953819
어머니와 아버지의 온정적 · 통제적 양육행동이 아동의 사회성 및 학업능력에 미치는 종단적 경로: 아동의 집행기능 곤란의 매개 역할,"Objectives: This study examined longitudinal pathways from mothers’ and fathers’ warmth and control to children’s prosocial and externalizing problem behaviors as well as academic outcome. The study also explored whether children’s executive functioning difficulty plays the mediating role in the links between mothers’ and fathers’ parenting behaviors and children’s social and academic outcomes.
Methods: Participants were 1,671 children and their parents which were retrieved from the Panel Study on Korean Children. Direct relations between parenting variables and children’s social and academic outcomes were examined. Indirect effects of children’s executive functioning difficulty were also investigated in these associations. Structural equation modeling was used to analyze the longitudinal relations among maternal and paternal parenting behaviors, children’s executive functioning difficulty, and their social and academic outcomes. The bootstrapping method was also used to examine the indirect effects of children’s executive functioning difficulty in the links between parenting variables and children’s social and academic outcomes.
Results: Mothers' and fathers' warm parenting was negatively related to children’s executive functioning difficulty, which in turn predicted their subsequent prosocial and externalizing problem behaviors, as well as academic outcome. Moreover, indirect relations between parenting variables and children’s social and academic outcomes via children’s executive functioning difficulty were found.
Conclusion: The result of this study suggests the importance of parental warmth in children's social and academic outcomes. The present results also emphasize the role of children’s executive functioning difficulty as the pivotal mechanism that explains how mothers’ and fathers’ warm parenting predicts subsequent children’s outcomes in social and academic domains.",한영숙,2022,https://www.riss.kr/link?id=A108244618
영아 자녀를 둔 어머니의 양육스트레스 변화가 온정적 양육행동 및 유아의 사회정서발달에 미치는 영향,"Objective: This study aimed to investigate the trajectory of maternal parenting stress during infancy according to the employment status of mothers when each year`s depression was controlled and examine the longitudinal effects of parenting stress on affective parenting and socioemotional developmental outcomes for preschoolers. Methods: Using latent growth modeling, the first 4 waves of panel data collected from 2,078 mothers and their babies were analyzed. This nationwide data was provided from the 2008 Panel Study on Korean Children, conducted by the Korea Institute of Child Care and Education. Results: First, maternal parenting stress showed a linear increasing pattern, and there were individual differences in intercept and slope. Second, when each year`s maternal depression was controlled, the intercept of parenting stress was lower, but the rate of increase was higher. In multiple group analyses, this increasing pattern of parenting stress was significant only in unemployed mothers. Lastly, the increase of unemployed mothers` parenting stress had direct effects on child emotionality and peer interaction and had an indirect effect on child peer interaction (mediated by affective parenting). Conclusion: The current study verified that the longitudinal effects of increasing parenting stress of unemployed mothers on affective parenting and child socioemotional development when maternal depression level was controlled. These results imply that we need to pay more attention to emotional health and resources of unemployed mothers and provide them with social support as well as employed mothers.",박새롬(Saerom Park),2016,https://www.riss.kr/link?id=A102954833
유아의 공격성에 대한 개인적 요인과 환경적 요인간의 구조적 관계,"Objective: The purpose of this study was to explore the structural relationships of child negative emotionality, mother rejective parenting, teacher-child conflict, and child emotion regulation on child aggression. Methods: The participants in this study were 3- to 5-year-old kindergarten children, their mothers, and their teachers (all of whom lived in Busan). The data were analyzed using PASW Statistics 18.0 and AMOS 21.0. For data analysis, frequency, Cronbach’s alphas, Pearson’s correlation coefficients, SEM were used. Results: First, mother rejective parenting had an indirect effect on child aggression through child emotion regulation. Second, teacher-child conflict had a direct effect on child aggression and had an indirect effect on child aggression through child emotion regulation. Third, child negative emotionality had an indirect effect on child aggression through mother rejective parenting and teacher-child conflict and child emotion regulation. Conclusion: These finding suggest the importance of mediating effect of mother rejective parenting, teacher-child conflict and child emotion regulation between child negative emotionality and aggression.",이혜진(Hea Jin Lee),2016,https://www.riss.kr/link?id=A102954825
2019 개정 누리과정 놀이실행자료에 기초한 유아교사용 놀이지원 척도 개발,"Objective: The goal of this study is to develop an instrument for measuring the quality of teacher support for children's play (age 3-5) based on the Play Practice Resources for Teachers presented in the 2019 revised Nuri Curriculum.
Methods: The subjects of this study were 333 early childhood educators. Exploratory and confirmatory factor analysis, as well as correlation analysis were all performed to confirm construct validity and concurrent validity. The reliability of each factor was verified using Cronbach’s alpha.
Results: The Preschool Teacher Play Support Scale (PTPSS) was finalized with 25 items, which included the following four sub-factors: interaction, play materials, play space, and play safety. The concurrent validity was also confirmed through significant correlations between the existing measures such as the Teacher Self-Efficacy Scale, the Teaching Efficacy Scale for Play, and the Teacher-Toddler Interaction Scale. The reliability of each factor was also desirable.
Conclusion/Implications: The PTPSS was verified as a sound measure quantifying the play support behavior of teachers who respect the autonomy and initiative of young children which is being pursued by the 2019 revised Nuri Curriculum.",성안나,2022,https://www.riss.kr/link?id=A108108740
"어머니의 양육 스트레스 , 사회적 지원과 부모효능감이 양육행동에 미치는 영향","The purpose of this study was to investigate causal relationships among parenting stress, social support, parenting efficacy, and mothers` parenting behaviors as a function of child`s sex. The subjects were 419 boys and 414 girls in the 3rd grade of elementary schools in Inchon city, and their mothers. Conflict Tactics Scales (Straus, 1979), Parenting Stress Index (Abidin, 1990), and Parenting Sense of Competence (Gibaud-Wallston & Wandersman, 1978) were revised for use in this research. A modified version of the Social Support Scale (Pak, 1985) and Teamwork of Parenting Alliance Inventory (Abidin, 1988) were used. The data were analyzed with one way ANOVAS, Pearson`s correlations, and covariance structural analysis by the LISREL 8.03 program. The results of this study were: (1) The more mothers felt parenting stress and the less they perceived social support and parenting efficacy. (2) The process leading to mothers` coercive parenting behaviors differed as a function of child`s sex. For mothers of boys, parenting stress and social support had an indirect effect on coercive parenting behaviors through the mediation of parenting efficacy. For mothers of girls, however, parenting stress had a direct effect on coercive parenting behaviors.",신숙재(Suk Jea Shin),1998,https://www.riss.kr/link?id=A102953530
부모공동양육과 유아의 정서 조절이 유아의 외현화 문제행동에 미치는 영향,"Objectives: The main purpose of this study was to examine the direct and indirect effects of co-parenting, infants’ emotional self-control, and infants’ externalized problem behaviors.
Methods: A total of 281 mothers of infants aged 3-5 years responded to questionnaires on three research variables. The scale used in this study was first measured using a co-parenting questionnaire, the emotional regulation checklist (ECR), and the child behavior checklist (CBCL). Data were analyzed with structural equation modeling using SPSS 21.0 and AMOS 20.0.
Results: The correlations between co-parenting, infants’ emotional self-control, and externalized problem behaviors were all statistically significant. With regard to the direct impact of co-parenting on infant problem behavior, co-parenting had a significant impact on infant externalized problem behavior. Co-parenting also indirectly influenced the externalized problem behaviors in infants through the infants’ emotional self-control.
Conclusion: This study demonstrated the importance of co-parenting and infant’s emotional self-control. The results suggest the need for a parent education program to improve infants’ emotional self-control and could be used as basic data for counseling and parent education sites to develop parenting programs to prevent infant problem behavior and ultimately create an enviroment that positively affects infant development.",유다정(Dajoung Yoo),2022,https://www.riss.kr/link?id=A108151560
유아기 모-자녀 상호작용이 아동의 친사회적 행동과 행동문제에 미치는 종단적 영향에서 아동의 자아존중감의 매개효과,"Objectives: This study aims to examine the longitudinal effects of mother-preschooler interaction on a child’s prosocial behavior and behavior problem. Furthermore, it examines the mediating role of child’s self-esteem between mother-preschooler interaction and child’s prosocial behavior and behavior problem.
Methods: The participants were 882 children(452 boys and 430 girls) and their mothers from the 7th(T1) to 9th(T3) wave(2014~2016) of the Panel Study on Korean Children. Data were analyzed with a Structural Equation Model and a bootstrapping method was used to test the statistical significance of the mediation.
Results: First, the mother-preschooler interaction did not have a direct longitudinal effect on a child’s prosocial behavior, but had an indirect effect through self-esteem after controlling gender. The bootstrapping result suggested that the indirect effect is statistically significant. Second, motherpreschooler interaction did not have longitudinal effects on behavior problem, both directly and indirectly, through child’s self-esteem. Consequently, the more the interaction between mothers and preschoolers, the higher the child’s self-esteem, which led to a higher prosocial behavior.
Conclusion: The results of this study show the mediating effect of self-esteem on the relationship between mother-preschooler interaction and child’s prosocial behavior. These findings suggest that parents should provide children with experiences in various interactions. They also imply the importance of experience in interactions in meaningful social relations for positive behavior of children. These experiences could play a role improving confidence in one’s worth and, eventually, allow children to have positive behaviors in social relations. The limitations and other implications of this study are also discussed.",최혜선,2022,https://www.riss.kr/link?id=A108244616
아동기 자녀의 미디어기기 중독과 관련 변인 간의 구조분석:다변량 잠재성장모형을 활용한 종단매개효과 검증,"The purpose of this study was to analyze the longitudinal mediation effects of mothers' depression and controlled parenting on the relationship between early childhood mothers' negative life events and childhood media device addiction. To analyze the relationship between early childhood mothers’ negative life events and childhood media device addiction, multivariate latent growth curve modeling was used. This study used data from the fourth, fifth, sixth, and tenth waves of the Panel Study on Korean Children.
The results of multivariate latent growth curve modeling revealed that the initial value and the rate of change in mothers' depression and controlled parenting had a significant longitudinal mediating effect on the relationship between early childhood mothers' negative life events and childhood media device addiction. The results of this study suggest the necessity of a family support program and related research to reduce childrens' media device addiction by examining the negative effects of mothers' negative life events experience on children.",성정혜,2020,https://www.riss.kr/link?id=A106911199
어린이집 유아반의 안전사고 발생과 사후조치의 현황 및 정책적 시사점,"The study involved an online survey of 265 teachers in childcare centers and examined the frequency and characteristics of preschoolers’ safety accidents and teachers’ response practices. Descriptive statistics examined the occurrence of safety accidents, characteristics of safety accidents, and response practices. To examine the differences between groups based on the overall background in the number of safety accidents, T-test and ANOVA analyses were used. The findings indicated that approximately three-quarters of the safety accidents occurred in the classroom over the two-week study period. Major accidents included falls and bumps; which occurred during free play time inside the classroom and could be attributed to the child's negligence and personality traits. Furthermore, 50.2% of the safety accidents involved two or more types of injuries. About 60.6% of the safety accidents were attended by childcare personnel and only 13.7% sought compensation from the Childcare Center Safety & Insurance Association (CSIA), indicating that most of the accidents were relatively minor. The results offer suggestions for policies to distinguish between preventable incidents and unforeseen accidents and to consider children’s characteristics, which are the main causes of safety accidents.",신나리,2022,https://www.riss.kr/link?id=A108280494
"3 , 4 , 5세 아동의 구성놀이 발달에 관한 연구","The purpose of this study was to analyze the quality of the constructive play of 3, 4 and 5 year-old children. The researchers used unit blocks as the instrument because they are the most representative examples of constructive play materials. The subjects were 73 children enrolled in a half-day early childhood education program. The children`s block play was videotaped 8 times, for a total of 330 minutes. The videotapes were transcribed and assessments were made on the children`s 233 constructions in terms of the developmental stage of block play, the variety of materials used, play duration, and play intensity. The data were analyzed through two-way ANOVA to check age and sex differences. The results showed that children`s developmental stages of block play were low on the average and that girls did not show an active interest in block play. The results also implied that block play developed by play experience rather than by age. Therefore, this study was interpreted to highlight the importance of teachers` understanding, planning, and mediation of block play in order to induce high-quality constructive play.",구현아(Hyun Ah Koo),1998,https://www.riss.kr/link?id=A102953538
"어린이집 조직혁신성, 영유아교사의 디지털 리터러시, 테크노스트레스와 교사효능감 간의 구조적 관계 분석","Objective: The purpose of this study was to examine the structural relationship among child care center innovativeness, the early childhood(EC) teacher’s digital literacy(DL), technostress and teacher efficacy. Methods: The participants were 454 EC teachers and were selected only if they had worked for more than one year. The innovativeness of childcare centers, the teacher’s DL, technostress, and teacher efficacy were assessed through online self-report questionaries. Data were analyzed through ANOVA, t-test, and SEM. Results: First, DL and technostress of EC teachers differed in some ways depending on the teacher's demographic background, the characteristics of their working institution, and their educational level of digital skills. Second, the childcare center innovativeness directly had a significant positive effect on DL, technostress, and efficacy of the teachers. In addition, the effect of the innovativeness on teacher efficacy was mediated by DL and technostress of the teachers. Conclusion/Implications: The more efforts made of childcare centers for recognizing the rapid development of DL and trying to change, the better the teacher's scores of DL and the appropriate technostress were, which increases teacher efficacy. So, continuous training and education for teachers with consideration of age and teaching experience, as well as public aid to improve teachers’ DL skills are required.",김윤지(Yoon Ji Kim),2023,https://www.riss.kr/link?id=A108489099
