
젠더리스 패션 표현특성에 따른 색채 분석,"This study was aimed at analyzing the factors of genderless fashion design and objectifying various categories of neutral images that are colorful and the boundaries of which are vaguely used. The method of this study involved literature research and color image analysis. First, we formulated a theoretical basis for empirical research to derive genderless colors by typifying genderless expression characteristics through prior work. Second, the color image analysis methodology was implemented through an analysis of the color analysis program. From the 2011 S/S collection to the 2020 F/W collection, 20 seasons were analyzed, and there were 120 collections of 20 seasons. On the basis of that, 480 colors of genderless expression characteristics were derived using the Korea Standard Color Analysis Program, and categories and areas of genderless color were analyzed. The results of this study are as follows. The color analysis by genderless expression characteristics showed that genderless’s compromise was dark blue (PB), with low-light and grayish-toned purple blue (PB), and with the highest frequency of colorless (N) and gender. In the obfuscated series, beige and brown’s calm color images were shown, and in the same color, purple blue (PB), purple (P), and blue (B), were analyzed as benign with masculinity. Enjoyment was shown to have a high sense of color rhythm, with low-light dark tones and high-light strong tones. The colors shown in sensuality were mainly achromatic (N) and warm-tone, indicating that the frequency of clothes using skin-exposed materials was high. The colors shown in genderless s exaggeration were analyzed to be used as a means of maximizing and exaggerating the appearance of costumes using medium- and medium-high-light red (R), purple blue (PB), and red purple (RP) with low-light base colors. Historicity is a strong-toned gold color that represents an antique and heavy image, while other obtuse colors represent a past-oriented, calm, and formal image.",최지은(Ji-Eun Choi),2021,https://www.riss.kr/link?id=A107839996
결혼이주여성의 사회적 관계 향상을 위한 정책 개선 방향,"This study analyzed and proposed new policy directions to improve the social relationships of married migrant women so that the women can enjoy healthy relationships and Korea can become a better integrated multi-cultural society. For this purpose, the research firstly examined current situations and theoretical backgrounds of women's social relationships. Secondly, the current policies, based on the 3rd Basic Plan for Multi-cultural Family, were analyzed. Thirdly, new directions to improve the current policies were explored. The new policy directions were based on the following four points. First is the need to support migrant women to have equal relationships with Koreans. Second, the policies should create an environment in which women can form relationships with migrant women and the Koreans. Third, the policies should encourage general citizens to support women. Fourth, the Korean government should establish policies centered on women.",최현우,2022,https://www.riss.kr/link?id=A108173881
어머니의 자아분화가 불안과 자녀와의 관계 및 유아의 적응행동에 미치는 영향,"The purpose of this study was to investigate the mediating effects of mothers’ anxiety and their relationships with their children by associating the mothers’ self-differentiation with their children’s adaptive behaviors. The data was gathered from 389 mothers with 3-5-year-old children from eight different childcare centers and kindergartens. Models were analyzed by an analysis of correlation matrix in the AMOS 18.0 software package. The results of this study were as follows; first, mothers self-differentiation including emotional fusion, emotional reaction, emotional hypersensitivity, and emotional cutoff had direct effects on their anxiety, i.e., the higher the levels of emotional fusion, emotional reaction, emotional hypersensitivity, and emotional cutoff in mothers, the more anxious they were. Second, mothers self-differentiation had a direct impact on their positive relationships with their children, i.e., higher the levels of emotional fusion, emotional reaction, emotional hypersensitivity, and emotional cutoff in mothers, the less likely they were to have positive relationships with their children. Third, mothers anxiety had direct effects on positive relationships with their children, i.e., mothers with higher levels of anxiety were less likely to have positive relationships with their children. Fourth, mothers positive relationships with their children had a direct influence on their children s adaptive behavior. Finally, the findings of this research support that the mediating effects on mothers’ anxiety and their relationships with their children due to mothers self-differentiation are associated with their children s adaptive behavior.","김선희(Kim, Sun-hee)",2021,https://www.riss.kr/link?id=A107839865
외국인 환자의 한국 병원 의료서비스 만족도 및 재이용의사 영향요인 분석 : 러시아권 환자를 대상으로,"The purpose of this study was to verify that the three types of medical service satisfaction, patient-oriented satisfaction, and the willingness to reuse Korean hospitals differ depending on the characteristics of foreign patients. Second, we investigate the factors affecting these four variables. The main analysis results shown in this study are as follows. First, most foreign patients were found to be highly satisfied with Korean hospital doctors and patient-oriented hospitals. In addition, more than 75 percent of foreign patients were willing to reuse Korean hospitals in the future. Second, a regression analysis of variables that affect satisfaction with Korean hospital doctors showed that the presence of long-term diseases affected. Specifically, if there is a disease in the long term, the satisfaction level of Korean hospital doctors is high. The factors that affect foreign patients satisfaction with the Korean hospital system were income and health conditions. The lower the income of foreign patients, the higher the satisfaction with the Korean hospital system in the case of positive perception of their health conditions. Meanwhile, the impact on the satisfaction of foreign patients with patient orientation in Korean hospitals was on whether they lived in Korea and recognized their health conditions. Foreign patients living abroad, not domestic residents, and foreign patients with positive perceptions of their health conditions showed high satisfaction with the patient-orientedness of Korean hospitals. Third, the regression analysis was conducted to identify the factors affecting the willingness of foreign patients to reuse Korean hospitals, and found that the medical expenses were borne by themselves, doctor satisfaction, and hospital system satisfaction. Foreign patients who do not pay for medical expenses showed high willingness to reuse Korean hospitals, while foreign patients with high satisfaction with Korean hospital doctors showed high willingness to reuse Korean hospitals.","손진석(Son, Jinsuk)",2021,https://www.riss.kr/link?id=A107973106
가정 및 학교의 자율성 지지 맥락과 아동의 집행기능곤란 및 학업수행능력 간의 구조적 관계,"This study examined the parenting behavior characteristics of mothers and fathers as important social context characteristics for children. Furthermore, the study examined whether the relationship between teachers and peers in school could satisfy autonomy. These factors were necessary to verify how parenting behavior characteristics and school social environment affect children’s executive skills. A total of 544 10-year-old children and their parents and homeroom teachers were included in the study. The route model was analyzed for suitability between the mother and father’s autonomy support parenting behavior and the child’s executive function difficulties. After the structural equation model was verified, the mother’s autonomy support parenting behavior was found to negatively affect the child’s difficulty with executive function. Conversely, the father’s autonomy support parenting behavior did not significantly affect the child’s difficulty with executive function. Second, this study found that the characteristics, supported by school autonomy, negatively affected children’s difficulty with executive function. Finally, this study found that difficulties in children’s executive function negatively affected their academic performance. This study is notable in that it provides basic data on improving children’s academic performance by incorporating children’s autonomy support at home and school when assessing their execution functional difficulties and academic performance.",안효진,2022,https://www.riss.kr/link?id=A108324565
"예비영유아교사의 인공지능활용 인식, 과학교수태도가 인공지능활용 교육 수용의도에 미치는 영향","The purpose of this study was to determine whether pre-early childhood teachers' science teaching attitude mediated the relationship in which their artificial intelligence utilization awareness affected the acceptance intention of artificial intelligence utilization education. An online survey targeting 134 pre-early childhood teachers was conducted. SPSS 27.0 and Process Macro 3.5 were used to conduct descriptive statistical analysis, correlation, and Process Macro model 4. The results of the study showed that the science teaching attitude of pre-early childhood teachers mediated the relationship between their artificial intelligence utilization awareness and the acceptance intention of artificial intelligence utilization education. Positive perception of AI utilization in early childhood education and science teaching attitude were important for pre-early childhood teachers' active education acceptance of AI utilization. The study results suggest that providing an opportunity to use AI in the curriculum of pre-early childhood teachers' science education is necessary to improve the awareness of AI utilization and attitudes toward science teaching.",조우미,2023,https://www.riss.kr/link?id=A108633784
"아동의 성별에 따른 인정욕구, 불안 및 분노억제와 관계적 공격성 간의 관련성","The major purpose of this study was to explore the relation of a child`s need for approval, anxiety and anger-in on a child`s relational aggression according to gender. The study`s participants included 464 boys and girls selected from fifth-and sixth-graders at an elementary school in Busan. A child`s need for approval, anxiety, anger-in and relational aggression were assessed with their own self-reports. For data analysis, Cronbach α, T-test, Pearson correlation coefficients, and Multiple Regression were used. The collected data was analyzed by the SPSSWIN 18.0 program. The major findings were as follows: First, child`s anger-in demonstrated a significant difference among sexes. Girls indicated higher points than boys. Second, Boys` need for approval indirectly affected child`s relational aggression through anger-in. Boys` anger-in was directly affected by relational aggression. Boys` anxiety was directly affected by anger-in. And boys` anxiety indirectly affected child`s relational aggression through anger-in. Third, Girls` anxiety was directly affected by relational aggression. Need for approval and anxiety were directly affected by anger-in. The findings from this study indicates that child`s need for approval, anxiety and anger-in are important elements in relational aggression are affected differently depending on the child`s gender. Also, this study has meaning in that it can be used as fundamental data to develop a teaching plan and counseling program for children that can decrease relational aggression.",이영화 ( Young Hwa Lee ),2013,https://www.riss.kr/link?id=A99615945
아버지와 어머니의 헬리콥터 부모역할이 고등학생의 진로준비 행동에 미치는 영향: 학업성패귀인과 진로결정자기효능감의 순차적 매개효과,"This study examined the sequential mediation effects of academic achievement attribution and career decision-making self-efficacy on the effect of paternal and maternal helicopter parenting on high-school students' career preparation behavior. A total of 285 (119 male and 166 female) Korean high-school students in the second grade participated in the study. Research variables were measured using the Career Preparation Behavior Scale (Kim, 1997), Helicopter Parenting Scale (LeMoyne & Buchanan, 2011), Attribution Questionnaire (Weiner, 1979), and Career Decision-Making Self-Efficacy Scale-Short Form (Betz et al., 1996). To examine the sequential mediating effect, data analysis was performed using SPSS 29.0 and PROCESS MACRO (v4.2) Model 6. The results revealed no correlations between helicopter parenting and academic failure attribution. However, higher paternal and maternal helicopter parenting were found to indirectly reduce high-school students' career preparation behavior through lower internal academic success attribution (effort and ability) and higher external academic success attribution (task difficulty and luck), which reduced career decision-making self-efficacy. These findings can be employed to develop more effective intervention programs comprising career guidance for adolescents, which emphasizes the negative effect of helicopter parenting. This study expands the research field, as previous findings on helicopter parenting mostly focus on college students.",김윤서,2023,https://www.riss.kr/link?id=A108727274
기관 내외 교육과 어머니의 영어교육 신념이 유아의 영어 흥미에 미치는 영향: 일반유치원과 영어학원 유치부의 비교,"This study investigated children’s interests in learning English, affected by educational activities in and out of institutes, and mothers’ perceptions regarding early childhood English education. We recruited, 253 mothers of 3- to 5-year-old children in either general kindergartens or English immersion institutes. They answered questions on socioeconomic status, perceived interest in English by their children, their perceptions regarding early childhood English education, and English education outside institutes. In addition, 42 English teachers provided information within institutes such as class time per week, teacher-pupil rate, and language use policy during class. The collected data were analyzed through SPSS 22 for frequency analysis, descriptive statistics, independent t-test, and hierarchical multiple regression analysis. The major findings are as follows. First, the two groups were in distinct learning environment. Second, mothers’ perceptions and outside-institute activities were significantly different between the two groups. Third, the English interests of children at both institutes were influenced by mothers’ worries and at-home English interactions. Fourth, education within institutes did not affect both group’s English interests. Fifth, private education and socioeconomic status did not affect both group’s English interests. Lastly, only the children’s interests in English immersion institutes were affected by gender and mother’s perceived necessities. Focusing children’s interests, this study helps in understanding young children’s affective aspects regarding learning English. The findings are expected to be a guideline for each home and institute to increase children’s interest in learning English.",최나야 ( Naya Choi ),2020,https://www.riss.kr/link?id=A107149554
암환자가 지각하는 가족지지가 삶의 의미에 미치는 영향,"Even with advances in medical science, cancer is still a disease that is so terrifying that one thinks of death. Cancer patients hope to find meaning in their lives after cancer diagnosis, and finding the meaning of life helps them overcome their disease. In particular, the importance of emotional support provided by family members is increasing, and in order to confirm this, correlation coefficient analysis, multiple regression analysis and hierarchical regression analysis were performed to confirm the effect of the family support on the meaning of life in 195 cancer patients at P University Hospital in Busan. Marital status, financial support, and number of visits by primary caregivers showed significant correlations with family support, education level, number of visits by primary caregivers, activity level, and current status showed significant correlations with meaning of life either. Higher family support was found to have a positive effect on the meaning of life, and it had positive effects activity level, perceived family support, current status, and education level. these results are expected to be of practical help as basic data for establishing effective counseling strategies for individual and family counseling for cancer patients and primary caregivers.",김민정,2023,https://www.riss.kr/link?id=A108661479
보육교사의 사회적 지지와 회복탄력성이 행복감에 미치는 영향,"This study attempted to examine how the general background, social support, and resilience of childcare teachers affect happiness.
To this end, 300 childcare teachers working at national, public, workplace, private, home, and corporate daycare centers in Seoul and Gyeonggi-do were surveyed and analyzed using SPSS 21.0 statistics. The analysis results are as follows.
First, as a result of analyzing social support, resilience, and happiness according to the general background of teachers, low-care teachers of less than 1 year and middle-care teachers of more than 5 to 7 years had high interpersonal skills, while high-care teachers of more than 7 to 10 years had low interpersonal skills. In terms of differences according to the educational background of childcare teachers, graduate school and older were higher in happiness, resilience overall, and positivity, while those in their 40s and 50s were higher than those in their 20s in terms of happiness, resilience, self-regulation, and positivity. According to the number of children of childcare teachers, childcare teachers with three or more children had the highest overall social support and overall happiness information and emotional support, material support, evaluation support, and resilience sub-factors. In the difference according to the marital status of teachers, information support, a sub-factor of social support, was high in unmarried teachers, and self-regulation ability and positivity were high in married teachers. The overall resilience, sub-factors, and happiness of childcare teachers preparing to change jobs were higher than those who were not preparing to change jobs.
Second, as a result of analyzing the correlation between social support (people in the workplace, people outside the workplace), resilience, and happiness of childcare teachers, there was a static correlation between all two variables. In the results of the correlation analysis by sub-factor, there was no significant correlation between the two variables in the relationship between self-regulation, a sub-factor of resilience, and information support in the workplace, a sub-factor of social support. Third, as a result of examining the general background of childcare teachers (education, age, number of children, preparation for change), social support (people in the workplace, non-workplace), and resilience, the relative explanatory power of childcare teachers was statistically significant.
In other words, it can be seen that the educational background of childcare teachers, the number of children, social support and resilience of people in the workplace are important in terms of the happiness of childcare teachers. These results suggest that in order to promote teachers’ happiness, various institutional and policy support is needed to provide social support through various networks, and the creation of an organizational culture that harmonizes and communicates with each other is required. It was also confirmed that the provision of education or programs to foster resilience can positively contribute to the psychological well-being of childcare teachers.",김혜선,2023,https://www.riss.kr/link?id=A108661480
사회적 지지가 중년 여성의 생활 스트레스에 미치는 영향: 자아존중감의 매개효과를 중심으로,"The purpose of this study is to examine the relationship between social support, self-esteem, and life stress in middle-aged women, and to investigate the mediating effect of self-esteem in the relationship between social support and life stress in middle-aged women.
For this purpose of the study, an analysis was conducted using SPSS 23.0 after conducting a survey of 356 middle-aged women aged 40 to 64 living in Seoul and the metropolitan area of Gyeonggi-do. In this study, the average difference test was conducted to examine the differences in major variables according to demographic characteristics, the correlation analysis between social support, self-esteem, and life stress variables of middle-aged women, and the mediation analysis was conducted using Process macro program, and the significance of mediation was verified by the bootstrapping method. The results of the study are as follows. First, as a result of the correlation analysis between social support, self-esteem, and life stress of middle-aged women, there was a significant correlation between all three variables. Second, the mediating role of self-esteem in the relationship between social support and life stress of middle-aged women was examined. Social support was divided into sub-factors, family support and other support, and life stress was also divided into relationship areas and task areas to analyze a total of four models. As a result, it was found that self-esteem partially mediated in the relationship between social support and life stress problems. Through these results, the direct effect of social support on life stress and indirect effect through self-esteem were revealed, and it was confirmed that self-esteem was a useful internal resource for reducing the life stress of middle-aged women.",윤혜경,2023,https://www.riss.kr/link?id=A108661482
한·중 유통기업의 ESG 경영에 대한 2030 소비자 인식 연구 : 쿠팡과 타오바오에 대한 IPA를 중심으로,"This study explores consumer perceptions of ESG management by distribution companies in Korea and China. A total of 2030 consumers completed an online survey about either Coupang in Korea or Taobao in China. The results confirmed the level of satisfaction-importance that consumers felt concerning ESG management. The survey consisted of 196 items, and the analysis was conducted using SPSS 26.0. The findings showed that both Korean and Chinese consumers were aware of the importance of ESG. For Korean consumers, the order of importance was E>S>G. For Chinese consumers, it was S>E>G, and the area that showed the biggest difference among the ESG indicators was G, which is believed to reflect the influence of China’s political system. According to the satisfaction-importance analysis, consumers in both countries showed low satisfaction with the distribution companies’ environmental management but high satisfaction with the ethical management corresponding to corporate soundness, transparency, and interest in communities, including rural communities. There was a great difference between the two companies in terms of consumer satisfaction, possibly due to the controversy over Coupang’s avoidance of responsibility related to consumer protection. This study is significant in that it explores ESG management from the consumer’s point of view. It shows that specific efforts and transparency are needed because consumers are aware of ESG management and evaluate its quality by distribution companies.","김수연(Kim, Su-yeon)",2021,https://www.riss.kr/link?id=A107839799
대학생의 전공만족도와 대인관계가 대학생활적응에 미치는 영향,"This study was investigated a causal model concerning the direct and the indirect effect of major satisfaction on college life adjustment through interpersonal relationships. The data were collected through 299 students by using the self-administered questionnaire method. The causal model was tested through the structural equation model by using AMOS 23.0 program. The result of this study was summarized as follows: First, All variables showed high correlation, but there was no correlation between autonomy of major choice and interpersonal relationship. Second, it was found that major satisfaction had an indirect effect through interpersonal relationships rather than directly affecting college life adjustment. Finally, the results of this study have great implications in the era of COVID-19. We hope that future longitudinal studies will be conducted to prepare for problems caused by the absence of human relationships in universities.","박정아(Park, Jung-a)",2021,https://www.riss.kr/link?id=A107973582
