
아동의 스마트폰 사용에 대한 어머니의 중재가 아동의 스마트폰 과의존에 미치는 영향: 어머니-아동 간 의사소통과 아동의 성별의 조절된 조절효과,"Objectives: This study examined the effects of maternal mediation and mother-child communication on children’s smartphone overdependence. It also explored the moderated moderation effect of motherchild communication and children’s gender on the relationship between maternal mediation and children’s smartphone overdependence.
Methods: A total of 411 first to third grade elementary school students and their mothers participated in this study. Mothers responded to questionnaires. Data were analyzed using multiple regression analysis with SPSS 21.0 and using model 3 in PROCESS macro version 3.4.
Results: First, maternal active mediation only affected girls’ smartphone overdependence, while maternal restrictive mediation affected both boys’ and girls’ smartphone overdependence. That is, the more active mediation mothers showed, the less dependent girls were on smartphones. Moreover, the more restrictive mediation mothers showed, the less dependent both boys and girls were on smartphones. Second, problematic communication influenced both boys’ and girls’ smartphone overdependence; that is, the more problematic communication they had with their mothers, the more they depended on smartphones. Lastly, the effect of maternal active mediation on children’s smartphone overdependence was different depending on open communication and children’s gender.
Specifically, its effect on children’s smartphone overdependence was greater when they communicated more openly with their mothers, and this effect was only found in the case of girls.
Conclusion: This study confirmed that maternal mediation and mother-child communication are important to effectively prevent or intervene in children’s smartphone overdependence. It also suggests that prevention or intervention should be approached differently depending on children’s gender.",박보경,2022,https://www.riss.kr/link?id=A108244619
학령 초기 아동의 스마트폰 과의존이 문제행동에 미치는 영향: 수면문제의 매개효과,"Objectives: This study explored the relationship between early elementary school children’s smartphone overdependence, sleep problems, and problem behaviors. Specifically, it examined the direct effect of children’s smartphone overdependence on problem behaviors and the indirect effect of their smartphone overdependence on problem behaviors through sleep problems.
Methods: About 283 mothers rearing first to third grade elementary school children (135 boys and 148 girls) answered questionnaires on their children’s smartphone overdependence, sleep problems, and problem behaviors. The Model 4 of PROCESS macro version 3.4 was used for data analysis.
Results: First, children’s smartphone overdependence had a positive effect on their internalizing and externalizing problem behaviors. Children who were highly dependent on smartphones exhibited more internalizing or externalizing problem behaviors. Second, children’s smartphone overdependence had a positive effect on sleep problems, which in turn had a positive effect on internalizing and externalizing problem behaviors. Children who were highly dependent on smartphones experienced more sleep problems, which increased their internalizing and externalizing problem behaviors.
Conclusion: Sleep problems mediated the relationship between smartphone overdependence and problem behaviors among early elementary school children, who have not received adequate attention from researchers. The results are meaningful because they confirm the underlying mechanism through which children’s smartphone overdependence impacts their problem behaviors. These results can be used to prevent children’s problem behaviors or reduce their sleep problems by parents rearing early elementary school children or experts providing parent education.",박보경,2023,https://www.riss.kr/link?id=A108731531
애착의 세대간 전이,"The purpose of this study was to investigate (1) intergenerational transmission from mother`s internal working model of relationships formed in her childhood and infant`s attachment patterns and (2) the associations among maternal working models, maternal sensitivity, and infant attachment patterns. The subjects were twenty 12- to 20-month-old infants and their mothers. The Adult Attachment Interview (1996) was used to assess mother`s internal work model of relationships. Interviews were audio-recorded and transcribed verbatim. Each dyad was videotaped in the modified Ainsworth Strange Situation(1978) and filmed for 3 minutes in the Questionaire Situation of Smith and Pederson (1988). Mothers were classified as autonomous(F), dismissing(Ds), preoccupied(E), or unresolved/disorganized(Ud). Infants were classified as secure(B), insecure-avoidant(A), or insecure-resistant(C). Exact A/B/C/D and Ds/F/E/Ud agreement was observed in 55% of the dyads. Maternal sensitivity was related to infant attachment patterns but not to maternal working models.",장미자(Mi Ja Jang),1999,https://www.riss.kr/link?id=A102953485
"어머니의 스마트미디어 리터러시, 스마트미디어 중재, 유아의 스마트기기 과의존과 실행기능 간의 구조적 관계","Objectives: This study aimed to examine the structural relationships among mothers’ smart media literacy, smart media mediation, young children’s overdependence on smart devices, and executive function.
Methods: The Participants comprised 205 children aged 3 to 5 years old, and their mothers. The Early Years Toolbox (EYT) was used to measure young children’s executive function. The data obtained were analyzed using Cronbach’s α, frequency analysis, descriptive statistics, one-way ANOVA analysis, and partial correlation analysis with SPSS 25.0. Bootstrapping was used to examine the mediating effect while the Structural Equation Model (SEM) analysis was performed using AMOS 22.0.
Results: First, young children’s executive function was positively associated with mothers’ smart media literacy and smart media mediation but negatively associated with young children’s overdependence on smart devices. Second, mothers’ smart media mediation and young children’s overdependence on smart devices sequentially mediated the relationship between mothers’ smart media literacy and young children’s executive function. It was also found that mothers’ smart media mediation partially mediated the relationship between mothers’ smart media literacy and young children’s executive function.
Conclusion: These findings highlight the importance of mothers’ smart media literacy and smart media mediation for young children’s executive function and emphasize the need of prevention for overdependence on smart devices in facilitating executive function development in early childhood.",이수빈,2022,https://www.riss.kr/link?id=A108244615
애착의 지속성에 관한 단기종단적 연구,"This article reports the developmental stability of individual differences in children`s attachment qualities with their mothers and the relations between the preschoolers` attachment security to mothers and maternal parenting behavior. 24 infants were observed with mothers in the Strange Situation to assess the infant-mother attachment patterns at 16 months of age. After 3 years, attachment security was assessed using Attachment Q-Set, and the modified IPBI (Iowa Parent Behavior Inventory: Mother Form) was administered to mothers to assess their parenting behavior. Analyses revealed significant differences in children`s attachment security scores by infancy attachment patterns. That is 11 of 12 children`s attachment to mothers qualities were stable across the 3 year periods. The attachment security scores related positively to the responsive maternal parenting behavior. Changes in child-mother attachment quality over time were related to maternal responsiveness. Collectively, these findings were consistent with predictions from attachment theory.",박응임(Ung Im Park),1997,https://www.riss.kr/link?id=A102953592
"아버지의 거친신체놀이, 유아의 정서표현성과 적응적 정서조절의 관계","Objective: The purpose of this study is to explain in detail the factors of the father's play interaction that predict children's adaptive emotional regulation. This study examined the moderated mediation effect of a father’s rough-and-tough play toward a child’s emotional expressiveness and the father’s play participation attitude on the child’s adaptive emotional regulation. Methods: The study participants included 309 fathers of children aged from 3 to 5 years. Data were analyzed using models of the PROCESS Macro. Results: As a result of this research, the relationship of the father’s rough-and-tough play with the child’s adaptive emotional regulation was that this was indeed mediated by the child’s negative emotional expressiveness. Additionally, the father’s responsive and fun play attitude moderated the relationship between the father’s rough-and-tough play and the child’s adaptive emotional regulation. Further, the father’s responsive and fun play attitude according to level had a moderated mediation effect. Conclusion/Implications: These results are meaningful in that they derives a mechanism for why and how a father’s rough-and-tough play affects children's adaptive emotional regulation.",오지현(Jihyun Oh),2023,https://www.riss.kr/link?id=A108489097
어머니의 아동기 과보호 경험과 부정적 양육행동의 관계에서 어머니의 자기분화를 통한 부모성찰의 조절된 매개효과,"Objectives: This study aims to determine how mothers’ parenting experiences affect their attitudes toward raising children. Specifically, it examines how the experience of being raised by overprotective parents affects a mother’s parenting behavior and analyzes the structural relationship and impact of self-differentiation and parental reflection variables on the relationship between the two variables.
Methods: The study participants were mothers of infants found through children's institutions located in Gwangju and Jeollanam-do. The institutions had been selected randomly and consent was obtained from all participants. A total of 374 questionnaires were analyzed using SPSS 20.0 and SPSS PROCESS macro.
Results: First, it was confirmed that self-differentiation completely mediated the relationship between mothers’ childhood overprotection experience and mothers’ negative parenting behavior through selfdifferentiation. Second, it was confirmed that parental reflection regulates the relationship between mothers’ childhood overprotection experience and self-differentiation. Third, the statistical significance of the controlled mediating effect of parental reflection was confirmed in the path in which the mother's childhood overprotection affected parenting behavior through self-differentiation. This suggests that, even if the mother was overprotected as a child and has a low level of selfdifferentiation, enhancing parental reflection can reduce negative parenting behaior.
Conclusion: This study is meaningful in that it discovered the possibility of modifying the process of negative parenting behavior between generations through the parental reflection function. In addition, the fundamental limitations of the previous parental education were revised and suggestions were made for the development of parental education programs that involve the parental reflection functions.",강서로,2022,https://www.riss.kr/link?id=A108244614
"초저출산 시대, 전국민 부모급여 제도의 설계","This study examines the need to introduce a national parental benefit system in order to tackle the falling birth rate in Korea. The aim of the study is to design and present a ‘National Parental Benefit System (NPBS)’, which will be modelled on the similar systems in other parts of the world. Korea has been responding passively to the problem of “double cost,” an outcome of loss of income due to lack of parental leave and increase in household expenditure owing to childcare. We benchmark Germany's 'Parents Allowance System', that provides income-related benefits to all citizens through general finance, as well as Sweden's 'Parental Insurance,' that provides sufficient benefits to the middle class through social insurance and eliminates blind spots through general finance. The proposed NPBS would provide a monthly flat-rate benefit of one million won from general finance to all parents of child birth. Additionally an income-related benefit (replacement rate of 30%, upper limit of 2 million won) to (parent) insurance subscribers, which reaches a maximum of 3 million won per month in total. To finance the NPBS, it is proposed to increase the value-added tax rate (0.5%p) and to pay 0.4% of the wage as a (parent) insurance premium (employers and workers pay 1/2 each).",양재진,2021,https://www.riss.kr/link?id=A107951428
학령 전이기 유아의 학교준비도 예측요인: 만 1세 영아기 애착안정성과 의도적 통제를 중심으로,"Objective: The purpose of this study was two-fold: first to explore the effects of mother-child attachment and effortful control at age 1 on preschoolers school readiness at age 6, and second, to determine the mediating effect of a child s effortful control on the relationship between mother-child attachment at age 1 in relation to school readiness at age 6. Methods: Participants in this study were 205 five-year-old toddlers(106 boys, 99 girls) recruited for the Korea Child Panel Study. Mother-child attachment was assessed using the Attachment Q-sort(Waters, 1989). Preschooler s effortful control was measured by the Early Childhood Behavior Questionnaire: ECBQ(Putnam, Gartstein & Rothbart, 2006). Preschooler s school readness was measured by the School Readiness Scale Murphey & Burns, 2002). Data were analyzed using descriptive statistics, correlations, and the structural equation modeling analysis. Results: First, mother-child attachment at age 1 effected school readiness at age 6. Effortful control at age 1 effected school readiness at age 6. Second, effortful control at age 1 mediated the effect of mother-child attachment at age 1 in relation to school readiness at age 6. Conclusion/Implications: Mother-child attachment at age 1 affects school readiness at age 6, and toddlers effortful control at age 1 mediates the relationship between mother-child attachment in relation to school readiness at age 6.",문영경(Young Kyung Moon),2019,https://www.riss.kr/link?id=A106261961
부모의 심리적 통제가 남녀 아동의 관계적 공격성에 미치는 영향과 거부민감성의 매개효과,"Objective: This study examined the influences of maternal and paternal psychological control and children’s rejection sensitivity on relational aggression in elementary school students, and investigated whether children’s rejection sensitivity mediated the relation of parental psychological control and relational aggression. Methods: The participants of this study were 596 fifth to sixth graders from seven elementary schools located in Seoul, Incheon, and Gyeonggi province. To measure the research variables, the Peer Conflict Scale (Marsee, Kimonis, & Frick, 2004), the Psychological Control Scale (Barber, 1996) and the Children’s Rejection Sensitivity Questionnaire (Downey, Lebolt, Rincon, & Freitas, 1998) were used. The data were analyzed by means of descriptive statistics and t -tests. Also, structure equation model (SEM) were used to examine the mediating role of rejection sensitivity. Results: The results of this study were as follows. First, the level of paternal psychological control increased the level of children’s relational aggression whereas the level of maternal psychological control had no significant effect on it. In addition, the level of rejection sensitivity had a significant positive influence on the level of relational aggression. These tendencies were observed on both boys and girls. Second, only for boys, rejection sensitivity in upper elementary school students partially mediated the relation between paternal psychological control and relational aggression. Also, for both boys and girls, rejection sensitivity completely mediated the relation between maternal psychological control and relational aggression. Conclusion: In conclusion, the higher the level of paternal psychological control, the higher the level of children’s rejection sensitivity, and subsequently the higher the level of their relational aggression",이경미(Kyung Mi Lee),2016,https://www.riss.kr/link?id=A102954701
"만 1세 영아의 맞벌이 부모 동반참여 블렌디드러닝 부모교육 프로그램의 개발 및 효과: 부모의 언어적 행동, 반응성 및 공동양육을 중심으로","Objectives: This study aimed to develop a blended learning-based parenting program and examine its effects on the quality of verbal behavior, responsiveness, and co-parenting of working parents with one-year-old infants.
Methods: Since both parents were working, the ‘Blended Learning’ method, which integrates online and offline sessions, was used. To evaluate the effectiveness of the developed program, 43 pairs of working parents, each having a one-year-old child were recruited (24 pairs in the experimental groups and 19 pairs in the control group). Parental verbal behaviors, responsiveness, and co-parenting were assessed before and after the eight-week program. The data were analyzed with ANCOVA using the pretest score as a covariate.
Results: The parenting program was developed through the following five steps derived from the ADDIE model development process: analyzing, designing, developing, implementing, evaluating. The program lasts for eight weeks and consists of four offline and eight online training sessions. After participating in the program, the parents in the experimental group showed improvement in their verbal behaviors and responsiveness during play interactions. There was no significant difference between the experimental group and the control group on the co-parenting assessment scores.
Conclusion: The blended learning-based parenting program proved to be effective in improving the quality of working parents’ verbal behaviors and responsiveness.",신혜영(Hye Young Shin),2021,https://www.riss.kr/link?id=A107409853
사회적 자본의 관점에서 본 조손가족 조부모의 양육문제 해결방안,"The purpose of this study is to examine the solutions to the nurturing problem of grandparents in grandparents-grandchildren families through the perspective of social capital, using literature analysis. This study operated the descriptive analysis and contents analysis according to the research themes and methods. The results of this study showed that the nurturing problem of grandparents in grandparents-grandchildren families had been actively discussed since 2003, and there were a lot of research on the nurturing experience. Quantitative research methodology was mainly used in the beginning, but the usage of qualitative research methodology has been increased rapidly since 2006. Mixed research was used a lot in the literature suggesting policies. In addition, there was a communication problem between grandparents and grandchildren resulting from a generation gap, and the relationship between grandparents and grandchildren was the dominant cause of the nurturing stress of grandparents. In particular, the nurturing stress of grandparents as daily stress negatively affected grandchildren's adaptation to school as well as grandparents’ physical and psychological health. Therefore, in order to solve the nurturing problem of grandparents, it is necessary to improve the quality of interaction between grandparents and grandchildren by diversifying the contents and forms of communication. In the end, this study suggests the methods that grandparents are able to use in order to solve the nurturing problem, by showing the reality of social networking including parents meeting or self-help group.",김승희,2016,https://www.riss.kr/link?id=A101896537
어린이집내 인공지능 로봇 사용경험 여부에 따른 유아의 인공지능 인식 차이,"Objective: This study investigated the differences in preschool children’s perceptions of artificial intelligence (AI) and their distribution by latent profiles according to their experience with AI robots in daycare centers.
Methods: The participants included 119 five-year-old children, 52 of whom had experience with AI robots in daycare centers and 67 of whom did not. Children’s perceptions of AI were measured using the Godspeed scale from Bartneck et al.(2009). Data were analyzed using a t-test, latent profile analysis, and chi-square test.
Results: The results showed that compared to the inexperienced group, the experienced group reported lower levels of animacy and perceived intelligence of AI robots, indicating higher levels of AI knowledge and understanding. In addition, the experienced
group had a higher probability of belonging to the ‘machine recognition’ type than ‘organism recognition’ type, although the difference was not statistically significant.
Conclusion/Implications: The findings suggest that experience with AI robots in daycare centers can improve children’s AI knowledge and understanding. To further enhance this effect, it is necessary to increase the number of robots put into classrooms, and to consider various teaching media that reflect children’s preferences.",이보람(Boram Lee),2023,https://www.riss.kr/link?id=A108560284
발달장애아동 부모의 긍정적 행동지원 중재 적용 실태 및 효과성 인식,"The purpose of this study is to prepare the basic information of parents' training through the present execution status and awareness of parents for children with disabilities on positive behavior intervention support for the their children with disabilities. The results of the study as follows: First, the problem behaviors which been recognized as the most serious problem were a lack of society, and then came tantrums. The rate of teachers having high concern on students' behavioral management was 67.9%, and the rate of teachers having low concern was 28.6%. And the parents considerably obtained the information on problem management from the therapists of children at their community, who went to therapists for advice too. And they got a parents' training for problem management at the rate of 60.7%. Second, the interventions to be used the most were the preventive interventions. And on the effectiveness evaluation, the parents evaluated the facts of monitoring and assessment of behaviors to be not effective. Results are discussed with reference to previous research, contributions to the literature, future directions, and implications for practitioners and researchers who are involved in interventions for children for children disabilities.",권회연,2017,https://www.riss.kr/link?id=A104866566
"부모의 양육행동, 미디어 사용 유형, 유아의 정서 및 행동 문제의 구조 관계","This study was to examine the relations parenting styles, media use types(education, entertainment), and preschooler's behavior problems. We analyzed the data from the 6th year Korean Children Panel Study(KCPS), including 1,662 families with 5-year-old children. Structural equation modeling was used for data analysis. The results of this study were as follows. First, parental warmth and control were associated with the shorter media usage time for playing. But parental warmth and control had insignificant impacts on media usage time for education. Second, media usage time for education was related to a lower likelihood of depression/anxiety and aggression. On the other hand, media usage time for entertainment was associated with a higher levels of attention problems and aggression. Based on the study findings, desired teaching methods according to preschooler' media usage types for parents and teachers were discussed.",김수정,2016,https://www.riss.kr/link?id=A101896540
그림책을 활용한 활동이 유아의 언어발달에 미치는 효과에 대한 메타분석,"Objective: This study was aimed to analyze the effects of activities using picture books for young children’s language development and to identify factors that caused differences in these effects by applying meta-analysis. Methods: We conducted a homogeneity test of effect sizes on 21 Korean studies published in academic journals from 1990 to February 2018 and calculated the effect size by applying a random effect model. Additionally, we conducted a meta-ANOVA to investigate whether the effect sizes differed by types of language development, picture book activities, and environmental variables-such as place, time, and agent. Results: The results indicated that the effect sizes of the 21 studies were heterogeneous and the total effect size was 0.90, which was significantly large according to Cohen s standard. The effect sizes also varied by types of language development, picture book activities, and environmental variables. Conclusion/Implications: To increase the effects of activities using picture books for young children’s language development, this study suggested the importance of picture book activities to be integrated with other play areas, teaching methods, and other print materials for the development of literacy abilities, and the link between home and early childhood education institutions.",심경화(Gyeong-Hwa Shim),2019,https://www.riss.kr/link?id=A106336289
