
AI 그림에 대한 사회 인식 및 AI 생성 서비스의 발전 방향성 분석,"Generative AI (생성적 인공지능)의 도입은 인공지능을 활용한 창작 활동을 가능하게 한다. Generative AI는 사용자의 명령에 따라 새로운 창작물을 탄생시킬 수 있는 알고리즘을 갖고 있으며 그림, 오디오, 텍스트 등 다양한 형태의 창작물을 제작할 수 있다. 본 연구는 이미지 생성 모델 기반의 AI 그림에 대해 주목하였다. 최근 쉬운 사용법을 갖춘 오픈 서비스 출시 이후 다수의 사람들이 AI 이미지 생성 서비스를 활용한 창작활동이 가능해진 것에 따라 각종 논쟁이 발생하고 있다. 이에 본 연구는 AI 그림에 대한 인식에 어떠한 변화가 나타나고 있는지 소셜 빅데이터를 통한 인식 분석의 필요성을 파악하였고 향후 서비스화에 고려할 요소로써 해당 방향성을 제언한다. 이를 위해 빅데이터 기반의 언급량 추이 분석, 긍부정 분석, 연관어 분석 및 원문 분석을 진행하였다. 또한 분석을 통해 확인된 인공지능 기반의 창작활동에 부정적 거부감을 극명하게 보이고 있는 일부 대중의 인식을 언급하였다. 이를 바탕으로 본 연구는 사용자 관점에서 생성적 인공지능 모델 기반의 AI서비스가 향후 어떻게 발전되어야 하는지에 대한 방향성을 제시하는 것에 의의가 있다.",석정현(Jeong Hyun Seok),2023,https://www.riss.kr/link?id=A108527366
"카페인이 함유된 음료 섭취가 대학생의 스트레스 정도, 학습태도 및 수면시간에 미치는 영향",,정은숙,2014,https://www.riss.kr/link?id=A99938537
디지털 리터러시 역량의 자기진단 평가도구 개발,,양길석,2020,https://www.riss.kr/link?id=A106970725
디지털 격차가 노인의 디지털 일상생활에 미치는 영향 분석,"본 연구는 디지털 격차가 노인의 디지털 일상생활에 미치는 영향력을 분석하는 것이다. 60세이상의 노년층을 대상으로 디지털 격차에 대한 적응경향성을 측정하여 집단으로 구분하였고, 디지털 의사소통 기술, 디지털 자신감, 디지털 자기통제감, 디지털 생활만족을 측정하였다. 연구모형은 교차설계 모형과 이중매개모형을 적용하였다. 연구결과, 첫째, 디지털 격차에 대한 적응 접근성이 높은 집단이 전반적인 디지털 일상생활에 긍정적인 영향을 미치는 것으로 나타났다. 둘째, 디지털 격차에 대한 적응 활동성이 높은 집단이 디지털 자기통제감에 긍정적인 영향을 미치는 것으로 나타났다. 셋째, 디지털 의사소통 기술이 디지털 생활만족에 긍정적인 영향을 미치며, 디지털 자신감과 디지털 자기통제감은 매개역할을 하는 것으로 나타났다. 이러한 연구결과를 토대로 노년층의 디지털 격차에 대한 극복 전략에 대해 논의하였다.",허성호,2020,https://www.riss.kr/link?id=A107078824
기계학습 기반 유튜브 악플 분석: “사이버렉카”에 달린 댓글의 어휘적 특성,"본 연구는 특정 유명인에 대한 선정적 유튜브 콘텐츠로 혐오를 조장하고 악성 댓글(이하 악플)을 확산시키는 일명 “사이버렉카” 채널에 주목해 여기에 달린 댓글을 수집한 후 기계학습 알고리즘으로 악플을 분류하여 그 어휘적 특성을 분석했다. 이를 위해 로지스틱 회귀 모델을 기계학습 알고리즘으로 사용하고 예측 성능을 높이기 위해 과적합을 방지하는 정규화 과정을 거쳤다. 그 결과, “사이버렉카” 콘텐츠는 욕설이나 비속어보다는 외모 비하나 조롱 목적의 멸칭과 모욕적 상징이 함축된 고유 명사가 사용되는 악플을 양산하고 있었고 이 과정에서 다양한 언어적 변이가 일어나고 있음을 발견했다. 이러한 결과를 바탕으로 기계학습의 방법을 이용한 악플 탐지의 가능성을 진단하고 그 한계를 극복하는 방안을 논의했다.",이신행,2022,https://www.riss.kr/link?id=A108185410
아동의 컴퓨터 게임 중독에 미치는 영향,"아동들에게 있어 컴퓨터 게임은 중요한 문화적 요소이고 컴퓨터 게임 중독은 심각한 상황에 이르고 있다. 게임요소에 대한 선호도를 학생의 배경변인과 선호게임의 유형별로 분석하여 보고, 게임요소와 게임중독과의 관계를 알아보는 것은 학생들의 게임중독을 예방하고, 게임을 긍정적으로 활용할 수 있도록 하기 위해 필요하다. 본 연구는 아동들의 게임 요소가 컴퓨터 게임 중독에 미치는 영향을 알아보는 것이다. 연구 방법은 설문조사를 통한 조사 연구와 실험 연구를 병행하였다. 통계처리방법은 게임 요소 선호도와 게임중독과의 관계를 알아보기 위해 피어슨의 상관계수를 구하였다. 그리고 영향을 알아보기 위하여 회귀분석(Stepwise Regression Analysis)을 실시하였다. 연구결과 게임요소와 컴퓨터 게임중독은 정적 상관이 있는 것으로 나타났고, 게임요소에 대한 선호도가 높을수록 컴퓨터 게임 중독 성향이 높은 것으로 분석되었다. 그리고 게임요소 중 감각적 욕구충족, 현실이탈 욕구충족, 사회적 욕구충족에 대한 선호도가 게임중독에 유의한 영향력을 미치는 것으로 나타났다. 그러나 지적 욕구충족과 경쟁 욕구 충족에 대한 선호도는 컴퓨터 게임중독에 유의한 영향을 미치지 않는 것으로 나타났다.",이재무,2010,https://www.riss.kr/link?id=A82508840
영유아를 배려하는 공공장소를 위한 사회적 디자인 연구,"최근 증가하는 노키즈존(No Kids Zone)은 우리사회의 영유아에 대한 인식을 반영한다. 본 연구는 영유아에 대한 관용과 사회적 수용을 증진시키는 사회적 인식개선의 일환으로서 음식 및 카페를 이용할 때 영유아를 동반함으로 인해 유발되는 문제를 파악하고, 개입방법을 모색하고자 하였다. 이를 위해 요식업 종사자, 식당 및 카페 이용자, 영유아 자녀를 둔 부모들과의 면담을 통해 인식 및 문제점을 파악한 후, 그들이 겪는 어려움을 해결하기 위한 개입방안을 모색했다. 면담 결과 영유아를 동반하는 이용자들의 자녀 돌봄에 대한 무관심과 영유아를 동반하지 않는 이용자들의 낮은 수용도가 문제의 원인으로 나타나 그들의 인식 개선을 위한 개입 방안으로 테이블매트와 안내판을 디자인하였다.",김도리(Kim Doolee),2023,https://www.riss.kr/link?id=A108527532
우리나라 개인정보보호수준의 개선방안에 관한 연구,"정보통신기술의 발달로 인하여 정보의 수집과 이용이 보편화되고 있으나, 이에 따른 정보의 오·남용이 증가하고 있어 정보화역기능에 대한 대책이 절실히 필요하다. 더욱이 앞으로 유비쿼터스사회에서는 개인정보를 RFID기반에서 유통하게 됨에 따라 보다 강력한 개인정보보호 인프라가 필요하다.
이에 본 연구에서는 중앙행정기관과 지방자치단체를 중심으로 그동안 추진하여온 개인정보보호의 제도적 대책과 기술적 방안을 정책·기술적 보호기반, 생애주기별 정보관리, 정보침해 대응대책으로 구분하여 온라인 설문조사를 실시하였다. 그 결과, 개인정보보호를 위한 정책·기술적 측면이 부족한 것으로 나타났으며, 이를 바탕으로 개인정보관리환경을 개선하고, 우리나라의 개인정보보호 수준을 향상시킬 바람직한 정책방향을 제시하고자 한다.",신영진,2009,https://www.riss.kr/link?id=A76522551
플립러닝과 학습태도에 관한 연구,"이 연구는 초등 SW교육에서 학습자의 개인적 적성이나 흥미에 따라 발생되는 어려움을 해소하기 위하여 플립러닝 교수학습방법을 적용하였다. 학습자의 학습태도에 대한 검사를 실시한 결과 플립러닝이 학습자의 학습태도에 대한 하위요인 중 흥미와 목적의식, 자율적인 학습, 학습기술을 촉진시켜 학습태도에 긍정적인 영향을 미쳤음을 알 수 있다.",박지현,2017,https://www.riss.kr/link?id=A105091306
조합에서 모든 경우의 수를 만들기 위한 CPU와 GPU의 효율적 협업 방법,"조합에서 모든 경우의 수를 생성하는 체계적인 방법 중 하나는 조합 트리를 구성 하는 것이며 조합 트리를 구성하는 시간 복잡도는 O(2<sup>n</sup>)이다. 조합 트리는 그래프 동형 문제나 빈발 항목집합을 계산하는 초기 모델 등 다양한 목적으로 활용된다. 그러나 조합의 모든 경우의 수를 탐색해야 하는 알고리즘은 높은 시간 복잡도로 인해 현실적으로 활용되기 어렵다. 그럼에도 불구하고 데이터의 양이 방대해지고 이를 활용하기 위한 다양한 연구가 진행되면서 모든 경우의 수를 탐색해야만 하는 경우가 늘고 있다. 최근 GPU환경이 보급되고 쉽게 접할 수 있게 되면서 직렬 환경에서 높은 시간 복잡도를 가지는 알고리즘들을 병렬화 하여 시간을 줄이려는 다양한 시도가 이루어지고 있다. 조합에서 모든 경우의 수를 생성하는 방법은 순차적으로 진행되고 하부 작업의 크기가 편향되기 때문에 병렬 구현에 적합하지 않다. 병렬 알고리즘의 성능은 모든 스레드가 비슷한 크기의 작업을 가질 때 극대화될 수 있다. 본 논문에서는 모든 경우의 수를 구하는 문제를 병렬화하기 위하여 CPU와 GPU가 효율적으로 협업하기 위한 방법을 제안한다. 제안한 알고리즘의 성능을 검증하기 위하여 이론적인 측면에서 시간 복잡도를 분석하고, CPU와 GPU환경에서 다른 알고리즘과 본 연구에서 제안한 알고리즘의 실험 시간을 비교한다. 실험 결과 본 연구에서 제안한 CPU와 GPU의 협업 알고리즘은 이전 알고리즘에 비하여 CPU의 수행시간과 GPU의 수행시간의 균형을 유지하였고 아이템의 개수가 커질수록 괄목할 만한 시간 개선을 보였다.",손기봉 ( Ki-bong Son ),2018,https://www.riss.kr/link?id=A105625230
의료정보 유출의 문제점과 의료정보보호,"과거 종이로 기록되던 환자의 의료정보는 점점 현대과학의 눈부신 진화와 발전으로 현재는 종이를 대신하는 전자적 시스템인 전자의무기록시스템 형태로 발전되었다. 또한 병원에서 활용되는 모든 의료정보들이 전자적시스템을 이용하여 활용되고 있는 것이 현실이다. 그러나 과학기술의 발전과 더불어 의료정보의 피해 사례는 계속 증가할 것으로 보인다. 보험사기 예방을 위해 의료정보를 공유해야한다는 보험단체들의 주장, 개인정보를 얻기 위해 금전적 불법거래가 성행되고 있다는 뉴스 등을 접할때면 의료정보 보호에 관한 대책 마련이 절실함을 의미한다. 따라서 의료정보와 관련된 유출상의 문제점을 정확히 파악하는 것은 의료정보 유출의 부작용을 예방하고 의료정보 보호와 미비점을 보완하는 선결과제인 것이다. 따라서 현재의 의료법 및 개인정보보호법제만으로는 의료정보의 표준화와 의료정보보호 등을 규율할 수 없고, 의료정보에서 발생되는 여러 문제들을 보호하기에는 미흡하다고 판단된다. 따라서 본 논문은 미흡한 의료정보관련 법제의 연구를 위한 선결 과제로 의료정보의 유출로 발생될 수 있는 문제점을 파악하는 것이 무엇보다 중요하다고 판단되며, 이에 의료정보의 유출로 인한 문제점을 파악하고 의료정보를 보호할 수 있는 입법방안을 중심으로 연구하고자 한다.",전영주(Young-Ju Jeun),2012,https://www.riss.kr/link?id=A101698380
전자그림책 읽기와 종이그림책 읽기에서 나타난 유아의 언어반응 비교,"본 연구에서는 스마트폰 전자그림책과 종이그림책을 또래와 짝지어 읽을 때 나타나는 유아의 언어 반응을 비교해 봄으로써 매체의 차이에 따른 언어반응이 어떻게 다르게 나타나는가를 살펴보고자 한다. 연구대상은 만5세 유아 8명으로, 각 아동은 또래와 짝을 지어 전자그림책<구름빵> 읽기와 종이그림책<구름빵> 읽기에 참여하였다. 연구결과 전자그림책 읽기와 종이그림책 읽기에서 나타난 아동의 언어반응은 언어반응의 내용과 언어반응의 유형에서 다르게 나타났다. 언어반응의 내용에서 유아는 종이그림책 읽기에서는 사건에, 전자그림책 읽기에서는 장면에 많은 반응을 보였으며 언어반응의 유형에서는 종이그림책 읽기에서 정보적 반응을, 전자그림책 읽기에서 개인적 반응을 가장 많이 보였다.",손희정(HeeJung Son),2012,https://www.riss.kr/link?id=A60142966
베블런효과와 밴드왜건효과가 미용실 선택에 미치는 영향,,최재민,2017,https://www.riss.kr/link?id=A103591103
"기술 활용의지, 디지털 소외감, 조력자 경험이 고령소비자의 삶의 만족도에 미치는 영향","최근 인터넷과 디지털 기기를 능동적으로 활용하는 고령층이 점차 증가하고 있다. 본 연구는 정보기술 활용에 있어서 취약계층으로 여겨지는 고령소비자의 기술 활용의지와 디지털 소외감 그리고 정보기술 활용을 돕는 조력자 경험이 삶의 만족도에 미치는 영향력을 규명하는 것을 목적으로 한다. 이를 위해 인터넷 활용이 가능한 60대 이상의 고령소비자 총 311명을 연구대상으로 선정하여 온라인 설문조사를 통해 자료를 수집 및 분석하였다. 연구결과, 고령소비자는 정보기술을 주체적으로 활용하려는 의지가 강하고 디지털 소외감을 낮게 지각하며 기술 활용 시 조력자의 도움을 많이 받는 것으로 나타났다. 회귀분석 결과, 디지털 소외감을 낮게 지각할수록, 기술사용에 있어서 조력자의 도움을 많이 경험할수록 고령소비자의 삶의 만족도가 유의하게 증가하였다. 본 연구는 첨단정보기술 환경에서 고령소비자의 삶의 만족도 증진에의 영향요인을 밝히고 정책적, 실무적 시사점을 제안한다는 점에서 가치가 있다.",장은교,2021,https://www.riss.kr/link?id=A107899792
탐색적요인분석과 확인적요인분석의 비교에 과한 연구,,최창호,2017,https://www.riss.kr/link?id=A103591133
온라인 콘서트의 사용자 경험 연구 - KPOP 온라인 콘서트 사례를 중심으로 -,,홍현주,2021,https://www.riss.kr/link?id=A107251781
데이터 기반 딥페이크 탐지기법에 관한 최신 기술 동향 조사,"최근 전 세계적으로 ‘가짜뉴스’, ‘가짜 연예인 음란 동영상’ 및 ‘지인 능욕’에 사용되는 인공지능 기반의 딥페이크 (Deepfakes)기술이 사회적인 이슈로 대두되고 있다. 딥페이크 기술이란 딥러닝 기술을 이용해 악의적으로 조작된 음성, 영상, 이미지 등을 만들어 내는 방법으로, 인공지능 기술의 발전에 맞추어 더욱더 빠르고 정교한 생성 기술이 등장하고 있다. 이러한 딥페이크 기술은 빠른 개발 속도와 쉬운 접근성을 기반으로 다양한 범죄에 악용되고 있다. 본 논문에서는 다양한 딥페이크 생성 기술을 설명하고, 이를 효율적으로 탐지 할 수 있는 다양한 데이터 기반 딥페이크 탐지 기술의 현황을 설명한다.",김정호(Jeongho Kim),2020,https://www.riss.kr/link?id=A107124318
핀테크 애플리케이션의 사용자 경험 연구-토스와 카카오뱅크를 중심으로-,"본 연구는 대표적인 핀테크 애플리케이션 서비스인 토스와 카카오뱅크를 사용자 관점에서 비교·분석하고, 이를 통해 사용자 경험의 주요 요인에 따른 발전 방향을 제안하는 데 목적이 있다. 두 애플리케이션을 모두 사용해본 경험이 있는 실험집단을 모집하여 1차로 조회 및 이체 서비스에 관한 task를 진행한 후 2차로 스티븐 앤더슨(Stephen P. Anderson)의 Creating Pleasurable Interface 모형을 재구성하여, 2030세대의 성향 특징 중심 키워드로 작성한 질문을 통해 심층 인터뷰를 진행하였다. 실험 결과, 사용자들은 사용성에 따라 만족도를 보였으며, 금융 거래 성향과 금전 관리 방식에 따라 애플리케이션 사용 경험이 나뉘었다. 따라서 개선 방안으로는 사용자의 금융 거래 성향을 공유할 수 있는 기능과 일상생활에서의 금전 관리를 돕기 위한 서비스가 요구된다. 본 연구는 사용자 중심의 핀테크 애플리케이션 서비스로 발전하기 위한 방안을 모색하는 데 도움이 될 것으로 기대한다.",김현우,2020,https://www.riss.kr/link?id=A106544813
자율주행자동차 기술 동향에 관한 연구,본문참고,"최원석, 최성곤",2021,https://www.riss.kr/link?id=A107775018
MZ세대의 업사이클링 및 친환경에 대한 인식과 업사이클링 기념품에 대한 선호도,"본 연구는 친환경 소비에 대한 MZ세대의 인식과 친환경 기념품에 대한 선호도를 알아보고자 하였다. 업사이클링 제품을 구매하는 이유로는 디자인, 가격, 차별성, 환경보호 등의 순으로 나타나 디자인이 제품 구매에 가장 큰 영향을 미침을 알 수 있다. 업사이클링 기념품 구매 시에도 디자인을 가장 많이 고려하였다. 환경문제에서는 환경오염의 심각성을 가장 크게 인식하고 있었으며, 패션제품의 재활용이 필요하다고 생각하였다. 친환경적인 패션제품 구매행동에서는 유행하는 옷보다 오래 입을 수 있는 옷을 선택하는 경우가 가장 많았다. 환경이나 친환경상품에 대한 관심이 있을 때 업사이클링 제품에 대한 구매가 이루어지는 것으로 나타났다. 또, 업사이클링 제품 구매 경험이 있을 경우 친환경 패션상품과 패션제품 재활용에 대한 인식이 높고 관심이 많은 것으로 나타났다. 환경문제에 대한 관심과 업사이클링 기념품에 대한 인식은 남성보다 여성이 높았다. 추후 연구에서는 업사이클링 제품, 환경문제, 소비자행동, 업사이클링 기념품 간의 상관성에 관한 연구를 진행해볼 필요가 있을 것으로 생각된다.",유천(Cheon Yu),2023,https://www.riss.kr/link?id=A108560562
종합병원 간호사의 재직의도에 영향을 미치는 요인,,김유미,2020,https://www.riss.kr/link?id=A107184218
코로나 블루와 여가 활동 : 한국 사례를 중심으로,"세계적으로 코로나19 팬데믹이 장기화되면서 코로나19와 우울감(blue)이 합쳐진 코로나 블루(Corona Blue) 현상이 심화되고 있다. 본 연구의 목적은 코로나19 전과 후의 스트레스와 여가활동과의 연관성에 대해 알아보고, 스트레스에 따른 여가활동의 도움에 관하여 분석하는 것이다. 본 연구는 토픽모델링방법을 통한 코로나 블루 뉴스기사 분석과 설문조사의 2가지 연구방법을 활용하여 분석하였다. 즉, 첫째, 코로나19가 “경계”단계로 격상된 2020년 1월부터 사회적 거리두기 2.5단계까지 강화된 9월까지의 신문 기사를 토대로 총363건의 뉴스 기사를 토픽모델링을 통해 분석하였다. 연구 결과 총 28개의 토픽이 추출되었으며, 비슷한 주제끼리 멘탈데믹(mentaldemic), 세대확산, 우울증 가속 원인, 피로감 증가, 장기전에 대처하는 자세, 소비변화, 우울 극복을 위한 노력 총 7개로 그룹화 하였다. 둘째, SPSS 통계 프로그램을 활용하여 코로나19 전, 후 여가활동에 따른 스트레스 변화수준과 여가활동에 따른 주된 도움을 분석하였다. 연구 결과 코로나19 전 여가활동 참여에 따른 스트레스 감소 평균 차이가 코로나19 후 보다 큰 것으로 확인할 수 있었으며, 코로나19 후에도 여가활동은 스트레스 완화에 효과가 있는 것으로 나타났다. 또한, 코로나 19전 여가활동에 따른 주된 도움이 신체적, 사회적 활동을 통한 기분전환, 재충전의 의미였다면, 코로나19 후에는 자연, 야외 활동, 지적 활동을 통한 기분전환, 잠깐 잊음과 같은 심리적 역할이 큰 것으로 나타났다. 결론적으로 본 연구는 코로나 블루 현황 파악과 극심한 스트레스 상황에서 여가 대처를 통해 완화 효과가 있음을 확인하였다. 본 연구 결과는 향후 코로나 블루 극복을 위한 현실적이고 바람직한 여가 정책 및 대응 방안 마련에 기초 자료가 될 수 있을 것이다.",사혜지 ( Hye Ji Sa ),2021,https://www.riss.kr/link?id=A107403003
사물인터넷을 위한 경량암호와 양자컴퓨터,"사물인터넷 상에서 활용되는 경량암호알고리즘은 높은 보안성과 함께 가용성을 제공할 수 있다는 장점으로 인해 활발히 연구되고 있다. 하지만 경량암호알고리즘은 양자컴퓨터 상에서의 Grover 알고리즘에 의해 해킹될 가능성을 가지고 있다. IBM 그리고 Google을 선두로 한 국제 대기업 및 국가 단위의 연구진들의 활발한 연구로, 고성능 양자 컴퓨터 ‘개발이 앞당겨지고 있다. 공개키 암호와 달리, 대칭키 암호는 양자 컴퓨터로부터 안전하다고 추정되는 문제를 기반으로 하고 있지만 경량화된 암호화 구조에 의해 심각한 보안 취약점을 야기할 수 있다. 본고에서는 사물인터넷을 위한 경량암호를 실제 해킹할 수 있는 양자컴퓨터의 현재 가용 자원에 대해 확인해 보며 이를 통해 양자컴퓨터의 한계점과 앞으로의 사물인터넷 보안의 안전성에 대해 확인해 보도록 한다.",장경배,2022,https://www.riss.kr/link?id=A108120775
"간호사의 성격유형, 자기효능감과 임상수행능력 간의 관계",,박영미,2016,https://www.riss.kr/link?id=A102392577
"간호대학생들의 자기주도적 학습능력, 학습몰입, 학업적 자기효능감, 학업성취도와의 관계",,길초롱,2021,https://www.riss.kr/link?id=A107971080
메타버스 해석과 합리적 개념화,"개념 정리도 되지 않은 채, 언론과 업계에서는 메타버스에 대한 다양한 논의가 진행 중이다. 스티븐슨(Neal Stephenson)의 소설 ‘스노우 크래쉬(Snow Crash, 1992)’에서 용어가 처음 사용된 이래로, 미국의 미래가속화연구재단(Acceleration Studies Foundation: ASF)이 2007년 메타버스 개념을 처음 정리했지만 이후 메타버스는 오랫동안 주목을 받지 못했다. 그러나 2020년 가을 엔비디아(NVIDIA)가 실시간 3D 시각화 협업 플랫폼 ‘옴니버스(Omniverse)’를 소개하며 제2의 인터넷으로 메타버스를 설명하고, 로블록스(Roblox)가 기업공개(IPO)를 하며 자사의 서비스를 메타버스로 설명하면서, 메타버스는 현실과 가상의 경계를 넘나드는 새로운 세상으로 인식하게 됐다. 이 연구는 어느새 미디어와 콘텐츠를 넘어 새로운 삶의 공간으로 그려지는 메타버스에 대한 다양한 논의를 정리하고, 메타버스에 대한 새로운 정의를 제안하고자 한다. 메타버스의 의미를 설명하기 위해서 ASF가 제안한 두 개의 축과 네 개의 시나리오를 중심으로 가상세계, 거울세계, 증강현실, 라이프로깅의 의미를 다양한 연구를 통해 연구를 통해 정리한 후에, 메타버스 설명의 문제점을 비판하고 대안으로 인간 중심, 사용자 중심의 메타버스 정의로 인간 커뮤니케이션, 현실, 비현실 경험, 그리고 확장현실을 제안하며, 메타버스에 대한 재개념화를 시도했다.",송원철 ( Song¸ Stephen W ),2021,https://www.riss.kr/link?id=A107873792
블록체인 기술과 활용 연구,"블록체인은 네트워크상에서 기록된 데이터들이 하나의 블록 단위로 수집되어 저장되며 앞뒤로 연결되어 저장되도록 고안되었고, 그 형태가 블록들이 연결되어있는 모습과 비슷하므로 블록체인이라 불리게 되었다. 많은 기업이 국내외적으로 블록체인 기반 서비스를 대중화하기 위해 노력하고 있으며, 다양한 산업에서 블록체인이 활용되고 있다. 본 연구는 블록체인의 기술적 특징을 소개하고 블록체인을 활용한 응용 서비스들을 다룬다. 블록체인의 아키텍처와 핵심기술 5가지를 소개하고 결제서비스와 블록체인 서비스 네트워크, 블록체인 부동산 플랫폼, 신원확인, 암호화폐, 다이아몬드 유통경로 추적, 블로그 정보 기록에서 활용되고 있는 블록체인 응용 서비스들을 소개하고자 한다. 블록체인의 이해를 높이고 향후 블록체인 연구 및 서비스 개발에 유용성을 제공할 것으로 기대된다.",이새봄(Sae Bom Lee),2021,https://www.riss.kr/link?id=A107293287
