
대학생의 자기개념명확성과 SNS중독경향성의 관계: 사회비교경향성과 상태 소외에 대한 두려움의 이중매개효과,"The Relationship Between Self-Concept Clarity and SNS Addiction Proneness for University Students: Dual Mediating Effects ofSocial Comparison Orientation and State-Fear of Missing OutHwalim Moon & Keehwan Park

Abstract: The present study aimed to examine the mediating role of social comparison orientation and state fear of missing out between self-concept clarity and SNS addiction proneness. For this purpose, 380 undergraduate students completed self-report questionnaires: Self-concept Clarity Scale, Iowa-Netherland Comparison Orientation Measure, State-Fear of Missing Out, and SNS Addiction Proneness Scale for College Students. As a result of the analysis, in the relationship between self-concept clarity and SNS addiction proneness, the simple mediating effect of state fear of missing out was significant. However, the simple mediating effect of social comparison orientation was not significant. The relationship between self-concept clarity and SNS addiction proneness was sequentially mediated by social comparison orientation and state fear of missing out. This result suggests that the lower the level of self-concept clarity, the more social comparisons you make with others, and you can experience fear of missing out in online and SNS, leading to SNS addiction. It is expected that SNS addiction can be further alleviated by dealing with the state-fear of missing out in the therapeutic scene.


Key Words: Self-Concept Clarity, Social Comparison Orientation, State-Fear of Missing Out, SNS Addiction Proneness, Dual Mediating Effect",문화림,2022,https://www.riss.kr/link?id=A108408599
"노인 지역사회 통합돌봄의 인공지능(AI), ICT활용사례 연구","This study identified and analyzed AI and ICT application cases used in community integrated care leading projects. Through this, we discovered application tasks for the vitalization of artificial intelligence and ICT in the care service field in the future. As a result of the analysis, artificial intelligence and ICT in the community integrated care leading project enabled effective service provision by sharing information related to the target and service between care service providers. In addition, with the operation of an AI welfare worker, it is now possible to provide care services outside the working hours of care workers. In addition, safety was managed in the space where the subject of care resided, and non-face-to-face health management was made possible so that medical staff could check the health condition without visiting the home or face-to-face. Lastly, emotional support was provided to the elderly by operating a non-face-to-face cultural leisure program that could satisfy the various needs of the elderly. In the future, care services using artificial intelligence and ICT should function as a supplement to supplement care workers, not replace them.",김경미(Kyungmi Kim),2023,https://www.riss.kr/link?id=A108546747
AI 음성 인식 스피커에 대한 영유아 부모의 인식,"The purpose of this study is to examine the perception of AI voice recognition speakers for parents of infants and toddlers. This study conducted a survey from June 5 to June 9, 2021 with 250 parents with children in daycare centers and kindergartens. The final analysis data is 195, and frequency analysis and χ2 verification were performed using SPSS 23.0. As a result of this study, many parents use the KT GiGA Genie and exposed the AI voice speaker at the age of 3 years old. The reason for using the AI-based voice speaker was that it could be used as a combination of communication, and the average daily use of the child was 1 to 1 times a day after evening hours, and they answered that they were generally satisfied with the AI voice speaker plan. When using the AI voice speaker, it was often used with the mother, and there were many infants and toddlers who listened to fairy tales through the AI voice speaker. It was reported that infants and young children were using AI voice speakers according to the rules established by their parents, which improved Korean language acquisition and vocabulary, but had a disadvantage in that sleep time was delayed. Parents were setting rules for the usage time of AI voice speakers for infants.",이정연,2021,https://www.riss.kr/link?id=A108141341
MZ세대 공무원의 이직 의향 결정요인 및 후생복지의 조절효과,"Determinants of Turnover Intention of MZ Generation CivilServants and the Moderating Effects of Employee WelfareJinwoo Seo & Jongsoo Kang

Abstract: The purpose of this study was to analysis the factors that affect of MZ generation civil servants’ turnover intention, and measure if employee welfare provide to civil servants could be a meaningful moderating effects. Based on the data conducted by the Korea Institute of Public Administration (2020). the analysis was conducted on young civil servants in their 20s and 30s who correspond to the MZ generation. The conclusions of this study are as follows. First, MZ generation civil servants have a meaningful higher turnover intention than older generations. Second, job stress, wages satisfaction, excessive of work, and public service motivation of MZ generation civil servants affected their turnover intention. Third, employee welfare is moderates meaningfully such effects. In order to prevent the MZ generation from leaving public organization, it is necessary to reorganize employee welfare and change the generation management method of the older generation according to the characteristics of the MZ generation.


Key Words: MZ Gen, Civil Servants, Turnover Intention, Employee Welfare, Moderator",서진우,2022,https://www.riss.kr/link?id=A108396112
스포츠(교육학) 분야의 질적 연구,"The study is to introduce the status of the qualitative research (QR) in sport pedagogy. It introduces how it has been evolved and where it stands now. Rather than providing extensive overview the whole field of sport pedagogy, the researcher introduces personal stories of the last 25 years with experiences of the evolution of sport pedagogy in the field of the profession as a researcher. The story is laid out around three topics that holds significant meaning to the researcher. First, the starting points of qualitative studies in sport pedagogy are reviewed and how it has been developed is outlined. The emerging interests on QR, paradigm wars, streams in QR, and conceptual debates are also discussed. Second, among many genres in QR, the study looks into a specific QR in which the researcher have personal academic interests. It is called action research and/or practitioner research. Extensive discussion is included on the status of various genres of QR in educational studies. Third, the topic of writing in QR is covered, along with the researcher’s observation on writing styles in QR and sport pedagogy. The study is concluded with the halfway life story of the researcher as a QR practitioner with suggestion of three key themes for development of Korean sport pedagogy.",최의창,2016,https://www.riss.kr/link?id=A102134317
"재활병동 간호사와 일반병동 간호사의 직무특성, 조직의사소통, 직무스트레스 및 직무만족도","The purpose of this study was to confirm the job characteristics, organizational communication, job stress, and job satisfaction of nurses in rehabilitation and general wards and to identify differences between the two groups. The survey was performed with 132 nurses working in three rehabilitation hospitals and 131 nurses working in three small and medium hospitals in B city. The data was collected through questionnaires and analyzed using SPSS/Win 25.0. The results of the survey were as follows. There was a statistical difference between the two groups in job characteristics and organizational communication, and nurses in the rehabilitation ward showed higher scores in job characteristics and organizational communication than nurses in the general ward. The job satisfaction of rehabilitation ward nurses had a positive correlation with job characteristics and organizational communication and a negative correlation with job stress. The job satisfaction of general ward nurses was found to have a positive correlation with organizational communication and a negative correlation with job stress. Job stress and organizational communication were factors affecting job satisfaction in nurses in rehabilitation and general wards, with explanatory power of 38.8% and 22.7%, respectively. In this study, the importance of job stress management and effective organizational communication was confirmed by showing that job stress and organizational communication are factors affecting the job satisfaction of rehabilitation and general ward nurses.",배인정,2023,https://www.riss.kr/link?id=A108548719
MZ세대를 중심으로 한 ‘Quiet Quitting’(조용한 사직)의특징과 개선 방안 연구,"A Study on the Characteristics and Improvement Plan of‘Quiet Quitting’ centered on the MZ GenerationJonghee Jeon

Abstract: The purpose of this study is to examine the main characteristics of ‘quiet quitting’, which is emerging around the MZ generation, and to find constructive improvement plans. All domestic newspaper articles on ‘quiet quitting’ were searched and all academic studies related to the MZ generation were investigated and converged. Domestic articles and academic data started on Sept. 27, and the final survey and update point was Oct. 11, 2022. After reviewing and organizing the data several times, the results of the investigation were reflected in the detailed topics and contents of the study. The characteristics of the MZ generation, the concept, characteristics, causes, and improvement plans of ‘quiet quitting’ were comprehensively presented. Based on the main contents of MZ generation and ‘quiet quitting’, improvement plans at the individual and organizational level were derived. Through this study, it will be possible to understand the phenomenon of ‘quiet quitting’ that is spreading throughout society and to identify ways to respond constructively.


Key Words: MZ Generation, Quiet Quitting, Work and Life Balance, Burnout, Hustle Culture",전종희,2022,https://www.riss.kr/link?id=A108408714
청소년의 긴장요인이 약물남용에 미치는 영향,"A Study on the Effect of Juvenile’s Strain on the Drug AbuseYujeong Choe & Sora Shin

Abstract: The purpose of this study is to analyze the effect of strain on drug abuse in juvenile and to propose preventive policies. According to the “White Paper on Drug-related Crimes (2021)” the total number of drug-related crime offenders decreased but the number of offenders under the age of 19 increased. These results shocked society by showing that ordinary citizens and teenagers are no exception to drug abuse crimes that have been recognized as exclusive to a specific group. The research method analyzed the factors of strain and drug abuse through logistic regression analysis in the survey data on juvenile drug behavior. In this study, the effect of the strain factors of juvenile experienced in daily activities on their drug abuse behavior was analyzed according to the GST. As a result, it was analyzed that the more juveniles who feel more stress and loneliness and have more experience of violent crime victimization, the higher the possibility of drug abuse. In order to prevent juvenile drug abuse, first of all, the subject of survey on drugs that were only targeting adults should be expanded to juvenile. For juvenile, drugs have already entered their daily lives, so simple preventive education on drug abuse is not enough. It is possible to cope only by knowing through what process they are exposed to drugs. In addition, juvenile should develop their ability to properly cope with strain in their daily lives.Therefore, various counseling programs such as personal counseling or group counseling, and activities other than subjects that can relieve strain should be prepared.




Key Words: Drug Abuse, Stress, Loneliness, Violence Crime Victimization, General Strain Theory",최유정,2022,https://www.riss.kr/link?id=A108395973
묻지마 범죄자들의 특성과 적절한 처우 집행을 위한 제언: 빅데이터 분석을 통한 대중적 인식을 중심으로,"If an offender has no correlation with a victim, holds no logical reason for the crime, and uses violence to unspecified individuals, he/she is generally defined as a random-crime offender.
Unpredictability of the crime and the degree of its damage is the reason for the fear of the random-crime. However, a definite definition of the random-crime has yet to be made and it still remains ambiguous. In this research, literatures of the random-crime are reviewed, and the perception of people on the random-crime is analyzed using the big-data analysis. Search terms related to the random crime on the online-news from 2013 to 2018 were collected through the crawling technique and analyzed by the R-studio. As the result, 'incident' and 'police' were the most frequently searched terms from 2013 to 2014; however, 'female' and 'incident' were the most frequently searched terms after 2016. From this data, it can be acknowledged that a term 'female' was not considered significant until the Gangnam-station homicide in 2016; and such rapidly increased attention on the element 'female' became a main factor of the random-crime in people's perception. However, generalizing the random-crime from a single case can generate obstacles in finding proper methods of rehabilitation and correction. Therefore, it is necessary to reform people's perception on the random-crime and establish suitable solution from the government.",이수정,2018,https://www.riss.kr/link?id=A105973851
사회부과적 완벽주의와 이상섭식 행동의 관계: 정서조절곤란과 경험회피의 순차매개 효과,"Relationship Between Socially Prescribed Perfectionism andDisordered Eating Behaviors: Emotion Dysregulation andExperiential Avoidance as Sequential MediatorsYeeun Kim & Changhyun Lee

Abstract: This study aimed to verify the sequential mediating effect of emotional dysregulation and experience avoidance in the relationship between socially imposed perfectionism and abnormal eating behavior. Questionnaires for socially imposed perfectionism, abnormal eating behavior, emotional dysregulation, and experience avoidance were administered to adult women and sequential mediating effects were confirmed through the Process Macro model 6. It is well known that socially imposed perfectionism affects abnormal eating behavior, but research on the path between the two variables is insufficient. Therefore, by identifying the path, it is possible to shed light on the psychological process by which people with eating problems. To this end, we tried to verify the sequential mediating effect of emotional dysregulation and experience avoidance in the relationship between socially imposed perfectionism and abnormal eating behavior. Based on the results of this study, psychological intervention for patients with abnoramal eating bahavior along with socially imposed perfectionaism is believed to be effective in clinical situation.


Key Words: Socially Prescribed Perfectionism, Disordered Eating Behaviors, Emotion Dysregulation, Experiential Avoidance, Sequential Dual Mediating Effect",김예은,2023,https://www.riss.kr/link?id=A108566611
국내외 ESG 사례를 통해 본 중소기업 ESG 경영 활성화 방안,"Purpose - This study is aim to stimulate ESG management of SMEs in Korea with SWOT analysis. Presently, ESG is also affecting a company’s supply chain and sales. We tried to make the complementary point of Korea SMEs through domestic and foreign cases. Design/methodology/approach - We divide foreign cases into three countries, and in Korea, also divide into three groups of government, major companies, SMEs to conduct SWOT analysis. Findings - We confirmed that ESG activities were delayed in Korea compared to overseas, but the government and major companies were responding quickly. However, SMEs are complaining of difficulties in ESG activities due to cost issues and limited information. Nevertheless, some SMEs companies show the possibility by carrying out ESG activities based on their own strengths. Research implications or Originality - We suggested the need for SMEs’ ESG management. The SMEs are inevitably vulnerable to ESG management compared to other groups. Therefore, We suggested the direction of SMEs ESG management expansion, that are R&D and distribution of eco-friendly activities through collaboration with universities(E), social program to improve working places(S), and expansion of governance that guarantees autonomy(G).",임형철(Hyung-Chul Lim),2021,https://www.riss.kr/link?id=A107983116
"지각된 간호대학생의 낙상에 대한 태도, 낙상예방의도 및 낙상예방자기효능감이 낙상예방활동에 미치는 영향","Effects of Perceived Nursing College Students’ AttitudeToward Falls, Fall Prevention Intention, and Fall PreventionSelf-efficacy on Fall Prevention ActivitiesImsun Lee & Jaewoo Oh

Abstract: This study was attempted to grasp the attitude toward fall, fall prevention intention, fall prevention self-efficacy, and fall prevention activities for nursing college students. The data collection period is from Oct. 15, 2021 to Nov. 30, 2021, and a survey was conducted on 131 nursing college students in G and D cities. The collected data was statistically analyzed using the SPSS WIN 22.0 program. As a result of the study, the factor that influenced the fall prevention activity of nursing college students who experienced clinical practice was the fall prevention self-efficacy (β=.365, p<.001), Fall Prevention Intention (β=.327, p<.001), Attitude to Fall (β=.222, p=.003) were shown in order, and the explanatory power of these factors was confirmed to be 59.3%. Based on this study, it is necessary to develop differentiated educational programs reflecting clinical sites and seek continuous and systematic operation plans in order to perform fall prevention activities well by enhancing nursing college students’ attitude toward fall, fall prevention intention, and fall prevention self-efficacy.


Key Words: Nursing Students, Fall Prevention, Attitude, Intention, Self-efficacy",이임선,2022,https://www.riss.kr/link?id=A108110540
"같지만 다른 그들, 청년: 성별 자살생각과 자살시도 영향요인의 탐색 연구","The purpose of this study is to provide basic data for an effective suicide prevention policy among young people. This study is an exploratory research study conducted to examine the difference between suicidal ideation and suicide attempt according to factors such as socioeconomic characteristics, health characteristics, psychosocial factors, and family factors. A survey was conducted by stratifying 1,012 young people aged 20-39 across the country, and descriptive statistical analysis and logistic regression analysis were performed. The results show that 42.1% of the study subjects had suicidal ideation and 5.6% had attempted suicide. The factors affecting suicidal ideation and suicide attempts were different by gender. Men had a higher risk of suicidal ideation when they had lower levels of education, subjective health status, sleep quality, and family strength (economic stability and cooperation) and higher levels of perceived burdensomeness and thwarted belongingness. The higher depressive symptoms increased suicidal ideation in women. The factors influencing suicide attempts in men were high income, high depressive symptoms, and low family strength (caring about the community). In the case of women, unemployment, high subjective economic status, high depressive symptoms, and high social trust were influencing factors. For effective suicide prevention policy among young people, it is necessary to subdivide and specify the policy according to the characteristics of those people. In particular, the factors that cause people to respond differently to suicidal ideation and attempt should be closely identified, and it is necessary to understand the distribution of factors influencing gender and the patterns that appear due to differences in sensitivity.",강지원,2023,https://www.riss.kr/link?id=A108548714
