
농촌 치유관광객의 라이프스타일과 추구편익의 관계,"This study aims to investigate relationships between lifestyle and benefit sought of rural healing tourists. For data collection, a total of 3,000 copies of questionnaires were collected by nationwide online survey. The data were analyzed by using SPSS 26.0. The factor analysis identified seven dimensions of the lifestyle : conservative, sports activity orientation, health orientation, consumption orientation, achievement orientation, adventure orientation, and personal orientation. Five dimensions of benefit sought were identified as psychological recovery, outdoor activities, rest, rural experience, and exercise. The results of the canonical correlation analysis indicated that adventure orientation of lifestyle and psychological recovery, outdoor activities, rural experience, exercise of benefit sought were highly correlated. This means it is important to place an emphasis on psychological recovery, outdoor activities, rural experience, and exercise for tourists looking for an adventure away from everyday life. Rural healing tourism marketers should consider lifestyle aspects as the most important factors affecting benefit sought of rural healing tourism.",김경희,2022,https://www.riss.kr/link?id=A108059420
주요 생태계 교란 외래식물의 생리활성 비교 평가 및 유효성분,"To evaluate functional biomaterials of 5 invasive alien plants, total polyphenol and flavonoid contents, antioxidant activity, anti-inflammatory activity, and antibacterial effect were measured. The total polyphenol and flavonoid contents of the extracts were in the order of Rumex acetosella L. > Hypochaeris radicata L. ≥ Lactuca scariola L. > Humulus japonicus Siebold & Zucc. ≥ Solanum viarum Dunal. The DPPH and ABTS radical scavenging activities of the extract were the highest in R. acetosella and correlated well with the total polyphenol contents. In RAW 264.7 cells stimulated with lipopolysaccharide (LPS), nitric oxide (NO) and prostaglandin E<sub>2</sub> (PGE<sub>2</sub>) production inhibitory effect of the extracts (100 ㎍ SE/mL) were 20~60% and 10~70%, respectively, showing the highest inhibitory effect in R. acetocella. The extracts of R. acetosella, H. japonicus and S. viarum showed antibacterial activity against food poisoning-causing microorganisms such as Bacillus subtilis, Escherichia coli, Vibrio parahaemolyticus and Vibrio vulnificus. Furthermore, the H. japonicus extract was found to have effective antibacterial activity against oral microorganisms such as Enterococcus faecalis, Lacticaseibacillus casei, Rothia dentocariosa, Staphylococcus epidermidis and Streptococcus mutans, and its major active ingredients were predicted to be pentadecylic acid, palmitic acid and clionasterol. These results suggest that alien plants have potential as biomaterials with antioxidant, anti-inflammation and antibacterial effects.",김소진,2023,https://www.riss.kr/link?id=A100284290
농촌체험휴양마을 운영관리 평가 및 유형화 - 양평 농촌체험휴양마을을 사례로 -,"This study aims to understand why the sales volume and the number of visitors are different in each rural tourism village. The study considered that the management and operation of rural tourism villages is one of the major influencing factors. To prove this, the study determined what factors were related to the management and operation of villages and derived detailed items to evaluate them. In the study, the researchers conducted an in-depth interview and a literature review on the management and operation of rural tourism villages in Yangpyeong-gun. They also performed a case study on the Sumi village, one of the successfully managed and operated villages in Yangpyeong-gun, to determine the detailed items. As a result, seven factors were identified. These factors comprise operation entity, governance, shared vision, leadership, efficient role-playing, marketing efforts, and equity in profit distribution. Based on these seven factors, 85 of the evaluation items were developed. The management and operation scores of 85 items were measured and summed for each of the 21 rural tourism villages. First, 21 villages were divided into two groups by the sales figures to derive items to determine the difference in the mean value of the evaluation scores. Second, an independent sample t-test was conducted for each village at YangPyeong-gun. Third, the study divided the 21 villages into four groups using 46 evaluation items. Finally, the study’s researchers clarified some challenges to solve and appropriate management and operation plans considering each type of rural tourism village.",이동윤 ( Yi Dong-yoon ),2021,https://www.riss.kr/link?id=A107781982
1인 가구의 배달.테이크아웃 식품 소비결정요인 분석,"This study conducts a Heckman’s two-stage sample selection model in order to analyze factors which determine the consumption of delivery and take-out foods of single-person household using the Consumer Behavior Survey for Food in 2018. The results has shown that the higher the age, the more frequent the purchasing HMR, the single-person household consumers’ intention of purchasing the delivery and take-out foods are higher. On the other hand, the more frequently the eating alone, the purchase intention is lower. Furthermore, the purchase amount on the delivery and take-out foods of the consumers who are more likely to use SNS, and who are more likely to use recommended information from their acquaintance or internet is higher than the others who do not use. Lastly, the purchase intention of the single-person household consumers towards the delivery and take-out foods increased when they have more quality-oriented consumption behavior, more convenience-oriented consumption behavior, and less health-oriented consumption behavior.","강형준(Kang, Hyung Jun)",2020,https://www.riss.kr/link?id=A100392075
곤충을 이용한 치유농업의 심리치유효과－호랑나비 사례－,"The study aims to examine the psychological effects of insect-based experience activities. A sample of 167 elementary students was hired for the study. Students in the experimental group participated in insect-based experience activities using swallowtail butterfly. Collected data are analyzed with analysis of variance and paired-sample T-test in SPSS 25.0. The results of this study are as follows 1) Insect based experience activities show positive effects in psychological and physiological aspects, 2) and students and teacher showed high satisfaction in insect-based program. In conclusion, this study contributes to providing fundamental information for the development of agro-healing programs using insect and design guidelines for identifying the characteristics of each healing program. Further research should be extended to different types of student and the development of diverse insect-based activities.",김소윤,2019,https://www.riss.kr/link?id=A3273295
간장발효에 관여하는 효모에 관한 연구(제4보),"The cultural conditions of the osmophilic yeasts for higher concentration of NaCl selected in the previous report were examined and the results obtained were as follows.
1) The strain T₃ and T_8 were grown exceedingly well on the media containing 15 percent of NaCl and T_5, T_9, T_(10) and T_(11) on the media containing 5 percent of NaCl.
2) The optimum temperature for growth of the strain T₃and T_5 was 30℃, T_8 T_(10) and T_(11) was 25℃ and T_9 was 35℃.
3) Their lethal temperature was 60℃ (treatment for 10 minutes).
4) The optimum pH for growth of the strain T₃ and T_8 was pH 4.0, T_5 was pH 6.0 and T_9, T_(10) and T_(11) was pH 5.0, respectively.",이택수,1970,https://www.riss.kr/link?id=A107746374
농촌지역 빈집 실태에 따른 등급화 지표 도출에 관한 연구,"The purpose of this study attempted to derive an index that can grade the standard empty house in consideration of the physical status and the level of harmfulness of empty houses. To this end, we tried to analyze gradable indicators through the analysis of specific empty house guidelines in Japan, which are experiencing similar problems with us, and to verify indicators and increase the objectivity of data through field surveys. Existing prior data lacked research on rural areas, and specific empty house guidelines in Japan were revised to suit the current status of local governments in rural areas, not rural areas, and analyzed to derive indicators suitable for rural areas in Korea. During the field survey in rural areas, Japanese indicators derived were verified to be applied to rural areas, and indicators that could be added to the rating evaluation of vacant houses were also discovered.",김용균 ( Kim Yong-gyun ),2023,https://www.riss.kr/link?id=A106057397
