
"상추 유전자원의 원산지, 형태 및 엽색별 Bitter Sesquiterpene Lactones의 변이","Lettuce (Lactuca sativa L.) is one of the most important leafy vegetables in the world due to its health related benefits. Bitter sesquiterpene lactones (BSLs) are crucial secondary metabolites of lettuce which are useful in many physiological activities, and also has been used to relieve pain. This study was conducted to appraise the variability of phenotypic characteristics and the total content of BSLs in fifty lettuce germplasm. The germplasm collections exhibited wide variation in both qualitative and quantitative characters. The average plant weight was 333.3 g with a range from 60.0 to 700.0 g and the lactucin content was varied from 3.4 (IT265031) to 448.6 (IT300287) μg/g DW with an average concentration of 94.0 μg/g DW. Whereas lactucopicrin ranged from 6.8 (IT217859) to 2,714.9 (Superseonpung) μg/g DW with an average concentration of 805.8 μg/g DW. Total BSLs content was ranged from 19.6 (IT217859) to 2,821.9 (Superseonpung) μg/g DW with the average concentration of 899.8 μg/g DW. Significant (p≤0.05) differences in lactucin, lactucopicrin and total BSLs content were found among the germplasm collections. Leafy type lettuce germplasm collections originated from South Korea revealed the highest average total BSLs content (2,821.9 μg/g DW). Principal component analyses of lactucin and lactucopicrin generated based on leaf color and plant growth type yielded two principal components, PC1 and PC2, which accounted for 60.8 and 39.2 % of the total variance, respectively. Our study provides fundamental insights on phenotypic characteristics and the total content of lactucin and lactucopicrin of lettuce germplasm which may further help researchers and breeders to produce improved lettuce varieties.",최수산나,2018,https://www.riss.kr/link?id=A100393518
계획행동이론을 적용한 하동지역 농업유산관광객의 행동의도 - 농업유산에 대한 지각된 가치와 사전적 지식의 역할을 중심으로 -,"The study aims to predict the behavior of tourists in Hadong County, which is registered as KIAHS. Based on the theory of planning behavior, we intend to verify the theory of planned behaviour, which adds descriptive parameters of the perceived value and prior knowledge of an agricultural heritage. In detail, first, the perceived value and prior knowledge of tourists about an agricultural heritage understand the influence of tourists' Attitude. Second, we could see the role of the behavioral factors in the causal relationship of the planned behavioral theory. We have identified the planned behavioral theory that attitudes, subjective norms, and perceptual behavior controls affect the intention of the revisit. Hadong should remember that by sending and providing various information about Hadong Green Tea and World Agricultural Heritage sites, it is possible to elicit changes in visitor attitudes and revisit visits.",김현지,2018,https://www.riss.kr/link?id=A101742700
도보여행길과 연계한 농촌마을 활성화 방안에 관한 연구,"In recent years, the number of walking-tourists who visit Jeju olle trail are increasing every year and the ripple effect is a rapid change on the roles and leadership of local people in rural villages. The reason for the change is that most Jeju Olle Trails cuts through the rural village in Jeju island. However, most of travelers just walked along the trails, no one was interested about villages along the Olle roads. For these reasons, many rural villages would not get any benefits such as non-farm income, sales profit and also can not activate the facility of village and infrastructure. Therefore, we study on Revitalization Method for rural villages through the Analysis of characteristics of tourist in Jeju Olle Trails and a field survey research too. In this process, we investigated the status and characteristics of the rural villages of Jeju island in the first step. Then, we considered the distinct characteristics and factors for improving of the 10 places with site investigation where were recommended by Jeju Olle Corporation and Jeju Agricultural Technology Center in second step. Lastly, we arranged the resident's requirement and result of survey and interview with leaders of rural village. As a result, we suggest the activation methods for residents and leaders of rural area and this study is also expected to help management of rural villages and also is an important study to improve importance of utilizing of more people visiting in Jeju Olle Trails.",임창수,2013,https://www.riss.kr/link?id=A100392198
유전자변형작물 안전성평가를 위한 영양성분 비교연구 동향,"Approvals for cultivation and import of genetically modified (GM) crops have dramatically increased around the world. Comparative compositional studies are an important aspect of safety assessments of products from GM crops and are based on substantial equivalence. Compositional analyses focus on determining similarities and differences between the compositions of the GM crops and their conventional counterparts, and thereby assessing the compositional equivalence of GM crops and their conventional comparators. The analytes, such as major constituents, key nutrients, and antinutrients, are generally determined on a crop-specific basis according to the OECD consensus document. The use of standard methods throughout the processes, such as selection of comparators, field trials, analytical methods, and statistical data analysis, is crucial. In this study, we showed the general framework of compositional studies. Literature for compositional studies of GM crops conducted abroad and in Korea was reviewed to obtain information about analytes, conventional counterparts, cultivation year, location, and statistical methods. The studies conducted abroad assessed for commercial release of GM crops such as soybean, maize, and cotton, while domestic studies were mainly performed for research in rice. In addition, we suggested a guidance for conventional comparators and field trials applicable to the domestic situation.",김은하,2020,https://www.riss.kr/link?id=A108531389
금화규(Abelmoschus manihot) 뿌리 추출물의 면역증진 및 항비만효과,"In this study, we investigated in vitro immune-enhancing and anti-obesity activity of Abelmoschus manihot roots (AMR) in mouse macrophage RAW264.7 cells and mouse adipocytes 3T3-L1 cells. AMR increased the production of immunostimulatory factors such as nitric oxide (NO), inducible nitric oxide synthase (iNOS), interleukin-1β (IL-1β), interleukin-6 (IL-6) and tumor necrosis factor-α (TNF-α) in RAW264.7 cells. The inhibition of toll like receptor (TLR) 2 and 4 blocked AMR-mediated production of immunostimulatory factors in RAW264.7 cells. In addition, the inhibition of mitogen-activated protein kinases (MAPKs) signaling pathway reduced AMR-mediated production of immunostimulatory factors. From these results, AMR is considered to have immune-enhancing activity through TLR2/4-mediated activation of MAPKs signaling pathway. In addition, AMR inhibited lipid accumulation and reduced the protein level such as CCAAT enhancer-binding protein alpha (CEBPα), peroxisome proliferator-activated receptor gamma (PPARγ), perilipin-1, adiponectin and fatty acid binding protein 4 (FABP4) associated with lipid accumulation in 3T3-L1 cells, indicating that AMR may have anti-obesity activity. Based on these results, AMR is expected to be used as a potential functional agent for immune enhancement and anti-obesity.",유주형(Ju Hyeong Yu),2021,https://www.riss.kr/link?id=A102140797
고라니 사체 부패 진행에 따른 시식성 곤충 다양성에 관한 연구,"Forensic entomology is a study that purposes at field reconstruction through insects attracted to carcasses, and has been mainly studied using carcasses such as a pig and chicken. Therefore, this study was conducted to find out if there is a singularity by using the carcass of water deer with different conditions and shapes of the hair quality and to find out the appearance of a necrophagous insect.
The water deer carcass was received from the Jeollanam-do Wildlife Rescue Management Center and research was conducted. From May 19 2021 to July 2 2021, the decay progress of the carcass was observed for about 6 weeks. A total of 51 species of 21 families in 4 orders of insects were collected. Even after the carcass completely decays, even at the stage where the activity of other insects is not observed, insects such as Dermestidae and Tenebrionidae are collected from the hairs and leather of water deer carcass until the last. It was confirmed that insects of the order Coleoptera other than Diptera can be used as forensic entomological data related to the decay of carcasses with fur",윤주혁,2022,https://www.riss.kr/link?id=A105608995
펫푸드(반려동물 식품) 선택속성에 대한 소비자 특성 분석,"This study aims to examine consumer types based on pet food selection attributes and to analyze the differences in consumer characteristics by those types. In this study, the researcher uses k-means cluster analysis and crossover analysis to determine market segmention, and then analyzes the resultant characteristics by categorizing consumers. A total of 202 cases are used for this study. First, the selection attributes are classified into the six factors of credibility, quality, design, convenience, information, and price. Second, the clusters are categorized into the four clusters, which are designated pet food lower-involvement type, pet food information- and price-seeking type, pet food convenience-seeking type, and pet food higher-involvement type. Third, these four groups exhibit statistically significant differences in terms of occupational variables, number of pets, and purchase frequency. The results of this study may provide helpful information in establishing customized, market-based marketing strategies based on the characteristics of pet food consumers.",박명은(Myeong-Eun Park),2021,https://www.riss.kr/link?id=A100403253
일제하 양배수장형 수리조합에서의 양수기술과 단위용·배수량의 변천 (리뷰 논문),"The purpose of this study is to investigate transition of pumping technology, irrigation water requirement, and unit area drainage discharge at the Pumping station-based Irrigation Associations (PIAs) in South Korea during Japanese colonial period (1910-1945). The PIAs established pumping stations and embankments along rivers for the purpose of irrigation, drainage and flood prevention until the mid-1920s. From the late 1920s after major river improvement projects, newly established PIAs did not include the flood prevention in their purpose of establishment. The design criteria of the irrigation and drainage projects, such as irrigation water requirements, design rainfall, and allowable ponding duration were decided according to the circumstances of PIAs. The gross irrigation water requirement of paddy fields increased from the 1920s to the 1940s, and reached the level of 0.0020 m<sup>3</sup>/s/ha (19 mm/d) in the 1940s for the fairly good irrigation status in the drought. The great floods of 1930, 1933, and 1934 triggered the increase in drainage discharge in the late 1930s, leading to the unit area drainage discharge of 0.9-2.6 m<sup>3</sup>/s/km<sup>2</sup> for natural drainage and 0.3-1.1 m<sup>3</sup>/s/km<sup>2</sup> for pump drainage. Therefore, several PIAs near the major rivers could avoid repetitive floods damage.",김진수 ( Kim Jin Soo ),2021,https://www.riss.kr/link?id=A107254226
기후변화 시나리오에 근거한 과수 개화기 변화 및 개화 후 저온 발생 전망,"In the spring of 2018, opened-flowers of fruit trees were frozen to death due to abnormal low temperature around Jeonbuk Province and southern Gyeonggi Province areas. In the 2000s, abnormal weather is observed all over the world very frequently. As a consequence, various sectors of the society suffer from economic damage and negative effects of the abnormal weather. Moreover, recent global climate change is believed to increase the incidence of extreme weathers, which are out of the normal range of the local climate. It is necessary to identify these abnormal weather phenomena accurately and analyze the effects of them on crops in order to understand the effects of them on crop yields. This study projected the trend of the low-temperature occurrence in the future by predicting the changes in future flowering dates and quantifying the temperature distribution after flowering using climate change scenarios. This study targeted areas actually producing a major portion of pear, peach, and apple in South Korea. The results of this study predicted that the flowering dates of these fruits will be approximately 20 days earlier than the current normal year in the future (2071-2100) for the study area. Moreover, it was found that the distribution of low temperature would vary by fruit type and region to some degree. The results of this study present only a portion of fruit trees cultivars grown in South Korea. It was expected that, when this approach is applied to various crops and fruit trees, it will be possible to contribute to preparing countermeasures for climate change in the agricultural sector.",김대준,2018,https://www.riss.kr/link?id=A105387837
물리적 처리조건 변화에 따른 아로니아(Aronia melancocarpa) 유래 안토시아닌 함량변화 특성,"The purpose of this study was to obtain basic data for using Aronia as a functional food material. The composition of anthocyanin was characterized and quantitated by LC-MS/MS, HPLC, and UV-VIS spectrophotometer techniques, respectively. The anthocyanin content was analyzed by temperature, time, pH, and the addition of citric acid. The UV-VIS spectrophotometer used for analysis of anthocyanin is less accurate than the LC-MS/MS method used in recent years. In the past, cyanidin-3-Glucoside was reported to be a major anthocyanin that contains Aronia. However, LC-MS/MS analysis in this study confirmed cyanidin-3-galactoside to be the major compound. The anthocyanin content of the Aronia powder began to decrease sharply at a temperature of 65 ℃ or higher when heated for 24 hours. In an aqueous solution of Aronia, the anthocyanin content was reduced by 50% at 65 ℃ for 10 hours and decreased by 85% at 85 ℃ within 10 hours. Above pH 8, the anthocyanin content was reduced by more than 50%. The results of this study will provide useful information to maintain anthocyanin content in the manufacturing process of Aronia. It could also be used to ensure the stability of anthocyanins in similar species of berries.",김보미,2017,https://www.riss.kr/link?id=A107946606
식량자급률은 식량안보를 강화시키는가?,"The concept of food security has gained increasing attention in the recent ten years. The Food and Agriculture Organization (FAO) defines that food security exists when all people can access food needed for a healthy and active life at all times. Achieving food security means the situation where sufficient food is available, food supply is relatively stable, and those in need of food can afford food at a reasonable cost. However, there are conflicting opinions about how to achieve food security. Agricultural exporting countries insist that the diversification of food sources and domestic self-reliance as well contributes to enhancing food security. On the other hand, agricultural importing countries emphasize food self-sufficiency for major crops, especially after experiencing the major food crises across the globe during the agflation period between 2006 and 2011.
This study investigates whether domestic agricultural production contributes to strengthening food security. Using the panel data for food self-sufficiency rate, we analyzed domestic grain price and food riots, the effect of domestic food production on food security or the probability of food riots. The results show that the increase in food self-sufficiency strengthens food security and reduces the probability of food riots, while lower import tariffs do not.",김태화,2019,https://www.riss.kr/link?id=A107946426
유청단백질의 분리 및 단백질 분해 효소에 의한 유청단백질의 가수분해 양상,"The aim of this study was to introduce a simple method for isolation of α-lactalbumin, β-lactoglobulin and bovine serum albumin from cow’s milk, and peptides produced by enzymatic hydrolysis of α-lactalbumin, β-lactoglobulin and bovine serum albumin with alcalase. Whey protein were precipitated from whey by ammonium sulfate and, α-lactalbumin and β-lactoglobulin were isolated using Hi Prep 26/60 Sephacryl S-100 column gel filtration chromatography. Bovine serum albumin and β-lactoglobulin were isolated by Mono-Q 5/50 GL column anion exchange chromatography of the 50% Ammonium Sulfate-supernatant. Isolated whey proteins were hydrolyzed by proteolytic alcalase. Tricine SDS-PAGE and reverse-phase HPLC analyses revealed that almost hydrolyzed all the α-lactalbumin, β-lactoglobulin and bovine serum albumin with alcalase. Molecular weight of various peptides derived from alcalase hydrolysate were small molecular weight than 3.5 kDa.",렌친핸드(Renchinkhand),2012,https://www.riss.kr/link?id=A108059418
세종시 남부일대의 관속식물상 연구,"The flora of Sejong were summarized as 531 taxa including 104 families, 315 genera, 462 species, 3 subspecies, 59 varieties and 7 form. The rare plants were 8 taxa including Nepeta cataria L. and Aristolochia ontorta Bunge. The Korea endemic plants were 9 taxa including Populus tomentiglandulosa T. B. Le and Clematis trichotoma Nakai.. The specific plants were 42 taxa including Phytolacca esculenta Van Houtte(Ⅴ), Corydalis decumbens (Thunb.) Pers(Ⅳ), Poncirus trifoliata Raf(Ⅲ), Pseudostellaria coreana (Nakai) Ohwi(Ⅱ), Cyrtomium fortunei J.Sm.(Ⅰ). The naturalized plants were 49 taxa including Sicyos angulatus L, Ambrosia trifida L, Physalis angulata L. Panicum dichotomiflorum Michx., Galinsoga parviflora Cav, and Erigeron philadelphicus L. Especially, Sicyos angulatus L., Phytolacca americana L. and Bidens frondosa L. have been spread throughout the country are required to manage. The naturalized index(NI) and urbanized index(UI) were 8.7% and 15.3%. Useful plants incuding Edible was 199 taxa, Pasture was 193 taxa, Medicinal was 178 taxa, Ornamental was 82 taxa, Timber was 25 taxa, Fiber was 18 taxa, Stain was 9 taxa. Useful plants will be important materials for plant design in recreational and healing forests.",성정원,2020,https://www.riss.kr/link?id=A100169480
"학교 식생활 교육이 청소년의 과일, 채소 섭취에 미치는 영향 분석","In 2010, the Korean government implemented a school dietary education policy to improve people’s dietary habits. This policy included dietary education for adolescents in school. However, its effect on adolescents’ eating habits is unclear. The objective of this study is to examine the effect of school dietary education on adolescents’ fruit and vegetable consumption. We used the thirteenth Korea Youth Risk Behavior Web-based Survey in 2017. Also, we used the Matching Frontier Method to control the selection bias. The results suggest that school dietary education makes a positive impact on adolescents’ daily consumption of fruits and vegetables recommended. Consuming at least a fruit a day is likely to increase by 2.2%p-4.0%p and consuming vegetables at least three times a day is likely to increase by 1.5%p-2.8%p. These results imply that school dietary education is an effective policy to develop healthy eating habits among adolescents.",연광훈,2019,https://www.riss.kr/link?id=A105664699
동물복지 인증 계란에 대한 소비자 선호,"This study estimates consumers’ willingness to pay for several eggs attributes, with primary focus on animal welfare. A nationwide online survey of 1,000 consumers was conducted to determine consumers’ preferences for animal welfare certification and identify perceptions of animal welfare claims and certifications factors affecting consumers’ willingness to pay by using the mixed logit model. The results from a choice experiment indicate that consumers place significant value on animal welfare certification, package size, expiration date and prices. We find a high degree of heterogeneity in willingness to pay for free-range and cage-free eggs. The mean premium for free-range eggs and cage-free eggs are 2,672KRW and 1,862KRW per 10 eggs, respectively. Our results also indicate that consumer perceptions of animal welfare and certification are associated with a willingness to pay. Results suggest there is potential for increasing the market share for animal welfare certified eggs.",장재봉,2022,https://www.riss.kr/link?id=A107793059
농업인 교육 패널자료를 활용한 농업 인적자원 개발 투자에 대한 성과분석,"This paper aimed to analyze the performance of agricultural human resource development investment using agricultural education panel data. It reviewed previous studies related to Human resource development investment. It examined the performance of human resource development investment and tested the performance with the Structural Equation Modeling(SEM) using AMOS21.0.
The major results of this paper are as follows: Investment in human resource development for farmers had a positive effect on the achievement of human resources such as improving job skills and job satisfaction of farmers. In particular, investments in human resource development for farmers had a more significant impact on human performance than income performance, and the same research results were obtained for regular companies. Also, human performance had a positive effect on agricultural performance and income performance, which was analyzed to have a more positive effect on agricultural performance than income performance.",김상태,2019,https://www.riss.kr/link?id=A107936613
"Antioxidant Properties of Green Tea, Oolong Tea, Black Tea and Pu-erh Tea","The antioxidant properties of green tea, oolong tea, black tea and pu-erh tea were studied using DPPH,
ABTS and ORAC assays. Green tea had the strongest antioxidant capacities: 201.504 mg trolox/g for DPPH, 676.117
mg trolox/g for ABTS and 1215.029 mg trolox/g for ORAC. For DPPH and ABTS assays, the kinetics of different teas
fitted well with second-order exponential decay equations, and single electron transfer reaction was the major reaction process. For ORAC assay, the decay of fluorescence intensity was accurately predicted by Boltzmann sigmoidal equation, and hydrogen atom transfer reaction was the principal reaction. The antioxidant capacities measured by DPPH, ABTS and ORAC assays were positively correlated to the total phenolics contents in teas, among which (-)-epigallocatechin gallate (EGCg) and (-)-epicatechin (EC) had the highest correlation coefficients with the antioxidant capacities of teas.",Jian-Hui Ye,2015,https://www.riss.kr/link?id=A107218415
형질전환 식물세포배양을 이용한 바이오의약품 생산,"Transgenic plant cell cultures for the production of biopharmaceuticals including monoclonal antibodies, recombinant proteins have been regarded as an alternative platform in addition to traditional microbial fermentation and mammalian cell cultures. Plant-made pharmaceuticals (PMPs) have several advantages such as safety, cost-effectiveness, scalability and possibility of complex post-translational modifications. Increasing demand for the quantity and diversity of pharmaceutical proteins may accelerate the industrialization of PMP technology. Up to date, there is no plant-made recombinant protein approved by USFDA (Food and Drug Administration) for human therapeutic uses due to the technological bottlenecks of low expression level and slight differences in glycosylation. Regarding expression levels, it is possible to improve the productivity by using stronger promoter and optimizing culture processes. In terms of glycosylation, humanization has been attempted in many ways to reduce immune responses and to enhance the efficacy as well as stability. In this review article, all these respects of transgenic plant cell cultures were summarized. In addition, we also discuss the general characteristics of plant cell suspension cultures related with bioreactor design and operation to achieve high productivity in large scale which could be a key to successful commercialization of PMPs.",권준영,2009,https://www.riss.kr/link?id=A108033605
생명공학 벤트그라스 개발,"Creeping bentgrass (Agrostis stolonifera L.) is economically important as the principal turfgrass species for golf course greens and fairways in temperate climates around the world. As the utilization area of the turfgrass species increases recently, the demand for new and improved cultivars increases. Thus, substantial progress has been made in applying modern biotechnology to develop genetically engineered (i.e., biotech) creeping bentgrass with new traits that eluded the breeders. This review article addresses the advances made in developing biotech creeping bentgrass, which are categorized in the following topics: (i) genetic transformation of creeping bentgrass, (ii) development of various biotech creeping bentgrasses by genetic engineering, and (iii) progresses in the deregulation of herbicide-resistant creeping bentgrass.",황옥진,2009,https://www.riss.kr/link?id=A107891098
