
병동 간호사의 임상등급 간호역량 평가도구 개발,"본 연구는 병동 간호사의 간호역량 평가도구 개발을 위해 문헌고찰과 간호대학 교수, 임상간호 전문가에 의한 내용타당도검증, 병동 간호사 대상의 설문지 조사, 임상등급 4등급 간호사 대상의 자가평가 과정을 통해 이루어진 방법론적 연구이다.연구의 개념적 기틀은 Carper[19]가 제시한 간호지식의 4가지 유형 모델을 기반으로 한 Jang[1]의 간호역량 모형을 근거로 4개 영역, 13개의 간호역량 요소, 30개의 핵심간호역량 요소 목록과 4개 임상등급별 간호역량수행 평가기준으로 적합한 항목을 선정하였다.4가지 간호지식의 유형에는 과학적, 윤리적, 인격적, 심미적 간호영역이 포함되어 있다. 과학적 간호역량이란 ‘경험과학적 지식을 바탕으로 상황을 객관적으로 파악하는데 도움을 주며 간호실무의 전문성과 효율성을 확보하고 간호지식을 체계화하는데 도움이 되는 역량이므로[1] 본 연구에서는 간호사에게 필요한 중요 핵심역량 영역인 간호전문 영역을 포함하였다.둘째, 심미적 간호역량은 ‘의식적인 심사숙고 없이도 즉각적으로 그 순간에 해야 할 일이 무엇인지 알고, 직면한 상황의 의미를 알고 해결할 수 있는 능력’으로 정의되어[1] ‘임상적 판단과 대처’에 포함되었던 개념 중 ‘조기 대처와 위기관리’를‘위기관리’로 수정하였다. 또한 ‘환자이해’와 ‘환자 지향성’에 관한 간호역량의 내용이 유사하여 이를 ‘환자 지향성’으로 통합하였고 ‘타인육성’ 역량에는 환자, 가족, 동료 및 기타 사람들을 지도 교육하고 발전시키는 것으로 ‘교육 및 상담’으로 수정하였다. 국외 의료기관의 경우 2000년 이전에는 4~6개 영역으로 구분하였고[15], 2003년 이후 주로 4개 영역으로 분류됐다[9,22]. 국내 병원은 대부분 4개 영역으로 분류하여 적용하고 있으며 본 연구에서도 4개 영역으로 분류하였다. 기관별로 영역에 대한 차이가 있는 것은 그 기관의 미션과 비전에 따라 목표와 핵심가치가 다르기 때문인 것으로 여겨진다[21]본 연구에서의 임상등급은 Benner[7]의 기술 습득 모형을수정 . 보완하여 1등급은 초보 등급(입사~1년), 2등급은 상급초보 등급(2~3년), 3등급은 유능 등급(4~6년), 4등급은 숙련등급(7년 이상)으로 구성하였다. 임상등급을 활용한 최초의 사례는 캘리포니아 대학 의료기관에서 간호사들의 임상적 능력, 지식 및 성과에 따라 보상받을 수 있는 임상경력시스템(Clinical ladder system)으로 간호역량에 따라 4개 등급의실무 수준을 개발한 것이다[23]. 임상등급 기준은 임상경력 기간 뿐 만 아니라 등급이 높아질수록 간호사의 업무능력이 향상되고 전문성 개발을 위한 연구 및 교육에 시간과 노력을 기울이며 문제해결 능력, 부서 간 협력 및 대인관계에서 발전된 수준을 기대할 있다[24,25]. 이와 같이 4개의 임상등급으로 구분한 것은 국내 Kim[25]의 연구에서도 타당하게 받아들여졌고 현재 경력개발제도를 운영하고 있는 국내 병원에서도 대부분 4개의 임상등급을 적용하고 있는 실정이다[23].본 연구에서는 간호역량 평가 예비문항 구성에서 간호사의 핵심역량과 중요도 인식 정도가 높은 문항을 우선적으로 반영 하였고 근무 부서 특성을 고려하여 병동에서 중요도가 높은128개 예비문항을 구성하였다. 13개의 간호역량 요소를 정의한 후 각 역량 요소에 따른 핵심간호역량을 결정하였으며 임상등급별로 수행평가 기준을 차별화하여 기술하였다.간호역량 중환자에게 직접 제공되는 부분을 간호전문분야로 정의하였고 환자와 공감하는 부분은 환자에게 서비스를 제공하는 것으로 정의하여 ‘환자지향성’으로, ‘기타 사람들을 지도, 교육하는 것’을 ‘교육 및 상담’으로 정의하였다. Choi와Eun[26]은 수술실의 특징을 반영하여 ‘환자 이해’와 ‘대상자 지향성’을 제외하고 ‘안전관리’를 포함하여 12개의 간호역량을 개발하였다. 또한 Liu 등[15]의 연구결과 도출된 ‘지도력,간호행위, 인간관계, 윤리적 활동, 교육, 전문성 개발 노력, 비판적 사고, 연구 경향’은 본 연구의 ‘간호전문 영역, 전문성 개발 노력, 병동업무 처리력, 윤리적 가치 지향성, 자기조절, 유연성, 교육 및 상담’과 유사한 영역으로 나타났다. Kang 등[17]은 일반병동 간호사의 간호역량을 9개로 구분하고 70개 문항으로 평가도구를 개발하였다. 9개 영역에서 본 연구와 유사한 영역은 ‘자원관리와 전문성 개발 노력, 병동업무 처리력,간호과정 적용력, 위기관리, 환자 지향성’이고 비판적 사고와 도덕적 의무, 인격적 배려 부분은 본 연구와 차이를 보였다.임상등급별 간호역량 평가문항 선정에서 128개 예비문항중 8개 문항이 삭제되었다. 이는 생리적 적응 증진, 측정 및 검사 부분의 중요도 인식이 다른 항목에 비해 낮고 내용이 중복 되었기 때문이다.최종 개발된 임상등급별 간호역량 평가도구를 임상등급 4등급 간호사 전체를 대상으로 자가평가를 실시한 결과 도구의 신뢰도 Cronbach``s .=.92였고, 점수는 4점 만점에 3.38~ 3.75점으 로 나타나 병동 간호사의 간호역량 평가도구로서 활용 가치가 높을 것으로 판단된다. 아울러 임상등급에 따른 전문성을 기준으로 선정된 것이어서 임상간호 질의 유지와 공정한 승급 도구로서의 가치가 있어 간호인적 자원관리의 과학적이고 합리적인 체계를 구축하는데 기여할 수 있을 것이다.",박미란(Mee Ran Park),2014,https://www.riss.kr/link?id=A102915735
만성질환자를 돌보는 간호사의 간호역량이 인간중심간호 수행에 미치는 영향: 소진의 매개효과와 간호근무환경의 조절효과,,"안진영(Ahn, Jin-Yeong)",2021,https://www.riss.kr/link?id=A107409753
병원 간호단위관리자의 핵심직무 - 핵심역량 매트릭스 개발,"연구목적: 본 연구의 목적은 병원 간호단위관리자의 핵심직무-핵심역량 매트릭스를 개발하고 확인된 핵심역량의 중요도-수행도의 수준을 확인하는 것이다. 연구방법: 7명의 간호단위관리자로 구성된 전문가 집단을 대상으로 핵심직무-핵심역량을 확인하였고, 도출된 핵심직무-핵심역량 매트릭스에 대한 전문가 검증 단계를 거쳤다. 간호단위관리자 핵심역량의 중요도-수행도의 수준 측정은 196명의 간호사를 대상으로 설문조사를 통해 확인하였다. 연구결과: 병원 간호단위관리자의 38개의 핵심직무와 5개 역량군, 37개의 핵심역량이 도출되었다. 5개의 역량군은 임상수행역량군, 인간관계역량군, 전문직 역량군, 리더십 역량군, 비즈니스 역량군이었다. 확인된 핵심직무와 핵심역량을 바탕으로 핵심직무-핵심역량 매트릭스를 개발하였다. 핵심역량에 대한 중요도-수행도 측정 결과는 중요도(3.50±.30)의 평균이 수행도(3.03±.34)의 평균보다 높게 나타났다. 결론: 병원 간호단위관리자의 핵심직무와 핵심역량의 도출은 간호관리자의 역량을 증진시키기 위한 프로그램을 개발하고 간호관리자의 역량을 평가하기 위한 기초자료를 제공할 수 있을 것이다.",이태화,2017,https://www.riss.kr/link?id=A103366663
수간호사와 일반간호사의 교환관계의 질이 일반간호사의 직무만족과 조직몰입에 미치는 영향,"1. 연구목적 : 본 연구는 수간호사와 일반간호사의 교환관계의 질이 일반간호사의 직무만족과 조직몰입에 미치는 영향을 규명하는 것이다.
2. 연구방법 : 본 연구의 대상은 인천광역시에 위치한 300병상 이상의 7개 종합병원에 근무하는 수간호사 42명과 일반간호사 202명 이었으며, 2013년 3월 10일부터 2013년 4월 10일까지 구조화된 설문지를 이용하여 조사하였다. 수간호사 1명당 자신의 병동간호사 5명의 교환관계의 질을 설문조사하도록 하였다. 또한 수간호사가 교환관계의 질을 측정하였던 해당 일반간호사를 대상으로 하여 교환관계의 질을 양방향으로 측정하였고, 직무만족과 조직몰입을 조사하였다. 자료는 위계적 회귀분석을 실시하여 영향정도를 확인하였다.
3. 연구결과 : 수간호사의 교환관계의 질은 평균 3.66점이었고, 일반간호사의 교환관계의 질은 평균 3.51점 이었다. 일반간호사의 교환관계와 연령은 직무만족에 긍정적 영향을 주었다(F=8.00, p<.001). 조직몰입에서는 일반간호사의 교환관계와 결혼여부(기혼자)가 긍정적 영향을 주는 것으로 확인되었다.
4. 결론 : 수간호사의 교환관계의 질은, 일반간호사의 교환관계의 질보다 높았지만, 수간호사의 교환관계의 질은 일반간호사의 직무만족과 조직몰입에 영향을 주지 못하였다. 그러므로 일반간호사의 교환관계가 수간호사의 교환관계 보다 간호사의 직무만족과 조직몰입에 더 중요한 요인으로 볼 수 있을 것이다. 수간호사는 자신이 가지고 있는 우호적인 감정을 일반간호사로 하여금 잘 인식할 수 있도록 적극적인 리더로서의 행동표현이 요구된다고 생각한다. 이러한 수간호사와 일반간호사 사이의 서로에 대한 충분한 긍정적인 인식의 전달은 일반간호사의 직무만족과 조직몰입 향상에 도움이 될 것이다.",이향화,2014,https://www.riss.kr/link?id=A100054524
"수술실 간호사의 셀프리더십, 전문직 자아개념, 긍정심리자본이 간호업무성과에 미치는 영향","목적: 본 연구의 목적은 수술실 간호사의 셀프리더십, 전문직 자아개념, 긍정심리자본이 간호업무성과에 미치는 영향을 규명하는데 있다. 방법: 2019년 11월 18일부터 29일까지 실시하였으며, 서울 소재 A 상급종합병원의 임상경력 1년 이상의 수술실 간호사 148명을 대상으로 실시하였다. 수집된 자료는 빈도분석, 기술통계, t-test, ANOVA, Pearson’s Correlation Coefficient, Multiple Linear Regression Analysis을 실시하였다. 결과: 수술실 간호사의 셀프리더십은 5점 척도에 3.62점으로 나타났고, 전문직 자아개념은 4점 척도에 2.83점으로 나타났다. 긍정심리자본은 5점 척도에 3.61점으로 나타났으며, 간호업무성과는 4점 척도에 3.23점으로 나타났다. 수술실 간호사의 셀프리더십, 전문직 자아개념, 긍정심리자본과 간호업무성과는 정(+)의 방향으로 유의한 상관관계가 있었다. 수술실 간호사의 간호업무성과에 가장 큰 영향을 미치는 요인은 전문직 자아개념으로 나타났다. 결론: 이상의 연구결과를 바탕으로 볼 때, 수술실 간호사의 간호업무성과를 증진시키기 위해서는 전문직 자아개념을 확고히 하기 위한 지속적인 교육, 긍정심리자본을 강화하는 교육을 개발하고 적용할 필요가 있다.",문현숙,2020,https://www.riss.kr/link?id=A107143012
간호학생의 아동 통증에 대한 지식,"본 연구에서 간호학생의 아동 통증에 대한 지식은 100점으로 환산했을 때 57.5점으로 낮았는데, 이는 간호사, 약사, 의사, 간호학생, 의대생 등 건강관리 제공자를 대상으로 한 Lebovits 등(1997)의 연구에서 통증에 대한 지식 점수가 평균 56점이었던 결과와 유사한 수준이었다. 또한 아동병동 간호사의 통증 지식을 측정한 Choi와 Choe (2005)의 연구에서 평균 49점이었던 결과보다 높은 점수였으나, 아동병동 간호사를 대상으로 한 Manworren(2000)의 연구에서 평균66점이었던 결과와 간호사를 대상으로 한 Hwang 등(2007)의 연구에서 평균 71점이었던 결과보다 낮은 점수였다. 최근 통증 관리의 중요성이 강조되면서 이전보다 건강관리 제공자의 통증에 대한 지식이 높아지고 있지만, 57.5점의 정답률은 40점 이상의 높은 오답률을 나타내며, 아직도 많은 간호학생이 잘못된 지식을 가지고 있음을 의미한다. 그러므로 아동의 통증에 대한 전반적인 지식을 다루는 내용을 정규 교육과정과 임상실습에 포함시켜 간호학생이 아동의 통증 관리에 대한 충분한 교육 경험을 쌓도록 지도해야 한다. 아동 통증에 대한 지식을 항목별로 보면, 100점으로 환산했을 때 통증 중재 75.7점, 통증 사정 59.9점, 진통제 47.7점의 순이었다. 간호학생은 진통제에 대한 지식이 가장 낮았는데, Hwang 등(2007)의 연구에서도 간호사의 통증 관리 지식에서 가장 낮은 점수를 나타낸 것이 마약성 진통제였고, Choi와 Choe (2005)의 연구에서도 아동병동 간호사의 약물중재 관련 지식은 평균 40.9점으로 가장 점수가 낮은 항목이었다. 아동에게 진통제를 처방하는 것은 의사의 업무이지만, 처방 한 진통제를 안전하고 적절하게 투여하며, 정확한 통증 사정으로 진통제의 효과를 평가하는 것은 간호사의 중요한 업무이다 (Yoon, 2002). 간호사가 진통제에 대해서 잘못된 지식을 갖고 있으면 아동의 통증 관리에 심각한 문제가 발생한다. 간호사의 정확한 지식은 효과적인 통증 관리의 필수 요건임에도 불구하고, 간호사와 의사의 통증 관리에 대한 지식을 비교한 선행 연구(Jull et al., 2006)에서 간호사의 통증 사정, 진통제의 작용과 투약에 대한지식이 의사보다 낮았다. 따라서 간호사와 간호학생을 대상으로 통증관리 약물과 통증의 사정 및 펑가에 대한 지속적인 교육을 실시하여 정확한 지식을 갖도록 해야 할 것이다. 또한 통증 중재에 대한 지식은 다른 항목에 비해 비교적 높은 점수였으나, 여전히 부정확하게 알고 있는 부분이 있으므로 정확한 교정이 필요하다．‘통증을 줄이기 위해서 온찜질과 냉찜질을 통증 부위에 직접 적용한다(아니오가 정답). ``의 문항은 정답률이 39.1％로 낮았는데, 38.5％의 정답률을 보인 Matthews 와 Ma1cm (2007)의 연구 결과와 유사한 수준이었다. 비약리적 통증 조절 방법은 경증이나 중등도의 통증 등에 효과가 있으나(Comlely & Banks, 2000), 대부분 적용 방법을 잘 모르고 있거나 효과가 없을 것이라는 부정적인 선입견을 갖고 있다. 이는 간호사가 비약리적 통증 조절 방법에 대해 관심이 없고 의사의 지시적 중재에 너무 익숙하며 시간과 자원이 부족하기 때문이다(Clarke & al., 1996). 그러나 비약리적인 방법은 간호사가 독립적으로 사용할 수 있는 중재로 안전하고 비 침습적이므로 최근 아동을 대상으로 한 연구기 활발하게 진행 되고 있다(Im & Shin, 2007; Koo, Park, & Im, 2007). 따라서 비약리적인 통증 조절에 대한 정확한 내용을 실습교육 등에 포함하여 적극적이고 체계적으로 교육하며, 아동의 통증 관리에 대한 지식이 임상 현장에서 통증을 감소시키는 구체적인 중재 활동으로 이어지도록 방안을 마련해야 한다. 간호학생의 아동 통증에 대한 지식 중 정답률이 가장 높은 문항은 ``고통스러운 처치를 반복해시 받는 아동은 처음 처치를 받을 때 통증과 불안을 줄이기 위해 노력하고, 다음 처치를 받을 때 불안해하지 않도록 해야 한다.`` 로 간호학생 대부분이 정확한 지식을 갖고 있었다. 이는 동일한 문항에 대해 간호사의 82％가 동의한 Salantera (1999)의 연구와 유사한 결과이며, 치치나 검사로 인한 불안이 아동의 통증에 영향을 미친다는 것을 간호학생이 인식하고 있음을 나타낸다. 하지만 ``아동이 심한 통증을 호소하면 활력징후가 변하는지 확인해야 한다(아니오가 정답.`` 와 ``아동은 통증이 있을 때 항상 행동도 변한다(아니오가 정답).``의 문항은 정답률이 각각 1.0&와 1.5％로 매우 낮았다. 같은 내용을 나타내는 ``아동은 통증이 심해도 잠을 잘 수 있다.`` 와 ``아동이 잠시 관심을 돌라 통증을 잊을 수 있다면 통증이 심한 것은 아니다(아니오가 정답).``의 문항도 각각 27.0％와 52.7％의 정답률로 낮았다. 이는 선행 연구(Hwang et al., 2007; Jun et al., 2006)에서 대상자가 호소하는 통증을 표현하는 그대로 받아들이지 못하는 간호사의 반응과 유사하였다. 즉 간호학생도 아동의 통증을 사정할 때 아동이 표현하는 통증을 그대로 수용하지 않고 활력징후나 행동의 특별한 변화를 확인해야 한다고 생각하며, 통증이 있어도 잠을 자가나 놀이에 참여하는 아동의 특성을 고려하지 못했다. 이로 인해 간호학생은 자신의 주관적인 판단에 따라 아동의 통증을 과소평가하여 통증 조절에 소극적으로 참여 할 수 있다. 간호학생은 ``아동이 성인보다 통증을 잘 견딘다(아니오가 정답).``의 문항에 96.9％의 높은 정답률을 보이면서도 구제적인 상황과 관련된 내용에서는 잘못된 지식을 갖고 있는 모순된 모습을 보였다. 따라서 간호학생이 아동의 통증에 대한 부정확한 지식을 잘못된 신념으로 발전시키지 않도록 통증에 영향을 미지는 발달 단계별 특성과 구체적인 임상 상황에서 통증을 사정하고 평가하는 방법에 대해 체계적으로 교육해야 한다. 또한 ‘수개월간 마약성 진통제를 투여받는 아동에게 호흡억제는 거의 나타나지 않는다.``의 문항도 4.6％의 매우 낮은 정답률을 보였다. 이는 간호학생이 아동의 통증을 조절하기 위해서 마약성 진통제를 사용하는 것과 관련하여 부작용에 대해 지나치게 우려하고 사용 방법에 대해 구체적으로 알고 있지 못함을 나타낸다. 통증 관리에 대한 여러 선행 연구(Abu-Saad et al., 1998; Hwang et al., 2007; Jacob & Puntillo, 1999; Jun et al., 2006; Lebovits et al., 1997; Suk et al., 1999)에서도 간호사와 간호학생 대부분이 마약성 진통제에 대한 충분한 지식을 갖고 있지 못함을 보고하였다. 그러나 혼합형 마약제의 약물의존성과 중독성은 순수 마약제보다 적어서 통증 조절에 유용하며, 마약성 진통제를 사용하면서 중독될 위험은 1% 미만이므로(So, Seo，Kwon, Kim, & Yoon, 2005) 정확한 교육을 통해 마약성 진통제가 통증 관리에 효과적으로 사용될 수 있도록 해야 한다. 간호학생의 아동 통증에 대한 지식은 성별, 학년, 성적, 만성통증 경험, 통증에 관한 수업 참여에 따라 유의한 차이가 있었다. 이는 간호사의 통증에 대한 지식이 교육 경험과 관련되었던 연구(Clarke et al., 1996; McCaffery & Ferrel, 1997) 및 아동 통증에 대한 교육을 받은 간호사의 지식 점수가 그렇지 않은 경우보다 높았던 연구(Choi & Choe, 2005)와 일관된 결과로 통증에 관한 수업에 참여한 간호학생이 그렇지 않은 경우보다 지식이 높았다. 또한 4학년의 아동 통증에 대한 지식은 3학년 보다 높았으나 2학년과는 차이 가 없었다. 학년 이 높은 경우 아동통증에 관한 교육 경험이 많기 때문에 아동 통증에 대한 지식이 증가하리라 생각되지만, 간호학생의 지식은 학년과 교육 경험 외에 어떤 다른 요인이 작용하는지 명확하지 않다. 3년제 대학과 4년제 대학교의 학년에 따른 이수학점 및 실습 시간의 차이(Lee, 2006)와 같은 교육과정상의 변수가 작용되었으리라 짐작할 수 있으므로, 추후 반복 확대 연구를 통해 간호학생의 아동 통증에 대한 지식의 차이를 파악해야 할 것이다. 성적이 상위 30% 이내인 경우에 그렇지 않은 경우보다 아동 통증에 대한지식이 높았던 결과는 측정하는 속성이 인지적인 영역이고 수업 내용에 포함된 내용이었기 때문일 것이다, 또한 만성 통증의 경험이 있는 경우가 그렇지 않은 경우보다 지식이 높았는데, 이는 오랫동안 통증을 경험하고 스스로 관리하면서 통증에 대한 실제적인 정보를 얻게 되어 나타난 결과로 생각된다. 선행 연구(Clarke et al., 1996; McCaffery & Ferrel, 1997)에서도 간호사의 통증 관리 경험은 통증에 대한 지식과 관련된 요인이었다. 여학생의 아동 통증에 대한 지식이 남학생보다 높았는데, 성별에 따른 차이를 살펴본 선행 연구가 없고, 남학생의 수가 상대적으로 적으므로 추후 확대 연구를 통해 관련성을 자세히 살펴보아야 할 것이다. 우리나라 간호학생을 위한 아동 통증에 대한 지식 측정 도구가 아직 개발되지 못하여 표준화된 도구를 사용하지 못한 점이 본 연구의 제한점으로 작용한다. 도구의 내용 타당도를 높이기 위해 간호학교수 2인과 간호사 4인으로부터 자문을 받아 수정 보완하였고, 간호학생 20명을 대상으로 사전 조사를 실시하여 의미가 모호하거나 이해가 가지 않는 일부 문항을 수정하고 보완하는 과정을 거쳤으나, 도구의 내적 타당도를 검증하기 위해 측정한 Cronbach``s α 계수가 매우 낮았다. 이는 문항 대부분이 예/아니오의 응답만 가능하여 정확도가 낮고 간호학생 간에 통증에 대한 이해 수준이 다르며, 통증에 대해 잘 모르면서 추측으로 응답하여 우연히 맞혔던 것에서 기인하였으리라 생각 된다(Shin & Park, 1995). 그러므로 우리나라 간호학생의 아 동 통증에 대한 지식을 정확하게 측정하기 위해서 신뢰도와 타당도가 높은 도구를 개발하여 표준화하는 작업이 이루어져야 할 것으로 사료된다. 표준화된 도구의 개발을 통해 간호학생의 아동 통증에 대한 지식을 정확히 파악하고, 아동 통증 관리 및 교육을 개발하는 데에 활용할 수 있을 것이다.",이경민 ( Yl Kyung Min ),2010,https://www.riss.kr/link?id=A99667562
