
간호대학생의 학년별 임상실습 스트레스 대처 및 실습 만족도의 차이 비교,"간호대학생이 경험하는 학년별 임상실습 스트레스에 따른 대처방식과 임상실습 만족도를 확인한 연구결과를 기초로 다음과 같이 논의하고자 한다. 1. 간호대학생의 심상실습 스트레스에 따른 대처방식, 임상실습 만족도 간호대학생의 임상실습으로 인한 스트레스는 2학년간호대학생의 경우 4점 만점 중 평균 2.71(±47)이었으며 3학년은 2.67(±35)로 2학년이 스트레스를 많이 받는 것으로 나타났다. 임상실습은 간호교육의 한분야로 지식, 기술, 태도를 자극하는 것으로 강의실에서 배운 이론을 간호현장에서 실제 대상자에게 적용하여 간호를 제공해 봄으로써 학생들의 잠재력을 최대한 개발시켜 창의력과 응용력을 길러주는 학습과정으로 필수적으로 매우 중요한 교육과정이라고 할 수 있다. Carter(1982)는 간호학생들이 간호교육 그 자체에서도 심한 스트레스, 불안정, 불만족을 경험하지만 특히 간호대상자인 아픈 환자와 가까이 있으므로 더욱 스트레스를 경험하게 된다고 하였다. Park, Kim, Park, Kim과 Kim(2005)의 간호대학생을 대상으로 임상실습 동안나타나는 스트레스, 불안과 피로감을 연구한 결과에서는 간호대학생의 스트레스는 5점 만점 중 평균 3.87점 정도를 보였으며 2학년보다 3학년이 스트레스가 더 높았다고 하였으나, 이러한 결과는 본 연구결과와 상반되는 결과였다. 그러나 학교마다 고유한 실습 운영체계 를가지고 있으므로 이러한 기본적인 전제를 배제하더라도 간호대학생이 경험하고 있는 임상실습의 스트레스는 상당히 높은 것으로 보여진다. 이러한 스트레스를 줄이기위한 노력으로 여러 가지 중재방법으로 연구되었으나대부분의 연구들이 일회적이었거나 혹은 일부대학에 치중하는 제한점을 가지고 있다. 간호대학의 실습교육에 대해 간호교육평가원에서 규제와 질 관리를 하고 있는 것으로 알고 있다. 학생들의 스트레스를 고려한 대안적인 실습체계 개발에 대한 논의는 반드서 이루어져야 할것으로 보인다. 이련 스트레스에 대한 대처방법으로 2학년, 3학년 모두 적극적인 대처유형을 더 사용하고 있었다. 즉 문제를 인식하고 해결하고자 하는 욕구를 강하게 표현하는 대처방법인 적극적인 대 처유형을 많이 사용하고 있는 것으로 나타났다. 특히 문제해결이나 논리적 분석등의 논리적인 과정들을 이용하려는 형태를 보이는 것은 매우 건강한 대처방법을 사용하고 있는 것으로 고려된다. 이러한 대처방법을 학년별로 비교하면, 3학년은 2학년보다 적극적인 대처유형의 평균점수는 낮았고, 회피유형의 평균은 오히려 높았다. 간호학생의 스트레스 지각정도가 높을수록 정서중심의 대처유형 이용 정도가 높았으며 스트레스 반응도 높게 나타났던(Ha, Han, &Choi, 1998)의 결과와는 다른 결과였으며 Nam(2007)의 성격유형에 따른 임상실습 동안 나타나는 스트레스와 대처방법에 관한 연구결과, 문제중심 대처방법을 정서중심 대처방법보다 빈번히 사용하고 있었다는 결과와유사한 결과였다. 이러한 결과들을 미루어볼 때, 처음실습을 서작하는 2학년의 경우 임상실습으로 인한 스트레스가 높았지만 이를 적극적이고 문제 중심적으로 해결하려는 대처방법을 사용하고 있는 반면에 3학년의 경우, 다양한 실습현장을 경험하였으며 이러한 현장의 노출은 스트레스를 낮추는 효과가 있었으나 이에 비해 회피적 대처방법을 빈번히 사용하려는 경향이 높았음을알 수 있었다. 이러한 결과는 임상실습으로 인한 스트레스는 줄일 수 있되, 실습과 관련된 대처방법을 졸업할 때까지 긍정적이고 목표지향적인 형태를 유지할 수있는 자극적이고 효율적인 교과 마련이 서급하다 할 것이다. 2. 임상실습 스트레스， 스트레스 대처， 임상실습 만족도와의 상관관계 임상실습 스트레스， 스트레스 대처， 임상실습 만족도와의 관계를 확인한 결과 임상실습 스트레스와 만족도 와｀ 음의 상관관계가 있었으며， 스트레스 대처와의 관계에서는 회피적 대처유형과의 상관성이 높았던 것으로 나타났다． 즉 실습 스트레스가 높을수록 회피적 대처유형을 자주 이용하고 있는 것으로 나타났다． 이러한 결과는 Ha 등 (1998） 의 국내 간호대학생을 대상으로 한 연구에서 정서중심 대처 유형과 스트레스 반응과는 정적관계, 문제중심 대처와 스트레스 반응과는 음의 상관 관계를 밝힌 결과와 유사하였다． 즉 이러한 결과물은 간호 대학생이 실습과 관련된 스트레스에 효율적으로 대응하지 못하다는 결과를 의미한다． 즉 문제중심 대처 능력이나 적극적 대처능력이 개발되어진다면 실습과 관련된 스트레스와 적극적인 대처유형과 관련성이 있어 야 함에도 불구하고 정서적 반응이나 회피적 대처유형 의 점수와 관련성이 높다는 것은 간호대학생을 대상으로 스트레스 관리방법이나 문제해결 능력 등을 함양 할 수 있는 훈련들이 필요하다는 것을 보여주는 결과이다． 아울러 실습내용에 대한 만족도가 높을수록 적극적 대처유형을 이용하고 있는 경우가 많다는 결과 가는 임상 실습 만족도와 실습 스트레스가 음의 상관관계를 가지 고 있었으며 스트레스를 줄이면 만족도가 증가할 수 있다는 것을 서사하면서， 아울러 실습 만족도가 높을수록 적극적인 대처유형을 이용하는 경우가 많으므로 일차적 인 교육 목표는 스트레스를 관리하고 실습만족도를 높일 수 있는 방안모이 필요할 것이다． 특히 실습내용 에 대한 만족도가 높을수록， 실습 스트레스가 낮았으며 아울러 적극적 대처방법을 효율적으로 사용할 수 있었다는 결과를 고려하여 실습내용의 조절 및 관리가 필수 적이다． Park 등 （2005） 의 연구결과 실습괴제물로 인한 스트레스가 높았던 결과물이나 집담회 영역에서의 높은 스트레스를 고려하여 실습관리에 대한 효율적 대안을 모색하고 운영 되어져야 할 것이다． 이상으로 간호대학생의 학년별 임상실습 스트레스 대처 및 실습 만족도의 차이를 확인한 결과 실습 스트레스는 3학년보다 2학년이 높은 것으로 나타났으며 스트레스 대처방법은 적극적인 대처방법을 더 많이 이 용하고 있으며 이러한 차이는 2학년인 경우 더 효율 적으로 이용하고 있는 것으로 나타났다． 마지막으로 실습 스트레스는 실습만족과 음의 상관관계를 나타내었으며 스트레스가 높을수록 회피적 대처유형을 이용 하고 있는 것으로 나타났다. 이러한 결과를 활용하여 각 학년별 실습운영의 효율적인 방안 모색할 필요가 있으며 아울러 실습 스트레스를 감소서킬 수 있는 대안적 인 교과과정 모색이 절실히 필요할 것이다．",이혜숙 ( Hea Sook Lee ),2008,https://www.riss.kr/link?id=A99667531
심폐소생술 금지(DNR) 환자를 돌보는 간호사의 갈등,"본 연구 참여자들은 심폐소생술 금지(DNR) 환자를 돌보면서 심폐소생술을 시행하는 환자에 비해 긴장감이 덜하고, 응급상황 시에도 의사 처방의 감소로 처치가 감소하여 업무적인 면이 많이 감소하여 상대적으로 손길이 덜 가는 것에 대해 미안한 마음과 함께 무성의하게 간호를 하고 있는 건 아닌지 하는, 그러면서도 딱히 그를 위해 뭔가 해줄 수 있는 것이 없는 자신의 입장을 생각하면서 간호사로서의 무능감과 아쉬움을 토로하면서 안타까워하고 있음을 알 수 있다. 또한 환자를 위해 아무런 역할 없이 그냥 지켜만 본 참여자가 그의 마지막 길을 자신의 손길을 통해 보내드려야 한다는 마음에 심리적으로 많은 부담감을 가지고 있었다. 보호자의 동의하에 심폐소생술 금지(DNR)에 관한 동의서를 받았다고 하지만, 끝까지 최선을 다하여 의료 행위를 하지 않은 것에 죄책감을 가지고 있었으며, 소극적이고 이례적인 간호를 제공하게 되는 것에 대해 의료인으로서의 책임을 다 하지 못했다는 아쉬움과 미안함이 안타까움과 같이 갈등으로 잔재하게 됨을 알 수 있다. 이와 같은 결과는 심폐소생술 금지(DNR)에 관해 병원 간호사들이 상당한 죄책감, 우울 그리고 무력감을 경험하는 것으로 나타난 Yi 등(2008)의 연구 결과와 일치하며, Kang과 Yom (2003)의 연구에서도 심폐소생술 금지(DNR)시행 후 문제점으로 38.2%가 치료와 간호의 소홀함을, 28.8%가 죄책감으로 나타나, 본 연구 결과와 일치하고 있음을 알 수 있다. 따라서 DNR 환자를 간호해야 하는 간호사로 하여금 이와 같은 심리적 갈등으로 인해 오히려 다른 환자를 돌보는 데 지장을 초래할 수 있으므로, 중환자와 DNR 환자를 분리 간호할 수 있는 간호체계, 내지 환경 마련이 시급하다고 생각된다. 또한 연구 참여자들 대부분이 심폐소생술 금지(DNR) 결정이 본인이 배제된 가족들에 의해 이루어지고 있는 것에 안타까움을 호소하였다. 즉, 전혀 본인의 의사가 반영되지 못하고 있으며, 특히 DNR에 대한 어떤 기준도 없이 의사의 권유나 설명에 의해 가족에 의해 수행해야 되는 의료 현실을 안타까워하고 있다. 또한 의료처치 중단 시, 일정한 기준 없이 일방적으로 행해지는 여러 가지 행태로 혹시 조금 더 생명을 지속할 수 있는데 잘못된 판단으로 삶을 단축시키는 것은 아닌가 하는 의구심 내지 아쉬움, 다른 한편으로 참여자는 DNR 제도가 가족들의 욕망이나 욕심 때문에 오히려 악용될 수도 있다는 염려가 안타까움으로 드러나면서 갈등을 겪고 있음을 알 수 있다. DNR 의사결정은 반드시 미리 사전이나 환자의 의식이 있을 때 받아야 하며 의식이 없는 경우는 법적 대리인에게 받아야 하는 것(Wilson, 1996)으로, 1988년 뉴욕을 시작으로 적절한 심폐소생술의 사용에 대한 지침을 입법화하고(Ebell & Eaton, 1992)있으며, 환자의 인종 및 입원 형태에 따라서도 DNR 결정의 상이점을 보여주고 있어(Cardenas et al., 2011) 외국의 경우 우리와는 차이가 있음을 알 수 있다. 우리나라의 경우, 의사와 보호자가 DNR 의사결정에 직접 참여하고 있었으며 간호사 역시 간접 참여하는 것(Kim, 2004)으로 나타났고, DNR 의사결정 시 환자를 배제한 의사와 가족의 일방적인 결정에 윤리적 딜레마를 겪게 된다(Lee et al.,1994)고 하여, 본 연구 결과와 일치하고 있었다. 이는 가족 중심의 측은지심 내지 책임전가 등의 사회 문화적 가치 차이인 것으로 사료되며, 따라서 장기 기증과 같은 범 사회 문화적 홍보로 이미 건강할 때사전 동의서를 작성한 후 병원입원과 동시에 다시금 본인 확인하에 의사결정을 하게 하는 법적 제도적 장치가 요구된다 하겠다. 특히 DNR 의사결정이 가족에 의해 작성되는 경우, 회복 불가능한 질병으로 입원하였을 때(46%), 뇌사상태가 되었을 때(23.3%), 뇌사상태가 예상될 때(14.1%)로 나타났으며, 임종을 앞둔 환자의 치료과정에 대한 선택의 경우, 의식이 없는 경우는 배우자가 결정해 주기를 윈하는 응답자가 64.7%였지만, 의식이 있는 경우는 대부분 본인 스스로 결정하고 싶다(68.8%)고 하였다. 또한 약 80%의 대상자가 생명연장을 위한 의료조치에 관한 자신의 생각을 서류 작성을 통해 미리 밝혀 놓도록 제도를 도입시키고 법적 효력을 부여하는 것에 찬성하는 것으로 나타나(Hong, 2010), 예의 주시할 부분으로 생각된다. 그리고 DNR 의사결정 시 대부분이 일정한 기준이 필요하다는 연구결과(Sung et al., 2007)가 있음에도 이 역시 준수되지 않고 의사의 결정과 권유에 의해 기준 없이 가족에 의해 대부분 의사결정이 이루어지고 있고, 부분적으로 병원 자체의 서식을 만들어 사용(Hong, 2010)하고 있어, 이 역시 위험한 발상으로, 의학적 진단을 기반으로 보다 구체적이고 정확한 기준마련이 요구된다 하겠다. Lee등(1994)에 의하면, 의료 전문인 역시 DNR 결정에 대한 일정한 기준없이 보호자와 상의하여 실시한 경우, 책임소재와 권한, 결정시기, 치료범위 등으로 고민하는 것으로 나타나, 신중하지 못한 의료행태, 처치중단, 무리한 의료처치 등으로 아쉬움이 있어 갈등을 겪는 간호사들의 입장과 일치하는 것으로, 이 역시 DNR 기준 마련과 의료처치의 범위를 분명히 할 수 있는 합의된 가이드라인의 제정 및 건강할 때 본인으로부터 사전 의사결정서를 마련하는 법적 제도적 장치가 요구된다 하겠다. Yuen 등(2011)의 연구에서도 성공적인 DNR을 위해 병원 문화의 변화, DNR에 관한 병원 정책의 개혁 등을 바람직한 전략으로 제안하고 있어 제도적, 정책적인 변화가 요구되는 우리나라의 실정에도 부분적으로 적용될 수 있다. 이러한 다양한 개선과 노력을 통해 DNR 환자를 간호하는 간호사들이 갖게 되는 심리적인 죄책감과 갈등을 해소하고 미안한 마음, 안타까운 마음 등의 부정적인 정서를 긍정적으로 승화시켜 환자 간호 시 더욱 우수한 양질의 간호를 수행할 수 있으리라 여겨진다. 즉, 심리적 부담감보다 신체적, 심리 정서적 및 영적인 측면까지 고려한 다양하고 깊이 있는 간호를 통해 환자와 교감하는 인격적인 간호를 수행하여 DNR 환자 간호의 수준을 향상시켜 최상의 간호를 적용할 수 있으리라 생각된다. 뿐만 아니라 임종을 앞두고 있는 DNR 환자에 대한 안위를 향상시키고 마지막 순간까지 환자의 삶의 질을 유지할 수 있도록 하여, 보다 인격적이고 품위 있는 죽음을 맞이할 수 있게 하리라 사료된다. 사회적으로는 DNR에 대한 사회적인 합의점을 마련하고 법적인 효력과 정당화를 이루게 하여 사회적인 혼란을 해소하고 갈등을 완화하며 DNR 제도가 악용되는 것을 예방하는 일종의 감시체제를 형성할 수 있을 것이다. 연구 참여자들은 DNR을 결정하고 난 후, 죽음을 그냥 담담히 받아들이는 모습과 면회 오는 횟수가 줄어드는 등, 가족들의 무성의해지고 오히려 빨리 끝내기를 원하는 모습에 아쉬움을 가지면서 안타까움이 갈등으로 드러나고 있었다. Kim (2006)의 연구에서는 DNR 환자의 가족들이 죄책감, 상실감, 슬픔, 부정 등을 경험할 것으로 예측하는 것으로 나타나 본 연구 결과와는 약간 상충되는 것으로, 이는 면담을 이용한 질적 연구와 도구를 활용한 양적연구와의 연구 방법 차이로 사료되며, 추후 연구가 요구된다 하겠다. 따라서 간호사들은 DNR 환자 간호 시 간호의 영역을 환자에게만 국한시키는 것이 아니라 가족들까지도 포함시켜 죽음에 대한 깊은 이해와 긍정적인 태도를 형성하여 건강한 가족지지 체계를 이룰 수 있도록 적극적으로 간호중재 영역에 포함시키는 것이 필요하다. Lorraine (2007)의 연구에서도 DNR이 간호의 중단을 의미하는 것이 아니며, 간호의 범위를 환자만으로 국한시키는 것이 아니라 가족까지도 포함시켜야 함을 보고하고 있다. 즉, DNR과 관련된 여러 가지 부정적인 감정들을 해소하고 가족 간의 활발한 의사소통과 죽음에 대한 보다 성숙한 자세를 지닐 수 있도록 가족을 포함한 포괄적인 전인 간호를 실시함으로써, 간호사들의 DNR환자 돌봄에 따른 전문적 간호처치 외 갈등으로부터 벗어날 수 있도록 준비함이 요구된다 하겠다. 본 연구의 참여자들은 DNR 환자의 임종 준비를 위한 환경 부재에 안타까움을 표현하였다. 마지막으로 집에도 한 번 가보지 못 하고 병원에서 임종을 맞이해야 함에 측은한 마음을 가지고 있었으며, 임종간호를 제공할 충분한 지식축적의 교육적 기회와 간호를 제공할 수 있는 시간적 여유가 없어 적절한 호스피스 간호를 제공하지 못하고 있는 현실을 안타까워하면서 이들을 돌보는 현장에서의 갈등은 더욱 깊고 커 가는 것을 알 수 있다. Kim (2009)의 임종 환자를 돌보는 암 병동 간호사를 대상으로 한 연구결과, 임상경력이 길수록, 호스피스 교육기간이 길수록, 임종간호 횟수가 많을수록 임종간호에 대한 인지정도가 높은 것으로 나타났으며, 암 병동 근무기간이 길수록 임종간호에 대한 교육 요구도가 높은 것으로 나타나, 표현의 차이는 있으나 본 연구결과와 일치하고 있다. 옛날 우리나라의 풍습은 병원에서 임종을 맞는 경우 횡사로 금기시되어 임종이 가까워지면 대부분 집으로 환자를 모시고 가는 문화였다. 그러나 요즈음 사회 문화의 도시화, 기계화 및 핵가족화로 인해 가정에서의 임종은 불가능한 것으로, 이에 따른 가족 구성원간의 인간사랑, 가족사랑에 대한 기본적 태도를 잃지 않도록 강조하며, 또한 임종간호에 대한 보다 깊이 있는 환경적 개선이나 교육이 요구되며, 이를 통해 보다 전문적인 지식적 기반하에 이들을 돌봄으로써 보다 양질의 도움으로 갈등으로부터 어느 정도 해소될 수 있으리라 사료된다.",김현아 ( Hyeon Ah Kim ),2011,https://www.riss.kr/link?id=A99667585
