
고교학점제도 문제점 해결을 위한 운영 방향 탐색,"이 연구의 목적은 고교학점제도의 운영 방향을 탐색하여 고교학점제도의 문제점들을 해결하고 고교학점제도를 효과적·효율적으로 운영하도록 도움을 주는 것이다. 연구방법은 문헌연구로 문헌연구대상은 선행연구, 공청회자료, 언론보도자료, 2015개정교육과정, 교육부의 고교학점제 추진방안 등이다. 연구 결과 고교학점제도의 문제점을 해결하기 위한 교육과정 편성의 기본적인 방향은 첫째, 보통 교과 과목 위주로 편성해야 한다. 둘째, 자신이 원하는 분야의 관련 과목을 깊이 있게 학습할 수 있게 해야 한다. 셋째, 교육과정 편성의 근거도 확인해야 한다. 고교학점제도 문제점 중 진로지도를 위한 고교학점제도 운영 방향은 첫째, 진로 학습·코칭을 위한 진로 교육과정위원회 구성 및 운영이다. 둘째, 교원의 업무 체계 재 구조화이다. 셋째, 진로 희망 설계 및 진학 방향 탐색의 시간 마련이다. 넷째, 진로 및 학업 설계 지도 코칭 북 제공이다. 다섯째, 진로 및 학업설계 지도 교사의 역할이다. 여섯째, 과목 선택에 대한 책임감 강조 및 재 이수 프로그램 마련이다.",윤옥한(Ok-Han Yoon),2021,https://www.riss.kr/link?id=A107841320
인공지능과 예술창작 활동의 융복합 사례분석 및 특성 연구,"최근 컴퓨터의 발달로 인해 네트워크의 활성화, 정보의 혁명, 빅데이터의 등장, 혁신적인 딥러닝의 기술발전으로 인공지능은 눈부신 성장을 하고 있으며 인공지능에 대한 대중들의 관심도 급증하고 있다. 테크놀로지와 예술의 융합은 오래전부터 계속되었으나 인공지능처럼 기계가 지능을 가지고 인간 고유의 능력인 창의적인 예술 활동을 직접 하는 경우는 없었으며 단순히 예술의 기계적 장치 수단으로써만 사용되었다.
그러던 것이 최근 인공지능의 영역은 단순한 기계적인 일처리 방식 분야뿐만 아니라 인간 고유의 영역이었던 창의성을 필요로 하는 예술분야까지 침범하였고 더불어 인공지능의 창의성에 대한 논란도 끊임없이 계속되고 있다.
그럼에도 불구하고 학문이라는 각각의 고유한 영역안에서 오랜 기간 형성된 학문간의 장벽을 허물고 인공지능이라는 과학기술과 예술창작 활동을 융복합시켜 과학과 예술의 협력을 통한 동반성장을 도모하고 예술창작 분야의 새로운 패러다임을 창출하였다는 것에 그 의의가 크다 하겠다.
이에 본 연구는 인간의 고유한 능력이자 재능인 창의성이 인공지능 시대와 어떻게 연결될 수 있으며 인공지능이 창의성을 요구하는 예술분야에서 어떠한 기술로 개발되었는지에 대해 알아보고자 한다. 또한 미래를 예측할 수 없는 현재 상황에서 인공지능을 활용한 예술의 특성을 살펴봄으로써 예술발달에 새로운 방향을 마련하는 자료로 활용하고 더불어 미래 인공지능 예술분야의 발전에 기여하는데 연구의 목적이 있다. 연구방법은 다음과 같은 순서로 기술한다.
첫째, 연구의 배경을 바탕으로 필요성과 목적에 대해 설정하고 구체적인 연구방법을 제시한다.
둘째, 인공지능의 정의와 역사에 대해 알아보고 빅데이터를 기반으로 한 인공지능 핵심기술 딥러닝에 대해 기술한다.
셋째, 인공지능을 활용한 예술분야에서도 특히 인공지능의 기술 개발이 활발하게 이루어진 문학, 음악, 미술 분야를 선정하여 인공지능과 예술이 융복합 된 사례조사를 통해 인공지능 예술창작 현황에 대해 기술한다.
넷째, 인공지능 예술창작분야의 사례분석을 바탕으로 인공지능의 예술에 따른 표현특성을 도출한다.
그 결과 인공지능이 활용된 예술의 표현특성으로는 기존에 학습한 데이터를 바탕으로 새로운 것을 창조하는 창의성, 미적활동을 통해 즐거움을 느낄 수 있는 유희성, 예술작품 제작과정에서 나타나는 노동의 해결책에 대한 편리성, 단순한 기술적 조작이나 새로운 기계학습의 프로그래밍 변화로 하나의 형태에서 전혀 다른 형태의 작품으로 바꿀 수 있는 가변성이 나타났다.
결론적으로 현재 인공지능의 창의성은 새로운 것을 창조했다기보다는 이미 주어진 데이터의 기계학습을 통하여 기존의 작품을 모사하여 재창조하는 수준이다. 즉 인공지능의 예술창작분야에 있어서 현재까지는 창의성이나 판단력, 직관 등 인간 고유의 영역을 대체할 수는 없으나 인공지능 예술창작의 기술 개발은 앞으로의 가능성을 예측할 수 있는 큰 성과라 할 수 있다.
정보화 기술(IT)시대에서 데이터 기술(DT)시대로 빠르게 전환되고 있는 4차 산업혁명시대의 인공지능기술 발달은 서비스산업과 노동가치의 상승으로 우리 삶을 높이는데 일조할 것이며 예술분야에서는 새로운 창작에 대한 영감을 주는 등 창작활동에 많은 도움이 될 것이다. 이에 본 연구는 앞으로 지속적으로 인공지능이 창의성을 요구하는 문화예술분야에 도움이 되기를 기대해본다.","최효승(Choi, Hyo Seung)",2017,https://www.riss.kr/link?id=A103042559
"사회관계망 서비스(SNS)를 활용한 대중음악 마케팅 사례와 홍보 효과 - 인스타그램, 유튜브, 틱톡 중심으로 -","코로나19의 창궐로 인한 사회적 거리두기는 일상생활 전반을 비대면화 시켰으며 이는 언택트 산업의성장으로 이어졌다. 이와 같은 급격한 사회 변화에 따라 디지털 기반의 활동이 급격하게 활성화되기 시작했다. 그중 가장 급부상한 것은 소셜 네트워크 서비스, 즉 SNS이며 대중음악 마케팅에서도 SNS를주요한 매체 중 한 가지로 인식하기 시작했다. 본 연구에서는 SNS를 활용한 대중음악 마케팅의 사례를다양한 SNS를 유기적으로 활용하는 홍보형, 티저 영상을 통해 신보에 대한 발매일이나 소속사 정보 등을 제공하는 정보형, SNS를 통해 가족이나 반려동물에 관한 내용 등 일상생활을 업로드하거나 팬덤이남긴 글에 댓글을 다는 등의 활동이 나타나는 소통형으로 구분해서 살펴보았다.
대중과 밀접한 관계를 맺고 있는 SNS는 오늘날 음반 시장에 있어 주요 마케팅 요인 중 한 가지로 자리 잡았으며 급변하는 트렌드에 맞춰 꾸준히 변화해 나가야 할 필요성이 확인되었다. SNS와 대중음악마케팅에 관한 본 연구가 확산되는 스마트 시대의 음악홍보 관련 유의미한 연구로 인식되기 바란다.",정민희,2022,https://www.riss.kr/link?id=A108324413
전자그림책 읽기와 종이그림책 읽기에서 나타난 유아의 언어반응 비교,"본 연구에서는 스마트폰 전자그림책과 종이그림책을 또래와 짝지어 읽을 때 나타나는 유아의 언어 반응을 비교해 봄으로써 매체의 차이에 따른 언어반응이 어떻게 다르게 나타나는가를 살펴보고자 한다. 연구대상은 만5세 유아 8명으로, 각 아동은 또래와 짝을 지어 전자그림책<구름빵> 읽기와 종이그림책<구름빵> 읽기에 참여하였다. 연구결과 전자그림책 읽기와 종이그림책 읽기에서 나타난 아동의 언어반응은 언어반응의 내용과 언어반응의 유형에서 다르게 나타났다. 언어반응의 내용에서 유아는 종이그림책 읽기에서는 사건에, 전자그림책 읽기에서는 장면에 많은 반응을 보였으며 언어반응의 유형에서는 종이그림책 읽기에서 정보적 반응을, 전자그림책 읽기에서 개인적 반응을 가장 많이 보였다.",손희정(HeeJung Son),2012,https://www.riss.kr/link?id=A60142966
간호간병통합서비스병동 간호사의 환자안전간호활동 관련 요인,"본 연구는 보호자 없이 간호인력이 24시간 환자를 간호하는 간호간병통합서비스병동 간호사의 환자안전문화인식, 간호전문직관, 피로와 환자안전간호활동의 관계를 확인하고, 환자안전간호활동 관련요인을 규명하고자 시도되었다. 자료는 2022년 7월 01일부터 7월 30일까지 수집되었고, 186부의 설문지가 이용되었다. 자료는 IBM SPSS Statistics 26.0을 이용하여 기술통계, t-test, ANOVA, Pearson correlation coefficient와 다중회귀분석을 진행하였다. 분석결과, 환자안전문화인식과 간호전문직관이 높을수록 환자안전간호활동 수행정도가 높게 나타나는 것으로 확인되었다. 따라서 간호간병통합서비스병동 간호사의 환자안전간호활동 수준을 높이기 위해서는 주기적이고 체계적인 교육프로그램을 활성화하는 등의 병원차원의 노력을 통하여 환자안전문화에 대한 인식을 공유하고 올바른 간호전문직관을 형성할 필요가 있다.",이은아(EunA Lee),2023,https://www.riss.kr/link?id=A108700191
ChatGPT를 활용한 대학 교양교육에서의 자기소개서 쓰기 사례 연구,"이 논문에서는 ChatGPT를 활용한 자기소개서 쓰기 사례 분석을 통해 새로운 글쓰기 경험과 그 효과에대해 살펴보았다. 학습자들은 다음과 같은 질문 전략을 통해 자기탐구를 수행했는데, ① 직무에 대한이해와 정보 파악 ② 자기 성향 및 경험 요소 ③ 방향성 점검 및 표현 체크 ④ 문제상황 인지 및 해결을 위한 조언과 평가 유형을 확인할 수 있었다. 학습 반응으로는 ChatGPT의 기능성에 호의적으로평가했으며 ① 지시한 문제뿐만 아니라 확장된 지식 및 정보를 제공하고 ② 개인의 고유한 특성과 역량을 반영하는 데 도움으로써 ③ 사회적 자아를 탐색하는 데 효과적이라는 의견들을 제출했다.
이를 통해 연구자는 대화형 인공지능의 활용이 기존의 정형화된 지식이나 정보를 일방적으로 수용하는방식이 아니라 협업을 통해 문제를 해결하는 자기주도적인 학습 경험을 확장하는 데 유의미하다고 보았다. 대화형 인공지능과의 협업을 통해 새로운 자기이해를 도모하고 생성된 텍스트에 대해 비판적이고분석적인 사고력을 요구하는 새로운 쓰기 경험이라 할 수 있다.",이지영,2023,https://www.riss.kr/link?id=A108759472
메타버스의 발전과 적용이 산업과 사회에 미치는 영향,"메타버스가 최근 여러 분야에서 많은 관심을 모으고 있다. 비대면 활동이 늘어나면서 메타버스는 현실 세계와 연동하여 경제적 가치 창출 외에도 사회적 교류와 문화 활동까지 그 영역을 확장해 나가고 있다. 메타버스는 AI, 빅 데이터, 3D 그래픽, 5G, 클라우드 컴퓨팅과 같은 기술의 고도화에 따라 가상세계와 현실세계를 연결하여 새로운 가치 를 창출하는 것으로 세계 유수의 기업들이 관심을 가지고 투자나 기술개발에 참여하고 있다. 이를 통해 경제·사회·문 화에 혁신적인 변화가 예상된다. 그러나 가상세계와 현실세계가 연동되기 위해서는 아직 풀어야 할 과제가 많다. 또 한 팬데믹 상황에 대응하는 비대면 사회 활동을 넘어서 다양한 산업에서 가상공간을 이용한 현실적 체험과 수익 창 출을 위한 제품이나 서비스의 획기적인 발전이 이루어야 한다. 본 연구를 통해 메타버스의 본질과 현황 및 발전 그리 고 적용분야를 분석하고 향후 예상되는 문제점을 도출하여 다가오는 메타버스 시대에 글로벌 경쟁력을 확보하기 위 한 전략과 방안을 제시한다.",문승혁,2022,https://www.riss.kr/link?id=A108145703
대중음악 흥행 요인에 대한 연구: 인터넷 밈(Internet Meme)의 매개효과를 중심으로,"최근 K-POP 열풍에서 볼 수 있듯이 한국 음악 산업의 규모와 영향력은 더욱더 커지고 있다. 한국의 음원 시장에는 1년에 최소 6천 개의 음원이 공개되고 있지만 흥행했다고 말할 수 있는 음원은 많지 않다. 이에 흥행작을 만드는 요인이 무엇인지 밝히기 위한 많은 연구 및 시도가 이루어지고 있다. 음악의 상업적인 성공에는 음악의 질뿐만 아니라 미디어 노출이나 홍보와 같은 상업적인 요소 또한 중요한 역할을 담당한다. 최근 대중음악 산업에서는 인터넷 밈을 활용한 마케팅이 많이 나타나는데, 인터넷 밈이란 사람들 사이에서 확산되는 문화적 단위로 이미지나 동영상 등 다양한 형태로 확산되는 활동이나 트렌드라고 할 수 있다. 인터넷 환경과 디지털 커뮤니케이션 특성에 따라 다양한 밈의 형태로 콘텐츠들이 확대 재생산되고 있으며, 이는 소비자들에게 더 큰 반응을 일으킨다. 기존에 인터넷 밈 현상은 자연적으로 발생해왔으나, 최근 마케팅 효과를 인지한 아티스트 측에서 마케팅의 요소로 활용하고 있다.
본 논문에서는 대중음악의 흥행 요인과 흥행의 관계에서 인터넷 밈의 매개효과를 분석하고, 이를 반영한 예측 모델을 제안하였다. 분석 결과, ‘커버효과’와 ‘챌린지효과’의 매개효과가 있는 요인은 동일하게 나타났다. 내부 흥행요인 중에서는 ‘가수의 인지도’, ‘POP, 댄스, 발라드, 성인가요, 일렉트로니카’ 장르에서 매개효과가 존재하였으며, 외부 흥행 요인 중에서는 ‘기획사 역량’,‘음악 방송 프로그램 출연 횟수’, ‘뉴스 기사 수’에서 매개효과가 나타났다. 커버효과와 챌린지효과를 반영한 예측 모형은 각각 F1-score가 0.6889, 0.7692로 나타났다. 본 연구는 실제 차트 데이터를 수집·분석하여 실무적으로 활용 가능한 상업적인 방향성을 제시하였으며, 대중음악의 여러 흥행 요인과 인터넷 밈의 매개효과가 존재한다는 것을 발견하였다는 점에서 의의를 갖는다.",심유정,2023,https://www.riss.kr/link?id=A108533633
간호대학생의 자기효능감과 학업스트레스가 대학생활적응에 미치는 영향,"본 연구의 목적은 간호대학생을 대상으로 대학생활적응과 밀정한 관련이 있는 자기효능감과 학업 스트레스 정도를 파악하고 대학생활적응과 하위 구성요소에 영향을 미치는 예측요인을 확인하고자 하였다. 2017년 6월 1일부터 15일까지 자가 보고식 설문조사로 진행하였으며 측정도구는 자기효능감, 학업스트레스, 대학생활적응 측정도구를 사용하였다. 자료 분석은 SPSS 22.0 프로그램을 이용하였으며 기술통계, 상관관계, 다중 회귀분석을 실시하였다. 본 연구결과 간호대학생의 자기효능감 평균은 2.95점, 학업스트레스는 2.81점, 대학생활적응은 3.28점으로 나타났으며, 자기효능감, 학업스트레스, 대학생활적응 간에 유의한 상관관계를 보였다. 자기효능감 수준이 높을수록 학업스트레스가 낮을수록 대학생활적응을 잘하는 것으로 나타났다. 이들 전체 변수는 대학생활적응에 대해 약 24%의 설명력을 나타냈으며(F= 11.49, p<.001) 하위변수로는 전공수월성이 자기효능감과 학업스트레스 모두와 통계적으로 유의하였으며 27.8%의 높은 설명력을 나타냈다(F= 15.64, p<.001). 결론적으로 간호대학생들의 학업 스트레스 대처능력 향상과 자기효능을 높이기 위한 프로그램 개발 및 지원이 필요하다.",정효주(Hyo-Ju Jung),2018,https://www.riss.kr/link?id=A105544138
소년범에 관한 국내 연구 동향 분석,"본 연구는 소년범에 관한 연구들을 종합하여 동향을 분석하고 향후 과제를 제시하는 데 목적이 있다. 이를 위하여 국내 등재 학술지와 학위논문 434편을 대상으로 연도, 연구 주제, 연구방법으로 구분하여 분석하였다.
연구 결과와 논의는 다음과 같다. 첫째, 소년범 관련 연구의 연도별 동향의 경우 해마다 증감은 있었으나 대체로 큰 변동을 보이진 않았다. 다만, 소년범과 관련된 사회적 사건이 발생한 후 이를 언론에서 다수 보도한 경우, 연구물의 수도 증가하는 것을 볼 수 있었다. 추후 소년범 관련 연구는 사회적 사건의 유무에서 벗어나 이들의 특성과 경험 등에 대한 깊이 있는 연구가 진행될 필요가 있다. 둘째, 소년범 관련 연구의 주제는 ‘법·제도’에 대한 연구가 가장 많이 이루어졌으며 가장 적게 이루어진 연구의 주제는 ‘기타’를 제외하고 ‘시설’에 대한 연구였다. 앞으로 소년범 연구는 다양한 주제로 폭넓게 수행될 필요가 있다. 셋째, 연구방법의 경우 가장 많이 활용된 연구방법은 문헌 연구방법이었다. 질적 연구방법이나 양적 연구방법을 활용한 연구는 상대적으로 적었다. 이는 소년범을 대상으로 연구를 수행할 경우 연구 윤리 문제와 더불어 접근이 쉽지 않다는 복합적인 이유에서 비롯된 것으로 보인다. 추후 소년범 연구는 양적 혹은 질적 연구방법을 적극적으로 활용하여 소년범의 정서적 특성은 어떠한지, 출소 후 어떻게 살아가는지 등에 대하여 보다 깊이 있는 연구가 수행될 필요가 있다.
이 연구는 소년범 관련 연구의 동향을 체계적으로 분석하여 향후 연구 방향을 제시했다는 점에서 의의가 있다. 향후 소년범 연구가 보다 다양하고 폭넓게 이루어진다면 소년범 관련 정책과 제도의 마련에 큰 도움이 될 것이고, 소년범에 대한 사회적 편견 등도 다소 완화될 것이다.",유주영,2022,https://www.riss.kr/link?id=A108402596
