
"간호대학생의 비판적 사고성향, 임상실습 스트레스 및 핵심기본간호술 자신감이 임상실습 적응에 미치는 영향","본 연구는 간호대생의 비판적 사고성향, 임상실습 스트레스, 핵심기본간호술 자신감, 임상실습 적응 정 도를 파악하는 서술적 조사연구이다. 2019년 6월부터 7월까지 간호대학생 4학년 207명에게 자가설문지를 통해 조사하였다. 수집된 자료는 SPSS/WIN v24.0을 이용하여 t-test, ANOVA와 다중회귀분석을 시행하여 분 석하였다. 임상실습 스트레스와 비판적 사고성향은 음의 상관관계(r=-.18, p=.010)로 나타났다. 핵심기본간 호술 수행자신감은 비판적 사고성향과 양의 상관관계(r=.25, p<.001), 임상실습 스트레스와 음의 상관관계 (r=-.17, p=.017)를 나타냈다. 임상실습 스트레스는 임상실습 적응과 양의 상관관계(r=.44, p<.001)를 보였 고, 임상실습 적응에 가장 큰 영향을 미치는 요인(β=.43)으로 나타났으며(F=18.34, p<.001), 설명력은 약 23.1%였다. 이상과 같이 임상실습 스트레스는 임상실습 적응에 영향을 미치는 요인으로, 간호대학생의 임상실 습에서 받는 스트레스 요인들을 파악하고 교육과정 개발에 반영할 필요가 있다.",장영미,2020,https://www.riss.kr/link?id=A107019249
지구온난화에 따른 질병의 양상변화와 대응 방안에 관한 연구,"지구온난화로 인한 기후 및 환경변화가 건강과 의료에 미치는 영향을 국내외 자료를 통해 검토하였으며, 특히 건강 및 의료 측면에서 대응 방안을 제시하는 데 목적이 있다. 기후변화, 건강 및 의료에 관련된 다양한 국내외 문헌, WHO 및 IPCC와 같은 국제기구의 기후변화 관련 조치 및 연구자료, 주요 해외 선진국의 정책 대응을 분석하였다. 지구온난화로 인한 기후 및 환경변화는 건강과 의료에 심각한 영향을 미칠 수 있으며, 대응 방안을 모색하는데 중요성이 부각되고 있다. 기후변화에 대한 대응을 위해 첫째로 법률 개정이 필요하며, 기후 건강에 관한 개별 법률 제정도 필요하다. 둘째로, 기후요인의 모니터링과 보고 시스템을 강화해야 하며, 기후변화와 질병의 관계를 확인하기 위한 연구개발에 투자해야 한다. 셋째로, 기후 건강과 관련된 전문가들을 강화하고 보건당국의 조직 확대가 필요하다. 기후변화는 인간 건강과 국가 안보에 위협을 가할 수 있으며, 협력과 연대로 부정적인 영향을 최소화하는 것이 중요하다. 이를 통해 기후변화에 대응하는데 효과적인 방법을 모색해야 한다.",정용주,2023,https://www.riss.kr/link?id=A108723446
"신규간호사의 공감수준과 인지된 프리셉터의 공감수준이 직무만족도, 직무스트레스 및 이직의도에 미치는 영향","본 연구의 목적은 신규간호사의 공감수준과 인지된 프리셉터의 공감수준이 그들의 직무만족도, 직무스트레스 및 이직의도에 미치는 영향을 확인하는 것이다. 이를 위해 신규간호사를 대상으로 프리셉터십을 운영하는 3개의 의료 기관에 재직 중인 12개월 이하의 신규간호사에게 설문을 실시하였다. 성인학습이론에 따른 프리셉터십에서 프리셉터는 신규간호사에게 심리적 환경을 조성해 줄 필요가 있으며, 공감은 경험 주체가 인지하여야 한다. 연구 결과 신규간호사의 공감수준이 높을수록 인지된 프리셉터의 공감수준이 높았으며, 신규간호사의 공감수준이 높은 집단은 직무만족도가 높고 직무스트레스와 이직의도가 낮았으며, 공감수준은 신규간호사의 직무만족도에 영향을 미치는 것으로 드러났다. 신규간호사가 경험한 인지된 프리셉터의 공감수준이 낮은 집단은 직무만족도가 낮고 직무스트레스와 이직의도가 높았으며, 인지된 프리셉터의 공감수준은 직무스트레스와 이직의도에 영향을 주었다. 이러한 결과를 토대로 신규간호사와 프리셉터 교육과정에 공감능력향상 프로그램의 도입을 제언한다.",최주희(Ju-Hee Choi),2019,https://www.riss.kr/link?id=A106102163
소셜미디어에서 에코챔버에 의한 필터버블 현상 개선 방안 연구,"최근 소셜미디어로 접하는 정보 증가로 알고리즘 기반 추천 형식은 사용자 정보에 기반하여 선별적으로 정보를 제공하는데, 이러한 알고리즘은 자주 에코챔버(Echo Chamber)에 의한 필터버블(FilterBuble) 효과를 일으킨다. 에코챔버는 밀폐된 시스템 안에서만 이루어지는 의사소통으로 인해 신념이 증폭되거나 강화되는 현상을 의미하고 필터버블은 정보 제공자가 이용자의 관심사에 맞춰 맞춤형 정보를 제공하여 이용자는 필터링 된 정보만 접하게 되는 현상을 의미한다. 본 연구의 목적은 이러한 에코챔버에 의한 필터버블 현상을 개선하는 방안으로 정보를 효율적으로 선별하는 방법을 제시하는 것이다. 연구 진행 방법은 유튜브, 페이스북, 그리고 아마존에서 사용되는 추천 알고리즘을 분석하였다. 본 연구에서는 추천 알고리즘으로 생기는 문제점에 대해서 소셜미디어 사용자의 비판적 사고능력 훈련이나 자기보존법칙에 따른 객관적 윤리 기준 강화 등의 인문학적 해결 방안과 모델 기반 협력 필터링이나 교차적 추천 방식의 기술적 해결 방안을 제시하였다.
결과적으로 추천 알고리즘은 지속적 기술 보완과 새로운 기법 개발을 위한 노력이 이루어져야 하며, 소셜미디어를 대하는 사용자는 비판적 사고 훈련과 정치적 의사소통 교육을 통해 인지부조화를 이겨내고 확증편향에 빠지지 않도록 하는 인문학적 노력이 병행되어야 한다.",조진형,2022,https://www.riss.kr/link?id=A108146816
신규간호사의 그릿과 재직의도의 관계에서 임상수행능력의 매개효과에 대한 융복합적 연구,"본 연구는 신규간호사의 그릿과 재직의도의 관계에서 임상수행능력의 매개효과를 규명하기 위해 시도된 서술적 상관관계연구이다. 연구대상은 2개 광역시와 1개 도의 300병상 이상 종합병원에서 근무하는 신규간호사 232명이었다. 자료분석은 기술통계, t-test, one-way ANOVA, Pearson’s correlation coefficient로 하였고, 매개효과 분석은 Baron과 Kenny의 다중회귀분석을 활용한 3단계 분석방법과 Sobel test로 하였다. 연구결과 신규간호사의 그릿과 임 상수행능력(r=.38, p =.011), 그릿과 재직의도(r=.32, p =.016), 임상수행능력과 재직의도(r=.33, p <.001)는 유의한 정적 관계가 있었고, 그릿과 재직의도의 관계에서 임상수행능력은 부분 매개효과가 있는 것으로 확인되었다(z=3.14, p <.001). 본 연구결과를 근거로 신규간호사의 임상수행능력과 재직의도를 높여주기 위해 그릿을 향상시킬 수 있는 중재 수행을 적극 권장한다.",고진희,2020,https://www.riss.kr/link?id=A106750491
디지털헬스케어에서의 인공지능 적용 사례 및 고찰,"디지털 헬스케어의 정의는 광의로는 헬스케어 산업과 ICT가 융합되어 개인건강과 질환을 관리하는 산업 영역을 의미하고, 협의로는 환자의 건강을 향상시키기 위해 의료 서비스를 관리하는데 다양한 의료 기술을 사용하는 것을 포함한다. 본 논문은 디지털 헬스케어 분야에 적용되고 있는 인공지능과 기계학습 기법들의 활용사례 소개를 통해 다양한 디지털 헬스케어 분야에 인공지능 기술이 안정적이고 효율적으로 적용할 수 있도록 설계 지침을 제공 하는 데 목적이 있다. 이를 위해 본 논문에서는 의료분야와 일상생활 분야로 나누어서 살펴보았다. 두 영역은 다른 데이터 특성을 갖는다. 두 개의 영역을 보다 세분화하여 데이터 특성 및 문제 정의 및 특징에 따른 인공지능 알고리즘 활용사례를 살펴보았다. 이를 통해 디지털 헬스케어 분야에서 활용되는 인공지능 기술들에 대한 이해도를 높이고 다양한 인공지능 기술의 활용에 대한 가능성을 검토하여 인공지능 기술이 헬스케어 산업과 개인의 건강한 삶에 기여할 수 있는 근본적인 가치에 대해 고찰한다.",박민서,2022,https://www.riss.kr/link?id=A108012432
유전자편집 기술의 발전에 대응한 인간배아 유전자치료의 규제방향,"크리스퍼 유전자가위 기술은 본격적인 유전자치료 시대의 등장을 예고하고 있다. 특히 인간배아를 대상으로 하는 유전자치료는 세대 간에 이어지는 유전병의 고리를 끊을 수 있다는 엄청난 사회·경제적 효용을 가지고 있다. 하지만 인간으로 발생할 수 있는 배아의 연구 수단화, 기술적 한계로 인한 부작용, 유전자의 역할에 대한 지식의 한계, 결과가 발현될 다음 세대의 동의 부재, 치료가 아닌 강화에 적용될 가능성과 문제점 등 다양한 사회·윤리적 문제 역시 내포하고 있다. 이러한 문제점 때문에 대부분의 국가에서 인간배아를 대상으로 하는 유전자치료를 금지하고 있으나 그 잠재적 효용을 고려하여 치료를 위한 연구는 허용하는 국가들이 많다. 다가올 인간배아 유전자치료 시대를 대비한 규제방향에 대해서도 외국에서는 다양한 논의가 이루어지고 있다. 반면, 우리나라는 인간배아 유전자치료를 위한 연구의 허용 여부가 명확하지 않고 인간배아 유전자편집 행위에 대해서도 법률로 규율하고 있지 않다. 인간배아 유전자치료를 위한 연구는 위험성을 고려한 합리적 범위를 설정하여 허용하되, 생식 목적의 유전자편집 행위는 법률로 금지할 필요가 있다. 아울러 다가올 인간배아 유전자치료 시대에는 치료의 기술적·윤리적 한계선 설정, 안정성 확보를 위한 장기간의 추적조사, 경제력에 의존하지 않는 보편적 의료접근권 보장, 유전자치료 강제행위의 금지 등의 법제화가 필요할 것이다.",박대웅(Park Dae-woong),2016,https://www.riss.kr/link?id=A102000801
딥러닝 기술이 가지는 보안 문제점에 대한 분석,본 논문에서는 딥러닝 기술이 인터넷과 연결된 다양한 비즈니스 분야에 새로운 형태의 비즈니스 업무에 활용할 수 있도록 보안에 관한 문제점을 분석하고자 한다. 우선 딥러닝이 비즈니스 영역에 보안 업무를 충분히 수행하기 위해서 는 많은 데이터를 가지고 반복적인 학습을 필요하게 된다. 본 논문에서 딥러닝이 안정적인 비즈니스 보안 업무를 완벽하 게 수행할 수 있는 학습적 능력을 얻기 위해서는 비정상 IP패킷에 대한 탐지 능력과 정상적인 소프트웨어와 악성코드를 탑재하여 감염 의도를 가지고 접근하는 공격을 탐지해낼 수 있는 인지 능력을 갖추고 있는지를 분석하였다. 이에 본 논문에서는 인공지능의 딥러닝 기술이 시스템에 접근하여 문제의 비즈니스 모델을 안정적으로 수행할 수 있게 하기 위해서는 시스템내의 비정상 데이터를 추출해 내고 시스템 데이터 침해를 구분해 낼 수 있는 수학적 역할의 문제점을 보완하기 위해 새로운 IP에 대한 세션 및 로그 분석을 수행할 수 있도록 보안 엔진이 탑재된 딥러닝 기술을 개발하여 비즈니스 모델에 적용시켜서 취약점을 제거하여 비즈니스 업무 능력을 향상시키도록 문제적 방안을 비교 분석하였다.,최희식,2019,https://www.riss.kr/link?id=A106221280
여대생들의 자궁경부암 및 자궁경부암 예방접종 캠페인에 대한 인식,"자궁경부암은 국내 여성들의 건강을 위협하는 질병으로서 우리나라에서도 매년 4천여 명의 여성이 자궁경부암 진단을 받고, 하루 평균 3명의 여성이 자궁경부암으로 사망하고 있다. 본 연구에서는 발생 증가세를 보이고 있는 군에 해당되며 2차 접종 대상인 14~26세 여성에 포함되는 여대생들을 대상으로 자궁경부암 및 자궁경부암 예방접종과 관련된 인식 조사를 실시하였다. 19명의 여대생들을 대상으로 심층 인터뷰를 진행한 결과 자궁경부암 및 자궁경부암 예방접종과 관련 되어서는 확산되지 않은 정보로 인해 자궁경부암이 중요하지 않다는 인식, 자궁경부암 관련 정보 접근의 우연성 및 부족, 발병원인이 여성들에게만 있다고 강조하는 정보의 편향성 및 용어의 문제가 있는 것으로 나타났고, 예방접종을 받지 않는 이유로는 사회적 편견, 비용, 부작용 및 막연한 두려움이 도출되었다. 연구결과 여대생들은 자궁경부암 및 예방접종과 관련되어 실질적이고 팩트 위주의 매세지, 또래 여성 및 남성도 포함된 메시지, 접근성과 노출 빈도수 높은 캠페인을 선호하는 것으로 나타났다. 본 연구 결과는 발병률이 증가하고 있는 15-35세 군 여성들을 대상으로 자궁경부암 예방교육을 실시할 경우 도움이 될 수 있다.",장안리(Ahnlee Jang),2021,https://www.riss.kr/link?id=A107934463
"노년층의 디지털기술교육의 과제 : 노인수강자, 교육자, 정부관계자를 중심으로","현대 사회는 인공지능(AI), 빅데이터(Big Data), 사물인터넷(IOT) 등을 기반으로 하는 기술융합의 시대로 사람들은 삶의 다양한 분야에서 발전된 기술을 활용함으로써 편리함을 누리고 있다. 그러나 노인들은 대표적인 정 보소외계층에 속하여 기술을 적극적으로 이용하지 못하고 있다. 이에 노인 대상 디지털기술교육을 통해 세대 간 정 보화 수준 격차를 줄일 필요성이 있다. 따라서 본 논문에서는 급속한 고령화의 상황 속에서 노인들의 정보화격차로 인한 사회적 손실을 줄이고자 첫째, 노인디지털기술교육에 대한 국내외 현황을 살펴보았으며 둘째, 노인 디지털교 육 수강자, 노인 디지털교육 교육자, 노인 디지털교육을 계획하는 정부관계자를 중심으로 심층 인터뷰를 진행하여 그 결과를 분석하였다. 노인 수강자의 경우 수업인원축소와 맞춤형 교육을 요구하였으며 교육자는 수업의 질을 높 이기 위한 경제적 지원과 강사역량교육의 필요성을 제안하였다. 정부관계자는 노년층의 디지털교육 담당 인력충원 과 경제적 지원, 교육 홍보의 확대를 요구하였다. 이에 본 연구는 효율적인 노인디지털교육의 키워드로 ’대상자 중 심‘, ’인프라 확충‘, ’접근성‘ 등의 키워드를 확보하여 노인디지털교육 시스템 개선에 도움을 주고자 하였다.",조진실,2021,https://www.riss.kr/link?id=A107294246
"혈액투석 간호사의 언어폭력경험, 감정노동, 간호근무환경이 직무스트레스에 미치는 영향","본 연구는 혈액투석 간호사의 언어폭력경험, 감정노동, 간호근무환경이 혈액투석 간호사의 직무스트레스에 미 치는 영향을 파악하기 위해 실시되었다. 자료수집은 혈액투석 간호사 169명을 대상으로 2021년 3월 1일부터 3월 30 일까지 구조화된 설문지를 이용하여 시행되었다. 자료분석은 IBM SPSS Statistic Version 23.0프로그램을 이용하여 t-test, ANOVA, Pearson's correlation coefficient, multiple regression으로 하였다. 혈액투석 간호사의 직무스트레 스에 영향을 미치는 주요 요인은 감정노동(β=.354, p<.001), 언어폭력경험(β=.255, p=.005), 간호근무환경(β=-.214, p=.003)이었다. 혈액투석 간호사의 직무스트레스 관리를 위해서는 언어폭력경험과 감정노동 감소와 긍정적인 간호근 무환경 조성을 위한 방안 마련이 필요하다.",김우주,2022,https://www.riss.kr/link?id=A108099831
지방자치단체 기후변화 적응 거버넌스 변화 연구,,"고재경(Koh, Jaekyung)",2017,https://www.riss.kr/link?id=A103224083
교권침해를 경험한 초등학교 교사의 회복과정에 대한 자문화기술지,"본 연구의 목적은 한 초등학교 교사의 교권침해 경험과 그 회복과정을 조명하는 것이다. 이를 위하여 교권침해 교사의 경험을 통해 교권침해 문제해결을 어렵게 하는 학교의 구조적 메커니즘을 분석하고, 공론화를 통해 학교 차원에서 교권침해 문제를 해결해 가는 과정을 서술하였다. 연구방법은 경험 당사자의 목소리를 효과적으로 들려줄 수 있는 자문화기술지를 사용하였다. 연구 결과는 크게 침해경험과 회복과정으로 나누어 서술하였다. 침해경험은 교권침해 문제 해결을 어렵게 하는 학교 시스템의 구조적인 문제점을 보여주고, 학부모와 학생에 의한 교권침해 경험을 보여준다. 교권침해로부터 회복하는 과정은 첫째, 관리자 교체와 더불어 공론화를 위한 연구자의 노력으로 학교 차원의 연대 형성이 가능했고, 둘째, 학부모와 관계 회복 셋째, 교사로서의 권위와 수업권 회복이 필요했음을 시사한다. 연구 결과가 주는 시사점은 다음과 같다. 첫째, 교권침해 문제를 공론화하고 학교 차원에서 해결하기 위해서는 변혁적 리더십을 가진 관리자가필요하다. 둘째, 암묵적 능력주의에 젖은 교직 사회의 분위기와 교사들의 인식이 변화할 필요가있다. 셋째, 교권 보호를 위한 절차 중심의 해결 방식이 수정되어야 한다. 마지막으로 교권 회복의 최종 목표는 수업의 정상화이며, 교사의 원활한 수업을 위해 어떤 지원이 필요한지 고민해 볼필요가 있다","장세린(Chang, Se rin)",2021,https://www.riss.kr/link?id=A107867658
ChatGPT의 교육적 활용 고려 요소 탐색을 위한 질적 연구,"생성형 인공지능 기술을 기반으로 한 도구 중 하나로 ChatGPT에 대한 활용 가능성이 모색되고 있다. 하지만 이를 교육적으로 활용할 때, 어떠한 요소를 고려해야 하는지를 학습자의 실제적인 인식을 기반으로 확인한 연구는 미흡하다. 본 연구는 교육 현장에서 ChatGPT를 활용할 때, 고려해야 하는 요소가 무엇인지를 질적 연구를 통해 도출하고자 하였다. 연구 결과, 교육에 있어서 ChatGPT를 효과적으로 활용하기 위해서는 생성된 정보에 대한 비판적 사고, 학습을 지원하는 한 가지 도구로서 인식하여 의존적인 활용 지양, 올바른 윤리적 활용에 대한 사전 교육 실시, 명확하고 적절한 질문 생성, 답변에 대한 재검토와 종합화 총 다섯 가지의 핵심 고려 요소를 확인하였다. 향후 이상의 요소를 종합적으로 구성한 교수설계 모형 개발이 이루어질 필요가 있다.",한형종,2023,https://www.riss.kr/link?id=A108687959
온라인게임 아이템거래 발생 원인 분석,"아이템 거래의 속성에 대해서는 그동안 많은 연구가 진행되어 왔으나, 막상 아이템 거래의 발생 원인에 대해서는 설문조사 등의 방법만 수행되어 왔고, 온라인 게임 내에서의 경제 분석 에 의한 연구는 이루어지지 못하였다. 따라서 본 연구는 온라인 게임 내에서의 아이템 수요와 공급에 대해 역할참석, 직접관찰, 관련자 면담 등의 방법을 사용하여 게임 내에서의 아이템 거래의 원인을 분석하였다. 분석 결과 아이템 거래가 일반 게이머들 사이에서 차지하는 비중은 크지 않으며, 인챈트를 즐기는 소수의 게이머, 혈전 및 공성전을 수행하는 사람들 사이에서 중점적으로 발생한다. 또 주된 아이템 공급자는 일반게이머가 아니라 작업장이다. 즉 아이템 거래는 소량으로 적은 액수를 거래하는 다수의 게이머와, 대량으로 많은 액수를 거래하는 소수의 매니아 게이머에 의해서 발생한다. 이러한 아이템 거래의 소수 집중적 속성을 파악하는 것은 아이템 거래와 관련된 제반 정책 및 사회적 영향을 검토하는 데에 기반 지식으로 활용될 수 있을 것이다.",최성락,2007,https://www.riss.kr/link?id=A100161215
제4차 산업혁명과 AI 윤리,"물리학 기술, 디지털 기술, 생물학 기술의 세 가지 핵심 분야를 바탕으로 한 융합으로 진행되는 제4차 산업혁명시대는 우리가 살고 있는 사회의 모습을 급격하게 변화시키고 있다. 그 중 가장 핵심을 차지하는 디지털 분야의 AI 기술은 기술과 인간의 관계를 새롭게 재편하고 있다. 기술의 창조자였던 인간이 기술의 노예로 종속되는 호모 사피엔스에 대한 호모 파베르의 승리가 극적으로 드러나게 된 것이다. 이런 상황을 극복해 나가기 위해 AI 윤리에 대해 논의하는 것이 반드시 필요하다. AI 윤리는 문제가 발생한 이후 그것의 해결책을 모색하는 기존 응용 윤리와 비교할 때, 윤리적 문제가 발생하기 이전 그것의 징후를 예측해 나가는 것이라는 점에서 독특한 위상을 지닌다. 또한 AI 윤리는 윤리 실천의 주체로서 인간의 위상을 재정립하기 위한 발판으로서 기능할 수 있다는 특징도 가진다. 자율성, 공공성, 공정성, 책무성, 투명성의 원칙을 핵심으로 하는 AI 윤리 원칙을 설정하고, 그것을 실천하기 위한 기반으로 도덕 교육 또한 각 원칙에 대응하는 주제들을 선정하여 효과적 수행이 가능하기 위한 방법들을 모색해 나가야 한다.",정결 ( Jung Kyul ),2021,https://www.riss.kr/link?id=A107353325
건강기능식품에 대한 20대 소비자의 인식 유형 연구,"본 연구는 최근 핫 소비 아이템으로 부각되고 있는 건강기능식품에 대한 20대 위주 MZ세대 소비자의 주관성을 알아보고자 하였다. 홍삼, 비타민, 프로바이오틱스로 대표되는 건강기능식품 시장에서 젊은층이 왜 핵심 소비자층으로 급부상되었는지에 그 특성과 의미, 가치에 대해 살피고자 Q 방법론을 활용하여 연구를 진행하였다. QUANL 분석 프로그램을 이용, 총 37개의 Q 표본과 30개의 P 표본을 연구에 사용한 결과 독특한 성향을 지닌 3개의 유형을 발견하였다. 건강기능식품의 기능과 효력에 매우 긍정적이며 적극적인 관심을 표출하는 소비자인 제1유형, 건강기능식품이 심리적 안정에는 도움이 되지만, 의심이 많고 선택에 있어서 까다로운 모습을 보이는 소비자인 제2유형, 맹목적인 신뢰보다는 건강기능식품을 탐구하여 실생활에 적극적으로 활용하는 소비자인 제3유형이 그것이다. 이에 대해서 제1유형을 ‘유비무환(有備無患)’, 제2유형을 ‘반신반의(半信半疑)’, 제3유형을 ‘실사구시(實事求是)’로 명명하였다. 그리고 해당 속성들을 반영해 건강기능식품 시장의 새로운 특성과 소비자층 구분, 판매촉진을 위한 다양한 전략적 아이디어를 제시하였다.",최원주,2022,https://www.riss.kr/link?id=A108295406
간호대학생의 웰다잉에 대한 인식과 연명치료중단과 안락사에 대한 태도,"본 연구는 간호대학생을 대상으로 웰다잉에 대한 인식과 연명치료중단의 태도 및 안락사에 대한 태도 간 의 관계를 알아보고자 시도되었다. 연구 기간은 2018년 4월 1일부터 5월 6일까지로 D광역시에 소재한 간호학 과의 288명의 간호대학생을 대상으로 조사를 실시하였다. 연구결과 웰다잉에 대한 인식은 연명치료중단의 태도 와 적극적 안락사, 소극적 안락사와 정(+)의 상관관계로, 연명치료중단의 태도는 적극적 안락사, 소극적 안락사 와 정(+)의 상관관계로 나타났다. 간호사는 연명치료과정에서 많은 윤리적 갈등을 경험할 것으로 예상되는 바 간 호대학생 시기에 웰다잉에 대한 인식, 생명윤리교육을 받는 것이 필요하고 교육프로그램의 개발과 효과평가가 요구된다.",김미자,2020,https://www.riss.kr/link?id=A107184130
