
"자기주장훈련 프로그램이 간호사의 부정적 평가에 대한 두려움, 자기주장행동 및 의사소통에 미치는 효과에 관한 융합 연구","본 연구는 자기주장훈련 프로그램이 간호사의 부정적 평가에 대한 두려움, 자기주장행동 및 의사소통에 미치는 효과 를 확인하고자 수행되었다. 연구설계는 비동등성 대조군 전후 설계에 의한 유사실험 연구이다. 연구대상은 G시에 소재한 2개 대학교 간호대학원생으로 실험군 14명, 대조군 18명 총 32명이었다. 자료 수집 기간은 2018년 3월 13일부터 2018년 5월 8일까 지이었다. 실험군에게는 주 1회, 180분씩 총 6회기 본 프로그램을 진행한 후 교육 전과 후에 구조화된 설문지를 이용하여 측정하였다. 자료 분석 방법은 Fisher’s exact test, χ2-test, t-test를 사용하였다. 연구결과 자기주장훈련 프로그램이 간호사의 자기주장행동과 의사소통에서 유의한 차이가 나타났다. 본 연구는 융복합 기반 시대 흐름에 맞춰 간호사의 자기 주장능력과 의사소통능력 함양을 위한 효과적인 훈련방안 개선에 기여하고자 한다.",김경임,2018,https://www.riss.kr/link?id=A105624403
중년의 우울증 감소에 독서치료가 미치는 영향,"자살이 다시 증가하고 있다. 특히나 코로나시대에 문제되고 있는 것이 중년의 자살이다. 자살은 대부분 우울증을 겪고 있는 사람들에게 발생할 비율이 높아 자살을 예방하기 위해서는 우울증치료에 관심을 가져야 한다. 자살사고 중 우울증 환자의 비율이 높고, 자살시도는 일반인의 4배가 되는 등 중년 우울증이 심각해지고 자살로 연결되고 있다는 보고들이 나오면서 중년의 우울증에 관심이 모아지고 있다. 그렇다면 자살과 밀접한 관계가 있는 우울증을 치료하는 효과적인 방법은 없을까? 우울증을 효과적으로 관리하는 방법은 없을까? 영국에 독서를 통한 책 처방의 효과가 입증되며 세계의 관심이 집중되었고 인지행동 독서치료프로그램이 중년여성의 우울감 감소에 효과가 있다는 연구도 있었다. 따라서 중년을 대상으로 독서치료는 우울증과 심리불안 대체치료로 주목받고 있기에 중년의 우울증 치료에 효과가 있을지에 대해 독서치료의 효과를 확인하고자 하였다. 경기도 소도시에 사는 중년남녀 5명을 대상으로 매주 1회 90분씩 총10회 독서치료프로그램을 진행하였다. ‘중년들의 우울증 감소에 영향을 미칠 것인가’ 하는 효과성을 살펴보기 위해서였다. 우울증과 관련이 있는 자아존중감과 불안감도 함께 살펴보았다. 효과성을 알아보기 위해 척도지 사전, 사후검사와 프로그램을 진행하면서 나누었던 내용을 중심으로 확인하였다. 프로그램 진행결과 독서치료가 중년들의 우울증감소에 영향을 미치는 것으로 나타났다. 자아존중감과 불안감에도 영향을 미쳤다. 프로그램에 참석한 횟수와 우울증 변화량은 관계가 있는 것으로 나타났는데 꾸준히 참석한 내담자가 더 효과가 있는 것으로 나타났다. 중년들이 독서치료프로그램에 참여하면 우울증과 자존감, 불안감이 대체로 참여회수에 관련하여 효과가 있었다. 10회기 내에서 효과를 높이기 위해 결석횟수를 줄이고 더 많은 참여할 수 있도록 독려할 필요가 있다.","신경희(Shin, Kyoung Hee)",2021,https://www.riss.kr/link?id=A107912787
먹방의 유행과 문화현상 연구,"2000년대 초반 뉴미디어 플랫폼을 통해 등장한 먹방은, 사회경제적 조건의 악화 속에서 혼자 식사를 해야 하는 청년 세대의 삶을 반영하였다. 많은 젊은이들이 먹방을 함께 시청하며, 비슷하게 어려운 처지를 겪는 이들과 가상적 일상 생활의 공동체를 구축하며 위안을 얻을 수 있었다. 이후 먹방은 사회를 반영하며, 또한 시청자의 요구를 수용하며 다양한 형태로 진화하여, 현재는 한국에서만이 아니라 글로벌 현상이 되었다. 기존 연구는 이런 먹방의 성장과 변화보다는 초반에 나타나는 화제거리로서의 현상에만 주목하여 먹방을 제한적으로 다루고 있다. 본 논문은 이런 한계를 비판적으로 검토하며, 먹방의 성장과 발전이 사회적 변화 과정과 어떻게 상호작용하며 전개되었는가, 그리고 이런 먹방의 고유성이 어떻게 뉴 미디어의 특성 속에서 등장할 수 있었는가를 살펴보고자 한다. 이를 통해 먹방이 세계적 현상으로 성장한 맥락과 기존 미디어에 미친 영향 등을 두루 살펴볼 수 있을 것이다.",조은하(Eun-Ha Cho),2020,https://www.riss.kr/link?id=A107083913
포토보이스 연구 방법의 이론적 토대 탐색,"본 연구는 최근 새롭게 부각되고 있는 포토보이스 연구방법의 이론적 토대를 구축하기 위한 것이다. 이를 위해, 먼저 ‘포토보이스’라는 용어를 처음으로 제시한 Wang과 Burris의 초기 연구들을 조명하면서 포토보이스의 개념 및 특징을 살펴보았다. 둘째, 포토보이스의 이론적 근거가 되는 프레이리의 비판적 의식화 교육론, 페미니즘, 그리고 다큐멘터리 사진에 대해 검토하였다. 셋째, Latz(2018)가 언급하고 있는 포토보이스 8단계 연구 절차를 제시하였다. 포토보이스 연구 절차는 독자들의 이해를 돕기 위해 국·내외에서 발표된 연구들을 예시로 활용하였다. 넷째, 포토보이스 연구에서 타당도를 확보할 수 있는 세 가지 전략으로 사진을 중심으로 부가적인 자료 수집을 통한 삼각 검증, 사진의 현실성 및 진실성, 그리고 연구 참여자의 주체성 보장을 제안하였다.
본 연구는 사회복지학, 간호학, 여성학, 교육학 등과 같이 다양한 학문 분야에서 점진적으로 적용 범위가 넓어지고 있는 포토보이스 연구 활성화에 기여할 것으로 기대된다. 마지막으로 본 연구가 갖는 네 가지 시사점을 논의하였다. 첫째, 이 연구는 포토보이스 연구를 수행하고자 하는 연구자에게 유용한 지침이 될 수 있다. 둘째, 포토보이스는 소외된 사람들의 목소리를 표면화할 수 있는 가능성을 열어 주었다. 셋째, 포토보이스를 통해 지식 생산의 민주화를 확산할 수 있다. 넷째, 포토보이스는 실천적 지식을 강화하는 유용한 방법이 될 수 있다.",오영범(Youngbeom Oh),2023,https://www.riss.kr/link?id=A108558873
메타버스 구성 원리에 대한 연구 : 로블록스를 중심으로,"본 연구는 메타버스 구성 원리에 관한 연구로 메타버스의 개념정리나 발전 방향과 같은 전망에 대한 것이 아니라 대표적인 메타버스 플랫폼인 로블록스를 중심으로 어떤 기능과 원리로 구성되어 있는지 분석하였다. 그 결과 로블록스는 생산과 소비 연계 구조가 잘 되어있었다. 특히 로블 록스 스튜디오 같은 경우 제페토의 스튜디오나 마인크래프트의 아이템 마 켓플레이스보다 창작자 등록이 자유로웠으며, 게임 내 구현할 수 있는 아 이템과 콘텐츠도 더욱 다양하고 수익 구조도 더욱 좋았다. 본 논문에서는 로블록스를 중심으로 분석한 결과이기에 모든 메타버스 플랫폼에 적용된 다고 할 수는 없지만 메타버스 콘텐츠에 대한 생태계 환경과 요소에 대한 이해를 바탕으로 메타버스 관련 콘텐츠 연구나 제작 시 도움이 될 것이라 기대한다.",전준현,2021,https://www.riss.kr/link?id=A107770191
신규간호사가 인식한 이직의도 영향요인 : 내용분석,"본 연구의 목적은 신규간호사가 인식한 이직의도 영향요인에 대한 내용분석을 통해 전문인력 양성 및 이직률 감소 를 위한 기초자료를 제공하기 위함이다. 본 연구는 B시에 소재한 일개 상급종합병원의 근무기간이 12개월 이하의 신규간 호사 80명을 대상으로 2020년 11월 20일부터 2021년 2월 10일까지 개방식 질문지 형태의 자가 기입식 설문조사를 실시 하였다. 자료분석은 질적연구 중 내용분석 방법으로 분석하였다. 연구 결과 신규간호사가 인식하는 이직의도 영향요인으로 업무, 조직문화, 교육, 개인적 성향, 인간관계, 태움, 처우의 7개 범주가 도출되었으며, 효과적인 인력관리 및 신규간호사의 이직 감소방안에 대한 근거자료를 제시하였다는데 본 연구의 의의가 있다. 본 연구를 토대로 각 도출된 이직의도 영향요인 에 따라 구체적인 제도개선을 위한 연구를 제언한다.",이송현,2021,https://www.riss.kr/link?id=A107390517
영유아를 배려하는 공공장소를 위한 사회적 디자인 연구,"최근 증가하는 노키즈존(No Kids Zone)은 우리사회의 영유아에 대한 인식을 반영한다. 본 연구는 영유아에 대한 관용과 사회적 수용을 증진시키는 사회적 인식개선의 일환으로서 음식 및 카페를 이용할 때 영유아를 동반함으로 인해 유발되는 문제를 파악하고, 개입방법을 모색하고자 하였다. 이를 위해 요식업 종사자, 식당 및 카페 이용자, 영유아 자녀를 둔 부모들과의 면담을 통해 인식 및 문제점을 파악한 후, 그들이 겪는 어려움을 해결하기 위한 개입방안을 모색했다. 면담 결과 영유아를 동반하는 이용자들의 자녀 돌봄에 대한 무관심과 영유아를 동반하지 않는 이용자들의 낮은 수용도가 문제의 원인으로 나타나 그들의 인식 개선을 위한 개입 방안으로 테이블매트와 안내판을 디자인하였다.",김도리(Kim Doolee),2023,https://www.riss.kr/link?id=A108527532
일반인 리얼리티 연애 프로그램의 시청자 경험에 대한 연구: 20~30대 시청자 심층 인터뷰를 중심으로,"본 연구는 최근 일반인이 출연하는 리얼리티 연애 프로그램이 높은 인기를 얻고 있는 상황에 주목하여, 이들 프로그램에 대한 시청경험을 탐구하고자 한다. 이를 위해 일반인이 출연하는 리얼리티 연애 프로그램을 시청한 경험이 있는 20~30대 미혼과 기혼자들을 대상으로 심층 인터뷰를 진행했다. 연구 결과, 시청자들은 출연자가 일반인이라는 점에서 동질감을 느끼고 이들의 일상적인 대화나 행동을 본인의 경우에 대입하며 공감을 경험하고 있었다. 이때 공감은 연애에만 한정된 것이 아니라 대인관계의 차원에서도 이루어졌으며, 감정이입을 바탕으로 자아성찰과 대리만족도 경험하고 있었다. 이러한 경험은 시청몰입으로 이어지기도 하며 심한 경우 과몰입에까지도 이르고 있었다. 연구 참여자의 대부분은 프로그램 시청을 통해 가치관의 변화를 겪었으며, 타인에 대한 이해가 확장된다고 보고했다. 이러한 결과는 미디어가 개인의 신념과 가치관에 변화를 주고, 나아가 다시 사회적 가치관의 형성에도 기여하고 있음을 보여준다.",장형민,2023,https://www.riss.kr/link?id=A108723389
말더듬이 지속된 아동과 회복된 아동의 기질 특성 비교: 종단연구,"본 연구의 목적은 말더듬의 지속과 회복에 따른 하위유형의 기질 특성을 종단적으로 비교하고, 외현적 말더듬 중증도와 기질 특성의 관련성을 살피는 것이었다. 연구 참여자는 학령전 아동으로 41명의 말더듬 아동(CWS, children who stutter)과 30명의 말을 더듬지 않는 아동(CWNS, children who do not stutter)이었다. 아동들은 4년간 종단연구에 참여하였으며, 마지막 평가에 참여하였을 때 전체 CWS 중 27명은 말더듬이 회복된 아동으로, 14명은 말더듬이 지속된 아동으로 최종 진단되었다. 각 아동의 기질 특성은 유아기질척도-간편형을 사용하여 평가하였으며, 기질 평가는 첫 평가 이후 1년이 지난 시점과 첫 평가 이후 2년이 지난 시점에서 각각 이루어졌다. 기질 특성 비교를 위해 유아기질척도-간편형의 상위요인(외향성, 부정적 정서, 의도적 통제)과 15개의 하위영역 점수를 분석하였으며, 집단과 평가 시점에 따른 차이를 각각 비교하였다. 연구 결과, 말더듬이 지속된 아동 집단은 말더듬이 회복된 아동 집단과 CWNS보다 상위요인인 부정적 정서 점수가 평가 시점과 관계없이 유의하게 높은 것으로 나타났다. 또한, 말더듬이 지속된 아동 집단은 다른 아동 집단보다 부정적 정서를 구성하는 하위영역인 ‘공포’와 ‘분노/좌절’ 점수가 유의하게 높았다. 말더듬이 지속된 아동 집단을 대상으로 평가 시점별로 외현적 말더듬 중증도와 기질의 상위요인 및 하위영역 점수 간 상관분석을 실시한 결과, 외현적 말더듬 중증도와 기질 특성은 유의한 상관을 보이지 않았다. 본 연구결과는 기질 특성이 말더듬의 지속 및 회복과 관련 있는 요인이라는 이론적 관점을 지지하며, 시간이 지남에 따라 기질이 말더듬으로 인한 반복적인 경험의 영향을 받을 수 있음을 시사한다.",전희정(HeeCheong Chon),2021,https://www.riss.kr/link?id=A107981744
밈의 뉴미디어 환경 적응에 관한 연구 - MZ세대의 밈 현상을 중심으로 -,"본 연구는 최근 부각되고 있는 밈 현상을 밈의 생존 방식과 MZ세대의 뇌 형성 및 뉴미디어의 발달과의 관계를 통해 살펴보고, 밈 현상의 전개 방식을 문화 전달 형태를 통해 고찰한다. 그것은 MZ세대를바라보는 관점을 밈의 입장으로 바꾸어 설명하는 것이다. 밈 현상은 MZ세대가 이전 세대와 본성적으로달라서 나타나는 것이 아니다. 그것은 이기적 밈이 적응해야 하는 인간환경이 뉴미디어를 중심으로 재편되었고, 밈 전달에 적합한 뇌가 MZ세대의 뇌이며, 그 뉴미디어 환경에 MZ세대가 가장 최적화되어있기 때문에 나타난 모습이다. 본 연구에서 밈의 존재는 진화생물학을 토대로 전제되었고, 밈의 생존방식은 신경미학을 토대로 설명되었으며, 밈의 정체는 인간 뇌 발달 단계를 분석하여 MZ세대의 변연계와 뉴미디어를 적극 활용하는 감정기억의 이용자로서 해석되었다. 그리고 그와 같은 밈들이 인간의 감정기억을 이용하는 방식은 전통적 문화 전달 방식으로서의 놀이, 공감, 스토리텔링으로 연결된다. 따라서 밈 현상은 이기적 밈이 MZ세대와 뉴미디어를 만나는 과정에서 놀이, 공감, 스토리텔링의 문화 전달방식으로 드러난 것이라고 볼 수 있다.",신종천,2022,https://www.riss.kr/link?id=A108293572
"광고 채널로서 틱톡(TikTok) 사용, 동기, 반응에 대한 연구","본 연구는 숏폼(short-form) 동영상 소셜미디어 플랫폼인 틱톡의 이용 동기를 파악하고 틱톡 광고에 대한 소비자의 인식 및 태도를 고찰함으로써 틱톡 광고 효과에 주요한 광고 요인을 탐색하고자 한다. 20-30대 틱톡 이용자를 대상으로 심층 인터뷰를 진행한 결과, 주요 틱톡 이용 동기로는 정보성과 오락성이 도출되었으며 틱톡 특성으로 짧은 동영상, 다양한 콘텐츠 내용, 형식의 참신성이 언급되었다. 또한, 유용성, 오락성, 광고 회피를 위한 조작용이성, 친근감, 상호작용이 주요 틱톡 광고 특성으로 제시되었다. 마지막으로, 틱톡 광고 참여행위는 대체적으로 ‘좋아요’ 클릭, 댓글쓰기, 공유, 구매 링크/광고주 홈페이지 클릭, 광고 제작 참여 등으로 나타났다. 이와 같은 연구 결과는 소셜미디어 광고의 이론적 확장에 기여하고 효율적인 틱톡 광고 전략 수립을 위한 지침을 제공할 것이다.",마뤼야오(Ruiyao Ma),2021,https://www.riss.kr/link?id=A107305335
노령층의 키오스크 사용을 통해서 본 사회의 차별과 배제 : “저걸 통과해야 먹을 수 있다”,"본 논문은 비대면 접촉의 확산으로 인해 증가되고 있는 키오스크의 도입이 노령층에게 어떤 배제와 타자화의 기제로 작동되는지를 연구한 논문이다. 노령층의 키오스크 사용 어려움의 원인을 기술적인 측면에서 살펴본 기존의 연구들과는 달리 본 연구는 정상과 비정상에 대한 사회적 담론과 디지털 조력자 네트워크의 측면에서 노령층의 키오스크 사용을 세밀하게 살펴본다. 이를 위해서 총 23명의 노령층과 6명의 프랜차이즈 매장 직원을 대상으로 심층인터뷰를 진행하였으며 연구결과는 다음과 같다. 첫째, 키오스크 활용에서 노령층은 키오스크를 자유롭게 사용할 수 있는 조건을 충족하지 못하는 ‘비정상’인 범주에 속하여 키오스크 활용에서 ‘배제’되는 모습을 보였다. 둘째, 키오스크 활용에서 노령층은 업종의 주된 소비자층으로 인식되느냐에 따라 다른 서비스를 제공받는 모습을 보였다. 이러한 비교는 키오스크 활용에서 노령층에 대한 배제의 기제가 자본주의 권력 작동의 또 다른 방식임을 보여준다. 셋째, 노령층이 형성한 사회자본의 성격에 따라 노령층의 키오스크 적응이 달라지는 모습을 보였다. 본 연구의 결과는 노령층과 그 외의 계층 간의 격차뿐 아니라, 노령층 내에서 디지털 격차가 가속화되어 가고 있는 우리 사회에 많은 시사점을 제공할 것으로 기대한다. 마지막으로 본 연구에서 도출된 결과를 토대로 노령층의 키오스크 활용능력을 높이는 구체적인 보완방안과 정책을 제언하였다.",류수민,2023,https://www.riss.kr/link?id=A108533060
AI 영화영상콘텐츠를 위한 AI 예술창작 사례연구,"현재 우리는 창작도구로서 컴퓨터와 창작자로서 컴퓨터 사이에 서 있다. 또한 포스트 시네마적 상황이라 할 수 있는 새로운 장르의 영화들이 등장하고 있다. 본 논문은 AI 시네마의 출현 가능성을 진단하고자 한다. AI 시네마의 가능성을 확인하고자 영화 창작의 필요조건이라 할 수 있는 스토리, 서사의 창작, 이미지의 창작, 사운드의 창작이 인공지능에 의해 가능한지 사례조사를 통해 살펴보았다. 먼저 AI 페인팅 알고리즘인 Obvious, GAN 및 CAN의 시각이미지 생성을 확인했다. 둘째, AI 사운드, 음악은 이미 인간과 협력하여 유통 단계에 들어섰다. 셋째, AI는 이미 드라마 대본을 완성 할 수 있고, 빅 데이터를 활용한 자동 시나리오 제작 프로그램도 인기를 얻고 있다. 즉, 우리는 필수적인 영화 제작 요구 사항이 AI 알고리즘으로 충족될 수 있음을 확인할 수 있다. 마노 비치의 'AI 장르 컨벤션' 관점에서 웹 다큐멘터리와 데스크톱 다큐멘터리는 포스트 시네마로서 AI 시네마의 대표적인 장르라고 할 수 있다. AI, 웹 다큐멘터리, 데스크톱 다큐멘터리가 존재하고 있는 환경이 동일하기 때문이다. 본 논문은 포스트시네마의 창작자로서 AI에 대한 연구를 통해 4차 산업혁명시대 영화라는 매체가 개척해야 할 새로운 길을 제시하고 있다.",전병원,2021,https://www.riss.kr/link?id=A107494434
인공지능(AI)을 활용한 작곡 기술 동향과 창작 플랫폼,"본 연구는 4차 산업혁명의 주요분야로 주목받고 있는 인공지능을 이용한 작곡의 기술적 개념과 주요 플랫폼의개발 및 서비스 사례에 대해서 연구하여 인공지능 작곡 기술 개발 현황과 인공지능 작곡을 활용한 기술의 활용방안 및 발전방안을 알아보는 것을 목적으로 하였다. 이를 위하여 인공지능의 개념에 대해서 설명하고 인공지능 작곡에 활용되는 대표적인 데이터 생성모델인 LSTM과 RNN, 적대적 생성모델인 GAN에 개념에 대해서 연구하고 인공지능의 데이터 생성과정 및 알고리즘 등을 알아보았다. 또한 현재 인공지능 작곡의 대표적 활용사례에 해당하는인공지능을 이용한 음악창작 플랫폼의 사례를 분석하여 기술 및 서비스의 현황을 알아보고 인공지능 작곡 플랫폼을 이용한 창작과정을 알아보았다. 본 연구는 최근 정부정책지원 및 대기업의 기출 및 관련 기업들의 등장으로 주목받고 있고 OTT서비스와 미디어 콘텐츠 플랫폼 등의 성장으로 수요가 급증하고 있는 인공지능을 활용한 콘텐츠제작기술 중 ‘음악창작’에 초점을 맞추어 기술 및 활용 사례를 연구하였다는 점에서 기존 연구와 차별성이 있다. 하지만 인공지능 작곡에 대한 선행연구의 부족과 개발 및 서비스가 비교적 최근에 시작되어 연구 사례가 부족하다는 점은 한계로 남았다. 하지만 향후 인공지능 작곡분야는 교육, 영상, 공연 등 다양한 분야에서 폭넓게 활용될수 있는 기술이며 본 연구를 통해 제시된 문제점이 향후 인공지능 작곡의 발전과 전문가 양성 등에 활용되기를 기대한다.",김상열(Sangyeol Kim),2022,https://www.riss.kr/link?id=A108194954
임상간호사의 회복탄력성이 직무스트레스와 소진에 미치는 영향,"임상 간호사의 경우 교대근무와 예측하기 어려운 환자 상태의 변화와 같은 간호업무 특성으로 인해 높은 직무스트레스와 소진을 경험하고 이는 간호사의 이직을 높이는 요인으로 작용하여 왔다. 회복탄력성은 이러한 간호사의 직무스트레스와 소진을 감소시키고 업무 만족과 적응을 높일 것으로 기대되어 임상간호 분야에서도 활발한 연구가 필요한 시점이다. 이에 본 연구는 임상 간호사를 대상으로 회복탄력성이 직무스트레스와 소진에 미치는 영향을 파악하고자 하였다. 대상자는 일개 종합병원에 근무하고 있는 간호사로 자료수집은 해당 병원 간호부에 연구목적과 필요성을 설명한 후 협조를 받아 연구자가 직접 설문지를 배포한 후 회수하여 분석하였다. 연구 결과 회복탄력성이 임상 간호사의 소진에 유의한 영향을 미치는 요인임이 파악되었다. 반면 회복탄력성이 임상 간호사의 직무스트레스에 미치는 영향은 파악되지 않았다. 임상 간호사의 소진이 적절히 관리되지 않으면 고객이 지각하는 간호서비스의 만족도가 저하되고, 그로 인하여 병원조직의 경쟁력과 효율성은 상당히 감소될 수 있다. 따라서 임상 간호사의 회복탄력성 향상 프로그램의 개발과 적용을 통해 소진을 감소시키기 위한 전략을 수립할 수 있을 것이다. 이를 통해 간호사의 업무 적응을 높이고 이직을 줄이는 적극적인 관리방안도 모색될 수 있을 것으로 기대한다. 또한, 개발된 회복탄력성 프로그램의 효과 검증을 위한 평가 연구와 이를 병원 조직 내 제도로 정착시키기 위한 간호 관리자의 지속적인 연구와 노력도 필요하다.",강정숙(Jenong-Sook Kang),2015,https://www.riss.kr/link?id=A101494897
유아교사의 챗지피티(ChatGPT) 활용 현황과 인식에 대한 연구,"본 연구는 유아교사의 ChatGPT 활용 현황과 인식을 조사하여, 생성형 인공지능의 유아교육 현장 적용 가능성을 논의하는 기초자료를 제공하는 데에 목적이 있다. 이를 위해 유아교사 101명의 온라인 설문자료를 수집하여 SPSS20.0으로 빈도 및 교차분석, 일원분산분석을 시행하였다. 연구 결과 첫째, 유아교사들은 ChatGPT에 대해 들어본 경험은 많았지만 일상과 유아교육 현장에서 ChatGPT를 사용한 경험은 적었다. 둘째, 유아교사들이 가장 희망하는 ChatGPT 활용 분야는 ‘놀이 지원방안 제안’이었다. 셋째, 경력 4년 미만의 교사들은 다방면의 학급운영에 ChatGPT를 활용하고자 하였다. 넷째, 유아교사들은 ChatGPT의 가장 큰 장점으로, 심화된 지식을 얻을 수 있다는 점을, 우려점으로는 ChatGPT 활용에 따른 교사 간 지식 격차를 꼽았다. 다섯째, 유아교사들은 ChatGPT에 대체되지 않는 유아교사의 가장 큰 장점으로 ‘공감과 정서적 나눔’을 이야기하였다. 여섯째, 유아교사들의 ChatGPT 현장 활용에의 가능성과 활용 의향은 긍정적이었다. 이를 바탕으로, 본 연구에서는 교사 경력별 ChatGPT 활용욕구에 대한 후속연구, ChatGPT에 대한 연수 및 전문적학습공동체 사례나눔을 제안하였다.",김윤나,2023,https://www.riss.kr/link?id=A108723432
