
웹툰의 흥행 결정요인에 대한 연구: 웹툰의 차별화된 특성을 중심으로,"스낵컬처 트렌드의 확산과 함께 웹툰은 현대인들에게 가장 인기 있는 콘텐츠 중 하나로 자리매김하였다. 웹툰작가의 TV 출연이나 웹툰을 원작으로 한 영화ㆍ드라마의 인기몰이 역시 흔한 모습이 되었다. 이러한 트렌드에 힘입어 웹툰시장은 급속도로 성장하고 있으며 웹툰의 영향력과 파급력 또한 커지고 있다. 본 연구는 이러한 웹툰의 흥행 성과에 영향을 미치는 요인들을 도출하는 것에 그 목적을 두었다. 총 10개의 독립변인을 책정하고 순서회귀분석을 통해 종속변인과의 관계를 살펴보았다. 그 결과, 좋아요의 수, 장르, 그림체, 속편 여부, OSMU 여부, 작가파워 지수, 그림ㆍ스토리 작가의 분리 여부, 디지털 효과 적용 여부가 웹툰의 흥행에 정(+)의 효과를 미치는 것으로 밝혀졌다. 특히, 그림ㆍ스토리 작가 분리 여부와 디지털 효과 적용 여부의 경우 영화ㆍ드라마 등 다른 콘텐츠와는 구별되는 웹툰만의 특징을 반영한 흥행 결정요인이라고 할 수 있다. 본 연구의 결과를 토대로, 웹툰의 흥행을 위해서는 차별화된 경쟁요소를 감안해야 한다는 시사점을 얻을 수 있다. 또한 본 연구에서 제시한, 이야기ㆍ표현주체ㆍ전달대상에 각각 시나리오ㆍ그림ㆍ독자를 대입한 웹툰의 3요소 개념과 작가파워 지수 산정에 대한 활용ㆍ보완을 통해 웹툰에 대한 후속 연구를 진행할 수 있을 것으로 기대된다.",박문호,2019,https://www.riss.kr/link?id=A106192515
한국사회 젠더갈등인식에 관한 탐색적 연구: 성별 조절효과를 중심으로,"이 연구는 최근 한국사회에서 증폭되고 있는 젠더갈등 현상에 주목해, 젠더갈등에 대한 사회구성원들의 인식수준, 인식의 지형과 균열지점, 인식에 영향을 미치는 요인들을 탐색적 차원에서 규명하고자 하였다. 첫째, 누가 젠더갈등을 심각하게 인식하는지 분석한 결과, 20대가 다른 연령대에 비해, 보수성향이 중도성향에 비해, 평등하고 진보적인 성역할태도를 가질수록, 젠더불평등인식수준이 높을수록, 성차별경험이 많을수록 젠더갈등을 심각하게 인식했다. 둘째, 젠더불평등인식, 성차별경험과 젠더갈등인식의 관계에서 성별의 조절효과를 확인했다. 남녀를 구분해 분석한 결과, 여성은 젠더불평등인식이 높을수록, 성차별경험이 많을수록 젠더갈등을 심각하게 인식했다. 이에 반해 남성의 젠더갈등인식은 젠더불평등인식, 성차별경험과 무관했고, 20대, 대졸이상, 보수적 정치성향, 평등한 성역할태도를 가진 남성이 젠더갈등을 심각하게 인식하는 것으로 나타났다. 이 연구는 현재 증폭되고 있는 젠더갈등 현상을 이해하기 위해 개인의 젠더불평등인식, 성차별경험 등 다양한 사회경제적 특성에 대한 이해가 선행되어야 하고, 성별에 따라 다른 갈등해소 전략이 필요함을 실증적으로 규명하였다.",류연규(Yunkyu Ryu),2019,https://www.riss.kr/link?id=A106478667
AI 시대의 디지털 격차,"정보 편중으로 인한 불평등 현상은 공유성·이전성·복제성과 같이 평준화에 기여함직한 정보의 기본 속성에 반하는 잠재적 역기능의 하나로 꼽혀 학술적·정책적으로 주시되어 왔다. ‘정보격차’로 불려온 정보화 시대의 불평등은 하드웨어 차원인 기기(tool), 소프트웨어 차원인 자료(data), 휴먼웨어 차원인 사용자(user)에 따라 기회격차, 활용격차 및 수용격차라는 세 유형으로 구분된다. 그런데 기계 지능이 인간지능을 넘보는 AI 시대에 들어서면서 정보격차는 새로운 양상을 보이고 있다. 디지털화가 새로운 도약단계로 들어서는 AI 시대의 디지털 격차를 하드웨어, 소프트웨어 및 휴먼웨어 차원에서 되짚어보면, 그것은 운영격차·선별격차·증강격차라는 세 갈레로 발현하고 있음을 알 수 있다. 정보격차로 불려온 AI 이전 시대의 디지털 격차1.0과 AI 시대의 디지털 격차2.0은 다음과 같은 측면에서도 상이한 면모를 보인다. 생활공간의 공유를 전제로 하는 전자의 경우 소유-비소유 관계가 문제의 핵심을 이루는 반면, 후자에 있어서는 생활공간에서의 실존성과 직결된 존재-부존재라는 쟁점이 중요시 된다. 따라서 디지털 격차1.0에서는 사회적 형평성에 어긋나는 정보수혜층과 정보소외층 간의 간극을 축소하기 위한 복지적 접근이 적실한 해법으로 상정되나, 디지털 격차2.0의 경우에는 생활 현장에서의 실존감을 유실한 심정적 퇴출자들의 인간성 회복이 보다 절실한 과제로 대두한다. 그 결과, 기술사회적 논의수준에 머물던 기존 정보격차론은 AI 시대를 맞아 기술담론·사회담론·인간담론을 망라한 수준으로 확장될 전망인데, 이 때 실용지나 암묵지의 소재 여부와 직결된 ‘신(新)지역격차’가 새로운 지적 관심사나 정책적 의제로 소환될 개연성이 높다.","김문조(Kim, Mun Cho)",2020,https://www.riss.kr/link?id=A107334583
성폭력 발생시 법의간호사의 역할,"해마다 늘어만 가고 지능화되어 가는 성폭력 범죄에 의료인으로서 간호사의 역할이 매우 중요함에도 아직까지 한국에서는 실제적으로 간호사의 역할이 제한적이다. 현재 간호사는 상담소에서의 상담이나 학교나 지역사회에서의 성폭력 방지와 예방 교육을 하고 있으나 피해자 발생 초기 대응시 실제적이고도 즉각적인 도움은 주지 못하고 있는 실정이다. 미국 등 선진국에서는 전문적인 소양을 가진 성폭행 전문 간호사들을 교육하고 배양함으로써 증가하는 성폭행 피해자들에게 즉각적인 의학적 처치와 위기중재에 대한 전문적인 대응으로 성폭력에 대한 법적기소와 대응이 효과적으로 이루어지고 있는 추세이다. 이에 반해 현재 한국은 성폭행 피해자와 관련된 의료적 대처에 대한 관련 교육 기관이나 의료 기관이 없으며 의료기관내 간호사의 역할도 미비한 게 현실이며, 성폭력 담당 기관에서조차도 관련 교육을 받은 의료진에 의한 성폭력 피해자에 대한 초기 대응 및 증거수집 및 체계적인 증거 및 자료 확보가 이루어지지 않고 있는 실정이다. 따라서 하루 빨리 우리 실정에 맞는 영역을 설정, 교육과정을 개발하여 성폭행 전담 간호사의 양성이 필요하며, 각 성폭력 담당 기관에서도 전문적인 법의간호사에 의한 피해자 관리가 필요하다. 전문적, 체계적인 커리큘럼을 통해 양성된 간호사에게 각 부서의 인증 및 자격을 부여하여 성폭력 관련 기관에서 의무적 배치 등으로 효율적인 처치 및 간호제공을 할 수 있는 법률적 제도 보완 역시 절실하다. 또한 정부 및 의료기관과 사회단체들이 협력하여 효과적이고 공신력 있는 전문양성 기관을 마련하여 전문적이고 훈련된 성폭행 전담 법의간호사의 배출이 요구된다고 사료된다. 나아가 더욱 세분화된 양질의 의료 서비스를 위해 아동 및 청소년 상대 성폭력 전담 간호사의 도입 및 양성이 필요할 것이다.",육지영,2006,https://www.riss.kr/link?id=A101489396
최근 한국사회의 출산율 변화원인과 향후 전망,"최근 한국사회에서는 출산율의 저하로 인한 사회경제적 영향을 우려하여 대책방안을 강구하여야 한다는 논의가 증대되고 있다. 그런데 국가정책을 개발ㆍ추진하기 이전에 반드시 요구되는 것은 저출산 현상의 올바른 인식과 철저한 원인규명이다. 따라서 본 연구에서는 출산율 변화의 원인을 다각적으로 살펴보고, 향후 변화방향을 전망해 보고자 한다.
먼저 자녀출산의 변화를 결혼상태 변화와 유배우부인의 출산율 변화 부분으로 나누어 살펴본 결과, 과거와는 달리 최근의 출산율 저하는 유배우 부인에 의해서가 아니라 미혼자의 결혼연장 또는 독신생활에서 기인되는 것으로 나타났다. 이들 두 요인에 영향을 주는 변수로는 경기침체 및 직장불안정, 결혼가치관의 변화와 초혼연령의 상승, 자녀양육 관심증대, 자녀양육비 부담, 가정과 직장의 양립을 위한 사회적 인프라 부족, 여성의 자아욕구 및 사회참여 증대, 자녀효용가치 감소, 이혼 등 가족해체의 증대, 그리고 불임부부의 증대 등인 것으로 판단된다.
향후 출산율 변화를 전망해 보면, 저출산을 일찍 경험한 서구 선진국의 경우와는 달리 정책의 추진에 한계가 있어 선진국보다 더 낮은 출산율을 회복하는 데는 많은 어려움이 있을 것이라는 판단이다. 더군다나 젊은 미혼남녀의 가치관이 개인주의화 되는 경향이 있다는 점을 감안한다면 출산율 회복정책을 추진한다 하더라도 한계가 있을 수밖에 없을 것이다. 수년간 실시된 각종 실태조사를 분석한 결과에 의하면 현재의 경기침체가 회복될 경우 약 20%의 출산율 상승 가능성이 있으며, 이 때의 합계출산율은 약 1.43명 수준이 될 수 있을 것으로 예견된다. 또한 종합적, 체계적 출산회복정책을 효과적ㆍ효율적으로 추진한다면 약 10년 후에는 합계출산율이 약 1.6 수준으로 회복될 것이라는 낙관적 견해를 가져본다. 그렇지만 정책의 강도에 따라서 회복수준은 현저하게 상이할 것이다.",김승권(Seung-Kwon Kim),2004,https://www.riss.kr/link?id=A76122132
노인장기요양보험제도 시행 이후의 한일 비교연구,"앞으로의 고령사회와 초고령사회 진입에 대비하여 노인장기요양보험제도의 합리적 기능수행을 위해 사회구조 및 제도 등 다양한 관점의 접근이 요구된다. 오늘날 현실화된 영유아를 위한 자녀양육의 사회화에 이어 노인장기요양의 사회화가 원만하게 이루어지기 위해서는, 관련법제도의 규범적 선택의 체계적 영역뿐 아니라 사회구성원의 합의적 이해가 지속적으로 논의되어야 할 것이다.
본 연구는 노인장기요양보험제도가 시행되고 6년을 맞이하게 된 우리나라와 일본의 개호보험제도에 대해 비교학적인 관점으로 문제점을 도출하여 개선점을 모색하는데 목적을 두고 있다. 연구방법은 노인장기요양보험제도가 시행된 이후의 비슷한 시점을 두고 한국과 일본의 운영현황에 대해 살펴보는 국내외 논문 및 저서의 문헌 중심으로 이루어졌다. 노인장기요양보험제도가 효과적으로 시행되기 위해서는 노인장기요양 인정자의 합리적인 범위에 대한 재검토가 이루어져야 할 것이다. 그리고 보험료 부담의무와 보험급여를 받을 권리에 대한 적극적 홍보를 통해 재원조달의 안정화로 효과적인 노인장기요양복지를 증진시킬 필요가 있다. 또한 서비스의 질적 수준 향상을 위하여 요양보호사의 처우개선과 장기적인 관점의 교육훈련 프로그램이 체계화되어야 할 것이다. 아울러, 노인장기요양기관의 노인인권보호 등 시설안전관리에 따른 세심한 관리감독체계와 노인부양에 대한 가족구성원의 역할과 책무에 대해서도 인식 재고할 필요가 있다.
이러한 연구는 향후 지속적인 연구로 이어지면서 한국의 사회문화 정서에 적합한 노인장기요양보험제도로 자리매김하는 개선방안을 제시하는데 그 의의가 있다고 본다.",오미희 ( Mi Hee Oh ),2014,https://www.riss.kr/link?id=A105498702
심리적 외상과 EMDR,"본 연구는 미국 심리학회 12분과인 임상심리학 분과의 연구에 따라 경험적으로 타당성이 인정된 치료로, 생물학적 원인에 의한 우울증, 강박증, 치매증상 등에는 권장하지 않으나, 심리적 외상에는 탁월한 최신의 심리치료로 추천되고 있는 안구운동 민감소실 재처리과정(Eye Movement Desensitization and Reprocessing; EMDR)을 다루고 있다.
증상 제거를 위한 효과의 지속성이 떨어지고, 약물의 의존성을 높이는 약물치료와 달리, EMDR은 부작용이 없고, 일반 심리치료와는 비교가 되지 않을 정도로 치료회기가 짧아서 환자의 고통경감은 물론이고, 환자의 가족에게도 심리적, 경제적, 사회적, 이외에도 다양한 측면에 혜택을 주는 심리치료이다. 치료자 자신에게도 만족도가 높은 EMDR은 한국의 경우 임상심리 전문가와 정신과 전문의 자격증 취득자 및 임상관련 전문인에게만 전문가 교육을 받을 수 있는 자격이 주어진다.
이에 다양한 심리치료 전문가들이라도 임상현장에서 심리적 외상을 가진 환자들을 접하게 되는 경우, EMDR 전문가에게 의뢰를 할 수 있도록 EMDR의 내용을 알리는 다양한 기회마련이 요구된다. 본 연구는 EMDR 전문가로서 국제웍샵, 협회와 연구모임 및 연구를 통해 축적된 내용을 토대로 EMDR의 강점 및 치료과정을 문헌연구 중심으로 분석하였다.",張蓮集,2009,https://www.riss.kr/link?id=A76518153
우크라이나 사태를 둘러싼 서방의 경제제재와 러시아의 대응 - 세계 경제의 블록화 위기,"2022년 2월 21일 블라디미르 푸틴 러시아 대통령은 도네츠크인민공화국과 루한스크인민공화국의 주권을 인정한다고 발표했다. 곧이어 2월 24일 러시아는 소위 ‘우크라이나 특별 군사작전’을 시작했다. 러시아는 전쟁 목적이 영토 확장이 아닌 우크라이나 비무장화, 비나치화, 비NATO화라고 주장한다. 우크라이나 전쟁과 관련하여 미국과 EU는 물론 한국과 일본 등 여러 나라가 은행 부문과 첨단 제품에서부터 에너지 분야에 이르기까지 러시아에 대한 대규모 제재를 강화해가고 있다.
크렘린 당국은 이런 조치들이 ‘경제전쟁’이라고 단언한다. 러시아 정부는 사태 악화에 대비하고 있으며 사회적 책무를 계속 이행할 것이라고 강조한다. 러시아 중앙은행은 기준금리를 연간 20%로 인상하고, 외화 수익 강제 매각 등 외환시장 안정화 조치를 취했다. 러시아 정부는 약 1조 루블이 투입되는 100여 개의 긴급 경제 대응 조치 등 경제제재에 대응하고 있다. 또한 러시아 여객기에 대한 서방 영공 폐쇄에 따른 대응 조치로 러시아 영공을 폐쇄하고 한국 등 ‘비우호 국가’를 대상으로 목재 수출 금지 등의 보복조치를 취하며 러시아에 수입된 ICT 관련 제품 등 200여 개 주요 기술 제품의 재수출 금지 등 자국 경제 보호조치에도 나서고 있다.
러시아와 우크라이나 간의 전쟁이 진행 중이고 미국과 EU 등 서방의 경제제재는 강도를 더해간다. 러시아 정부도 서방의 경제제재에 대한 보복제재를 검토 중이다. 한국 등 ‘비우호 국가’들을 대상으로 취해질 러시아의 보복제재는 에너지, 광물 자원 등 서방에 큰 타격을 주면서도 러시아 경제에 대한 영향은 미미한 품목들을 검토하고 있다고 밝혔다. 미국과 EU 등 서방 국가들은 경제제재에 대한 러시아의 본격적인 대응 조치가 나오기도 전에 새로운 제재의 추가뿐만 아니라 중국 등 러시아를 도우려는 모든 국가의 시도를 차단하는 조치를 예고했다. 표면상으로는 러시아 제재를 목적으로 하는 것이지만 중국, 인도, 중동 국가 등 경제제재에 참여하지 않고 러시아에 우호적인 태도를 보이려는 국가들에 대한 영향력 행사를 통해 세계를 거대한 블록으로 나누어가고 있다.
본고는 3월 24일까지 언론에 발표된 내용 중심으로 우크라이나 사태로 야기된 서방의 경제제재와 그에 대한 러시아의 대응책, 경제에 미치는 영향 등을 정리해보고 간략한 시사점을 얻고자 한다.",김학기,2022,https://www.riss.kr/link?id=A108213374
