
메타버스 유형에 따른 NFT 활용사례 및 특성연구,"(연구배경 및 목적) 가상·초월을 뜻하는 메타(Meta)와 현실세계를 의미하는 유니버스(Universe)를 결합한 메타버스(Metaverse)는 최근 다양한 산업에 접목되어 활용되고 있다. 메타버스의 성장세에 따라 블록체인 기반의 NFT(Non-Fungible Token) 또한 주목받고 있으며 이는 경제적 요소로 활용되기도 하고 인증을 통한 사적 모임 등의 다양한 활동을 가능하게 한다. 하지만 현재까지 메타버스와 NFT의 결합에 대한 각 학문 분야의 개별적인 연구는 진행되고 있지만, 현황과 특성에 관한 연구는 미비한 실정이다. 따라서 본 연구는 메타버스 플랫폼에서 다양하게 사용되고 있는 NFT의 대표사례들을 유형에 따라 분석하여 그 특성을 연구하는 것에 목적을 둔다. (연구방법) 연구의 방법은 먼저 메타버스와 NFT에 대한 이론적 정의와 대분류를 확인한 후 이에 대한 NFT 활용사례의 세부 유형 및 특성을 분석한다. 연구의 범위는 연구의 객관성을 위해 현재 가장 통용되고 있는 ASF의 메타버스 네 가지 유형을 대분류 기준으로 사례를 분류하며, 각 유형에서 나타나는 NFT의 기능적 특성을 도출한 후 메타버스에서의 NFT 활용방안에 대한 방향성을 제시함에 범위를 둔다. (결과) 메타버스 유형별 NFT 대표사례를 분석한 결과 가상세계(Virtual Worlds)에서는 거래하는 아이템의 차이만 있을 뿐 게임 플랫폼에서 NFT가 기능하는 것을 확인하였다. 증강현실(Augmented Reality)은 현실세계에 가상의 아이템을 중첩해 보면서 아이템을 확인하고 모으는 기능이 주로 사용되는 것을 확인할 수 있었다. 거울세계(Mirror Worlds)에서는 가상세계와 현실세계 양면에서 인정받을 수 있는 기능을 확인하였다. 라이프로깅(Lifelogging)에서는 개인의 일상을 NFT화 하거나 NFT작품으로 개인을 표현하는 데 사용하는 기록기능이 주요 기능으로 도출되었다. (결론) 분석결과를 통해 가상세계는 NFT의 게임기능, 증강현실은 NFT의 수집기능, 거울세계는 NFT의 증명기능, 라이프로깅은 NFT의 기록기능이 주된 기능으로 활용되고 있음을 확인하였다. 최근 메타버스는 유형이 융합 및 혼합되어 발전하는 경향을 보이기에 메타버스 기반 NFT 활용에도 유형과 관계없이 다양한 기능적 측면이 융합될 때 비로소 NFT가 메타버스의 경제적 요소로 확실한 자리매김이 가능할 것으로 판단된다. 본 연구에서는 메타버스 기반 NFT 활용 현황에 대한 유형 및 특성 탐구하고, 미래적 관점에서 연구결과에 따른 메타버스 기반 NFT 발전 방향에 대해 모색하였다. 향후 NFT의 기능적 특성을 기반으로 메타버스와 NFT 유형의 융합관점에 관한 지속적인 연구들이 본 연구의 가치를 배가시킨다.",신지민,2022,https://www.riss.kr/link?id=A108177647
자폐스펙트럼 장애아동의 의사소통 기술 향상에 관한 연구동향 분석,"이 연구는 2011년부터 2021년까지 이루어진 자폐스펙트럼 장애아동의 의사소통 기술 향상을 위한 단일대 상연구들을 조사하여, 일반적인 특징과 동향을 알아보고, 실험설계와 독립변인 및 종속변인에 대한 분석에 목적을 두었다. 분석대상으로 선정된 논문은 국내의 학술지 논문으로 총 23편이었다. 연구결과, 대상인원이 1명으로 실시된 연구가 가장 많았고, 연령은 주로 취학 전 연령에서 이루어져 왔으며, 장애정도는 경증-중 간 자폐를 대상으로 한 연구가 가장 많았다. 연구환경은 언어치료실에서 이루어진 연구가 가장 많았고, 실 험설계는 중다 간헐 기초선 설계를 가장 많이 사용했다. 독립변인으로는 다양한 중재방법들이 사용되었으 며, 이 중 보완대체 의사소통 중재가 6편으로 여러 연구의 중재방법으로 사용되었다. 종속변인은 의사소통 기능 증진의 효과를 본 연구들이 절반 이상을 차지하였다.",임연주,2021,https://www.riss.kr/link?id=A108458758
체험마케팅을 활용한 메종 플래그쉽 스토어의 브랜드 정체성이 구매의도에 미치는 영향,"(연구배경 및 목적) 최근 럭셔리 브랜드의 주 소비계층인 MZ세대 소비자는 자신만의 독특하고 차별화된 경험과 자신의 가치 확인을 위한 희소 경험 소비를 추구하고 있다. 소비자는 브랜드 경험을 중요시하고, 이러한 시장 변화에 따라 럭셔리 패션 브랜드는 체험공간을 확장하여 메종 플래그쉽 스토어로 표현하고 있으며, 브랜드의 공간에 다양한 경험을 제공하여 브랜드 정체성을 나타내고, 브랜드 이미지와 가치를 공유하여 소비자와 커뮤니케이션을 하고 있다. 이에 본 연구는, 체험마케팅을 활용한 메종 플래그쉽 스토어의 브랜드 정체성이 구매의도에 미치는 영향을 파악하여 실증자료를 제공하는데 목적이 있다. (연구방법) 문헌연구와 실증연구를 병행하였다. 첫째, 문헌연구를 통해 메종 플래그쉽 스토어, 체험마케팅, 브랜드 정체성, 인터렉티브 디자인 요소, 구매의도 등을 고찰하였다. 둘째, 선행연구를 참고하여 연구모형을 도출하고 가설을 설정하여 본 연구에 부합하는 측정도구를 선정하였다. 셋째, 설문조사는 2023년 4월 6일부터 4월 17일까지 진행하였으며, 럭셔리 패션 브랜드 의 메종 플래그쉽 스토어를 방문한 경험이 있는 MZ세대 고객을 대상으로 설문지를 배포하여, 불성실한 응답을 제외하고 총 400부를 최종 데이터로 활용하였다. (결과) 메종 플래그쉽 스토어의 체험마케팅 요인이 브랜드 정체성에 정(+)적인 영향을 미치는 것으로 나타났고, 메종 플래그쉽 스토어의 체험마케팅은 인터렉티브 디자인에 정(+)적인 영향을 미치는 것으로 나타났으며, 브랜드 정체성과 구매의도 간의 관계에서는 유의한 영향을 미치지 않는 것으로 나타났다. 인터렉티브 디자인은 구매의도에 정(+)적인 영향을 미치는 것으로 나타났고, 메종 플래그쉽 스토어의 체험마케팅은 구매의도에 정(+)적인 영향을 미치는 것으로 나타났다. 매개효과를 확인한 결과, 메종 플래그쉽 스토어의 체험마케팅은 인터렉티브 디자인에 직접적인 영향을 미치고, 인터렉티브 디자인은 구매의도에 직접적인 영향을 미치는 것으로 나타났다. (결론) 체험마케팅은 인터렉티브 디자인 요소를 매개로 구매의도에 간접적인 영향을 미친다고 볼 수 있다. 체험마케팅이 구매의도에 직접적인 영향을 미치는 것으로 나타나 인터렉티브 디자인 요소를 매개로 구매의도에 영향을 미치는 부분 매개효과가 나타난다고 할 수 있다. 이러한 브랜드의 희소 경험은 럭셔리 패션 브랜드의 정체성이 잘 드러나는 디자인 요소를 반영하여 브랜드 긍정적 이미지를 강화하고, 고객과 브랜드의 관계를 연결하여 유대감을 높이고 해당 브랜드의 일원으로 느낄 수 있는 커뮤니케이션 관계 형성에 집중해야 한다. 또한, 고객이 가치 소비를 할 수 있는 감성적 체험 기회를 제공하도록 노력해야 할 것이다. 체험을 통해 형성된 브랜드의 긍정적 인식은 구매의도로 자연스럽게 이루어지게 만드는 중요한 요인임을 보여준다.",이목영,2023,https://www.riss.kr/link?id=A108634841
현대 패션에 나타난 고프코어(Gorpcore)에 대한 연구,"본 연구는 코로나 19 이후 라이프스타일이 급격하게 변화 하면서 트렌드에 가장 민감한 MZ세대의 주도하에 일상복과 아웃도어의 경계가 허물어지고, 세계 리딩 아웃도어 브랜드부터 스포츠브랜드, 국내외 글로벌 브랜드에 이르기까지 고프코어 스타일에 대한 관심의 급부상과 더불어 영향력이 커진 고프코어 스타일의 조형적 특성을 고찰하고, 앞으로의 고프코어 연구에 정확한 기준이 되고 효율적인 정보로 활용되어지는 것을 목적으로 하며, 이를 통해 패션디자인 개발에 있어서 고프코어에 관한 이해를 돕고 실제적인 디자인 개발에 도움이 되고자 한다. 이를 위해 고프코어가 언급된 문헌자료나 패션전문지, 웹, 정기 간행물, 논문, 디자인 관련 전문 서적, 기사나 해당 디자인 인터넷 사이트 등을 통한 문헌 연구를 진행하였다. 고프코어는 패션 트렌드의 개념으로 사회적 배경과 라이프 스타일이 반영된 스타일로 일반적인 등산복에서 벗어나 일상복으로 활용할 수 있는 착용감이 편할 뿐 아니라 기능성 소재에 세련된 디자인이 접목된 스타일리시한 아웃도어 의류를 매치해서 입는 패션을 말한다. 현대 패션에 나타난 고프코어 스타일의 조형성은 의복디자인의 기능적 요소들의 컨버전스 형태의 다기능 융합성, 평범한 외형에 극도의 럭셔리함을 지향하는 기능적인 요소를 믹스한 형태의 이중적 지향성과 윤리적 소비를 기반으로 한 재활용 소재 사용에 중점을 두어 오랜 시간 동안 지속적으로 사용할 수 있는 친환경 지속성으로 나타났다.",김생자(Sang Ja Kim),2023,https://www.riss.kr/link?id=A108519626
유니버셜디자인 개념 적용의 공공시설물디자인 사례 분석,"유니버설디자인 개념 기반 공공시설물디자인의 실현은 공공시설물을 접하는 사회구성원 모두에게 편안하고 쾌적한 환경을 제공할 수 있고, ‘소통(Communication)’과 ‘배려(Consideration)’를 생각하는 디자인으로서 국내외 다른 디자인 활동에도 자극을 주어 사용자를 위한 디자인이 생산되고 소비되도록 하는 데 크게 기여하고 있다. 본 논문은 누구에게나 공평하고 사용하기 편리한 공공시설물디자인 개발과 교육,홍보에 필요한 이론적 데이터와 구체적 분석자료를 제공하고자 연구되어졌다. 본 연구의 주된 범위와 내용에는 유니버셜디자인의 개념과 7가지 원리와 지침, 공공시설물 분류와 개선이 필요한 공공시설물 유형, 그리고 배려와 소통을 위한 공공시설물디자인의 국내외 사례분석 내용이 포함되어진다. 연구방법은 인터넷을 이용한 국내외 정보 D/B 및 네트워크 검색, 논문과 단행본을 포함한 도서,출판물 등 문헌조사를 통한 고찰 및 분석이 이루어졌다. 본 연구의 고찰과 분석 결과, 사회구성원 모두가 쾌적하고 공평하게 사용하기 편리함을 느낄 수 있는 공공시설물디자인의 접근방식으로 ‘모두를 위한 디자인(Design for All)’, 즉, 유니버셜디자인(Universal Design)의 개념 적용은 매우 효율적이고 기능적이며, ‘소통’과 ‘배려’를 생각하는 디자인의 필요성에 대한 인식은 디자이너뿐만 아니라 일반 대중들에게까지 더욱 널리 확산되어져야 할 필요성이 도출 되어졌다.",최석준(Suk Jun Choi),2010,https://www.riss.kr/link?id=A101725369
문화공간에 나타난 재생디자인 공간적 특성 연구 -서울시 박물관·미술관을 중심으로-,"(연구배경 및 목적) 서울시는 ‘비전 2030, 문화시민도시 서울’을 목표로 시민의 행복한 삶과 삶을 위한 문화발전이라는 방향성을 가지고 사업을 추진하고 있다. 본 사업은 크게 개인, 공동체, 지역, 도시라는 범주로 나누어, 문화 주권, 문화 공생, 문화재생, 문화 창조를 목표로 한다. 특히 여러 정책의 추진과제 중 문화사업은 문화재생의 범위 안에 속해 문화를 새롭게 만들어내는 것이 아닌, 재생하는 것에 초점을 맞춘 문화예술 사업으로 진행했다. 이 중 ‘박물관·미술관 도시, 서울’은 서울시 곳곳에 방치된 유휴공간을 재생하여 문화공간으로 활용한다. 본 연구는 해당 문화공간을 파악하여, 각각의 사례들이 재생디자인의 범주에서 어떠한 방식으로 보존되며, 특성은 무엇인지 연구하였다. (연구방법) 본 연구는 우선 문화예술 및 관련 유사 공간의 공간재생 및 디자인에 관한 이론적 고찰을 수행하고, 서울특별시에서 ’17년~’23년까지 진행하는 ‘박물관·미술관 도시, 서울’ 프로젝트의 14개 문화시설 개관 사업 중 재생디자인에 해당하는 문화공간을 사례 연구의 대상으로 한다. 서울시가 진행하는 프로젝트의 사업은 연구자 본인이 직접 방문 또는 사업부서 문의를 통해 진행하였다. (결과) 연구 결과, 서울시 도시재생사업 중 문화공간 개관 사업의 특성을 분석하여 서울시 문화공간에 나타난 재생사업 체계적 유형을 도시 생활·문화 재생형, 콘텐츠 개발 및 특화형, 역사 보존형, 문화·예술 영유형 이렇게 네 가지로 분류하여 각 사례에 나타난 재생디자인 공간적 특성을 분석하였다. 재생공간의 공간적 특성을 살펴보면, 모두 유휴지에 새로운 용도를 부여하는 부활형 공간 활용을 하고 있으며, 되도록 원형보존을 목표로 하나, 안전도나 사업의 특성에 따라 구조적으로 원형보존 및 부분 개조하였다. 사업 규모에 따라 신관을 증축하여 신구건물을 연결한 사례도 있었으나, 대부분 건축물은 증축하지 않았다. 재생디자인의 특성은 보존성, 활용성이 기본으로 나타나되, 앞으로의 공간 활용성이나, 사업특징에 따라 역사성, 예술성, 사회·문화성, 장소성, 참여성, 연계성, 경관성 등이 다양하게 나타나고 있다. (결론) 이미 개관한 건축물뿐만 아니라, 앞으로 개관을 앞둔 건물 역시 서울시가 추구하는 도시재생의 목표에 따라 진행하되, 공간과 콘텐츠가 조화를 이룰 수 있는 방향성을 추구하여 지속 가능한 문화 재생공간으로 구현될 수 있기를 기대한다.",박세희 ( Park¸ Sehee ),2021,https://www.riss.kr/link?id=A107897006
대학생 유튜브 브이로그(Vlog) 시청자의 시청동기와 지속시청의도 관계 분석 -시청몰입과 시청만족을 매개변인으로-,"본 연구는 유튜브(YouTube) 브이로그(Vlog)를 시청하는 대학생들의 시청동기 요인을 파악하고, 시청동기가 시청만족, 시청몰입, 지속시청의도에 미치는 영향과 시청동기와 지속시청의도간의 관계에서 시청 몰입과 시청 만족이 매개역할을 하는지에 대해 분석하였다. 연구를 위해 2019년 8월 14일부터 9월 14일까지 온라인 설문 후 오류가 없는 332부를 최종 분석에 사용하였다.
분석결과 첫째, 유튜브 브이로그 시청동기 요인은 외로움 해소, 매개된 관음증, 시간 보내기, 오락추구 4가지로 구분되었다. 둘째, 유튜브 브이로그 외로움해소 시청동기 요인은 시청몰입에 정(+)적인 영향을 미치지만, 시청만족과 지속시청의도에는 영향을 미치지 않는 것으로 나타났다. 셋째, 유튜브 브이로그 매개된 관음증 시청동기 요인은 시청몰입, 시청만족, 지속시청의도에 정(+)적인 영향을 미치는 것으로 나타났다. 넷째, 유튜브 브이로그 시간보내기 시청동기 요인은 시청몰입에 부(-)적인 영향을 미치고, 시청만족과 지속시청의도에는 영향을 미치지 않는 것으로 나타났다. 다섯째, 유튜브 브이로그 오락추구 시청동기 요인은 시청몰입, 시청만족, 지속시청의도에 정(+)적인 영향을 미치는 것으로 나타났다. 여섯째, 시청몰입은 매개된 관음증, 오락추구 시청동기 요인과 지속시청의도 관계에서 부분매개 효과를 갖고 있었다. 마지막으로, 시청만족은 매개된 관음증, 오락추구 시청동기 요인과 지속시청의도 관계에서 완전매개효과를 갖고 있었다. 즉, 매개된 관음증, 오락추구 시청동기 요인은 시청만족의 매개효과가 없으면 지속시청의도에 직접적으로 영향을 주지 못한다.
이러한 연구 결과는 대학생 유튜브 브이로그 시청자에 대한 연구가 부족한 상황에서 수용자의 이용과 충족 이론을 기반으로 실증적으로 검증함으로써 연구의 폭을 넓혔음에 의의를 가지며, 기존 선행연구의 전통/뉴미디어의 시청동기에서 파악할 수 없었던 ‘매개된 관음증’동기가 추가되었다는 점이 이 연구의 의의를 갖는다.",정윤주,2020,https://www.riss.kr/link?id=A107264987
오감형 가상현실 콘텐츠 사례연구,"(연구배경 및 목적)최급변하는 기술의 발달과 함께 장비의 수준도 점차적으로 높아지며 가상현실이라는 기술이 일부에서만 사용되던 예전과 달리 일반인도 쉽게 접할 수 있을 정도로 보편화되고 다양성이 증가하였다. 이러한 기술의 발달은 Experience자의 오감을 자극하여 보다 실제공간과 가상공간의 차이를 느끼지 못하고 가상공간 내에서 원활한 상호작용을 할 수 있도록 도움을 는데, 이러한 발전은 아직 초기단계이며 현재 시각과 청각을 활용한 콘텐츠는 많이 등장하였지만 오감을 활용한 콘텐츠는 대중적으로 활성화 되지 않고 있는 실정이다. 본 논문에서는 이러한 오감에 관련한 가상현실 콘텐츠 연구를 통하여 오감 가상현실 콘텐츠의 대중화를 위한 방향성을 제시하는데 목적을 두고 있다. (연구방법)가상현실에서 Experience자의 감각기관이 가상의 공간속에서 상호작용을 할 때 보다 높은 몰입감을 낼 수 있는데 Experience자가 가상현실 속에서 현실감을 느끼도록 하기 위해선 세 가지의 요소가 나타나야 하는데 바로 대화성Interaction, 현장성Presence, 자율성Autonomy 이다. 이러한 요소는 인간의 오감 즉 다섯 가지 감각이 자극 될 때 구현될 수 있으며 이러한 반응은 가상현실 속의 상호작용에서 일어나는 반응을 통해 Experience자가 이전의 인지하고 있던 예전의 정보를 연상해내고 그렇게 떠오른 연상은 콘텐츠를 분석하는데 있어 중요한 역할을 한다. 본 논문에서는 국내, 외에서 개발된 가상현실 콘텐츠 중(HMD기반) 오감에 관련된 콘텐츠를 대상으로 사례분석을 하고 가상현실 콘텐츠와 오감의 연계성, 중요성을 알아볼 것이다. (결과)본 논문은 국내, 외에서 개발된 가상현실 콘텐츠 중 오감에 관련된 콘텐츠를 대상으로 유형연구를 하고, 오감형 가상현실 콘텐츠의 방향성을 다음과 같이 제시하였다. 유형연구의 결과 시각, 청각, 촉각의 감각이 주로 사용되었으며 특히 시각은 모든 콘텐츠에서 볼 수 있었다. 청각의 경우 청각중심 콘텐츠로 조사를 한 결과 형상화되지 않은 이미지의 등장이 주를 이루었으며 소리에 집중할 수 있는 모노톤의 색상이 많이 등장하였다. 촉각을 통해 깊이감, 공간감 등을 느낄 수 있었으며 촉각을 통해 실재감이 증가하였다. (결론)4K, 8K고화질 디스플레이가 등장하였음에도 불구하고 HMD의 본질적인 단점인 Experience자의 멀미증상은 아직도 해결되지 않은 상태이며 300-500g대의 무거운 장비는 Experience자가 오래 사용하기 어려운 환경이다. Experience자가 현실의 세계처럼 느껴지 위한 오감의 경계 또한 현재보다 더 실존감있게 느껴져야 한다. 더욱 더 커져가는 가상현실시장의 더욱 확대되고 높은 가상증강현실기술이 만나 기존의 패러다임을 넘어선 새로운 오감형 콘텐츠가 나타날 것이라 생각된다.",차은지 ( Cha Eun-ji ),2016,https://www.riss.kr/link?id=A102166737
패션유통매장 VMD의 트렌드 분석 - 2020년부터 2023년을 중심으로 -,"본 연구는 패션유통매장의 VMD와 관련하여 국내 뉴스 기사를 수집하여 VMD의 구성요소의 틀에서 분석하고 패션유통매장 VMD의 트렌드 특성을 도출하는 것을 목적으로 하였다. 연구 결과, 첫째, 패션유통매장 VMD의 의미변화이다. 상품의 사회적·정서적 가치가 중요시 되었고, 쇼핑체험을 통하여 얻는 휴식, 문화체험, 경험의 의미가 중요해졌다. 둘째, 패션유통매장 VMD의 기능변화이다. 온라인매장에게 고유의 판매기능을 넘겨준 오프라인매장은 특색 있는 대형 오프라인 체험매장을 지속적으로 운영하여 브랜드의 가치와 문화를 체험을 통하여 전달하는 기능변화가 일어났다. 셋째, 패션유통매장 VMD의 핵심요소와 세부요소의 융복합현상이다. 휴식형·쇼룸형·갤러리형 체험매장, 라이프스타일형 편집매장, 라이프스타일 편집숍과 무인매장의 결합, 체험형 편집매장, 크로스오버 편집매장 등 다양한 형태로 진화하여 소비자의 요구에 부합하는 매장의 형태로 발전되어 가는 융복합 형태의 매장이 나타났다. 넷째, 패션유통매장 VMD의 최첨단디지털기술 도입이다. 온오프라인 연계확장형 체험매장과 최첨단디지털도구형 체험매장으로, 최첨단디지털기술의 선두적인 도입을 실행한 오프라인매장이다.",김지영 ( Kim Jiyoung ),2023,https://www.riss.kr/link?id=A108633705
OTT 서비스의 이용 동기와 혁신성이 콘텐츠 중독에 미치는 영향 - 미디어 인게이지먼트 매개효과를 중심으로 -,"최근 OTT 서비스가 급격히 성장하고 있다. 이는 OTT 서비스가 다양한 장르와 콘텐츠를 원하는 시간과 장소에서 편리한 디바이스로 적극적인 시청이 가능하기 때문이다. 그러나 과다시청으로 콘텐츠에 대한 의존성이 커지고 콘텐츠 시청을 통제하지 못해 일상생활에서 심각한 장애가 초래되고 있다. 이에 본 연구는 OTT 서비스의 이용 동기와 혁신성이 콘텐츠 중독에 미치는 영향 관계를 살펴보고, 이러한 과정에서 이용자들의 미디어 인게이지먼트가 콘텐츠 중독에 매개적 역할을 하는 지에 대해 실증적으로 검증해보고자 진행되었다. 이를 위해 표본으로 남·여 총 215명의 설문조사 데이터를 바탕으로 연구를 진행하였다. 연구 결과는 다음과 같다. OTT 서비스의 이용 동기에서 콘텐츠 중독에 유의미한 영향을 미치는 요인은 ‘시간 때우기·습관’, ‘회피’로 확인되었으며, 이용자들의 혁신성도 유의미한 영향을 미치는 것으로 확인되었다. 또한, 미디어 인 게이지먼트가 콘텐츠 중독에 유의미한 영향을 미치는 것으로 확인됐으며, OTT 서비스의 이용 동기가 콘텐츠 중독에 미치는 영향에 있어 미디어 인게이지먼트의 매개 역할을 하는 요인은 '시간 때우기·습관'과 '회피'인 것으로 확인되었다. 마찬가지로 이용자들의 혁신성이 콘텐츠 중독에 미치는 영향에 있어 미디어 인게이지먼트가 그 매개 역할을 하는 것으로 확인되었다. 본 연구가 OTT 콘텐츠 중독 예방과 마케팅 전략 수립에 유용한 기초자료가 되기를 기대하며, 후속 연구로 코로나 19 관련 OTT 콘텐츠 중독에 대한 깊이 있는 연구를 기대한다.",윤칠상 ( Yoon Chil Sang ),2021,https://www.riss.kr/link?id=A107791256
