
VMD기법에 의한 팝업 스토어 공간구성 요소가 브랜드 경험에 미치는 영향에 관한 연구 - 중국 내 명품 POP-UP Store 사례를 중심으로 -,"(연구배경 및 목적) 경험 경제 시대가 도래되면서 소비 흐름은 점차 오프라인으로 회귀하게 되었으며 그중에서도 소매점의 새로운 비즈니스 형태인 팝업 스토어는 유연하고 효율적인 특성으로 수많은 브랜드에서 빠르게 확산되고 있다. 이러한 팝업 스토어에서의 시각적 인식은 외부 정보를 얻는 주요 수단으로서 초기에 브랜드에 대한 소비자의 일련의 반응을 단시간 파악할 수 있다. 최근 팝업 스토어와 같은 비주얼 머천다이징(Visual Merchandising; VMD) 기법으로 구축된 창의적인 비주얼 공간은 차별적인 경험을 제공하고 소비자들의 브랜드에 대한 긍정적인 반응을 유도하여 브랜드 인지도와 경쟁력을 높이는 데 중요한 역할을 하고 있다. 특히 중국에서는 '팝업 스토어'의 발전 및 변화와 함께 브랜드 체험을 중심으로 하는 공간 계획을 확산하고 있다. 따라서 본 연구는 실증분석을 통해 중국 팝업 스토어 내의 VMD 요소와 브랜드 경험 간의 상관관계 및 중요성을 파악한 후, 브랜드 경험에 필요한 팝업 스토어 비주얼 머천다이징 전략 방안을 도출하고자 한다. (연구 방법) 본 연구는 '샤오홍슈'(小紅書) 앱을 통해 명품 팝업 스토어 블로그 순위를 기준으로 연구사례를 선정하였다. 연구 방법은 선정한 사례를 중심으로 팝업 스토어 메인 고객인 MZ세대 소비자를 대상으로 팝업 스토어의 VMD 공간 구성요소와 브랜드 경험에 대하여 설문조사를 진행하였으며 분석은 SPSS PRO를 통해 신뢰도 요인분석, 확인적 요인분석 및 회귀 분석 방법으로 VMD 공간 구성 요인이 브랜드 경험에 미치는 영향 관계를 검증하였다. (결과) 그 결과‘시각적 표현 VP존',‘판매적 표현 PP존', '체험적 표현 EP존', '포커스 표현 FP존'(작은따옴표 기호통일) 은 모두 브랜드 경험에 유의미한 정(+)의 영향을 미쳤으며 FP, VP, PP존은 중요도가 높은 반면 IP존은 브랜드 경험에 영향을 미치지 않는 것을 알 수 있다. 따라서 VMD에 따른 팝업 스토어 공간 구성요소가 브랜드 경험에 영향을 미친다는 가설이 검증되었다. (결론) 분석 결과 팝업 스토어 공간에서 브랜드 경험에 영향을 미치는 중요도는 FP존, PP존, VP존, EP존, IP존의 순으로 나타났다. 특히 FP존, PP존, VP존 및 EP존의 시각적 기능은 브랜드 경험을 향상하는 데에 긍정적인 영향을 미치는 것으로 팝업 스토어에서의 소비자에 대한 시각적 이미지 제공의 중요성을 알 수 있으며 IP존의 시각적 디자인 기능이 브랜드 경험에 큰 영향을 미치지 않는 이유는 IP존이 체험 제공보다는 주로 쇼핑의 기능만을 충족하는 공간이기 때문임을 알 수 있다. 따라서 이커머스(E-Commerce)의 시장규모가 지속적으로 확대되는 시대에 팝업 스토어가 수많은 브랜드에서 자리 잡을 수 있었던 것은 비주얼 마케팅의 중요한 역할 때문임을 알 수 있으며 향후 이에 관한 연구는 브랜드 경험에 대한 다양한 요인의 영향을 더 깊이 있게 고려하여 기업의 브랜드 팝업 스토어 활성화에 기여해야 할 것이다.",이흔영,2023,https://www.riss.kr/link?id=A108727677
국립박물관 전시 공간의 실감형 콘텐츠 구현 특성 연구,"디지털 매체의 활용과 수용은 국내에서도 박물관 공간 변화를 초래하게 되었고 관람객들의 오감을 자극하여 몰입도를 증진 시키는 실감형 콘텐츠는 차세대 정보통신 환경에서 유망산업 분야로, 디지털 혁명 시대에 다양한 기술력을 중심으로 한 전시 콘텐츠 개발과 구현에 선도적 역할을 하고 있다. 또한 스마트 박물관으로서 역할 제고, 디지털 체험공간을 조성, 박물관 브랜드 강화를 위해 실감형 콘텐츠 활용도가 높아지고 있다. 본 연구는 박물관의 실감형 전시 콘텐츠에 주안점을 두어 전시공간에 대한 접근성을 확보하고, 실감형 전시 콘텐츠 구현을 위한 공간구성의 특성과 이를 활용한 국내 박물관 전시사례를 조사 및 분석함으로써 박물관 실감형 콘텐츠 활용 경향 파악과 실감 콘텐츠 구현 특성에 관한 계획상의 단초 마련을 궁극적인 연구 목적으로 한다. 본 연구를 통하여 실감 콘텐츠 구현에 대한 계획 지침을 도출하고 실감 콘텐츠 구현 방식은 관람형 실감 콘텐츠와 관람자 인터렉션을 수용한 상호작용형 실감 콘텐츠의 2가지 유형으로 대별되며, 실감영상 제작은 실제 촬영 영상보다는 CG 랜더링을 통한 가상공간의 영상을 통한 실감 콘텐츠를 구현, 다면 구성으로의 실감 콘텐츠 구현의 특성이 나타났다.",최준혁 ( Choi Jun-hyuck ),2023,https://www.riss.kr/link?id=A108633711
학교공간혁신을 위한 학습자 중심의 유연한 공간플랫폼 제안,"(연구배경 및 목적) 학교라는 공간은 우리의 청소년/아이들을 위한 배움의 장소이자 커뮤니티 공공시설이다. 하지만 오랜 시간 동안 사각형 교실에서 일방적 지식의 전수기관으로 머물러 왔다. 그 결과 학교라는 공간은 지금껏 효율적인 관리와 통제의 학습공간으로만 기능하고 있었다. 하지만 최근 4차 산업혁명 시대에 도달하면서 획일적이고 정형화된 인재가 아닌, 미래의 불확실성에 대해 대처하고 새로운 것을 만들어 낼 수 있는 창의적인 인재육성을 요구하고 있다. 이에 본 연구는 창의적 인재육성을 위한 유형별 학습 환경 분석을 통해 전통적인 사각형이라는 물리적인 공간 구조에서 벗어난 창의적 미래 교육 환경에 맞는 새로운 형태의 교실공간에 대해 제시하고자 한다. 노후화된 재료와 마감을 교체하거나 리모델링하는 수준의 변화가 아닌 기존 교실공간의 패러다임 자체를 파괴하는 개념으로 새로운 접근을 통해 창의적인 인재육성을 위한 미래 교육 학습활동을 할 수 있는 학습자 중심의 유연한 공간플랫폼을 제시하는 데에 목적이 있다. (연구방법) 전통적인 수업방식은 사각형의 정해진 물리적 공간에서 교과서(혹은 영상자료)에 기반하여, 3Rs Reading(읽기), Writing(쓰기), Arithmetic(연산) 중심으로 진행됐으며, 이러한 교육패러다임 방식은 대량생산 체제에서 요구하는 획일적이고 표준화된 인간을 육성하는 데 효율적이었다. 하지만 4차 산업혁명 시대에 맞추어 급격히 변화하는 미래를 이끌 창의·융합형 인재를 길러내기 위해, 여러 교육기관은 창의·융합교육을 뜻하는 4Cs Creativity(창의성), Critical Thinking(비판적 사고), Collaboration(협력), Communication(의사소통)을 토대로 다양한 방법으로 교실공간과 교육프로그램에 변화를 주고 있다. 이에 본 연구는 해외의 다양한 선진 미래교실 환경사례를 통해 4Cs를 함양할 수 있는 수업환경과 방식에 대해 알아보고, 이에 맞는 학습자 중심의 유형별 미래교실공간의 프로토타입(prototype)을 설정하고자 한다, 또한, 첨단기술의 체계적 통합과 정보의 자유로운 교류를 통해 협동 맞춤 개별학습이 가능하도록 하는 학습공간은 어떠한 공간구조와 기능을 가져야 하는지에 대해 고민하여 학습자 중심의 유연한 미래교실 플랫폼을 제안하고자 한다. (결과) 첫째, 기존 지식전달 중심의 사각형 공간을 탈피하고 소통과 협력 중심의 수업환경을 구현하고자 방향성이 없는 허니콤(honeycomb) 구조의 모듈을 적용하였다. 둘째, 허니콤(honeycomb) 구조의 모듈을 통해 용도와 기능에 따라 유기적인 연결과 분리를 할 수 있어 확장 가능한 레이아웃을 계획하였다. 셋째, 교사와 학생들의 창의, 융합교육학습(4Cs)의 다양한 유형별 수업 활동을 위해 교실의 병합과 분리를 할 수 있는 시스템을 구축하고, 배치와 조합이 자유로운 모듈형 가구와 기자재를 계획함으로써 학습자 중심의 유연한 유형별 수업환경을 다목적 활용(Multi-Use)공간을 계획하였다. (결론) 기존 교실공간의 패러다임을 탈피한 본 연구 과제를 통해 기존의 획일적이고 감옥 같은 학교공간을 혁신시킬 수 있는 하나의 사례로써 지침이 될 수 있을 것이다.",박병준 ( Park Byoungjoon ),2021,https://www.riss.kr/link?id=A107747655
디자인을 통한 국내 업사이클링 산업 활성화 방안 제시,"연구배경 : 국내 업사이클링 산업은 정부와 기업의 관심과 달리 국외 업사이클링 선진국에 비해 발전이 느리다. 이에 본 연구는 국내 업사이클링 산업에 미치는 요인과 문제점을 디자인 관점에서 분석하여 활성화 방안을 제시하고자 하였다.
연구방법 첫째, 사전적 정의를 통해 업사이클링의 개념을 이해하고 국내 업사이클링 산업의 현황을 파악하기 위해 관련 문헌 및 관련 기관의 자료, 보고서 등을 수집하였다. 둘째, 국내의 업사이클링 산업을 해외 업사이클링 산업과 비교하여 미성숙한 단계로서 다각적인 기반이 구축되어야 하는 산업임을 파악하였다. 국내 업사이클링 산업의 현황을 구체적으로 파악하고 분석하기 위하여 국내 업사이클링 기업, 마켓, 관련 활동들을 기업, 기관의 사이트와 기사 등에서 포괄적으로 수집하였다. 셋째, 이를 종합하여 국내 업사이클링 산업의 기업 유형 및 생태계를 파악하고 분석한 뒤 특성을 찾아내고 시사점을 다섯 가지로 정리하였다.
연구결과 : 최종적으로 정리된 시사점을 토대로 국내 업사이클링 산업을 활성화하기 위해, 업사이클링 디자인 방법론 및 도구의 연구 개발, 다양한 경로를 통한 안정적 소재 수급, 온라인 마켓 개선, 지속가능한 교육 프로그램 개발의 네 가지 방안을 제안하였다.
결론 : 본 연구를 통해, 기존 국내 업사이클링 산업의 생산방식의 한계를 극복하고, 소재의 안정적인 확보와 효율적인 활용방안을 극복할 수 있으며, 기업과 소비자의 직접적인 소통 및 소비자의 시장 참여 유도와 친환경적 문화확산 및 소비 시장 규모 확산을 도모할 수 있다.","정서준(Jung, Seojun)",2015,https://www.riss.kr/link?id=A101087579
도시재생을 통한 복합문화공간의 공공공간에 관한 연구,"(연구배경 및 목적) 우리나라는 급속한 산업화로 도시의 무분별한 개발과 쇠퇴로 인해 도시의 곳곳에서 본연의 기능을 상실한 건축물와 폐산업시설 등 흉물처럼 남아 있는 유휴지를 활용한 도시재생사업이 중요한 사업으로 부각되었다. 본 연구는 도시재생사업 중 지역의 활성화에 크게 기여하고 있다고 평가되고 있는 문화 중심의 도시재생 사업으로 한정하였고, 방문객들이 가장 많이 이용하며 교류의 중심이 되는 복합문화공간의 공공공간에 대한 연구의 필요성을 인식하고, 공간특성과 공간구성을 중점으로 연구하였다. 이에 앞으로 추진될 문화 중심의 복합문화공간 조성 시 공공공간에 대한 방향성을 제시하는데 연구의 목적이 있다. (연구방법) 본 연구의 방법은 이론적 고찰을 통해 문화적 도시재생의 개념과 복합문화공간에 대해 파악하고, 선행연구를 통해 도시재생 공간의 공공공간 특성요소와 복합문화공간의 공간구성 요소를 도출하였다. 앞서 도출된 공공공간 특성요소 항목은 평가의 항목으로 선정하고, 공간구성 요소는 사례조사에 활용하였다. 연구분석을 위한 사례는 최근 5년 이내로 한정하였으며, 연구의 타당성을 검증하기 위해 전문가 설문조사를 진행하였다. 그리고 마지막으로 설문조사를 통해 취합된 내용을 분석모형으로 구체화하였다. (결과) 도시재생과 복합문화공간에 관한 선행연구 결과 공공공간의 공간특성은 복합성, 체험성, 접근성, 장소성, 역사성, 심미성, 쾌적성이 도출되었으며, 공간구성 요소는 체험공간, 휴식공간, 상업공간 및 창작·교육공간으로 조사되었다. 각 사례에 대한 연구결과 공간구성요소는 전체적으로 잘 구성되어 있었으며, 공공공간의 특성요소에 대한 전문가 조사결과 복합성과 역사성이 공통적으로 가장 높게 조사되었다. 공간에 대한 장소성과 심미성이 두 번째로 높게 평가되었으며 다음으로 체험성과 쾌적성, 접근성 순으로 조사되었다. (결론) 문화를 중심으로 하는 복합문화공간 조성 시 공공공간 측면에서 다음과 같은 공간특성요소를 고려해야 한다. 첫째, 문화적 관점에서 복합성을 고려한 공공공간 구성이 필요하며 둘째, 재생의 공간이라는 시대적 역사성을 공간에 담아야 하고 셋째, 미학적 요소를 살려 공간의 심미성을 중점으로 공간을 구성해야 하며 넷째, 지역문화 활성화와 문화적 거점의 공간이 되기 위해서는 재생공간의 정체성과 문화적 장소성을 고려해야 한다. 따라서 본 연구에서는 복합문화공간의 활성화와 지역주민의 문화 수준향상을 위한 문화중심의 도시재생 공간에 대해 연구하였으며, 복합문화공간 구축 시 유용한 기초자료로 활용되기를 기대한다.",신윤선,2022,https://www.riss.kr/link?id=A108110116
디지털 디바이드 해소를 위한 노인복지관의 디지털 체험 공간 연구,"(연구배경 및 목적) 인터넷의 발달과 생활의 보편화로 인해 모든 연령층의 일상이 빠르게 변화하고 있으나, 노인들은 디지털 기기의 시용 및 사회 적응에 어려움과 불편함을 겪고 있다. 노인들의 디지털 디바이드 문제는 세대 간의 소통을 단절시키는 요인이 되고 있으며, 이로 인한 심리적인 어려움과 소외현상으로 이어지고 있다. 최근 이러한 노인들의 디지털 디바이드 해소의 필요성이 제기됨에 따라, 이와 관련한 디지털 활용 교육 대책이 마련되고 있다. 그러나 디지털에 관한 기본적인 교육만 진행하기 때문에 노인의 디지털 활용 능력은 정체되고 있는 실정이다. 따라서 디지털의 단순한 사용보다는 제대로 활용할 수 있는 디지털 리터러시 교육 및 활용능력이 요구된다. 본 연구는 고령층의 디지털 디바이드와 그로 인한 소외현상에 주목하고 이를 해소시키고 자 하는 함에 연구의 목적이 있다. 이에 노인들의 디지털 디바이드로 인한 소외현상을 해소하기 위해 노인복지관의 디지털 리터러시 필요성과 체험 공간에 대하여 연구하고자 한다. (연구방법) 노인들을 위한 디지털 리터러시 및 체험공간의 연구를 위해 참고문헌을 통한 이론을 고찰하고 선행 연구 및 사례를 조사하여 분석하였다. 또한 노인들의 디지털 활용 정도와 디지털 디바이드 문제로 인한 노인들의 소외현상을 관련기사 및 관련 인터뷰를 통해 조사하고 우리나라 디지털리터러시 요구조건에 가장 부합하다고 생각되는 국내·외 사례를 분석하였다. 이를 통해 디지털 리터러시의 필요성을 제기하고 현재 디지털 리터러시 교육의 문제점과 디지털 체험을 위한 공간의 필요성과 요구조건 등을 도출하였다. (결과) 본 연구에서는 노인들의 디지털 디바이드와 이에 따른 소외현상과 문제점을 살펴보았다. 노인들은 생활과 가장 밀접한 디지털 기기인 스마트폰마저 젊은 세대와 사용과 활용의 격차가 있고, 무인매장의 키오스크의 이용에도 불편함을 겪고 있는 것을 알 수 있었다. 따라서 노인들도 점점 발전하는 디지털시대에 단순히 기기를 이용만 하는 것이 아니라, 다양한 정보를 목적에 맞게 활용할 줄 아는 디지털 리터러시의 필요성을 알 수 있었다. 이를 위한 정부와 민간단체들의 노인을 위한 디지털 리터러시 정책의 실시와 교육을 지원하고 있지만 원론적인 차원의 교육에 머물고 있어, 노인들이 직접 경험하고 익힐 수 있는 교육과 체험할 수 있는 공간이 더욱 중요함을 알 수 있다. 노인들이 위축되지 않고 편안한 공간에서 디지털을 직접적으로 체험할 수 있는 공간이야말로 디지털리터러시의 효과를 더욱 높일 수 있을 것이다. (결론) 노인들의 디지털 디바이드 해소를 위해 기본적인 교육뿐만 아니라, 일상생활 속에서 편안하게 교육 받고, 체험할 수 있는 공간의 조성은 매우 중요하다. 그리고 이러한 공간 환경은 노인들의 디지털디바이스 문제가 해소되고 자립적이고 원활하게 디지털시대의 건강한 노년을 보낼 수 있는 사회 환경이 조성될 것으로 기대한다.",김미숙 ( Kim Misook ),2022,https://www.riss.kr/link?id=A108335680
국가브랜드 측정평가 요인에 기반한 국가브랜드 평가 상위국에 대한 사례연구- 독일·프랑스·미국·일본 등 4개국을 중심으로 -,"본 연구는 국가브랜드 평가 상위국의 현황 및 실태를 살펴보고, 국가브랜드 전략 수립에 참고 가능한 요인 도출 및 시사점 제시를 목적으로 진행되었다. 연구방법은 문헌조사를 통해 NBI, BSI, SERI-PCNB NBDO 측정법을 종합하여 국가브랜드 전략에서 고려해야할 요인을 3개의 대항목과 13개의 소 항목으로 구분 짓고, 이를 분석도구로 활용하여 사례조사를 실시하였다. 조사대상은 국가브랜드 순위 상위국가인 독일·프랑스·미국·일본 등 4개국이다. 사례조사 결과, 국민의 능력, 외국인 인식도, 준법정신, 글로벌 의식으로 이루어진 국민성은 국가별로 정도 및 추구 방향에 차이가 있으나, 문화 및 제품·서비스의 근간이 되므로 국가브랜드 기획 단계부터 접목되어야 한다. 대중문화, 관광이미지, 인적요인, 자연경관, 역사적 산물로 구성된 문화·유산은 타 국가와 차별화된 홍보 전략이 필요하며 이를 통해 국가이미지를 구축하고 경쟁력을 도모해야 한다. 디자인, 기술, 경쟁력, 혁신성으로 이루어진 제품·서비스는 국민의 특성 및 능력, 문화가 반영된 결과로, 인지도 및 신뢰도를 강화시킴으로써 국가브랜드 가치를 향상시키고 성공적인 국제관계를 이끌어야 한다. 향후 연구를 통해 추출한 요인에 우리의 강점을 접목하여 국제사회에서 선도적 역할을 할 수 있는 체계적 방법과 전략을 통한 경쟁력 향상 방안을 마련해야 할 것이다.",차은수,2022,https://www.riss.kr/link?id=A108295829
실내디자인 스타일 유형화에 따른 주거공간 코디네이트 연출방법에 관한 연구,"실내디자인 스타일 유형화에 따른 주거 코디네이트 연출방법에 대하여 연구하기 위해 실내디자인 스타일 유형에 따라 모델하우스에서 주거 코디네이트가 적용된 사례를 중심으로 살펴보았다. 실내디자인 스타일 유형은 선행 연구된 자료와 현재 연구되어진 트렌드를 중심으로 분석하였고 2000년 이후부터 현재까지 적용된 스타일을 수집 하고, 사전 조사와 1차, 2차 조사를 각 전문가의 협조에 의해 진행되어 선정하였다. 이와 같은 결과로 모던, 클래식, 로맨틱, 미니멀, 오리엔탈, 내추럴, 믹스 앤 매치의 7가지 그룹의 실내디자인 스타일로 분류하게 되었다. 주거 코디네이트 연출 하기위한 방법을 7가지 사항으로 분류하면 다음과 같다.① 실내디자인 콘셉트 및 키워드추출 ② 코디네이트 콘셉트 및 이미지 콜라주 ③ 건축요소계획 ④ 가구 계획⑤ 패브릭 계획 ⑥ 코디네이트 오브젝트 계획 ⑦ 설치. 각 유형에 7가지 단계를 대입하여 실내디자인 코디네이션 연출 방법을 실무적으로 도입 하였다. 본 연구는 선행 자료에 따른 프로세스를 참고로 실무를 통해본 실내디자인 스타일별 주거공간 코디네이트 방법을 적용하였다. 이에 본 연구가 실내디자인의 주거 공간 코디네이트를 위한 방법적인 접근을 위한 예시로 참고가 되기를 바란다.",김소희,2010,https://www.riss.kr/link?id=A82688775
국내 유니콘 서비스 기업 사례분석을 통한 고객 경험 기반 서비스 혁신 프레임워크 제안,"서비스산업이 고부가가치를 창출하기 위해서는 서비스 경쟁력이 강화되어야 한다. 본 연구는 고객 경험 기반 서비스 혁신 프레임워크를 제안하고 검증하는 것을 목적으로 한다. 결과, 과정, 경험, 시스템 영역으로 구분된 고객 경험 기반 서비스 혁신 프레임워크를 제안하고, 국내 5개 유니콘 기업(야놀자, 쏘카, 무신사, 오늘의 집, 당근마켓)의 서비스 혁신 사례를 분석하였다. 결론적으로 고객 경험 기반 서비스 혁신을 다양하게 시도한 기업을 소비자는 더 혁신적으로 인식하였으며 해당 기업의 초기 성장률도 더 높게 나타났다. 또한 기업은 결과 기반 혁신, 과정 기반 혁신, 시스템 기반 혁신의 순으로 고객 경험 기반 서비스 혁신을 실행함을 확인할 수 있었다. 본 연구는 서비스를 기획하고 디자인하는 데 있어서 가이드라인의 역할을 하고 서비스 혁신을 추구하는 기업이 자신의 서비스를 분석하고 서비스 혁신 전략을 수립하는 데 실질적 도움을 줄 것으로 기대된다.",정재희(Jae Hee Chung),2023,https://www.riss.kr/link?id=A108519156
