
"부리오의 ""관계미학""의 의의와 문제","니콜라스 부리오(Nicolas Bourriaud)는 미술계가 1990년대에 들어 대다수의 비평가와 철학자들이 다루기를 꺼려하는 새로운 현상을 맞이하게 되었다고 진단하고, 바로 이러한 새로운 예술현상을 이론적으로 정식화하기 위해 ""관계미학""과 ""관계예술""이란 개념을 창안하게 된다. 부리오는 관계예술이란 인간의 상호관계를 다루는 예술이고 관계미학이란 인간의 상호관계에 기초하여 작품을 평가하는 이론으로 각각 정의하며, 90년대 일련의 예술가들이 이러한 인간관계를 자신의 예술적 주제로 다루게 된 배경은 무엇보다 자본주의 체제의 심화가 인간의 관계를 폐색하고 단절해왔다는 인식에서 비롯되었다고 분석한다. 그리하여 관계예술가들은 폐색되고 단절된 인간의 관계를 다시 뚫고 연결함으로써 그리하여 소규모의 현실적인 유토피아를 개진함으로써 자본주의의 문제에 대한 대안을 제시하고자 했다는 것이다. 부리오는 이러한 관계예술가들의 출현의 시대적 배경과 그들의 문제의식, 그리고 그들의 새로운 예술적 형식의 창안과 그들이 제시하고자 했던 공동체를 다양한 이론가들의 다양한 개념들을 차용하고 취합함으로써 자신의 관계미학의 이론을 확립하게 된다. 본고는 구체적으로 관계미학을 이론적으로 뒷받침하는 주요개념들을 부리오의 텍스트를 통해, 즉 ⑴ 관계예술의 출현의 시대적 배경을 데보르의 ""스펙터클의 사회""라는 개념을 통해 분석하고 또한 관계예술의 기능을 마르크스의 ""사회적 틈으로서의 예술""의 개념을 통해 검토하고, ⑵ 관계예술가들이 어떻게 새로운 예술적 형식을 창안하게 되는지를 데니와 레비나스의 형식의 개념을 통해 논의한 뒤, 나아가 ⑶ 관계예술이 추구한 실제적 소(小)유토피아와 그것의 철학적 토대를 위해 차용된 펠릭스 가타리의 ""주체성""과 ""미적 패러다임""의 개념을 차례로 검토한다. 그런 뒤, 관계예술이 다루는 인간관계가-부리오가 자신의 이론에 한편 철학적 토대와 권위를 부여하기 위해 끌어들였던 가타리의 (주체성과 미적 패러다임의 의거한) 탈구조주의적 관점에서 다른 한편 새로운 미학적 지위를 부여하기 위해 90년대 현대예술의 담론 속에 위치시키려했던 미학적 맥락에서, 특히 랑시에르의 비판적 예술의 관점에서-어떤 적합성을 갖는지를 논의함으로써 관계미학의 의의와 문제를 조명한다. 본고는 부리오의 관계미학의 의의가 주로 현대(미술)사적 맥락에 놓여있다고 주장한다. 관계예술이 등장한 90년대라는 시대적 맥락은 1989년 베를린 장벽의 몰락이후 민주주의와 자본주의의 모순적 결합에 의해 상징화될 수 있는데, 이것은 소위 시장 자유주의 또는 글로벌 자본주의의 전지구적 지배로 집약된다. 니콜라스 부리오는 90년대 일련의 예술가들이 바로 이러한 새로운 지배체제로부터 비롯되는 문제를 예민하게 의식하고 작업을 하고 있었다는 것을 날카롭게 포착하고 이론적으로 체계화 했으며 실천적으로 전시기획을 해왔다. 우리는 여기서 획기적인 역사적 사건은-모든 미술사의 전환기가 그렇듯이-현대예술의 흐름에서도 중요한 전환점을 준비했고, 실제로 이것에 반응했던 일련의 예술가와 부리오와 같은 비평가/기획자/이론가를 통해 예술의 시대적 존재이유(raison d'etre)를 확인하게 된다. 이러한 맥락에서 부리오의 업적은 이러한 90년대 새로운 예술가들의 운동을 ""관계미학""과 ""관계예술""이라는 전문개념의 창안을 통해 하나의 시대적 양식으로 포착하고 정식화하려 했다는데 있다고 사료된다. 그럼에도 불구하고 본고는 부리오의 관계미학이 적지 않는 문제를 안고 있음을 다음과 같이 논의한다. 첫째 부리오는 관계미학을 가타리의 사상에 근거시키고자 했지만, 사실상 탈구조주의의 맥락을 충분히 고려함이 없이 그의 주체성과 미적 패러다임의 개념을 원용하고 있으며, 둘째 부리오의 관계예술은-랑시에르에 따라 비판적 예술의 힘이 의도와 결과의 직접적 인과관계에서가 아니라 오히려 그것의 분리에서 비롯된다는 것을 받아들일 때-동질적인 다수성을 전제하기 때문에 오늘날 비판적 예술의 스펙트럼에서 주변화 되어 있다. 그리하여 부리오의 관계예술은 오늘날 다양한 사회적, 문화적, 정치적 갈등구조의 문제를 다루는데 있어서 제한적이며, 그것이 제시하는 소(小)유토피아도 민주주의적 공동체와는 거리가 멀다. 부리오의 관계미학의 많은 문제는 아마도 그가 이론적으로-특히 모더니즘과 포스트모더니즘, 구조주의와 탈구조주의 사이에서-애매하고 절충적인 입장을 취하는 것과 관련되어 있을 것이라고 결론짓는다.",김기수,2011,https://www.riss.kr/link?id=A99908033
인공지능 기반 미술을 중심으로 한 미술비평교육이 고등학생의 미디어리터러시에 미치는 영향,"새로운 과학기술의 발달로 인해 미디어 환경이 크게 변화하면서 많은 양의 정보를 분석하고 판단하여 활용하는 능력이 이 시대의 핵심역량으로 떠오르고 있다. 이에 본 연구는 인공지능 기반 미술을 중심으로 한 미술비평교육이 고등학생의 미디어 리터러시에 미치는 영향을 알아보는 것을 목적으로 한다. 연구대상은 서울과 경기지역에 소재한 고등학교의 학생 30명을 선정하였고, 천혜선(2016)이 개발한 미디어 리터러시 검사지를 사전과 사후검사에 활용하였다. 인공지능 기반 미술을 중심으로 한 미술비평수업은 학습자가 인공지능 기술을 활용한 미술의 창작과정을 탐구하며 미디어 사회를 반영하는 인공지능 미술작품을 비평하고, 인공지능을 직접 활용하여 자신의 작품을 제작할 수 있도록 설계하였다. 본 연구 수업의 사전·사후 검사지는 SPSS Ver. 21.0 프로그램으로 통계처리 하였고, 학습자의 수업 결과물은 질적 분석하여 연구의 신뢰도를 높이고자 하였다. 연구 결과 인공지능 기반 미술을 중심으로 한 미술비평교육은 고등학생의 미디어 리터러시에 유의미한 변화를 가져왔으며 하위영역인 미디어 이용 통제, 미디어의 도구적 활용, 시민미디어에 대한 이해, 개인창작 영역에 긍정적인 영향을 미쳤다. 따라서 본 연구는 인공지능 기반 미술을 중심으로 한 미술비평교육을 통해 미디어 리터러시 교육의 새로운 융합적 교육 방안을 모색하고 그 효과를 검증하였다는 데에 의의가 있다.","김예진(Kim, Ye Jin)",2021,https://www.riss.kr/link?id=A107906426
프랭크 로이드 라이트 주택건축에 나타난 공간 표현특성 연구,"프랭크 로이드 라이트는 근대 건축의 개혁자이자 20세기 건축의 선구자로서 당대의 관습에 얽매이지 않고 유기적 건축사상을 토대로 자신만의 건축사상과 철학을 정립하였다. 그는 자신의 건축을 정의하면서 사람과 시간 그리고 장소가 유기적인 통합을 이루어져야 하며 이러한 사상의 중심에는 자연이 있음을 강조한다. 결국 자연은 그가 주장하는 유기적 건축의 핵심으로 건축은 자연과 상호보안의 관계이며 자연이 주는 재료와 아름다움이 건축과 조화를 이룰때 유기적 독창성을 지닌 건축이 된다고 주장하였다. 이러한 그의 사상은 건축의 형태, 평면, 재료, 가구의 통합적 건축요소에 표현되었다. 새로운 건축적 방향을 제시한 라이트의 작품은 그가 생애를 마감한 이후 반세기가 지난 현재까지도 많은 건축가와 건축을 공부하는 이들에게 커다란 영감을 주고 있다. 본 연구는 그의 건축적 사상과 철학이 어떠한 방식으로 공간을 구성하고 표현되는지 분석해 봄으로써 라이트 건축의 가치에 대해 재고해 보는데 목적과 의의를 둔다.",라윤지,2011,https://www.riss.kr/link?id=A60093613
박서보의 1960년대 작업 연구,"본 논문은 박서보가 1961년에 1년 가까이 프랑스에 체류하면서 앵포르멜 미술뿐 아니라 누보 레알리즘과 같은 앵포르멜 이후의 미술을 접하게 되는 과정을 추적하고, 이 시기의 경험이 그의 1960년대의 작업 전반에 반영되었음을 논의한다. 본 논문에서 특히 주목하였던 것은 박서보가 프랑스에서 앵포르멜 미술보다 누보 레알리즘과 이브 클랭의 작업에 경도되었다는 점이다. 특히 클랭의 영향은 박서보의 귀국 직후의 작업인 〈원형질〉 연작은 물론이고 1960년대 말에 제작된 〈허상〉과 〈유전질〉연작에까지 지속적으로 반영되었다. 그러나 박서보는 귀국 직후부터 프
랑스 미술계를 비판적으로 언급하면서 자신이 그곳에 체류하는 동안 프랑스 현대미술의 영향을 거의 수용하지 않았음을 강조하였다. 특히 그는 〈원형질〉 연작과 관련해서는 이 작업과 누보 레알리즘 혹은 클랭의 관계를 강조하는 대신, 이를 앵포르멜 미술로 소개하기도 하였다. 이에 본 연구는 박서보가 귀국 후의 작업에 있어 프랑스 체류 시기의 영향을 강조하지 않았던 배경을 당대의 국내외 미술계의 정황과 연계해 분석한다. 이러한 과정을 통해 본 논문은 박서보의 1960년대의 작업은 그의 프랑스 체류 시기의 경험과 당대 프랑스 미술계와의 관계라는 보다 국제적인 맥락에서 재조명되어야 하며, 이를 통해 미술사적으로 재평가되어야함을 강조하고자 한다.",전유신(Yusin Jeon),2017,https://www.riss.kr/link?id=A104891862
도시공간의 유휴공간 활용방안에 관한 연구,"서울의 도시공간의 기능과 역할은 재검토되어야 한다. 도시는 단순히 한 부분의 편익만을 위한 공간이어서는 안되며, 다양한 이용자의 편익을 고루 충족시키는 시민의 공간으로 다시 태어나야 한다. 도시의 여러 공간은 보행, 휴식, 만남, 산책, 쇼핑 등 시민들의 다양한 활동이 일어나는 공공장소이며, 시민과 방문자들이 그 도시를 이해하고 느끼는 도시의 이미지를 형성한다. 도시의 공간은 모든 사회적 활동을 담는 장소임을 인식해야 한다.
우리나라는 인구밀도 476명/㎢의 세계 3위의 고밀도 국가다. 특히 전 인구의 30%이상이 밀집되어 있는 서울은 자동차가 다니기에도 부족하여 항상 체증과 혼잡을 겪고 있는 도시이다. 그러나 서울에는 차량의 소통에도 쓰이지 않고, 사람의 보행이나 여러 활동에도 쓰이지 않는 많은 공간이 남아 있으며, 본 연구는 이 공간을 ‘유휴공간’이라 칭한다. 도시 속에 자리잡고 있는 공간이나 활용되지 않거나, 적합하게 쓰이지 않는 공간 모두를 유휴공간이라 할 수 있다.
서울은 유휴공간을 많이 가지고 있다. 이런 유휴공간을 적극적으로 활용하여 도시공간을 지혜롭게 개선하면,
1) 보다 많은 녹지공간 조성
2) 보다 편안하고 안전한 보행공간 조성
3) 보다 유용한 활용으로 다양한 기능 부여
4) 시민의 여가활동공간 제공을 통한 사회적 교류 증대
5) 쾌적하고 아름다운 도시 이미지 조성
등 보다 유용하고 기능적이며 아름다운, 쾌적하고 즐거운 인간을 위한 공간으로 조성할 수 있다.
그러나 지금까지 유휴공간에 대한 정확한 인식과 유용한 개발은 미비한 편이었으며, 따라서 유휴공간의 적극적 개발과 활용은 시급하다. 특히 국가, 지역, 시민의 도시공간에 관한 통합된 관심과 인식의 변화를 통한 유휴공간의 해결방안이 필요하다. 앞으로도 지속적인 연구와 개발로 좀 더 적극적인 유휴공간 활용을 시도해야 할 것이다.",백나영,2002,https://www.riss.kr/link?id=A347150
대학 교양 미술 교육에서 인공지능의 활용 방향 탐색,"본 연구는 최근 인공지능의 발달과 함께 급격히 확대된 인공지능 활용 사례 검토를 바탕으로 대학 교양 미술 교육에서 인공지능의 활용 방향을 탐색하기 위해 수행되었다. 먼저 교육에서의 인공지능 활용은 학생 교육, 학생 지원, 교사 지원 등의 영역에서 시스템 개발을 비롯하여 각종 기술과 접근이 이루어지고 있으며 특히 개별화/맞춤형 학습의 측면에서 강점을 가진다. 다음으로 미술에서의 인공지능 활용은 창작, 감상, 제도 등 다양한 영역에서 연구가 이루어지고 있고, 일부 미술 교육에 도입되었으며 기개발된 인공지능 기술을 활용하는 경우와, 인공지능 기술을 도구로 활용하여 각 영역에 새로운 시각을 보여주는 경우를 동시에 엿볼 수 있다. 마지막으로 대학 교양 미술 교육의 목표 분석을 토대로 교육에서의 인공지능 시스템을 대학 교양 미술 교육 사례에 대입하여 대학 교양 미술 교육에서 인공지능의 활용 방안을 탐색하였다. 향후 가속화될 미술 교육에서의 인공지능 활용은 미술 교육의 목적에 부합하는 방식으로 이루어져야 할 것이며 이를 바탕으로 한 플랫폼 및 콘텐츠의 개발과 활용 방안 탐색이 필요할 것이다.","안지연(Ahn, Ji Youn)",2020,https://www.riss.kr/link?id=A107087280
레지오 에밀리아의 공간 접근법을 적용한 어린이놀이테마공간에 관한 연구,"어린이 놀이공간은 창의력 있는 인재육성과 여성의 사회진출이 활발해 짐에 따라 교육적인 가치를 띠는 전문적인 놀이공간으로 변화하고 있다. 본 연구는 사회성과 또래집단과의 교류, 교사와 관계에 주목하고 능동적인 어린이를 육성하는데 초점이 맞춰진 레지오 에밀리아의 공간 접근법을 고찰하여 유아학교에서 발견되는 요소를 중심으로 현대 어린이놀이공간을 분석하고 우리나라에 맞는 어린이놀이테마공간을 제안하는데 그 목적이 있다. 유아학교에서 추출한 공간적 특성은 개방성, 투명성, 자연성, 다양성, 조형성으로 구체화된다. 사례를 분석한 결과 우리나라 놀이공간에서는 개방성과 투명성이 부족하였고 캐릭터 위주의 놀이시설로만 꾸며져 있다. 레지오 에밀리아의 공간 접근법은 어린이공간을 어른의 축소공간으로 이해한다. 어른들의 세계인 도시구조를 반영한 어린이공간은 어른이 되기 위한 축소공간으로 도시와 사회와의 관계에 초점을 두고 있다. 레지오 에밀리아 이론을 근거로 어린이 공간을 보다 독립적인 공간으로 인정하고 관계에 초점을 맞춘 어린이 놀이공간으로 제시한다.",어혜진,2011,https://www.riss.kr/link?id=A82688735
현대 사진에 작용하는 ‘반연극성’과 ‘관람’에 대한 마이클 프리드의 논의와 그 비판적 고찰: 작가의 의도(intentionality)와 관람자의 미적 경험 사이의 분리,"마이클 프리드가 1967년 「미술과 오브제성」을 통해 미니멀리스트 작업의 비예술적 특성으로 제시해 논쟁을 일으킨 ‘연극성’ 개념 이후, 그가 현대 사진의 예술적 속성으로 본 개념은 ‘반연극성’이다. 포스트모더니즘의 패러다임을 거친 후에도 그의 연극성/반연극성 개념은 중요하게 다뤄지고 있는데 특히 사진 매체에서 갖는 함의가 적지 않다. 본 논문은 프리드 미학의 핵심이라 할 수 있는 반연극성 개념을 중심으로, 모더니스트 프리드가 포스트모던 사진 작업을 읽는 이론적 입장의 일관성 여부를 검토하며, 여기서 파생되는 유의미한 논의들을 다룬다. 논문의 내용은 다층적으로 구성되는 바, 먼저 프리드의 반연극성을 이해하기 위해 그가 분석한 바르트의 ‘푼크툼’을 경유하여 작가의 의도성과 반연극성 사이의 반작용을 밝힌다. 그리고 두 개념이 현대 사진 작품에서 어떻게 맞물리는가를 추적하고자 토마스 데만트 작업에 대한 프리드의 분석을 검토한다. 데만트 작업은 미니멀리스트 작업과의 공통점에도 불구하고 반연극성을 드러내는데, 본 논문은 이에 대한 논리적 이유를 밝히는 데 주력한다. 그리고 다른 매체와의 비교를 위해 사뮈엘 베케트의 <숨>과 그 미적 연관성을 간략히 논하는데, 이는 사진과 연극이라는 다른 매체를 다루면서 매체에 대한 비판적 거리두기를 위해서다. 끝으로 사진의 매체적 속성을 고려하여 프리드 시각의 전환을 분석하며 그의 이전 시각에서의 확장 가능성을 탐색한다.",전영백,2023,https://www.riss.kr/link?id=A108506676
아파트 외부 보행공간 사인디자인의 색채에 관한 연구,"아파트 외부 보행공간의 다양한 구성요소 중 정보전달의 기능이 있는 사인 디자인이 최근 발전하고 있다. 사인디자인의 색채는 시각적으로 정보를 인지하는데 큰 영향을 끼치기 때문에 이에 대한 연구를 하고자 하는데 다양하고 많은 사람이 생활하는 공간이기 때문에 유니버설디자인 관점에서 접근하고자 한다. 따라서 본 연구에서는 아파트 보행공간 사인디자인의 색채 기준을 유니버설디자인 관점에서 먼셀의 색상, 명도, 채도 평가 분석모형을 색각이상자, 저시력자, 고령자를 대상으로 만들어 현황을 분석하고 개선점을 제시하는 것을 목적으로 한다. 이를 위해 2009년 국내아파트 도급순위 상위 5개 브랜드의 사인디자인 색채평가를 실시하였다. 그 결과 사인디자인의 바탕색, 글자 색상의 색상차, 명도차, 채도차 중 특히 명도차가 가장 두드러진 문제점으로 나타났다. 본 연구를 바탕으로 아파트의 보행공간 사인디자인 색채가 유니버설디자인 관점에서 모든 사람들에게 쉽게 인지될 수 있도록 계획되기를 기대한다.",김경민,2010,https://www.riss.kr/link?id=A82688778
장소 특정적 미술과 현대도예,"역사 초기에 도자는 주어진 환경과 장소에 따라 용도와 형태가 다른 '장소 특정적'인 특성을 가지고 있었다. 예를 들어, 신석기시대 초기 토기의 일종인 빗살토기는 강이나 해변과 같은 모래땅에 살았던 신석기 시대 사람들이 토기를 안정적으로 바닥에 박아 놓고 사용할 수 있도록 밑이 뾰족한 모양을 하고 있었다. 이후 인류의 역사를 통틀어 발달한 모든 도예 양식은 주어진 환경, 장소와 밀접한 관련이 있다. 본 연구의 목적은 다양한 해석적 근거에 따라 현대미술 환경에서 도자와 장소의 관계, 동시대도자의 의미와 가치를 연구함으로써 현대 시각 예술과 문화의 담론으로 도예가 확장되는 경향을 이해하는 것이다. 이를 위해, 장소와 공간에 대한 이론적 이해에 대한 선행연구와 현대도예의 현장 사례에 대한 연구를 수행하였다. 배경 연구가 되는 Ⅱ 장에서는 이-푸 투안의 공간과 장소에 대한 이론을 바탕으로 모더니즘의 공간에서 동시대 미술의 장소성 회복으로의 변화 과정을 설명하고 과 권미원의 『장소 특정적 미술 One Place After Another』에서 기술한 장소 특정적 미술의 특징을 요약하였다. Ⅲ장에서는 점토예술과 동시대 도자예술의 영역에서 장소성에 대한 작업을 활발히 하고 있는 국내외 두 작가 이연숙와 클레어 투미(Clare Twomey)의 최근 프로젝트를 분석하였다. 본 연구는 현대미술과의 교차점을 그리며 발전해 온 도자가 어떻게 영역을 넘어 이 시대의 문화로 확장될 수 있는지를 살펴보는 계기가 될 것이다.",김예성,2021,https://www.riss.kr/link?id=A107928954
낭만주의 미학 연구 -사상적 배경과 미적 특징을 중심으로,"낭만주의는 18세기 말부터 19세기 초에 걸쳐서 계몽주의와 고전주의에 대한 반동으로 일어나 유럽 전역을 풍미했던 문예사조 및 그런 예술 현상에 근거가 되었던 사상적 경향을 지칭한다. 낭만주의는 방법론적으로 볼 때 비합리주의이고 존재론적으로는 일원론의 입장이며 자연관에 있어서는 인간과의 관계를 배제하지 않는 유기론적 시각을 취한다. 그리고 미 학적으로는 고전미 대신 낭만미를 추구한 예술 사조였다고 할 것이다. 낭만주의는 `자연으로 돌아가라`고 외쳤던 루소(J. J. Rousseau)로 부터 직접 촉발되었다고 하겠으나 독일 관념론 철학으로부터의 영향 또한 무시할 수 없다. 그리고 독일 관념론 철학에 막대한 영향을 끼쳤던 신플라톤주의(Neo-Platonism)로부터의 영향도 결코 간과될 수 없다 아울러 일찍이 대립되는 것 없이는 아무 것도 존재할 수 없다는 특유의 대립사상을 전개했던 헤라클레이토스(Herakleitos)로부터의 영향 역시 주목할 만하다. 낭만주의 사상의 핵심인 유기론적 우주관，대립자를 통한 상승의 변증법 등은 모두 이들로부터 받은 영향의 결과이다. 한편, 규칙과 전통에 얽매이지 않고 상상력을 발휘하고 주관적인 미를 창조해내는 것을 참다운 예술로 보았던 낭만주의 예술의 두드러진 특징은 바로 신으로부터의 영감에 의한 작시만이 참 다운 예술이라고 주장했던 플라톤에게서 물려받은 것이다. 따라서 플라톤은 낭만주의의 효시로 간주된다. 대립자를 통하여 오히려 자기 존재의 존립이 공고히 될 수 있다는 낭만주의의 역설적 사유는 문학에서 아이러니(Irony)라는 기법으로 잘 드러난다. 그리고 이성적인 고전미 대신 비합리적 창조 동인에 의거하여 주관적이고 초월적인 미를 구사하고자 했던 낭만주의 미학은 미술에서 숭고미의 강조로 잘 드러난다. 이러한 낭만주의 예술은 한 마디로 상상력을 통한 인간 정신의 초월 가능성을 타진해 보았던 시도라고 할 수 있다.",노영덕 ( Young Deok Roh ),2010,https://www.riss.kr/link?id=A82490385
