
한지를 이용한 조형예술작품 연구,"20세기 현대 예술은 정보화 시대를 맞이하여 무척이나 빠른 속도로 복잡하고 다양하게 변화되고 있으며 이러한 여러 가지 표현양식을 바탕으로 시대에 따라 다양한 재료들이 생겨나고 있다. 이러한 다양한 소재 표현에 맞는 재료들 중에 본 연구자는 우리와 너무나도 친숙하며, 한국의 역사와 같이 살아 온 ``한지``라는 재료가 여러 가지 회화표현의 양식을 바탕으로 다양한 추상세계를 표현하고 현대 추상미술 속에서 전통 재료를 통하여 현대적인 예술과 한국적인 예술로 표현 되고 있다고 생각 되었다. 따라서 우리나라의 생활사와 함께 해온 한지의 역사와 한지의 특성과 장점에 대해 알아보며 한지라는 재료를 정확히 인식하고 한국 전통문화를 되돌아보며 전통적인 방식으로 현대적인 새로운 표현 발상의 방향을 제시하고자 하였다. 연구 방법으로는 한지를 이용한 표현기법들을 설명하고 이러한 한지 표현기법들을 응용한 조형예술 작품들을 알아보며 보다 구체적인 한지의 다양한 조형요소와 시각적 요소로서의 조형예술을 본인의 작품을 통해 분석해 보고자 하였다. 먼저 한지의 표현기법으로는 첫째 지승공예가 있으며 좁고 기다란 한지를 손으로 꼬아 종이끈을 만든 후, 이것을 엮어 공예품을 만드는 방법이 있다. 둘째 지호공예는 한지를 찢어 물에 불린 후, 말풀을 섞어 점토처럼 만들어진 종이죽을 붙여 만드는 방법으로, 주로 그릇이나 가면 등을 만들 때 사용하는 기법이다. 셋째 지화공예는 오색 한지를 여러 겹 접어 다양한 형태로 꽃이나 새 등의 모양을 오려 만드는 것으로 굿을 하거나, 혼례를 치를때 사용하는 장식용 종이꽃 등을 만들 때 썼던 기법이다. 넷째 후지기법은 한지를 여러 겹 붙여 두툼하게 하여 만드는 것으로 지갑이나 장판지 같은 공예품들을 만들 때 사용하는 기법이다. 다섯 번째 장지공예는 한지 공예 중 가장 일반적이라고 할 수있으며, 한지를 여러 겹 붙인 합지나 나무로 만든 틀에 안팎으로 여러 가지 색지를 발라 만드는 방법이다. 그 다음으로 여러 가지 한지 표현기법을 응용한 현대조형 작품을 살펴보았으며 마지막으로 연구자의 한지 기법을 이용한 작품을 살펴보면서 한지를 이용한 조형예술작품 연구를 마무리 하였다. 이상의 연구 결과로 자연친화적 소재인 한지가 현대조형재료로 중요한 역할을 하며 독창적인 조형미를 추구하는데 큰 효과를 볼수 있으리라 사료된다.",정미진 ( Mi Jin Jeung ),2013,https://www.riss.kr/link?id=A100574819
도시재생사업의 국내·외 사례분석을 통한 방향성 제고에 대한 연구,"도시화 및 산업화는 도시로의 인구를 급속히 유입시키면서 많은 도시문제를 야기시켰다. 특히 도시의 외연적 팽창으로 인한 위성도시의 생성은 교통문제와 구도심지의 공동화 현상을 초래시켰으며, 기존 도심기반시설의 노후화와 더불어 구도심의 도시재생 필요성이 대두되었다. 이에 본 연구에서는 도새재생의 이론적 고찰을 통해 도시재생의 개념, 변천과정을 알아보았고, 해외 선진 도시재생사례와 국내 사례를 살펴보았다. 또한 문헌연구를 통해 도시재생의 주요관점을 추출하고 각 사례를 물리·환경적 측면, 사회·문화적 측면, 산업·경제적 측면에서 평가하였다. 평가결과 생활환경을 개선하고, 지역정체성을 확보하여, 도심경제의 활성화를 이루는 것이 도시재생의 중요한 요소인 것으로 파악하였다. 향후 도시재생의 방향은 주민 커뮤니티를 강화하는 도시재생이 되어야하고, 저소득층(원거주민)의 주거안정을 위한 정책적 보완 및 낙후된 중소 지방도시를 위한 도시재생도 고려해야할 것이다.",김준연,2012,https://www.riss.kr/link?id=A99536227
후기모더니즘 미술이론 30년,"현대미술을 포함한 문화 전반을 설명할 수 있는 가장 영향력 있는 단어는 ‘후기모더니즘’일 것이다. 후기모더니즘은 후기구조주의 언어비평에 기초하여 발생하는데, 언어의 구조적 결함을 지적함으로써, 이성, 과학, 진화, 이분법 등의 인식의 허점을 공격했다. 이런 경향은 1950년대 이후 추상표현주의를 탈피한 반, 탈모더니즘적 미술의 등장과 궤를 함께하고, 이때부터 후기모더니즘 미술이 활발하게 진행된다.
후기구조주의 시각을 포함한 철학적 역사적 새로운 이론들을 수용한 후기모더니즘 미술이론이 1976년 『옥토버』의 등장과 함께 수면 위로 부상하자 이론가들은 반-모더니즘 미술을 적극 옹호하면서 구조적 반란이 역사의 당위성을 갖는다고 변론했다.
『옥토버』의 강력한 후원에 힘입어 모더니즘의 중심 논리인 독창성, 아방가르드의 역사의 이질성이 지적되고, 복제와 반복의 의미가 긍정적으로 변모하면서 저자의 의미나 창조의 단계에 대한 전혀 다른 시선이 미술에 침투하게 되었다. 그런데, 『옥토버』 영향을 거친 미술사가나 비평가들이 혼성모방이나 반복을 긍정적으로 평가하는 가운데 후기모더니즘 미술은 점차 상업주의나 보수적 대중의 취향에 상응하기 시작했고, 초기의 언어비판에 기초한 관습과 권력에 대한 저항은 사라지게 되었다.
『옥토버』의 수장이라 할 수 있는 로잘린 크라우스와 유명 편집인들은 모두 이런 현상에 대해 강하게 반발하면서 미술사와 이론의 접점을 모색하는 가운데, 그들이 실은 매우 순수한 미술의 독자성을 강조하는 그린버그의 모더니즘 가치관에서 그리 다르지 않은 학자들임을 알게 해주었다. 이들은 특히 스펙터클과 대중화를 후기모더니즘 미술의 문제점으로 지적하지만, 그것만이 현대미술의 병폐는 아니다. 그들은 오히려 이종과 융합일로를 걷는 미술에서 경계를 강화하여 미술의 독자적 영역을 확보함으로써 과거와 같은 미술이론의 위상을 견고히 하기를 원하고 있는 것이다.
후기모더니즘 이론은 사소하고 비논리적으로 보일 수 있지만 파편화된 반란과 모순의 지적을 통한 전체에 대한, 통일성과 논리성의 허점을 지적하는 움직임이다. 오히려 가장 타당한 흐름은 이런 융합과 이종의 활성화이다. 『옥토버』 이론가들은 분명 모더니즘시기의 미술사와 달리 학문적 방법론, 참고 내용의 확대에 크게 기여했지만 진정한 후기모더니즘적 발상을 받아들이는 데는 어려움이 있었다. 다시 한 번 현실에서의 작고 사소한 탈경계의 예들을 통한 이론의 성숙을 시도해야 한다고 본다.",진휘연(Whuiyeon Jin),2011,https://www.riss.kr/link?id=A82657525
웹툰에 있어서 서사구조에 따른 공간활용에 대한 비교분석,"최근 우리나라 만화 시장은 웹툰의 성장세가 매우 두드러지게 나타나고 있다. 이 가운데 스크롤만화는 웹 툰의 주류 표현 양식으로 자리 잡으면서 독자에게 새로운 시각적 체험을 선사하고 있다. 스크롤 만화는 장대한 세로 칸의 사용과 애니메이션적인 기법의 활용, 혁신적인 칸 나누기, 말풍선과 나레이션의 다양한 배치 등으로 디지털 만화가 가진 ‘무한 캔버스’와 웹페이지의 ‘스크롤바’를 충분히 활용함으로써 출판만화 와는 전혀 다른 디지털 만화만의 새로운 양식을 선보이며 시대를 이끌고 있다. 본 연구는 국내외 웹툰의 서사구조에 따른 다양한 공간 활용에 관한 사례를 다양한 디자인적 관점에서 분석하고 이를 기반으로 웹 툰 기반 컨텐츠들이 가지고 있는 공간 활용의 변화와 웹툰에 대한 새로운 가이드라인을 제시하고자 한다.",김지연,2012,https://www.riss.kr/link?id=A99556815
조선시대 건물 축조과정 중 매납된 도자기에 대한 일고,"본 논문은 최근까지 조사된 조선시대 건물지 유적에서 출토된 도자기 중 구연이 위를 향하도록 정치(正置)되어 단독으로 매납되거나 뚜껑이 얹힌 상태로 매납된 예들의 양상과 특징에 대한 구체적인 규명을 시도한 글이다. 이를 위해 조선시대 건물지 유적에서 구연을 위로 향하도록 정치시켜 매납한 도자기를 진단구 혹은 지진구로 명명하던 기존의 의견 대신, ‘매납 도자기’로 잠정 명명하고, 조선시대 건물 축조과정과 연관 지어 매납된 시기와 의미에 대해 중점을 두어 전개하였다. 매납 도자기가 보고된 서울 종로구, 중구 일대의 발굴결과를 토대로 총 124건의 매납 도자기를 살펴본 결과 분청자와 도기가 차지하는 비율이 압도적이었고, 15세기 층에서는 분청자, 16세기 층에서는 백자, 도기가 주로 사용되었다. 매납 도자기가 출토된 지점은 건물 내부인 경우 적심 주변, 건물 외부인 경우 담장 주변인 경우가 대부분이지만 건물 외부에 매납된 경우에도 건물의 범주에서 크게 벗어나지 않았다. 매납 도자기는 적심의 최상단보다 낮은 지점 혹은 기단의 하부에 위치하는 경우가 대부분이었고, 적심을 비롯한 기초시설의 축조과정과 동일한 시기에 매납되었다. 본 논문에서는 매납 도자기의 용례와 의미에 집중하여 매납 도자기의 출토지점과 레벨수치를 건물의 평면, 측면의 대상으로 파악하였고, 그 결과 대부분의 매납 도자기는 초석이나 월대가 놓일 자리를 지정하는 과정 중에 기초시설과 함께 보토되었고, 건축 통과제의인 개기제, 개공제 혹은 모탕고사가 행해진 시점에 매납되어 건물의 각 공간이 지닌 봉안 대상 즉, 가신에게 건물의 무사 안녕과 복을 바라는 함의를 담고 있으며 특히, 건물의 중심인 대청에 보다 높은 비율로 매납된 배경이 되었을 가능성을 제시하였다. 또한 매납 도자기의 전개와 관련해 온녕군의 묘에서 출토된 분청자와의 비교, 1417년과 1421년의 기록과 부합되는 ‘지역＋관청’명 분청자의 예, 경기도 광주 관요의 설치시기에 대한 접근, 17세기 초의 대동법 시행과 전란 및 사회 내 혼란으로 인해 15~16세기에 이뤄지던 도자기의 매납 행위가 분묘뿐만 아니라 건물에도 분명 영향을 미쳤을 것으로 파악하였다.",오영인,2013,https://www.riss.kr/link?id=A107023286
"팝아트 이후, 현대미술의 소통가능성","1960년대 팝아트가 출현한 이후, 현대미술은 대중문화의 코드와 일상적 사물을 사용하면서, 우리에게 예술과 일상 사이의 거리를 좁히는 경험을 제공하려는 경향이 있다. 특히 소비 사회의 코드로서의 ‘사물’과 산업적 재료로서의 ‘특수한 사물’을 제작하였던, 팝아트와 미니멀리즘은 현대미술에 문화적 기호들을 부여해왔다. 그럼으로써 그 예술들은 오늘날 포스트모더니즘과 관계를 갖는다.
클레멘트 그린버그와 마이클 프리드에 따르면, 팝아트와 미니멀리즘에서의 ‘사물’과 일상적 사물은 비미술의 조건에 해당된다. 그러나 그 미술들에서의 ‘사물’은 고급문화와 대중문화사이의 해체와 같은 포스트모더니즘의 차원에서 관객의 미적경험을 확대하였을 뿐 아니라, 우리의 삶의 문화적 코드들을 예술에 포함시켰다. 무엇보다도 이러한 미적 경험이 문화 비판적 의미에서 현대미술에서의 새로운 소통 가능성을 열어준다는 사실에 대해 주목할 가치가 있다.
프리드가 말한 것처럼, 도날드 저드나 로버트 모리스의 작품들에서와 같은 미니멀리즘의 미적 경험은, 관객에게 일종의 ‘무대 현존성’과 같은 체험을 안겨준다. 이것이 바로 프리드가 ‘미술의 부정’으로 지적한 ‘연극성’이다. 그러나 미니멀리즘이 오늘날 미술작품들을 관객들 사이에서 공유할 수 있는 인터렉티브한 미적 경험 혹은 문화적 담론의 장으로 이끌었던 이정표가 되는 것은 어느 정도 이러한 연극성과 같은 장치 때문이라고 할 수 있다.
보드리야르와 아도르노가 보았던 것처럼, 한편으로 팝아트와 미니멀리즘은 소비사회의 ‘시뮬라크르’이거나 자본주의 사회의 물화된 현상의 지표일 것이다. 그러나 다른 한편, 그 미술들은 작품의 미적 경험을 통해 숨겨진 문화정치학적 의미를 드러낸다. 따라서 포스트아방가르드 시대에 우리는 이러한 미적 경험을 사회와의 ‘비판적 거리두기’를 내포한 소통으로 읽을 수 있다. 즉 사회에 대한 새로운 아방가르드적 저항의 의미로 읽을 수 있을 것이다.
팝아트와 미니멀리즘은 결국 물화된 현대사회를 그것들의 미적 효과인 ‘추상성’을 통해 비판적으로 인식시킨다. 그렇게함으로써, 그 예술들은 현실 자체가 진리가 아닌 가상임을 깨닫게 해준다. 그런 의미에서 이 두 미술은 이 사회의 시뮬라크르이면서 동시에 반-문화의 양가성을 지니는 것으로 해석된다. 특히 미니멀리즘은 현대 미술에서 ‘문화적 소통’의 공간을 가능케 한 것으로 평가받는다. 이 점에서 미니멀리즘은 니콜라스 부리오의 표현으로 말하자면, ‘사회적 틈’을 갖는 것일 것이다. 즉 그것은 우리 사회의 일반적 소통과는 다른, ‘재현적 교역’인, 다른 유형의 소통을 제공한다고 할 수 있다.
팝아트와 미니멀 아트에서 살펴본 것처럼, 현대 미술에서 일상적 사물들의 사용은 대중이 작품을 통해 사회와의 비판적 거리를 취하면서 미술작품의 주체로 참여할 수 있는 기회를 확대하였다. 결과적으로 팝아트 이후 현대미술을 통하여 대중은 예술에 더 가까워지고, 제도-비판적이고 반성적이며 또한 문화적인 장을 열어주는 이러한 예술적 소통의 과정에, 즉 ‘틈’에 참여할 수 있게 되었다고 할 수 있다.",유현주(Yu Hyun-Ju),2011,https://www.riss.kr/link?id=A82625335
공존의 미의식: 이우환의 작품세계,"본 논고에서는 이우환 작가의 작품에 대한 새로운 해석을 위한 시도로서 ‘공존’의 개념에 주목하여 살펴보고자 한다. 이우환은 ‘공존’에 대하여 철저하게 자아와 타자가 존중되며 함께 있는 것이며, 예술가가 타자의 다름을 점유하지 않고 최소한의 행위를 통해 세계를 껴안으려는 시도는 ‘공존’의 이념에 기반을 둔 것이라고 말하고 있다. 이우환의 일련의 작품들인 <관계항>, <점으로부터>, <조응>에서는 이러한 공존의 미의식을 살펴볼 수 있다. 이우환은 작품 <관계항>에서 돌과 유리를 부딪치게 하는 최소한의 신체개입을 통해 각 물체의 특징을 더욱 드러나게 하였으며 만남의 순간적 지각을 유발시켜 작가 혹은 관람자에게 장으로서의 공간에 공존함을 인식하게 한다. 작품 <점으로부터>와 <선으로부터>연작에서는 작가의 반복된 행위로 인한 점과 선들의 차이는 그리기의 과정 즉 시간성을 경험하게 하며, 행위의 결과로서의 점과 선들은 시간과 공간의 공존을 보여준다. <조응> 연작에서는 물감과 캔버스 간의 상이적인 물성으로 인해 그려진 부분과 그려지지 않은 부분이 확연하게 드러나며 이는 관람자로 하여금 그려지지 않은 부분인 여백을 인지하게 한다. 여백은 작가의 최소한의 개입인 한 번의 붓질로 생성된 공간이며, 작가의 이러한 행위는 ‘있는 그대로’의 세계를 제시하는 방식이다. 기존에 이루어졌던 서양의 현대미술작품들과의 비교를 통해 비록 그 표현방식은 공통점을 보이나 작품을 통한 이우환의 메시지는 동양적 미의식에 근거하고 있다는 것을 알 수 있다. 이우환의 공존의 미의식은 타자 즉 자연을 점유하지 않으려는 동양의 자연관, 또는 한국의 전통 윤리관과도 연결된다.",남수진 ( Su Jin Nam ),2015,https://www.riss.kr/link?id=A100768774
"외국의 문화예술교육 프로그램에 대한 분석 연구: 미국, 영국, 핀란드, 일본을 중심으로","문화예술에 대한 깊이 있는 미적 경험은 인간의 삶 뿐만 아니라 사회 전체의 수준과 역량을 높여 나가는데 필수적인 일이다. 최근 10년간 우리나라에서도 문화예술교육을 위한 지원과 정책이 양적으로 활성화되고 있는데, 그 지속성, 체계성, 현장성 등의 질적인 측면에서 이미 오래 전에 시작하여 많이 발전을 이룬 외국의 문화예술교육과 비교해 볼 때 매우 미흡한 실정이다. 따라서 이러한 외국의 문화예술교육 프로그램을 분석해 보는 작업은 그들 프로그램의 내용과 운영방안에 대한 중요한 아이디어를 얻을 수 있고, 그것들보다 더 진취적이고 창의적인 우리만의 문화예술교육프로그램을 생성해낼 수 있다는 점에서 매우 유익하다. 이에 본 연구의 목적은 미국, 영국, 핀란드, 일본의 대표적인 문화예술교육 프로그램에 대한 목적, 내용, 운영방법 등을 분석함으로써 우리나라 문화예술교육 프로그램의 충실성과 선진성을 위한 시사점을 제공하는데 있다. 연구를 통한 시사점은 다음과 같다: (1) 학교와 음악 전문가 및 집단 간의 체계적인 협력 체제의 구축; (2) 국가 음악교육과정에 기초한 프로그램의 기획과 실행; (3) 음악 메디에이터의 역할 규명 및 양성; (4) 통합적 예술교육 교육과정의 개발과 추진.",석문주 ( Moon Joo Seog ),2010,https://www.riss.kr/link?id=A87019863
일제강점기 금관총의 조사와 의의,"일제는 식민 지배의 정당성을 찾기 위해 고적 조사 사업을 실시하면서 한반도의 유적을 비롯하여 경주 지역의 고분을 여러 차례 발굴했다. 그러나 신라 고분은 구조가 복잡했기 때문에 조사는 항상 실패했고, 1920년까지 신라 고분에 대한 이해는 매우 낮았다고 할 수 있다. 그러나 1921년 금관총의 발견은 신라 고분에 대한 인식을 완전히 바꿔놓았고 신라 고분을 집중적으로 조사하게 되는 계기를 제공했다. 금관총의 발견과 조사 과정은 조선총독부의 고적 조사 사업뿐만 아니라 당시 일본 고고학계에도 많은 영향을 주었다. 특히 고적조사과가 발족하였고 금관총 보고서 간행에 참여한 일본인 연구자들은 새로운 경험을 통해 근대적인 고고학 지식을 축척할 수 있었다. 그러나 한편으로 금관총의 발견은 신라 고분을 무분별하게 조사하게 되는 계기를 제공했다. 식민 지배를 정당화할 수 있는 유물에 눈이 먼 제국 관료들의 지원 아래 신라 고분은 처참하게 유물 수집의 대상이 되었다. 금관총은 당시 제도적 장치가 있었음에도 공식적인 발굴 과정을 거치지 않았기에 일본인들에게 문화재 수집에 대한 좋지 않은 태도 또는 의식을 자리 잡게끔 했다. 즉 조사나 기록은 적당히 하고 금관과 같은 유물을 도굴식으로 최대한 많이 수집하고자 하는 그릇된 인식을 형성하는 데 큰 영향을 주었다. 한편 유물의 출토 맥락을 중시하는 전통보다 유물 그 자체를 연구하는 경향도 이즈음부터 아주 강해졌다. 우메하라 스에지의 금관총 유물 조사는 유물 중심의 연구가 일본고고학에 자리 잡는 데 매우 중요한 계기를 제공했다고 볼 수 있다.",김대환,2014,https://www.riss.kr/link?id=A107023287
뜻밖의 위로: 서유럽의 흑사병과 14-16세기 신체적·심리적 고통의 시각화,"14세기 흑사병이 서유럽에 상륙하면서 해당 병증을 드러내며 고통스러워하는 환자들의 모습이 동시대 미술에 등장하기 시작했으며, 특히 15세기 말에서 16세기 초에 다양한 작품이 제작되었다. 이러한 이미지들은 기존 연구에서 감염되었을 당시의 상태나 병증의 치료와 같은 대처 방식을 기록한 의학사적 사료로서만 관심을 받아 왔다. 최근 근세미술사학계에서 활발히 이루어지고 있는 ‘고통 받는 몸’에 대한 일반적 논의를 적용하면, 흑사병의 고통을 시각화한 작품들을 공포감 조성을 통한 윤리적 계도의 수단으로 해석할 여지가 있다. 당대인들이 전염병을 인간의 죄에 대한 신의 형벌로 이해했기 때문이다. 그러나 본 연구는 이 그림들이 감상자들에게 비판적 메시지보다는 위안을 전달하는 ‘뜻밖의 역할’을 수행했음을 고찰한다. 이 그림들은 감염된 자들에게는 자신들의 신체적, 정신적 고통을, 비감염자들에게는 자신들에게도 닥쳐올지 모를 고통에 대한 두려움을 가시화하는 역할을 했다. 이는 일레인 스캐리(Elaine Scarry)가 주장했던 것처럼 고통의 표현불가성으로 인한 외부와의 단절을 “대상화된 형태”로 변환하여 그 괴로움을 일부 경감하는 행위로 이해된다. 또한, 문학치료(bibliotherapy)의 핵심 치유 기제인 “너 혼자만이 겪는 고통이 아니다”라는 공감적 체험을 제공했던 것으로도 해석 가능하다. 아비 바르부르크(Aby Warburg)의 논의를 적용할 경우, 불가해한 고통과 공포를 승화시키고 카오스적인 세계 안에서 정위하려는 서유럽인들의 절박한 노력을 담은 일종의 파토스 형식으로 볼 수 있다. 이 연구는 14-16세기 흑사병 환자들의 고통을 재현한 작품들의 조형 언어와 문화사 및 종교사적 맥락이 실제로 이러한 현대이론의 틀과 서로 공명함을 보여준다. 그리고 이를 통하여 이 그림들이 인간의 고통과 치유에 대한 보편적 속성을 내포하고 있으며, 때문에 그 감상에 있어 ‘뜻밖’이지만 또한 친숙한 위로의 기제가 작동함을 밝힌다.",한유나 ( Yu Na Han ),2023,https://www.riss.kr/link?id=A108654275
`포스트 다큐멘터리` : 예술과 정치 사이에서,"본 논문은 최근 국제 미술계에서 주목받고 있는 사회적 다큐멘터리의 예술적 전회를 다룬다. 이러한 현상을 대표하는 룩 델라헤이, 줄 온디어스, 리처드 모세, 짐 골드버그 등과 같은 사진가들은 객관성과 진실성이라는 사진의 전통적 가치에 얽매이지 않고, 민감한 정치적 주제를 디지털 기술이 제공하는 다양한 미학적 형식으로 재해석한다는 점에서 다큐멘터리의 새로운 지평을 여는 `포스트 다큐멘터리` 작가들로 분류될 수 있을 것이다. 특히 이들의 `미학적` 사진은 디지털의 상호적, 몰입적, 가상적 경험을 통해 관객성의 새로운 지평을 제시하는데, 이는 타인의 재난을 재현하는 것에 대한 다큐멘터리의 오랜 윤리적 고민에 전환적 대안을 제공한다. 즉, 포스트 다큐멘터리는 타인의 재난을 `단지 볼거리`로 만드는것이 아니라, `보다 적극적인 보기의 대상`으로 만드는데, 이는 사진 속의 타자와 보는 관객 사이의 시각적/감성적 연관을 강조하고, 보기를 적극적인 인식행위로 치환함으로써 윤리성을 증대시킨다는 것이 본 논문의 주장이다.
이러한 주장을 뒷받침하기 위해 논자는 미학과 정치학 사이의 근본적인 상관성을 `감각의 분할`이라는 용어로 설명하는 프랑스 철학자 자끄 랑시에르, 그리고 최근 사진 이론에서 보기와 몰입에 의해 매개되는 사진적 관객성의 새로운 지평을 제시한 미국의 이론가 마이클 프리드의 이론을 참조할 것이다. 이 두 이론가는 특히 `사진의 연극적 경험`에 관한 논의(프리드)에서 그리고 `(플라톤적) 관객의 인식론적 해방`에 관한 고찰(랑시에르)에서 이미지 세계에 갇힌 관객의 한계와 가능성을 고찰하고 있는데, 이러한 관객성의 새로운 지평은 포스트 다큐멘터리를 기존의 사진-윤리 담론과 구분짓는 이론적 기반이 된다. 논자는 이러한 주장들을 통해 미학과 정치학, 그리고 나아가 윤리적 영역을 포괄하는 다큐멘터리사진 예술의 진보적 향방을 가늠해 보고자 한다.",최종철 ( Jong-chul Choi ),2017,https://www.riss.kr/link?id=A103260055
