
입원한 기분장애 소아청소년의 임상특성,"본 연구는 소아청소년에서의 우울증 및 조울증의 우울삽화에 대한 임상특성을 알아보고자 하였다.
1993년 3월 1일부터 1999년 10월 31일까지 ○○대학교 어린이 병원 소아청소년 정신과에 입원하였던 34명의 우울증 환아와 17명의 조울증 우울삽화 환아를 대상으로 병록지 기록을 통해서 이들의 사회인구학적 특성, 진단적 분류, 입원시 주 증상 및 문제점, 증상의 빈도, 주산기 모 병력과 아동기 발달력, 공존정신 질환 및 신경 심리학적 검사 가족의 임상적 특성, 가족 정신병리 및 가족 병력, 치료반응등에 대하여 조사하였다.
1) 우울증에서 남자의 비율이 여성의 경우보다 높았으며, 조울증 우울삽화에서는 남녀의 비율이 비슷하였다. 2) 평균 발병 연령은 조울증 우울삽화에서 14.1세, 우울중에서 12.8세로 우울증에서 일찍 발병하는 양상을 나타냈으며, 입원 횟수에 있어서는 조울증 우울삽화에서 우울증에 비해서 많았다. 3) 조울증 우울삽화와 우울증 모두에서 식물증상의 호소가 신체증상보다 많았으며, 자살사고 증상은 우울증에서, 공격적인 증상은 조울증 우울삽화에서 많았고, 정신병적 증상에서는 망상은 우울증에서 환각은 조울증 우울삽화에서 많이 나타났다. 4) 두 집단 모두에서 불안장애가 가장 많이 동반되었으며, 신체형 장애, 정신지체, 인격장애 등이 동반되었다. 5) 조울증 우울삽화와 우울증 모두 높은 가족력을 보였고, 특히 우울증은 아동 학대력과 가족의 부적절한 양육과 관련성을 보였다.
성인에서 조울증과 우울증이 분명한 임상적 차이를 갖고있는 것처럼 소아에서도 조울증 우울삽화와 우울증은 발병연령, 신체증상 및 식물증상을 비롯한 임상증상의 차이, 공존질환 등에서 서로 다른 임상 양상을 나타내었다.
중심 단어 : 주요 우울증ㆍ우울 삽화ㆍ임상 특성.",임명호,2000,https://www.riss.kr/link?id=A60204671
임상 ; 적절한 산전 관리를 받지 않은 임산부와 신생아의 주산기 합병증,"목적: 산전 관리는 임산부와 신생아의 건강 증진을 위해 중요한 것으로 우리 나라의 사회 경제적 여건이 개선 되면서 대부분의 임부가 산전 관리를 받고 있지만 아직도 경기도 일부 지역에서는 적절한 산전 관리를 받지 않은 임산부와 신생아가 있으나 이들에 대한 국내의 보고는 없는 실정이어서 이들의 주산기 합병증에 대하여 조 사하였다. 방법: 2004년 1월부터 2009년 12월까지 고려대학교 부속 안산 병원 신생아 중환자실 및 신생아실에 입원한 신 생아의 어머니 중 산전 관리를 3회 이하로 받은 임산부를 대상으로 하여 후향적으로 의무 기록을 분석하였다. 대상 임산부는 106명, 대상 신생아는 107명으로 재태 연령이 부정확한 경우는 새로운 발라드 법을 이용하여 재 태 기간을 추정하였다. 이들에 대하여 임산부의 분만력과 주산기 합병증을 조사하였고 신생아의 인구역학적 특징과 주산기 합병증, 선천성 기형 및 사망률을 조사하였으며 본원 의료 사회사업팀에서 연계한 의료 지원에 대 하여 알아보았다. 결과: 대상 임산부는 2004년도에 12명이었고 2005년도에 14명, 2006년도에 9명, 2007년도에 15명, 2008 년도에 28명, 2009년도에 28명으로 최근에 적절히 산전 관리를 받지 못하는 임산부와 신생아가 늘어나고 있는 추세를 보였다. 임산부의 주산기 합병증으로는 조산이 35명(33.0%), 빈혈 20명(22.9%), 조기 양막 파수 15 명(17.2%), 융모양막염 14명(16%), 태반 조기 박리 6명(6.8%), 다발성 질벽 열상 6명(6.8%), 전자간증 4명 (4.5%)이 있었다. 신생아의 주산기 합병증으로 미숙아가 44명(41.1%)이었으며 이중 재태 기간 28주 미만의 미 숙아는 7명(6.5%)이었다. 저체중 출생아는 44명(41.1%)으로 극소 저체중 출생아 17명(15.8%), 초극소 저체중 출생아 7명(6.5%)이었다. 대상 신생아 중 재태 연령 34주 미만의 미숙아 26명에 대하여 같은 기간 동안 적절히 산전 관리를 받았던 임산부에게서 출생한 재태 연령 34주 미만의 미숙아 52명을 대조군으로 설정하여 이들의 주산기 합병증에 대하여 비교한 결과, 적절한 산전 관리를 받았던 임산부에게서 태어난 미숙아에 비해 대상 미 숙아들의 호흡곤란 증후군의 발생이 더 많았고(P =0.044), 부당 경량아가 더 많이 태어났으며(P =0.038), 3단계 이상의 뇌출혈 또한 유의하게 더 많이 발생하였다(P =0.040). 또한 선천성 기형아와 사망아의 비율도 높았으며 특히 전전뇌증(holoprosencephaly)이나 Beare-Stevenson 증후군과 같이 생존율이 매우 낮은 기형아의 출생 도 있었다. 대상 환아 중 37명(34.5%)이 입양 기관으로 이송되었고, 1명은 아동보호시설로 퇴원하였으며, 13명 (12.1%)은 보호자의 경제적 사정으로 보건소, 재단, 교우회, 시청 등에서 진료비 지원을 받았다. 결론: 본 연구에서 적절한 산전 관리를 받지 않는 경우 임산부와 신생아의 주산기 합병증의 이환율이 증가하고 임산부의 사회경제적인 여건으로 인하여 사회적 부담도 발생함을 알 수 있었다. 이들은 대부분 저소득층 및 미 성년자와 같은 소외 계층으로 국가에서 운영하는 보건소의 무료 산전 관리 프로그램의 혜택을 받지 못했고 이를 개선하기 위해 야간 및 주말에도 산전 관리 진료를 운영하는 등의 실질적인 국가 정책의 활성화와 소외 계층 에게 정보를 제공하기 위한 홍보 및 교육 프로그램 개발의 필요성이 절실히 요구된다.",최병민 ( Byung Min Choi ),2010,https://www.riss.kr/link?id=A2118086
로봇을 이용한 자궁근종절제술의 유용성: 복강경 그리고 개복수술과 비교,"목적 로봇을 이용한 자궁근종절제술을 복강경하 자궁근종절제술, 개복하 자궁근종절제술과 임상 양상 및 수술 후 경과에 대해 비교하여 보고자 하였다. 연구방법 2007년 1월부터 2011년 3월까지 자궁근종절제술을 시행 받은 환자를 수술방법에 따라 세 군으로 나누어 환자 및 근종의 특성, 수술 중 및 수술 후 경과에 대해 후향적으로 의무기록을 분석하여 비교하였다. 결과 총 206명의 환자 중 로봇을 이용한 자궁근종절제술을 시행한 환자(로봇수술 군)는 31명(15%), 복강경하 자궁근종절제술을 시행한 환자(복강경수술 군)는 70명(34%), 개복하 자궁근종절제술을 시행한 환자(개복수술 군)는 105명(51%)이었다. 로봇수술 군(164.3 ± 193.7 g)에서 제거된 근종의 무게는 개복수술 군(284.7 ± 265.6 g)과 비교했을 때에는 가벼웠지만 복강경수술 군(117.3 ± 132.7 g)에 비해서는 더 무거웠다(P = 0.001). 평균 수술 중 출혈량은 개복수술 군, 로봇수술 군, 복강경수술 군 각각 456.6 ± 288.5 mL, 380.6 ± 303.8 mL, 198.5 ± 137.6 mL로 개복수술 군, 로봇수술 군은 복강경수술 군에 비해 통계적으로 유의하게 출혈량이 많았다(P＜0.001). 평균 수술시간은 로봇수술 군은 272.5 ± 116.8분, 복강경수술 군은 172.1 ± 49.4분, 개복수술 군은 152.3±45.3분이었다(P＜0.001). 로봇수술 군의 평균 재원일수는 4.1±1.4일로 개복수술 군의 5.5 ± 1.3일에 비해 의미 있게 짧았고 복강경수술 군의 3.8 ± 1.0일과는 유의한 차이가 없었다(P＜0.001). 결론 복강경수술 군의 수술 중 출혈량은 다른 두 그룹에 비해 적었으나 제거된 근종 역시도 작았다. 그러나 로봇수술 군은 개복수술 군과 비교했을 때 근종의 크기와 수술 후 경과 면에서 뒤지지 않았다. 본 연구 결과로 미루어 볼 때 로봇을 이용한 자궁근종절제술은 개복수술을 대체할 수 있을 것으로 보이며 개복수술에 비해 로봇수술은 복강경수술의 장점인 미용적 우수성과 짧은 재원기간의 이점도 가지고 있어 거대 근층내 자궁근종을 제거하는 데 유용할 것으로 생각된다.",장민영 ( Min Young Chang ),2011,https://www.riss.kr/link?id=A99588919
주의력결핍/과잉운동장애(ADHD) 아동의 진단도구로서 부모용 행동 평가지의 타당도 연구,"본 연구에서는 현재 주의력-결핍 및 과잉운동장애(Attention Deficit/Hyperactivity Disorder, 이하 ADHD)의 주요한 평가척도 중의 하나로서 이용되고 있는 한국아동인성검사(Korean Personality Inventory for Children, K-PIC)와 아동ㆍ청소년 행동평가척도(Korean Child Behavior Checklist K-CBCL)의 임상적 타당도에 대해 살펴보고자 하였다.
피검자들은 ADHD의 하위 유형 중 주의력-결핍 우세형(ADHD-I)으로 진단된 환아 11명과 과잉 행동-충동 우세형 및 복합형(ADHD-H)로 진단된 환아 23명, 우울, 불안 등 정서적 문제로 진단(신경증 집단 ; N) 받은 정신과 외래 환아 16명, 정상아동 15명 등 총 65명이었다. 먼저 각 집단별로 분산분석을 실시하였고, 각각 행동 평정 척도의 변별력을 측정하기 위하여 판별분석을 실시하였다.
이 집단들의 K-PIC와 K-CBCL 결과들에 대한 전체(omnibus) F-검증 결과, K-PIC의 과잉행동(HPR) 척도와 K-CBCL의 주의집중문제(Attention Problems, 이하 AP) 척도들은 분산분석결과 유의한 차이를 보였다. 하지만 사후검증 결과, ADHD-I 집단과 ADHD-H 집단 그리고 신경증 집단 사이에 유의한 차이를 보이지 않는 반면, 그 세 집단은 모두 정상집단과 .05 유의도 수준 하에서 유의한 차이를 나타내었다. 이러한 결과는 K-PIC의 과잉행동(HPR) 척도와 K-CBCL의 주의집중문제(Attention Problems) 척도의 경우, 기본적으로 임상군과 정상군을 구별하는데는 유용하지만 임상군내에서의 세부 진단을 위해 사용하는 데는 한계가 있음을 시사해준다. 또한 본 연구 결과 상대적으로 HPR 척도는 ADHD-H type을 감별하는 데 더 유용한 반면, K-CBCL의 AP 척도는 ADHD-I type을 감별하는 데 더 큰 강점을 갖는 것으로 보이나, HPR 척도와 AP 척도 중 어느 하나만을 사용하는 것보다는 병행하여 사용하는 것이 더 바람직한 것으로 보인다. 특히 cut-off score면에서 두 척도 중 어느 하나에서 T점수 65점 이상 상승할 때 ADHD로 진단내리는 경우, 가장 효과적으로 정분류율(true positive rate : sensitivity)과 정배제율(true negative rate : specificity)을 조화시킬 수 있는 결정규칙이 되는 것으로 나타났다.
중심 단어 : 주의력결핍/과잉운동장애 한국아동인성검사ㆍ아동ㆍ청소년 행동평가척도.",김지혜,2000,https://www.riss.kr/link?id=A99588929
품행장애 청소년의 음악치료 사례연구,"요 약 : 이 사례는 1998년 6월부터 9월까지 주 1회 30분씩 서울국립정신병원에 입원한 품행장애 청소년들을 대상으로 한 음악치료 사례로, 그룹 음악치료에 참여한 환아들 중 가장 지속적으로 참여한 두명의 여자 환아(A, B)에 초점을 맞추었다. 음악치료 세션은 다음과 갈이 3부분으로 나누어진다 ; 시작할 때 부르는 인사노래, 다양한 음악적 활동, 그리고 마칠 때 하는 소리내기와 움직이기 주로 사용되었던 음악치료 기술들로는 자유로운 즉흥연주, 노래 토론, 음악 모노드라마, 그리고 소리내기와 움직이기를 들 수 있다. 자유로운 즉흥연주는 환아들의 감정과 생각을 강화시키고, 동기유발을 하며, 연주를 통해 상징적으로 자신을 볼 수 있게 하기 위해 사용되었다 노래 토론은 그들의 생각을 담아내고 지지하기 위해 사용되었다 음악 모노드라마는 그들이 가지고 있는 대인 관계적 문제에 대한 통찰력을 갖게 하기 위해 사용되었다. 소리내기와 움직이기는 그들에게 결여되어 있는 자발성을 강화하기 위해 사용되었고 이를 통해 자신들의 신체와 목소리를 표현적 도구로 탐색하게끔 만들었다 음악치료를 하는 3개월 동안 환아 A는 그룹에서 대화 기술, 사회성 그리고 행동적인 측면에서 향상을 보였다. 그녀는 음악을 상징적으로 사용할 수 있게 되었고 자신과 자신의 가족에 대한 느낌을 그룹과 공유할 수 있게 되었다. 환아 B는 자기표현 능력이 향상되었다. 그녀는 보다 더 자발적으로 그룹에서 자신의 감정에 대해 말을 할 수 있게 되었다. 비언어적이고 비위협적인 수단으로서 음악은 두 여자 환아들에게 그들이 자신을 표현하기 위해 필요한 신뢰감을 다시 회복할 수 있는 환경을 제공한 것으로 보인다.",권혜경,2000,https://www.riss.kr/link?id=A75129860
"현성 요실금이 한국 중,노년 여성의 성기능에 미치는 영향","목적 본 연구는 현성 요실금이 한국 중 · 노년 여성의 성기능에 미치는 영향을 평가하기 위함이었다. 연구방법 2009년 5월부터 2010년 1월까지 서울대학교 헬스케어시스템 강남센터를 방문한 만 40세 이상 여성 건강검진 수진자 중 성적으로 활발하고 본 연구에 동의한 773명을 대상으로, 병력청취(Beck`s Depression Inventory 설문 포함), 신체검진, 혈액검사, Pelvic Floor Distress Inventory-20 (PFDI-20) 및 Female Sexual Function Index (FSFI) 설문조사를 시행하였다. 현성 요실금은 PFDI-16 또는 17 문항에 ``예``라고 답하고 ``약간 이상의 성가심``이 있다고 답한 경우로 정의하였고, 성기능장애는 FSFI 총점이 26.55점 이하인 경우로 정의하였다 결과 설문에 응한 총 773명의 여성 중 318명(41.14%)에서 현성 요실금이 있었다. 현성 요실금이 있는 군은 그렇지 않은 군에 비해 성기능장애의 빈도가 유의하게 높았다(62.26% vs. 49.45%, P＜0.05). 다중선형회귀분석 결과 현성 요실금은 나이, 폐경 여부, 경제력, 흡연 유무, 확장기혈압, 우울증과 더불어 FSFI 총점에 유의한 영향을 미치는 인자로서 나타났다(standardized β = -0.108, P＜0.05). 임상적 위험인자들을 보정한 FSFI 총점 평균은 현성 요실금이 있는 군에서 그렇지 않은 군에 비해 유의하게 낮았으며(24.59 vs. 25.74, P＜0.05), 각 영역별 점수 역시 윤활액분비(4.70 vs. 4.84, P = 0.056)를 제외한 나머지 영역, 성욕(2.88 vs. 3.05), 성적흥분(3.75 vs. 3.96), 오르가즘(4.11 vs. 4.36), 성적만족도(4.15 vs. 4.33), 성교통(4.99 vs. 5.20)에서 모두 유의하게 낮았다(P＜0.05). 결론 한국 중 · 노년 여성에 있어서 현성 요실금은 성기능에 영향을 미치는 중요한 위험인자이며, 요실금 치료 후 성기능이 개선되는지에 대한 후속 연구가 필요하다.",김지현 ( Jee Hyun Kim ),2011,https://www.riss.kr/link?id=A82688035
청소년기 여학생에서 빈혈 및 철분 영양 상태,"목 적 : 빈혈은 아직도 전세계적으로 가장 흔히 볼 수 있는 영양결핍으로 특히 청소년기 여아에 많이 발생하는데, 그 원인은 철분의 불충분한 섭취, 빠른 성장에 따른 철분 필요량 증가 및 월경으로 인한 혈액 손실을 들 수 있다. 본 연구는 건강하게 보이는 중학생 및 고교의 여학생에 있어서 지난 10년간에 걸친 빈혈 및 철분에 관한 영양상태의 발표를 종합하였다. 방 법: 1990년 대구지역에서 도시와 농촌의 여학생에 대해, 1997년 부천지역 여학생에 대해, 1999년 울산지역에서 도시와 농촌지역 여학생에 대해, 2000년 인천에서 도시와 농촌의 여학생에 대해 혈액학적 조사와 신체 계측 그리고 설문지를 통한 조사가 이루어졌다. 빈혈은 혈색소 11.5 g/dL 미만으로 정의하였다. 철 결핍은 혈청 ferritin이 10 ng/mL 미만인 경우로 정의하였고, IDA는 혈색소가 최저 기준치 이하이면서 MCV 78 fL 미만, ferritin 10 ng/mL 미만, 또는 transferrin 포화도 10% 미만인 경우로 정의하였다. 결 과 : 1) 도시와 농촌간의 혈색소 평균치에는 유의할 만한 차이가 없었고, 연령이 증가함에 따라 평균 혈색소의 감소를 볼 수 있었다. 2) 전체적인 빈혈의 유병율은 1990년 13.4%, 1997년 6.9%, 1999년 6.0%, 2000년 5.7%로 감소하는 소견을 보이고 있고, 각각의 조사에서는 연령이 증가함에 따라 유병율도 증가하였다. 특히 여고생에서의 빈혈의 유병율은 1997년 10.1%, 2000년 12.6%로 높게 나타났다. 3) 철 결핍 유병율은 1990년 36.1%에 비해 1997년과 1999년은 13.9%, 13.3%로 감소하는 소견을 보이나 2000년 연구에서는 23.2%로 증가되었다. 4) 연도별 IDA의 유병율은 1990년에는 10.0%, 1997년 4.6%, 1999년 8.3%, 2000년 6.1%로 일정 하지는 않으나 감소하는 소견을 보이고 있고, 연령이 증가하면서 유병율이 증가하는 것을 볼 수 있다. 결 론 : 중, 고교 여학생에 있어서 10년 전에 비하여 철분 영양은 개선되었지만, 농촌과 도시에 관계없이 빈혈 및 철 결핍이 빈발하였고, 청소년기 연령이 올라갈수록 더욱 현저하였다. 더욱이 최근의 다이어트 풍조와 영양섭취의 불균형을 고려할 때, 다른 영양소의 부족 역시 우려할만한 것으로 사료된다. 따라서 중학교 3학년 이상의 여학생과 빈혈의 위험군에 대해서는 선별검사가 요구되며, 아울러 지속적이며 효과적인 영양 교육과 철분지표와 영양지식에 대한 평가가 필요할 것으로 사료된다.",조주래,2002,https://www.riss.kr/link?id=A105616820
청소년에서 자녀가 지각한 부모 양육태도와 문제 행동의 연관성,"역기능적인 부모―자녀 관계는 청소년의 다양한 정신 및 행동 장애와 연관되어 있을 뿐 아니라 성인에서의 여러 정신 병리와도 밀접한 연관성을 가지고 있다. 역기능적인 부모―자녀 관계와 그 관계가 정신적 및 신체적 문제에 미치는 영향에 대한 연구는 대부분 임상 집단에서 이루어 졌으나 지역사회 중심의 일반 집단을 대상으로 한 연구는 거의 없어 본 연구에서는 청소년들이 지각한 부모의 양육태도와 청소년 문제 행동과의 연관성을 문제 행동군으로 나누어 비교하여 살펴보고자 하였다. 서울 소재 남자 고등학생 중 정신건강 문제가 없었고 양친과 함께 살고 있는 147명을 대상으로 한국판 부모―자녀 결합행태 척도와 문제 행동척도 점수를 나타내는 한국판 Youth Self Report를 이용하여 청소년이 지각하는 부모의 양육태도와 청소년의 문제행동을 평가하였다. 문제 행동 척도 점수로 나누어 본 문제 행동군과 정상 행동군을 비교한 결과 어머니의 과보호 정도가 문제 행동군에서 높았으며, 어머니의 과보호는 남자 청소년의 문제행동과 유의한 상관이 있었다. 청소년이 지각한 부모의 양육태도를 알아봄으로 청소년기에 문제행동을 유발할 수 있는 문제 행동군을 예측하는데 도움이 될 수 있으며, 적절한 부모의 양육태도로 다양한 청소년기 문제행동이 예방될 수 있음이 시사된다.",문유선,2001,https://www.riss.kr/link?id=A3014099
복강경하 자궁경부 자궁근종절제술: 단일 기관에서의 5년간의 경험,"목적: 복강경수술이 발전하면서 자궁근종의 치료에 있어 복강경 접근의 범위가 넓어지고 있다. 그러나 자궁경부에 위치한 근종에 대한 복강경 수술은 아직 쉽지 않다고 알려져 있다. 이 연구는 자궁경부에 위치한 자궁근종의 복강경수술에 대한 연구이다. 연구방법: 본원에서 시행된 자궁경부근종의 복강경수술 총 65예에 대해 의무기록 분석을 통하여 후향적으로 시행되었다. 결과: 총 65명의 환자가 포함되었고, 수술의 이유는 자궁근종 크기의 증가가 가장 많았다. 수술 시간은 평균 63분이 걸렸으며 수술 시 자궁근종의 최대 직경의 평균은 72 mm였고, 개복수술로 전환된 경우는 없었다. 결론: 자궁경부에 위치한 근종에 대한 복강경적 접근은 안전하며 효율적으로 시행될 수 있는 것으로 보인다.",이수윤 ( Soo Yoon Lee ),2012,https://www.riss.kr/link?id=A82491853
건강한 고령 초산모에서 산모 연령이 임신결과에 미치는 영향,"목적: 고령 초산모의 임신과 출산에 있어서 연령이 임신결과에 어떠한 영향을 미치는지 알아보고자 하였다. 방법: 2001년 1월부터 2008년 12월까지 본원에서 임신 21주 이후 분만한 산모 중 초산모를 대상으로 하였으며, 연령 이외에 산과적 예후에 영향을 줄 수 있는 요인을 최소화 하고자 심혈관계 기저질환이 없고, 임신 중 고혈압 질환이나 현성 및 임신성 당뇨와 같은 위험인자가 없는 건강한 초산모만으로 연구대상을 제한하였다. 이들 중 35세 이상인 산모 235명을 연구군으로 하였으며, 20세에서 34세까지의 산모 1571명을 대조군으로 하여 임상적 특징 및 산과적 예후를 후향적으로 분석하였다. 결과: 제태연령이나 출생체중은 두 군간에 유의한 차이가 없었다. 연구군에서 제왕절개의 빈도가 의미있게 높았으며(60.4% vs 39.4%, P=0.000), 제왕절개의 적응증 중 기왕 자궁수술력이 있었던 경우, 전치태반인 경우의 빈도가 연구군에서 유의하게 높았다(3.0% vs 0.2%, P=0.000, 9.4% vs 5.2%, P=0.011). 신생아 합병증에는 두 군간에 유의한 차이가 없었으며, 산전합병증은 전치태반, 자궁근종의 빈도가 연구군에서 유의하게 높게 나타났으며(6.0% vs 2.8%, P=0.010, 4.7% vs 1.2%, P=0.000), 산후합병증은 수술부위 감염의 빈도가 연구군에서 높게 나타났다(1.7% vs 0.3%, P=0.005). 결론: 심혈관계 기저질환이 없고, 임신 중 고혈압 질환이나 현성 및 임신성 당뇨와 같은 위험인자가 없는 건강한 고령 초산모에서 전치태반의 빈도 및 제왕절개의 빈도는 유의하게 증가하나 신생아 합병증은 대조군과 유의한 차이가 없었다. 산전 및 산후 합병증 중 전치태반, 자궁근종, 수술부위 감염은 유의하게 증가하였으나 조기진통, 조기양막파수, 산후출혈 등에는 유의한 차이를 보이지 않았다. 이에 고령의 초산모에서 단지 산모의 연령이 고령인 것이 산과적으로 고위험 요소는 아니며, 모든 고령 산모를 고위험 산모로 간주하는 것은 타당하지 않다고 사료된다.",김태은 ( Tae Eun Kim ),2009,https://www.riss.kr/link?id=A100133914
"시험불안과 우울, 특성불안 및 상태불안과의 상호관계에 관한 연구","시험불안은 전세계적으로 학령기 아동 또는 청소년들이 공통적으로 경험하는 불안이라고 할 수 있다. 경우에 따라서는 어느 정도의 시험불안은 학습을 촉진시키기도 하지만 대부분의 경우에 학습을 저해시키는 요인으로 작용한다. 지난 수십년동안 시험불안의 요인이나 특성에 대하여 많은 연구들이 있어왔으나 단편적이며, 시험불안의 정확한 특성이나 원인에 대하여 아직 밝혀져 있지 않은 상태이다. 이에 본 연구에서는 시험불안의 특성을 규명하기 위하여 시험불안과 상태-특성불안, 우울증과의 상호관련성에 관하여 알아보았다.
서울시내 한 고등학교 학생들을 대상으로 하여 시험불안, 우울증, 상태-특성불안 간의 상호관계에 대하여 신뢰도와 타당도가 입증된 평가도구를 시용하여 상관성을 검증하였다.
시험불안과 우울증과의 상관성은 상관계수 0.56(p<0.05), 특성불안과의 상관성은 상관계수 0.53(p<0.05), 상태불안과의 상관성은 상관계수 0.75(p<0.05)로서 모두 의미있는 상관관계를 보여주었다.
이상의 결과로 미루어 시험불안은 단순한 시험불안이 아니라 우울증, 상태불안, 또는 특성불안과 밀접한 관계가 있다고 할 수 있다. 따라서 시험불안에 대한 치료적인 대책을 수립할 때에는 이러한 요인들이 고려되어야 한다.",조수철,2001,https://www.riss.kr/link?id=A108639603
