
타바타 운동과 케틀벨 운동이 성인 여성의 폐활량과 골격근량 및 지구력에 미치는 효과,"Purpose : The purpose of this study was to compare the effects of Tabata exercise and Kettle bell exercise on vital capacity, skeletal muscle mass, and endurance in women.
Methods : Twenty subjects participated in this study. They were divided into two group: a Tabata exercise group (n=10) and a kettle bell exercise group (n=10). Both groups performed their assigned exercise 3 times a weeks for 6 weeks.
Result : There were statistically significant differences in FVC, FEV1, FEV1/FVC, PEF, and VC (p<.05) between the Tabata exercise group and the kettle bell exercise group. There were also statistically significant differences in skeletal muscle mass and endurance function (p<.05) between the two groups. The Tabata exercise group demonstrated greater improvements in fitness parameters compared to those demonstrated by the kettle bell exercise group.
Conclusion : The Tabata exercise group was more effective at increasing vital capacity, skeletal muscle mass, and endurance compared to the kettle bell exercise group.",양회송 ( Yang Hoesong ),2017,https://www.riss.kr/link?id=A104572671
"경상남도 웰니스관광의 염증면역지표, 자율신경균형, 정서, 피로, 스트레스, 삶의 질 및 수면의 질 개선에 미치는 단기효과","Purpose : Recently, there has been a growing social interest in aging well. Consequently, wellness tourism has begun to attract attention. However, no studies on whether wellness tourism has any objective health benefits have been carried out yet. In this study, we assess the health benefits as well as the degree of improvement in health of a wellness tourism program.
Methods : The study involved 30 adults over the age of 19 who live in the Gyeongsangnam-do region. Participants were evaluated on health indicator before and after participating in wellness tourism program. Participants took heart rate variability (HRV) test, and LFT, RFT, CBC, FBS HbA1C, and CRP test were conducted before and after the tour. Additionally, a survey was conducted before and after the program, and participant satisfaction was evaluated. Statistical differences in the tests conducted before and after the program were analyzed using a design t-test, a Wilcoxon signed-rank test, and McNemar’s test.
Results : The study showed that participants were very satisfied with and had significant health improvements after the wellness tourism program. The program was also found to be beneficial in improving participants' emotions as follows: BDI (p<.001), fatigue recovery (p=.006), stress relief (p=.003), improved quality of life (p<.05), and improved sleep quality (p<.001).
Conclusion : Wellness tourism programs are specifically beneficial for improving participants' emotions (depression, anxiety), fatigue, stress levels, quality of life, and sleep. Therefore, they are beneficial to the overall health. Further research in the future by way of a follow-up study on the long-term effects on health after short-term interventions will provide more validation data.",이새롬 ( Sae-rom Lee ),2021,https://www.riss.kr/link?id=A107833088
폐머리카락을 이용한 중금속의 흡착특성에 관한 연구,"The current study conducted experiments for property analysis regarding heavy metal absorption, iodine adsorption and porosity using waste hair as a reclamation method of waste hair. The study also observed pore distribution of hair using a Scanning Electron Microscope(SEM) and examined the possibility of removing heavy metal from hair. That is, the purpose of the current study is to evaluate environmental risk and economical efficiency by comparing hair with other biomass resources, activated carbon, etc. heavy metal removal efficiency was analyzed wrule heavy metal concentration 10 ppm, time variables were 5min, 15min, 30min, 60min and 120min, temperature was 20 .C, and pH 3",홍승목,2008,https://www.riss.kr/link?id=A82692314
"흉추 가동성 운동프로그램이 만성 요통 환자의 통증 및 심박 변이도, 우울증에 미치는 영향","Purpose : This study aimed to investigate the effects of a thoracic flexibility exercise program on pain, heart rate variability (HRV), and depression in patients with chronic low back pain.
Methods : Fifty patients with chronic low back pain participated in this study. Each participant performed a pre-test and post-test. The outcome measures evaluated were a visual analog scale, HRV test results (automatic activity, standard deviation normal to normal [SDNN], low frequency [LF], high frequency [HF], and LF/HF ratio), and the Beck Depression Inventory. Patients underwent conventional physiotherapy for 35 minutes per session. In addition, a thoracic flexibility exercise program (trunk rotation exercise, McKenzie exercise, and supine thoracic extension exercise) were performed 3 times per week for 4 weeks.
Results : After the training period, the visual analog scale results showed a significant decrease in the post-test compared to the pre-test. Automatic activity, SDNN, LF, HF, and LF/HF ratio significantly increased in the post-test compared to the pre-test. The Beck depression inventory results significantly decreased in the post-test compared to the pre-test.
Conclusion : This study demonstrated that a thoracic flexibility exercise program improves a visual analog scale, HRV (automatic activity, SDNN, LF, HF, and LF/HF ratio), and the Beck Depression Inventory in patients with chronic low back pain.",박동환,2019,https://www.riss.kr/link?id=A106480597
균형과 보행분석을 위한 스마트 인솔의 신뢰도와 타당도 분석,"Purpose: The Pedisole is a newly developed shoe-mounted wearable assessment system for analyzing balance and gait. This study aimed to determine the reliability and validity of the parameters provided by the system for static balance and gait analysis of healthy adults.
Methods: This study included 38 healthy adults (22.4±1.9 years) with no history of injury in the lower limbs. All participants were asked to perform balance and gait tasks for undertaking measurements. For analysis of balance, both the smart Pedisole and Pedoscan systems were concurrently used to analyze the path length of the center of pressure (COP) and the weight ratio of the left and right for 10 s. Gait was measured using the smart Pedisole and GaitRite walkway systems simultaneously. The participants walked at a self-selected preferred gait speed. The cadence, stance time, swing time, and step time were used to analyze gait characteristics. Using the paired t-test, the intra-class coefficient correlation (ICC) was calculated for reliability. The Spearman correlation was used to assess the validity of the measurements. In total, data for balance from 36 participants and the gait profiles of 37 participants were evaluated.
Results: There were significant differences between the COP path lengths (p<.050) derived from the two systems, and a significant correlation was found for COP path length (r=.382~.523) for static balance. The ICC for COP path length and weight ratio was found to be greater than .687, indicating moderate agreement in balance parameters. The ICC of gait parameters was found to be greater than .697 except for stance time, and there was significant correlation (r=.678~.922) with the GaitRite system.
Conclusion: The newly developed smart insole-type Pedisole system and the related application are useful, reliable, and valid tools for balance and gait analysis compared to the gold standard Pedoscan and the GaitRite systems in healthy individuals.",이병권 ( Byoung-kwon Lee ),2021,https://www.riss.kr/link?id=A107927720
"저항성 운동이 여성 노인의 신체조성, 체력, 혈중지질 및 인슐린에 미치는 영향","Purpose : This study aimed to investigate the effects of 12 weeks of resistance exercise on body composition, physical strength, blood lipids, and insulin.
Methods : The study was conducted on 24 elderly women divided into two groups: 12 subjects in an exercise group and 12 subjects in a control group. Resistance exercise was performed for 50 minutes a day, three times a week, for the duration of 12 weeks, and body composition, physical strength, blood lipids, and insulin were measured before and after the subjects completed the program. For the statistical analysis, the mean and standard deviation (M±SD) of each variable were calculated using SPSS version 20, and a paired t-test and two-way repeated ANOVA were conducted to test for the differences before and after the resistance exercise. All significant levels were set to α=.05 as a result of the experiment.
Results : Changes in body composition after the 12-week resistance exercise program did not show any significant difference based on the comparison between the groups, but when noting the values for body fat percentage and body in the control group before and after, a significant difference was shown in fat mass (p<.05). As for changes in physical fitness, significant differences appeared in flexibility, muscle strength, and stenotic force (p<.01) when the groups were compared. Regarding pre- and post-values within each group concerning flexibility within the exercise group, significant differences were shown in gender (p<.001), muscle strength (p<.05), (p<.01), muscle earth strength, equilibrium (p<.01), stenosis force, and cardiopulmonary earth force (p<.001). Also, comparisons between populations in changes in blood lipids the values before and after in each group, significant differences in glucose (p<.05) and insulin (p<.05) were shown in the exercise group. When comparing the values before and after in each population, a significant difference was shown in the control group (p<.05).
Conclusion : When all the results were integrated, the 12-week resistance exercise program was found to enhance physical strength (flexibility, muscle strength, and coordination) and improve the blood sugar levels of elderly women. In particular, resistance exercise is believed to lower the prevalence of obesity, type 2 diabetes mellitus, and metabolic diseases by having a positive effect on insulin. Further studies are suggested to verify the effect on body composition and blood lipids by setting up a variety of exercise treatment methods (including subjects, exercise periods, exercise plans, and exercise intensity focuses).",김원경,2022,https://www.riss.kr/link?id=A108247442
노인의 신체건강 관련 요인 조사 : 근감소증과 운동기능저하증후군을 중심으로,"Purpose : This study was conducted to investigate and analyze the physical health of older Koreans with sarcopenia and locomotive syndrome and identify the related factors.
Methods : In this study, the sarcopenia and locomotive syndrome evaluations were applied to 210 elderly people, and the sarcopenia group was 36, the locomotive syndrome group was 164, and the normal group was 10. After group selection, a physical health status survey was conducted. The physical health status was assessed via body composition analysis, physical characteristics survey including measurement of waist and calf circumference, investigation of diseases currently being diagnosed by a doctor, and frailty measurements. The collected data were statistically analyzed using one-way ANOVA, the Kruskal-Wallis test, and the Chi-square test.
Results : There were significant differences between groups in all elements of physical characteristics including body mass index, waist circumference, and calf circumference. Among them, a consistent result was found that the normal group had the largest amount of muscle mass and the sarcopenia group had the least amount of muscle mass in the factors related to muscle mass. However, the factors relating to fat mass and obesity also showed significant differences between the groups, but the results were not consistent. Considering the group differences in current diseases, a significant difference was only detected for osteoporosis among 12 diseases. Moreover, those in the sarcopenia group had the highest rate of osteoporosis. And there was no significant difference between the groups in the total score of the frailty measurement, but there was a significant difference between the groups in the frailty measurement levels.
Conclusion : This study on physical health status confirmed that muscle mass-related factors, osteoporosis, and frailty levels were significantly related to sarcopenia and locomotive syndrome.",김해인,2023,https://www.riss.kr/link?id=A108601091
스마트폰 애플리케이션을 이용한 골반바닥근육 운동이 배 근육 두께와 최대 자발적 환기량에 미치는 영향,"Purpose : This study was conducted to determine the effect of intervention using a smartphone application on abdominal muscle thickness and maximum voluntary ventilation when conducting pelvic floor muscle exercise (PFME).
Methods : This study was performed on 14 subjects. They were divided into two groups; PFME using smartphone application (n=7), common PFME (n=13). Both of group executed the exercise 5 times a week for 1 weeks. Abdominal muscle thickness was measured using ultrasound. Maximum voluntary ventilation was measured using a spirometer. The smartphone application used the paid version of Kegel trainer. This material was analyzed by the paired t-test to compare differences on each group and the independent t-test to compare between the two groups.
Results : The PFME group using the smartphone application showed a significant increase in the transverse abdominis and internal oblique muscles (p<.05). The common PFME group showed a significant increase in the internal oblique muscle (p<.05). There was no significant difference in variation of the muscle thickness between the two groups (p>.05). The PFME group using the smartphone application showed a significant increase in the maximal voluntary ventilation (p<.05). There was no significant difference in variation of the maximal voluntary ventilation between the two groups (p>.05).
Conclusion : As a results of this study, PFME using a smartphone application seems to induce voluntary participation of subjects and maintain continuity against time constraints. As a result, it is thought that using a smartphone application when performing PFME is efficient and convenient in terms of research method. However, this study is difficult to generalize due to the small number of subjects and short intervention period. Therefore, additional research should be conducted by modifying and supplementing these limitations.",박한규,2023,https://www.riss.kr/link?id=A108728552
인공지능(AI)을 이용한 디지털 운동중재가 성인의 신체능력에 미치는 영향,"Purpose : Along with the rapid development of digital technology, the application of digital healthcare in the medical field is also increasing. According to many experts, increasing the amount of exercise and physical activity is a helpful way to prevent and manage physical problems in modern society. However, a lack of exercise, which is of the lifestyle of modern people, leads to the development of various diseases. This study aimed to examine the effects of digital exercise intervention using artificial intelligence (AI) on the physical abilities of adults whether digital exercise intervention can be a reliable and effective therapeutic option for musculoskeletal disorders in real-world clinical settings.
Methods : In this study, exercise was conducted using a digital application to investigate the effects of an AI-based digital exercise intervention on the physical abilities of adults. A total of 13 adults were evaluated, and their physical abilities before and after the exercise intervention were compared. Hand-grip strength, functional leg muscle strength, dynamic balance, and quadriceps muscle strength were assessed. Exercise was performed using a digital application and in a non-face-to-face manner. AI identified the exercise status of each participant and adjusted the exercise difficulty level accordingly. The exercised daily for 4 weeks.
Results : A total of 12 participants were analyzed for the final results. Significant improvements were observed in hand-grip strength, functional leg muscle strength (evaluated using the stand-up test), dynamic balance, and straight-gait ability (p<.05), indicating an increase in the overall muscular strength and physical function of the participants.
Conclusions : Digital exercise intervention using AI is effective in improving physical abilities related to musculoskeletal function. It can be useful in clinical practice as an effective treatment option for patients with musculoskeletal disorders or muscle weakness.",문소라,2023,https://www.riss.kr/link?id=A108601110
당뇨병 환자의 삶의 질(EQ-5D)에 미치는 영향 요인 : 2019년도 제2기 한국 의료패널 조사를 중심으로,"Purpose : The purpose of this study was to determine factors that affect the quality of life (QoL) of people with diabetes. We hope to provide a basis for intervention strategies for health promotion and related research among patients with diabetes in the field of physical therapy.
Methods : We selected individuals diagnosed with diabetes who were aged 19 years or higher by using data from the 2019 Korean Health Panel survey and analyzed the results of 1,527 people. The influencing factors were sex, age, household income, marital status, age, education level, subjective health status, body mass index (BMI), smoking, drinking, regular exercise, experience of depression and anxiety, suicidal thoughts, stress, and frequency of walking (days/week). Frequency analysis, descriptive statistics, independent sample t-test, one-way analysis of variance, and multiple regression analysis were performed.
Results : The EQ-5D score for QoL was .87 ± .12, with pain and discomfort being the most detrimental to the QoL of people with diabetes. In terms of patients characteristics, the QoL was lower among participants who were female, older, and separated/widowed/divorced; had an education level below middle school; had a poor subjective health status; were non-smokers and drinkers; and did not walk and exercise regularly, experienced a lot of stress, and experienced depression and anxiety; and had suicidal thoughts (p<.001). Being separated/bereaved/divorced; experiencing a lot of stress, depression, and anxiety; and having suicidal thoughts were negatively associated with QoL in people with diabetes (p<.01). On the other hand, age of 65 years or younger; graduation from high school, fair or better subjective health, regular exercise and alcohol consumption, and walking (days/week) were positively associated with QoL (p<.05).
Conclusion : Regarding the QoL of patients with diabetes, intervention strategies should be formulated by considering general characteristics and disease-related characteristics. Among the various factors affecting QoL, the number of walking and regular exercise were found to be the factors that improved the QoL of patients with diabetes. These results can be used as a basis for the education and management of patients with diabetes in the field of physical therapy.",김소현,2023,https://www.riss.kr/link?id=A108728560
소비자 특성별 PHR을 이용한 평생건강관리서비스 이용행태: 소비자 수요도 조사,"Objective: This study was conducted to investigate public opinion regarding personal health management service using Personal Health Record (PHR) in Korea. Specifically, the relationships between consumer's demographic characteristics, need for health information, consumer's benefit and concern, type of health information, type of management and security of patient information using PHR and attitude to PHR were explored. Methods: A survey was conducted, using questionnaire developed by the study team based on literature review. Structured questionnaires were completed through a telephone survey for 715 consumers. Results: A key finding was the significant difference for customer's attitude towards using PHR by customer's characteristics. Regarding factors affecting attitudes of customers with higher concern about their health, considering authorization level to access their private information and using reliable method to certificate were more likely to prefer PHR system positively. Conclusion: Public opinion is reflected in policy of health information. Meeting consumers' needs sufficiently, the goal of health information service to improve consumers' accessibility to and satisfaction will archive successfully",김진현,2008,https://www.riss.kr/link?id=A101593561
12주간의 수중운동이 뇌성마비 청소년의 견관절 등속성 근기능에 미치는 영향,"Purpose: The present study investigated the effects of 12-week aquatic exercise training on isokinetic muscle function of the shoulder in adolescents with cerebral palsy.
Methods: The study included four male and four female adolescents with cerebral palsy. Isokinetic muscle function was measured at an angular velocity of 60°/s, using Biodex System VI Pro. The peak torques of internal rotation and external rotation were measured before and after training. Aquatic exercise training was performed once a day for 120 min, 4 times a week for 12 weeks.
Results: The peak torque of external rotation according to body weight and mean power of internal rotation were significantly higher after training (p < 0.05).
Conclusion: Our findings suggest that 12-week aquatic training for adolescents with cerebral palsy can improve isokinetic muscle function of the shoulder. Future studies should analyze the changes in isokinetic muscle function of the shoulder in more detail using various aquatic exercise programs to investigate their effects on individuals with cerebral palsy.",홍성균,2019,https://www.riss.kr/link?id=A101593030
Task-ambient 공조세스템의 온열환경 및 에너지 절약성에 관한 실험적 연구,"Generally, the proportion of energy consumption in office building is approximately 3094 for air-conditioning and 30% for lighting. Therefore, reduction of energy related air-conditioning is the point of energy saving in building. However, because reduction of energy for air-conditioning is closely concerned occupant s health and pleasantness, the design of improving the second side on air-conditioning is the best plan to satisfy energy saving and pleasantness in the room. In addition to, change of temperature set up is the simplest energy saving method. Take notice of this point, we proposed task-ambient air-conditioning system as a new concept of personal air-conditioning system in office building, and actually made it and quantitatively investigated it s thermal environment and efficiency of energy saving through experimentation on this study.",이정재,2001,https://www.riss.kr/link?id=A106363516
어깨관절벌림 각도에 따른 어깨주변 근육들의 참여 비율에 대한 연구,"Purpose: The purpose of this study was to determine the muscle activity ratio according to the shoulder abduction angle by identifying the mean muscle activities and calculating the muscle ratios for use in developing strengthening methods.
Methods: The participants were healthy adults in their 20s (n=19). The activity of the deltoid middle, upper trapezius, middle trapezius, and lower trapezius muscles was measured by 8-channel surface electromyography. Muscle activity was measured during 4 conditions of angle of shoulder abduction: 30°, 60°, 90°, and 120°. The data used in the analysis were the root mean square and % total muscle activity values.
Results: The root mean square values for the deltoid middle, upper trapezius, middle trapezius, and lower trapezius muscles showed significant differences. No significant differences were detected in the % total muscle activity of the deltoid middle, upper trapezius, middle trapezius, or lower trapezius muscles.
Conclusion: Future studies aimed at developing selective shoulder abductor muscle strengthening methods are likely to provide more effective results by using muscle activity ratios.",박민철 ( Park Minchull ),2017,https://www.riss.kr/link?id=A40012741
Monitoring of Pyrethroid Resistance Allele Frequency in the Common Bed Bug (Cimex lectularius) in the Republic of Korea,"Two-point mutations (V419L and L925I) on the voltage-sensitive sodium channel of bed bugs (Cimex lectularius) are known to confer pyrethroid resistance. To determine the status of pyrethroid resistance in bed bugs in Korea, resistance allele frequencies of bed bug strains collected from several US military installations in Korea and Mokpo, Jeollanam-do, from 2009-2019 were monitored using a quantitative sequencing. Most bed bugs were determined to have both of the point mutations except a few specimens, collected in 2009, 2012 and 2014, having only a single point mutation (L925I). No susceptible allele was observed in any of the bed bugs examined, suggesting that pyrethroid resistance in bed bug populations in Korea has reached a serious level. Large scale monitoring is required to increase our knowledge on the distribution and prevalence of pyrethroid resistance in bed bug populations in Korea. Based on present study, it is urgent to restrict the use of pyrethroids and to introduce effective alternative insecticides. A nation-wide monitoring program to determine the pyrethroid resistance level in bed bugs and to select alternative insecticides should be implemented.",조수지,2020,https://www.riss.kr/link?id=A103330369
