
소아 기능성 변비의 치료에 영향을 미치는 인자,"목 적: 소아에서 기능성 변비는 흔히 볼 수 있는 질환이지만 임상적 경과 및 치료 반응에 대한 대단위 연구가 없는 실정이다. 이 질환의 임상적 특징과 치료에 영향을 미치는 인자들을 알아보고자 본 연구를 시행하였다. 방 법: 1998년 1월부터 2007년 12월까지 부산대학교 병원 소아과에서 변비로 치료를 받았던 500명 중 Iowa 기준에 따라 기능성 변비로 1개월 이상 치료를 받고 경과관찰이 가능하였던 240명의 환자를 대상으로 후향적조사를 하였다. 변비의 주 치료제로 락툴로스를 복용한 군(145명)과 PEG (polyethylene glycol)를 복용한 군(95명)으로 나누었다. 환자에 따라 magnesium hydroxide, psyllium, bisacodyl, domperidone, 고장성 인산염 관장액등을 병용하였다. 치료 반응은 약물 투여 후 이틀에 1회 이상 통증이 없이 배변을 하는 시점으로 하였고, 치료 반응이 3개월 이상 유지되면 약물을 감량하였다. 결 과: 1) 남자 142명(59.2%), 여자 98명(40.8%)이었고, 발병 시 연령은 18.7${\pm}$21.5개월, 진단 시 연령은 51.2${\pm}$37.9개월이었다. 발병 시 연령은 1세 이하가 94명(39.2%)으로 가장 많았다. 2) 증상 지속 기간은 32.6${\pm}$33.7개월, 치료 전 배변 빈도는 1회/4.8일이었다. 3) 동반 증상은 유분증 91명(30.4%), 복통 76명(31.6%), 혈변37명(15.4%), 식욕저하 23명(9.6%), 복부팽만 18명(7.5%), 구토 14명(5.8%)이었다. 4) 배변 빈도가 락툴로스 투여군 1회/4.6일로 PEG 투여군 1회/5.2일에 비해 짧았던 것을 제외하고 두 군 간에 차이는 없었다. 5) 치료 반응은 여자에서(p<0.001), 동반증상이 있었을 때(p<0.05), PEG 투여군에서(p=0.001) 의미 있게 빨랐으며, 치료 전 증상 지속 기간이 길수록(p<0.05), 배변 빈도가 적을수록(p<0.05) 늦었다. 6) 총 치료 기간은 성별, 증상 발생 나이, 증상 지속 기간, 배변 빈도, 동반 증상, 유분증 유무, 타병원에서의 치료, 민간 요법 시행, 치료 약물의 종류와 무관하였다. 7) 7명(락툴로스군 6명, PEG군 1명)에서 치료 후 재발이 있었으나, 2명을 제외하고 재치료로 완치되었다. 결 론: 여자, 치료 전 증상 지속 기간 및 배변 빈도가 치료 반응에 중요한 인자였고, PEG가 락툴로스에 비해 치료 반응 시간이 짧았기 때문에 1차 치료 약제로 고려해 볼 수 있겠다. 총 치료 기간에 영향을 미치는 요인은 없었으나, 조기 치료가 치료 반응 및 치료 기간을 단축할 수 있으리라 판단된다.",김형석,2010,https://www.riss.kr/link?id=A76521058
계란 알레르기 환아에서 오리알과 거위알에 대한 교차반응,"목적 : 계란은 어린아이들에게서 흔히 알레르기를 유발하는 식품으로 알려져 왔다. 이에 계란 알레르기를 가지고 있는 환아에게서 조류의 다른 알들(거위, 오리, 메추라기)에 대한 알레르기 반응 여부를 조사하여 종간의 차이를 확인하고 대체 여부를 가늠하고자 한다. 방법 : 2002년 9월부터 2003년 6월까지 연세대학교 의과대학 소아 알레르기 클리닉에 내원하여 병력상 계란 알레르기가 의심되는 환아를 대상으로 피부 시험 및 계란에 대한 특이 IgE를 측정하여",김정훈 ( Kim Jeong Hun ),2003,https://www.riss.kr/link?id=A101971558
소아에서의 요로결석: 단일기관에서 22년간의 경험,"목적: 소아 요로결석은 흔하지 않은 질환이나 신장에 치명적인 손상을 야기할 수 있다. 성인 요로결석의 경우 많은 수의 문헌 보고들이 있으나, 소아에서는 대규모의 연구들이 아직 부족한 실정이다. 이에 저자들은 22년간 3차 의료기관에서 22년간 경험한 소아 요로결석 환아들을 분석하였다. 방법: 1991년 1월부터 2013년 5월까지 서울아산병원 소아청소년과, 소아비뇨기과에서 요로결석으로 진단된 환아들을 대상으로 후향적으로 의무 기록을 분석하였다. 진단 시 연령, 성별, 임상 증상, 가족력, 동반 질환, 요로결석의 위치, 결석 성분 분석, 원인 및 치료 방법, 재발 등을 조사하였다. 결과: 137례(남:여=96:41)에서 연구가 이루어졌다. 연령 분포는 생후 5일경 진단받은 경우부터 17세까지로 1세 미만이 43례(31%)로 가장 많았고 그 중 16례(37%)에서 중환자실 치료의 과거력이 있었다. 요로결석의 가족력은 13명(9.5%)의 환자에서 보였다. 진단 당시 주증상으로는 육안적 혈뇨가 56명(41%)으로 가장 많았으며 측복부 동통 또는 복통이 46명(34%)이었다. 요로결석의 위치는 신석 82례(62%), 요관석 30례(22%), 방광석 2례(1.4%) 였으며, 20례(15%)에서는 다발성으로 있었다. 요 저류를 일으킬 수 있는 구조적인 원인이 동반된 경우는 모두 26례(19%) 이었으며, 대사 검사는 91례(66%)에서 시행하여 38%(35/91)에서 이상을 발견하였고, 요로감염은 26례(19%) 에서 발견되었다. 요로결석 성분검사는 35례에서 가능하였으며 칼슘석이 20례(20/35,57%)로 가장 많았으며, 감염석 5례(5/37,14%), 요산석 4례(4/35,11%), 탄산염 인회석 3례(3/35,7%), 시스틴석 2례(2/35,6%), 인산염석 1례 순이었다. 개방 수술적 치료가 5례(4%)에서 시행되었으며 77례(56%)에서 보존적 치료를 시행하였고, 나머지 55례(40%)에서는 1가지 이상의 비개방적 치료를 시행하였다. 총 18례(13%)에서 요로결석이 재발하였다. 결론: 소아 요로결석은 흔히 비뇨 생식기계의 구조적 이상, 대사 이상, 요로감염과 연관되어 발생하며, 두가지 이상의 원인을 함께 동반하기도 하고, 특발성으로 발생하기도 한다. 따라서 이들을 배제하기 위한 검사들이 시행되어야 한다. 또한 소아 요로결석은 절반에서 자연배출이 되며, 최근 20년 들어 기구와 술기가 발전하여 최소 침습적 치료들이 가능하다. 소아 요로결석은 재발율이 높으므로 장기간의 추적관찰이 필요하며 잔류 요로결석이 완전히 사라지는 것을 확인하는 것이 중요하다.",김수연,2013,https://www.riss.kr/link?id=A100682288
지속적인 청색증에 노출된 선천성 심장병에서 수술 후 Cardiac Troponin I의 농도 변화,"목 적 : 오랫동안 청색증에 노출된 선천성 심장병인 경우 심근의 지속적인 저산소증은 수술 전후로 심근에 영향을 미칠 것으로 기대되는데 최근 소아에서의 cardiac specific protein인 cTpn-I에 대한 연구가 활발하여 조금이나마 예측이 가능하게 되었다. 본 연구에서는 청색증을 보이는 심장질환의 경우 수술 전후의 심근 손상과 수술 경과를 cTpn-I를 중심으로 살펴보고자 하였다. 방 법 : 2001년 3월 1일부터 2001년 6월 30일까지 부천세종병원 소아과에서 활로씨 4징 혹은 우심실 양대혈관 기시의 진단을 받고 흉부외과에서 완전교정술을 받은 25명의 환자를 대상으로 하였다. 대조군으로 같은 기간에 심실중격수술을 받은 10명의 환아들(D군)과 대상 환아들을 수술 전 산소 포화도에 따라 A군(>90%) B군(80-90%), 그리고 C군(<80%)으로 나누었다. 각 군별로 수술 전 혈색소, 수술 연령 및 체중과 수술 기록지를 통해 수술 중 경과를 고찰하였고 수술 후의 경과를 관찰함과 동시에 cTpn-I 및CK-MB의 혈중농도와 산소 포화도를 수술 전, 수술 후 24시간 그리고 수술 후 72시간째에 측정하였다. 결 과: 25명의 대상 환아들은 대조군인 A군이 6명, B군이 12명, C군이 7명 그리고 D군이 10명으로 구성되었다. 수술 전 혈색소의 농도는 A군이 $12.9{\pm}1.3g/dL$, B군 $13.8{\pm}1.8 g/dL$, C군은 $17.0{\pm}4.1 g/dL$ 그리고 D군은 $12.1{\pm}0.9 g/dL$로 각 군간의 유의한 차이가 있었으나(P=0.01) 각 군간의 수술 나이와 수술 당시의 체중은 통계적으로 유의한 차이가 없었다. 수술 전 cTpn-I의 농도는 A군이 $0.23{\pm}0.12 ng/mL$, B군이 $0.25{\pm}0.12ng/mL$, C군이 $0.26{\pm}0.13ng/mL$ 그리고 D군이 $0.24{\pm}0.08ng/mL$로 통계적으로 유의하지는 않았으나 청색증이 심할수록 cTpn-I 농도가 높은 경향을 보였다. 대상군들의 수술 당시 CPB time과 ACC time 그리고 수술 후 인공호흡기 유지시간과 중환자실 입원기간은 대조군과는 큰 차이를 보였으나 대상군 사이에서는 유의한 차이가 없었다. 수술 후 24시간째의 cTpn-I 의 농도는 A, B, C, D 군이 각각 $10.04{\pm}5.28 ng/mL$, $12.50{\pm}6.86 ng/mL$, $12.55{\pm}9.90 ng/mL$, $3.35{\pm}2.93 ng/mL$ 대상군에서 대조군 보다 높게 나타났으며 대상군내에서도 C군에서 가장 높게 나타났다. 수술 후 72시간째의 cTpn-I의 농도는 환자군인 A, B, C군에서 각각 $1.58{\pm}0.80 ng/mL$, $2.92{\pm}1.36 ng/mL$, $4.96{\pm}3.14ng/mL$로 대조군의 $0.83{\pm}0.58ng/mL$과 비교해도 유의하게 높았고 환자군 내에서도 수술 전 산소 포화도에 따라 의미 있는 차이가 있었다(P=0.000). 또한 수술 후 72시간째의 cTpn-I의 농도는 수술 후 24시간째의 그것과 통계적으로 유의한 상관관계를 보였다(P=0.001). 수술전이나 수술 후 24시간, 72시간째의 CK-MB 농도는 각 군간에 유의한 차이를 발견할 수 없었다. 결 론: 수술 전의 지속적인 청색증은 수술 후의 cTpn-I의 농도를 높일 수 있으며 특히 수술 후 72시간째의 농도가 높아짐으로 수술 후 심근 회복에 영향을 끼칠 수 있다.",송진영,2002,https://www.riss.kr/link?id=A107730633
고체온으로 경련이 유발된 경우 경련의 양상과 쥐 해마부의 Neuronal Nitric Oxide Synthase 발현,"목 적 : 고체온에 의하여 유발된 반복성 열성경련에서 경련의 양상과 해마부의 nNOS 발현을 비교관찰하고 열성경련과 nNOS의 관계를 알아보기 위하여 연구를 시행하였다. 방 법 : 생후 20일된 Spraque-Dowley rat을 이용하여 1주일에 2회씩 4주간 모두 8회 온수에 노출시켜 고체온에 의한 반복적인 열성경련을 유발하였다. 실험에 이용된 쥐는 모두 82마리로서 이중 52마리는 실험군으로서 항온조에서 4분간 $45^{\circ}C$ 정도의 온수에 노출시켰고, 30마리는 대조군으로서 4분간 $37^{\circ}C$에 노출시켰다. 입수 후 경련이 발생할 때까지를 잠복기로 정하였고, 경련의 첫 증상으로서 근간대성 경련이 보이고 난 후 의식을 회복하여 정상적인 활동을 보이는 시점까지를 경련 지속시간으로 정하였다. 대조군과 고체온에 노출될 때마다 경련을 보였던 hyperthermic seizure group 및 경련이 전혀 발생하지 않았던 hyperthermic non-seizure group 간의 nNOS 발현을 관찰하기 위하여 western blot을 시행하였다. 결 과 : 고체온에 노출되었던 쥐의 87%에서 전신성 강직-간대 발작을 보였고, 고체온 노출횟수에 따른 경련 발생률은 통계적으로 유의성이 없었다(P>0.05). 입수 후 경련이 나타날 때까지의 잠복기는 158에서 240초였고 평균 204초였으며, 고체온 노출횟수에 따른 잠복기는 통계적으로 유의하지 않았다(P>0.05). 경련 지속시간은 12에서 145초였고 평균 55초로 측정되었으며, 고체온 노출에 따른 경련 지속시간은 통계적으로 유의하게 나타났다(P<0.05). 결과적으로 고체 온 노출횟수가 증가할수록 경련 지속시간은 의미있게 증가하였으나 경련 발생률 및 잠복기는 차이가 없었다. 쥐 해마부에서 nNOS 단백질의 발현을 조사하기 위하여 대조군의 해마부, 대뇌피질 및 소뇌, hyperthermic non-seizure group 및 hyperthermic seizure group의 해마부와 대뇌 피질을 대상으로 하여 western blot을 한 결과 대뇌 피질에서는 각 그룹간에 nNOS 발현에 변화가 없었으나 각 그룹의 해마부에서의 nNOS 단백질 발현은 대조군에 비하여 hyperthermic non-seizure group과 hyperthermic seizure group에서 약하게 나타났고, 이 두 군간에는 차이가 없었다. 결 론 : 고체온에 의한 반복성 열성경련에서 nNOS 는 경련유발에 영향을 주지 않을 것으로 추정되며 앞으로 열성경련에 의한 해마부의 형태학적인 변화와 함께 많은 연구가 병행되어야 할 것으로 생각된다.",김두권,2002,https://www.riss.kr/link?id=A108204565
노인의 작업수행에 대한 인간작업모델(Model of Human Occupation)의 적용 - 사례연구 -,"본 연구는 노인을 대상으로 인간작업모델을 적용하여 작업수행의 문제점과 흥미, 중요도 등을 파악하여 적절한 중재를 하여 노인의 작업수행 유지와 향상을 위한 효과적인 중재방법을 제시하고자 한다. 65세 이상 노인에게 인간작업모델에 기초한 자가작업평가, 의지평가, 작업설문지, 여가활동 평가를 실시하여 작업수행력을 파악하였다. 이를 바탕으로 작업 치료적 중재를 실시하였다. 연구결과 자가작업평가 결과 능력 점수가 52점에서 60점으로 가치 점수가 47점에서 54점으로 향상 되었다. 노인에게 인간작업모델을 적용하는 것은 대상자를 보다 전인적으로 종합적으로 판단할 수 있는 근거가 되며, 대상자를 보는 관점을 변화시켜 대상자가 원하는 다양한 치료방법을 제시하여 클라이언트의 참여도와 만족도를 증가시키며 작업치료서비스의 전문성과 질을 향상시킬 것이다.",임경민 ( Kyung Min Lim ),2013,https://www.riss.kr/link?id=A101490200
단계적인 주의 집중력 훈련이 경증치매노인의 기억력과 일상생활수행능력에 미치는 효과,"본 연구는 경증치매노인을 대상으로 전산화 인지프로그램을 이용한 단계적 주의 집중력 훈련이 치매노인의 기억력과 일상생활수행능력에 미치는 효과에 대해 알아보고자 하였다. 본 연구는 4명의 경증치매노인을 대상으로 개별실험연구 방법 중 기준 변동설계(Changing Criterion Design)를 사용하였다. 독립변인은 전산화 인지프로그램(레하컴) 중 주의 집중력 프로그램을 대상자의 인지 수준에 따라 단계를 조절한 것으로 주 4회 매 회기 15분씩 총 16회 각 대상자별로 실시되었다. 종속변인은 기억력(숫자외우기와 Rey복합 도형 검사)과 일상생활수행능력(AMPS)의 변화였다. 단계적 주의 집중력 훈련 결과, 매 회기가 진행될수록 대상자 모두 주의 집중력이 향상되었고 기억력 및 일상생활수행능력이 증가된 양상을 나타냈다. 단계화된 전산화 인지프로그램은 사용이 쉽고 개별 수준에 따른 맞춤치료가 가능하다는 장점을 지니고 있어 치료에 대한 동기 부여와 치료효과에 대한 일반화가 어려운 치매노인에게 적합한 중재방법임을 확인할 수 있었다. 따라서 앞으로는 경증치매 노인뿐만 아니라 인지손상 환자를 대상으로 단계화된 전산화 인지 프로그램에 대한 다각적 연구들이 이루어져야 할 것이다.",손지형 ( Ji Hyung Shon ),2013,https://www.riss.kr/link?id=A108702458
