
수술후 조기 운동이 부종 감소에 미치는 영향에 대한 실험적 연구,"Edema is an inevitable outcome in any kinds of operative procedure and such edema is an important factor in determining postoperative prognosis or complication. Presently, there are numerous efforts in trying to reduce these postoperative edema. Early postoperative exercise has been proposed to reduce edema, however is exact role or clinical significance has yet to be verified.
Here, the author induced edema in the extremity of rabbit by severing all the tissue except bone & neurovascular bundle and repairing them. Such rabbits were divided into exercise group and joint immobilization group and consequently they were compared for their increases in circumference and volume due to edema. Also tissue samples were obtained on postoperative day 7 and observed for their histological difference under microscope.
Results were as follows.
1) From postoperative day 1 to 3 there was no significant difference of edema in two groups, however joint immobilizaton group showed slightly lesser edema.
2) In exercise group edema continuously increased until a peak was reached on postoperative day 3 which from this point on edema decreased slowly, however in immobilization group the peak was reached on postoperative day 5 and from then on it failed to decrease and continued up to postoperative day 7.
3) From postoperative day 4 immobilization group showed significant edema as compared to exercise group and with the passing time this significance continued to increase.
4) In the histological examination on postoperative day 7, more inflammatory cells were infiltrated and more degenerative findings were observed in joint immobilization group than exercise group.
In conclusion, early postoperative exercise decreases edema beginning from postoperative day 4, but without exercise edema increases up to postoperative day 5 and continues to maintain edema until postoperative day 7.",김양우,1996,https://www.riss.kr/link?id=A2013540
Salvage of Infected Breast Implants,"Background Implant-based breast reconstruction is being performed more frequently, and implants are associated with an increased risk of infection. We reviewed the clinical features of cases of implant infection and investigated the risk factors for breast device salvage failure. Methods We retrospectively analyzed 771 patients who underwent implant-based breast reconstruction between January 2010 and December 2016. Age, body mass index, chemotherapy history, radiation exposure, and smoking history were assessed as potential risk factors for postoperative infection. We also evaluated the presence and onset of infection symptoms, wound culture pathogens, and other complications, including seroma, hematoma, and mastectomy skin necrosis. Additionally, we examined the mastectomy type, the use of acellular dermal matrix, the presence of an underlying disease such as hypertension or diabetes, and axillary node dissection. Results The total infection rate was 4.99% (58 of 1,163 cases) and the total salvage rate was 58.6% (34 of 58). The postoperative duration to closed suction drain removal was significantly different between the cellulitis and implant removal groups. Staphylococcus aureus infection was most frequently found, with methicillin resistance in 37.5% of the cases of explantation. Explantation after infection was performed more often in patients who had undergone 2-stage expander/implant reconstruction than in those who had undergone direct-to-implant reconstruction. Conclusions Preventing infection is essential in implant-based breast reconstruction. The high salvage rate argues against early implant removal. However, when infection is due to methicillin-resistant S. aureus and the patient's clinical symptoms do not improve, surgeons should consider implant removal.","Song, Joon Ho",2017,https://www.riss.kr/link?id=A2013153
하악각축소술시 절제된 골의 간치이식을 이용한 턱끝증대술,"The square face or the box face appearance is quite common in orientals as well as occidentals and consists of flaring at the mandible angle areas with exaggerated posterior inferior projection of the mandibular angle in combination with a small and weak chin, resulting in widened bigonial distance and shortened lower third of face. Such patients complain of unbalanced and masculine appearance and may regard themselves as unaesthetic. To correct these deformities simultaneously, the mandible angles were resected (angled osteotamy) and the bone fragment from these ostectomized mandibular angles were used to augment the chin as an autogenous interpositional bone graft.
At the Institute of Plastic and Reconstruction Craniofacial Surgery(IPRCS), Ice University Collage of Medicine, twenty eight cases were successfully operated in this manner during a six-year period from June 1989 to May 1995. Patient's satisfaction was high and improved esthetics were noted in all patients with minimal complications.
The advantages are:
l. Simultaneous correction of prominent mandible angle and augmentation of the deficient chin area.
2. Provides vertical elongation of the chin and lower face, which gives visual compensation for agittal weakness of the lower face.
3. Improves upper and lower facial balance.
4. Another donor site for bone is not necessary, thus avoiding unnecessary donor site morbidity.
5. Homogenous autologous bone is used thus reducing the chance of resorption.
6. Minimal chance of infection.",이태일,1997,https://www.riss.kr/link?id=A105316327
절골술을 이용한 미용 목적의 턱 성형술,"The most important factor in facial aesthetics is the harmony on the facial skeleton and soft tissue. Although the mandible constitute lower one third of the facial skeleton, minimal alterations can produce a wide range of facial deformities because of its prominent location and the intimate interrelationships of the facial bone. There are several deformities such as prominent mandibular angles, prognathism, microgenia, and asymmetry that are regarded as poor facial aesthetics.
We carried out a retrospective review of the 56 mandibular contouring surgery, which were performed in the period from January 1988 to January 1995 in Guro hospital. The age range was 18 to 42 years and female was approximately 2 times more frequent than male. The types of the mandibular deformities included 24 prominent mandibular angles, 9 prognathisms, 8 microgenias, 5 asymmetries, and 10 deformities with combinations of aforementioned problems and midfacial deformities.
To plan the mandibular contouring, photographs with planimetry, cephalogram, and panoramic view of the mandible were obtained. 24 prominent mandibular angles were contoured through intraoral approach. Angle ostectomy was performed in conjunction with malar reduction, for correction of prominent malar eminences, in 3 cases. Angle ostectomy was performed in conjunction with sliding advancement genioplasty, for correction of microgenia, in 4 cases. 9 prognathisms were corrected with vertical ramus osteotomy. 8 microgenias were corrected with sliding advancement genioplasty. Among these, 3 cases were performed in conjunction with bone graft due to their severity. 5 asymmetries were corrected by genioplasty and bone graft.
The results were evaluated based on the consideration of the deformity by means of radiology, photography, and interview with the patients. In prominent mandibular angles, most patients were pleased with the results. In prognathisms, the mean horizontal changes of hard and soft pogonion were 9.3 mm and 8.5 mm, respectively. The soft tissue response to bone adjustment was approximately 1 : 0.91. In microgenias, the mean horizontal changes of hard and soft pogonion were 8.8 mm and 6.5 mm, respectively. The soft tissue response to bone adjustment was approximately 1 : 0.75. One case showed infection in mandibular angle ostectomy group which was solved with intraoral incision and drainage, and antibiotics. In microgenias, 1 partial mental nerve damage nerve damage was encountered but it was recovered spontaneously after 3 months. In a case of combination angle ostectomy with sliding genioplasty, prolonged lower lip edema remained for 1 month. We concluded that osteotomy for mandibular contouring procedure was a safe, reliable, and simple procedure due to development of operative techniques and tools.",김우경,1997,https://www.riss.kr/link?id=A2014230
고압산소요법이 피부이식에 미치는 영향에 관한 임상적 연구,"Skin grafting is one of the most commonly used procedures in the plastic surgical field. However, skin flaps are preferred to skin grafts because hyperpigmentation, contraction, and creases develop more frequently in skin grafts. Nevertheless, skin grafting should be performed when the defects are multiple and extensive as in burns, or are adjacent to major anatomical structures. In these cases, full thickness skin grafts attached to subcutaneous fat may be used to overcome above disadvantages of skin grafts and to replace skin flaps.
In this study, postoperative hyperbaric oxygen therapies were used to improve survivals of these composite grafts during the plasmatic imbibition period. Experimental cases were randomly selected by the blind method. Full thickness skin grafts containing adequate amount of subcutaneous fat or cartilage were used to improve the quality of the grafted skin Postoperatively, the patient was placed in the hyperbaric chamber of 2.5ATA 100% oxygen for 60minutes, twice a day and 10 times overall. Rate was estimated on 7th postoperative day by gross findings.
Authors concluded that this combined hyperbaric oxygen therapy could extend the donor site including the abdomen and increases the survival rate of skin grafts.",민경원,1992,https://www.riss.kr/link?id=A2014272
Unusual Bilateral Impalement Injury with Rusted Iron Bars on Face and Neck,"Impalement injury is the subset of penetrating trauma, defined as fixed, elongated objects penetrate and remain in the human body cavity or region by relatively low velocity.
We report an unusual case of facial and neck impalement where two dirty rusted iron bars penetrated forehead bilaterally and exited neck and ear respectively without causing major organ injuries. After thorough radiologic and physical evaluation, the patient got medical and surgical treatment. The patient was discharged without complication after four day of delayed wound closure. There have been no complications and sequelaes related with trauma, wound infection and scar contracture at 3-year follow-up.
According to affected organs and pattern of impalement, individualized and multidisciplinary surgical approach should be considered. Following these guidelines as in this case, it was possible to achieve excellent clinical outcome in impalement injury.",서현석,2015,https://www.riss.kr/link?id=A2012712
The utility of three-dimensional models in complex microsurgical reconstruction,"Background Three-dimensional (3D) model printing improves visualization of anatomical structures in space compared to two-dimensional (2D) data and creates an exact model of the surgical site that can be used for reference during surgery. There is limited evidence on the effects of using 3D models in microsurgical reconstruction on improving clinical outcomes.
Methods A retrospective review of patients undergoing reconstructive breast microsurgery procedures from 2017 to 2019 who received computed tomography angiography (CTA) scans only or with 3D models for preoperative surgical planning were performed. Preoperative decision- making to undergo a deep inferior epigastric perforator (DIEP) versus muscle-sparing transverse rectus abdominis myocutaneous (MS-TRAM) flap, as well as whether the decision changed during flap harvest and postoperative complications were tracked based on the preoperative imaging used. In addition, we describe three example cases showing direct application of 3D mold as an accurate model to guide intraoperative dissection in complex microsurgical reconstruction.
Results Fifty-eight abdominal-based breast free-flaps performed using conventional CTA were compared with a matched cohort of 58 breast free-flaps performed with 3D model print.
There was no flap loss in either group. There was a significant reduction in flap harvest time with use of 3D model (CTA vs. 3D, 117.7±14.2 minutes vs. 109.8±11.6 minutes; P=0.001). In addition, there was no change in preoperative decision on type of flap harvested in all cases in 3D print group (0%), compared with 24.1% change in conventional CTA group.
Conclusions Use of 3D print model improves accuracy of preoperative planning and reduces flap harvest time with similar postoperative complications in complex microsurgical reconstruction.",Adeyemi A. Ogunleye,2020,https://www.riss.kr/link?id=A104770023
실리콘판과 실리콘접착제로 만든 비삽입물,"Augmentation rhinoplasty now involves flat noses as well as saddle or deviated noses. Creation of an accurate nasal implant is critical for augmentation rhinoplasty in such cases. The author has devised a new method to create implants. First, an ideal nasal patters is made from a xeroradiogram of a profile of the face. A silicone sheet (0.06 inch in thickness) is then tailored to this pattern and mounted on a stone model of the patient's nasal impression. Silicone adhesive is squeezed onto both sides of the silicone sheet and cured. Finally a carving of the outer surface of the implant is done with a #11 blade. Consequently a nasal implant is composed of silicone sheet and silicone adhesive.
The results of the clinical experience of augmentation rhinoplasty with this implant are as follows:
1. A shaping of the implant with the same angle and size of the preoperative design.
2. The undersurface of the implant has contact with the patient's nasal contour.
3. A smooth and natural curvature of the nose.
4. Easy carving because the implant is attached firmly to the stone model.
5. Preoperative discussion with the patient is possible.
6. A saving of operative time because the implant is perfectly shaped preoperatively
7. Less expense than other types of silicone implants.
8. The making of the implants is easier for inexperienced workers.
9. The disadvantages are that it is more time consuming and is a staged production",한기환,1988,https://www.riss.kr/link?id=A107049569
한국 영화와 드라마에 나타난 성형외과 의사와 성형수술의 이미지,"Nowadays, plastic surgical operations are increasingly being performed in Korea. We have gained added interest in this because some professional pictures contain plastic surgery in their venue. In the films, we intend to see the recognition of society for plastic surgeons and which field of plastic surgery. The list of movies for analysis were 'Plastic Beauty (1975)', 'Penthouse Elephant (2005)', '200 Pounds Beauty (2006)', 'Cinderella (2006)', and 'Time (2006)'. The TV dramas were 'She is looking (2005)', 'Lovers (2006-2007)', and 'Before & After Plastic Surgery Clinic (2008)'. Films were analyzed according to the following: the chief complaints and names of the operations, character of plastic surgeons, result of the operation and its possibility in reality, and its effect of plastic surgery on the life of the patients. Most of the film contained facial transplantation or the change of the face or body different from the original shape. Character type of the plastic surgeons was mostly medical realism, rather than ideal humanism. Most of the plastic surgeons have capability as a doctor; however, some of them had extramarital affairs. The surgery was successful in most of the cases, but were the patients happy with the results? This was not the case in the movies. In only one movie, '200 Pounds Beauty', the patient became happy; rest of them were eminently unhappy with the outcome. Why the discrepancy? It is difficult to analyze the minds of the people in the films, but considering that the majority of the characters in the films were rather unsavory, one may deduce that a crooked mind functions differently. Perhaps it is too much to hope for a day that will come when we will see a film that portrays the mental anguish that accompanies each and every procedure the Korean plastic surgeons make.",김한준,2012,https://www.riss.kr/link?id=A2013624
댄디워커증후군에 동반된 점막 밑 입천장갈림증 치험례,"Purpose: Dandy-Walker syndrome is a rare congenital brain malformation that occurs one in every 25,000-35,000 live births, mostly in females. It is characterized by cystic enlargement of the fourth ventricle, agenesis or hypogenesis of the cerebellar vermis and enlargement of the posterior fossa. In this report, the authors aimed to address a rare case of a 14-months-old female Dandy-Walker syndrome patient that is presented with submucous cleft palate. Methods: A 14-months-old female patient admitted to our outpatient clinic, via the department of pediatrics, with the complaints of nasal regurgitation, choking and breathing difficulties. She was diagnosed as Dandy-Walker syndrome by magnetic resonance imaging evaluation, at another hospital and underwent a shunt operation for the hydrocephalus continuing treatments. On physical examination, she had structural abnormality of bifid uvula, and palpable notch in the posterior surface of the hard palate. Her submucous cleft palate was corrected, which used a double opposing Z-plasty under general anesthesia. Results: In a follow-up period of 2 months, no complications, such as wound dehiscence, necrosis and infection occurred, which shows satisfactory results. She consulted with pediatric neurologists and physical therapists for further evaluation and management of the abnormalities in the central nervous system. Conclusion: Dandy-Walker syndrome patient with a cleft palate is a very rare case to find, which only a few cases are reported around the world. Authors would like to share this case of Dandy-Walker syndrome patient, with submucous cleft palate, who underwent a double opposing Z-plasty that shows satisfactory results.",강범식,2012,https://www.riss.kr/link?id=A102070515
모호한 외부 성기를 가진 소아에서 1단계 외부 생식기 재건술,"The criteria for the identification of sex are as follows; sex chromosome and chromatin, gonadal structure, morphology of the external genitalia, morphology of the internal genitalia, hormonal status, sex of rearing and gender role. During these steps, any disturbance may be presented clinically as a disorder of intersexuality. Hermaphroditism is a state of having ambiguous genitalia due to abnormal sexual differentiation.
We experienced three children with ambiguous external genitalia. Two patients were male pseudohemaphrodites, who had a normal male chromosomal constitution of 46XY with incomplete masculinization of the external genitalia and hypospadia. One patient was female pseudohemaphrodite, who had a normal female chromosomal constitution of 46XX with male phallus-like enlarged clitoris associated with posterior labial fusion and single perineal urogenital orifice. There was elevated urinary 17 ketosteriod and hypertrophied adrenal gland on CT scan. We planned staged reconstruction because they were children. First stage reconstruction were surgical restoration of the ambiguous external genitalia to normal appearance and removal of contradictory gonadal structure as early as possible. Second stage reconstruction includes reconstruction of secondary sex characteristics after puberty such as mammaplasty, vaginoplasty, and facial plasty. Hormonal therapy was necessary for normalization of hormonal status and promotion of expression of secondary sex characteristics.
In first stage reconstruction, we performed clitoroplasty by use of glans penis island flap with dorsal neurovascular bundle, labioplasty and orchiectomy in two male hermaphroites. All neoclitoris survived well with good preservation of sensation.",이백권,1998,https://www.riss.kr/link?id=A102070512
하이드로겔과 하이드로콜로이드 드레싱을 이용한 압박성 궤양의 치험례,"Pressure sores are a common complication of hospitalized patients. However, It is often impossible to correct surgically because the general conditions of these patients are poor. It is known that the hydrogel has a powerful autolytic effect by providing moist environments and facilitates wound healing and hydrocolloid dressing is also known to promotes granulation tissue formation and epithelialization. The patients were treated with hydrogel(Purion gel, Coloplast A/S, Denmark) and hydrocolloid dressing (Comfeel Plus Transparent Dressing, Coloplast A/S, Denmark) after surgical debridement of pressure sores progressed to stage III(n=2) and IV(n=7). This combination treatment could facilitate to debride the nectrotic tissue and promote granulation tissue formation epithelialization simultaneously. We could achieve complete healing of pressure sores using the combination treatment without requiring surgical correction.In conclusion, hydrogel in combination with hydrocolloid dressing is effective in acheiving complete healing of progressed pressure sores.",김융수,2005,https://www.riss.kr/link?id=A2014316
선천성 구순열 및 구개열 환자의 임상적 고찰,"Until recent years, the birth of a child with a cleft of the lip or palate was surrounded by supersitition and mystery. All congenital malformations were commonly ascribed to a multitude of natural and supernatural prenatal influecnes. Many scientists hampered by their inability to make direct observations of human fetal development within the uterus, ascribed malformation to defective inheritance and adopted a fetalistic attitude toward them.
The authors reviewed and discussed our clinical experience of 798 cases of cleft lip and palate patient who were treated at Red Cross Hospital from Apr. 1978 to December 1982.
Clinical analysis of these 798 cases of cleft lip and palate patients were carried out and summarized as follows.
1. Cleft lip includes all lip clefts incomplete or complete with or without alveolar notching. Cleft palate covers all clefts of the secondary palate including submucous cleft palate. Cleft lip palate covers all clefts of primary and scondary plate.
2. The rate of cleft lip, cleft L.P., and cleft palate was 1(3.5) : 2.1(2) : 1(1)
3. Females were affected 1.2 times more than males in cleft palate.
4. Left Incomplete cleft lip was most frequent in cleft lip and cincomplete cleft palate was most frequent in cleft palate.
5. Mothers in age group over 50 and under 20 were greater incidence than other age group.
6. Herb medicine antiementics and contraceptives were the frequent medicine among prental medication.
7. Hyperemesis and U.R.I. was the frequent disease in first trimester.
8. Family history was 9.3%
9. Blood “O”type was less frequent than other blood group.
10. Two flap palatoplasty was applied with incomplete cleft palate, three flap was applied with complete and bilateral cleft palate. Four flap was applied withseveral cases of bilateral cleft palate.
11. Pharyngcal flap was applied with 32 paints in severe hypernasality.
12. Motality was absent and overall complication was cases; Pneumonia, bleeding, Wound infection wound disruption, oronasal fistula, hypertrophic scar.
13. Rare craniofacial clefts was 23 cases among 1363 cases of facial clefts.",양혜숙,1983,https://www.riss.kr/link?id=A104555465
포경수술에 의해 악화된 매복음경,"Purpose: To report a rare case of concealed penis that was aggravated by circumcision and simple way of treatment using skin flap. The concealed penis is a primarily pediatric disease and is usually treated by urologists. The plastic surgeons tend to see these patients when it become secondary deformation or in conjoinment with other specialties. In such situation, the plastic surgeons do not have many experiences.Methods: A 3-year-old boy was admitted with aggravated concealed penis after circumcision in congenital webbed penis. Patient had been operated with scar revision and skin flap and peri operative antibiotics.Results: The patient recovered well without any complication such as infection, hematoma and necrosis of flap. Patient was discharged POD#7 with remaining sutures. Patient was followed up for 7 months and he has no sign of erectile dysfunction, voiding dysfunction and evidence of inflammation of the urinary system.Conclusion: We experienced a case of concealed penis that was aggravated from aggressive circumcision in congenital webbed penis.",남승민,2006,https://www.riss.kr/link?id=A2013344
