
수근관절 활액막염 원인 질환 진단을 위한 다중적 접근법,"목적: 본 연구의 목적은 수근관절 활액막염 진단하에 활막 절제술을 시행한 환자들을 대상으로 원인 질환 진단을 위한 다중적 접근법을 제시하고자 한다.
대상 및 방법: 2000년 1월부터 2013년 12월까지 서울대학교병원에서 수근관절 활액막염 진단하에 활막 절제술을 시행한 환자 중 수술 전 수근관절 조영 증강 자기공명영상 검사를 시행한 29명의 환자를 대상으로 후향적으로 분석하였다. 이 중 17명의 환자는 수술 전 Tc99m 백혈구 스캔 검사를 시행하였다. 류마티스 관절염 진단 기준에 부합하는 환자의 경우, 수근관절 자기공명영상 및 조직 병리 검사 결과 중 하나 이상에서 류마티스 관절염을 시사하는 소견이 나왔다면 류마티스 관절염으로 최종 진단하였다. 만약 자기공명영상 검사와 조직 검사 소견이 시사하는 진단이 다르게 나타나는 경우에는 조직 검사 소견 결과를 토대로 확진하였다.
결과: 류마티스 관절염 진단 기준을 충족하는 9명의 환자 중 7명의 환자는 류마티스 관절염으로 최종 확진되었으며, 2명의 환자는 결핵성 관절염으로 최종 진단되었다. 류마티스 관절염 진단 기준을 충족시키지 못한 20명의 환자 중 12명은 자기공명영상 검사 및 조직 검사 결과 모두 동일한 질환을 시사하는 것으로 나왔으며 나머지 8명의 환자들은 임상 양상, 자기공명영상 및 조직학적 소견에 근거하여 5명은 비특이적 만성 활액막염, 1명은 류마티스 관절염, 2명은 결핵성 관절염으로 최종 진단되었다.
결론: 자기공명영상 검사 및 백혈구 스캔 검사는 수근관절 활액막염 원인 질환 진단에 많은 도움이 되는 유용한 검사이다. 진단이 어렵거나 약물 치료에 반응이 없는 경우에 활막 절제술을 통한 조직 병리 검사 결과는 매우 유용할 수 있다.",배기정(Kee Jeong Bae),2018,https://www.riss.kr/link?id=A76564278
스포츠와 연관된 회전근 개 부분층 파열,"견관절통은 특히 던지기 운동선수에서 흔히 생기는 임상증세다. 전문적인 선수뿐만 아니라 여가활동으로 참여하는 대중의 던지기 선수에서 회전근 개 부분층 파열이 발생할 위험은 상존한다. 본 논문에서는 던지기 선수에서 회전근 개 부분층 파열이 있는 경우 부상의 특징, 치료 전략 및 그 결과에 대하여 문헌고찰을 통하여 알아보고자 한다.",박태수(Tae-Soo Park),2019,https://www.riss.kr/link?id=A75273939
고령의 대퇴전자간 분쇄골절 치료 시 내고정술과 인공관절 반치환술간의 임상결과 비교,"목적: 고령 환자의 불안정성 대퇴전자간 골절에서 무작위로 전향적으로 시행한 내고정술과 고관절 부분 치환술간의 연령별 임상 결과를 비교 분석하고자 하였다. 대상 및 방법: 2004년 1월부터 2007년 2월까지 70세 이상 고령에서 대퇴 전자간 불안정성 골절로 내고정이나 고관절 부분 치환술을 시행한 62예에 대해 최소 12개월(12개월~36개월) 추시 관찰하여 SF-36을 통해 임상적 평가를 시행하였다. 내고정을 시행한 군은30명, 부분 치환술을 시행한 군은 32명이다. 임상 결과 분석은 SF-36을 이용하였으며 SPSS를 통해 통계 분석하였다. 결과: 70대에서는 동통, 파행, 보조기 사용 여부 항목에서 부분 치환술 군이 유의하게 좋은 결과를 보였고, 80대에서는 파행 항목에서만 부분 치환술 군이 좋은 결과를 보였으나(P<0.05), 나머지 항목에서는 각 군간에 유의한 차이가 없었다. 내고정군에서 고정물 실패가 4예 있었고, 부분 치환술 군에서 감염에 의한 실패가 2예, 탈구로 인한 재치환술이 2예 있었다. 결론: 고령의 불안정성 대퇴 전자간 골절 시 내고정술보다 초기 안정성으로 동통이 적고 조기 기동이 가능한 고관절 부분 치환술이 더 유용할 것으로 사료되었다.",문창윤 ( Chang Yun Moon ),2008,https://www.riss.kr/link?id=A108611995
항정신병 약물 과량 복용 후 발생한 횡문근융해증으로 인한 급성 구획증후군,"49세 남자 환자가 숙박업소에서 의식을 잃은 채 발견되어 응급실로 내원하였다. 환자는 조현증 및 주요우울증으로 항정신병 약물 및 항우울증 약물(vortioxetine hydrobromide, mirtazapine, sertraline hydrochloride, quetiapine, alprazolam)을 복용 중이었으며 환자 주변에 상기 약물들을 과량 복용한 흔적이 남아있었다. 신체검사에서 좌측 둔부 및 가측 대퇴부로 동통, 창백 및 부종 관찰되었으며 좌측 족관절 이하의 능동 관절운동이 불가하였다. 그리고 경골 및 비골신경 영역의 감각이 소실되어 있었다. 가장 종창이 심했던 가측 대퇴부에서 측정한 둔부 구획 내 압력은 42 mmHg 이었으며 자기공명영상에서 좌측 둔부 근육 및 주변 연부 조직의 부종 및 고강도 신호를 보이고 있었다. 응급 근막절개술을 시행하였고 24시간 이후 하지 감각 및 근력이 일부 회복되었다.",황석하(Seok-Ha Hwang),2020,https://www.riss.kr/link?id=A30076283
삼각골 후방 피질 골절에 동반된 삼각섬유연골 복합체 손상,"목적: 삼각골 후방 피질 골절 후 지속되는 수근관절 척측 통증의 한 원인으로 동반된 삼각섬유연골 복합체 손상을 고려할 수 있으며, 이에 대하여 수근관절 관절경의 유용성 및 이들의 연관성에 대해 보고하고자 한다. 대상 및 방법: 삼각골 후방 피질 골절 진단 후 보존적 치료를 받았으나 수근관절 척측 부위 통증이 지속된 6예를 대상으로 하였다. 수술 전후 VAS 통증척도, 악력 검사, 척골 연마 검사, 클레인만 전단 검사, 월상삼각 부유 검사를 시행하였고, 관절경 검사를 시행한 후 Palmer 분류에 따라 삼각섬유연골 복합체 손상을 분류하였다. 결과: 척골 연마검사 저 6예에서, 클레인만 전단 검사 3예에서, 월상삼각 부유 검사 1예에서 양성을 보였다. 관절경 검사 5예에서 Palmer 1A, 1예에서 1D형을 보였고, 전 예에서 활액막염의 소견을 보였으며, 삼각섬유연골 복합체 부분 절제술 및 활액막 제거술을 시행하였다. 수술 전후 VAS 통증 정도는 평균 8점에서 3점으로 호전되었으며, 악력 검사에서 건측과의 차이가 평균 15 lb에서 5 lb로 감소하였다. 수술 후 6주에 시행한 이학적 검사에서 전예에서 척골 연마 검사 및 클레인만 전단 검사 음성 소견을 보였다. 결론: 삼각골 후방 피질 골절 후 지속되는 수근관절 척측 통증의 원인으로 삼각섬유연골 복합체의 손상을 고려할 수 있으며, 이에 대하여 관절경하 부분 절제술이 좋은 치료 방법으로 생각된다.",이승준 ( Seoung Joon Lee ),2009,https://www.riss.kr/link?id=A100900773
감염성 심내막염과 동반된 세균성 슬관절 활액막염 환자에서 나타난 건측 상하지 위약: 감염성 심내막염으로 인한 색전 경색,"저자들은 발열과 동반한 우측 슬관절 통증으로 내원한 82세 남자 환자를 세균성 활액막염으로 진단하고 관절경하 대량 세척술 및 활액막 절제술을 시행하였다. 술 후 1일째 건측 상하지의 위약감이 발생하여 뇌 자기공명영상 검사를 통하여 색전 경색증을 진단하였으며, 순차적으로 시행한 경식도 심초음파에서 승모판의 감염성 심내막염을 확인하였다. 내원 당시 환자의 생체 징후, 말초백혈구 수, 균혈증의 유무, 균 동정 결과를 통해 감염성 심내막염의 동반 가능성을 예측해 볼 수 있었기에 문헌 고찰과 함께 보고하는 바이다.",차재룡(Jae-Ryong Cha),2022,https://www.riss.kr/link?id=A107937974
경피적 척추성형술 시 발생한 골시멘트에 의한 척수 손상,"경피적 척추성형술의 합병증 중 척추관내 골시멘트 누출은 드물지 않게 발생하며, 이 중에는 심각한 신경 증상을 유발하는 경우도 있다. 이 때의 신경 손상이 영구적 또는, 가역적인 것인지는 확실하지 않으나, 척추관내의 골시멘트를 제거하지 않았을 경우에 척수는 경미한 외상 등에 의해 보다 수월하게 추가적 손상을 받을 수 있을 것으로 생각된다. 본 교실에서는 75세 여자 환자가 제8, 9 흉추에 경피적 척추성형술을 받다가 척추관내 골시멘트 누출로 Nurick 4등급의 신경 결손이 발생하였으며, 골시멘트를 제거하지 않고 지내다가 9년 후 사소한 외상으로 인해 Nurick 5등급으로 진행한 예를 경험하였으며 수술적 제거술을 시행하고 6개월 후에 Nurick 2등급으로 호전되었다. 본 증례를 관찰한 결과 이와 같은 신경 손상은 골시멘트를 제거하지 않았을 경우에 경미한 외상에 추가적인 신경 손상을 받기 쉬우며 장기간 지연된 경우라도 골시멘트를 제거하면 신경 증상의 호전을 기대할 수 있는 것으로 생각되었다.",안동기(Dong Ki Ahn),2009,https://www.riss.kr/link?id=A107896234
골다공증성 척추 압박 골절과 비타민 D 결핍의 정도,"목적: 골다공증성 척추 압박 골절 환자에 있어 비타민 D 부족 정도를 알아보고, 비타민 D와 여러 변수 간의 상관관계에 대해 알아보고자 한다. 대상 및 방법: 2008년 10월부터 2011년 6월까지 골다공증성 척추 압박 골절로 진단 받은 총 134명의 환자를 대상으로 하였다. 25(OH)vitamin D3를 측정하여 환자의 비타민 D 상태를 평가하였고, 성별, 골절된 추체 수, 거주 환경, 계절에 따른 비타민 D 수치를 비교 분석하였으며, 비타민 D와 나이, 골밀도, 골대사 지표와의 상관관계를 조사하였다. 결과: 골다공증성 척추 압박 골절 환자의 87명(65%)에서 비타민 D 부족이 관찰되었다. 비타민 D는 겨울철에 가장 낮은 수치를 여름철에 가장 높은 수치를 보였고, 일반 가정에 거주하는 경우가 요양 시설에 거주하는 경우보다 통계학적으로 유의하게 높은 수치를 보였으며(p=0.032), 나이와는 유의한 음의 상관관계를(r=-0.201, p=0.02), 골밀도와는 유의한 양의 상관관계를 보였다(r=0.217,p=0.012). 결론: 골다공증성 척추 압박 골절 환자에 있어 비타민 D 수준을 평가하는 것이 치료를 계획하는 데 도움이 될 것으로 생각되며, 부족 시 적절한 일광 노출과 비타민 D의 보충을 고려해 보는 것이 좋을 것으로 생각된다.",김홍식 ( Hong Sik Kim ),2013,https://www.riss.kr/link?id=A104138734
고주파 에너지의 축화를 이용한 전방십자인대 부분 파열의 치료,"목적: 전방십자인대 부분 파열에 의한 슬관절 불안정성이나, 통증을 호소하는 환자에서 고주파 에너지를 이용한 축화 치료의 유용성과 결과를 분석하고자 하였다. 대상 및 방법: 전방십자인대 부분 손상에 의한 통증 또는 불안정성으로 축화 치료를 받은 11례를 대상으로 하였으며, 추시 기간은 평균 19(15~24)개월이었다. 축화 치료의 대상은 축이동 검사 상 1+ 이하이고, 슬관절 전방 전위 촬영상 건측과의 차이가 5 mm 이하이며, 관절경 상에서 탐지자를 이용한 검사에서 긴장을 유지하는 전방십자인대가 75% 이상인 경우로 하였다. 축화 전후의 이학적 검사, Lysholm knee 점수 및 Tegner activity 점수 그리고 슬관절 전방 전위 촬영을 비교 분석하였다. 결과: 수술 전 Lachman 검사는 전례에서 양성(2+ 1례, 1+ 10례)이였고, 축이동 검사는 7례에서 1+의 소견을 보였다. 수술전 실시한 슬관절 전방전위 촬영에서는 평균 3.6 mm (2~5 mm)의 전위를 보였다. 수술 전 Lysholm 점수와 Tegner activity 점수는 각각 평균 68.6(44~90)과 3.1(1~4)점이었다. 수술 후 추시 관찰 상 4례에서 Lachman 검사 상 1+의 불안정성을 보였고, 그 중 2례는 축이동 검사에서도 1+의 불안정성을 보였다. 수술 후 Lysholm 점수와 Tegner activity 점수는 각각 평균 89.1 (75~99)과 6.3(4~7)점으로 수술 전에 비해 향상된 소견을 보였다. 또한 수술 후 최종 추시 관찰 시의 전방전위 촬영에서 건측과의 차이는 평균 4.0 mm(2~7 mm)로 수술 전 보다는 증가된 소견을 보였다. 결론: 고주파 에너지를 이용한 축화는 증상이 남아있는 전방십자인대 부분 파열에서 고려될 수 있는 유용한 치료 방법으로 사료된다. 또한 좋은 결과를 얻기 위해서는 좁은 수술 적응증과 엄격한 재활 치료가 중요할 것으로 판단된다.",서정탁 ( Jeung Tak Suh ),2006,https://www.riss.kr/link?id=A103844910
주관절 강직의 병태 생리,"목적: 관절의 적절한 기능을 위해서는 관절의 안정성과 운동 범위의 유지가 필요하다. 주관절과 연관된 환자의 주소의 대부분이 주관절의 강직이다. 최근 보고들에서 주관적의 강직에 대한 치료에서 우수한 결과가 보고되고 있다. 그러나 어떠한 술식을 선택하여야 하는 것은 결정하기 어렵다.
대상 및 방법: Morrey 등은 기능적인 운동 범위를 30-130도의 굴곡-신전 범위, 50도 회내전 및 50도 회외전이라고 하였다. 이 범위에서 일상 생활의 약 90%가 이루어 진다. 주관절 강직은 원인이 되는 외상과 주 병변의 위치에 따라서 분류할 수 있다. 관절 내 원인으로는 심각한 관절 내 불일치, 관절 내 유착 또는 관절 내 연골의 소실, 골극 형성에 의한 기계적 제한, 관절 내 유리체, 활액막의 과다 증식이 해당된다. 관절 외 원인으로는 외상 또는 탈구에 의한 심한 관절막의 유착, 측부 인대 또는 근육의 구축이 해당된다.
결과 및 결론: 신전 제한의 주 원인은 전방 관절막의 섬유화에 의한 구축이다. 이러한 병변은 전방 관절막 절제술이 도움이 된다. 굴곡 제한의 주 원인은 내측부 인대의 후방대의 구축이다.",송현석(Hyun Seok Song),2010,https://www.riss.kr/link?id=A103844879
광범위 회전근개 파열과 동반된 삼각근 파열,"비외상성 삼각근 파열은 드문 질환으로 견관절 수술 후나 반복적인 스테로이드 주사의 합병증으로 발생할 수 있으나, 만성 광범위 회전근개 파열과 관련된 마멸성 파열이 원인이 될 수도 있다. 회전근개 광범위 파열의 경우 견관절의 거상 운동은 주로 건재한 삼각근 기능에 의존하므로 삼각근 파열은 돌발적인 가성마비와 같은 심각한 기능 장애를 유발한다. 저자들은 삼각근 파열을 동반한 특이한 회전근개 광범위 파열 환자 2예를 경험하고 삼각 대흉근 도달법 피부 절개 하에서 삼각근을 봉합하고 역 인공관절 치환술을 시행하여 양호한 임상적 결과를 얻어 이를 보고하고자 한다.",오용승(Yong Seung Oh),2022,https://www.riss.kr/link?id=A107799924
급성 구획 증후군에서 근막 절개술 후 임상 결과,"목 적: 급성 구획 증후군 환자에서 근막 절개술 후 임상 결과 및 합병증에 대하여 알아보고자 하였다. 대상 및 방법: 2011년 1월부터 2015년 2월까지 하지 급성 구획 증후군으로 진단 받고 근막 절개술을 시행한 17예를 대상으로 후향적으로 연구하였다. 급성 구획 증후군의 원인, 부위, 창상 관리 방법, 피부 이식 유무, 절단 및 감염을 포함한 합병증을 조사하였다. 결 과: 급성 구획 증후군의 원인으로는 골절이 7예, 비외상성 혈종 1예, 재관류 손상 6예, 횡문근 융해증 3예였다. 구획 증후군발생 부위로는 대퇴부 3예, 하퇴부 10예, 족부 3예, 대퇴부, 하퇴부 및 족부 모두 침범한 경우가 1예였다. 전체 17예 중 사망이 3예 있었으며, 이는 모두 재관류 손상에 의해 급성 구획 증후군이 발생하였던 경우였고, 1예에서 연부조직의 광범위한 괴사로 인해 절단술을 시행하였다. 사망과 절단을 제외한 13예에서 shoelace 기법 또는 음압 창상 치료를 이용한 9예 중 1예와 이용하지 않은 4예 중 2예에서 피부 이식이 필요하였다. 감염이 2예에서 발생하였다. 결 론: 재관류 손상 후 발생한 급성 구획 증후군은 다른 원인에 의한 급성 구획 증후군보다 예후가 나빴다. 근막 절개술 이후 shoelace 기법을 쓰거나 음압 창상 치료를 하는 경우 효과적인 창상 관리를 할 수 있었다.",박지용 ( Ji Yong Park ),2015,https://www.riss.kr/link?id=A82591281
세라믹-세라믹 관절면을 이용한 시멘트형과 무시멘트형 인공고관절 전치환술의 결과 비교,"목적: 세라믹-세라믹 관절면으로 시멘트형 인공 고관절 전치환술을 시행한 군과 무시멘트형 인공 고관절 전치환술을 시행한 군에서 임상적 및 방사선학적 결과를 조사하였다. 대상 및 방법: 2004년 1월부터 2005년 2월까지 시멘트형 인공 고관절 전치환술을 시행하고 3년 이상 추시가 가능하였던 53명 59예와, 같은 기간 무시멘트형 인공 고관절 전치환술을 시행하고 3년 이상 추시가 가능하였던 58명 64예를 대상으로 하였다. 임상적 평가로는 Harris 고관절 점수, WOMAC 점수를 사용하였고, 최종 추시상 고관절부 불편감, 대퇴부 동통 여부를 조사하였다. 방사선학적으로 방사선 투과음영, 대퇴 스템의 침강, 시멘트 맨틀의 등급, 고정의 안정성 등을 관찰하였다. 결과: Harris 점수는 시멘트형 군에서 수술 전 평균 62.7점에서 최종 추시상 평균 92.4점으로 향상 되었으며, 무시멘트형 군에서는 수술 전 평균 61.5점에서 최종 추시상 평균 91.8점으로 향상 되었다(p>0.05). WOMAC 점수는 시멘트형 군에서 수술 전 평균 37.9점에서 최종 추시상 평균 7.0점으로 향상 되었고, 무시멘트형 군에서는 수술 전 평균 38.5점에서 최종 추시상 평균 12점으로 향상 되었다(p<0.05). 시멘트형 군에서는 고관절부 불편감과 대퇴부 동통은 없었으며, 무시멘트형 군에서는 고관절부 불편감 5예, 대퇴부 동통 9예가 있었다. 양 군에서 비구 컵의 골성 고정을 얻었고, 삽입물의 이동 소견은 보이지 않았다. 시멘트형 군에서 대퇴 스템의 침강은 57예에서 1 mm 이내, 2예에서 2 mm 이내였으며, 무시멘트형 군의 모든 예에서 대퇴 스템의 골성 고정을 얻었다. 결론: 세라믹-세라믹 관절면을 이용한 시멘트형 인공 고관절 전치환술은 무시멘트형 인공 고관절 전치환술에 비해 유의하게 임상적으로 양호한 결과를 얻었으며, 세라믹-세라믹 관절면의 높은 강성으로 인한 문제점을 보완하기에 좋은 방법이라고 생각된다.",임수재 ( Soo Jae Yim ),2008,https://www.riss.kr/link?id=A76562972
고령의 고관절 골절 환자의 노인장기요양 서비스 현황 분석,"목적: 고관절 골절이 발생한 고령 환자에서 개시된 노인장기요양 서비스 현황에 대하여 분석하였다.
대상 및 방법: 고관절 골절 진단을 받은 65세 이상의 고령자를 대상으로 국민건강보험공단으로부터 2005년부터 2018년까지의 진료 내역 및 노인장기요양 정보 등을 제공받아서 연구를 시행하였다. 골절 발생후에 노인장기요양 서비스 신청자, 인정자에 대하여 조사하였으며 인정자에서 시행된 서비스의 이용 현황에 대하여도 분석하였다.
결과: 80,675명의 골절 환자 중에서 노인장기요양 서비스 신청자는 14,795명으로 18.3%, 인정자는 11,020명으로 13.7%였으며 신청자 대비 인정율은 74.7%였다. 여성, 80세 이상, 거주지가 서울 및 도내시, 의료급여 이외의 보험료 분위, 전자부 주위 골절 및 복합 골절, 수술을 시행 받은 자, 노인성 질환을 가지고 있는 자, 류마티스 질환이 없는 자, 지체 장애가 없는 자, 뇌병변 장애인에서 인정이 많이 발생하였으며 p값이 0.05 이하로 통계학적으로 의미 있는 소견을 보였다. 인정자의 서비스 이용 현황은 시설 서비스 25.9%, 재가 서비스 54.3%, 서비스를 이용하지 않은 비수급이 19.8%로 재가 서비스를 가장 많이 이용하였으며 최근일수록 시설 서비스는 감소하였고 재가 서비스와 비수급은 증가하고 있는 추세를 보였으며 통계학적으로 의미 있는 소견을 보였다.
결론: 2009년부터 2017년까지의 기간 중 고관절 골절 발생 후 노인장기요양 등급의 인정을 받은 환자는 13.7%였고 신청자 대비 인정율은 74.7%였으며 재가 서비스를 가장 많이 이용하였다. 고관절 골절 후에 서비스에 대한 요구가 많은 것을 알 수 있었으며 4명 중 1명에서 신청은 했지만 인정을 못 받고 있는 상태로 서비스의 확대가 필요하다고 사료된다.",손강주(Kang Ju Son),2023,https://www.riss.kr/link?id=A105122417
근위 대퇴정을 이용한 대퇴골 전자부 골절 치료의 합병증,"목 적: 최근 대퇴골 전자부 골절에서 많이 사용되고 있는 근위 대퇴정의 합병증을 분석하고그 합병증을 줄일 수 있는 방법을 알아보고자 하였다. 대상 및 방법: 2001년 6월부터2005년 8월까지 근위 대퇴정으로 치료한 대퇴골 전자부 골절 환자 중에서 추시 관찰이 가능하였던 198예를 대상으로 합병증 발생 유무를 조사하였다. 결 과: 합병증이 총 28예(14.1%)에서 발생하였다. 지연 나사만의 돌출 1예, 지연 나사와 회전 방지 나사의 돌출이 3예, 회전 방지 나사만의 돌출이 3예이며 그 중 1예에서 대퇴 골두 골절이 발생하였다. 대퇴골 경부 골절 1예, 대퇴 골두 무혈성 괴사 1예, 수술 중피질골 골절이 1예, 수술 중drill bit 파손 1예, 섬유성 유합 2예, 과도한 후방 돌출로 인한 피부 자극이 3예, 수술 후 삽입물 주위 골절 2예, 10˚ 이상의 내반 함몰 변형이 4예, 감염이 3예, 근위 대퇴정의 파손 1예, 근위 대퇴정 제거후 내반 변형이 1예, 지속적인 대퇴부 동통이 1예 있었다. 이 중 심각한 합병증으로 전신 마취 혹은 척추 마취의 재수술이 필요한 경우는 9예 (4.5%)였다. 지연 나사나 회전 방지 나사 혹은 골절의 정복과 관련된 합병증이 19예 (9.6%)이며 이 중 17예 (89.5%)에서 골절의 비해부학적 정복 혹은 증가된 TAD (tip apex distance)의 소견을 보였다. 결 론: 근위 대퇴정을 사용할 때 합병증 발생을 줄이기 위해서 수술 중 골절의 해부학적 정복과 세심한 술기기 필요하며 지연 나사와 회전 방지 나사의 관절내 돌출과 후방 돌출을 줄이기 위한 디자인의 개선 노력이 필요할 것이다.",이기병 ( Kee Byoung Lee ),2007,https://www.riss.kr/link?id=A99550428
견갑골 두께의 전산화 단층 촬영을 이용한 기하학적 모델,"목적: 견갑골의 수술적 치료에 있어서 해부학적 및 형태학적인 이해는 매우 중요하다고 할 수 있다. 전산화 단층촬영을 이용하여 견갑골의 정확한 두께를 측정하고, 기하학적인 형태를 재구성함으로써 견갑골의 정확한 해부학적 및 형태학적인 정보를 제공하고자 하였다.
대상 및 방법: 총 51개의 해부용 시체에서 적출한 102개의 견갑골을 대상으로 하였으며, 일반적인 견갑골의 형태를 얻기 위해 8개의 평균적인 길이와 2개의 각을 측정하였다. 또한 견갑골의 두께를 측정하기 위해 각각의 견갑골에서 동일한 위치의 시상면을 얻고, 각각의 시상면에서 견갑골의 두께를 전산화 단층 촬영을 이용하여 측정하였다. 견갑골의 두께에 대한 실측치를 토대로 평균값을 계산하였으며, 성별에 따른 견갑골 두께의 차이를 Student t-test 를 이용하여 비교하였다.
결과: 견갑골 관절와의 평균 두께는 22.4 mm, 외측연의 평균 두께는 13.83 mm, 내측연의 평균 두께는 4.44 mm, 견갑골 체부의 중간 1/3 위치의 평균 두께는 2.06 mm 로 측정되었으며, 남성의 견갑골이 여성의 견갑골 보다 더 두껍게 측정되었다. 측정된 실측치를 참고로 하여 견갑골들의 두께에 대한 3차원적인 기하학적인 모델을 재구성하였다.
결론: 측정 수치의 분석 결과 견갑골의 두께가 가장 두꺼운 부분은 관절와 부위 및 외측연 부위이며, 반대로 두께가 가장 얇은 부분은 견갑골 체부의 중간 1/3 지점이 견갑골에서 가장 얇은 부위로 나타났다.",유정현(Jeong Hyun Yoo),2012,https://www.riss.kr/link?id=A101528678
