
소아ㆍ청소년 및 성인 우울신경증 환자에 대한 Paroxetine의 항우울 및 항불안 효과 검증,"요 약

본 연구의 목적은, 선택적 serotoin 재흡수 차단제(sell·ctive serotonin re-uptake
inhibitors : SSRI)로서 불안중상을 동반한 비정신병적 우울증에 효과적인 치료제로 알려지
고 있는 paroietine의 항우울 및 항불안 효과를 검증하고. 성별 및 연령별로 효과의 차이를
파악하는 것이다. 이를 위해 8∼55세 사이의 우울신경증 환자 23B명을 대상으로 paroxetine
과 위약을 이중맹 교차방식으로 투여한 후,우울 및 불안 증상의 호전도를 Hamilton
Depression Scale(HDS)과 Hamilton Anxeity Scale(HAS)로 측정하여 다음과 같은 결과를
얻었다.

1) BBDS로 측정된 우울증상에 대해, 성별 및 연령별로 구분된 8개 대상군에서 모두
paroxetine이 위약에 비해 통계적으로 유의하게 높은 호전 효과를 보였다.
2) HAS로 측정된 불안증상에 대해서도, 성별 및 연령별로 구분된 8개 대상군에서 모
두 paroxedne이 위약에 비해 통계적으로 유의하게 높은 호전 효과를 보였다.
3) 위약과 비교시, paroxetine의 항우울 효과는 소아· 청소년 여자 환자군에서 가장 두드
러졌고, 항불안 효과는 남,녀 소아 환자군과 35세 이하의 성인 여자 환자군에서 가장 높은
경향을 보였다.
4) 부작용으로는, 전체 232례 중 3례에서 paroxetille 투여 후 경미한 소화불량 및 복통증상
을 나타내었으나, 3례 모두 약물의 감량이나 투여중단 없이 회복이 가능했다.


이상의 결과에서 paroxetine은 소아 · 청소년 및 성인 우울신경증 환자에서 2주 이내에 위
약보다 유의하게 우수한 항우울 및 항불안 효과를 나타내는 것을 알 수 있었다. 향후 보다
장기간의 치료실험을 통하여 이러한 효과의 장기간 지속성에 대한 검증이 필요할 것이다.

ABSTRACT

Paroxetine is a potent and selective serotoin re-uptake inhibitor. It is well known as an
effective and safe antidepressant and increasingly used for neurotic or non-psychotic
depression with anxiety symptoms. The present study assessed antidepressant and
antianxiety efficacy and tolerability of paroxetine against placebo in child-adolescent and
adult depressive neurosis patients. 232 subjects aged 8-55 years and meeting
DSM-ID-R
criteria for depressive neurosis or dysthymia were divided into 8 subgroups according to
their sex and age(8-1l years old,12-17 years old, 18-35 years old and 36-55 years
old
subgroups in each male and female group). In each subgroup, the randomly assigned
half of the patients were treated with paroxe-tine(10-30mg/day) and the others
with
placebo for the first 2 weeks in double blind fashion.After 1 week of drug-washout
period, paroxetine and placebo groups were crossed over. The depression and anxiety
symptoms were assessed with Hamilton Depression Scale(HDS) and Hamilton Anxiety
Scale(HAS) at baseline and every 1 week during the trial periods. The levels of
reduction in HDS and HAS scores from baseline after 2-week trial were compared
between paroxetine- and placebo- treated periods by paired t-test In all the 8
subgroups, statisti-cally significant differences between paroxetine and placebo were
found on the antidepressant efficacy after 2-week treatment The antidepressant efficacy
of paroxetine compared to placebo was most prominent in child and adolescent female
groups. On anxiety symptoms, paroxetine was also significantly more effective than
placebo. The antidepressant efficacy of paroxetine compared to placebo was
most
prominent in male and female child groups and young adult female group aged 18?5
years. As for the adverse effects of paroxetine, 3 out of 232 subjects reported mild
indigestion and abdominal pain. However, in all the 3 cases, the symptoms improved
without reduction of dosage or discontinuation of the drug. In conclusion, paroxetine
showed significantly higher antidepressant and antianxiety efficacy compared to placebo
in child-adoles-cent and adult depressive neurosis patients after 2-week
treatment
Further trials of paroxetine in depressive neurosis are warranted to elucidate the
long-term antidepressant and antianxiety efficacy of paroxetine.",김승태,1994,https://www.riss.kr/link?id=A99887896
영아 돌연사에 대한 고찰 (13 부검례를 포함한 34례 분석),"목 적 : 영아 돌연사에 있어서 그 역학적 특성을 알아보고 사인을 밝히는데 병력에 대한 자세한 검토, 사망 당시 상황에 대한 조사, 그리고 부검 및 대사 이상 검사 등 사후 검사의 중요성에 대하여 알아보고자 하였다. 방 법 : 1987년 2월부터 2001년 12월까지 14년 8개월간 갑작스런 사망으로 응급실을 방문한 1세 미만의 영아 34례를 대상으로 하여 이들의 임상기록을 후향적으로 조사하여 이들의 역학적 특성을 조사하였다. 과거 병력에 대한 검토, 사망 당시 상황에 대한 조사 및 부검을 실시한 13례의 기록과 2000년 이후 시행한 혈액, 소변, 담즙 및 간조직에서의 사후 아실카르니틴 및 유기산 분석 검사를 통하여 사망의 원인을 분석하였다. 결 과 : 1) 성별 및 연령별 분포 : 총 34례 중 남아 18명(52.9%), 여아 16명(47.1%)으로 남아에서 많이 발생하였고 연령별 분포는 생후 6개월 이하가 31례 (88.2%)로 가장 많은 분포를 차지하였다. 2) 사망시각은 오전 6-12시에 18례(52.9%)로 가장 많은 분포를 보였다. 3) 계절적 분포는 겨울에 가장 많이 사망하였고 13례(38.2%)였다. 4) 사망 발견시 수면 자세를 알 수 있었던 15례 중 복와위가 9례, 앙와위는 6례였다. 5) 병력과 사망 당시 상황으로도 죽음의 원인을 설명할 수 없는 경우가 23례였고 이중 부검을 실시한 13례 중 특이한 병리 소견을 발견할 수 없어 SIDS로 진단을 내린 경우가 7례였고 6례는 부검을 통하여 사망의 원인을 밝힐 수 있었다. 부검을 통해 밝혀진 사인으로는 심내막 섬유 탄성증 1례, 췌도 세포증 1례, 간의 지방 변화로 지방산 대사 이상을 의심할 수 있었던 2례, 경막하 및 경막외 출혈 1례, 기관지폐렴이 1례였다. 선천성 대사 이상 질환은 부검상 총 3례에서 의심되었으나 당시에는 대사 이상 검사가 시행되지 못하였고 2000년부터 시행한 대사 이상 검사에서는 모두 정상 소견이었다. 결 론 : 자세한 병력과 사망 상황에 대한 조사와 함께 부검은 사망의 원인을 밝히고 영아 돌연사 증후군을 진단하는데 필수적이라고 할 수 있으며 앞으로 우리나라에서도 부검의 중요성을 인지하고 이를 적극적으로 시행하여야겠고 지방산 대사 이상을 포함하는 대사 이상 검사도 아울러 적극적으로 시행하여야 할 것이다.",문여옥,2002,https://www.riss.kr/link?id=A3014124
소아 및 청소년 2형 당뇨병의 임상적 특징,"목 적 : 소아, 청소년기의 당뇨병은 대부분 1형 당뇨병으로 진단되어지나 최근에는 소아, 청소년에서도 2형 당뇨병이 전세계적으로 증가하고 있고 우리나라의 경우도 같은 양상을 보인다고 생각된다. 저자들은 소아, 청소년의 2형 당뇨병의 임상 양상에 대하여 고찰해 보고자 하였다. 방 법 : 1987년부터 2000년까지 서울대학교병원 소아과에서 2형 당뇨병으로 진단 받은 소아, 청소년 환자 33명을 대상으로 하였다. 당뇨병의 진단기준에 합당한 환자 중에서 체질량지수 25 이상의 비만을 보인 경우, 2형 당뇨병의 가족력을 가진 경우, 진찰상 흑색 극세포증을 보인 경우, 그리고 혈청 혹은 소변 C-peptide가 정상 혹은 증가된 경우 등의 2형 당뇨병의 진단을 지지하는 소견들 중 2가지 이상을 보이고 항GAD 항체가 음성일 경우를 임의적으로 2형 당뇨병으로 진단하였다. 또한 인슐린 치료가 필요하지 않거나 인슐린 치료를 받다가 끊을 수 있었던 경우는 위의 지지소견 들이 2가지 미만인 경우에도 2형 당뇨병으로 진단하였다. 대상 환자 33명의 병록지를 후향적으로 검토하여 환자들의 진단 당시의 임상 양상, 인구 통계학적 양상, 검사결과, 치료방법 및 반응 등에 대해 임상적인 고찰을 하였다. 인슐린 치료를 받은 환자 중 2년 이상 인슐린을 사용한 군과 2년 안에 인슐린을 끊을 수 있었던 군의 임상적 양상에 대해 비교하여 보았다. 결 과: 진단시 나이는 평균 $13.4{\pm}1.8$세로 10대 초반이 다수였다. 23명의 환자 중 16명(69.6%)이 진단 시 사춘기에 해당하였다. 평균 체질량지수는 $24.3{\pm}4.2kg/m^2$이었고 $25kg/m^2$ 이상의 비만을 보인 경우가 32명 중 16명(50%)이었다. 2형 당뇨병의 가족력이 있는 경우가 33명 중 24명(72.7%)이었다. 흑색극세포증은 6명(18.2%)에서 관찰되었다. 진단 당시 다음, 다뇨등의 증상을 보인 경우가 14명(42.4%)이었고, 요당이나 고혈당이 우연히 발견되어 진단된 경우가 19명(57.6%)이었다. 치료방법으로는 인슐린 단독치료가 25명(75.8%), 경구 혈당강하제 단독사용이 3명(9.1%)이었고, 두 가지를 같이 사용한 경우가 3명(9.1%), 운동과 식이요법 외에 약물치료를 하지 않은 경우가 2명(6%)이었다. 15명(45.5%)이 인슐린을 사용하지 않았거나 끊을 수 있었다. 진단 당시 다음, 다뇨와 같은 전형적인 당뇨병의 증상은 2년 이상 인슐린을 쓴 군에서 유의하게 많았다(P<0.05). 결 론: 소아, 청소년에서의 2형 당뇨병은 증상의 발현이 뚜렷하지 않으며 사춘기, 비만, 가족력과 관계가 깊었다. 소변과 혈청에서의 C-peptide 농도 측정에서 증가 또는 정상 소견이 보일 경우, 췌세포 자가 항체가 음성인 경우 2형 당뇨병으로 진단할 수 있으나 좀 더 나은 1형 당뇨병과의 감별방법 개발이 필요하다고 생각된다. 다수의 2형 당뇨병 환자에서 초기에 인슐린 투여를 필요로 하였고 혈당 조절이 호전된 후 끊을 수 있었으나 진단 시 증상을 보이는 경우 인슐린을 지속적으로 필요로 하는 경우가 많았다.",이성용,2002,https://www.riss.kr/link?id=A3014070
라마즈 출산교육 참여자의 분만경험,"1 김순희, ""출산준비교육이 초산모의 입원시 불안, 분만진통 및 분만경험 지각에 미치는 효과"" 병원간호사회 8 (8): 129-145, 2002",여정희 ( Jung Hee Yeo ),2010,https://www.riss.kr/link?id=A100133911
산후출혈로 인한 응급 자궁절제술의 적용 및 예후,"목적 산후출혈로 응급 전자궁절제술을 시행받은 환자와 보존적 치료를 시행받은 환자의 임상양상과 예후를 비교 분석해 보고자 한다. 연구방법2004년부터 2011년까지 개인병원 및 본원에서 분만 이후 발생한 일차성 산후출혈로 치료받았던 환자들 중 본원에서 자궁을 절제한 환자 29명과 자궁을 보존한 39명을 포함한 68명을 대상으로 의무기록을 통하여 후향적 분석을 시행하였다 결과 산후출혈로 자궁을 절제한 환자와 자궁을 보존한 환자 간의 평균연령, 체질량지수, 분만력, 산후출혈의 원인 및 유도분만의 유무는 차이가 없었다. 그러나 자궁절제술 환자에서 내원 시 더 낮은 평균혈압(83.62/48.01 ± 19.16/21.68 mm Hg vs. 96.10/64.12 ±16.17/22.8 mmHg), 높은 평균 심박동수(114 ±21.68/min vs. 96.10 ± 22.8/min), 낮은 혈색소농도(6.99 ± 3.06 g/dL vs. 8.34 ± 2.1 g/dL)를 보이며 자궁을 보존한 환자들과 통계적 유의한 차이를 나타냈다(P = 0.0007, 0.0017, 0.0358). 결론 산후출혈 환자가 혈역학적으로 불안정할수록 응급 전자궁절제술의 가능성이 높았고, 응급 전자궁절제술을 시행한 군은 재원기간도 길고합병증 발생률도 높았다. 따라서 분만 후 활력징후, 자궁수축 및 질출혈에 대한 잦은 모니터링을 통해서 활력징후가 불안정화되기 전에 적절한 처치를 시행한다면, 불필요한 자궁절제술을 막고 산후출혈로 인한 불량한 예후를 최소화할 수 있을 것으로 생각된다.",이경복 ( Kyung Bok Lee ),2012,https://www.riss.kr/link?id=A82704846
최신임상강좌 : 요실금 수술 후 발생한 배뇨장애의 처치,"최근 요실금 수술이 증가함에 따라 수술 후 배뇨장애가 문제가 되고 있다. 요실금 수술 후 배뇨장애를 가진 환자는 주로 저장증상 또는 배뇨증상이 나타나며 진단을 위해서는 수술 전 환자의 배뇨상태를 파악하는 것이 도움이 된다. 요실금 수술 후 배뇨장애의 진단은 병력 청취, 이학적 검사, 요검사, 잔뇨량 검사를 기초로 하며 요역동학 검사, 방광경 검사를 이용한 정보도 유용하다. 치료로는 우선 자가됴뇨, 수분제한, 항콜린성약제, 골반근육운동 등의 보존적 치료를 시행하며 효과가 없을 경우 수술적 치료를 한다. 이전 요실금 수술이 중부요도 슬링인지 다른 시술인지에 따라서 수술 시기 및 방법이 달라지므로 이를 구별하는 것이 중요하다. 최근 중부요도 슬링의 경우 빠른 시기에 테이프를 이완하거나 절단하는 방법으로 좋은 성적이 보고되고 있다. 요실금 수술 후 배뇨장애를 예방하는 가장 좋은 방법은 수술 시 과도한 장력을 피하는 것이므로, 항상 이를 염두에 두고 수술을 시행하여야 하겠다.",구천회 ( Chun Hoe Ku ),2010,https://www.riss.kr/link?id=A101971648
편두통 유사 증상을 보인 갑상샘기능항진증 1례,"편두통은 소아청소년에서 흔한 질환으로 조기에 정확한 진단과 적절한 치료가 환자의 삶의 질을 높이는데 매우 중요하다. 정확한 진단을 위해서 두통의 2차적 원인을 감별해야 하는데, 매우 드문 질환이 원인인 경우는 어려움이 따른다. 최근 2차적 원인 중에서 갑상샘기능이상이 드물게 두통과 관련이 있다는 보고가 있다. 저자들은 갑상샘기능항진증으로 인하여 편두통 증상을 보인 환아 증례를 치험하였기에 보고한다. 15세 남아가 2주전부터 처음으로 시작된 주당 4회 정도의 심한 두통(7-8시각 아날로그 척도)을 호소하며 외래 통해 입원하였다. 두통의 통증 부위는 주로 앞이마 부위로 2-3시간 정도 지속되었으며 구역 증세도 동반하였다. 두통 동안에 30초 정도의 어지러움과 시야흐림 증상이 있었다. 생체 징후는 안정적이었으며 뇌자기공명영상 검사에서 특이소견 보이지 않았다. 말초혈액 검사에서 특이소견 보이지 않았으나 호르몬 검사에서 갑상샘 자극호르몬 수치가 0.076 μIU/mL로 증가되어 있었고, T3 >800 ng/dL, free T4 2.19 ng/dL로 증가되어 있었다. 갑상샘 초음파 검사에서 불균일한 저에코양상을 보였으며, 핵의학 검사에서는 양측 갑상샘 동위 원소 섭취율이 1.2%로 감소되어 있었다. 최초에 임상적으로 무조짐편두통을 의심하였으나, 갑상샘기능 항진증 진단 하에 methimazole(15 mg/day)로 치료를 시작하였다. 15일간 투약 후 두통증세 호전되었으며 갑상샘 호르몬 기능도 정상으로 돌아왔다. 소아두통환자에서 설명되는 않는 두통 설명되지 않는 두통 특히 만성 혹은 두통병력이 없는 환자가 갑자기 심한 두통을 호소하는 경우 등의 환자에서는 갑상샘 기능검사에 대한 검토도 필요할 것으로 생각된다.",양원준(Won Jun Yang),2016,https://www.riss.kr/link?id=A19593909
놀이정신치료,"놀이정신치료의 역사와 분류를 통해 놀이정신치료의 다양한 발전 과정을 살펴보았고, 놀이의 기능과 임상적 응용을 통해 기본 개념과 실제적 요소를 짚어 보았으며 주요 치료적 접근에서는 대표적 치료 방법인 정신분석적 기법과 비지시적 치료의 이론과 실제기법을 정리하여 소개하였다. 또한 놀이치료에서의 발달론적 접근을 이해하기 위해 발달과정으로서의 놀이, 그 치료적 적용, 인지발달적 측면 그리고 치료과정에 대해 조명해 보았다.
중심 단어 : 놀이정신치료ㆍ역사와 분류ㆍ놀이의 기능과 임상적 응용ㆍ주요 치료ㆍ발달론적 접근",곽영숙,2000,https://www.riss.kr/link?id=A101840647
소아연령에서의 2형 당뇨병의 임상적 고찰,"목 적 : 최근에 비만증의 증가와 함께 소아에서 2형 당뇨병의 발생 빈도가 증가하는 경향이 있어 우리나라 소아 연령에서 2형 당뇨병의 발생빈도 및 그 특성을 규명하고자 본 연구를 시행하였으며 자궁내 성장지연과의 관계도 분석하였다. 방 법 : 1990년 3월에서 2000년 12월까지 연세의료원 소아과에서 2형 당뇨병으로 진단받은 소아 25명을 대상으로 분석하였다. 결 과 : 소아에서 1형 당뇨병과 2형 당뇨병은 1990년 이후에 모두 증가하였으며 소아에서 발병한 당뇨병 중 2형이 차지하는 비율은 연도별로 볼 때 1990년에 5.3%(1/19)였던 것이 2000년에 21.0%(8/38)로 급격히 증가하였다. 총 25명 중 비만군이 68%(17/25)였고 비비만군이 32%(8/25)였다. 진단 당시의 주증상은 다음, 다뇨, 다식 증상이 48%(12/25), 학교 신체 검사에서 무증상 당뇨로 발견된 경우가 40%(10/25)였고 그외 체중 감소, 비만으로 우연히 발견된 경우였다. 진단당시 평균 연령은 $12.9{\pm}1.8$세였다. 25명 중 64%(16/25)에서 당뇨병의 가족력이 있었다. 자가항체 검사는 18.1%(4/22)에서 양성이었다. 총 7례에서 동반 질환이 있었으며 비만과 관련하여 지방간 등이 있었다. 치료는 모두 진단 후 경구용 혈당 강하제를 사용하였고 혈당 조절이 잘 되지 않았던 3명에서 인슐린을 추가하였다. 장기 합병증은 4명에서 발생하였다. 자궁내 성장지연은 9명에서 있었고 이들 중 8명은 비 비만군 당뇨병이었다. 결 론 : 최근 비만증과 관련되어 소아에서 2형 당뇨병이 증가하는 추세이고 비비만군 당뇨병 환아에서는 자궁내 성장 지연이 상관관계가 있으리라고 생각되며 소아에서 2형 당뇨병은 국가적인 차원에서 예방 및 치료책이 제시되어야 할 것이다.",박지민,2002,https://www.riss.kr/link?id=A60179031
한국판 아동용 Leyton 강박증 척도의 개발,"요 약

소아의 강박증 평가 도구인 아동용 레이톤 강박증 척도를 한국판 집단용 지필 검사로
개발하기 위하여 본 연구를 시행하였다. 국민학교 4학년부터 고등하교 3학년까지 127
명을 대상으로
한국어로 번역한 지필 검사 양식의 아동용 레이톤 강박증 척도를 실시하였고, 검사-
재검사 신뢰도
검증을 위하여 3주뒤에 82명에게 재검사를 시행하였다. 또한 전 대상 군에 신뢰도와
타당도가 이미
입증된 간이진단검사(SCL90-R)를 함께 실시하여 공존타당도가 있는 지를 알아 보았
고, 강박환아군과
정신과 환아대조군 그리고 정상대조군을 9명씩 비교하여 진단 변별력이 있는 지를 보
았다.

검사-재검사 신뢰도, 내적 일관성 등은 상당히 만족스러운 수준이었고, 간이진단검사와의
공존
타당도도 비교적 높게 나왔다. 강박환아군이 정신과 환아대조군이나 정상 대조군보다
유의하게 높은
점수가 나와서 변별력 또한 높은 것으로 나타났다. 요인분석상 문항들을 5개의 요인
으로 묶을 수
있었다. 한편 증상과 저항척도에서 여아가 남아보다 유의하게 높은 점수를 보고하였
으며, 특히
국민학교 여아에서 높은 점수를 보여 주었다.

결론적으로 한국판 아동용 레이톤 강박척도는 실시하기 간편하고, 신뢰도와 타당도가 좋은
척
도임 이 입증되 었다. 향후 전국 규모의 규준을 작성하고, 미흡한 부분을 보완한 후속
연구가 필요하다.

ABSTRACT

Objects : This study was carried out to develop the Korean form of Leyton Obsessional
Inventory-Child Version(LOI-CV) designed to assess the obsessive compulsive
symptoms in
children and adolescents. The LOI-CV was modified into a paper-and-pencil form in
order
to administer it to group.

Methods : We applied the Korean form LOI-CV to 127 elementary, middle and high
school
children, and retest it to 82 children with 3 weeks interval. Togather with LOI-CV,
Korean
form of SCL-90-R which had been proved its reliability and validity, were administered
to
the all subjects for examininig of concurrent validity And then we examined whether
this
scale discriminates between obsessive patients, psychiatric controls and normal controls
in the
level of obsessive symptoms.

Results : Test-retest reliability, internal consistency were very satisfactory. Concurrent
validity
with SCL-90-R was moderate level. And obsessive patients was scored significantly
higher than
psychiatric and normal controls in the level of obsessive symptoms. In factor analysis,
items
are clustered to 5 factors. In the global obsessive symptom, obsessive scores of female
elimentary
school students were higher than that of male students.

Conclusions : These results indicate that the Korean form of LOI-CV is a reliable and
valid
self-rating scale to assess the obsessive-compulsive symptoms in Korean children and
adolesce-
nts. Author suggests that future research is needed for Korean version standardization
study
in normal and clinic-refered population.",홍강의,1994,https://www.riss.kr/link?id=A76499525
발달 지연아에서 K-ASQ(Korean-Ages & Stages Quest ionnaires) 발달 선별 검사와 베일리 영유아 발달 검사의 비교,"목 적 : 영유아 건강 검진에서 발달장애아를 조기선별하기 위하여 K-ASQ 선별검사(Korean Ages& Stages Questionnaires, 부모 작성형 유아 모니터링 체계)가 사용되고 있다. K-ASQ 선별검사의 분별력을 확인하기 위하여, 본원에 발달 지연으로 내원한 아동들을 대상으로 베일리 영유아 발달검사(BSIDII)와 K-ASQ 선별검사를 병행하여 두 검
사법간의 성적을 비교 분석하였다.방 법: 2008년 1월부터 2009년 8월까지 대구가톨릭대학교 병원 소아청소년과에 발달 지연으로내원한 월령 8개월부터 39개월 아동 129명(남아94 명, 여아 35명)을 대상으로 베일리 영유아 발달
검사와 K-ASQ 선별 검사를 동시에 시행하였다.베일리 영유아 발달 검사에서 산출된 인지 발달 지수에 따라 3군(심각한 지연을 보이는 70 미만인 1군, 경도의 지연을 보이는 70-84 인 2군, 정상 범위 85 이상인 3군)으로 나누어 K-ASQ 선별 검사와 비교하였다.결 과:제 1군 81명에서 80명, 그리고 제 2군38명에서 33명이 K-ASQ 선별 검사에서 한 개 영역이상에서 절선보다 낮은 결과를 보였다. 제 1군의나머지 1명은 절선보다 낮은 점수를 보이는 영역은없었으나, 근접한 점수를 보이는 영역은 있었다. 제2군의 5명은 절선보다 낮은 점수는 없었는데, 이중3명은 절선에 근접한 점수를 보이는 영역이 있었다.결 론 : 발달 지연이 있는 아동들을 대상으로 베일리 영유아 발달 검사와 K-ASQ 선별 검사를 병행하여 비교하였을 때 높은 일치를 보였다. K-ASQ선별 검사에서 절선 점수보다 낮은 점수를 보이는경우 뿐 아니라, 낮은 점수는 없이 근접한 점수만을보이는 경우에도 발달 지연을 의심하고 전문기관으로 의뢰하여야 하겠다.",김문선(Moon-Sun Kim),2010,https://www.riss.kr/link?id=A19593888
