
간호대학생의 범문화 효능감과 문화적 공감이 인간중심간호역량에 미치는 영향,"Purpose : Establishing competency in person-centered care is crucial for providing high-quality nursing care in diverse clinical settings and adapting to changing roles in different situations. This study aimed to explore the level of transcultural self-efficacy, cultural empathy, and person-centered care competency among nursing students, as well as identify the factors influencing their person-centered care competency. The findings will serve as fundamental data to enhance person-centered care competency.
Methods : A questionnaire consisting of items on general characteristics, person-centered care competency, transcultural self-efficacy, and cultural empathy was administered to 175 nursing students in G city. Data were collected from March 5, 2023, to March 20, 2023. The collected data were analyzed using the SPSS 23.0 program. Pearson's correlation coefficients were used to examine the correlation among transcultural self-efficacy, cultural empathy, and person-centered care competency. Multiple regression analysis was employed to determine the factors influencing person-centered care competency.
Results : The person-centered care competency scores were above the average level and varied according to department satisfaction (F=13.79, p<.001), subjective well-being (t=3.34, p=.015), and interpersonal relations (F=5.74, p=.001). Person-centered care competency exhibited a significant positive correlation with cultural empathy (r=.51, p<.001) and transcultural self-efficacy (r=.49, p<.001). Regression analysis confirmed that cultural empathy (ß=.39, p<.001) and transcultural self-efficacy (ß=.22, p<.001) were influential factors for nursing students' person-centered care competency, with the model explaining 37 % of the variance.
Conclusion : Cultural empathy and transcultural self-efficacy are significant factors influencing the person-centered care competency of nursing students. It is crucial to encourage nursing students to develop person-centered care competency by fostering cultural empathy and transcultural self-efficacy. Further research is needed to identify additional factors affecting person-centered care competency among nursing students. Additionally, the development of education programs aimed at enhancing person-centered care competency is necessary.",류은진,2023,https://www.riss.kr/link?id=A106838841
척주세움근의 키네시오 테이핑이 허리가동범위와 허리통증에 미치는 영향,"Purpose : To retestify about the changes of the range of motion and pain from kinesiotaping the erector spinae muscle. Method : Targeted the number of 30 people with low back pain and measured lumbar range of motion and pain before kinesiotaping on the erector spinae muscle. After that, the measured value were compared and analyzed. Result : First, before and after kinesiotaping, doing skin distraction test, the changes of the skin distance within each experiment group all statistically showed meaningful differences(p<0.05). Secondly, before and after kinesiotaping and testing pain threshold, it statistically showed meaningful differences(p<0.05). Conclusion : Both two groups showed that the change of the skin distance increased and the pain averagely decreased than before taping. Therefore, kinesiotaping is considered that it affected the low back, the range of motion and pain.",박종항 ( Jong Hang Park ),2015,https://www.riss.kr/link?id=A108728556
집단 미술치료 프로그램을 통한 장애아동 어머니의 자아존중감과 양육효능감 변화,"Purpose : In this study, a group art therapy program was applied to mothers who are the main rears of disabled children to confirm its effect by comparing the self-esteem and parenting efficacy of the mothers prior to and after the program.
Methods : 17 subjects recruited by using the 2-group prior-after control group study design method were randomly allocated. The study was conducted on 8 subjects in the experimental group for whom an art therapy program is applied and 9 subjects in the control group. The experimental group was subjected to group art therapy lasting 60 minutes once a week. Activity goals and contents were predetermined for each subject for each session, and a total of 10 sessions of the program was applied for 10 weeks. Self-esteem and parenting efficacy prior to and after the program of the subjects were measured by using corresponding self-esteem and parenting efficacy scales. Measurement data were analyzed by using the Mann-Whitney Test.
Results : It was possible to observe that the self-esteem and parenting efficacy of the subjects in the experimental group to whom the art therapy program was applied underwent more significant changes in comparison to those of the control group (p<.01).
Conclusion : Group art therapy induces social support experiences of group therapy and an improvement of an assertive attitude towards art therapy. Since there was a significant improvement of self-esteem and parenting efficacy in the results of this study when the group art therapy program is applied, it is believed its clinically meaningful application would be possible. In particular, it can be utilized in programs for disabled children in a family unit from the perspective that it improves parenting efficacy, which can impart an affirmative effect not only to the main rear but also to all the family members.",송은주,2023,https://www.riss.kr/link?id=A101721002
"유산소운동과 근력운동이 노인의 하지근력과 통증, 균형에 미치는 영향","Purpose : The purpose of this study was to improve the quality of life of people aged 65 and over by reducing musculoskeletal pain and increasing balance and muscular strength in their lower-extremities through aerobic exercises and the use of Thera-Bands and gym balls.
Method : Fifteen out of 30 women who used a welfare center for the elderly in C City performed exercises using Thera-Bands and gym balls, and the remaining 15 elderly women did aerobic exercises. Both groups performed their respective exercises three times a week over a four-week period, for 50 minutes each time. Pain (VAS), balance (TUG), and lower extremity muscular strength were measured as evaluation tools. The data were analyzed using the statistical software SPSS 18.0 for Windows. The Wilcoxon signed-rank test was performed to compare the differences within each group, and the Mann- Whitney U test was used to compare the two groups in terms of their differences both before and after the participants` respective exercise programs.
Results : No differences were found between the two groups, although there were some differences within each group in terms of levels of pain, muscular strength, and balance.
Conclusion : The aerobic and muscle strength exercise programs had positive effects on all variables, including pain, balance, and muscular strength in the lower extremities. Therefore, the combination of aerobic and muscle strength exercises may be effective in improving the quality of life of elderly people.",안성자 ( An Seongja ),2017,https://www.riss.kr/link?id=A108601101
"간호대학생의 자기효능감, 전공만족도, 대학생활 적응과의 관계","Purpose : The purpose of this study was to identify the self-efficacy, major satisfaction, and degree of adjustment to college life of nursing students and the relationships among the foregoing.
Methods : This study was conducted with 319 nursing students in B city from May to June 2019. The collected data were analyzed with frequency, percentage, mean and standard deviation, t-test, ANOVA, Scheffe's test, and Pearson Correlation Coefficient using the SPSS / WIN 22.0 program.
Results : The self-efficacy score of nursing college students was shown to be 2.95±0.32 points, major satisfaction score was shown to be 3.83±0.55 points, and college adjustment score was shown to be 3.52±0.55 points. The degrees of adjustment to college life were significantly different according to general characteristics of nursing students as follows; grade (F=6.614, p=.000), health condition (F=13.384, p=.000), club activities (t=4.557, p=.000), happiness index (F=32.094, p=.000), part-time job (t=2.781, p=.006), and motive of major selection (F=7.300, p=.000). The adjustment to college life of nursing students showed a weak negative correlation with self-efficacy (r=-.196, p<.001) and a strong positive correlation with major satisfaction (r=.782, p<.001). Major satisfaction and self-efficacy showed a weak negative correlation (r=-.185, p<.001).
Conclusion : Through the results of this study, it can be seen that repetitive studies are necessary in relation to the self-efficacy, major satisfaction, and college adjustment of nursing students, and that interest in effort for the development of programs that can improve nursing students’ major satisfaction and college adjustment are necessary.",정경순,2019,https://www.riss.kr/link?id=A103330374
뇌졸중 환자의 동작관찰훈련이 보행에 미치는 효과에 대한 메타분석; 국내연구를 중심으로,"Purpose : The purpose of this study was to investigate the meta-analysis on the effects of action observation training on stroke patients‘ walking.
Methods : Domestic databases (DBpia, KISS, NDSL, and RISS) were searched for studies that conducted randomized controlled trials (RCTs) associated with action observation training in adults after stroke. The search outcomes were items associated with the walking function. The 18 studies that were included in the study were analyzed using R meta-analysis. A random-effect model was used for the analysis of the effect size because of the significant heterogeneity among the studies. Sub-group and meta-regression analysis were also used. Egger’s regression test was conducted to analyze the publishing bias. Cumulative meta-analysis and sensitivity analysis were also done to analyze a data error.
Results : The mean effect size was 2.77. The sub-group analysis showed a statistical difference in the number of training sessions per week. No statistically significant difference was found in the meta-regression analysis. Publishing bias was found in the data, but the results of the trim-and-fill method showed that such bias did not affect the obtained data. Also, the cumulative meta-analysis and sensitivity analysis showed no data errors.
Conclusion : The meta-analysis of the studies that conducted randomized clinical trials revealed that action observation training effectively improved walking of the chronic stroke patients.",고운,2019,https://www.riss.kr/link?id=A106480632
"운동치료, 심리치료 및 식이요법이 포함된 통합비만관리프로그램이 산업체에 근무하는 비만 환자의 체성분 및 혈액성분에 미치는 영향","Purpose : The purpose of this study was to find out how changes in body shape of obese patients could be affected by the combined management of diet and psychotherapy along with exercise therapy to control energy imbalance, the cause of obesity.
Methods :In this study, the aerobic exercise program was conducted on 12 employees of D Company for a total of eight weeks for obese patients with a high body mass index (25 kg/m2 or higher). The experimental group did not apply the program three times a week. The body type analysis was carried out using the body analyzer (Inbody, Korea) and blood test and psychological test were performed after 8 weeks of exercise before and after exercise
Result : The results of the group showed a change in weight loss of 7.6kg (p=0.002) on average, which is nearly 10% of the change in weight. It was also shown that the BMI (body mass index) decreased by -2.4 kg/m2 (p=0.002). Abdominal fat (AO) is also -0.14% (p=0.002), waist circumference (WC, -7cm, p=0.002), internal fat (VF, -27%, p=0.002), liver function levels AST (6.5U/L, p=0.04), ALT (-14.6 U/L, p=0.0044g/mL), total cholesterol, pTC -16.
Conclusion : Based on the results of this study, the obesity management program will be able to maximize the effects of obesity control if exercise programs and psychotherapy are combined.",서동권,2019,https://www.riss.kr/link?id=A106480581
"탄성밴드를 이용한 저항운동이 뇌졸중 환자의 근력, 근긴장도, 균형 및 보행에 미치는 영향: 예비 연구","Purpose: The purpose of this study was to identify whether resistance exercise using elastic band for 6 weeks could improve the muscle strength, muscle tone, balance and gait in stroke patients.
Method: Eleven stroke patients who had agreed with the study were randomly divided into 3 groups categorized as resistance exercise using elastic band training combined with less affected side training group (experimental group 1, n=4), affected side training group (experimental group 2, n=3), and both side training group(experimental group 3, n=4). The muscle strength, muscle tone, balance and gait were assessed by hand-held dynamometer, Modified Ashworth Scale (MAS), Berg Balance Scale and G-walk at before training and after training. Wilcoxon signed rank test was used to analyze change before and after intervention in intra-group. Kruskal Wallis H test, Mann-Whitney U test were used to analyze changes of all variables in inter-groups.
Result: All the muscle strength except the affected knee flexor and extensor muscle were increased in all three groups but no significant difference. There was no change in muscle tone(MAS) in all three groups. All three groups showed an increase in BBS scores but no significant difference. Walking speed and walking symmetry were increased in all groups but there was no significant difference following training. The changes of affected step length in the experimental group 1 were significantly greater than them of the experimental group 3. The changes of affected step length in the experimental group 3 were significantly greater than them of the experimental group 2.
Conclusion: The result of this study suggest the resistance exercise using elastic would be a potential intervention to improve muscle strength of lower extremities, balance and gait in stoke patients.",안소영,2019,https://www.riss.kr/link?id=A106480593
목과 어깨근육 운동프로그램이 전방머리자세의 척추-골반 정렬 변화에 미치는 영향,"Purpose : Excessive computer use frequently results in musculoskeletal disorders of the neck and shoulder such as forward head posture (FHP). The purpose of this study was to investigate effects of neck and shoulder exercise program on spino-pelvic alignment and the correlation between change in head and neck posture and spino-pelvic alignment in FHP.
Methods : The study included 44 participants with FHP. The participants performed the exercise for correction of FHP 2-3 times a week for 4 weeks. We examined whole spine X-ray images in the lateral standing position with both arms crossed. We measured anterior head translation distance (AHT), craniovertebral angle (CVA), cervical lordosis (CL), thoracic kyphosis (TK), lumbosacral lordosis (LSL), sacral slope (SS), pelvic tilt (PT), and pelvic incidence (PI) of the subjects. The association between change in AHT and each spino-pelvic parameter was also subjected to Pearson’s correlation coefficient analysis.
Results : There were statistically significant differences before and after exercise in the parameters of AHT, CVA, and SS (p<.05). Significant negative correlation was observed between the change in AHT and CVA (r=-.768, p<.001), and CL (r=-.388, p<.05). There was significant positive correlation between the change in AHT and SS (r=.328, p<.05), and PI (r=.333, p<.05). However, no significant correlation was observed in change in AHT with that of TK, LSL, and PT.
Conclusion : Based on the above results, we conclude that there is a relationship between change in AHT, which is a parameter associated with forward displacement of the head, and that of CVA, CL, SS, and PI after exercise in cases of FHP.",강효정,2019,https://www.riss.kr/link?id=A106480574
탄성 밴드를 이용한 노인운동프로그램이 노인의 우울과 신체적 자기효능감에 미치는 영향,"Purpose : The purpose of this study was to determine the influence of the exercise program with elastic-band for elderly who over than 65 years old in terms of depression and physical self efficacy disabilities. We aim to suggest exercise program with elastic-band interventions for elderly.
Methods : The study subject was selected female or male 65 years old or over who can walk without assistance, possible to talk daily living without mental or physical disorder. Total eight subjects were participated who understood the purpose of this study and agreed to participate. Before and after exercise program, the subjects was monitored for the change in their physical self-efficacy and depression. To measure the physical self efficacy, we used perceived physical ability scale and physical self presentation confidence scale (Cronbach α=0.942). To measure depression, we used geriatric depression scale short form (Korea version, Cronbach α=0.969). The data obtained from each measure were analyzed using Wilcoxon signed rank test to determine the change of before and after exercise program. The exercise program consists of three part (warm-up, main exercise and cool-down), including upper extremity, lower extremity and trunk exercise with elastic-band(yellow and red). The program last for 15 weeks, once a week, lasting for 60 min.
Results : After 15 weeks of elastic-band exercise program, there was significant decreased on depression scale (p<0.05) and significant improve on physical self-efficacy scale (p<0.05).
Conclusion : Based upon our result, we demonstrated that the exercise program using the elastic-band was effective on the improvement of depression and physical self-efficacy of the elderly.",박우권,2019,https://www.riss.kr/link?id=A106480631
호흡 기능 향상을 위한 들숨근 강화 훈련 방법 : 위팔운동을 동반한 가로막 호흡과 파워브리드 호흡의 효과 비교,"Purpose : It was to compare changes in respiratory function (pulmonary function, inspiratory function) after four weeks of inspiratory muscle strengthening training (diaphragmatic breathing with upper arm exercise, Power-Breathe breathing) for 36 healthy people.
Methods : Subjects were randomly assigned to diaphragmatic breathing with upper arm exercise (Group Ⅰ) and Power-breathe breathing (Group Ⅱ) was conducted by the protocol for four weeks five times per week. As the main measurement method for comparison between groups For pulmonary function, Forced Vital Capacity (FVC) and Forced Expiratory Volume at One second (FEV1) were used, and for inspiratory function, Maximum Inspiratory Capacity (MIC), Maximum Inspiratory Pressure (MIP), and Maximum Inspiratory Flow Rate (MIFR) were used.
Results : In changes in pulmonary function between groups, FVC and FEV1 showed no significant difference, and in inspiratory function changes, MIC showed no significant difference, but in MIP and MIFR, Group B significantly improved over Group A.
Conclusion : The progressive resistance training using the Power-breath device applied to the inspiratory muscle did not show a significant difference in the increase in the amount of air in the lungs and chest cage compared to the diaphragmatic breathing training accompanied by the upper arm exercise. However, by increasing the air inflow rate and pressure, it showed a more excellent effect on improving respiratory function.",이건철 ( Keon-cheol Lee ),2021,https://www.riss.kr/link?id=A106480584
짐볼을 이용한 교각운동 시 탄성밴드 저항 유·무에 따른 근탄성도의 변화,"Purpose : The purpose of this study was to compare and analyze whether there are changes in muscle elasticity when resistance using an elastic band is present or absent during a bridge exercise on an unstable surface with a gymball.
Methods : Eighteen healthy adult college students attending E University in Gyeonggi-do, who voluntarily agreed to participate were included in this study. The subjects were instructed to perform the bridge exercise using a gymball both without resistance and with resistance using an elastic band. Myoton was used during the exercise to measure the elasticity of the rectus abdominis and biceps femoris muscles.
Results : There was a significant difference in the stiffness of the rectus abdominis muscle on both sides before and after using the elastic band (p< .05). however, no significant difference was observed in the biceps femoris on either side (p >.05). Based on the evaluation of the frequency before and after using the elastic band, no significant difference was observed between the rectus abdominis and biceps femoris muscles on both sides (p>.05). The logarithmic decrement was significantly different in the right rectus abdominis muscle (p< .05), and there was no significant difference in the left rectus abdominis and both biceps femoris (p >.05).
Conclusion : Resistance exercise using an elastic band is more effective in improving elasticity of the rectus abdominis muscle than without a elastic band during bridge exercise with a gymball.",김명철 ( Myung-chul Kim ),2021,https://www.riss.kr/link?id=A106480583
전방머리자세 대상자에 대한 목운동과 골반운동이 척추 굽이에 미치는 효과,"Purpose : The purpose of this study was to compare the effect of pelvic exercise on the CVA and spinal curve in adults with forward head posture compared to the group using only neck exercise when pelvic exercise was performed in parallel with conventional neck exercise.
Methods : GPS 400 and Formetric were used to identify craniovertebral angle (CVA), thoracic kyphosis, lumbar lordosis, and pelvic torsion and were measured by an experienced research manager. Forward head posture (FHP) was selected for people whose angle between the line connecting the ear ball and the seventh cervical spine and the horizontal line is 50 degrees or less. The 30 selected students were randomly divided into 15 experimental groups and 15 control groups. Mackenzie exercise and sling exercise were performed for neck exercise in both the experimental group and the control group, and pelvic exercise using a Swiss ball was additionally performed in the experimental group. All data collected in this study were analyzed using SPSS statistics 21.0. Cervical vetebral angle (CVA), thoracic kyphosis, lumbar lordosis, and pelvic torsion were compared at 0 weeks, 3 weeks, and 6 weeks for each measurement factor using ANOVA with repeated measures. For the statistical significance test, the significance level of α was set to .05.
Results : The changes of pelvic torsion, thoracic kyphosis and CVA due to pelvic exercise using Swiss Ball and neck exercise were changed over time, but lumbar lordosis were not changed. And there were no significant differences among the groups.
Conclusion : In conclusion, the pelvic correction exercise is considered to be an effective exercise for correcting the FHP and requires regular pelvic correction exercises. We expect the results to be used in clinical trials.",배원식 ( Won-sik Bae ),2021,https://www.riss.kr/link?id=A106480578
플라스틱 단하지보조기 중재가 뇌졸중 후 편마비 성인의 보행과 균형에 미치는 효과: 국내 학위 논문을 중심으로 고찰,"Purpose : The aim of this study was to investigate the effects of plastic ankle foot orthosis on adult post-stroke hemiplegic patients walking ability and balance. Method : The searched for the case controlled clinical trials about the effects of plastic ankle foot orthosis(pAFO) for walking ability and balance using quantitative gait analysis in adult post-stroke patients. Ten trials were selected from Riss4U databases published until June 2016 in Korea. The selected trials contained a control group with pre-test and post-test design, measured walking ability and balance as a dependent variable. Result : The selected ten trials involved a total of 180 patients. The walking speed, cadence, the portion of double limb supporting, stride length on affected side were improved by plastic ankle foot orthosis. Conclusion : The plastic ankle foot orthosis has some evidence to improve the walking ability and balance in post-stroke hemiplegic patients.",조병모 ( Cho Byeongmo ),2016,https://www.riss.kr/link?id=A107833040
