
감각통합치료가 뇌성마비 아동의 일상생활 기능에 미치는 효과 - 캐나다 작업수행 측정을 이용하여 -,"Objective : The objective of this case study is to search the effects of sensory integration treatment. First we have taken a child with a cerebral palsy and given him/her sensory integration treatment. Then, we intended to look into whether the child performed his daily-life tasks and how satisfactory the parents were with the treatment. Methods : We have chosen a child with a cerebral palsy and tested his sensory integration functions. Applying the 30 minutes-sensory integration treatment twenty times to the child, we compared the result of the treatment using Canadian Occupational Performance Measure. We counseled the parents of the child before and after the treatment. Results : We have rated the problems with the degrees of importance referring to the parents. Important problems include controlling eliminations, having meals, moving by self, interacting with peer groups, and performing delicate hand-movements. The score of the in the performance is 1.2 and the score of the degree in the satisfaction is 1.4 compared with the total score. Conclusion : We have concluded that the sensory integration treatment has the effective result to the daily-life task performances of a child with a cerebral palsy, a kind of sensory integration dysfunction and satisfies the child's parents after this case study.",권분정,2003,https://www.riss.kr/link?id=A82712641
"청지각 훈련과 병행한 감각통합치료가 발달지연 아동의 감각처리, 시 지각 발달, 주 의집중에 미치는 영향","Objective : The purpose of this study is investigate the effects of sensory integration combined with auditory treatment on the sensory processing, visual perception and attention ability of children with developmental delay. Methods : A combined treatment of auditory training and sensory integration therapy was implemented to 3 children aged 4 to 7 and diagnosed with developmental delay during 9 weeks period from December 2016 to January 2017. ABA' design which is one of single subject research designs was used in this study. Baseline A had 4 sessions, intervention B had 15 sessions, and baseline A’ had 4 sessions, so 23 sessions were applied in total. During the baseline A and A 'periods, visual perception ability was measured by K-DTVP-2 (Korea Developmental Test Visual Perception-2) and sensory processing ability was evaluated by sensory profile. The maintenance time of attention was measured with the absence of intervention for the baseline period, and for the intervention period, it was measured at 10 minutes break time which was provided after the intervention. The children’s attention time during a fine motor task provided were measured using video recorder with the interval recording method, and the interval for the evaluation was 30 seconds. Results : No statistically significant difference were found in the visual perception function and sensory processing scores before and after treatment. Attention of participant A enhanced significantly while that of participant B and C did not improve significantly. Conclusion : It is hard to conclude that sensory integration therapy combined with auditory perception training has positive effects on visual perception function and attention of children with developmental delays. However, there were significant increase in attention and improvements in behavior related to sensory processing for some cases in this study. In further study, longer intervention periods and valid measurement need to be applied in order to get better results. And it is proposed that more studies need to be done to enhance evidence of auditory perception training as a mean to facilitate attention and to prepare learning.",박미영,2017,https://www.riss.kr/link?id=A108184564
아동작업치료사의 직무분석,"Objective : The aims of the this study is to identify job characteristics, to generate job description, and additionally to investigate duty task of the job for Korean pediatric occupational therapist focused on sensory integration intervention. Methods : In the first stage, job analysis of pediatric occupational therapist focused on sensory integration intervention was performed by an advisory committee consist of the DACUM panel. Through the job analysis, job description with definition was established. In the second stage, a survey was performed for 141 pediatric occupational therapist using a questionnaire based on the job description in order to investigate importance, frequency and difficulty of duty task and task elements of the job. This process was done from May to September 2017. Results : The job definition drew from this study was 'Pediatric occupational therapist provides occupational therapy services to children and adolescents to support occupational performance and social participation including daily activities and play”. Through the job description established in this study, 9 duties (consulting, evaluation, intervention plan, intervention, document, education, self-development, management, and administration), 28 tasks and 169 task elements were drew. In the survey, among the duty tasks and task elements, ‘ensure physical safety’ and ‘perform a session’ were selected as the most important task, and ‘ensure safety of children, sensory integrative equipment and environment’ and ‘prepare a safe environment’ were selected as the most important element. Conclusion : This study defined job demands and characteristics of pediatric occupational therapist who performs sensory integration intervention. It is expected that this study can be used a resource to develop and/or improve educational program related.",최정실,2017,https://www.riss.kr/link?id=A82712784
"Ayres의 감각통합(Ayres Sensory Integration®) 그룹 놀이 활동이 저소득층 ADHD 아동의 감각처리능력, 사회적 기술능력과 자아존중감에 미치는 효과","Objective : The present study investigated the effects of group play activities based on Ayres Sensory Integration® (ASI) on sensory processing ability, social skill ability and self-esteem of low-income children with attention deficit hyperactivity disorder (ADHD).
Methods : A total of 20 low-income participants with children with ADHD were recruited and divided into an experimental group (n=10) and a control group (n=10). Sensory processing ability was measured via the Short Sensory Profile (SSP). Social skill ability was measured via the Social Skills Rating System (SSRS). To measure self-esteem, the Rosenberg’s self- esteem scale was used. The experimental group received the ASI® group play activities for 50 minutes, twice per week for six weeks, while the control group did not receive an intervention. Level of significance of all statistical analyses was .05.
Results : Social skill ability (F=4.443, p=.05), cooperation (F=5.328, p=.035) and self-esteem (F=5.358, p=.033) differed significantly between groups after the intervention.
Conclusion : Our findings indicate that the group play activities based on ASI® are effective in improving social skill ability and self-esteem. This study provided a theoretical basis for the clam that sensory integration therapy should be applied in general elementary schools.",이나핼,2018,https://www.riss.kr/link?id=A107729787
국내 뇌성마비 아동의 상지기능 향상을 위한 중재효과에 대한 고찰,"Objective : The purpose of this study is to improve the effect of therapeutic intervention on upper extremity function of children among cerebral palsy using systematic review methods and suggest treatment trends used in Korea.
Methods : The subjects of the study were the researches published in the Korean Journal since 2008. Total 12 studies were selected through Korean research database engine such as DBpia, Scholar, KSDC, KISS and RISS for the systematic review in this study. Key words were ‘cerebral palsy’, ‘upper extremity function’ and ‘hand function’. The results of this study were analyzed by qualitative level and methodological quality level of evidence, and the results of each study were analyzed according to the PICO approach, that is Patient, Intervention, Comparison and Outcome.
Results : For the level of evidence, Grade Ⅳ and Ⅴ were most, and in terms of Methodological quality, majority of the studies showed ‘Fare’ level. The subjects were the subjects with hemiplegic children, and the experimental design was high in single-subjects and case studies. Constraint-induced movement therapy (CIMT) was used frequently in intervention, and Jebsen-Taylor Hand Function Test was used frequently for evaluation. In eleven studies showed that the upper limb function of children with cerebral palsy significantly improved or had a positive effect.
Conclusion : Various intervention methods have been implemented to improve the upper limb function of children with cerebral palsy. In the future, studies on intervention methods based on the type of paralysis and studies with high quality of evidence should be continued in Korea.",박영주,2018,https://www.riss.kr/link?id=A102475586
부모-아동 상호작용치료가 양육기술과 아동의 문제행동에 미치는 영향: 메타분석,"Objective: The purpose of this study is to examine the effects of parent - child interaction therapy on parenting skills and child problem behaviors by meta - analysis and to provide a basis for intervention methods.
Methods: This study was conducted from January 2007 to March 2018 and the study was conducted using the parent-child interaction program for children with disabilities. PubMed and CINAHL, EBSCOhost, Science Direct were used to search for papers, and secondary papers were reference. A total of 7 studies were selected to meet the selection criteria, and the final thesis was assessed using the Jadad scale. Statistical tests were performed using the R-meta-analysis program.
Results: The effect size of parenting skill was large and the size of the effect of parenting stress was moderate. The children's problem behaviors also showed moderate effect sizes and all p values were statistically significant (p<.0001).
Conclusion: This study examined the effects of parent-child interaction therapy on parenting skills, parenting stress, and child problem behaviors. Future research is needed to establish the basis for intervention for family involvement in child occupational therapy.",박민경,2018,https://www.riss.kr/link?id=A3261849
Ayres 감각통합 중재가 발달지연 아동의 감각처리능력과 운동발달에 미치는 효과,"Objective : The purpose of this study was to investigate the effect of Ayres’s sensory integration (ASI) intervention on the sensory processing ability and motor development in children with Developmental Delay.
Methods : 9 children in the experimental group and 8 children in the control group participated in this study for Developmental Delay children aged 3-5 years. For research tool, the Short Sensory Profile (SSP), Peabody Developmental Motor Scale-2 (PDMS-2) are used. In the experimental group, individual sensory integration therapy according to principle of ASI was performed for twice a week, 40 minutes, and 16 times for 8 weeks. Methods for the data analysis included Mann Whitney U test, Chi-square test, Wilcoxon’s signed rank test, Cohen's d test of SPSS 24.0.
Results : In the ASI Intervention group, the sensory processing ability showed statistically significant difference in total score, movement sensitivity, auditory filtering and low energy/weak compared to the control group without ASI intervention (p<.05). In the ASI Intervention group, the motor development showed statistically significant difference in Gross Motor Quotient, Fine Motor Quotient and Total Motor Quotient compared to the control group without ASI intervention (p<.05).
Conclusions : In this study, ASI intervention had a positive effect on the sensory processing and motor development in children with Developmental Delay.",박하나,2019,https://www.riss.kr/link?id=A107729784
성인의 수면의 질 향상을 위한 감각통합중재의 효과: 단일사례 연구,"Objective : The purpose of this study was to investigate the effects of a sensory integration intervention to improve sleep quality in adults.
Methods : The subjects of the study were three sleepless adults with sensory defensiveness. This study applied a multiple baseline design out of a single-subject study, with the process comprising 4 basic lines, 7 basic lines, and 14 basic lines. The intervention was conducted 3 times per week for a total of 12 times. Overall sleep time, sleep latency, and the number of times that participants awoke at night were measured during every session. Sleep quality, sensory integration capabilities (including sensory defensiveness), and sleep satisfaction were measured before and after treatment.
Results : A visual analysis of total sleep time, sleep latency, and number of waking times during the night as measured daily after the sensory integration intervention was applied showed no noticeable improvement in any of the subjects.
Conclusion : This study is meaningful in that it applied a sensory integration intervention to adults and proposed sensory integration therapy as a new method of intervention to treat sleep disorders.",홍초롱,2019,https://www.riss.kr/link?id=A30086672
자폐스펙트럼장애아동의 청각행동특성과 사회성과의 관계,"Objective : The purpose of this study is to investigate about what autistic-spectrum disorder child’s relationship between the sensory process types, the auditory behavioral characteristic and sociality
Methods : The study performed from May to June, 2014. Targeting 15 children diagnosed as the autistic spectrum disorder and other 11 children suspected as having the autistic spectrum disorder in their ages of full 2-14 years old. This study used the Auditory Behavioral Checklist, Ewha-Check List for Autistic Children, Social Maturity Scale, School Function Assessment and sensory profile. For the data analysis, the statistical analysis was conducted with the SPSS 18.0.
Results : First, in the relationship between the sensory process type and the auditory behavior, the preschool children and the school children showed some positive correlations with the hearing in the background noise and the communication, respectively. Second, the hearing in the background noise and the communication showed some meaningful relationship with sociality.
Conclusion : The occupational therapists need to investigate effects of the sensory integrative intervention with sensory diet to improve sociality.",장기연,2014,https://www.riss.kr/link?id=A106491857
Bruininks-Oseretsky Test of Motor Proficiency-2(BOT-2) 단축형을 사용한 학령전기 아동의 운동능력에 대한 연구,"Objective : This study aimed to provide the preliminary data as a pilot study on standardizing BOT-2 by using an assessment criteria linked to Bruininks-Oseretsky Test of Motor Proficiency (BOTMP) short form for the children with preschool years(4-6 year old) in South Korea. Methods : A total of 81 children aged 4-6 in Busan and Gimhae were participated in this study. They were evaluated by using BOT-2 SF. It provides the average values and standard deviations about the abilities of praxis along with descriptive statistical analyses, and has the verification of gender differences by using independent t-test and using ANOVA for discrepancies in the abilities of praxis. Results : There were significance difference in the total raw score between four and five (p=.000), the items on fine motor accuracy between five and six year olds (p=.014). Girls showed higher scores than boys in fine motor accuracy, fine motor integration and balance (p=.022, p=.006, p=.031). Also, mean raw scores of 4 and 5 year olds (p=.007, =.000), and the all age group's standard scores were higher than the age in American children who were the participants of BOT-2. Conclusion : This study suggested the average of each item with regard to the ability of motor praxis about the children of preschool ages and showed the dissimilarity in the ability of motor praxis between age and gender, also between the participants in this study and American children who were participants of BOT-2. The research could provide basic data for future studies to standardize BOT-2 SF for korean preschoolers.",홍기훈,2016,https://www.riss.kr/link?id=A3261525
감각조절장애 아동을 위한 가정 프로그램의 효과,"Objective : To explore the effectiveness of sensory integration program of home-based outcomes in child with sensory modulation disorder. Methods : This study used the simple case study. The subjects were three children diagnosed as developmentally delayed who 14 month and 26 month males and a 15 month female. After initial evaluation, parents were educated on sensory diet and Wilbarger protocol method for 30 minutes twice for home-based treatment and asked to make out daily treatment planning. To measure improvement of children, we used for the Denver Developmental Screening Test II(DDST II), Wee Functional Independence Measure(WeeFIM), hand function, functional ability, oral motor function, Sensory Profile(Dunn, 1999). Results : After the home-based program, the scored of the Denver Developmental Screening Test II(DDST II), Wee Functional Independence Measure(WeeFIM), hand function, functional ability, oral motor function, Sensory Profile(Dunn, 1999) were higher rather than initial evaluation after the home-based program. Conclusion : The home-based program is effective for children with sensory modulation disorder but parents had to be educated by therapist specific evaluation and treatment in sensory integration.",이성아,2003,https://www.riss.kr/link?id=A76527247
감각통합치료가 발달장애 아동의 기능적 쥐기에 미치는 영향,"Objective : The experiment consists of measuring functional grasp ability of a child suffering from sensory defense disability of the hands as the child is treated with sensory integration therapy. Methods : We treated two-year-old child with developmental disability to set up the reversal design(ABAB design). We used treatment equipments, free activities, and toys for sensory integration therapy. Results : A child's functional grasp ability did not show anything before the sensory integration therapy, however, after the sensory integration was applied during the first treatment(Treatment 1), the five minutes before the treatment, it averaged 1.87 times(ranges=0 to 5 times), the five minutes after the treatment, it averaged 1.25 times(ranges=0 to 8 times) showing an increased. After ending the sensory integration therapy, the functional grasp ability averaged 2.5 times before the therapy and 4 times after the therapy, which showed a totally different tendency, when we reapplied the treatment during the second treatment(Treatment 2), it averaged 2.4 times(ranges=1 to 4 times) before the treatment, and it averaged 5.3 times(ranges=4 to 6 times) after the treatment, which showed a big improvement. Conclusion : The sensory integration therapy brought an increase in functional grasp ability along with improvement in daily life functions of the child. For this result, there should be more research to see more effects and results to help those in need.",장문영,2003,https://www.riss.kr/link?id=A103429232
학령기 정상아동의 운동 기술 및 자세 조절에 관한 임상관찰,"Objective : The purpose of this study is to identify the developmental characteristics of sensory integration according to age and sex distinction using COMPS for school-aged children and to provide the preparatory data for standardization appropriate for our social and cultural environment. Methods : The COMPS was administered to 40 normal children in the first grade of elementary school by 4 occupational therapists. Results : By comparison between age groups, 6 and 7 year olds performed similarly and statistically in all items. Between males and females, there was no significant difference in performance of all items Conclusion : Findings from the study suggested that the performance of the COMPS by children followed developmental trends. The COMPS is easy to administer to groups and beneficial to discriminate children with motor problems, and it should be standardized.",김미혜,2003,https://www.riss.kr/link?id=A82712636
감각통합기능장애를 가진 청소년의 작업수행에 초점을 맞춘 작업치료 사례,"Introduction : Sensory Integration(SI) theory, science it is developed by an occupational therapist A. Jean Ayres, is the one of the most popular frames of reference used in occupational therapy(OT) intervention. It has been proved as a scientific theory especially in neuroscience discipline through abundant research and practice. Occupational therapists apply the SI therapy with strong clinical reasoning to improve adaptive behaviors of their clients and try to link the adaptive behaviors with occupational performance in the clients’ everyday life. One of the manners regarding clinical reasoning is Top-down approach. In occupational therapy discipline, Top-down approach is well-reflected within two evaluation tools; Canadian Occupational Performance Measure(COPM) and Assessment of Motor and Process Skills(AMPS) and two models of practice; Canadian Model of Occupational Performance(CMOP) and Occupational therapy intervention process model(OTIPM).
Objective : The purpose of this paper demonstrates how SI therapy can be employed within OTIPM and how the OT process (evaluation-intervention-outcome) can be structuralized based on the Top-down approach. This single-case study recognizes the impact of a SI therapy for a male adolescent on his occupational performance.
Intervention Examined : “P” was 16 years old male adolescent with no diagnosis and junior of the high school when he was referred. P was always with mouth opened, showed difficulties in gathering things need to be prepared and managing and paying money for shopping, and his colleges dislike getting close to him because he can’t was his body well. AMPS was administrated in initial evaluation and reevaluation of P’s occupation performance, Bruininks-Oserestky Test of Motor Proficiency-2(BOT-2) was carried out to assess motor functions and perception skills related in sensory integration, and occupational therapist performed clinical observation in order to complement the evaluation quantitatively and quantitatively. Based on the evaluation, it is concluded that the SI therapy is primary means to improve P’s occupational performance, and three therapeutic approaches were constructed; restorative, acquired and compensatory approach. P showed improved motor and process skills in occupational performance after undergone the occupational therapy.
Conclusions : The sensory integration therapy was practical enough to build the bridge between the occupational performance(Top) and the underlying component problems (Bottom). The OTIPM was helpful to identify meaningful occupation for P and P’s family within P’s contexts, and the AMPS was valuable to analyze and clarify the cause of difficulties in the chosen occupational performance.","지석연 (Ji, Seok-Yeon)",2008,https://www.riss.kr/link?id=A106491855
감각통합치료를 통한 적응반응의 변화 : 사례보고,"Introduction : This study presents a case report of a child with sensory integration dysfunction(mixed sensory modulation disorder and dyspraxia), and describes strategy of the sensory integration intervention to encourage child's inner drive and the change of adaptive response.
Main Subject : The subject was a boy, age 5 years and 10 months, who participated in short-term intensive sensory integration therapy program which was provided in a 2008 sensory integration treatment course. Based on results of assessment to the child, This study identifies the treatment goals, contents of treatment and analyze adaptive response' change of four therapy sessions.
Conclusion : This case report demonstrates improvement of the adaptive response by sensory integration intervention and impotent to encourage the child's inner drive. However, subjective date, which is sensory integration may produce an effect that is evident during treatment sessions and in home environment have suggested.","김은영 (Kim, Eun-Young)",2008,https://www.riss.kr/link?id=A107086728
감각조절장애 아동에 대한 감각통합 치료적용-사례보고,Objective : To summarize and interpret observations of responses of child with sensory modulation disorder during four therapy sessions in order to contribute to future studies. Method : Analyze treatment goals and strengths and weaknesses of four therapy sessions and discuss implications of therapy. Results : Child's adaptive responses were improved throughout the therapy sessions. Conclusions : Intensive sensory integration therapy is needed continuously. Future study with this participant is needed to explore more effectiveness of sensory integration therapy.,김미혜,2006,https://www.riss.kr/link?id=A101671616
말기암 환자의 통증 양상과 통증관리에 영향을 미치는 요소들,N/A,이수련(Soo Ryun Lee),1999,https://www.riss.kr/link?id=A101671595
