
두피를 공여부로 한 부분층 식피술의 임상적 고찰,"Plastic surgeons regard the management of tissue defects as a major issue and use the split thickness skin graft as one of the popular treatment modalities.
Since Crawford has introduced the scalp as a donor site for split thickness skin graft, this method has been used with its many advantages.
From Jan. 1989 to Jan. 1992, we perfomed the split thickness skin graft using the scalp as a donor site in 23 patients.
The grafted scalp has many advantages such as improved color match in facial area, improved texture in other areas and invisible donor scar due to hair regrowth.
We could conceive that good color match between the scalp and the face may be due to their histologic similarities.",김진환,1992,https://www.riss.kr/link?id=A2012708
구순열 및 구개열의 산전 초음파 진단,"Cleft lip & palate are the most frequent manifestation of facial malformations. Fetuses with cleft lip & palate have a much higher incidence of multiple malformations and chromosomal aberrations than neonates with cleft lip & palate. Thus, ultrasonography of the fetal face has become important for the detections of major syndromal malformations or chromosomal disorders. Especially in cases with a family history of cleft lip & palate, we should confirm or exclude the diagnosis and associated anomalies have to be ruled out when cleft lip & palate are present Positive findings have different clinical outcomes and obstetrical implications. We detected five fetuses with cleft lip & palate, using ultrasonography. We taught to their parents about disease entities, operative schedules with complications and sequelaes, and feeding, etc.. Also, we performed genetic counseling for other malformations and chromosomal disorders in case with a history of stillbirth of fetus with cleft lip & palate. Our teaching and genetic counseling provided early cognitive, emotional and behavioral supports to mother. Also, a recent development of the fetal endoscopic surgery in life threatening conditions has raised the possibility of fetal cleft lip & plate repairs. This sophisticated prenatal diagnostic imaging will play the basic and important roll in the progression of endoscopic fetal surgery in plastic surgery.",강정훈,1997,https://www.riss.kr/link?id=A2012703
수지재접합 수술 후 이점분별력에 대한 고찰,"The recovery of sensibility following digital replantation is essential in the restoration of hand function. We reviewed a consecutive series of 150 patients, 185 digital replantations which wre performed with direct neurorrhaphy without nerve graft between Jan. 1990 and Jul, 1992. Mean age was 28.5 years. Follow-up period was two year on zone Ⅰ,Ⅱ,Ⅲ amputation. The sensory recovery of the finger tip was assessed by the static two-point discrimination test. Mean static two-point discrimination(S2PD) was 8.4mm clean thumb vs. 11.7 mm in crush avulsion finger replantions.
Overall mean S2PD was 10.1 mm in thumb and 9.8 mm in finger replantations.
The sensory recovery was depends on the zone of amputation, the type of injury, age. The results were as follows :
1. The digits replanted at more distal zone showed better sensory recovery.
2. Younger patients showed better recovery of S2PD.
3. There was no significance of comparison on S2PD between male & female
4. The digits with crushing and avulsion injury showed worse recovery of S2PD.
5. When thumbs and fingers not injured were assessed by S2PD, mean S2PD was as follows : 3.1 mm, little finger ; 3.1 mm.",홍인표,1995,https://www.riss.kr/link?id=A2014209
Threaded K-wire를 이용한 관골 골절의 비관혈적 정복술,"The zygomatic projections articulate with sphenoid, frontal bone, maxilla and maxillary alveolus.
The prominent position of zygoma make it susceptible to traumatic injury. The fracture dis-placement is classified into several types.
According to the degree of displacement and fracture segments, the method of its treatment is decided.
In the cases of closed reduction, Gillies'or Dingman's maneuver have been applied for the lifting and pulling of displaced zygoma, even though the open reduction was indicated. In my personal opinion, there are some difficulties and disadvantages because this method is indirect reduction of the fractured zygoma.
The author designed a new direct transcutaneous reductionmethod with threaded K-wire and applied this method to some cases.
The author conclude the advantages of this method are as followings.
1) There is no destruction of fine submuscular structure around lower eyelid and zygoma.
2) There are no incision on the face and scalp.
3) The relapse of the displacement was not occurred.
4) The surgical method is very simple.
5) It takes very short(10-15 minutes)",박병윤,1995,https://www.riss.kr/link?id=A2013015
일측성 구순열의 이차 변형에 대한 임상적 경험,"In the cases of unilateral cleft lip, the most prominent findings are asymmetric and deformed upper lip and nose. Numerous methods have been published by many authors to correct this troublesome problem. We followed and modified the previously published methods which seemed to be the most adequate procedure for the given problems.
During 5 years, from January, 1990 to December 1994, a total of 26 cases of secondary deformity of unilateral cleft lip were treated with our favorite methods which were
1. Functional muscle alingment repair to correct the deformity of the orbicularis oculi muscle
2. Reverse U-incision with vestibular z-plasty in addition to open rhinoplasty incision, and 3 point plication of alar cartilage to correct the nasal deformity
3. W-plasty on the nostril margin to correct the web of nostril
4. Small Z-plasty on the vermilion border to ever and protrude the white-roll with the phenomenon of dog-ear intended around the Z-plasty
5. Mucosal advancement of the labium and release of frenulum to augment the vermilion Our combination methods for secondary unilateral cleft lip and nasal deformity obtained excellent results in all patients.",안성열,1996,https://www.riss.kr/link?id=A2013007
Use of platelet-rich plasma and modified nanofat grafting in infected ulcers: Technical refinements to improve regenerative and antimicrobial potential,"Background Surgical reconstruction of chronic wounds is often infeasible due to infection, comorbidities, or poor viability of local tissues. The aim of this study was to describe the authors' technique for improving the regenerative and antimicrobial potential of a combination of modified nanofat and platelet-rich plasma (PRP) in nonhealing infected wounds. Methods Fourteen patients met the inclusion criteria. Fat tissue was harvested from the lower abdomen following infiltration of a solution of 1,000 mL of NaCl solution, 225 mg of ropivacaine, and 1 mg of epinephrine. Aspiration was performed using a 3-mm cannula with 1-mm holes. The obtained solution was decanted and mechanically emulsified, but was not filtered. Non-activated leukocyte-rich PRP (naLR-PRP) was added to the solution before injection. Patients underwent three sessions of injection of 8-mL naLR-PRP performed at 2-week intervals. Results Thirteen of 14 patients completed the follow-up. Complete healing was achieved in seven patients (53.8%). Four patients (30.8%) showed improvement, with a mean ulcer width reduction of 57.5%±13.8%. Clinical improvements in perilesional skin quality were reported in all patients, with reduced erythema, increased thickness, and increased pliability. An overall wound depth reduction of 76.6%±40.8% was found. Pain was fully alleviated in all patients who underwent re-epithelization. A mean pain reduction of 42%±33.3% (as indicated by visual analog scale score) was found in non-re-epithelized patients at a 3-month follow-up. Conclusions The discussed technique facilitated improvement of both the regenerative and the antimicrobial potential of fat grafting. It proved effective in surgically-untreatable infected chronic wounds unresponsive to conventional therapies.","Segreto, Francesco",2020,https://www.riss.kr/link?id=A2013127
태아피부 혈관 및 배양한 태아진피 미세혈관 내피세포에서 E-selectin 발현에 관한 연구,"Inflammation is the characteristics of scar formation which is abscent in fetal wound healing. The adhesion molecules such as selection groups are believed to have key roles for migration of inflammatory cells through the microvascular endothelial cells to the wound. The purpose of this study was to evaluate the expression of E-selection on the cultured human fetal and neonate dermal microvascular endothelial cells.
The back skin of spontaneously delivered dead fetus (IUP 18-22wks) and circumcised prepuce skin of neonate were used. Human fetal dermal microvascular endothelial cells (HFDMEC) were isolated by extracting microvascular segment from trypsin treated fetal and neonate skin tissue and isolated by sieving with nylon mesh and then by 35% Perocoll gradient centrifugation. Further purification was done with the Ulex europaeus I coated magnetic dynabead. To confirm the fetal and neonatal endothelial cells, expression of factor Ⅷ antigen on cell surface and uptake of acetylated low-density lipoprotein were checked.
Expression of E-selection on cultured fetal and neonatal endothelial cells in response to IL-1αTNF-αINF-ｒwas examined by ELISA. And the expression of E-selection on fetal and neonatal dermal microvascular endothelial cells was examined by immunohistochemical study using monoclonal 3B7 anti E-selection antibody in cultured fetal and neonatal skin.
The expression of E-selection on endothelial cells was not significantly different between fetal and neonatal endothelial cells. This expression was augmented 10 times more by IL-1αTNF-αINF-ｒ. Augmented endothelial E-selection expression by IL-1αTNF-αINF-ｒshowed peak level 4 hours after stimulation and return to baseline level after 48 hrs. This time course was similar in both fetal and neonatal endothelial cells. Immunohistochemically, the expression of E-selection molecule of unstimulated fetal and neonatal tissue was not observed. However, on both fetal and neonatal tissue cultured for 4 hours after stimulation by 100u/ml of IL-1 and 100u/ml of TNF, expression of E-selection molecule in microvasculature of upper dermis was observed and this expression persisted for up to 16 hours of culture. Also after culturing for 48hrs with 500u/ml of IFN, expression of E-selection was observed in the microvessels of upper dermis.
In conclusion, we could not find any differences between the fetal and neonate skin in the expression of E-selection on the endothelial cell spontaneously or stimulated by IL-1αTNF-αINF-ｒin vivo and vitro which means the expression of E-selection may not be an important mechanism of scarless wound healing in fetus.",나동균,2000,https://www.riss.kr/link?id=A106908965
급성 열성 감염 후유증에 의한 안면 변형의 재건,"Acquired facial deformities due to Noma sequale are manifested variably according to the tissue necrosis nature, and reconstruction of the facial deformity is difficult by using simple approach when the tissue loss extended over a wide area to the face. The authors experienced reconstruction of complex adult facial deformities owing to Noma sequale by stage operation.
The first case was a 43 year old female. Her deformities were the loss of Lt. lateral alar dome, Lt. alveolar and maxilla, Lt. supralabium and cheek. The surgical prcedures were Washio flap for Lt. alar dome reconstruction at the 1st stage of operation, and Millard rotation advancement procedure for Lt. lip and supralabial reconstruction at the 2nd stage of operation.
The 2nd case was a 42 year old female. The deformities were the loss of anterior manidibular arch and teeth, complex loss of lower lip and inferior labiobuccal sulcus. Surgical procedures for this patient were alveolar ridge reconstruction by using iliac bone graft and labiobuccal sulcus reconstruction by using skin graft at the 1st stage operation. The 2nd stage operation was performed by using tongue flap for reconstruction of the lower lip defect.
The Authors are presenting two cases of facial deformity due to noma seguale for the following reasons in summary.
1. Noma survivor is rare nowadays and clinical reports of reconstruction that deformity in this country are rare.
2. Because the deformties or defects of these cases involve multiple facial units, we consider the experience of reconstructing these cases are invaluable.",설재윤,1992,https://www.riss.kr/link?id=A2013290
박피술에 의한 신생아의 선천성 거대 모반증의 치험례,"The congenital giant nevus in neonates not only gives na unsightly appearance, but also has a malignant transformation potential.
The incidence of malignant transformation varies from 2 to 32%.
Recently, Quaba and Wallace (1986) reported that the giant nevus which covered more than 2% of the total body surface area could become malignant within the first 15years of life with an incidence rate of 8.52%.
We treated a neonate with a giant nevus which involved extensively the abdomen, back, buttocks and thighs; the lesion was dermabraded by two times within 5 months age.
After 14 months of the follow-up, no signs of recurrence were noted; the result was acceptable in the aesthetic standpoint and for a preventive measure of malignant transformation.",손문방,1992,https://www.riss.kr/link?id=A2012684
하악과두골절 치료후의 예후에 관한 임상적연구,"Seventeen of twenty-five patients who were treated for mandible condyle fractures at Inje university from March 1988 to May 1992, were available for follow up from postoperation one to five years were evaluated statistically the analysis are as follows:
1) The incidence of the mandibular condyle fracture was more frequent in males than that of females(five point two five : one).
2) The incidence of the disease based on age was the following orders; ten in the third decade(forty percent), nine in the fifth decade(thirty-six percent), three in the first decade(tweleve percent), two in the second decade(eight percent), and one in the sixth decade(four percent).
3) The incidence of the disease based on causation was as follows; nine by traffic accidents(thirty-six percent), six by an accidental fall down(twenty-four point five percent), six by fist blow(twenty-four percent), three by sliping on the ground(twelve percent)and by collision with trees(four percent).
4) Fifteen cases had unilateral fracture site and two cases were bilateral. The location of fracture line were seven cases on right side, twelve cases on left side, and fourteen cases on condyle portion, five cases on subcondyle potion.
5) Management was achieved by closed reduction in sixteen cases and one cases was treated by open reduction.
6) The cases were divided into four groups according to Yamaguchi's classification ; ten in degree 0(fifty-eight point eight percent), four in degree Ⅰ(twenty-three point five percent), two in degree Ⅱ(eleven point seven percent) and one in degree Ⅲ. A statistically significant difference in degree of TMJ dasfunction were demonstrated according to age (x²=fifteen point two two three, p=nought point one one)
No significant difference in TMJ dysfunction were demonstrated between the first decade and the other decade.(x²=nought point one one seven, p=nought point seven three two)
7) After treatment for condyle fracture five patients(thirty-five point seven percent) showed disability out of fourteen patients; three in degree Ⅰ, one in degree Ⅱ and one in degree Ⅲ. After treatment for subcondyle fracture two patients(fourty percent) showed disability out of five patients; one in degree Ⅰ and one in degree Ⅱ. No statiscally significant difference in degree of TMJ dysfunction were demonstrated between condyle fracture and subcondyle fracture.(x²=nought point nine five, p=one)",서일경,1994,https://www.riss.kr/link?id=A2012688
구개골절의 유형에 따른 치료방법,"The palatal fracture results in deformity of the midface, as well as change in occlusion. However, no report was found on the incidence, treatment and results of palatal fracture in Korea. A retrospective review was done over 6 years and 11 patients(6.5%) with palatal fracture were determind out of 168 patients who had midfacial bone fractures without nasal bone fracture. According to the Hendrickson's classification, the number of patients with specific types of palatal fracture was described as follows; sagittal(2 cases), parasagittal(2 cases), para-alveolar(3 cases), transverse(3 cases) and complex(1 case). Le Fort Ⅰ(6 cases), Le Fort Ⅱ(7 cases) and mandible(6 cases) fractures were also associated. Open reduction and internal fixation was applied to all patients. Internal fixation consisted of pyriform or alveolar ridge stabilization and maxillary buttress stabilization. The rigid palatal vault stabilization was applied in one patient with midline split of the palate. The duration of intermaxillary fixation was shortened to less than 3 weeks from 4 to 6 weeks with rigid fixation. The palatal splint was used temporarily before internal fixation. All the patients showed good bony union and satisfactoryocclusion postoperatively. Open reduction and internal fixation showed satisfactory results from the aspects of stability, occlusion, patient convenience and final aesthetics. The following treatment model for palatal fracture according to the fracture type is proposed; 1) Alveolar type - close reduction or open reduction and selective alveolar ridge fixation and selective application of palatal splint, 2) Sagittal type - open reduction and internal fixation of the alveolar ridge, maxillary buttress and palatal vault. 3) Parasagittal type - open reduction and internal fixation of the pyriform aperture and maxillary buttress, as well as selective fixation of the palatal vault. 4) Para-alveolar type - open reduction and internal fixation of the alveolar ridge and maxillary buttress. 5) Complex type - open reduction and internal fixation of the alveolar ridge, maxillary buttress, pyriform aperture and continuous use of a palatal splint to bony union. 6) Transverse type - open reduction and internal fixation of the alveolar ridge and maxillary buttress.",박상훈,1999,https://www.riss.kr/link?id=A2012861
유리피판술을 이용한 진행성 반안면 위축증(Romberg's Desease)의 치험,"Romberg's disease is an uncommon condition manifested by progressive hemifacial atrophy of the skin, soft tissue and bone. Facial asymmetry with soft tissue deficiency in Romberg's disease causes a significant disability affecting the social life and can bring about many psychological problems. The aim of surgical treatment is cosmetic amelioration of the defect. Several conventional reconstructive procedures have been used for correcting facial asymmetry. They include fat injections, dermal fat grafts, silicone injections, cartilage and bone grafts, pedicled flaps and free flaps. We report our experience with 6 patients involving 6 free flaps with a minimun of 1 year follow-up who were treated from October 1989 to March 1998. All patients were classified as having moderate to severe atrophy. The average age of disease onset was 4.5 years. The average duration of atrophy was 5.2 years. No patient was operated on with a quiescent interval of less than 1 year. The average age at operation was 14.1 years, ranging from 10 to 24 years. Follow-up ranged from 1 to 9 years. Reconstruction was performed using 2 groin dermofat free flaps and 4 latissimus dorsi muscular free flaps. To achieve the finest symmetrical and aesthetic results, several ancillary procedures were performed in 4 patients. These procedures included Le-Fore 1 ½ leveling osteotomy, sagittal split ramus osteotomy, reduction malarplasty and angleplasty, rib and calvarial bone graft, correction of alopecia and additional dermofat graft. All patients were satisfied with the results. We believe that free flap is one of the best choices for contoured restoration of facial asymmetry in Romberg's disease.",백롱민,1999,https://www.riss.kr/link?id=A2014571
레이노드 증후군의 치료에 있어서 수부 교감신경절제술,"Raynaud's syndrome causes discolorization, ischemic claudication(pain) and necrosis of the digits through insufficiency in the circulation which is induced by intermittent spasms of the digital arteries.From January, 2002 to December, 2004, 10 patients were surgically treated for Raynaud's syndrome. 9 patients were female and 1 patient was male. 2 patients showed unilateral involvement, 8 patients were operated on both hands. 6 patients had necrotic changes on the finger tips due to the disease. Ages ranged from 21 to 60 with an average of 39.1. Ischemic pain, discolorization, and cold intolerance of the digits were the common symptoms. All patients were evaluated with color doppler before the surgery. Two different procedures were applied according to the severity of the disease: Patients with decreased circulation received, what we call a limited digital sympathectomy, i.e. stripping of the adventitia of the ulnar, radial and common digital arteries. An extended procedure, radical digital sympathectomy, was performed on patients with a complete block of circulation. Stripping of the adventitia in these patients also involved the proper digital arteries.Symptoms like discolorization, ischemic pain, and cold intolerance improved immediately after the surgery. The patients did not suffer from pain even with exposure to cold weather.We conclude that digital sympathectomy could improve the symptoms in Raynaud's patients who do not respond to conservative treatment such as calcium channel blocker and other vasodilators.",이세환,2005,https://www.riss.kr/link?id=A2014573
괴저성 구내염 후유증에 의한 후천성 안면 변형의 재건,"Acquired facial deformities following cancrum oris sequelae manifested variably according to the nature of tissue necrosis. In cases that tissue loss extends over a wide area of the face, or the tissue nature is different due to congenital facial cleft, it is difficult to reconstruct with a single operation. As cancrum oris has virtually disappeared from our country, clinical report of reconstruction is also rare. We report 5 cases of facial deformities following cancrum oris sequelae.Since 1988, five adult patients(4 female and 1 male) were treated by authors. These patients, with an age ranged from 47 to 58 years, all suffered from acquired facial cleft such as facial mutilation, asymmetry. The stages of operation were from 1 to maximum of 5 operations. All surgeries achieved satisfactory results after a long-term follow-up. But one surgery in the case of palatal mucosal flap for the coverage of reconstructed maxilla alveolar bone resulted tissue sloughness, followed by osteomyelitis. Those were debrided and discarded.In conclusion, all sites of deformities were positioned around one of the oral commissures. In their past medical history, they have been suffering from measles, typhoid fever and unknown febrile illness. We diagnosed the acquired facial deformity following cancrum oris sequelae. The reconstruction of acquired facial deformity following cancrum oris sequelae were difficult due to extensive multiple tissue defects. Therefore multiple staged operations were inevitable.The authors reconstructed 5 cases of simple and complex form of facial deformity with minimum staged operations. All patients were satisfied functionally and cosmetically.",문재원,2006,https://www.riss.kr/link?id=A104556766
Use of Acellular Biologic Matrix Envelope for Cardiac Implantable Electronic Device Placement to Correct Migration into Submuscular Breast Implant Pocket,"Breast implants whether used for cosmetic or reconstructive purposes can be placed in pockets either above or below the pectoralis major muscle, depending on clinical circumstances such as subcutaneous tissue volume, history of radiation, and patient preference. Likewise, cardiac implantable electronic devices (CIEDs) can be placed above or below the pectoralis major muscle. When a patient has both devices, knowledge of the pocket location is important for procedural planning and for durability of device placement and performance. Here, we report a patient who previously failed subcutaneous CIED placement due to incision manipulation with prior threatened device exposure requiring plane change to subpectoral pocket. Her course was complicated by submuscular migration of the CIED into her breast implant periprosthetic pocket. With subcutaneous plane change being inadvisable due to patient noncompliance, soft tissue support of subpectoral CIED placement with an acellular biologic matrix (ABM) was performed. Similar to soft tissue support used for breast implants, submuscular CIED neo-pocket creation with ABM was performed with durable CIED device positioning confirmed at 9 months postprocedure.",Peyton Terry,2023,https://www.riss.kr/link?id=A104555860
