
소아기 우울증,"요 약

소아기 우울증은 1980년 DSM-III에서 이를 공식적으로 인정하기까지 많은 임상보고에도
불구하고 논란의 대상이 되어 왔었다. 이는 과거 정신분석학적 영향으로 인한 것이기도 하
지만 다른 한편으로는 소아의 발달학적 측면을 고려하지 못한 결과이기도 하였다. 즉 소아
는 시간과 정도(time & degree)에 대한 감각이 다르고 자신의 감정을 언어로 표출하는
데 한계가 있으며, 정상적으로 정서가 얕고 불안하다. 뿐만 아니라 학령기전 까지는 현실판
단력이 부족하고 자기중신적 이어서 논리적 사고과정을 통해서는 심리적 고통으로 부터 벗
어날 수 없기 때문에 부인(denial)을 주된 방어 기전으로 사용하여 우울증상은 대체로 일시
적 이 기가 쉽다. 그러나 전차 나이가 들어 후기 아동기 되면 내적 경험에 대하여 숙고하는
능력이 생기고 정서조절면에서도 상호작용에 의한 의존상태에서 벗어나서 개인 내적인 조절
단계로 이행하므로 성인의 우울증과 비슷한 임상양상을 보이게 된다.

지금까지,소아기 우울증의 원인이 밝혀지지 않았고,이것이 성인기 우울증과 상관관계가 있는
지의 여부, 그리고 이것이 성격형성에는 어떤 영향을 주는지에 대해서는 여전히 논쟁점으로
남아 있으나, 소아기 우울증이 상당히 오랜 기간후에도 지속되었다는 일부 보고를 고려한다
면 이에 대한 조기 인식은 예방이라는 차원에서 큰 의미가 있을 것으로 생각된다

본고에서는 소아기 우울증의 개관과 발달적 관점에서 소아기의 우울증상을 살펴 봄으로써
이에 대한 이해를 높이고자 하였다.",강경미,1994,https://www.riss.kr/link?id=A2118066
유분증 아동을 위한 배변훈련프로그램의 효과 연구,훈련의 조건과 목표행동의 기준을 변화시키는 설계(changing conditions and changing criterion design)를 사용하여 일차적 유분증과 이차적 유분증이 있는 아동 2명을 각각 행동치료하였다. 측정된 종속변인은 바람직한 배변행동의 증가와 부적절한 배변행동의 감소였다. 과제분석과 체계적인 강화를 사용하여 아동을 치료한 결과 각각 처치 12주와 13주 후에 아동의 유분증은 제거되었다. 치료 종결 두 달 후의 follow-up에서도 부적절한 배변행동은 보고되지 않았으며 바람직한 배변행동이 가정이외의 곳으로 일반화되었음이 보고되었다.,이양희,2001,https://www.riss.kr/link?id=A19593965
"중년여성의 부부친밀감, 우울과 갱년기 증상의 관계","본 연구는 중년여성이 인식하는 부부친밀감 정도를 파악하고, 부부친밀감과 우울, 갱년기 증상의 관계를 확인하여, 중년 여성의 건강증진과 삶의 질 향상을 위한 효과적인 간호중재를 개발하는데 기초자료를 제공하고자 시행되었다. 본 연구의 결과를 바탕으로 중년여성이 인식하는 부부친밀감, 우울, 갱년기 증상의 특성과 이들의 관계에 대하여 논의하고자 한다. 본 연구에서 중년여성이 인식한 부부친밀감의 평균값은 5점 척도에서 3.19점으로 나타났다. 부부친밀감을 측정한 선행 연구를 살펴보면, Koo (2008)의 연구에서 40~60세 여성의 부부친밀감 점수는 3.32점, Woo와 Lim (2010)의 연구에서 40~59세 기혼 남녀의 부부친밀감 점수는 3.56점으로 나타났다. 본 연구의 부부친밀감 점수가 선행연구의 결과보다 낮게 나타난 이유는 본 연구가 40세부터 65세 미만의 넓은 연령 범위의 대상자를 대상으로 조사하였기 때문이라 생각된다. 또한 Kim (2008), Pak과 Kim (2010), Woo와 Lim의 연구에서는 남성이 여성보다 부부친밀감을 높게 인식하는 것으로 나타났는데 이에 비해 본 연구에서는 상대적으로 낮은 부부친밀감을 나타낸 것은 남성과 여성의 부부친밀감을 함께 조사한 것이 아니라, 남성을 제외한 여성만을 대상으로 부부친밀감을 조사한 결과라고 생각된다. 본 연구에서 중년여성의 연령 집단별 부부친밀감 비교를 보면, 40~44세 미만 집단의 부부친밀감 점수가 3.56점으로 가장 높았고, 50~54세 집단의 부부친밀감 점수가 3.09점으로 가장 낮았으며, 55세 이상 집단에서 40대 집단 보다 부부친밀감이 낮게 나타났지만, 통계적으로 유의하지 않았다. 이와 같이 연령이 높은 집단에서 부부친밀감이 낮게 나타난 결과는 연령이 부부친밀감의 주요 관련 요인이라는 Lee와 Ok (2002)의 연구와 유사하였다. 그러나 부부친밀감과 연령의 관계에 대하여 Woo와 Lim (2010)의 연구의 결과에서는 40대 부부의 부부친밀감이 50대 부부보다 유의하게 높았던 것에 비해, Jang, Chung과 Lee (2011)의 연구에서는 30대의 부부친밀감이 40대보다 높았지만 통계적으로 유의하지는 않았다. 한편 결혼만족도는 20대 연령 집단과 결혼 기간 10년 미만인 집단에서 유의하게 높게 나타났다(Lee & Ok; Son & You, 2008). 즉 결혼 만족도는 연령과 결혼 기간에 따라 감소하는 경향이 뚜렷한 것에 비해 부부친밀감은 연령이 증가할수록 낮아지는 경향은 있으나 연령 집단별 차이에 대하여 결과가 일치되지 않았다. 이러한 부부친밀감의 특성에 대하여 Moss와 Schwebel (1993)은 부부친밀감이 결혼만족도 보다 부부 간의 상호 정서적, 인지적, 신체적 밀접함과 헌신의 측면을 중요하게 다룬 것으로 인함이라고 했다. 이러한 부부친밀감에 대하여 Cutrona (2004)는 배우자와의 관계란 타인과 맺을 수 있는 가장 강력한 친밀감이라고 했으며, 일생을 함께 살아온 부부사이에 느끼는 매우 가깝고 공유된 밀접함을 반영하는 부부친밀감은 중년여성에게 더욱 큰 의미를 부여할 수 있다고 하였다. 따라서 중년여성과 중년 부부를 위한 다양하고도 효과적인 부부친밀감 증진 프로그램을 계획해야 하겠다. 중년여성의 일반적 특성 중 부부친밀감과 유의한 관련 변인을 살펴보면 다음과 같다. 본 연구에서 최종학력(F=6.88, p = .001)이 대졸 이상일 경우가 중졸 이하인 경우보다 부부친밀감이 높다는 결과가 나왔는데 이는 Woo와 Lim (2010)의 연구에서 중년여성의 교육정도가 높을수록 부부친밀감이 유의하게 높아지는 것과 비슷한 결과이다. 또한 교육정도가 부부친밀감에 미치는 요인으로 작용하는가에 대해 부부친밀감이 높은 친밀형 부부관계 유형이 교육수준이 높았다는 연구(Jang et al., 2011; Lee & Ok, 2002)와도 비슷한 결과이다. 이는 교육 수준이 높은 여성일 경우 자아정체감이 높고, 배우자와의 관계에서 부부 중심의 평등한 부부관계에 밑바탕이 되는 원활한 의사소통이 있을 것이기에 가능한 것으로 해석된다. 또한 본 연구에서 종교가 있을수록 부부친밀감이 유의하게 높아지는 결과를 나타냈는데 이는 Kim과 Choi (2007)의 연구에서 중년여성에게 있어 종교생활을 하는 배우자가 있는 경우 부부친밀감이 높게 나타난 것과 비슷한 결과로 이는 부부에게 있어 통제하기 어려운 부모·친지·자녀·재정적인 대화를 나누는 것보다는 종교적인 초점에 맞추어 의사소통하는 경우에 생활 만족도가 더 높은 것으로 판단된다고 하였다. Woo와 Lim(2010)의 논문에서는 직업군에 따라 부부친밀감 정도가 차이를 보인다고 하였는데, 그에 따르면 전문·관리직군이 생산·서비스직보다 친밀감이 높았고, 사무직 군이 생산·서비스직보다 높은 부부친밀감을 갖는 것으로 나타난다고 보고하였다. 이는 본 연구에서 본인직업(F=4.47, p =.012)이 전문직, 관리직, 사무직일 경우가 서비스직, 생산직, 자영업일 경우보다 부부친밀감이 유의하게 높다는 결과와 비슷하다. 본 연구에서 본인 월평균소득(F=3.01, p =.019)이 200~300만원 미만인 경우가 100만원 미만인 경우보다 부부친밀감이 유의하게 높았으며, 배우자 월평균소득이 200만원 이상인 집단이 100~200만원 미만인 경우보다 부부친밀감이 유의하게 높게 나타 났다(F=6.72, p<.001). 이는 대체로 가계소득이 높을 때 부부친밀감이 높다는 연구(Jang et al.,; Park, 2006; Pak & Kim, 2010, Woo & Lim)와 유사하였다. 특히 본 연구에서 배우자와 함께 여가활동을 하는 집단의 부부친밀감이 유의하게 높았는데(t=-5.05, p<.001), 이는 가족의 지지가 많을수록 부부친밀감이 높았다는 연구결과(Koo, 2008)와 비슷한 결과이다. 또한 현재 질병을 치료하고 있는 경우(t=2.22, p =.027)와, 현재 질병이 있는 경우(t=2.53, p =.012)에 부부친밀감의 유의하게 낮게 나타났는데 이는 중년부부의 건강상태가 부부 친밀감에 중요한 요인으로 작용함을 나타내는 결과이다. 본 연구의 부부친밀감은 우울(r=-.61, p<.01), 갱년기 증상(r=-.39, p<.01)과 부적 상관관계를 보이는 것으로 나타났다. 이는 부부친밀감이 높을수록 우울과 갱년기 증상이 낮다는 것을 의미하며 Lee와 Choi (2007)의 중년여성의 우울과 부부관계 만족도에서 부부사이의 관계가 만족스러웠던 그룹에서 우울감이 유의하게 낮게 나타난 것과 유사한 결과이다. 또한 Yeo (2004)의 연구에서 가족과 사회적 관계의 지지를 받는 중년여성일수록 폐경 증상을 적게 느끼며 가족 간의 문제가 없을수록 중년여성이 폐경 관리를 잘하게 된다는 연구결과는 배우자와의 친밀감이 강할수록 갱년기증상을 적게 호소 한다는 본 연구의 결과와도 유사하다고 볼 수 있겠다. 본 연구에서 중년여성의 우울에 대한 전반적인 수준을 살펴 본 결과, 대상자의 우울 전체 평균점수는 100점 만점에 44.11점을 나타내었다. 이는 동일한 우울 측정도구를 사용한 Park(2006)의 중년여성 우울 평균점수 47.38점에 비해 본 연구의 우울 점수가 약간 낮은 경향을 나타낸 것으로 나타났다. 이와 같이. 본 연구의 우울 수준이 비교적 낮게 나타난 것은 30대부터 50대까지 젊은 연령층을 대상으로 한 Park의 연구에 비해 본 연구의 대상자들의 연령이 중년으로 제한되어 있었으며, 종교생활 비율이 Park의 68.7%에 비해 본 연구의 대상자들은 77.5%로 비교적 높을 종교생활을 하고 있기 때문이라 하겠다. 본 연구에서 중년여성의 갱년기 증상 총점은 40점 만점에 15.16점, 문항평균값은 0.76점으로 나타났으며 세부적인 갱년기 증상 요인별 평균값은, 성적 증상 0.86, 신체적 증상 0.79, 정신적 증상 0.67점 순으로 나타났다. 이는 Han (2004)의 연구에서도 성적 증상이 1.24점으로 가장 높았으며 그 다음으로 신체적 증상 1.22점, 정신적 증상 1.19점으로 나타난 결과와 같아, 중년여성에게 있어 갱년기 증상이 표현될 때 성적증상이 가장 많이 호소되고 있음을 다시 한 번 확인 할 수 있었다. 본 연구에서 우울은 갱년기 증상 전체 평균과 유의한 정적 상관관계를 보였다. 이는 우울이 높을수록 갱년기 증상이 높다는 것을 의미하며 Sung (2001)의 연구에서 중년여성의 갱년기증상 호소가 높을수록 우울에 대한 점수가 높게 나타난 것과, 갱년기 증상과 우울이 정적 상관관계를 나타낸 것과 같은 결과이다. Kang과 Shin (2002)의 연구에서도 폐경증상과 우울간의 관계에서 폐경증상 항목 중 정서장애 증상이 우울과 유의한 차이를 보였는데, 정서장애 증상을 경험하는 대상자의 우울점수가 높게 나타났으며 이는 본 연구의 결과와 유사한 결과이다. 이처럼 중년여성에게 있어서 부부친밀감과 우울과 갱년기 증상은 서로 영향을 주고받으며 중년여성에게 중요한 영향을 미치는 요소임을 확인할 수 있었다. 종합적으로 볼 때, 지금까지 배우자와의 정서적 관계가 긍정적일수록 중년여성의 삶에 긍정적인 영향을 미친다고 보고한 문헌들(Koo, 2008; Lee & Ok, 2002; Son & You, 2008; Woo & Lim, 2010)이 있었으나 구체적으로 부부친밀감이 중년여성의 우울과 갱년기 증상에 어떠한 영향을 미치는지를 알아보고자 했던 연구는 많지 않았다. Deeks와 McCabe (2004)는 중년여성의 갱년기 증상은 심리적 측면을 포함한 통합적 시각으로 이해해야 하며, 중년여성의 건강문제를 다룰 때는 폐경 증상과 관련된 다양한 요인들을 건강증진 전략에 포함시켜야 한다고 했다. 따라서 부부친밀감이 우울과 갱년기 증상과 더불어 중년여성의 건강을 사정하고 중재하는 중요한 요소임을 고려하여 중년여성의 긍정적인 삶의 질과 건강을 위해 효과적인 간호중재방안을 모색하여야 하겠다. 또한 부부친밀감과 우울과 갱년기 증상에 있어 공통적으로 유의한 영향 요인으로 나타난 배우자와 함께 여가활동(t=-5.05, p<.001)을 적극적으로 중년여성을 위한 부부친밀감 향상과 우울과 갱년기 극복을 위한 간호중재로 활용하여 다양한 프로그램으로 활성화되기를 기대한다.",김수진 ( Su Jin Kim ),2013,https://www.riss.kr/link?id=A99794343
대학생의 성적 자기주장에 영향을 미치는 요인,"본 연구에서는 데이트 경험이 있는 대학생의 성역할 고정관념, 전통적 성태도, 자기주장, 성적 자기주장을 조사하고, 인구사회학적 특성에 따른 성적 자기주장에 차이가 있는지 분석 하였으며, 성역할 고정관념, 전통적 성태도, 자기주장이 성적 자기주장에 미치는 영향을 파악하였다. 연구결과 데이트 경험이 있는 대학생의 성적 자기주장은 성역할 고정관념, 전통적 성태도, 자기주장과 높은 상관성을 보였다. 특히, 대학생의 일반적 특성 변인을 통제하여 성별, 전공, 성역할 고정관념, 전통적 성태도, 자기주장이 성적 자기주장에 미치는 영향을 알아보기 위해 단계적 다중회귀분석을 실시한 결과, 대학생의 성별, 전공, 성역할 고정관념, 전통적 성태도, 자기주장이 성적 자기주장에 미치는 설명력은 37%로 나타났다. 본 연구에서 나타난 주요한 결과들을 중심으로 다음과 같이 논의하고자 한다. 인구사회학적 특성에 따른 성적 자기주장에 차이가 있는지를 분석한 결과, 성적 자기주장은 남학생보다 여학생이 더 높았으며, 보건 및 인문계열 학생, 종교가 있는 학생, 성교경험이 없는 학생이 더 높은 것으로 나타났다. 성별 차이에 있어서 남학생에 비해 여학생이 성적 자기주장성이 높은 것으로 나타났는데 남녀를 대상으로 그 차이를 비교한 연구는 거의 없어 연구결과를 비교하기 어렵다. 하지만 유사개념으로서 성적 자율성을 성별로 비교한 연구들을 보면, 여자대학생군이 남자대학생군보다 성적 자율성이 더 높은 것으로 나타나(Chang & Lee, 2003; Kim et al., 2012), 본 연구 결과와 일치하였다. 이는 남학생의 성 개념이 행위 중심적이며 성기 중심적인 점에 비해, 여학생들은 성행동의 결과가 원하지 않는 임신, 인공유산, 성병감염 등 여성의 몸에 직접적인 결과를 가져오기 때문에 남학생보다는 여학생 스스로가 자기몸을 돌보고 대처하고자 실천적인 의지가 반영되었기 때문이라고 해석된다. 일상생활에서 성에 대한 고정관념으로부터 탈피하지 못하고, 성행동에 있어서 자신의 의사를 정확하게 표현하지 못하는 사회문화적인 차이가 성폭력을 유발할 수 있으므로 데이트 성폭력을 예방하기 위해서는 성 지식의 강화만을 목표로 교육할 것이 아니라, 자기주장능력 및 의사소통 기술을 포함시킨 성적 자기주장 프로그램 개발이 더욱 효과적인 대안이 될 수 있겠다. 또한, 여학생들의 성의식 향상과 성경험에 있어서 성별 빈도 차이가 줄어드는 현 상황에서 여성용 성적 자기주장 척도를 남녀학생에게 적용하는 것이 큰 무리가 없을 것으로 판단되지만, 후속 연구로서 성적 자기주장 문항에 대한 성별 특성을 고려한 세부적인 요인분석이 포함된 남녀공용 성적 자기주장 도구 개발도 필요하리라 생각된다. 계열별에서는 보건계열 학생들이 전공 특성상 생물학적 성(sex)에 대한 지식이 높고, 임신·성병 등 다양한 문제들에 대한 정보에 노출되는 기회들이 많기 때문에 타 계열 학생들보다 성적자기주장이 높은 것으로 생각된다. 또한 종교가 있는 학생들이 성적자기주장이 높게 나타났다. 이는 Han (2010)이 18세 이상 성인 남녀를 대상으로 종교와 성태도 간 관계 연구에서 종교성이 높을수록 혼전 성관계에 대해 부정적인 태도를 가질 확률이 높고, 종교성은 성태도에 있어 억제효과를 가지고 있는 것으로 나타난 연구결과와 맥락을 같이한다. 이러한 결과는 성적인 순결성 등을 강조하는 종교적 가치규범에 의한 태도 차이로 사료된다. 성교경험 여부에 따라 성교경험이 없는 학생이 성교경험이 있는 학생보다 성적 자기주장이 높게 나타났는데, 이는 성적 접촉이 심화됨에 따라 성적 자기주장능력의 감소를 보였다는 연구(Lee, 2001)와 Choi (2005)의 연구에서 성교경험이 없는 경우보다, 성교경험이 있는 경우가 성적 자기주장능력이 낮았다는 결과를 지지하였다. 성역할 고정관념과 전통적 성태도는 성적 자기주장에 부적인 상관을 보임으로써, 이 두 요인은 성적 자기주장과 부정적으로 관련되어 있음을 나타냈다. 이는 남녀 대학생이 개방적 성태도를 가지고 있을수록 성적 자율성이 높다는 Kim 등(2011)의 연구결과와 일치하였다. 또한 자기주장은 성적 자기 주장에 정적 상관을 나타내 자기주장과 성적 자기주장은 긍정적인 관련이 있음을 확인함으로써, 여대생의 자기주장능력이 이성교제 간 성접촉 경험에 영향을 준다는 Song (2006)의 주장을 뒷받침해주고 있다. 이는 성적 자기주장 향상을 위한 교육이나 상담 프로그램 내용에 성역할 고정관념과 전통적인 성태도는 낮추고, 자기주장을 높이는 방안이 도움 될 것임을 시사한다. 성적 자기주장의 요인에 성역할 고정관념, 전통적 성태도, 자기주장에 의해 예측되는데, 그 중에서도 자기주장이 가장 큰 영향을 미치는 것으로 나타났다. 자기주장은 대인관계의 출발점이자 의사소통의 핵심 요소로, Choi (2005)의 연구에서도 성교경험이 있는 여대생의 일치형 의사소통이 성적 자기 주장과 유의한 정적 상관관계를 보이고 있어, 성적 자기주장을 증진시키는 프로그램에 자기주장은 필수적으로 포함되어야 할 중요한 부분이라 생각된다. 이는 평소 개인의 권리존중과 정신건강 측면에서 자기의 생각과 감정에 일치되는 의사를 표현하는 훈련, 그리고 대인 관계적 측면에서 자신의 욕구와 기대를 솔직하고 적절하게 표현하는 훈련을 통해 성적인 상황에서도 자신의 정당한 요구나 기대, 생각, 견해, 감정과 일치되는 성적 자기주장 능력이 함양될 수 있을 것이다. 성역할 고정관념은 전통적으로 성별화된 사회규범을 말하는 것으로, 전통적인 여성성과 남성성을 내면화한 정도를 의미하는데, 이것이 여대생이 원하지 않는 상황에서 거절하는 것을 어렵게 하고, 성적 상황에서 안전을 위한 자기주장을 어렵게 한다(Morokoff et al., 1997). 이는 사회 규범화된 성역 할이 많은 영역에서 인간의 행동을 안내하고 구속하는데, 특히 친밀한 관계에서의 남녀가 만나는 성적 상황에서는 더욱 성역할을 따라야 할 것 같은 사회적 압력을 느낀다(Kiefer & Sanchez, 2007)는 주장을 뒷받침하고 있다. 또한, 전통적인 성태도는 성적인 활동에서 남성에게는 성행위를 주도하기를 기대하지만, 여성에게는 남성의 성적 주도에 따르기를 기대하는 것으로(Muehlenhard & McCoy, 1991), 이는 전통적 성태도가 수동적 성행위에 영향을 미치고, 이것이 다시 성적 자율성을 저하시킨다는 연구결과(Kiefer & Sanchez, 2007)를 지지해주고 있다. 따라서 전통적인 성태도를 지양하고, 성적 상황에서도 남녀가 보다 성적으로 평등할 수 있도록 하는 구체적 성적 자기주장 훈련이 필요하리라 사료된다. 이상의 결과로 나타난 본 연구의 의의 및 제안점은 다음과 같다. 첫째, 그동안 대부분의 국내의 성적 자기주장에 관한 연구가 거절과 예방요인 위주로만 진행되었던 것을 성적 자기주장의 개념이 인간의 자율성에 근거한 것이기에, 자율성에는 원하지 않는 것을 거절하는 것 뿐 아니라, 원하는 것을 주도적으로 표현하는 것이 포함되어야 한다. 단지 거절이라는 상대방 파트너의 요구에 대한 반응적인 성적 자기주장 개념이 아니라, 주도적이고 주체적일 수 있을 때 예방도 잘할 수 있음을 고려하여, 원하는 성행동에 대해 자신의 의사를 표현할 수 있는 보다 주체적이고 능동적인 주도 개념을 포함한 성적 자기주장의 개념으로 확대 되어야 한다고 생각한다. Hong (2002)도 그동안 청소년 대상으로 한 성교육이 금욕적인 절제 위주의 전통적인 접근방법을 사용해왔으나, 청소년 성문제 예방이나 해결에 효율적이지 못했기 때문에 청소년들이 성과 관련해서 주체적으로 판단하고 결정할 수 있는 능력을 키워주는 것이 필요하다고 주장했다. 따라서 성적 자기주장을 향상시키는 교육이나 상담 프로그램에 주도성을 포함한 주체성을 강화하는 내용이 포함되어야 할 것이며, 성적 자기주장의 하위요인인 주도, 거절, 예방을 모두를 잘 할 수 있는 방안이 모색되어야 할 시점이라고 본다. 둘째, 원하지 않는 성행동의 거절 여부로 성적 자기주장을 판단하는 것이 자칫 편협한 이해를 가져올 여지가 있음을 조심스럽게 지적하고자 한다. Impett와 Peplau (2003)는 원하지 않는 성적 응낙을 하는 사람의 동기에 따라 성관계 이후의 심리적 안녕에 다른 결과를 나타냄을 밝혔다. 그러므로 원하지 않는 성적 응낙을 하였더라도 동기에 따라 다르다는 외국의 선행연구가 국내에서도 마찬가지의 결과를 나타내는지 반복 연구가 필요하다고 본다. 국내에서도 마찬가지의 결과를 갖는다면, 원하지 않는 성적 응낙에 관한 교육과 상담에서도 단지 원하지 않는 성적 응낙을 거절하여야 한다는 교육도 중요하지만 자신의 동기를 파악하여, 자신이 원하는 것을 얻기 위한 최선의 방안을 찾도록 돕는 것이 필요할 것이다. 마지막으로 본 연구는 이성교제를 하고 있는 대학생들의 성적 자기주장에 관련된 연구이므로, 성적 다양성을 갖는 관계로까지 확대시킬 수 없는 한계가 있다. 또한 표집에서 성적 정체성에 관한 질문 없이, 설문에 응한 모든 학생들이 이성애자임을 암묵적으로 설정한 부분은 본 연구의 표집의 순수성이 떨어진다는 한계가 있다. 그러므로 차후의 연구에서는 이성교제 중의 성적 자기주장 연구에서는 성적 정체성을 구별한 후 진행할 것을 제안한다.",김영희 ( Young Hee Kim ),2013,https://www.riss.kr/link?id=A100680679
