
"코로나19 범유행 상황에서 임상간호사의 소진 영향요인 : 신체증상, 우울, 감염스트레스와 직무스트레스 중심으로","Purpose : The purpose of this study was to investigate the effects of physical symptoms, depression, infection stress, and occupational stress in terms of the burnout experienced by nurses working in hospitals operating nationally designated isolation beds throughout the COVID-19 pandemic. Methods : This research design is a descriptive study as informed via the use of a questionnaire. The physical symptoms, depression, infection stress, occupational stress and burnout scale were used. The data from 186 nurses were collected between August 30 and September 30, 2020. The data were analyzed using SPSS Statistics 23.0. Results : The results of this study revealed that burnout has a significant positive correlation with physical symptoms(r＝.49, p＜.001), depression(r＝.51, p＜.001), infection stress(r＝.33, p＜.001), and occupational stress(r＝.53, p＜.001). Results further indicate that occupational stress is the most significant predictor(β＝.36, p＜.001) of burnout. Conclusion : To reduce burnout among nurses, it may be necessary to regularly measure burnout among high-risk and vulnerable groups and to provide an intervention program so as to reduce burnout. In addition, institutional-level efforts - such as providing sufficient rest - are required to reduce occupational stress. The application of group counseling programs or stress management programs can be considered.","박유진(Yu Jin, Park)",2021,https://www.riss.kr/link?id=A76516757
치매 선별을 위한 MMSE-K와 K-MMSE의 진단 타당도 비교,"Objectives：This study aimed to compare the diagnostic validities between the Korean version of Mini-Mental State Examination (MMSE-K) and the Korean MMSE (K-MMSE) for screening of dementia and to investigate the possible changes of optimal cutoff scores of each instrument according to age, gender, and educational level. Methods：746 community residents aged 65 or over in two areas of Kwangju, Republic of Korea were assessed with MMSE-K and K-MMSE and were also evaluated for the diagnoses of dementia (DSM-IV). Results：The performances, measured by area under receiver operating characteristics curve, of MMSE-K and K-MMSE against DSM-IV dementia were 0.93 and 0.94 respectively. The optimal cutoff scores for screening of dementia were 21|22 in MMSE-K and 17|18 in K-MMSE. Changes of the optimal cutoff scores according to age, gender, and educational level of the sample were 0-2 in the MMSE-K and 2-5 in the K-MMSE. Conclusions：MMSE-K and K-MMSE could be used for screening of dementia with excellent validities. For primary health care staff, however, it was suggested that MMSE-K would be more feasible than K-MMSE because the former had less changes in the optimal cutoff scores and was easier to interpret its results than the latter.",김재민,2003,https://www.riss.kr/link?id=A105434882
비턴넬형 중심정백관 개방성 유지를 위한 헤파린 희석액 관류와 생리식염수 관류의 비교,"Purpose: The purpose of this study was to compare the effectiveness of heparin and 0.9% normal saline solution flusing for maintaining patency of non-tunneled central venous catheters in patients with surgery. Methods: A randomized controlled clinical trial was performed. Fifty-eight patients were prospectively enrolled and fifty-foru patients were completed the study. The heparin group consisted of 30 patients given 100u/ml diluted heparin flusing and the normal saline group consisted of 24 patients with 0.9% sodium chloride flushing. Results: There was no significantly difference in occlusion between the heparin group and the normal saline group in non-tunneled central venous catheters' occlusion. Also there was no difference between these two groups in catheter-related infections. Conclusion: Flushing with 0.9% normal saline is as effective as flushing with heparin solution in maintaining the patency of non-tunneled central venous catheters. In this study, however, the duration of central line use was short and the infection occurrence was little. Further studies are warranted with a larger sample size at multipel centers.",김지혜,2014,https://www.riss.kr/link?id=A100054524
"간호조직문화, 셀프리더십, 임파워먼트가 종합병원 간호사의 직무만족과 이직의도에 미치는 영향","Purpose: In this study factors affecting job satisfaction and turnover intention of nurses were explored in the context of organizational culture, self- leadership, and empowerment. Method: Participants were 286 nurses drawn from 3 general hospitals. Data were analyzed using t-test, one-way ANOVA, Pearson correlation, and hierarchial multiple regression with the SPSS Win 18.0 program. Result: Significant differences in job satisfaction and turnover intention were found according to organizational culture types. Significant positive correlations were found between self-leadership, empowerment, task oriented organizational culture, relationship oriented organizational culture, innovation oriented organizational culture and job satisfaction. On the other hand, significant negative relationships were found between empowerment, relationship oriented organizational culture, innovation oriented organizational culture and turnover intention. The factors that enhance job satisfaction were found to be higher innovation-oriented organizational culture. Lower turnover intention was shown to be positively associated with relationship- or innovation oriented organization culture. Conclusion: Innovation oriented organizational culture is needed in order to raise job satisfaction and reduce turnover intention of nurses.",최승혜,2014,https://www.riss.kr/link?id=A76516617
지역사회 독거노인의 자가간호에 미치는 영향요인,"Purpose: This study aimed to identify the factors affecting the self-care of older adults living alone in a community during the COVID-19 pandemic. Methods: Data were collected through a questionnaire survey of 160 older adults living alone in Seoul, Gyeong-gi, and Chung-cheong province using self-care, health conservation, psychological well-being, and self-esteem scales. Data were analyzed using the Pearson correlation coefficients, t-test, analysis of variance ANOVA, and Hierarchial stepwise multiple regression with the SPSS/Windows version 25.0 program. Results: The greatest variables affecting the self-care for older adults living alone were compliance with COVID-19 quarantine rules (β=-.04, p=.054), interactions with the neighborhood (β=-.06, p=.029), economic status (β=.10, p=.008), health conservation (β=.29, p<.001), psychological well-being (β=.18, p=.008), and self-esteem (β=.35, p<.001). The explanatory power of these variables was 70.0% (F=18.45, p<.001). Conclusion: Regarding the COVID-19 pandemic, these factors were highly mutually related to older adults living alone, so it is necessary for older adults living alone to actively participate in self-care programs using direct and indirect community resources.",우희영(Heeyoung Woo),2023,https://www.riss.kr/link?id=A100054522
간호사의 DICS 행동유형과 투약오류,"Purpose: Human factor is one of the major causes of medication errors. The purpose of this study was to identify nurses' perception and experience of medication errors, examine the relationship of Dominance, Influence, Steadiness, Conscientiousness (DISC) behavior patterns and medication errors by nurses. Methods: A descriptive survey design with a convenience sampling was used. Data collection was done using self-report questionnaires answered by 308 nurses from one university hospital and two general hospitals. Results: The most frequent DISC behavioral style of nurses was influence style (41.9%), followed by steadiness style (23.7%), conscientiousness style (20.4%), and dominance style (14.0%). Differences in the perception and experience level of medication errors by nurses' behavioral pattern were not statistically significant. However, nurses with conscientiousness style had the lowest scores for in experience of medication errors and the highest scores for perception of medication errors. Conclusion: The results of this study show that identification of the behavior pattern of nurses and application of this education program can prevent medication errors by nurses in hospitals.",김은경,2013,https://www.riss.kr/link?id=A107307368
국내 노인 간호연구 분석,"This study was done to analyze the trends in research and to suggest future directions for nursing research on nursing care for elderly people in Korea. Eighty-eight studies in gerontological nursing between 1999 and 2003 were reviewed. The author examined research design, participants, major concepts, nursing interventions, and related variables associated with gerontological nursing.
The findings of the analysis are summarized as follows:
1. The most popular research design was quantitative design (83.0%) including surveys, experimental, correlation, and comparative studies. Qualitative studies accounted for only 7.9% of the total.
2. Most participants were elderly (79.5%). Major concepts studied were mental and physical health.
3. There were many factors influencing nursing of elderly people. In 14 experimental studies, the most frequent nursing interventions were exercise programs and music therapy. In 31 correlation studies, factors such as social support, health status, depression, and self-efficacy were found to correlate with nursing interventions.
The following issues are suggested for future studies.
1. Future research is needed for nursing interventions and program development.
Meta-analysis and triangular methods of study need to be conducted for evidence in gerontological research.
2. Study with more diverse participants and environmental research, as well as participation in, and collaborate with, other disciplines are needed in future studies involving elderly people.
3. Studies on policies and strategies to improve the status of elderly people along with theory based studies and cost effectiveness studies in nursing care of elderly people are also needed.",김춘길,2004,https://www.riss.kr/link?id=A108609158
의료 3D 프린팅 기술의 전망 및 소아치과분야에서의 활용,"One of the fields to which the 3D printing technology can be applied is the field of medicine. Recently, the application of 3D printing technology to the bio-medical field has been gradually increasing with the commercializing of the bio-compatible or bio-degradable materials. The technology is currently contributing to the biomedical field by reducing times required for operations or minimizing adverse effects through preoperative identification of post-surgical consequences or model surgery with artificial bones and organs. This technology also enables the production of customized biomedical auxiliary products like hearing aids or artificial legs etc. For the field of dentistry, the 3D printing technology is also expected to elevate the level of dental treatment by making the customized orthodontic models, crown, bridge, inlay, and surgical guides for implant and surgery. However, issues remaining unidentified or incomplete in printing materials, modeling technology, software technology associated with CAD, verification of bio-stability and bio-effectiveness of materials or in compatibility and standardization of the technology are yet to be solved or be clarified for the full-scale application of the 3D printing technology, thus, it seems such issues should be resolved through further studies.",이상호,2016,https://www.riss.kr/link?id=A107183460
종합병원 간호사의 노인간호 스트레스와 노인간호수행과의 관계에서 공감과 회복 탄력성의 조절된 조절효과,"Purpose: This study aimed to investigate whether empathy and resilience moderate the relationship between geriatric care-related stress and geriatric nursing practice among secondary hospital nurses. Methods: Data were collected from three secondary hospitals in J province from July 20, 2022, to August 10, 2022. Nurses with at least three months of employment were convenience sampled, and a structured questionnaire was used. A total of 218 questionnaires were included in the analysis. The collected data were analyzed using the IBM SPSS Statistics 24.0 software. Results: Geriatric nursing practice was significantly positively correlated with geriatric carerelated stress, empathy, and resilience. Empathy moderated the effects of geriatric care-related stress on geriatric nursing practice, and this moderating effect was re-moderated by resilience (moderated moderation effect). In other words, nurses with high resilience and empathy tended to show stronger geriatric nursing practice even with elevated geriatric care-related stress. Conversely, nurses with high resilience and low empathy tended to show weaker geriatric nursing practice with increasing geriatric care-related stress. Conclusion: These results highlight the need for multilateral efforts to reduce nurses’ stress related to geriatric care and enhance their empathy and resilience, ultimately promoting geriatric nursing practice. This study has important implications for nursing practice. Specifically, it is the first to confirm a moderated moderation effect of empathy and resilience on the relationship between geriatric care-related stress and geriatric nursing practice among nurses. Subsequent studies should identify whether other factors moderate the relationship between geriatric care-related stress and geriatric nursing practice.",최영숙(Young Suk Choe),2023,https://www.riss.kr/link?id=A3080326
한국인 직무 스트레스 측정도구의 개발 및 표준화,"Background and Purposes: Over the past three decades, numerous studies performed in Korea have reported that job stress is a determinant risk factor for chronic diseases and work disability. Every society has its own culture and occupational climate particular to their organizations, and hence experiences different occupational stress. An occupational stress measurement tool therefore needs to be developed to estimate it objectively. The purpose of this study is to develop and standardize the Korean Occupational Stress Scale (KOSS) which is considered to be unique and specific occupational stressors in Korean employees.
Subjects and Methods: Data were obtained from the National Study for Development and Standardization of Occupational Stress (NSDSOS Project: 2002-2004). A total of 12,631 employees from a nationwide sample proportional to the Korean Standard Industrial Classification and the Korean Standard Occupational Classification were administered. The KOSS was developed for 2 years (2002-2004). In the first year, we collected 255 items from the most popular job stress measurement tools such as JCQ, ERI, NIOSH and OSI, and 44 items derived from the a qualitative study (depth interview). Forty-three items of KOSS, in the second year, were retained for use in the final version of the KOSS by using Delphi and factor analysis. Items were scored using conventional 1-2-3-4 Likert scores for the response categories.
Results: We developed eight subscales by using factor analysis and validation process: physical environment (3 items), job demand (8 items), insufficient job control (5 items), interpersonal conflict (4 items), job insecurity (6 items), organizational system (7 items), lack of reward (6 items), and occupational climate (4 items). Together they explained 50.0% of total variance. Internal consistency alpha scores were ranged from 0.51 to 0.82. Twenty-four items of the short form of the KOSS (KOSS-SF) were also developed to estimate job stress in the work setting. Because the levels of the subscales of occupational stress were gender dependent, gender-specific standard norms for both the 43-item full version and the 24-item short form using a quartile for the subscales of KOSS were presented.
Conclusion: The results of this study suggest that KOSS might be an appropriate measurement scale to estimate occupational stress of Korean employees. Further and more detailed study needs to be conducted to improve the validity of this scale.",장세진,2005,https://www.riss.kr/link?id=A2075185
종합병원 노인환자의 낙상 위험 요인과 낙상 지식 및 태도와의 관계,"Purpose: The purpose of this study was to investigate the knowledge and attitude towards falls among elderly inpatients and to provide basic data for development of fall prevention programs. Method: From April to May 2007, 180 elders who were hospitalized in a general hospital in Seoul were interviewed with a structured questionnaire about risk factors, attitude and knowledge related to falls. Medical records were also reviewed. Data were analyzed with SPSS program. Results: While hospitalized, 25.6% of the participants received education on the prevention of falls. There were significant differences in attitude toward falls according to age, smoking, alcohol consumption, combined diagnosis, history of surgery, history of falls, activity status, sleep disturbance and depression. There was a significant correlation between attitude and the number of risk factors and the number of medications being taken. Attitude towards falls increased with self-perceived risk of fall and score on the Morse Fall Scale. Knowledge of falls was significantly related to education level, and anxiety. Conclusion: The study revealed that elderly inpatients had increased risk factors for falls. These factors may impact on attitude toward falls.",허정윤,2009,https://www.riss.kr/link?id=A108609055
"간호사의 의사소통 스타일, 수술환자의 불안, 불확실성이 환자만족도에 미치는 영향","Purpose : The study was conducted to examine effects of nurses’ communication styles perceived by surgical patients and their anxiety and uncertainty on patient satisfaction.
Methods : Data were collected by using a structuralized questionannaire which consists of nurses’ communication style tool, State trail Anxiety Inventory(STAI), Mishel Uncertainty in Illiness scale, and patient satisfaction tool targeting on 276 surgical patients who were hospitalized in general wards from July 24, 2020 to December 18, 2020. The data analysis was done with the correlation analysis and the multiple regression analysis.
Results : Nurses’ communication style perceived by surgical patients has found to have the most informative communication styles and the least authoritative communication style. And the variable which has the most effect on patient satisfaction was the affective communication style(β =.35, p<.001), followed by nurse communication importance perceived by surgical patients(β =.15, p=.001). And surgical patients' anxiety (β =-.15, p=.011) and uncertainty(β =-.13, p=.024) has found to have a negative effect on patient satisfaction. Conclusion : The patient satisfaction got higher when the surgical patients perceived the Affective & informative communication styles among nurses’ communication styles, and when they perceived the nurses’ communication as important.",서향란,2022,https://www.riss.kr/link?id=A76516824
의료진 대상 리마인더 프로그램이 중환자실 중심정맥관 관련 혈류감염에 미치는 효과,"Purpose: This study aimed to develop a reminder program and evaluate the impacts of the program on adherence to maximal sterile barrier precautions (MBP), duration of catheterization, and central line-associated blood stream infection rates (CLA-BSIs). Methods: A simulated control group pretest-posttest design was used. The participants were 35 physicians, 17 nurses and 165 patients (control group=75, intervention group=90) with central catheter insertions for more than 48 hours admitted to a tertiary hospital. Data were collected from an university-affiliated hospital in Gwangju, South Korea. The intervention group received the reminder program which consisted of MBP adherence education, short message service (adherence feedback to MBP, optimal recommendation, and hand washing), and self-report checklist on central venous catheter management. Results: The adherence level of MBP was significantly increased from 87.7% to 97.9% (p =.026) after implementation of the reminder program. The duration of catheterization significantly decreased in the intervention group compared to the control group (from 10.6 to 7.4 days, p =.024). The incidence of CLA-BSI rate decreased in the intervention group compared to the control group but it was not statistically significant. Conclusion: This study showed some effectiveness of the reminder program to improve adherence of MBP and duration of catheterization among patients with central line. Further studies are needed to evaluate effects of the program on CLA-BSI rate using a randomized clinical trial with larger samples and diverse settings.","최옥자(Choi, Ok-Ja)",2021,https://www.riss.kr/link?id=A107974301
간호과정 적용 평가도구 개발,"Purpose: This study was conducted to develop standards to ensure nursing process-based care of oxygen therapy and airway suctioning and to develop a performance measurement tool to evaluate the care applied according to the standards, and finally to determine validity of the standards and the tool.
Methods: The standards and the tool were reviewed by a panel of experts and refined based on the panel's suggestions. Validity of the standards and the tool were examined through surveying a total of 366 hospital nurses.
Results: The mean validity scores of the performance measurement standards and the tool were 3.58 and 3.55, respectively, out of 4.00. So the performance measurement standards and the tool in this study were found to be acceptable in evaluating quality of nursing care provided at patient admission and discharge.
Conclusion: This result indicates that the performance measurement standards and the tool developed in this study are valid instruments to monitor and improve quality of nursing care for oxygen therapy and airway suctioning.",김금순,2013,https://www.riss.kr/link?id=A107974014
"청지각 훈련과 병행한 감각통합치료가 발달지연 아동의 감각처리, 시 지각 발달, 주 의집중에 미치는 영향","Objective : The purpose of this study is investigate the effects of sensory integration combined with auditory treatment on the sensory processing, visual perception and attention ability of children with developmental delay. Methods : A combined treatment of auditory training and sensory integration therapy was implemented to 3 children aged 4 to 7 and diagnosed with developmental delay during 9 weeks period from December 2016 to January 2017. ABA' design which is one of single subject research designs was used in this study. Baseline A had 4 sessions, intervention B had 15 sessions, and baseline A’ had 4 sessions, so 23 sessions were applied in total. During the baseline A and A 'periods, visual perception ability was measured by K-DTVP-2 (Korea Developmental Test Visual Perception-2) and sensory processing ability was evaluated by sensory profile. The maintenance time of attention was measured with the absence of intervention for the baseline period, and for the intervention period, it was measured at 10 minutes break time which was provided after the intervention. The children’s attention time during a fine motor task provided were measured using video recorder with the interval recording method, and the interval for the evaluation was 30 seconds. Results : No statistically significant difference were found in the visual perception function and sensory processing scores before and after treatment. Attention of participant A enhanced significantly while that of participant B and C did not improve significantly. Conclusion : It is hard to conclude that sensory integration therapy combined with auditory perception training has positive effects on visual perception function and attention of children with developmental delays. However, there were significant increase in attention and improvements in behavior related to sensory processing for some cases in this study. In further study, longer intervention periods and valid measurement need to be applied in order to get better results. And it is proposed that more studies need to be done to enhance evidence of auditory perception training as a mean to facilitate attention and to prepare learning.",박미영,2017,https://www.riss.kr/link?id=A107890986
