
지각운동프로그램이 주의력결핍과잉행동장애아동의 시각운동통합기술과운동기술에 미치는 영향,"Objective : The purpose of this study is to explore the effectiveness of a perceptual motor program in promoting visual motor and motor control outcomes in a child with Attention-Deficit/Hyperactivity Disorder (ADHD) who is enrolled in an elementary school. Methods : The subject is 8-year-old boy who was diagnosed with ADHD but did not receive medication. Research design is a single-subject A-B-A(follow-up). Baseline and follow-up phase were 3 sessions and intervention phase were 8 sessions. After performing 40 minutes of free play on the baseline A and follow-up A, we used the copying subtest of the Korean Development Test of Visual Perception 2 (K-DTVP-2) for evaluating visual motor integration skill and the rope jumping subtest for motor skill. After providing the perceptual motor activity in intervention phase B, copying and ropejumping were performed. Results : The standard scores of the Copying for measuring visual motor integration skill were poor at an average of 4.7 points at baseline phase A, but maintained an average of 9.6 points at intervention phase B and an below average of 7.7 points at the follow-up phase A. In the Rope jumping for the motor skill, it was increased by 4.3 times in the baseline phase A and 5.9 times in the intervention phase B, but slightly decreased by 5 times in the follow-up phase A. Conclusion : This study suggests that perceptual motor program has a positive effect on visual motor and motor function of ADHD children.",김승주,2017,https://www.riss.kr/link?id=A100329092
감각통합치료에서 고유수용성 감각 활동에 관한 고찰,"The purpose of this study is to provide definition of proprioception, foundations and roles of neuroanatomy, and systemical review of proprioceptive activities in sensory integration intervention. Proprioception exists in muscle, ligaments, joints and skin and it plays important role in controling body movements and interacting with environment during child development. Proprioception interacting with tactile and vestibular systems contributes to the change of muscle tone, postural control, refinements of planning and praxis. Children who are deficit in proprioceptive processing would seek hypo-responsive proprioceptive input or avoid hyperactive one. Outcome of poor proprioceptive input would cause the problems of praxis and postural control. Because proprioception provides information about the position and movement of body and limb it is important for development of body scheme and motor planning. It also influences the arousal and emotional tone. Sensory integration intervention which provides rich proprioceptive activities will improve the level of arousal and enhance motor planning.",김진미,2007,https://www.riss.kr/link?id=A105434882
대학생의 수면과 감각처리 특성의 상관관계,"Objective : This study was to investigate the relationship between sensory processing patterns and sleep quality for poor sleepers enrolled in universities. Methods : The participants are 191 students, aged 18 to 25, at the 6 universities located in Busan, Daegu, and other Gyeongsang Provinces. These participants completed the Korean version of Adolescent/Adults Sensory Profile (AASP) and the Pittsburgh Sleep Quality Index (PSQI). Results : The group with lower sleep quality of this study participants suggested low but positive correlation with sleep disturbance which is one of sleep quality components of the PSQI. Low sensory registration suggested high positive correlation and Sensory sensitivity suggested low positive correlation with daytime dysfunction. Conclusion : We identified that sensory processing patterns and sleep quality may influence each other and sleep quality can be more significantly influenced by specific sensory processing pattern. More studies requires on sleep quality and sensory processing patterns in children, adults, and elders.",이예진,2017,https://www.riss.kr/link?id=A101679140
국내 뇌성마비 아동의 자세조절 향상을 위한 운동 중재 효과: 체계적 고찰,"Objective : The purpose of this study is to prove the effects of exercise intervention on postural control of children with cerebral palsy in Korea by systematic review. Methods : Total 18 studies were selected through Korean research database engine such as DBpia, KISS and RISS for the systematic review in this study. Key words used were ‘cerebral palsy’, ‘postural control’ and 'balance' and publication time period was limited only after October 2006 in the research selection. All the selected studies were reviewed in terms of quality level of evidence and methodological quality level, and then the results were analyzed with Patient, Intervention, Comparison, Outcome (PICO). Results : For the level of evidence, it is found that 8 studies show Grade Ⅰ, 5 studies show Grade Ⅲ, and 2 studies show Grade Ⅴ. In terms of Methodological quality, majority of the studies showed ‘Fare’ level. Majority of target population of the studies was children with spastic diplegia. Most research design of the studies were randomized controlled trials. The results in several suited showed that the postural control exercise used in Korea has positive impact on improvement of motor and balance ability. Conclusion : Impact of the exercise intervention used in Korea for postural control of children with cerebral palsy has been evidenced in this study. It is proposed that further research need to be done considering several types of cerebral palsy.",박영주,2016,https://www.riss.kr/link?id=A82712639
감각통합치료가 감각조절장애 아동의 놀이에 미치는 효과,"Objective : This study is to verify effect of a sensory integration (SI) intervention on sensory processing of children with sensory modulation disorder (SMD), and to explore how the SI intervention affect play, socialization, occupational performance and occupational satisfaction of those children.
Method : Five children with developmental disabilities living in metropolitan were diagnosed as SMD by the Sensory History Interview (SHI) and Short Sensory Profile (SSP). The SMD children undergone the 48 sessions of 50 min intervention twice in a week for six months and took the Revised Knox Preschool Play Scale(RKPPS), Social maturity test, Canadian Occupational Performance Measure(COPM), and Japanese Sensory Inventory Revised(JSI-2) before- and after the intervention. The result data analyzed by the Wilcoxon matched-pair signed rank test.
Results : All data of post-intervention differed significantly; RKPPS(Z=-2.023, p=.043), Social maturity test(Z=-2.023, p=.043); occupational performance(Z=-2.023, p=.043); satisfaction(Z=-2.032, p=.042); and tactile system of JSI-2(Z=-2.032, p=.042).
Conclusions : The results advocate that sensory integration intervention is effective in improving tactile processing, play, socialization, occupational performance, and occupational satisfaction of child with SMD. It is found that sensory integration intervention improves not only one’s occupational performance but also underlying components of the performance. In order to generalize this conclusion, further studies need to be done with more number of subjects and consideration of environmental factors. Striving for more reliable and valid methods of data collection is also suggested.",김진미,2009,https://www.riss.kr/link?id=A108184560
그룹감각통합치료가 감각통합장애아동의 또래 및 치료사와의 상호작용에 미치는 영향,"Objective : The purpose of this study was to investigate the effects of group sensory integrative intervention on the sensory integration dysfunction children's social interaction with peer and therapist
Methods : The subjects were three children aged between 3 and 5 with sensory integration disorder. Each Child participated in 15 sessions of group sensory integrative intervention. The based on the observation list of the children's social interaction behavior, the children's interactions with the peers and therapist are measured. One group pretest-posttest design was used to verify the effect of group sensory integrative intervention. The difference between before and after the sensory integration group program in the observation list of the children's social interaction behavior were tested by the Wilcoxon matched-pair signed rank test.
Results : The average scores of the observation list of the children's social interaction behavior was increased after the group sensory integrative intervention. However, there is no significant difference in the social interactions between data of pre-intervention and the one of post-intervention.
Conclusion : The results suggest a possibility of that the group sensory integrative intervention may affect social interactions. Future research should supplement limitations of this study regarding the short period of the experiment and there must be several evaluation standard to show norm data.",김은영,2012,https://www.riss.kr/link?id=A101671606
지적장애 아동의 균형과 호흡 기능 향상을 위한 감각통합치료: 개별 실험 연구,"Objective : Sensory integration is the organization for sensation for use. The purpose of this study is to carry out the sensory integrative intervention for the mental retardation with child and to examine change of child's balance and breath abilities.
Methods : The study performed from 25 May to 13 Autumn, 2009. The design is AB design(baseline 3sessions, intervention 21sessions) of single -subject research design. We carried out the sensory integrative intervention(3 sessions per week) for baseline period and the sensory integrative intervention(3 sessions per week) with sensory diet every day for intervention period.
Results : The results of the sensory integrative intervention with sensory diet had positive effects for child's breathe and balance.
Conclusion : The occupational therapists recognize the effects of the sensory integrative intervention with sensory diet and need to recommend for the family of child with disability.",김경미,2011,https://www.riss.kr/link?id=A82712640
아동 그룹 작업치료의 효과 : 체계적 고찰,"Objective : The purpose of this article is to study the effectiveness of a group occupational therapy for children via systematic review, and to provide clinical evidences. Methods : The systematic review initially included articles in Pubmed, Ovid, RISS, KISS, and DBpia, published until 2014. Total 14 articles have been chosen, using different keyword of each domestic/foreign studies. Selected articles were divided depending on the level of evidence, and eventually been organized into group PICO (Patient, Intervention, Comparison, Outcome). Results : The results indicated that there are more diagnosed children than normal in participants and especially children with sensory integration disorder (28.6%) appeared to be the most common. In intervention, group sensory integrative intervention had the largest frequency, and instruments measuring social skills were used most for analyzing the intervention results. The effectiveness of interventions showing statistically significant results were 40.7% of Total. Conclusion : Group occupational therapy for children should be provided to various diagnosis with widely better quality of interventions providing the enough support for the evidence level.",이가영,2016,https://www.riss.kr/link?id=A103429233
어깨관절과 상박부 통증에 대한 견해,N/A,강영선(Yeong Seon Kang),1996,https://www.riss.kr/link?id=A101671615
뇌졸중 후 중추성 통증에 대한 통증관리가 재활에 미치는 효과,N/A,이두익(Doo Ik Lee),2002,https://www.riss.kr/link?id=A76527250
국내 장애아동·청소년의 일상생활활동 향상을 위한 작업치료 : 체계적 고찰,"Objective : The purpose of this study is to provide evidence for a systematic analysis of occupational therapy evaluations and interventions for the activities of daily living of children and adolescents.
Methods : The research period was from 2010 to September 2019. The articles were collected from the Research Information Sharing Service (RISS) and Koreanstudies Information Service System (KISS) databases. The key words were ‘pediatric occupational therapy & activities of daily living’, ‘pediatric occupational therapy & self care’, ‘pediatric occupational therapy & self management', ‘pediatric occupational therapy & occupation’, ‘occupational therapy & eating’, ‘occupational therapy & AMPS (Assessment of Motor and Process skills)', 'occupational therapy & WeeFIM (Functional Independence measure for children'.
Results : A total of 14 studies were analyzed, the qualitative level Ⅳ, Ⅴ of the study was 72% of the total research. The diagnosis of participants included 50% intellectual disorder and 20% brain lesion, including cerebral palsy. The most frequently used method to assess the activities of daily living was Canadian Occupational Performance Measure (COPM). The most frequently used method to therapy was sensory integration therapy. The intervention effect of all studies was positive, however, the use of group programs on the occupational therapy on children with intellectually disorder didn't work.
Conclusion : In Korea, there are no articles that systematically analyze whether occupational therapy improves the activities of daily living in children and adolescents.",홍은경,2019,https://www.riss.kr/link?id=A101671593
목덜미와 어깨의 통증에 관한 연구,N/A,최중립(Joong Rieb Choi),1992,https://www.riss.kr/link?id=A101679142
그룹감각통합치료가 아동의 놀이와 또래 상호작용에 미치는 영향,"Objective : The purpose of the study is to find out how group sensory integrative (SI) intervention enhances play skill and social interaction of the children with sensory integration disorders.
Method : Three children who were showing problems related in sensory integration received 12 SI intervention sessions. The Sensory Profile (SP) and The Social Maturity Scale (SMS) were accomplished by the subject’s primary caregiver. Test of Playfulness (ToP) and Peer Social Interactions Rating Scale (PSIRS) were utilized to investigate the children’s play skills and social interactions with their friends. Goal Attainment Scale (GAS) is applied to assess the children’s play skill, social interactions with peer, and sensory processing at each session. Data was collected before- and after the intervention and analyzed by the Wilcoxon matched-pair signed rank test with SPSS/WIN version 10.0 and Microsoft Excel.
Results : The average scores of ToP, PSIRS, and SMS were increased after the sensory integrative intervention. However, there is no significant difference in the play skills and social interactions between data of pre-intervention and the one of post-intervention. The score of the GAS was frequently increased in terms of the play skills and sensory processing throughout the whole sessions.
Conclusions : This study reveals a possibility of that the group sensory integrative intervention may affect not only sensory processing ability, but also play skills and social interactions of children experiencing difficulties of sensory processing. Future research should supplement limitations of this study regarding insufficient number of the subject and the short period of the experiment.",홍은경,2009,https://www.riss.kr/link?id=A103429234
고유-전정감각 중심의 감각통합 중재가 초등학교 저학년 아동의글씨쓰기와 소운동에 미치는 영향,"Objective : The purpose of this study was to investigate the effect of proprioceptive-vestibular based sensory integrative intervention on handwriting and fine motor function in elementary school students in grades 1 to 3. Methods : In this study, eight students in an elementary school in Busan were enrolled. The intervention was conducted twice a week from May to October, 2016, and a total of 14 intervention sessions were conducted. In order to evaluate the writing ability and the fine-motor exercise ability before and after the intervention, the fine-motor movement items of the Korean alphabet writing test and the Bruininks-Oseretsky Test of Motor Proficiency (BOTMP) evaluation were used. Results : There was a statistically significant difference between the total scores of consonant writing and the Korean alphabet writing assessment after the intervention. In BOTMP-Fine motor, the response speed items showed statistically significant difference. Visual-motor control scores increased during intervention, but the statistical significance was not found. Conclusion : Sensory integration interventions might have positive effects on elementary school students' writing skills and fine motor functions.",황지혜,2017,https://www.riss.kr/link?id=A99943265
무릎관절의 통증에 관한 연구,N/A,최중립(Joong Rieb Choi),1992,https://www.riss.kr/link?id=A107183941
국내 감각통합치료 실태조사,"Objective : To provide a foundation to develop clinical training program based on a status of sensory integration therapy in Korea identified through the study. Methods : A questionnaire has been developed that is investigating such as environment of therapy, level of knowledge of therapist, and etc. The questionnaire was distributed from June 1st,2014 June 1 to August 31st,2014. The total questionnaire result collected and analyzed are 232 responses. Results : In terms of ratio of therapist who are administrating sensory integration, occupational therapist takes biggest percentage. In most case, it is equipped enough to do treatment in terms of space and tools. Generally, therapists are performing evaluation and documentation earnestly, and willingly participating to continued education and clinical training coursework. However, it is found that some cases are implementing treatment without through evaluation and/or without professional training. Conclusion : This study propose that sensory integration therapists need to train their clinical knowledge and skills through professional training education based on the Ayres Sensory Integration (ASI) theory. Most of professional trainings are administered in capital area currently. The educational opportunities need to be extend to outside of capital region so the level of clinical competence and the quality of the therapy service can be improved.",김인선,2015,https://www.riss.kr/link?id=A107183942
슬골관절염 환자에서 관절내 리도카인과 아스피린이 혼합주사에 의한 진통 효과,N/A,양내윤(Nae Yun Yang),1995,https://www.riss.kr/link?id=A102475587
감각조절장애 아동에 대한 가정 프로그램의 적용 - 사례연구,"Objective: To evaluate the effectiveness of the home-based program composed of sensory diet for child with sensory modulation disorder. Method: The subject underwent the home-based program composed of sensory diet for 8 months. Evaluation tools we used are the Developmental Screening Test II(DDSTII) for developmental screening; the Short Sensory Profile(SSP), clinical observation and the clinical history record form for sensory integrative function; the Motor-Free Visual Perception Test(MVPT) and draw a person test for visual perception. Evaluation was executed before and after the program is provided. Results: The subject has showed remarkable improvement in developmental level, sensory integrative function and visual perceptual ability after went through the home-based program. Conclusion: The home-based program composed of sensory diet is effective for children with sensory modulation disorder when it is difficult to apply classical sensory integrative approach.",이지영,2007,https://www.riss.kr/link?id=A82712775
정맥내 통증 자가조절법을 이용한 말기 암환자의 통증조절,N/A,송선옥(Sun Ok Song),1996,https://www.riss.kr/link?id=A82712642
집중체중 이동훈련이 뇌성마비 아동의 체간조절 능력에 미치는 영향: 사례연구,"Objective : This study investigated the effect of intensive weight shift training (IWST) on the ability to balance in a sitting posture of children with spastic cerebral palsy (SCP).
Methods : One child with spastic diplegia participated in this study for a total of 8 weeks using the ABA experimental design. For the pre-intervention period (A1), general physical therapy (GPT) for children with SCP was performed. The intervention period (B1 and B2), GPT and IWST were conducted for children with SCP, and GPT was conducted again for the post-intervention period (A’1 and A’2). Trunk control capacity was measured using the Korean Trunk Control Measurement Scale (TCMS-K) and Biorescue (RM Ingenierie, France).
Results : All TCMS-K variables increased from A1 to B2, and decreased from B2 to A’2. The total area with limit of stability (LOS) increased from A1 to B2, and decreased from B2 to A’2. The ratio of the left/right (Lt/Rt) and anterior/posterior (Ant/Post) LOS area was closer to 1, meaning symmetry, in B2 than in A1. The ratio of the Lt/Rt LOS area decreased further from 1 in A’2 than in B2. The ratio of the Ant/Post LOS area was closer to 1 in A’2 than in B2.
Conclusion : IWST had a positive effect on the improvement of balance in the sitting posture of a child with SCP. The results suggest that IWST might help to improve the balance abilities of children with SCP for independent sitting, postural control, and activities of daily living.",유현남,2019,https://www.riss.kr/link?id=A76527246
실행능력 평가도구에 대한 체계적 고찰,"Objective : The purpose of this study tried to present the performed average and range through systematic review about assessment tools that measures the praxis ability of sensory integrative function for foreign and domestic normal children.
Methods: With making use of Medline, PubMed, Ovid, Eric, the Library of Congress, National Science and Technology Information Center, Kiss, RISS, and the Google search engine, we searched the name of assessment tool on the basis of the framework of the theory of sensory integration. Target paper was thesis and Journal published from January 2000 to April 2011.
Results: Total of 24 papers were retrieved, used assessment tools were Bruininks-Oseretsky Test of Motor Proficiency (BOTMP), Bruininks-Oseretsky Test of Motor Proficiency, Short Form (BOTMP-SF), Bruininks-Oseretsky Test of Motor Proficiency, Second Edition (BOT-2), Bruininks-Oseretsky Test of Motor Proficiency, Second Edition, Short Form (BOT-2-SF), Clinical Observations of Motor and Postural Skills (COMPS), Motor Assessment Battery for Children (MABC), Clinical Test of Sensory Interaction with Balance (CTSIB), and subtest of Sensory Integration and Praxis Test (SIPT). We presented the average and range of assessment tools applied to normal children in each country.
Conclusion: A performed result in other cultural and domestic normal children which this study presented will provide a standard in comparison with performance of children with disabilities who are the actual clinical evaluation.",홍은경,2013,https://www.riss.kr/link?id=A99943259
방과 후 감각통합프로그램(감각통합치료)이 학교에서의 기능적 과제 수행에 미치는 효과,"Objective : This study is designed to identify effect of a sensory integration(SI) program provided to
elementary school students as an after-school activity. The study is looking at both occupational
performance components and school-task performance which is an area of occupational performance.
Methods : SI program specially designed as an after-school activity was provided to three boys who are first- or second grade students of Y elementary school in Dae-Jeon city. The SI intervention was organized with 25 sessions and carried out for two months. One group pretest-posttest design was used to evaluate the effectiveness of the SI program. Measurements used are Short Sensory Profile(SSP), K-DTVP-2, and BOTMP for occupational performance components, and School Function Assessment for functional schooltask performance.
Results : It is found that posttest scores were enhanced in all assessments SSP; BOTMP; K-DTVP-2; and SFA.
Conclusion : Results of this study simply propose that sensory integration program designed as after-school activity may have positive effects on not only occupational performance components but also on school-task performance of elementary school student. Since sample size is too small, however, there is limitation to find statistical significance. Further researches testing large number of subjects are required to boost the finding of this study.",박지훈,2010,https://www.riss.kr/link?id=A100329091
